Title,Publication Date,Author(s),Abstract,Link,DOI,Relevant
Natural Humanoid Robot Locomotion with Generative Motion Prior,12/03/2025,"Haodong Zhang, Liang Zhang, Zhenghan Chen, Lu Chen, Yue Wang, Rong Xiong","Natural and lifelike locomotion remains a fundamental challenge for humanoid
robots to interact with human society. However, previous methods either neglect
motion naturalness or rely on unstable and ambiguous style rewards. In this
paper, we propose a novel Generative Motion Prior (GMP) that provides
fine-grained motion-level supervision for the task of natural humanoid robot
locomotion. To leverage natural human motions, we first employ whole-body
motion retargeting to effectively transfer them to the robot. Subsequently, we
train a generative model offline to predict future natural reference motions
for the robot based on a conditional variational auto-encoder. During policy
training, the generative motion prior serves as a frozen online motion
generator, delivering precise and comprehensive supervision at the trajectory
level, including joint angles and keypoint positions. The generative motion
prior significantly enhances training stability and improves interpretability
by offering detailed and dense guidance throughout the learning process.
Experimental results in both simulation and real-world environments demonstrate
that our method achieves superior motion naturalness compared to existing
approaches. Project page can be found at
https://sites.google.com/view/humanoid-gmp",http://arxiv.org/pdf/2503.09015v1,,False
I Predict Therefore I Am: Is Next Token Prediction Enough to Learn Human-Interpretable Concepts from Data?,12/03/2025,"Yuhang Liu, Dong Gong, Erdun Gao, Zhen Zhang, Biwei Huang, Mingming Gong, Anton van den Hengel, Javen Qinfeng Shi","The remarkable achievements of large language models (LLMs) have led many to
conclude that they exhibit a form of intelligence. This is as opposed to
explanations of their capabilities based on their ability to perform relatively
simple manipulations of vast volumes of data. To illuminate the distinction
between these explanations, we introduce a novel generative model that
generates tokens on the basis of human interpretable concepts represented as
latent discrete variables. Under mild conditions, even when the mapping from
the latent space to the observed space is non-invertible, we establish an
identifiability result: the representations learned by LLMs through next-token
prediction can be approximately modeled as the logarithm of the posterior
probabilities of these latent discrete concepts, up to an invertible linear
transformation. This theoretical finding not only provides evidence that LLMs
capture underlying generative factors, but also strongly reinforces the linear
representation hypothesis, which posits that LLMs learn linear representations
of human-interpretable concepts. Empirically, we validate our theoretical
results through evaluations on both simulation data and the Pythia, Llama, and
DeepSeek model families.",http://arxiv.org/pdf/2503.08980v1,,False
