Title,Publication Date,Author(s),Abstract,Link,DOI,Relevant
"Synthetic Voices, Real Threats: Evaluating Large Text-to-Speech Models in Generating Harmful Audio",14/11/2025,"Guangke Chen, Yuhui Wang, Shouling Ji, Xiapu Luo, Ting Wang","Modern text-to-speech (TTS) systems, particularly those built on Large Audio-Language Models (LALMs), generate high-fidelity speech that faithfully reproduces input text and mimics specified speaker identities. While prior misuse studies have focused on speaker impersonation, this work explores a distinct content-centric threat: exploiting TTS systems to produce speech containing harmful content. Realizing such threats poses two core challenges: (1) LALM safety alignment frequently rejects harmful prompts, yet existing jailbreak attacks are ill-suited for TTS because these systems are designed to faithfully vocalize any input text, and (2) real-world deployment pipelines often employ input/output filters that block harmful text and audio.
  We present HARMGEN, a suite of five attacks organized into two families that address these challenges. The first family employs semantic obfuscation techniques (Concat, Shuffle) that conceal harmful content within text. The second leverages audio-modality exploits (Read, Spell, Phoneme) that inject harmful content through auxiliary audio channels while maintaining benign textual prompts. Through evaluation across five commercial LALMs-based TTS systems and three datasets spanning two languages, we demonstrate that our attacks substantially reduce refusal rates and increase the toxicity of generated speech.
  We further assess both reactive countermeasures deployed by audio-streaming platforms and proactive defenses implemented by TTS providers. Our analysis reveals critical vulnerabilities: deepfake detectors underperform on high-fidelity audio; reactive moderation can be circumvented by adversarial perturbations; while proactive moderation detects 57-93% of attacks. Our work highlights a previously underexplored content-centric misuse vector for TTS and underscore the need for robust cross-modal safeguards throughout training and deployment.",https://arxiv.org/pdf/2511.10913v1,,False
Evaluating Large Language Models on Rare Disease Diagnosis: A Case Study using House M.D,14/11/2025,"Arsh Gupta, Ajay Narayanan Sridhar, Bonam Mingole, Amulya Yadav","Large language models (LLMs) have demonstrated capabilities across diverse domains, yet their performance on rare disease diagnosis from narrative medical cases remains underexplored. We introduce a novel dataset of 176 symptom-diagnosis pairs extracted from House M.D., a medical television series validated for teaching rare disease recognition in medical education. We evaluate four state-of-the-art LLMs such as GPT 4o mini, GPT 5 mini, Gemini 2.5 Flash, and Gemini 2.5 Pro on narrative-based diagnostic reasoning tasks. Results show significant variation in performance, ranging from 16.48% to 38.64% accuracy, with newer model generations demonstrating a 2.3 times improvement. While all models face substantial challenges with rare disease diagnosis, the observed improvement across architectures suggests promising directions for future development. Our educationally validated benchmark establishes baseline performance metrics for narrative medical reasoning and provides a publicly accessible evaluation framework for advancing AI-assisted diagnosis research.",https://arxiv.org/pdf/2511.10912v1,,False
Expert-Guided Prompting and Retrieval-Augmented Generation for Emergency Medical Service Question Answering,14/11/2025,"Xueren Ge, Sahil Murtaza, Anthony Cortez, Homa Alemzadeh","Large language models (LLMs) have shown promise in medical question answering, yet they often overlook the domain-specific expertise that professionals depend on, such as the clinical subject areas (e.g., trauma, airway) and the certification level (e.g., EMT, Paramedic). Existing approaches typically apply general-purpose prompting or retrieval strategies without leveraging this structured context, limiting performance in high-stakes settings. We address this gap with EMSQA, an 24.3K-question multiple-choice dataset spanning 10 clinical subject areas and 4 certification levels, accompanied by curated, subject area-aligned knowledge bases (40K documents and 2M tokens). Building on EMSQA, we introduce (i) Expert-CoT, a prompting strategy that conditions chain-of-thought (CoT) reasoning on specific clinical subject area and certification level, and (ii) ExpertRAG, a retrieval-augmented generation pipeline that grounds responses in subject area-aligned documents and real-world patient data. Experiments on 4 LLMs show that Expert-CoT improves up to 2.05% over vanilla CoT prompting. Additionally, combining Expert-CoT with ExpertRAG yields up to a 4.59% accuracy gain over standard RAG baselines. Notably, the 32B expertise-augmented LLMs pass all the computer-adaptive EMS certification simulation exams.",https://arxiv.org/pdf/2511.10900v1,,False
