Title,Publication Date,Author(s),Abstract,Link,DOI,Relevant
BioFormer: Rethinking Cross-Subject Generalization via Spectral Structural Alignment in Biomedical Time-Series,21/05/2026,"Guikang Du, Haoran Li, Xinyu Liu, Zhibo Zhang, Xiaoli Gong, Jin Zhang","Cross-subject generalization in biomedical time-series refers to training on data from some subjects and testing on unseen subjects.The key challenge is to suppress subject specific variability in BTS representations.Most existing methods implicitly suppress the variability through model building or subject adversarial learning, but rarely model it explicitly.We introduce spectral drift as a new perspective to characterize subject specific variability.Specifically, BTS signals under the same label often share consistent oscillatory structure, yet exhibit subject-dependent magnitude or phase shifts in specific frequency components, which we interpret as subject-specific variability. Building on this insight, we propose BioFormer.At its core is a Frequency-Band Alignment Module(FBAM) that generates band-wise modulation factors from the spectral distribution and adaptively adjusts amplitude and phase to align spectral structure, thereby mitigating variability.We further pair FBAM with Sample Conditional Layer Normalization, which infers normalization parameters from intrinsic signal statistics rather than subject identity, stabilizing cross-subject representations.Extensive experiments on six datasets demonstrate that BioFormer outperforms 12 baselines, yielding absolute F1-score improvements of 6%.",https://arxiv.org/pdf/2605.22468v1,,False
S2ED: From Story to Executable Descriptions for Consistency-Aware Story Illustration,21/05/2026,"Sijing Yin, Jiamou Liu, Xiao Tang, Yaser Shakib, Qian Liu","Multi-frame story illustration requires long-horizon coherence beyond single-image text-to-image generation, including narrative decomposition and persistent character identity, layout, and affect across frames. We propose Story-to-Executable Descriptions (S2ED), a training-free, model-agnostic, prompt-layer framework that converts a full story into a sequence of explicit, editable executable descriptions for more consistent rendering. S2ED coordinates three agents to segment the narrative, ground canonical character attributes, and enrich spatial and affective cues, enabling interpretable prompt-carried state propagation and local edits to repair drift without retraining the generator. Experiments on Flintstones and Shakoo Maku show that S2ED improves sequence-level consistency and character fidelity over strong prompting, large-model planning, and a reference training-based method, under both automatic metrics and human judgments. We also deploy S2ED in an end-to-end story-to-storybook system for children's illustrated stories, with a supplementary video.",https://arxiv.org/pdf/2605.22448v1,,False
Diffusion-guided Generalizable Enhancer for Urban Scene Reconstruction,21/05/2026,"Henry Che, Jingkang Wang, Yun Chen, Ze Yang, Sivabalan Manivasagam, Raquel Urtasun","Urban scene reconstruction from real-world observations has emerged as a powerful tool for self-driving development and testing. While current neural rendering approaches achieve high-fidelity rendering along the recorded trajectories, their quality degrades significantly under large viewpoint shifts, limiting the applicability for closed-loop simulation. Recent works have shown promising results in using diffusion models to enhance quality at these challenging viewpoints and distill improvements back into 3D representations. However, they often require costly per-scene optimization, and the distilled representations remain fragile and fail to generalize beyond limited synthesized views. To address these limitations, we propose GenRe, a novel diffusion-guided generalizable enhancer for urban scene reconstruction. GenRe takes as input any pretrained 3D Gaussian representation and fixes the deficiencies within a few minutes. By learning to distill generative priors across diverse scenes, GenRe produces robust and high-fidelity representation efficiently that generalizes reliably to challenging unseen viewpoints (e.g., lane change). Experiments show that GenRe outperforms existing methods in both quality and efficiency and benefits various downstream tasks, enabling robust and scalable sensor simulation for autonomous driving.",https://arxiv.org/pdf/2605.22420v1,,False
A Boundary-Layer Mechanism for One-Third Scaling in Online Softmax Classification,21/05/2026,"Marcel Kühn, Yoon Thelge, Bernd Rosenow","Hard-label classification is usually trained with smooth surrogate losses, most prominently softmax cross-entropy. We isolate an asymptotic mechanism by which this mismatch between smooth surrogate and discrete labels produces power-law learning curves in an online teacher-student model. After subtracting the mean logit, the thermodynamic-limit dynamics close in centered variables: a growing centered student-teacher alignment $D$ and the residual student variance $Δ$. At late times, examples away from teacher decision boundaries are already classified confidently and contribute exponentially little. Only boundary layers of width $O(D^{-1})$ remain active, while the noise of fixed-learning-rate online gradient descent maintains a nonzero $Δ$. As a function of the training time $α$ the late-time solution yields a $α^{-1/3}$ power law not only for the test loss but also for the generalization error $ε_g$, i.e., one minus test accuracy. This is much slower than the $α^{-1}$ Bayes-optimal reference for the same model. We further show that learning-rate schedules can improve the generalization error towards a $ε_g \sim α^{-1/2}$ power law. Simulations support the predicted order parameter dynamics and learning curves. Controlled experiments with correlated Gaussian inputs and whitened pretrained features show that data structure can dominate transients. Therefore, our result is an asymptotic, complementary mechanism rather than an alternative to spectral explanations of neural scaling laws.",https://arxiv.org/pdf/2605.22341v1,,False
From Snapshots to Trajectories: Learning Single-Cell Gene Expression Dynamics via Conditional Flow Matching,21/05/2026,"Siyu Pu, Qingqing Long, Xiaohan Huang, Haotian Chen, Jiajia Wang, Meng Xiao, Xiao Luo, Hengshu Zhu, Yuanchun Zhou, Xuezhi Wang","Single-cell RNA sequencing (scRNA-seq) provides high-dimensional profiles of cellular states, enabling data-driven modeling of cellular dynamics over time. In practice, time-resolved scRNA-seq is collected at only a few discrete time points as unpaired snapshot populations, leaving substantial temporal gaps. This motivates trajectory inference at unmeasured time points. Existing methods mainly follow two directions, optimal-transport (OT) alignment provides distribution-level matching between observed snapshots, while continuous-time generative models support forecasting via learned dynamics. However, two challenges remain: (i) unpaired snapshots render local transitions between adjacent time points ambiguous, leading to unstable supervision; and (ii) long-horizon prediction relies on repeated integration, where small modeling errors compound and cause distribution drift. To address these challenges, we propose single-cell Flow Matching (scFM), a latent generative framework based on coupling-conditioned flow matching. First, we compute entropically regularized OT couplings between adjacent snapshots and use them to construct soft, weighted flow-matching targets for learning time-dependent velocity fields. Second, we learn bidirectional velocity fields and leverage their consistency to refine couplings and improve temporal coherence under sparse supervision. Third, we introduce distribution-level alignment and latent dynamic regularization to anchor long rollouts and mitigate drift. Experiments on real-world time-series scRNA-seq datasets show that scFM consistently improves distributional prediction performance for both temporal interpolation and extrapolation. Moreover, scFM yields more accurate trajectory reconstruction and temporally coherent visualizations where intermediate time points are absent, indicating a more faithful recovery of underlying temporal gene expression dynamics.",https://arxiv.org/pdf/2605.22340v1,,False
MuKV: Multi-Grained KV Cache Compression for Long Streaming Video Question-Answering,21/05/2026,"Junbin Xiao, Jiajun Chen, Tianxiang Sun, Xun Yang, Angela Yao","Long streaming video QA remains challenging due to growing visual tokens and limited reasoning length of large language models (LLMs). KV-caching stores the Key-Value (KV) of the historical tokens via LLM prefill and enables more efficient streaming QA. However, existing methods cache every one or two frames, causing redundant memory usage and losing fine-grained spatial details within frame or temporal contexts across frames. This paper proposes MuKV, a method that features a multi-grained KV cache compression module and a semi-hierarchical retrieval approach to improve both efficiency and accuracy for long streaming VideoQA. For the offline KV cache, MuKV extracts visual representations at patch-, frame-, and segment-levels. The multiple levels of granularity preserve both local cues and global temporal context, while maintaining efficiency with a dual signal token compression mechanism guided by self-attention and frequency. For online QA, MuKV designs a semi-hierarchical retrieval method to retrieve relevant KV caches for answer generation. Experiments on long-streaming VideoQA benchmarks show that MuKV significantly improves answer accuracy, without sacrificing memory and online QA efficiency. Moreover, our compression mechanism alone brings consistent benefits across answer accuracy, memory, and QA efficiency over baselines, showcasing highly effective contribution.",https://arxiv.org/pdf/2605.22269v1,,False
Impact of Atmospheric Turbulence and Pointing Error on Earth Observation,21/05/2026,"Celia Sánchez-de-Miguel, Antonio M. Mercado-Martínez, Beatriz Soret, Antonio Jurado-Navas, Miguel Castillo-Vázquez","Earth Observation (EO) imagery is often degraded by atmospheric turbulence and pointing jitter; yet, these effects are rarely considered in datasets used to train AI-based detection models. Based on prior work, this paper presents an enhanced image simulator that enables the incorporation of vertical-path atmospheric turbulence and satellite pointing jitter, arising from platform and sensor vibrations, to generate physically realistic distorted images. As a case study, vessel detection is evaluated using YOLOv8 and RetinaNet on images generated by the proposed simulator under different levels of turbulence and pointing errors. Results show that YOLOv8 recall decreases from 91% under ideal conditions to 60% in the presence of weak turbulence, and falls below 40% under strong turbulence or jitter. In contrast, RetinaNet demonstrates greater robustness, maintaining approximately 75% recall across degraded conditions. These results highlight the importance of incorporating realistic physical degradations into EO training datasets to ensure reliable performance of AI-based models in operational environments, as demonstrated in maritime surveillance applications.",https://arxiv.org/pdf/2605.22268v1,,False
How Many Different Outputs Can a Transformer Generate?,21/05/2026,"Maxime Meyer, Mario Michelessa, Caroline Chaux, Vincent Y. F. Tan","We study how we can leverage only a handful of characteristics of a transformer's architecture to closely predict the number of different sequences it can output, both qualitatively and quantitatively. We provide an upper bound depending on the length of the prompt, which we show empirically to be tight up to a factor less than 10, across architectures and model sizes. Our analysis also provides a theoretical explanation for previously observed empirical failures of transformers on simple sequence tasks, such as copying and cramming. Formally, we prove that (i) the maximal length of accessible sequences (those that the transformer can output for some prompt) grows linearly with the prompt length, (ii) beyond a critical threshold, the proportion of accessible sequences decays exponentially with sequence length, and (iii) the linear coefficient relating prompt length to accessible sequence length admits a theoretical upper bound. Notably, these results hold even with unbounded context and computation time.",https://arxiv.org/pdf/2605.22223v1,,False
A Generative Adversarial Graph Neural Network for Synthetic Time Series Data,21/05/2026,"Marco Gregnanin, Johannes De Smedt, Giorgio Gnecco, Maurizio Parton","Generating synthetic data for financial time series poses challenges, especially considering their non-stationary nature. Traditional statistical time series models normally assume weak stationarity. However, this assumption can constrain their effectiveness. Deep learning models, particularly Generative Adversarial Networks (GANs), have exhibited considerable potential in emulating complex probability distributions. GANs employ a generator-discriminator framework, where the generator creates data samples, while the discriminator distinguishes real from generated data. In this research, we introduce the Sig-Graph GAN model, which integrates the time-series signature, offering a structured summary of its temporal evolution; the Long Short-Term Memory network, capturing its inherent autoregressive structure; and Graph Neural Networks (GNNs), leveraging geometric patterns within the time-series data. To employ GNNs optimally, we use the visibility graph algorithm to derive a graph-based representation of the underlying time series. Numerical evaluations demonstrate that the Sig-Graph GAN model outperforms baseline methods in replicating the distribution of logarithmic returns across different stock exchanges. The integration of the graph structure with the autoregressive component effectively captures both geometric and temporal patterns embedded in time-series data. This research advances the field of GAN models for time series by introducing a model capable of leveraging both autoregressive properties and geometric structures for synthetic data generation.",https://arxiv.org/pdf/2605.22215v1,,False
Spectra as Language: Large Language Models for Scalable Stellar Parameter and Abundance Inference,21/05/2026,"Hai-Ling Lu, Yu-Yang Li, Yin-Bi Li, Cun-Shi Wang, A-Li Luo, Jun-Chao Liang, Shuo Li","Stellar spectra encode key information on the physical properties and chemical compositions of stars. Accurate stellar parameter determination is essential for addressing major questions such as galaxy and stellar evolution. Large-scale spectroscopic surveys have accumulated unprecedented spectral data. Traditional feature extraction or model-fitting approaches struggle with high-dimensional, massive datasets, limited generalization, and computational inefficiency. Recent advances in large language models demonstrate strong generalization and feature-learning in tasks like natural language processing, DNA/RNA sequence analysis, and protein/chemical parsing. Stellar spectra are continuous sequential signals, enabling the transfer of language models to stellar spectroscopy. Here, we propose a two-stage large language model framework for stellar parameter inference, achieving accurate estimation of effective temperature, surface gravity, metallicity, and abundances of ~20 chemical elements. Scaling-law analyses show systematic performance improvements with increasing data, providing a scalable framework for forthcoming large-scale surveys.",https://arxiv.org/pdf/2605.22162v1,,False
Atom-level Protein Representation Learning Improves Protein Structure Prediction,21/05/2026,"Taewon Kim, Hyosoon Jang, Hyunjin Seo, Seonghwan Seo, Hyeongwoo Kim, Wonho Zhung, Mingyeong Shin, Wooyoun Kim, Sungsoo Ahn","Recent advances in generative modeling show that pretrained representations can improve generation as conditioning features or alignment targets. Motivated by this, we study protein representations for predicting structures beyond conventional function annotation. We propose TriProRep, a structure-aware pretraining method that jointly models three aligned residue-level views: amino-acid identity, backbone geometry, and local full-atom geometry, discretely encoded via VQ-VAE tokenizers. By pretraining to recover original tokens from generator-corrupted views, TriProRep learns to distinguish plausible but incorrect cross-view augmentations from the original protein. We further introduce RepSP, a benchmark for evaluating protein representations in structure-predictive settings. RepSP tests three uses of representations: homodimer co-folding from apo-chain representations, residue-level prediction of homodimer-derived interaction properties, and representation-aligned monomer structure prediction. Across these tasks, TriProRep improves over sequence-only and prior structure-aware representation models, while maintaining competitive performance on conventional benchmarks.",https://arxiv.org/pdf/2605.22133v1,,False
Self-Supervised ConvLSTM for Fermi Large Area Telescope Transient Detection,21/05/2026,"Alberto Garinei, Stefano Speziali, Alessandro Vispa, Andrea Marini, Sara Cutini, Emanuele Piccioni, Marcello Marconi, Francesco Longo, Matteo Martini, Francesca Fallucchi, Romeo Giuliano, Ernesto William De Luca, Umberto Di Matteo, Sabino Meola","We present a framework for detecting transient gamma-ray phenomena in a controlled environment by combining end-to-end simulations of the Fermi-LAT sky with self-supervised spatio-temporal deep learning. We generate a ten-year synthetic Universe with gtobssim and process the simulated events into daily all-sky maps of counts and exposure, obtaining a time-ordered sequence that mirrors the structure of Fermi-LAT observations. To model the nominal evolution of the sky, we employ a Convolutional Long Short-Term Memory (ConvLSTM) network that operates directly on map sequences, preserving spatial locality while learning temporal dependencies. The model is trained to reconstruct expected emission, and departures from the learned baseline are quantified through pixel-wise mean-squared residual maps. We then define statistically motivated anomaly criteria by estimating per-pixel thresholds from the residual distribution on the training set, and we enforce spatial coherence via local filtering to suppress isolated fluctuations. The ConvLSTM is then deployed as trained predictor on Fermi-LAT daily maps, where the sky can depart from the nominal behavior because of genuine astrophysical variability and instrumental non-stationarities. The resulting pipeline flags localized, time-dependent excesses consistent with high-variable sources or transient events (e.g., flares or GRBs) and provides a benchmark for evaluating anomaly-detection strategies on long-duration, Fermi-LAT-like datasets.",https://arxiv.org/pdf/2605.22112v1,10.1016/j.ascom.2026.101128,False
CoRMA: Contrastive RMA for Contact-Rich Meta-Adaptation,21/05/2026,"Wentian Wang, Chutong Wen, Hongxu Ma, Wuhao Wang, Zhexiong Xue, Abdul Haseeb Nizamani, Dandi Zhou, Xinhai Sun, Jianqiao Zhu","We present CoRMA(Contrastive Robotic Motor Adaptation), a context-based meta-adaptation framework that modifies RMA for force-dominant assembly. CoRMA replaces raw simulator-parameter adaptation with a compact 6D simulator-only semantic contact context describing contact onset, lateral engagement, guided transition, contact direction, and jamming. A deployable causal Transformer adapter infers this context online from force, proprioceptive, and action histories using semantic regression and a force-regime contrastive objective. At deployment, oracle context is removed and replaced by the inferred context, enabling within-episode adaptation without demonstrations, privileged inputs, or gradient updates. We evaluate CoRMA on PegInsert, GearMesh, and NutThread in Isaac Lab / Isaac Sim~5.0 and on a real Marvin arm. Compared with FORGE baselines that achieve high simulation success but degrade substantially on hardware, CoRMA retains higher verified real success under controlled target-pose noise. These results support semantic contact inference as a reusable adaptation interface within a related assembly task family, while broader unseen-task generalization and Real2Sim calibration remain future work.",https://arxiv.org/pdf/2605.22082v1,,False
Prototype-Guided Classification Sub-Task Decoupling Framework: Enhancing Generalization and Interpretability for Multivariate Time Series,21/05/2026,"Xianhao Song, Yuang Zhang, Yuqi She, Liping Wang, Xuemin Lin","Time Series Classification (TSC) is a long-standing research problem that has gained increasing attention in recent years with the rapid growth of large-scale temporal data. Despite substantial progress enabled by deep learning, designing TSC models that are both accurate and interpretable remains a challenging task. Many existing approaches adopt a direct feature-to-label classification paradigm, by collapsing high-dimensional temporal embeddings into class logits via a single linear projection (often after global pooling), the paradigm conflates feature extraction and decision logic into an inseparable mapping.
  To address these limitations, we propose PDFTime, a prototype-guided framework that reformulates time series classification as a multi-stage decision process. Instead of direct feature-to-label mapping, PDFTime leverages learned prototypes to approximate class-conditional feature distributions in the latent space, enabling progressive discrimination through classification sub-tasks of varying granularity. To our knowledge, PDFTime is the first framework to reformulate time series classification as a decoupled, multi-stage similarity-based reasoning process, breaking the long-standing paradigm of direct, black-box feature-to-label mapping. Extensive evaluations demonstrate that PDFTime achieves state-of-the-art (SOTA) performance across UEA and UCR benchmarks. Notably, it secures the top-$1$ accuracy on 80 out of 128 datasets in the UCR archive, significantly outperforming recent strong baselines in both consistency and generalization.",https://arxiv.org/pdf/2605.22055v1,,False
Active Evidence-Seeking and Diagnostic Reasoning in Large Language Models for Clinical Decision Support,21/05/2026,"Chen Zhan, Xihe Qiu, Xiaoyu Tan, Xibing Zhuang, Gengchen Ma, Yue Zhang, Shuo Li, Peifeng Liu, Xiaoxiao Ge, Liang Liu, Lu Gan","Large language models perform well on static medical examinations, yet clinical diagnosis often requires iterative evidence gathering under uncertainty. Building on prior interactive evaluation efforts, we introduce an OSCE-inspired standardized patient simulator and a controlled, reproducible benchmark for active diagnostic inquiry. Across 468 cases and 15 models in our protocol, we observe that multi-turn evidence seeking reduces diagnostic accuracy by 12.75% and lowers supporting-evidence quality by 24.36% relative to full-context evaluation; error analyses associate these drops with premature diagnostic closure and inefficient questioning. Together, these results suggest that static full-context benchmarks may overestimate performance in interactive evidence-seeking settings, motivating complementary interactive assessment for safer clinical decision support.",https://arxiv.org/pdf/2605.22047v1,,False
From TF-IDF to Transformers: A Comparative and Ensemble Approach to Sentiment Classification,21/05/2026,"Dip Biswas Shanto, Mitali Yadav, Prajwal Panth, Suresh Chandra Satapathy","Sentiment analysis, also referred to as opinion mining, primarily tries to extract opinion from any text-based data. In the context of movie reviews and critics, sentimental analysis can be a helpful tool to predict whether a movie review is generally positive or negative. It can be difficult for the ML models to understand the context or metaphysical sentiment accurately, as ML models rely largely on statistical word representations. The objective of this paper is to examine and categorise movie reviews into positive and negative sentiments. Diverse machine learning models are considered in doing so, and Natural Language Processing (NLP) methodologies are employed for data preprocessing and model assessment. The IMDb dataset is used. Specifically, Naive Bayes, Logistic Regression, Support Vector Machines (SVM), LightGBM, LSTM, and transformer-based models such as RoBERTa and DistilBERT were evaluated. After a lot of testing with accuracy, precision, recall, F1-score, and ROC-AUC, RoBERTa performed better than all the other models, with an accuracy of 93.02%. A soft voting ensemble that combined all the models also improved classification performance, showing that model ensembling works well for sentiment analysis.",https://arxiv.org/pdf/2605.22003v1,,False
