Title,Publication Date,Author(s),Abstract,Link,DOI,Relevant
Efficient Reasoning Models: A Survey,15/04/2025,"Sicheng Feng, Gongfan Fang, Xinyin Ma, Xinchao Wang","Reasoning models have demonstrated remarkable progress in solving complex and
logic-intensive tasks by generating extended Chain-of-Thoughts (CoTs) prior to
arriving at a final answer. Yet, the emergence of this ""slow-thinking""
paradigm, with numerous tokens generated in sequence, inevitably introduces
substantial computational overhead. To this end, it highlights an urgent need
for effective acceleration. This survey aims to provide a comprehensive
overview of recent advances in efficient reasoning. It categorizes existing
works into three key directions: (1) shorter - compressing lengthy CoTs into
concise yet effective reasoning chains; (2) smaller - developing compact
language models with strong reasoning capabilities through techniques such as
knowledge distillation, other model compression techniques, and reinforcement
learning; and (3) faster - designing efficient decoding strategies to
accelerate inference. A curated collection of papers discussed in this survey
is available in our GitHub repository.",http://arxiv.org/pdf/2504.10903v1,,False
Can Vision-Language Models Understand and Interpret Dynamic Gestures from Pedestrians? Pilot Datasets and Exploration Towards Instructive Nonverbal Commands for Cooperative Autonomous Vehicles,15/04/2025,"Tonko E. W. Bossen, Andreas Møgelmose, Ross Greer","In autonomous driving, it is crucial to correctly interpret traffic gestures
(TGs), such as those of an authority figure providing orders or instructions,
or a pedestrian signaling the driver, to ensure a safe and pleasant traffic
environment for all road users. This study investigates the capabilities of
state-of-the-art vision-language models (VLMs) in zero-shot interpretation,
focusing on their ability to caption and classify human gestures in traffic
contexts. We create and publicly share two custom datasets with varying formal
and informal TGs, such as 'Stop', 'Reverse', 'Hail', etc. The datasets are
""Acted TG (ATG)"" and ""Instructive TG In-The-Wild (ITGI)"". They are annotated
with natural language, describing the pedestrian's body position and gesture.
We evaluate models using three methods utilizing expert-generated captions as
baseline and control: (1) caption similarity, (2) gesture classification, and
(3) pose sequence reconstruction similarity. Results show that current VLMs
struggle with gesture understanding: sentence similarity averages below 0.59,
and classification F1 scores reach only 0.14-0.39, well below the expert
baseline of 0.70. While pose reconstruction shows potential, it requires more
data and refined metrics to be reliable. Our findings reveal that although some
SOTA VLMs can interpret zero-shot human traffic gestures, none are accurate and
robust enough to be trustworthy, emphasizing the need for further research in
this domain.",http://arxiv.org/pdf/2504.10873v1,,False
Hallucination-Aware Generative Pretrained Transformer for Cooperative Aerial Mobility Control,15/04/2025,"Hyojun Ahn, Seungcheol Oh, Gyu Seon Kim, Soyi Jung, Soohyun Park, Joongheon Kim","This paper proposes SafeGPT, a two-tiered framework that integrates
generative pretrained transformers (GPTs) with reinforcement learning (RL) for
efficient and reliable unmanned aerial vehicle (UAV) last-mile deliveries. In
the proposed design, a Global GPT module assigns high-level tasks such as
sector allocation, while an On-Device GPT manages real-time local route
planning. An RL-based safety filter monitors each GPT decision and overrides
unsafe actions that could lead to battery depletion or duplicate visits,
effectively mitigating hallucinations. Furthermore, a dual replay buffer
mechanism helps both the GPT modules and the RL agent refine their strategies
over time. Simulation results demonstrate that SafeGPT achieves higher delivery
success rates compared to a GPT-only baseline, while substantially reducing
battery consumption and travel distance. These findings validate the efficacy
of combining GPT-based semantic reasoning with formal safety guarantees,
contributing a viable solution for robust and energy-efficient UAV logistics.",http://arxiv.org/pdf/2504.10831v1,,False
TransitReID: Transit OD Data Collection with Occlusion-Resistant Dynamic Passenger Re-Identification,15/04/2025,"Kaicong Huang, Talha Azfar, Jack Reilly, Ruimin Ke","Transit Origin-Destination (OD) data are essential for transit planning,
particularly in route optimization and demand-responsive paratransit systems.
Traditional methods, such as manual surveys, are costly and inefficient, while
Bluetooth and WiFi-based approaches require passengers to carry specific
devices, limiting data coverage. On the other hand, most transit vehicles are
equipped with onboard cameras for surveillance, offering an opportunity to
repurpose them for edge-based OD data collection through visual person
re-identification (ReID). However, such approaches face significant challenges,
including severe occlusion and viewpoint variations in transit environments,
which greatly reduce matching accuracy and hinder their adoption. Moreover,
designing effective algorithms that can operate efficiently on edge devices
remains an open challenge. To address these challenges, we propose TransitReID,
a novel framework for individual-level transit OD data collection. TransitReID
consists of two key components: (1) An occlusion-robust ReID algorithm
featuring a variational autoencoder guided region-attention mechanism that
adaptively focuses on visible body regions through reconstruction
loss-optimized weight allocation; and (2) a Hierarchical Storage and Dynamic
Matching (HSDM) mechanism specifically designed for efficient and robust
transit OD matching which balances storage, speed, and accuracy. Additionally,
a multi-threaded design supports near real-time operation on edge devices,
which also ensuring privacy protection. We also introduce a ReID dataset
tailored for complex bus environments to address the lack of relevant training
data. Experimental results demonstrate that TransitReID achieves
state-of-the-art performance in ReID tasks, with an accuracy of approximately
90\% in bus route simulations.",http://arxiv.org/pdf/2504.11500v1,,False
Can Large Language Models Trade? Testing Financial Theories with LLM Agents in Market Simulations,15/04/2025,Alejandro Lopez-Lira,"This paper presents a realistic simulated stock market where large language
models (LLMs) act as heterogeneous competing trading agents. The open-source
framework incorporates a persistent order book with market and limit orders,
partial fills, dividends, and equilibrium clearing alongside agents with varied
strategies, information sets, and endowments. Agents submit standardized
decisions using structured outputs and function calls while expressing their
reasoning in natural language. Three findings emerge: First, LLMs demonstrate
consistent strategy adherence and can function as value investors, momentum
traders, or market makers per their instructions. Second, market dynamics
exhibit features of real financial markets, including price discovery, bubbles,
underreaction, and strategic liquidity provision. Third, the framework enables
analysis of LLMs' responses to varying market conditions, similar to partial
dependence plots in machine-learning interpretability. The framework allows
simulating financial theories without closed-form solutions, creating
experimental designs that would be costly with human participants, and
establishing how prompts can generate correlated behaviors affecting market
stability.",http://arxiv.org/pdf/2504.10789v1,,False
ATLASv2: LLM-Guided Adaptive Landmark Acquisition and Navigation on the Edge,15/04/2025,"Mikolaj Walczak, Uttej Kallakuri, Tinoosh Mohsenin","Autonomous systems deployed on edge devices face significant challenges,
including resource constraints, real-time processing demands, and adapting to
dynamic environments. This work introduces ATLASv2, a novel system that
integrates a fine-tuned TinyLLM, real-time object detection, and efficient path
planning to enable hierarchical, multi-task navigation and manipulation all on
the edge device, Jetson Nano. ATLASv2 dynamically expands its navigable
landmarks by detecting and localizing objects in the environment which are
saved to its internal knowledge base to be used for future task execution. We
evaluate ATLASv2 in real-world environments, including a handcrafted home and
office setting constructed with diverse objects and landmarks. Results show
that ATLASv2 effectively interprets natural language instructions, decomposes
them into low-level actions, and executes tasks with high success rates. By
leveraging generative AI in a fully on-board framework, ATLASv2 achieves
optimized resource utilization with minimal prompting latency and power
consumption, bridging the gap between simulated environments and real-world
applications.",http://arxiv.org/pdf/2504.10784v1,,False
