Title,Publication Date,Author(s),Abstract,Link,DOI,Relevant
MobiFuse: Learning Universal Human Mobility Patterns through Cross-domain Data Fusion,20/03/2025,"Haoxuan Ma, Xishun Liao, Yifan Liu, Qinhua Jiang, Chris Stanford, Shangqing Cao, Jiaqi Ma","Human mobility modeling is critical for urban planning and transportation
management, yet existing datasets often lack the resolution and semantic
richness required for comprehensive analysis. To address this, we proposed a
cross-domain data fusion framework that integrates multi-modal data of distinct
nature and spatio-temporal resolution, including geographical, mobility,
socio-demographic, and traffic information, to construct a privacy-preserving
and semantically enriched human travel trajectory dataset. This framework is
demonstrated through two case studies in Los Angeles (LA) and Egypt, where a
domain adaptation algorithm ensures its transferability across diverse urban
contexts. Quantitative evaluation shows that the generated synthetic dataset
accurately reproduces mobility patterns observed in empirical data. Moreover,
large-scale traffic simulations for LA County based on the generated synthetic
demand align well with observed traffic. On California's I-405 corridor, the
simulation yields a Mean Absolute Percentage Error of 5.85% for traffic volume
and 4.36% for speed compared to Caltrans PeMS observations.",http://arxiv.org/pdf/2503.15779v1,,False
Accelerating Transient CFD through Machine Learning-Based Flow Initialization,20/03/2025,"Peter Sharpe, Rishikesh Ranade, Sanjay Choudhry","Transient computational fluid dynamics (CFD) simulations are essential for
many industrial applications, but a significant portion of their computational
cost stems from the time needed to reach statistical steadiness from initial
conditions. We present a novel machine learning-based initialization method
that reduces the cost of this subsequent transient solve substantially,
achieving a 50% reduction in time-to-convergence compared to traditional
uniform and potential flow-based initializations. Through a case study in
automotive aerodynamics using a 16.7M-cell unsteady RANS simulation, we
evaluate three ML-based initialization strategies. Two of these strategies are
recommended for general use: (1) a physics-informed hybrid method combining ML
predictions with potential flow solutions, and (2) a more versatile approach
integrating ML predictions with uniform flow. Both strategies enable CFD
solvers to achieve convergence times comparable to computationally expensive
steady RANS initializations, while requiring only seconds of computation. We
develop a robust statistical convergence metric based on windowed
time-averaging for performance comparison between initialization strategies.
Notably, these improvements are achieved using an ML model trained on a
different dataset of automotive geometries, demonstrating strong generalization
capabilities. The proposed methods integrate seamlessly with existing CFD
workflows without requiring modifications to the underlying flow solver,
providing a practical approach to accelerating industrial CFD simulations
through improved ML-based initialization strategies.",http://arxiv.org/pdf/2503.15766v1,,False
ATTENTION2D: Communication Efficient Distributed Self-Attention Mechanism,20/03/2025,Venmugil Elango,"Transformer-based models have emerged as a leading architecture for natural
language processing, natural language generation, and image generation tasks. A
fundamental element of the transformer architecture is self-attention, which
allows the model to capture intricate dependencies within the data. However,
the self-attention mechanism also incurs significant computational and memory
costs, particularly for long sequences.
  In this paper, we introduce ATTENTION2D, a novel approach that exploits
parallelism along two dimensions - query and key/value - of the self-attention
operation. This method enables efficient distribution and parallelization of
computations across multiple devices. Our approach facilitates asymptotically
faster training and inference phases compared to previous methods, without
relying on approximations or incurring additional computational or memory
overheads. Furthermore, unlike existing techniques that struggle to scale with
an increasing number of processing units, our approach effectively scales with
additional processing units.
  Our experimental results confirm the effectiveness of our method in improving
communication efficiency and scalability. Compared to Ring Attention, our
approach demonstrated up to a 5x performance boost on a GPT-3-like model using
64 NVIDIA A100 GPUs across 16 nodes, and up to a 9.4x performance boost on 64
NVIDIA H100 GPUs across 64 nodes.",http://arxiv.org/pdf/2503.15758v1,,False
