Title,Publication Date,Author(s),Abstract,Link,DOI,Relevant
Learning Novel Skills from Language-Generated Demonstrations,12/12/2024,"Ao-Qun Jin, Tian-Yu Xiang, Xiao-Hu Zhou, Mei-Jiang Gui, Xiao-Liang Xie, Shi-Qi Liu, Shuang-Yi Wang, Yue Cao, Sheng-Bin Duan, Fu-Chao Xie, Zeng-Guang Hou","Current robot learning algorithms for acquiring novel skills often rely on
demonstration datasets or environment interactions, resulting in high labor
costs and potential safety risks. To address these challenges, this study
proposes a skill-learning framework that enables robots to acquire novel skills
from natural language instructions. The proposed pipeline leverages
vision-language models to generate demonstration videos of novel skills, which
are processed by an inverse dynamics model to extract actions from the
unlabeled demonstrations. These actions are subsequently mapped to
environmental contexts via imitation learning, enabling robots to learn new
skills effectively. Experimental evaluations in the MetaWorld simulation
environments demonstrate the pipeline's capability to generate high-fidelity
and reliable demonstrations. Using the generated demonstrations, various skill
learning algorithms achieve an accomplishment rate three times the original on
novel tasks. These results highlight a novel approach to robot learning,
offering a foundation for the intuitive and intelligent acquisition of novel
robotic skills.",http://arxiv.org/pdf/2412.09286v1,,False
Score and Distribution Matching Policy: Advanced Accelerated Visuomotor Policies via Matched Distillation,12/12/2024,"Bofang Jia, Pengxiang Ding, Can Cui, Mingyang Sun, Pengfang Qian, Zhaoxin Fan, Donglin Wang","Visual-motor policy learning has advanced with architectures like
diffusion-based policies, known for modeling complex robotic trajectories.
However, their prolonged inference times hinder high-frequency control tasks
requiring real-time feedback. While consistency distillation (CD) accelerates
inference, it introduces errors that compromise action quality. To address
these limitations, we propose the Score and Distribution Matching Policy (SDM
Policy), which transforms diffusion-based policies into single-step generators
through a two-stage optimization process: score matching ensures alignment with
true action distributions, and distribution matching minimizes KL divergence
for consistency. A dual-teacher mechanism integrates a frozen teacher for
stability and an unfrozen teacher for adversarial training, enhancing
robustness and alignment with target distributions. Evaluated on a 57-task
simulation benchmark, SDM Policy achieves a 6x inference speedup while having
state-of-the-art action quality, providing an efficient and reliable framework
for high-frequency robotic tasks.",http://arxiv.org/pdf/2412.09265v1,,False
Vision CNNs trained to estimate spatial latents learned similar ventral-stream-aligned representations,12/12/2024,"Yudi Xie, Weichen Huang, Esther Alter, Jeremy Schwartz, Joshua B. Tenenbaum, James J. DiCarlo","Studies of the functional role of the primate ventral visual stream have
traditionally focused on object categorization, often ignoring -- despite much
prior evidence -- its role in estimating ""spatial"" latents such as object
position and pose. Most leading ventral stream models are derived by optimizing
networks for object categorization, which seems to imply that the ventral
stream is also derived under such an objective. Here, we explore an alternative
hypothesis: Might the ventral stream be optimized for estimating spatial
latents? And a closely related question: How different -- if at all -- are
representations learned from spatial latent estimation compared to
categorization? To ask these questions, we leveraged synthetic image datasets
generated by a 3D graphic engine and trained convolutional neural networks
(CNNs) to estimate different combinations of spatial and category latents. We
found that models trained to estimate just a few spatial latents achieve neural
alignment scores comparable to those trained on hundreds of categories, and the
spatial latent performance of models strongly correlates with their neural
alignment. Spatial latent and category-trained models have very similar -- but
not identical -- internal representations, especially in their early and middle
layers. We provide evidence that this convergence is partly driven by
non-target latent variability in the training data, which facilitates the
implicit learning of representations of those non-target latents. Taken
together, these results suggest that many training objectives, such as spatial
latents, can lead to similar models aligned neurally with the ventral stream.
Thus, one should not assume that the ventral stream is optimized for object
categorization only. As a field, we need to continue to sharpen our measures of
comparing models to brains to better understand the functional roles of the
ventral stream.",http://arxiv.org/pdf/2412.09115v1,,False
In-Dataset Trajectory Return Regularization for Offline Preference-based Reinforcement Learning,12/12/2024,"Songjun Tu, Jingbo Sun, Qichao Zhang, Yaocheng Zhang, Jia Liu, Ke Chen, Dongbin Zhao","Offline preference-based reinforcement learning (PbRL) typically operates in
two phases: first, use human preferences to learn a reward model and annotate
rewards for a reward-free offline dataset; second, learn a policy by optimizing
the learned reward via offline RL. However, accurately modeling step-wise
rewards from trajectory-level preference feedback presents inherent challenges.
The reward bias introduced, particularly the overestimation of predicted
rewards, leads to optimistic trajectory stitching, which undermines the
pessimism mechanism critical to the offline RL phase. To address this
challenge, we propose In-Dataset Trajectory Return Regularization (DTR) for
offline PbRL, which leverages conditional sequence modeling to mitigate the
risk of learning inaccurate trajectory stitching under reward bias.
Specifically, DTR employs Decision Transformer and TD-Learning to strike a
balance between maintaining fidelity to the behavior policy with high
in-dataset trajectory returns and selecting optimal actions based on high
reward labels. Additionally, we introduce an ensemble normalization technique
that effectively integrates multiple reward models, balancing the tradeoff
between reward differentiation and accuracy. Empirical evaluations on various
benchmarks demonstrate the superiority of DTR over other state-of-the-art
baselines",http://arxiv.org/pdf/2412.09104v1,,False
SVasP: Self-Versatility Adversarial Style Perturbation for Cross-Domain Few-Shot Learning,12/12/2024,"Wenqian Li, Pengfei Fang, Hui Xue","Cross-Domain Few-Shot Learning (CD-FSL) aims to transfer knowledge from seen
source domains to unseen target domains, which is crucial for evaluating the
generalization and robustness of models. Recent studies focus on utilizing
visual styles to bridge the domain gap between different domains. However, the
serious dilemma of gradient instability and local optimization problem occurs
in those style-based CD-FSL methods. This paper addresses these issues and
proposes a novel crop-global style perturbation method, called
\underline{\textbf{S}}elf-\underline{\textbf{V}}ersatility
\underline{\textbf{A}}dversarial \underline{\textbf{S}}tyle
\underline{\textbf{P}}erturbation (\textbf{SVasP}), which enhances the gradient
stability and escapes from poor sharp minima jointly. Specifically, SVasP
simulates more diverse potential target domain adversarial styles via
diversifying input patterns and aggregating localized crop style gradients, to
serve as global style perturbation stabilizers within one image, a concept we
refer to as self-versatility. Then a novel objective function is proposed to
maximize visual discrepancy while maintaining semantic consistency between
global, crop, and adversarial features. Having the stabilized global style
perturbation in the training phase, one can obtain a flattened minima in the
loss landscape, boosting the transferability of the model to the target
domains. Extensive experiments on multiple benchmark datasets demonstrate that
our method significantly outperforms existing state-of-the-art methods. Our
codes are available at https://github.com/liwenqianSEU/SVasP.",http://arxiv.org/pdf/2412.09073v1,,False
Motif Guided Graph Transformer with Combinatorial Skeleton Prototype Learning for Skeleton-Based Person Re-Identification,12/12/2024,"Haocong Rao, Chunyan Miao","Person re-identification (re-ID) via 3D skeleton data is a challenging task
with significant value in many scenarios. Existing skeleton-based methods
typically assume virtual motion relations between all joints, and adopt average
joint or sequence representations for learning. However, they rarely explore
key body structure and motion such as gait to focus on more important body
joints or limbs, while lacking the ability to fully mine valuable
spatial-temporal sub-patterns of skeletons to enhance model learning. This
paper presents a generic Motif guided graph transformer with Combinatorial
skeleton prototype learning (MoCos) that exploits structure-specific and
gait-related body relations as well as combinatorial features of skeleton
graphs to learn effective skeleton representations for person re-ID. In
particular, motivated by the locality within joints' structure and the
body-component collaboration in gait, we first propose the motif guided graph
transformer (MGT) that incorporates hierarchical structural motifs and gait
collaborative motifs, which simultaneously focuses on multi-order local joint
correlations and key cooperative body parts to enhance skeleton relation
learning. Then, we devise the combinatorial skeleton prototype learning (CSP)
that leverages random spatial-temporal combinations of joint nodes and skeleton
graphs to generate diverse sub-skeleton and sub-tracklet representations, which
are contrasted with the most representative features (prototypes) of each
identity to learn class-related semantics and discriminative skeleton
representations. Extensive experiments validate the superior performance of
MoCos over existing state-of-the-art models. We further show its generality
under RGB-estimated skeletons, different graph modeling, and unsupervised
scenarios.",http://arxiv.org/pdf/2412.09044v1,,False
A physics-informed transformer neural operator for learning generalized solutions of initial boundary value problems,12/12/2024,"Sumanth Kumar Boya, Deepak Subramani","Initial boundary value problems arise commonly in applications with
engineering and natural systems governed by nonlinear partial differential
equations (PDEs). Operator learning is an emerging field for solving these
equations by using a neural network to learn a map between infinite dimensional
input and output function spaces. These neural operators are trained using a
combination of data (observations or simulations) and PDE-residuals
(physics-loss). A major drawback of existing neural approaches is the
requirement to retrain with new initial/boundary conditions, and the necessity
for a large amount of simulation data for training. We develop a
physics-informed transformer neural operator (named PINTO) that efficiently
generalizes to unseen initial and boundary conditions, trained in a
simulation-free setting using only physics loss. The main innovation lies in
our new iterative kernel integral operator units, implemented using
cross-attention, to transform the PDE solution's domain points into an
initial/boundary condition-aware representation vector, enabling efficient
learning of the solution function for new scenarios. The PINTO architecture is
applied to simulate the solutions of important equations used in engineering
applications: advection, Burgers, and steady and unsteady Navier-Stokes
equations (three flow scenarios). For these five test cases, we show that the
relative errors during testing under challenging conditions of unseen
initial/boundary conditions are only one-fifth to one-third of other leading
physics informed operator learning methods. Moreover, our PINTO model is able
to accurately solve the advection and Burgers equations at time steps that are
not included in the training collocation points. The code is available at
$\texttt{https://github.com/quest-lab-iisc/PINTO}$",http://arxiv.org/pdf/2412.09009v1,,False
Stellar parameter prediction and spectral simulation using machine learning,12/12/2024,"Vojtěch Cvrček, Martino Romaniello, Radim Šára, Wolfram Freudling, Pascal Ballester","We applied machine learning to the entire data history of ESO's High Accuracy
Radial Velocity Planet Searcher (HARPS) instrument. Our primary goal was to
recover the physical properties of the observed objects, with a secondary
emphasis on simulating spectra. We systematically investigated the impact of
various factors on the accuracy and fidelity of the results, including the use
of simulated data, the effect of varying amounts of real training data, network
architectures, and learning paradigms. Our approach integrates supervised and
unsupervised learning techniques within autoencoder frameworks. Our methodology
leverages an existing simulation model that utilizes a library of existing
stellar spectra in which the emerging flux is computed from first principles
rooted in physics and a HARPS instrument model to generate simulated spectra
comparable to observational data. We trained standard and variational
autoencoders on HARPS data to predict spectral parameters and generate spectra.
Our models excel at predicting spectral parameters and compressing real
spectra, and they achieved a mean prediction error of approximately 50 K for
effective temperatures, making them relevant for most astrophysical
applications. Furthermore, the models predict metallicity ([M/H]) and surface
gravity (log g) with an accuracy of approximately 0.03 dex and 0.04 dex,
respectively, underscoring their broad applicability in astrophysical research.
The models' computational efficiency, with processing times of 779.6 ms on CPU
and 3.97 ms on GPU, makes them valuable for high-throughput applications like
massive spectroscopic surveys and large archival studies. By achieving accuracy
comparable to classical methods with significantly reduced computation time,
our methodology enhances the scope and efficiency of spectroscopic analysis.",http://arxiv.org/pdf/2412.09002v1,,False
Selective Visual Prompting in Vision Mamba,12/12/2024,"Yifeng Yao, Zichen Liu, Zhenyu Cui, Yuxin Peng, Jiahuan Zhou","Pre-trained Vision Mamba (Vim) models have demonstrated exceptional
performance across various computer vision tasks in a computationally efficient
manner, attributed to their unique design of selective state space models. To
further extend their applicability to diverse downstream vision tasks, Vim
models can be adapted using the efficient fine-tuning technique known as visual
prompting. However, existing visual prompting methods are predominantly
tailored for Vision Transformer (ViT)-based models that leverage global
attention, neglecting the distinctive sequential token-wise compression and
propagation characteristics of Vim. Specifically, existing prompt tokens
prefixed to the sequence are insufficient to effectively activate the input and
forget gates across the entire sequence, hindering the extraction and
propagation of discriminative information. To address this limitation, we
introduce a novel Selective Visual Prompting (SVP) method specifically for the
efficient fine-tuning of Vim. To prevent the loss of discriminative information
during state space propagation, SVP employs lightweight selective prompters for
token-wise prompt generation, ensuring adaptive activation of the update and
forget gates within Mamba blocks to promote discriminative information
propagation. Moreover, considering that Vim propagates both shared cross-layer
information and specific inner-layer information, we further refine SVP with a
dual-path structure: Cross-Prompting and Inner-Prompting. Cross-Prompting
utilizes shared parameters across layers, while Inner-Prompting employs
distinct parameters, promoting the propagation of both shared and specific
information, respectively. Extensive experimental results on various
large-scale benchmarks demonstrate that our proposed SVP significantly
outperforms state-of-the-art methods. Our code is available at
https://github.com/zhoujiahuan1991/AAAI2025-SVP.",http://arxiv.org/pdf/2412.08947v1,,False
Goal-Conditioned Supervised Learning for Multi-Objective Recommendation,12/12/2024,"Shijun Li, Hilaf Hasson, Jing Hu, Joydeep Ghosh","Multi-objective learning endeavors to concurrently optimize multiple
objectives using a single model, aiming to achieve high and balanced
performance across these diverse objectives. However, it often involves a more
complex optimization problem, particularly when navigating potential conflicts
between objectives, leading to solutions with higher memory requirements and
computational complexity. This paper introduces a Multi-Objective
Goal-Conditioned Supervised Learning (MOGCSL) framework for automatically
learning to achieve multiple objectives from offline sequential data. MOGCSL
extends the conventional Goal-Conditioned Supervised Learning (GCSL) method to
multi-objective scenarios by redefining goals from one-dimensional scalars to
multi-dimensional vectors. The need for complex architectures and optimization
constraints can be naturally eliminated. MOGCSL benefits from filtering out
uninformative or noisy instances that do not achieve desirable long-term
rewards. It also incorporates a novel goal-choosing algorithm to model and
select ""high"" achievable goals for inference.
  While MOGCSL is quite general, we focus on its application to the next action
prediction problem in commercial-grade recommender systems. In this context,
any viable solution needs to be reasonably scalable and also be robust to large
amounts of noisy data that is characteristic of this application space. We show
that MOGCSL performs admirably on both counts. Specifically, extensive
experiments conducted on real-world recommendation datasets validate its
efficacy and efficiency. Also, analysis and experiments are included to explain
its strength in discounting the noisier portions of training data in
recommender systems.",http://arxiv.org/pdf/2412.08911v1,,False
Federated Foundation Models on Heterogeneous Time Series,12/12/2024,"Shengchao Chen, Guodong Long, Jing Jiang, Chengqi Zhang","Training a general-purpose time series foundation models with robust
generalization capabilities across diverse applications from scratch is still
an open challenge. Efforts are primarily focused on fusing cross-domain time
series datasets to extract shared subsequences as tokens for training models on
Transformer architecture. However, due to significant statistical heterogeneity
across domains, this cross-domain fusing approach doesn't work effectively as
the same as fusing texts and images. To tackle this challenge, this paper
proposes a novel federated learning approach to address the heterogeneity in
time series foundation models training, namely FFTS. Specifically, each
data-holding organization is treated as an independent client in a
collaborative learning framework with federated settings, and then many
client-specific local models will be trained to preserve the unique
characteristics per dataset. Moreover, a new regularization mechanism will be
applied to both client-side and server-side, thus to align the shared knowledge
across heterogeneous datasets from different domains. Extensive experiments on
benchmark datasets demonstrate the effectiveness of the proposed federated
learning approach. The newly learned time series foundation models achieve
superior generalization capabilities on cross-domain time series analysis
tasks, including forecasting, imputation, and anomaly detection.",http://arxiv.org/pdf/2412.08906v1,,False
Efficient Reinforcement Learning for Optimal Control with Natural Images,12/12/2024,Peter N. Loxley,"Reinforcement learning solves optimal control and sequential decision
problems widely found in control systems engineering, robotics, and artificial
intelligence. This work investigates optimal control over a sequence of natural
images. The problem is formalized, and general conditions are derived for an
image to be sufficient for implementing an optimal policy. Reinforcement
learning is shown to be efficient only for certain types of image
representations. This is demonstrated by developing a reinforcement learning
benchmark that scales easily with number of states and length of horizon, and
has optimal policies that are easily distinguished from suboptimal policies.
Image representations given by overcomplete sparse codes are found to be
computationally efficient for optimal control, using fewer computational
resources to learn and evaluate optimal policies. For natural images of fixed
size, representing each image as an overcomplete sparse code in a linear
network is shown to increase network storage capacity by orders of magnitude
beyond that possible for any complete code, allowing larger tasks with many
more states to be solved. Sparse codes can be generated by devices with low
energy requirements and low computational overhead.",http://arxiv.org/pdf/2412.08893v1,,False
Quantum Kernel-Based Long Short-term Memory for Climate Time-Series Forecasting,12/12/2024,"Yu-Chao Hsu, Nan-Yow Chen, Tai-Yu Li, Po-Heng, Lee, Kuan-Cheng Chen","We present the Quantum Kernel-Based Long short-memory (QK-LSTM) network,
which integrates quantum kernel methods into classical LSTM architectures to
enhance predictive accuracy and computational efficiency in climate time-series
forecasting tasks, such as Air Quality Index (AQI) prediction. By embedding
classical inputs into high-dimensional quantum feature spaces, QK-LSTM captures
intricate nonlinear dependencies and temporal dynamics with fewer trainable
parameters. Leveraging quantum kernel methods allows for efficient computation
of inner products in quantum spaces, addressing the computational challenges
faced by classical models and variational quantum circuit-based models.
Designed for the Noisy Intermediate-Scale Quantum (NISQ) era, QK-LSTM supports
scalable hybrid quantum-classical implementations. Experimental results
demonstrate that QK-LSTM outperforms classical LSTM networks in AQI
forecasting, showcasing its potential for environmental monitoring and
resource-constrained scenarios, while highlighting the broader applicability of
quantum-enhanced machine learning frameworks in tackling large-scale,
high-dimensional climate datasets.",http://arxiv.org/pdf/2412.08851v1,,False
Emulating the Global Change Analysis Model with Deep Learning,12/12/2024,"Andrew Holmes, Matt Jensen, Sarah Coffland, Hidemi Mitani Shen, Logan Sizemore, Seth Bassetti, Brenna Nieva, Claudia Tebaldi, Abigail Snyder, Brian Hutchinson","The Global Change Analysis Model (GCAM) simulates complex interactions
between the coupled Earth and human systems, providing valuable insights into
the co-evolution of land, water, and energy sectors under different future
scenarios. Understanding the sensitivities and drivers of this multisectoral
system can lead to more robust understanding of the different pathways to
particular outcomes. The interactions and complexity of the coupled human-Earth
systems make GCAM simulations costly to run at scale - a requirement for large
ensemble experiments which explore uncertainty in model parameters and outputs.
A differentiable emulator with similar predictive power, but greater
efficiency, could provide novel scenario discovery and analysis of GCAM and its
outputs, requiring fewer runs of GCAM. As a first use case, we train a neural
network on an existing large ensemble that explores a range of GCAM inputs
related to different relative contributions of energy production sources, with
a focus on wind and solar. We complement this existing ensemble with
interpolated input values and a wider selection of outputs, predicting 22,528
GCAM outputs across time, sectors, and regions. We report a median $R^2$ score
of 0.998 for the emulator's predictions and an $R^2$ score of 0.812 for its
input-output sensitivity.",http://arxiv.org/pdf/2412.08850v1,,False
