Title,Publication Date,Author(s),Abstract,Link,DOI,Relevant
Estimating Total Effects in Bipartite Experiments with Spillovers and Partial Eligibility,14/11/2025,"Albert Tan, Mohsen Bayati, James Nordlund, Roman Istomin","We study randomized experiments in bipartite systems where only a subset of treatment-side units are eligible for assignment while all units continue to interact, generating interference. We formalize eligibility-constrained bipartite experiments and define estimands aligned with full deployment: the Primary Total Treatment Effect (PTTE) on eligible units and the Secondary Total Treatment Effect (STTE) on ineligible units. Under randomization within the eligible set, we give identification conditions and develop interference-aware ensemble estimators that combine exposure mappings, generalized propensity scores, and flexible machine learning. We further introduce a projection that links treatment- and outcome-level estimands; this mapping is exact under a Linear Additive Edges condition and enables estimation on the (typically much smaller) treatment side with deterministic aggregation to outcomes. In simulations with known ground truth across realistic exposure regimes, the proposed estimators recover PTTE and STTE with low bias and variance and reduce the bias that could arise when interference is ignored. Two field experiments illustrate practical relevance: our method corrects the direction of expected interference bias for a pre-specified metric in both studies and reverses the sign and significance of the primary decision metric in one case.",https://arxiv.org/pdf/2511.11564v1,,False
Generalizing Fair Clustering to Multiple Groups: Algorithms and Applications,14/11/2025,"Diptarka Chakraborty, Kushagra Chatterjee, Debarati Das, Tien-Long Nguyen","Clustering is a fundamental task in machine learning and data analysis, but it frequently fails to provide fair representation for various marginalized communities defined by multiple protected attributes -- a shortcoming often caused by biases in the training data. As a result, there is a growing need to enhance the fairness of clustering outcomes, ideally by making minimal modifications, possibly as a post-processing step after conventional clustering. Recently, Chakraborty et al. [COLT'25] initiated the study of \emph{closest fair clustering}, though in a restricted scenario where data points belong to only two groups. In practice, however, data points are typically characterized by many groups, reflecting diverse protected attributes such as age, ethnicity, gender, etc.
  In this work, we generalize the study of the \emph{closest fair clustering} problem to settings with an arbitrary number (more than two) of groups. We begin by showing that the problem is NP-hard even when all groups are of equal size -- a stark contrast with the two-group case, for which an exact algorithm exists. Next, we propose near-linear time approximation algorithms that efficiently handle arbitrary-sized multiple groups, thereby answering an open question posed by Chakraborty et al. [COLT'25].
  Leveraging our closest fair clustering algorithms, we further achieve improved approximation guarantees for the \emph{fair correlation clustering} problem, advancing the state-of-the-art results established by Ahmadian et al. [AISTATS'20] and Ahmadi et al. [2020]. Additionally, we are the first to provide approximation algorithms for the \emph{fair consensus clustering} problem involving multiple (more than two) groups, thus addressing another open direction highlighted by Chakraborty et al. [COLT'25].",https://arxiv.org/pdf/2511.11539v1,,False
MoCap2Radar: A Spatiotemporal Transformer for Synthesizing Micro-Doppler Radar Signatures from Motion Capture,14/11/2025,"Kevin Chen, Kenneth W. Parker, Anish Arora","We present a pure machine learning process for synthesizing radar spectrograms from Motion-Capture (MoCap) data. We formulate MoCap-to-spectrogram translation as a windowed sequence-to-sequence task using a transformer-based model that jointly captures spatial relations among MoCap markers and temporal dynamics across frames. Real-world experiments show that the proposed approach produces visually and quantitatively plausible doppler radar spectrograms and achieves good generalizability. Ablation experiments show that the learned model includes both the ability to convert multi-part motion into doppler signatures and an understanding of the spatial relations between different parts of the human body.
  The result is an interesting example of using transformers for time-series signal processing. It is especially applicable to edge computing and Internet of Things (IoT) radars. It also suggests the ability to augment scarce radar datasets using more abundant MoCap data for training higher-level applications. Finally, it requires far less computation than physics-based methods for generating radar data.",https://arxiv.org/pdf/2511.11462v1,,False
"Low-Bit, High-Fidelity: Optimal Transport Quantization for Flow Matching",14/11/2025,"Dara Varam, Diaa A. Abuhani, Imran Zualkernan, Raghad AlDamani, Lujain Khalil","Flow Matching (FM) generative models offer efficient simulation-free training and deterministic sampling, but their practical deployment is challenged by high-precision parameter requirements. We adapt optimal transport (OT)-based post-training quantization to FM models, minimizing the 2-Wasserstein distance between quantized and original weights, and systematically compare its effectiveness against uniform, piecewise, and logarithmic quantization schemes. Our theoretical analysis provides upper bounds on generative degradation under quantization, and empirical results across five benchmark datasets of varying complexity show that OT-based quantization preserves both visual generation quality and latent space stability down to 2-3 bits per parameter, where alternative methods fail. This establishes OT-based quantization as a principled, effective approach to compress FM generative models for edge and embedded AI applications.",https://arxiv.org/pdf/2511.11418v1,,False
KarmaTS: A Universal Simulation Platform for Multivariate Time Series with Functional Causal Dynamics,14/11/2025,"Haixin Li, Yanke Li, Diego Paez-Granados","We introduce KarmaTS, an interactive framework for constructing lag-indexed, executable spatiotemporal causal graphical models for multivariate time series (MTS) simulation. Motivated by the challenge of access-restricted physiological data, KarmaTS generates synthetic MTS with known causal dynamics and augments real-world datasets with expert knowledge. The system constructs a discrete-time structural causal process (DSCP) by combining expert knowledge and algorithmic proposals in a mixed-initiative, human-in-the-loop workflow. The resulting DSCP supports simulation and causal interventions, including those under user-specified distribution shifts. KarmaTS handles mixed variable types, contemporaneous and lagged edges, and modular edge functionals ranging from parameterizable templates to neural network models. Together, these features enable flexible validation and benchmarking of causal discovery algorithms through expert-informed simulation.",https://arxiv.org/pdf/2511.11357v1,,False
Model Class Selection,14/11/2025,"Ryan Cecil, Lucas Mentch","Classical model selection seeks to find a single model within a particular class that optimizes some pre-specified criteria, such as maximizing a likelihood or minimizing a risk. More recently, there has been an increased interest in model set selection (MSS), where the aim is to identify a (confidence) set of near-optimal models. Here, we generalize the MSS framework further by introducing the idea of model class selection (MCS). In MCS, multiple model collections are evaluated, and all collections that contain at least one optimal model are sought for identification. Under mild conditions, data splitting based approaches are shown to provide general solutions for MCS. As a direct consequence, for particular datasets we are able to investigate formally whether classes of simpler and more interpretable statistical models are able to perform on par with more complex black-box machine learning models. A variety of simulated and real-data experiments are provided.",https://arxiv.org/pdf/2511.11355v1,,False
MOON Embedding: Multimodal Representation Learning for E-commerce Search Advertising,14/11/2025,"Chenghan Fu, Daoze Zhang, Yukang Lin, Zhanheng Nie, Xiang Zhang, Jianyu Liu, Yueran Liu, Wanxian Guan, Pengjie Wang, Jian Xu, Bo Zheng","We introduce MOON, our comprehensive set of sustainable iterative practices for multimodal representation learning for e-commerce applications. MOON has already been fully deployed across all stages of Taobao search advertising system, including retrieval, relevance, ranking, and so on. The performance gains are particularly significant on click-through rate (CTR) prediction task, which achieves an overall +20.00% online CTR improvement. Over the past three years, this project has delivered the largest improvement on CTR prediction task and undergone five full-scale iterations. Throughout the exploration and iteration of our MOON, we have accumulated valuable insights and practical experience that we believe will benefit the research community. MOON contains a three-stage training paradigm of ""Pretraining, Post-training, and Application"", allowing effective integration of multimodal representations with downstream tasks. Notably, to bridge the misalignment between the objectives of multimodal representation learning and downstream training, we define the exchange rate to quantify how effectively improvements in an intermediate metric can translate into downstream gains. Through this analysis, we identify the image-based search recall as a critical intermediate metric guiding the optimization of multimodal models. Over three years and five iterations, MOON has evolved along four critical dimensions: data processing, training strategy, model architecture, and downstream application. The lessons and insights gained through the iterative improvements will also be shared. As part of our exploration into scaling effects in the e-commerce field, we further conduct a systematic study of the scaling laws governing multimodal representation learning, examining multiple factors such as the number of training tokens, negative samples, and the length of user behavior sequences.",https://arxiv.org/pdf/2511.11305v1,,False
Experiences from Benchmarking Vision-Language-Action Models for Robotic Manipulation,14/11/2025,"Yihao Zhang, Yuankai Qi, Xi Zheng","Foundation models applied in robotics, particularly \textbf{Vision--Language--Action (VLA)} models, hold great promise for achieving general-purpose manipulation. Yet, systematic real-world evaluations and cross-model comparisons remain scarce. This paper reports our \textbf{empirical experiences} from benchmarking four representative VLAs -- \textbf{ACT}, \textbf{OpenVLA--OFT}, \textbf{RDT-1B}, and \boldmath{$π_0$} -- across four manipulation tasks conducted in both simulation and on the \textbf{ALOHA Mobile} platform. We establish a \textbf{standardized evaluation framework} that measures performance along three key dimensions: (1) \textit{accuracy and efficiency} (success rate and time-to-success), (2) \textit{adaptability} across in-distribution, spatial out-of-distribution, and instance-plus-spatial out-of-distribution settings, and (3) \textit{language instruction-following accuracy}. Through this process, we observe that \boldmath{$π_0$} demonstrates superior adaptability in out-of-distribution scenarios, while \textbf{ACT} provides the highest stability in-distribution. Further analysis highlights differences in computational demands, data-scaling behavior, and recurring failure modes such as near-miss grasps, premature releases, and long-horizon state drift. These findings reveal practical trade-offs among VLA model architectures in balancing precision, generalization, and deployment cost, offering actionable insights for selecting and deploying VLAs in real-world robotic manipulation tasks.",https://arxiv.org/pdf/2511.11298v1,,False
OT-ALD: Aligning Latent Distributions with Optimal Transport for Accelerated Image-to-Image Translation,14/11/2025,"Zhanpeng Wang, Shuting Cao, Yuhang Lu, Yuhan Li, Na Lei, Zhongxuan Luo","The Dual Diffusion Implicit Bridge (DDIB) is an emerging image-to-image (I2I) translation method that preserves cycle consistency while achieving strong flexibility. It links two independently trained diffusion models (DMs) in the source and target domains by first adding noise to a source image to obtain a latent code, then denoising it in the target domain to generate the translated image. However, this method faces two key challenges: (1) low translation efficiency, and (2) translation trajectory deviations caused by mismatched latent distributions. To address these issues, we propose a novel I2I translation framework, OT-ALD, grounded in optimal transport (OT) theory, which retains the strengths of DDIB-based approach. Specifically, we compute an OT map from the latent distribution of the source domain to that of the target domain, and use the mapped distribution as the starting point for the reverse diffusion process in the target domain. Our error analysis confirms that OT-ALD eliminates latent distribution mismatches. Moreover, OT-ALD effectively balances faster image translation with improved image quality. Experiments on four translation tasks across three high-resolution datasets show that OT-ALD improves sampling efficiency by 20.29% and reduces the FID score by 2.6 on average compared to the top-performing baseline models.",https://arxiv.org/pdf/2511.11162v1,,False
Adaptive Symmetrization of the KL Divergence,14/11/2025,"Omri Ben-Dov, Luiz F. O. Chamon","Many tasks in machine learning can be described as or reduced to learning a probability distribution given a finite set of samples. A common approach is to minimize a statistical divergence between the (empirical) data distribution and a parameterized distribution, e.g., a normalizing flow (NF) or an energy-based model (EBM). In this context, the forward KL divergence is a ubiquitous due to its tractability, though its asymmetry may prevent capturing some properties of the target distribution. Symmetric alternatives involve brittle min-max formulations and adversarial training (e.g., generative adversarial networks) or evaluating the reverse KL divergence, as is the case for the symmetric Jeffreys divergence, which is challenging to compute from samples. This work sets out to develop a new approach to minimize the Jeffreys divergence. To do so, it uses a proxy model whose goal is not only to fit the data, but also to assist in optimizing the Jeffreys divergence of the main model. This joint training task is formulated as a constrained optimization problem to obtain a practical algorithm that adapts the models priorities throughout training. We illustrate how this framework can be used to combine the advantages of NFs and EBMs in tasks such as density estimation, image generation, and simulation-based inference.",https://arxiv.org/pdf/2511.11159v1,,False
AV-Dialog: Spoken Dialogue Models with Audio-Visual Input,14/11/2025,"Tuochao Chen, Bandhav Veluri, Hongyu Gong, Shyamnath Gollakota","Dialogue models falter in noisy, multi-speaker environments, often producing irrelevant responses and awkward turn-taking. We present AV-Dialog, the first multimodal dialog framework that uses both audio and visual cues to track the target speaker, predict turn-taking, and generate coherent responses. By combining acoustic tokenization with multi-task, multi-stage training on monadic, synthetic, and real audio-visual dialogue datasets, AV-Dialog achieves robust streaming transcription, semantically grounded turn-boundary detection and accurate responses, resulting in a natural conversational flow. Experiments show that AV-Dialog outperforms audio-only models under interference, reducing transcription errors, improving turn-taking prediction, and enhancing human-rated dialogue quality. These results highlight the power of seeing as well as hearing for speaker-aware interaction, paving the way for {spoken} dialogue agents that perform {robustly} in real-world, noisy environments.",https://arxiv.org/pdf/2511.11124v1,,False
ARCTraj: A Dataset and Benchmark of Human Reasoning Trajectories for Abstract Problem Solving,14/11/2025,"Sejin Kim, Hayan Choi, Seokki Lee, Sundong Kim","We present ARCTraj, a dataset and methodological framework for modeling human reasoning through complex visual tasks in the Abstraction and Reasoning Corpus (ARC). While ARC has inspired extensive research on abstract reasoning, most existing approaches rely on static input--output supervision, which limits insight into how reasoning unfolds over time. ARCTraj addresses this gap by recording temporally ordered, object-level actions that capture how humans iteratively transform inputs into outputs, revealing intermediate reasoning steps that conventional datasets overlook. Collected via the O2ARC web interface, it contains around 10,000 trajectories annotated with task identifiers, timestamps, and success labels across 400 training tasks from the ARC-AGI-1 benchmark. It further defines a unified reasoning pipeline encompassing data collection, action abstraction, Markov decision process (MDP) formulation, and downstream learning, enabling integration with reinforcement learning, generative modeling, and sequence modeling methods such as PPO, World Models, GFlowNets, Diffusion agents, and Decision Transformers. Analyses of spatial selection, color attribution, and strategic convergence highlight the structure and diversity of human reasoning. Together, these contributions position ARCTraj as a structured and interpretable foundation for studying human-like reasoning, advancing explainability, alignment, and generalizable intelligence.",https://arxiv.org/pdf/2511.11079v1,,False
LiteAttention: A Temporal Sparse Attention for Diffusion Transformers,14/11/2025,"Dor Shmilovich, Tony Wu, Aviad Dahan, Yuval Domb","Diffusion Transformers, particularly for video generation, achieve remarkable quality but suffer from quadratic attention complexity, leading to prohibitive latency. Existing acceleration methods face a fundamental trade-off: dynamically estimating sparse attention patterns at each denoising step incurs high computational overhead and estimation errors, while static sparsity patterns remain fixed and often suboptimal throughout denoising. We identify a key structural property of diffusion attention, namely, its sparsity patterns exhibit strong temporal coherence across denoising steps. Tiles deemed non-essential at step $t$ typically remain so at step $t+δ$. Leveraging this observation, we introduce LiteAttention, a method that exploits temporal coherence to enable evolutionary computation skips across the denoising sequence. By marking non-essential tiles early and propagating skip decisions forward, LiteAttention eliminates redundant attention computations without repeated profiling overheads, combining the adaptivity of dynamic methods with the efficiency of static ones. We implement a highly optimized LiteAttention kernel on top of FlashAttention and demonstrate substantial speedups on production video diffusion models, with no degradation in quality. The code and implementation details will be publicly released.",https://arxiv.org/pdf/2511.11062v1,,False
Autonomous Vehicle Path Planning by Searching With Differentiable Simulation,14/11/2025,"Asen Nachkov, Jan-Nico Zaech, Danda Pani Paudel, Xi Wang, Luc Van Gool","Planning allows an agent to safely refine its actions before executing them in the real world. In autonomous driving, this is crucial to avoid collisions and navigate in complex, dense traffic scenarios. One way to plan is to search for the best action sequence. However, this is challenging when all necessary components - policy, next-state predictor, and critic - have to be learned. Here we propose Differentiable Simulation for Search (DSS), a framework that leverages the differentiable simulator Waymax as both a next state predictor and a critic. It relies on the simulator's hardcoded dynamics, making state predictions highly accurate, while utilizing the simulator's differentiability to effectively search across action sequences. Our DSS agent optimizes its actions using gradient descent over imagined future trajectories. We show experimentally that DSS - the combination of planning gradients and stochastic search - significantly improves tracking and path planning accuracy compared to sequence prediction, imitation learning, model-free RL, and other planning methods.",https://arxiv.org/pdf/2511.11043v1,,False
AirCopBench: A Benchmark for Multi-drone Collaborative Embodied Perception and Reasoning,14/11/2025,"Jirong Zha, Yuxuan Fan, Tianyu Zhang, Geng Chen, Yingfeng Chen, Chen Gao, Xinlei Chen","Multimodal Large Language Models (MLLMs) have shown promise in single-agent vision tasks, yet benchmarks for evaluating multi-agent collaborative perception remain scarce. This gap is critical, as multi-drone systems provide enhanced coverage, robustness, and collaboration compared to single-sensor setups. Existing multi-image benchmarks mainly target basic perception tasks using high-quality single-agent images, thus failing to evaluate MLLMs in more complex, egocentric collaborative scenarios, especially under real-world degraded perception conditions.To address these challenges, we introduce AirCopBench, the first comprehensive benchmark designed to evaluate MLLMs in embodied aerial collaborative perception under challenging perceptual conditions. AirCopBench includes 14.6k+ questions derived from both simulator and real-world data, spanning four key task dimensions: Scene Understanding, Object Understanding, Perception Assessment, and Collaborative Decision, across 14 task types. We construct the benchmark using data from challenging degraded-perception scenarios with annotated collaborative events, generating large-scale questions through model-, rule-, and human-based methods under rigorous quality control. Evaluations on 40 MLLMs show significant performance gaps in collaborative perception tasks, with the best model trailing humans by 24.38% on average and exhibiting inconsistent results across tasks. Fine-tuning experiments further confirm the feasibility of sim-to-real transfer in aerial collaborative perception and reasoning.",https://arxiv.org/pdf/2511.11025v1,,False
Text-guided Weakly Supervised Framework for Dynamic Facial Expression Recognition,14/11/2025,"Gunho Jung, Heejo Kong, Seong-Whan Lee","Dynamic facial expression recognition (DFER) aims to identify emotional states by modeling the temporal changes in facial movements across video sequences. A key challenge in DFER is the many-to-one labeling problem, where a video composed of numerous frames is assigned a single emotion label. A common strategy to mitigate this issue is to formulate DFER as a Multiple Instance Learning (MIL) problem. However, MIL-based approaches inherently suffer from the visual diversity of emotional expressions and the complexity of temporal dynamics. To address this challenge, we propose TG-DFER, a text-guided weakly supervised framework that enhances MIL-based DFER by incorporating semantic guidance and coherent temporal modeling. We incorporate a vision-language pre-trained (VLP) model is integrated to provide semantic guidance through fine-grained textual descriptions of emotional context. Furthermore, we introduce visual prompts, which align enriched textual emotion labels with visual instance features, enabling fine-grained reasoning and frame-level relevance estimation. In addition, a multi-grained temporal network is designed to jointly capture short-term facial dynamics and long-range emotional flow, ensuring coherent affective understanding across time. Extensive results demonstrate that TG-DFER achieves improved generalization, interpretability, and temporal sensitivity under weak supervision.",https://arxiv.org/pdf/2511.10958v1,,False
