Title,Publication Date,Author(s),Abstract,Link,DOI,Relevant
SpeechQualityLLM: LLM-Based Multimodal Assessment of Speech Quality,09/12/2025,"Mahathir Monjur, Shahriar Nirjon","Objective speech quality assessment is central to telephony, VoIP, and streaming systems, where large volumes of degraded audio must be monitored and optimized at scale. Classical metrics such as PESQ and POLQA approximate human mean opinion scores (MOS) but require carefully controlled conditions and expensive listening tests, while learning-based models such as NISQA regress MOS and multiple perceptual dimensions from waveforms or spectrograms, achieving high correlation with subjective ratings yet remaining rigid: they do not support interactive, natural-language queries and do not natively provide textual rationales. In this work, we introduce SpeechQualityLLM, a multimodal speech quality question-answering (QA) system that couples an audio encoder with a language model and is trained on the NISQA corpus using template-based question-answer pairs covering overall MOS and four perceptual dimensions (noisiness, coloration, discontinuity, and loudness) in both single-ended (degraded only) and double-ended (degraded plus clean reference) setups. Instead of directly regressing scores, our system is supervised to generate textual answers from which numeric predictions are parsed and evaluated with standard regression and ranking metrics; on held-out NISQA clips, the double-ended model attains a MOS mean absolute error (MAE) of 0.41 with Pearson correlation of 0.86, with competitive performance on dimension-wise tasks. Beyond these quantitative gains, it offers a flexible natural-language interface in which the language model acts as an audio quality expert: practitioners can query arbitrary aspects of degradations, prompt the model to emulate different listener profiles to capture human variability and produce diverse but plausible judgments rather than a single deterministic score, and thereby reduce reliance on large-scale crowdsourced tests and their monetary cost.",https://arxiv.org/pdf/2512.08238v1,,False
MobileFineTuner: A Unified End-to-End Framework for Fine-Tuning LLMs on Mobile Phones,09/12/2025,"Jiaxiang Geng, Lunyu Zhao, Yiyi Lu, Bing Luo","Mobile phones are the most ubiquitous end devices, generating vast amounts of human-authored data and serving as the primary platform for end-side applications. As high-quality public data for large language models (LLMs) approaches exhaustion, on-device fine-tuning provides an opportunity to leverage private user data while preserving privacy. However, existing approaches are predominantly simulation-based or rely on IoT devices and PCs, leaving commodity mobile phones largely unexplored. A key gap is the absence of an open-source framework that enables practical LLM fine-tuning on mobile phones. We present MobileFineTuner, a unified open-source framework that enables end-to-end LLM fine-tuning directly on commodity mobile phones. MobileFineTuner is designed for efficiency, scalability, and usability, supporting full-parameters fine-tuning (Full-FT) and parameter-efficient fine-tuning (PEFT). To address the memory and energy limitations inherent to mobile phones, we introduce system-level optimizations including parameter sharding, gradient accumulation, and energy-aware computation scheduling. We demonstrate the practicality of MobileFineTuner by fine-tuning GPT-2, Gemma 3, and Qwen 2.5 on real mobile phones. Extensive experiments and ablation studies validate the effectiveness of the proposed optimizations and establish MobileFineTuner as a viable foundation for future research on on-device LLM training.",https://arxiv.org/pdf/2512.08211v1,,False
Embodied Tree of Thoughts: Deliberate Manipulation Planning with Embodied World Model,09/12/2025,"Wenjiang Xu, Cindy Wang, Rui Fang, Mingkang Zhang, Lusong Li, Jing Xu, Jiayuan Gu, Zecui Zeng, Rui Chen","World models have emerged as a pivotal component in robot manipulation planning, enabling agents to predict future environmental states and reason about the consequences of actions before execution. While video-generation models are increasingly adopted, they often lack rigorous physical grounding, leading to hallucinations and a failure to maintain consistency in long-horizon physical constraints. To address these limitations, we propose Embodied Tree of Thoughts (EToT), a novel Real2Sim2Real planning framework that leverages a physics-based interactive digital twin as an embodied world model. EToT formulates manipulation planning as a tree search expanded through two synergistic mechanisms: (1) Priori Branching, which generates diverse candidate execution paths based on semantic and spatial analysis; and (2) Reflective Branching, which utilizes VLMs to diagnose execution failures within the simulator and iteratively refine the planning tree with corrective actions. By grounding high-level reasoning in a physics simulator, our framework ensures that generated plans adhere to rigid-body dynamics and collision constraints. We validate EToT on a suite of short- and long-horizon manipulation tasks, where it consistently outperforms baselines by effectively predicting physical dynamics and adapting to potential failures. Website at https://embodied-tree-of-thoughts.github.io .",https://arxiv.org/pdf/2512.08188v1,,False
Worst-case generation via minimax optimization in Wasserstein space,09/12/2025,"Xiuyuan Cheng, Yao Xie, Linglingzhi Zhu, Yunqin Zhu","Worst-case generation plays a critical role in evaluating robustness and stress-testing systems under distribution shifts, in applications ranging from machine learning models to power grids and medical prediction systems. We develop a generative modeling framework for worst-case generation for a pre-specified risk, based on min-max optimization over continuous probability distributions, namely the Wasserstein space. Unlike traditional discrete distributionally robust optimization approaches, which often suffer from scalability issues, limited generalization, and costly worst-case inference, our framework exploits the Brenier theorem to characterize the least favorable (worst-case) distribution as the pushforward of a transport map from a continuous reference measure, enabling a continuous and expressive notion of risk-induced generation beyond classical discrete DRO formulations. Based on the min-max formulation, we propose a Gradient Descent Ascent (GDA)-type scheme that updates the decision model and the transport map in a single loop, establishing global convergence guarantees under mild regularity assumptions and possibly without convexity-concavity. We also propose to parameterize the transport map using a neural network that can be trained simultaneously with the GDA iterations by matching the transported training samples, thereby achieving a simulation-free approach. The efficiency of the proposed method as a risk-induced worst-case generator is validated by numerical experiments on synthetic and image data.",https://arxiv.org/pdf/2512.08176v1,,False
Information-Dense Reasoning for Efficient and Auditable Security Alert Triage,09/12/2025,"Guangze Zhao, Yongzheng Zhang, Changbo Tian, Dan Xie, Hongri Liu, Bailing Wang","Security Operations Centers face massive, heterogeneous alert streams under minute-level service windows, creating the Alert Triage Latency Paradox: verbose reasoning chains ensure accuracy and compliance but incur prohibitive latency and token costs, while minimal chains sacrifice transparency and auditability. Existing solutions fail: signature systems are brittle, anomaly methods lack actionability, and fully cloud-hosted LLMs raise latency, cost, and privacy concerns. We propose AIDR, a hybrid cloud-edge framework that addresses this trade-off through constrained information-density optimization. The core innovation is gradient-based compression of reasoning chains to retain only decision-critical steps--minimal evidence sufficient to justify predictions while respecting token and latency budgets. We demonstrate that this approach preserves decision-relevant information while minimizing complexity. We construct compact datasets by distilling alerts into 3-5 high-information bullets (68% token reduction), train domain-specialized experts via LoRA, and deploy a cloud-edge architecture: a cloud LLM routes alerts to on-premises experts generating SOAR-ready JSON. Experiments demonstrate AIDR achieves higher accuracy and 40.6% latency reduction versus Chain-of-Thought, with robustness to data corruption and out-of-distribution generalization, enabling auditable and efficient SOC triage with full data residency compliance.",https://arxiv.org/pdf/2512.08169v1,,False
Multi-agent learning under uncertainty: Recurrence vs. concentration,09/12/2025,"Kyriakos Lotidis, Panayotis Mertikopoulos, Nicholas Bambos, Jose Blanchet","In this paper, we examine the convergence landscape of multi-agent learning under uncertainty. Specifically, we analyze two stochastic models of regularized learning in continuous games -- one in continuous and one in discrete time with the aim of characterizing the long-run behavior of the induced sequence of play. In stark contrast to deterministic, full-information models of learning (or models with a vanishing learning rate), we show that the resulting dynamics do not converge in general. In lieu of this, we ask instead which actions are played more often in the long run, and by how much. We show that, in strongly monotone games, the dynamics of regularized learning may wander away from equilibrium infinitely often, but they always return to its vicinity in finite time (which we estimate), and their long-run distribution is sharply concentrated around a neighborhood thereof. We quantify the degree of this concentration, and we show that these favorable properties may all break down if the underlying game is not strongly monotone -- underscoring in this way the limits of regularized learning in the presence of persistent randomness and uncertainty.",https://arxiv.org/pdf/2512.08132v1,,False
