Title,Publication Date,Author(s),Abstract,Link,DOI,Relevant
"From Sensors to Insight: Rapid, Edge-to-Core Application Development for Sensor-Driven Applications",04/05/2026,"Komal Thareja, Anirban Mandal, Ewa Deelman","Scientists increasingly rely on sensor-based data, yet transforming raw streams into insights across the edge-to-cloud continuum remains difficult. Provisioning heterogeneous infrastructure and managing execution on emerging platforms like Data Processing Units typically requires cross-domain expertise, creating significant barriers to rapid prototyping.
  This paper introduces an experience-driven methodology for the rapid development of sensor-driven applications. By combining pattern-based workflow engineering with AI-assisted development-implemented via Pegasus on the FABRIC testbed - we utilize an existing Orcasound hydrophone workflow as a reusable template. We introduce a pattern-based engineering methodology to generate and refine workflows for air quality, earthquake, and soil moisture monitoring. Furthermore, we show how these abstract structures are extended to edge resources through modular configuration and placement. Our evaluation focuses on user productivity and practical lessons rather than peak performance. Through these case studies, we illustrate how AI-assisted, pattern-based development lowers the entry barrier for non-experts and enables iterative exploration of sensor-driven applications across distributed infrastructures.",https://arxiv.org/pdf/2605.02859v1,,False
"(POSTER) From Sensors to Insight: Rapid, Edge-to-Core Application Development for Sensor-Driven Applications",04/05/2026,"Komal Thareja, Anirban Mandal, Ewa Deelman","Scientists increasingly rely on sensor-based data; however transforming raw streams into insights across the edge-to-cloud continuum remains difficult due to the breadth of expertise required to coordinate the necessary data and computation flow. This paper introduces a pattern-based, AI-assisted methodology for rapid development of sensor-driven applications. Using Pegasus workflows executing on the FABRIC testbed, we demonstrate a 5-step development loop that shifts workflow construction and deployment from code-first to intent-first design. Starting from an existing Orcasound hydrophone workflow as a reusable template, we generate and refine workflows for air quality, earthquake, and soil moisture monitoring applications. We further show how these workflows extend to edge resources-including BlueField-3 DPUs and Raspberry Pis-through configuration and placement rather than workflow redesign. Our evaluation, from the perspective of a novice Pegasus user, shows that AI-assisted pattern reuse compresses multi-stage workflow development to 1-1.5 days per workflow while preserving the rigor and portability of workflow-based execution.",https://arxiv.org/pdf/2605.02844v1,,False
The Bayesian Reflex: Online Learning as the Autonomic Nervous System of Modern and Future AI,04/05/2026,"Durba Bhattacharya, Sucharita Roy, Sourabh Bhattacharya","This chapter introduces the Bayesian reflex -- an analogy with the autonomic nervous system -- as a unifying framework for online learning in AI. Bayesian online algorithms automatically maintain equilibrium in dynamic environments via three mechanisms: belief maintenance through probabilistic representations, sequential updating via Bayes' theorem, and uncertainty-driven action balancing exploration and exploitation. We survey online Bayesian methods, highlighting two computational principles: the look-up table principle for sequential inference in function space, and the ellipsoidal decomposition framework for nearly exact i.i.d. sampling from arbitrary posteriors. These principles are generalized across dynamic emulation, nonparametric state-space models, circular time series, inverse regression for climate model evaluation, and deep architectures via Recursive Gaussian Processes. Decision-making is explored via Thompson sampling and restless bandits. We extend the framework to assess infinite series convergence (applied to climate dynamics and the Riemann Hypothesis), model prime number distributions leading to the discovery of 184 strong Mersenne prime candidates, detect stationarity, and characterize point processes. The Bayesian reflex provides a foundational infrastructure for adaptive AI that continuously learns in a complex world.",https://arxiv.org/pdf/2605.02825v1,,False
Online Generalised Predictive Coding,04/05/2026,"Mehran H. Z. Bazargani, Szymon Urbas, Adeel Razi, Thomas Brendan Murphy, Karl Friston","This paper introduces an extension of generalised filtering for online applications. Generalised filtering refers to data assimilation schemes that jointly infer latent states, learn unknown model parameters, and estimate uncertainty in an integrated framework -- e.g., estimate state and observation noise -- at the same time (i.e., triple estimation). This framework appears across disciplines under different names, including variational Kalman-Bucy filtering in engineering, generalised predictive coding in neuroscience, and Dynamic Expectation Maximisation (DEM) in time-series analysis. Here, we specialise DEM for ``online'' data assimilation, through a separation of temporal scales. We describe the variational principles and procedures that allow one to assimilate data in a way that allows for a slow updating of parameters and precisions, which contextualise fast Bayesian belief updating about the dynamic hidden states. Using numerical studies, we demonstrate the validity of online DEM (ODEM) using a non-linear -- and potentially chaotic -- generative model, to show that the ODEM scheme can track the latent states of the generative process, even when its functional form differs fundamentally from the dynamics of the generative model. Framed from a neuro-mimetic predictive coding perspective, ODEM offers a biologically inspired solution to online inference, learning, and uncertainty estimation in dynamic environments.",https://arxiv.org/pdf/2605.02675v1,,False
Pareto frontier of portfolio investment under volatility uncertainty and short-sale constraints market,04/05/2026,"Jing He, Shuzhen Yang","In this paper, we investigate a portfolio investment problem under volatility uncertainty and short-sale constraints market via sublinear expectation which is used to model volatility uncertainty. We assume the stocks admit volatility uncertainty. Thus the related portfolio has upper variance (maximum risk) and lower variance (minimum risk). By introducing a risk factor $w$ to conduct coupled modeling of the maximum and minimum risks, a simplified Sublinear Expectation Mean-Uncertainty Variance (SLE-MUV) model is constructed. Theoretically, we show that the Pareto frontier of the SLE-MUV model is a continuous convex curve, and its optimal solution can be expressed as a polynomial analytical expression with respect to the risk factor $w$. Empirically, we systematically test the practical performance of the SLE-MUV model and conduct comparative analysis with the traditional Mean-Variance (MV) model as the benchmark based on three sets of samples -- simulated generated data, data of the US stock market and the A-share market. The empirical results show that the SLE-MUV model can significantly improving the risk-adjusted return of the investment portfolio.",https://arxiv.org/pdf/2605.02666v1,,False
CARD: Coarse-to-fine Autoregressive Modeling with Radix-based Decomposition for Transferable Free Energy Estimation,04/05/2026,"Ziyang Yu, Yi He, Wenbing Huang, Wen Yan, Yang Liu","Estimating free energy differences quantifies thermodynamic preferences in molecular interactions, which is central to chemistry and drug discovery. Despite fruitful progress, existing methods still face key limitations: classical computational approaches remain prohibitively expensive due to their reliance on extensive molecular dynamics simulations, while deep learning-based methods are constrained by either less-expressive generative models or input dimensions tied to a specific system, resulting in negligible generalization. To address these challenges, we propose CARD, a generative framework that employs a novel radix-based decomposition to bijectively convert 3D coordinates into mixed discrete-continuous sequences, enabling coarse-to-fine autoregressive modeling with enhanced expressiveness. Notably, the model corresponds to a distribution with zero free energy, serving as a proposal for absolute free energy computation of arbitrary systems without relying on alchemical pathways. Experiments across diverse tasks demonstrate that CARD matches the accuracy of classical computational methods on unseen systems with diverse topologies, while achieving an approximately 40-fold speedup in inference.",https://arxiv.org/pdf/2605.02657v1,,False
On Training Large Language Models for Long-Horizon Tasks: An Empirical Study of Horizon Length,04/05/2026,"Sunghwan Kim, Junhee Cho, Beong-woo Kwak, Taeyoon Kwon, Liang Wang, Nan Yang, Xingxing Zhang, Furu Wei, Jinyoung Yeo","Large language models (LLMs) have shown promise as interactive agents that solve tasks through extended sequences of environment interactions. While prior work has primarily focused on system-level optimizations or algorithmic improvements, the role of task horizon length in shaping training dynamics remains poorly understood. In this work, we present a systematic empirical study that examines horizon length through controlled task constructions. Specifically, we construct controlled tasks in which agents face identical decision rules and reasoning structures, but differ only in the length of action sequences required for successful completion. Our results reveal that increasing horizon length alone constitutes a training bottleneck, inducing severe training instability driven by exploration difficulties and credit assignment challenges. We demonstrate that horizon reduction is a key principle to address this limitation, stabilizing training and achieving better performance in long-horizon tasks. Moreover, we find that horizon reduction is related to stronger generalization across horizon lengths: models trained under reduced horizons generalize more effectively to longer-horizon variants at inference time, a phenomenon we refer to as horizon generalization.",https://arxiv.org/pdf/2605.02572v1,,False
Beyond Specialization: Robust Reinforcement Learning Navigation via Procedural Map Generators,04/05/2026,"Christian Jestel, Nicolas Bach, Marvin Wiedemann, Jan Finke, Peter Detzner","Deep reinforcement learning (DRL) navigation policies often overfit to the structure of their training environments, as environmental diversity is typically constrained by the manual effort required to design diverse scenarios. While procedural map generation offers scalable diversity, no prior work systematically compares how different generator types affect policy generalization. We integrate four generators (sparse, maze, graph, and Wave Function Collapse) with guaranteed navigability into MuRoSim, a 2D simulator focusing on training efficiency for LiDAR-based navigation. We cross-evaluate five navigation policies on 1000 seeded maps per generator across three training seeds. Results show a strongly asymmetric cross-generator transfer: a specialist trained on sparse layouts falls to 3.3% success on mazes, whereas a policy trained on the combined generator set achieves 91.5 +/- 1.1% mean success. We further demonstrate that A* path-planner subgoal inputs are the dominant factor for robustness, raising success from the 90.2 +/- 1.4% feedforward baseline to 98.9 +/- 0.4% and outperforming GRU recurrence, which only improves the reactive baseline. The DRL policies outperform a classical Carrot+A* controller, which matches their success only at low speeds (1.0 m/s) but collapses to 24.9% at 2.0 m/s. This highlights learned speed adaptation as the decisive advantage of the learned approach. Real-world experiments on a RoboMaster confirm sim-to-real transfer in a cluttered arena, while a maze-like layout exposes remaining failure modes that recurrence helps mitigate.",https://arxiv.org/pdf/2605.02528v1,,False
A Novel Preprocessing-Driven Approach to Remaining Useful Life (RUL) Prediction Using Temporal Convolutional Networks (TCN),04/05/2026,"Florent Imbert, Tosin Adewumi, Hui Han","Accurate prediction of Remaining Useful Life (RUL) in aero-engines is vital for predictive maintenance, improved operational reliability, and reduced lifecycle costs. While deep learning approaches have demonstrated strong potential in this area, most existing methods focus primarily on model architecture design and treat input features uniformly, often neglecting the influence of data preprocessing. In this work, we propose a novel preprocessing pipeline that enhances RUL prediction by improving data quality and temporal representation before model training. Our approach leverages complete temporal sequences and generates RUL estimates at each timestep, enabling the model to capture fine-grained degradation dynamics and deliver continuous prognostic insights throughout the engine's operational life. To validate the effectiveness of the proposed pipeline, we conduct experiments on the NASA C-MAPSS dataset. Comparative evaluations against a suite of state-of-the-art neural models including CNN, RNN, LSTM, DCNN, TCN, BiGRU-TSAM, AGCNN, and ATCN, demonstrate that our approach consistently achieves superior accuracy and robustness in aero-engine RUL prediction. These results highlight the critical role of preprocessing in maximizing the effectiveness of neural prognostic models.",https://arxiv.org/pdf/2605.02507v1,10.1109/ICTAI66417.2025.00160,False
EngiAgent: Fully Connected Coordination of LLM Agents for Solving Open-ended Engineering Problems with Feasible Solutions,04/05/2026,"Xiyuan Zhou, Ruixi Zou, Xinlei Wang, Yuheng Cheng, Yan Xu, Junhua Zhao, Jinjin Gu","Engineering problem solving is central to real-world decision-making, requiring mathematical formulations that not only represent complex problems but also produce feasible solutions under data and physical constraints. Unlike mathematical problem solving, which operates on predefined formulations, engineering tasks demand open-ended analysis, feasibility-driven modeling, and iterative refinement. Although large language models (LLMs) have shown strong capabilities in reasoning and code generation, they often fail to ensure feasibility, which limits their applicability to engineering problem solving. To address this challenge, we propose EngiAgent, a multi-agent system with a fully connected coordinator that simulates expert workflows through specialized agents for problem analysis, modeling, verification, solving, and solution evaluation. The fully connected coordinator enables flexible feedback routing, overcoming the rigidity of prior pipeline-based reflection methods and ensuring feasibility at every stage of the process. This design not only improves robustness to diverse failure cases such as data extraction errors, constraint inconsistencies, and solver failures, but also enhances the overall quality of problem solving. Empirical results across four representative domains demonstrate that EngiAgent achieves substantial improvements in feasibility compared to prior approaches, establishing a new paradigm for feasibility-oriented engineering problem solving with LLMs. Our source code and data are available at https://github.com/AI4Engi/EngiAgent.",https://arxiv.org/pdf/2605.02289v1,,False
Variational Matrix-Learning Fourier Networks for Parametric Multiphysics Surrogates,04/05/2026,"Xinyu Li, Jianhua Zhang, Liang Chen","Multiphysics simulation is critical for system-technology co-optimization (STCO) in chiplet-based design, but repeated finite-element solutions of PDE-governed problems are computationally expensive in parametric design exploration. This paper proposes a variational matrix-learning Fourier network (VMLFN) for efficient parametric multiphysics surrogate modeling. VMLFN constructs a log-space sine neural representation with randomly sampled spectral frequencies, frequency-dependent decay regulation, and embedded Dirichlet boundary conditions. With fixed hidden-layer parameters, the output-layer weights are determined by reformulating the governing PDEs into variational weak forms and enforcing the stationarity condition of the resulting energy functional. This converts physics-informed training into a linear matrix-solving problem, requiring only first-order derivatives and avoiding both high-order automatic differentiation and penalty-coefficient tuning. A heuristic frequency-scanning algorithm is further introduced to select a problem-adaptive maximum frequency that covers the dominant spectral range of the target problem. The proposed method is validated on heat conduction, solid mechanics, and Helmholtz wave propagation problems. Results from five benchmark cases demonstrate that VMLFN delivers accurate full-field predictions with substantial speedup over conventional physics-informed neural networks and repeated finite-element simulations.",https://arxiv.org/pdf/2605.02280v1,,False
HELIX: Hybrid Encoding with Learnable Identity and Cross-dimensional Synthesis for Time Series Imputation,04/05/2026,"Fengming Zhang, Wenjie Du, Huan Zhang, Ke Yu, Shen Qu","Time series imputation benefits from leveraging cross-feature correlations, yet existing attention-based methods re-discover feature relationships at each layer, lacking persistent anchors to maintain consistent representations. To address this, we propose HELIX, which assigns each feature a learnable feature identity, a persistent embedding that captures intrinsic semantic properties throughout the network. Unlike graph-based methods that rely on predefined topology and assume homogeneous spatial relationships, HELIX learns arbitrary feature dependencies end-to-end from temporal co-variation, naturally handling datasets where features mix spatial locations with semantic variables. Integrated with hybrid temporal-feature attention, HELIX achieves the state-of-the-art performance, surpassing all 16 baselines on 5 public datasets across 21 experimental settings in our evaluation. Furthermore, our mechanistic analysis reveals that HELIX aligns learned feature identities and dependencies with latent physical and semantic structure progressively across layers, demonstrating that it more effectively translates cross-feature structure into imputation accuracy.",https://arxiv.org/pdf/2605.02278v1,,False
The Conversations Beneath the Code: Triadic Data for Long-Horizon Software Engineering Agents,04/05/2026,Yelin Kim,"Frontier software engineering agents have saturated short-horizon benchmarks while regressing on the work that constitutes senior engineering: long-horizon, multi-engineer, ambiguous-specification deliverables. This paper takes a position on what training data is needed to close the gap. The substrate for the next generation of SWE agents is neither larger GitHub scrapes nor more solo-agent trajectories nor -- sufficient by itself -- open human-AI dialogue logs. It is triadic data: synchronized capture of the human-human conversations where engineering context is formed, the human-AI sessions where that context is partially consumed, and the multi-week cross-functional work that surrounds both. We argue that the canonical instantiation of triadic data is two complementary products: long-horizon expert trajectories captured under stimulated-recall protocols, and simulated cross-functional companies -- instrumented teams of senior engineers, product managers, designers, and data scientists working through ambiguous deliverables on shared infrastructure. We further specify a four-tier evidence framework through which any such corpus -- triadic or otherwise -- must justify its quality to a fine-tuning researcher: mechanical verification, statistical corpus characterization, probe experiments, and pre-registered blind evaluation. We argue that this data is capturable in 12-18 months with methods already mature in adjacent fields, that it is the empirical key to four open questions in agent training, and that the field's near-term research agenda should include it explicitly.",https://arxiv.org/pdf/2605.02244v1,,False
MEMAUDIT: An Exact Package-Oracle Evaluation Protocol for Budgeted Long-Term LLM Memory Writing,04/05/2026,"Nishant Bhargava, Rodrigo Sobral Barrento","Long-term LLM agents must compress streams of past interactions into persistent memory before future queries are known. Existing evaluations usually measure final question-answering accuracy, which entangles memory writing with retrieval, prompting, and reader reasoning. We introduce MEMAUDIT, an exact packageoracle evaluation protocol for budgeted long-term memory writing. A MEMAUDIT package fixes an experience stream, candidate memory representations, storage costs, semantic evidence units, future-query requirements, and a budget, turning write-time memory selection into a finite auditable optimization problem with a certified denominator. We instantiate this protocol with a concave-over-modular semantic coverage objective under storage and one-representation-per-experience constraints, and compute exact package optima using branch-and-bound with MILP certification. Across controlled exact packages, validity-heavy stress tests, human-audited natural support slices, and exported Mem0, A-Mem, and Letta stores, MEMAUDIT separates representation quality, validity-state preservation, and budget-aware selection effects that end-to-end QA cannot localize. The resulting artifact provides reusable package generators, certified solvers, natural package exports, external-system scorers, and cached reproducibility metadata for evaluating what memory writers actually preserve under fixed storage budgets.",https://arxiv.org/pdf/2605.02199v1,,False
Trees and Graphs with Non Log-concave Dominating Set Sequence via AI Tools,04/05/2026,"Alina Du, Steven Heilman, Greta Panova","We give new examples of graphs and trees with dominating set sequences that are not log-concave. These examples were generated by PatternBoost, a transformer-based reinforcement learning software developed by Charton-Ellenberg-Wagner-Williamson. We also show: for any positive integer $m$, there exists a tree whose dominating set sequence is not log-concave for at least $m$ indices by modifying a similar construction of Bautista-Ramos for the independent set sequence. We show that a large class of caterpillar graphs has log-concave dominating set sequences. A continuous analogue of the sequence is also log-concave for all graphs.",https://arxiv.org/pdf/2605.02193v1,,False
