Title,Publication Date,Author(s),Abstract,Link,DOI,Relevant
RoboVIP: Multi-View Video Generation with Visual Identity Prompting Augments Robot Manipulation,08/01/2026,"Boyang Wang, Haoran Zhang, Shujie Zhang, Jinkun Hao, Mingda Jia, Qi Lv, Yucheng Mao, Zhaoyang Lyu, Jia Zeng, Xudong Xu, Jiangmiao Pang","The diversity, quantity, and quality of manipulation data are critical for training effective robot policies. However, due to hardware and physical setup constraints, collecting large-scale real-world manipulation data remains difficult to scale across diverse environments. Recent work uses text-prompt conditioned image diffusion models to augment manipulation data by altering the backgrounds and tabletop objects in the visual observations. However, these approaches often overlook the practical need for multi-view and temporally coherent observations required by state-of-the-art policy models. Further, text prompts alone cannot reliably specify the scene setup. To provide the diffusion model with explicit visual guidance, we introduce visual identity prompting, which supplies exemplar images as conditioning inputs to guide the generation of the desired scene setup. To this end, we also build a scalable pipeline to curate a visual identity pool from large robotics datasets. Using our augmented manipulation data to train downstream vision-language-action and visuomotor policy models yields consistent performance gains in both simulation and real-robot settings.",https://arxiv.org/pdf/2601.05241v1,,False
Robust Reasoning as a Symmetry-Protected Topological Phase,08/01/2026,Ilmo Sung,"Large language models suffer from ""hallucinations""-logical inconsistencies induced by semantic noise. We propose that current architectures operate in a ""Metric Phase,"" where causal order is vulnerable to spontaneous symmetry breaking. Here, we identify robust inference as an effective Symmetry-Protected Topological phase, where logical operations are formally isomorphic to non-Abelian anyon braiding, replacing fragile geometric interpolation with robust topological invariants. Empirically, we demonstrate a sharp topological phase transition: while Transformers and RNNs exhibit gapless decay, our Holonomic Network reveals a macroscopic ""mass gap,"" maintaining invariant fidelity below a critical noise threshold. Furthermore, in a variable-binding task on $S_{10}$ ($3.6 \times 10^6$ states) representing symbolic manipulation, we demonstrate holonomic generalization: the topological model maintains perfect fidelity extrapolating $100\times$ beyond training ($L=50 \to 5000$), consistent with a theoretically indefinite causal horizon, whereas Transformers lose logical coherence. Ablation studies indicate this protection emerges strictly from non-Abelian gauge symmetry. This provides strong evidence for a new universality class for logical reasoning, linking causal stability to the topology of the semantic manifold.",https://arxiv.org/pdf/2601.05240v1,,False
Stochastic Deep Learning: A Probabilistic Framework for Modeling Uncertainty in Structured Temporal Data,08/01/2026,James Rice,"I propose a novel framework that integrates stochastic differential equations (SDEs) with deep generative models to improve uncertainty quantification in machine learning applications involving structured and temporal data. This approach, termed Stochastic Latent Differential Inference (SLDI), embeds an Itô SDE in the latent space of a variational autoencoder, allowing for flexible, continuous-time modeling of uncertainty while preserving a principled mathematical foundation. The drift and diffusion terms of the SDE are parameterized by neural networks, enabling data-driven inference and generalizing classical time series models to handle irregular sampling and complex dynamic structure.
  A central theoretical contribution is the co-parameterization of the adjoint state with a dedicated neural network, forming a coupled forward-backward system that captures not only latent evolution but also gradient dynamics. I introduce a pathwise-regularized adjoint loss and analyze variance-reduced gradient flows through the lens of stochastic calculus, offering new tools for improving training stability in deep latent SDEs. My paper unifies and extends variational inference, continuous-time generative modeling, and control-theoretic optimization, providing a rigorous foundation for future developments in stochastic probabilistic machine learning.",https://arxiv.org/pdf/2601.05227v1,,False
Internal Representations as Indicators of Hallucinations in Agent Tool Selection,08/01/2026,"Kait Healy, Bharathi Srinivasan, Visakh Madathil, Jing Wu","Large Language Models (LLMs) have shown remarkable capabilities in tool calling and tool usage, but suffer from hallucinations where they choose incorrect tools, provide malformed parameters and exhibit 'tool bypass' behavior by performing simulations and generating outputs instead of invoking specialized tools or external systems. This undermines the reliability of LLM based agents in production systems as it leads to inconsistent results, and bypasses security and audit controls. Such hallucinations in agent tool selection require early detection and error handling. Unlike existing hallucination detection methods that require multiple forward passes or external validation, we present a computationally efficient framework that detects tool-calling hallucinations in real-time by leveraging LLMs' internal representations during the same forward pass used for generation. We evaluate this approach on reasoning tasks across multiple domains, demonstrating strong detection performance (up to 86.4\% accuracy) while maintaining real-time inference capabilities with minimal computational overhead, particularly excelling at detecting parameter-level hallucinations and inappropriate tool selections, critical for reliable agent deployment.",https://arxiv.org/pdf/2601.05214v1,,False
SimuAgent: An LLM-Based Simulink Modeling Assistant Enhanced with Reinforcement Learning,08/01/2026,"Yanchang Liang, Xiaowei Zhao","Large language models (LLMs) have revolutionized text-based code automation, but their potential in graph-oriented engineering workflows remains under-explored. We introduce SimuAgent, an LLM-powered modeling and simulation agent tailored for Simulink. SimuAgent replaces verbose XML with a concise, dictionary-style Python representation, dramatically cutting token counts, improving interpretability, and enabling fast, in-process simulation. A lightweight plan-execute architecture, trained in two stages, equips the agent with both low-level tool skills and high-level design reasoning. To tackle sparse rewards in long-horizon tasks, we propose Reflection-GRPO (ReGRPO), which augments Group Relative Policy Optimization (GRPO) with self-reflection traces that supply rich intermediate feedback, accelerating convergence and boosting robustness. Experiments on SimuBench, our newly released benchmark comprising 5300 multi-domain modeling tasks, show that a Qwen2.5-7B model fine-tuned with SimuAgent converges faster and achieves higher modeling accuracy than standard RL baselines, and even surpasses GPT-4o when evaluated with few-shot prompting on the same benchmark. Ablations confirm that the two-stage curriculum and abstract-reconstruct data augmentation further enhance generalization. SimuAgent trains and runs entirely on-premise with modest hardware, delivering a privacy-preserving, cost-effective solution for industrial model-driven engineering. SimuAgent bridges the gap between LLMs and graphical modeling environments, offering a practical solution for AI-assisted engineering design in industrial settings.",https://arxiv.org/pdf/2601.05187v1,,False
ROOFS: RObust biOmarker Feature Selection,08/01/2026,"Anastasiia Bakhmach, Paul Dufossé, Andrea Vaglio, Florence Monville, Laurent Greillier, Fabrice Barlési, Sébastien Benzekry","Feature selection (FS) is essential for biomarker discovery and in the analysis of biomedical datasets. However, challenges such as high-dimensional feature space, low sample size, multicollinearity, and missing values make FS non-trivial. Moreover, FS performances vary across datasets and predictive tasks. We propose roofs, a Python package available at https://gitlab.inria.fr/compo/roofs, designed to help researchers in the choice of FS method adapted to their problem. Roofs benchmarks multiple FS methods on the user's data and generates reports that summarize a comprehensive set of evaluation metrics, including downstream predictive performance estimated using optimism correction, stability, reliability of individual features, and true positive and false positive rates assessed on semi-synthetic data with a simulated outcome. We demonstrate the utility of roofs on data from the PIONeeR clinical trial, aimed at identifying predictors of resistance to anti-PD-(L)1 immunotherapy in lung cancer. The PIONeeR dataset contained 374 multi-source blood and tumor biomarkers from 435 patients. A reduced subset of 214 features was obtained through iterative variance inflation factor pre-filtering. Of the 34 FS methods gathered in roofs, we evaluated 23 in combination with 11 classifiers (253 models in total) and identified a filter based on the union of Benjamini-Hochberg false discovery rate-adjusted p-values from t-test and logistic regression as the optimal approach, outperforming other methods including the widely used LASSO. We conclude that comprehensive benchmarking with roofs has the potential to improve the robustness and reproducibility of FS discoveries and increase the translational value of clinical models.",https://arxiv.org/pdf/2601.05151v1,,False
Token-Level LLM Collaboration via FusionRoute,08/01/2026,"Nuoya Xiong, Yuhang Zhou, Hanqing Zeng, Zhaorun Chen, Furong Huang, Shuchao Bi, Lizhu Zhang, Zhuokai Zhao","Large language models (LLMs) exhibit strengths across diverse domains. However, achieving strong performance across these domains with a single general-purpose model typically requires scaling to sizes that are prohibitively expensive to train and deploy. On the other hand, while smaller domain-specialized models are much more efficient, they struggle to generalize beyond their training distributions. To address this dilemma, we propose FusionRoute, a robust and effective token-level multi-LLM collaboration framework in which a lightweight router simultaneously (i) selects the most suitable expert at each decoding step and (ii) contributes a complementary logit that refines or corrects the selected expert's next-token distribution via logit addition. Unlike existing token-level collaboration methods that rely solely on fixed expert outputs, we provide a theoretical analysis showing that pure expert-only routing is fundamentally limited: unless strong global coverage assumptions hold, it cannot in general realize the optimal decoding policy. By augmenting expert selection with a trainable complementary generator, FusionRoute expands the effective policy class and enables recovery of optimal value functions under mild conditions. Empirically, across both Llama-3 and Gemma-2 families and diverse benchmarks spanning mathematical reasoning, code generation, and instruction following, FusionRoute outperforms both sequence- and token-level collaboration, model merging, and direct fine-tuning, while remaining competitive with domain experts on their respective tasks.",https://arxiv.org/pdf/2601.05106v1,,False
"Quantitative mapping from conventional MRI using self-supervised physics-guided deep learning: applications to a large-scale, clinically heterogeneous dataset",08/01/2026,"Jelmer van Lune, Stefano Mandija, Oscar van der Heide, Matteo Maspero, Martin B. Schilder, Jan Willem Dankbaar, Cornelis A. T. van den Berg, Alessandro Sbrizzi","Magnetic resonance imaging (MRI) is a cornerstone of clinical neuroimaging, yet conventional MRIs provide qualitative information heavily dependent on scanner hardware and acquisition settings. While quantitative MRI (qMRI) offers intrinsic tissue parameters, the requirement for specialized acquisition protocols and reconstruction algorithms restricts its availability and impedes large-scale biomarker research. This study presents a self-supervised physics-guided deep learning framework to infer quantitative T1, T2, and proton-density (PD) maps directly from widely available clinical conventional T1-weighted, T2-weighted, and FLAIR MRIs. The framework was trained and evaluated on a large-scale, clinically heterogeneous dataset comprising 4,121 scan sessions acquired at our institution over six years on four different 3 T MRI scanner systems, capturing real-world clinical variability. The framework integrates Bloch-based signal models directly into the training objective. Across more than 600 test sessions, the generated maps exhibited white matter and gray matter values consistent with literature ranges. Additionally, the generated maps showed invariance to scanner hardware and acquisition protocol groups, with inter-group coefficients of variation $\leq$ 1.1%. Subject-specific analyses demonstrated excellent voxel-wise reproducibility across scanner systems and sequence parameters, with Pearson $r$ and concordance correlation coefficients exceeding 0.82 for T1 and T2. Mean relative voxel-wise differences were low across all quantitative parameters, especially for T2 ($<$ 6%). These results indicate that the proposed framework can robustly transform diverse clinical conventional MRI data into quantitative maps, potentially paving the way for large-scale quantitative biomarker research.",https://arxiv.org/pdf/2601.05063v1,,False
From Stories to Cities to Games: A Qualitative Evaluation of Behaviour Planning,08/01/2026,"Mustafa F. Abdelwahed, Joan Espasa, Alice Toniolo, Ian P. Gent","The primary objective of a diverse planning approach is to generate a set of plans that are distinct from one another. Such an approach is applied in a variety of real-world domains, including risk management, automated stream data analysis, and malware detection. More recently, a novel diverse planning paradigm, referred to as behaviour planning, has been proposed. This approach extends earlier methods by explicitly incorporating a diversity model into the planning process and supporting multiple planning categories. In this paper, we demonstrate the usefulness of behaviour planning in real-world settings by presenting three case studies. The first case study focuses on storytelling, the second addresses urban planning, and the third examines game evaluation.",https://arxiv.org/pdf/2601.04911v1,,False
DVD: A Robust Method for Detecting Variant Contamination in Large Language Model Evaluation,08/01/2026,"Renzhao Liang, Jingru Chen, Bo Jia, Bo Deng, Chenggang Xie, Yidong Wang, Ke Jin, Xin Wang, Linfeng Zhang, Cunxiang Wang","Evaluating large language models (LLMs) is increasingly confounded by \emph{variant contamination}: the training corpus contains semantically equivalent yet lexically or syntactically altered versions of test items. Unlike verbatim leakage, these paraphrased or structurally transformed variants evade existing detectors based on sampling consistency or perplexity, thereby inflating benchmark scores via memorization rather than genuine reasoning. We formalize this problem and introduce \textbf{DVD} (\textbf{D}etection via \textbf{V}ariance of generation \textbf{D}istribution), a single-sample detector that models the local output distribution induced by temperature sampling. Our key insight is that contaminated items trigger alternation between a \emph{memory-adherence} state and a \emph{perturbation-drift} state, yielding abnormally high variance in the synthetic difficulty of low-probability tokens; uncontaminated items remain in drift with comparatively smooth variance. We construct the first benchmark for variant contamination across two domains Omni-MATH and SuperGPQA by generating and filtering semantically equivalent variants, and simulate contamination via fine-tuning models of different scales and architectures (Qwen2.5 and Llama3.1). Across datasets and models, \textbf{DVD} consistently outperforms perplexity-based, Min-$k$\%++, edit-distance (CDD), and embedding-similarity baselines, while exhibiting strong robustness to hyperparameters. Our results establish variance of the generation distribution as a principled and practical fingerprint for detecting variant contamination in LLM evaluation.",https://arxiv.org/pdf/2601.04895v1,,False
Token Maturation: Autoregressive Language Generation via Continuous Token Dynamics,08/01/2026,Oshri Naparstek,"Autoregressive language models are conventionally defined over discrete token sequences, committing to a specific token at every generation step. This early discretization forces uncertainty to be resolved through token-level sampling, often leading to instability, repetition, and sensitivity to decoding heuristics.
  In this work, we introduce a continuous autoregressive formulation of language generation in which tokens are represented as continuous vectors that \emph{mature} over multiple update steps before being discretized. Rather than sampling tokens, the model evolves continuous token representations through a deterministic dynamical process, committing to a discrete token only when the representation has sufficiently converged. Discrete text is recovered via hard decoding, while uncertainty is maintained and resolved in the continuous space.
  We show that this maturation process alone is sufficient to produce coherent and diverse text using deterministic decoding (argmax), without reliance on token-level sampling, diffusion-style denoising, or auxiliary stabilization mechanisms. Additional perturbations, such as stochastic dynamics or history smoothing, can be incorporated naturally but are not required for the model to function.
  To our knowledge, this is the first autoregressive language model that generates text by evolving continuous token representations to convergence prior to discretization, enabling stable generation without token-level sampling.",https://arxiv.org/pdf/2601.04854v1,,False
A zone-based training approach for last-mile routing using Graph Neural Networks and Pointer Networks,08/01/2026,"Àngel Ruiz-Fas, Carlos Granell, José Francisco Ramos, Joaquín Huerta, Sergio Trilles","Rapid e-commerce growth has pushed last-mile delivery networks to their limits, where small routing gains translate into lower costs, faster service, and fewer emissions. Classical heuristics struggle to adapt when travel times are highly asymmetric (e.g., one-way streets, congestion). A deep learning-based approach to the last-mile routing problem is presented to generate geographical zones composed of stop sequences to minimize last-mile delivery times.
  The presented approach is an encoder-decoder architecture. Each route is represented as a complete directed graph whose nodes are stops and whose edge weights are asymmetric travel times. A Graph Neural Network encoder produces node embeddings that captures the spatial relationships between stops. A Pointer Network decoder then takes the embeddings and the route's start node to sequentially select the next stops, assigning a probability to each unvisited node as the next destination.
  Cells of a Discrete Global Grid System which contain route stops in the training data are obtained and clustered to generate geographical zones of similar size in which the process of training and inference are divided. Subsequently, a different instance of the model is trained per zone only considering the stops of the training routes which are included in that zone.
  This approach is evaluated using the Los Angeles routes from the 2021 Amazon Last Mile Routing Challenge. Results from general and zone-based training are compared, showing a reduction in the average predicted route length in the zone-based training compared to the general training. The performance improvement of the zone-based approach becomes more pronounced as the number of stops per route increases.",https://arxiv.org/pdf/2601.04705v1,,False
LAMB: LLM-based Audio Captioning with Modality Gap Bridging via Cauchy-Schwarz Divergence,08/01/2026,"Hyeongkeun Lee, Jongmin Choi, KiHyun Nam, Joon Son Chung","Automated Audio Captioning aims to describe the semantic content of input audio. Recent works have employed large language models (LLMs) as a text decoder to leverage their reasoning capabilities. However, prior approaches that project audio features into the LLM embedding space without considering cross-modal alignment fail to fully utilize these capabilities. To address this, we propose LAMB, an LLM-based audio captioning framework that bridges the modality gap between audio embeddings and the LLM text embedding space. LAMB incorporates a Cross-Modal Aligner that minimizes Cauchy-Schwarz divergence while maximizing mutual information, yielding tighter alignment between audio and text at both global and token levels. We further design a Two-Stream Adapter that extracts semantically enriched audio embeddings, thereby delivering richer information to the Cross-Modal Aligner. Finally, leveraging the aligned audio embeddings, a proposed Token Guide directly computes scores within the LLM text embedding space to steer the output logits of generated captions. Experimental results confirm that our framework strengthens the reasoning capabilities of the LLM decoder, achieving state-of-the-art performance on AudioCaps.",https://arxiv.org/pdf/2601.04658v1,,False
"Autonomous Agents on Blockchains: Standards, Execution Models, and Trust Boundaries",08/01/2026,Saad Alqithami,"Advances in large language models have enabled agentic AI systems that can reason, plan, and interact with external tools to execute multi-step workflows, while public blockchains have evolved into a programmable substrate for value transfer, access control, and verifiable state transitions. Their convergence introduces a high-stakes systems challenge: designing standard, interoperable, and secure interfaces that allow agents to observe on-chain state, formulate transaction intents, and authorize execution without exposing users, protocols, or organizations to unacceptable security, governance, or economic risks. This survey systematizes the emerging landscape of agent-blockchain interoperability through a systematic literature review, identifying 317 relevant works from an initial pool of over 3000 records. We contribute a five-part taxonomy of integration patterns spanning read-only analytics, simulation and intent generation, delegated execution, autonomous signing, and multi-agent workflows; a threat model tailored to agent-driven transaction pipelines that captures risks ranging from prompt injection and policy misuse to key compromise, adversarial execution dynamics, and multi-agent collusion; and a comparative capability matrix analyzing more than 20 representative systems across 13 dimensions, including custody models, permissioning, policy enforcement, observability, and recovery. Building on the gaps revealed by this analysis, we outline a research roadmap centered on two interface abstractions: a Transaction Intent Schema for portable and unambiguous goal specification, and a Policy Decision Record for auditable, verifiable policy enforcement across execution environments. We conclude by proposing a reproducible evaluation suite and benchmarks for assessing the safety, reliability, and economic robustness of agent-mediated on-chain execution.",https://arxiv.org/pdf/2601.04583v1,,False
Reasoning Over Space: Enabling Geographic Reasoning for LLM-Based Generative Next POI Recommendation,08/01/2026,"Dongyi Lv, Qiuyu Ding, Heng-Da Xu, Zhaoxu Sun, Zhi Wang, Feng Xiong, Mu Xu","Generative recommendation with large language models (LLMs) reframes prediction as sequence generation, yet existing LLM-based recommenders remain limited in leveraging geographic signals that are crucial in mobility and local-services scenarios. Here, we present Reasoning Over Space (ROS), a framework that utilizes geography as a vital decision variable within the reasoning process. ROS introduces a Hierarchical Spatial Semantic ID (SID) that discretizes coarse-to-fine locality and POI semantics into compositional tokens, and endows LLM with a three-stage Mobility Chain-of-Thought (CoT) paradigm that models user personality, constructs an intent-aligned candidate space, and performs locality informed pruning. We further align the model with real world geography via spatial-guided Reinforcement Learning (RL). Experiments on three widely used location-based social network (LBSN) datasets show that ROS achieves over 10% relative gains in hit rate over strongest LLM-based baselines and improves cross-city transfer, despite using a smaller backbone model.",https://arxiv.org/pdf/2601.04562v1,,False
