Title,Publication Date,Author(s),Abstract,Link,DOI,Relevant
Completely Weakly Supervised Class-Incremental Learning for Semantic Segmentation,16/05/2025,"David Minkwan Kim, Soeun Lee, Byeongkeun Kang","This work addresses the task of completely weakly supervised
class-incremental learning for semantic segmentation to learn segmentation for
both base and additional novel classes using only image-level labels. While
class-incremental semantic segmentation (CISS) is crucial for handling diverse
and newly emerging objects in the real world, traditional CISS methods require
expensive pixel-level annotations for training. To overcome this limitation,
partially weakly-supervised approaches have recently been proposed. However, to
the best of our knowledge, this is the first work to introduce a completely
weakly-supervised method for CISS. To achieve this, we propose to generate
robust pseudo-labels by combining pseudo-labels from a localizer and a sequence
of foundation models based on their uncertainty. Moreover, to mitigate
catastrophic forgetting, we introduce an exemplar-guided data augmentation
method that generates diverse images containing both previous and novel classes
with guidance. Finally, we conduct experiments in three common experimental
settings: 15-5 VOC, 10-10 VOC, and COCO-to-VOC, and in two scenarios: disjoint
and overlap. The experimental results demonstrate that our completely weakly
supervised method outperforms even partially weakly supervised methods in the
15-5 VOC and 10-10 VOC settings while achieving competitive accuracy in the
COCO-to-VOC setting.",http://arxiv.org/pdf/2505.10781v1,,False
Context-Aware Probabilistic Modeling with LLM for Multimodal Time Series Forecasting,16/05/2025,"Yueyang Yao, Jiajun Li, Xingyuan Dai, MengMeng Zhang, Xiaoyan Gong, Fei-Yue Wang, Yisheng Lv","Time series forecasting is important for applications spanning energy
markets, climate analysis, and traffic management. However, existing methods
struggle to effectively integrate exogenous texts and align them with the
probabilistic nature of large language models (LLMs). Current approaches either
employ shallow text-time series fusion via basic prompts or rely on
deterministic numerical decoding that conflict with LLMs' token-generation
paradigm, which limits contextual awareness and distribution modeling. To
address these limitations, we propose CAPTime, a context-aware probabilistic
multimodal time series forecasting method that leverages text-informed
abstraction and autoregressive LLM decoding. Our method first encodes temporal
patterns using a pretrained time series encoder, then aligns them with textual
contexts via learnable interactions to produce joint multimodal
representations. By combining a mixture of distribution experts with frozen
LLMs, we enable context-aware probabilistic forecasting while preserving LLMs'
inherent distribution modeling capabilities. Experiments on diverse time series
forecasting tasks demonstrate the superior accuracy and generalization of
CAPTime, particularly in multimodal scenarios. Additional analysis highlights
its robustness in data-scarce scenarios through hybrid probabilistic decoding.",http://arxiv.org/pdf/2505.10774v1,,False
