Title,Publication Date,Author(s),Abstract,Link,DOI,Relevant
Reinforcement Learning for AMR Charging Decisions: The Impact of Reward and Action Space Design,16/05/2025,"Janik Bischoff, Alexandru Rinciog, Anne Meyer","We propose a novel reinforcement learning (RL) design to optimize the
charging strategy for autonomous mobile robots in large-scale block stacking
warehouses. RL design involves a wide array of choices that can mostly only be
evaluated through lengthy experimentation. Our study focuses on how different
reward and action space configurations, ranging from flexible setups to more
guided, domain-informed design configurations, affect the agent performance.
Using heuristic charging strategies as a baseline, we demonstrate the
superiority of flexible, RL-based approaches in terms of service times.
Furthermore, our findings highlight a trade-off: While more open-ended designs
are able to discover well-performing strategies on their own, they may require
longer convergence times and are less stable, whereas guided configurations
lead to a more stable learning process but display a more limited
generalization potential. Our contributions are threefold. First, we extend
SLAPStack, an open-source, RL-compatible simulation-framework to accommodate
charging strategies. Second, we introduce a novel RL design for tackling the
charging strategy problem. Finally, we introduce several novel adaptive
baseline heuristics and reproducibly evaluate the design using a Proximal
Policy Optimization agent and varying different design configurations, with a
focus on reward.",http://arxiv.org/pdf/2505.11136v1,,False
Scalability of Reinforcement Learning Methods for Dispatching in Semiconductor Frontend Fabs: A Comparison of Open-Source Models with Real Industry Datasets,16/05/2025,"Patrick Stöckermann, Henning Südfeld, Alessandro Immordino, Thomas Altenmüller, Marc Wegmann, Martin Gebser, Konstantin Schekotihin, Georg Seidel, Chew Wye Chan, Fei Fei Zhang","Benchmark datasets are crucial for evaluating approaches to scheduling or
dispatching in the semiconductor industry during the development and deployment
phases. However, commonly used benchmark datasets like the Minifab or SMT2020
lack the complex details and constraints found in real-world scenarios. To
mitigate this shortcoming, we compare open-source simulation models with a real
industry dataset to evaluate how optimization methods scale with different
levels of complexity. Specifically, we focus on Reinforcement Learning methods,
performing optimization based on policy-gradient and Evolution Strategies. Our
research provides insights into the effectiveness of these optimization methods
and their applicability to realistic semiconductor frontend fab simulations. We
show that our proposed Evolution Strategies-based method scales much better
than a comparable policy-gradient-based approach. Moreover, we identify the
selection and combination of relevant bottleneck tools to control by the agent
as crucial for an efficient optimization. For the generalization across
different loading scenarios and stochastic tool failure patterns, we achieve
advantages when utilizing a diverse training dataset. While the overall
approach is computationally expensive, it manages to scale well with the number
of CPU cores used for training. For the real industry dataset, we achieve an
improvement of up to 4% regarding tardiness and up to 1% regarding throughput.
For the less complex open-source models Minifab and SMT2020, we observe
double-digit percentage improvement in tardiness and single digit percentage
improvement in throughput by use of Evolution Strategies.",http://arxiv.org/pdf/2505.11135v1,,False
PhiNet v2: A Mask-Free Brain-Inspired Vision Foundation Model from Video,16/05/2025,"Makoto Yamada, Kian Ming A. Chai, Ayoub Rhim, Satoki Ishikawa, Mohammad Sabokrou, Yao-Hung Hubert Tsai","Recent advances in self-supervised learning (SSL) have revolutionized
computer vision through innovative architectures and learning objectives, yet
they have not fully leveraged insights from biological visual processing
systems. Recently, a brain-inspired SSL model named PhiNet was proposed; it is
based on a ResNet backbone and operates on static image inputs with strong
augmentation. In this paper, we introduce PhiNet v2, a novel Transformer-based
architecture that processes temporal visual input (that is, sequences of
images) without relying on strong augmentation. Our model leverages variational
inference to learn robust visual representations from continuous input streams,
similar to human visual processing. Through extensive experimentation, we
demonstrate that PhiNet v2 achieves competitive performance compared to
state-of-the-art vision foundation models, while maintaining the ability to
learn from sequential input without strong data augmentation. This work
represents a significant step toward more biologically plausible computer
vision systems that process visual information in a manner more closely aligned
with human cognitive processes.",http://arxiv.org/pdf/2505.11129v1,,False
Conditioning Matters: Training Diffusion Policies is Faster Than You Think,16/05/2025,"Zibin Dong, Yicheng Liu, Yinchuan Li, Hang Zhao, Jianye Hao","Diffusion policies have emerged as a mainstream paradigm for building
vision-language-action (VLA) models. Although they demonstrate strong robot
control capabilities, their training efficiency remains suboptimal. In this
work, we identify a fundamental challenge in conditional diffusion policy
training: when generative conditions are hard to distinguish, the training
objective degenerates into modeling the marginal action distribution, a
phenomenon we term loss collapse. To overcome this, we propose Cocos, a simple
yet general solution that modifies the source distribution in the conditional
flow matching to be condition-dependent. By anchoring the source distribution
around semantics extracted from condition inputs, Cocos encourages stronger
condition integration and prevents the loss collapse. We provide theoretical
justification and extensive empirical results across simulation and real-world
benchmarks. Our method achieves faster convergence and higher success rates
than existing approaches, matching the performance of large-scale pre-trained
VLAs using significantly fewer gradient steps and parameters. Cocos is
lightweight, easy to implement, and compatible with diverse policy
architectures, offering a general-purpose improvement to diffusion policy
training.",http://arxiv.org/pdf/2505.11123v1,,False
Think Twice Before You Act: Enhancing Agent Behavioral Safety with Thought Correction,16/05/2025,"Changyue Jiang, Xudong Pan, Min Yang","LLM-based autonomous agents possess capabilities such as reasoning, tool
invocation, and environment interaction, enabling the execution of complex
multi-step tasks. The internal reasoning process, i.e., thought, of behavioral
trajectory significantly influences tool usage and subsequent actions but can
introduce potential risks. Even minor deviations in the agent's thought may
trigger cascading effects leading to irreversible safety incidents. To address
the safety alignment challenges in long-horizon behavioral trajectories, we
propose Thought-Aligner, a plug-in dynamic thought correction module. Utilizing
a lightweight and resource-efficient model, Thought-Aligner corrects each
high-risk thought on the fly before each action execution. The corrected
thought is then reintroduced to the agent, ensuring safer subsequent decisions
and tool interactions. Importantly, Thought-Aligner modifies only the reasoning
phase without altering the underlying agent framework, making it easy to deploy
and widely applicable to various agent frameworks. To train the Thought-Aligner
model, we construct an instruction dataset across ten representative scenarios
and simulate ReAct execution trajectories, generating 5,000 diverse
instructions and more than 11,400 safe and unsafe thought pairs. The model is
fine-tuned using contrastive learning techniques. Experiments across three
agent safety benchmarks involving 12 different LLMs demonstrate that
Thought-Aligner raises agent behavioral safety from approximately 50% in the
unprotected setting to 90% on average. Additionally, Thought-Aligner maintains
response latency below 100ms with minimal resource usage, demonstrating its
capability for efficient deployment, broad applicability, and timely
responsiveness. This method thus provides a practical dynamic safety solution
for the LLM-based agents.",http://arxiv.org/pdf/2505.11063v1,,False
Conceptual framework for the application of deep neural networks to surface composition reconstruction from Mercury's exospheric data,16/05/2025,"Adrian Kazakov, Anna Milillo, Alessandro Mura, Stavro Ivanovski, Valeria Mangano, Alessandro Aronica, Elisabetta De Angelis, Pier Paolo Di Bartolomeo, Alessandro Brin, Luca Colasanti, Miguel Escalona-Moran, Francesco Lazzarotto, Stefano Massetti, Martina Moroni, Raffaella Noschese, Fabrizio Nuccilli, Stefano Orsini, Christina Plainaki, Rosanna Rispoli, Roberto Sordini, Mirko Stumpo, Nello Vertolli","Surface information derived from exospheric measurements at planetary bodies
complements surface mapping provided by dedicated imagers, offering critical
insights into surface release processes, interactions within the planetary
environment, space weathering, and planetary evolution. This study explores the
feasibility of deriving Mercury's regolith elemental composition from in-situ
measurements of its neutral exosphere using deep neural networks (DNNs). We
present a supervised feed-forward DNN architecture - a multilayer perceptron
(MLP) - that, starting from exospheric densities and proton precipitation
fluxes, predicts the chemical elements of the surface regolith below. It serves
as an estimator for the surface-exosphere interaction and the processes leading
to exosphere formation. Because the DNN requires a comprehensive exospheric
dataset not available from previous missions, this study uses simulated
exosphere components and simulated drivers. Extensive training and testing
campaigns demonstrate the MLP's ability to accurately predict and reconstruct
surface composition maps from these simulated measurements. Although this
initial version does not aim to reproduce Mercury's actual surface composition,
it provides a proof of concept, showcasing the algorithm's robustness and
capacity for handling complex datasets to create estimators for exospheric
generation models. Moreover, our tests reveal substantial potential for further
development, suggesting that this method could significantly enhance the
analysis of complex surface-exosphere interactions and complement planetary
exosphere models. This work anticipates applying the approach to data from the
BepiColombo mission, specifically the SERENA package, whose nominal phase
begins in 2027.",http://arxiv.org/pdf/2505.11053v1,10.5281/zenodo.15394849 10.5281/zenodo.15425584,False
DexGarmentLab: Dexterous Garment Manipulation Environment with Generalizable Policy,16/05/2025,"Yuran Wang, Ruihai Wu, Yue Chen, Jiarui Wang, Jiaqi Liang, Ziyu Zhu, Haoran Geng, Jitendra Malik, Pieter Abbeel, Hao Dong","Garment manipulation is a critical challenge due to the diversity in garment
categories, geometries, and deformations. Despite this, humans can effortlessly
handle garments, thanks to the dexterity of our hands. However, existing
research in the field has struggled to replicate this level of dexterity,
primarily hindered by the lack of realistic simulations of dexterous garment
manipulation. Therefore, we propose DexGarmentLab, the first environment
specifically designed for dexterous (especially bimanual) garment manipulation,
which features large-scale high-quality 3D assets for 15 task scenarios, and
refines simulation techniques tailored for garment modeling to reduce the
sim-to-real gap. Previous data collection typically relies on teleoperation or
training expert reinforcement learning (RL) policies, which are labor-intensive
and inefficient. In this paper, we leverage garment structural correspondence
to automatically generate a dataset with diverse trajectories using only a
single expert demonstration, significantly reducing manual intervention.
However, even extensive demonstrations cannot cover the infinite states of
garments, which necessitates the exploration of new algorithms. To improve
generalization across diverse garment shapes and deformations, we propose a
Hierarchical gArment-manipuLation pOlicy (HALO). It first identifies
transferable affordance points to accurately locate the manipulation area, then
generates generalizable trajectories to complete the task. Through extensive
experiments and detailed analysis of our method and baseline, we demonstrate
that HALO consistently outperforms existing methods, successfully generalizing
to previously unseen instances even with significant variations in shape and
deformation where others fail. Our project page is available at:
https://wayrise.github.io/DexGarmentLab/.",http://arxiv.org/pdf/2505.11032v1,,False
Logo-LLM: Local and Global Modeling with Large Language Models for Time Series Forecasting,16/05/2025,"Wenjie Ou, Zhishuo Zhao, Dongyue Guo, Yi Lin","Time series forecasting is critical across multiple domains, where time
series data exhibits both local patterns and global dependencies. While
Transformer-based methods effectively capture global dependencies, they often
overlook short-term local variations in time series. Recent methods that adapt
large language models (LLMs) into time series forecasting inherit this
limitation by treating LLMs as black-box encoders, relying solely on the
final-layer output and underutilizing hierarchical representations. To address
this limitation, we propose Logo-LLM, a novel LLM-based framework that
explicitly extracts and models multi-scale temporal features from different
layers of a pre-trained LLM. Through empirical analysis, we show that shallow
layers of LLMs capture local dynamics in time series, while deeper layers
encode global trends. Moreover, Logo-LLM introduces lightweight Local-Mixer and
Global-Mixer modules to align and integrate features with the temporal input
across layers. Extensive experiments demonstrate that Logo-LLM achieves
superior performance across diverse benchmarks, with strong generalization in
few-shot and zero-shot settings while maintaining low computational overhead.",http://arxiv.org/pdf/2505.11017v1,,False
GenoArmory: A Unified Evaluation Framework for Adversarial Attacks on Genomic Foundation Models,16/05/2025,"Haozheng Luo, Chenghao Qiu, Yimin Wang, Shang Wu, Jiahao Yu, Han Liu, Binghui Wang, Yan Chen","We propose the first unified adversarial attack benchmark for Genomic
Foundation Models (GFMs), named GenoArmory. Unlike existing GFM benchmarks,
GenoArmory offers the first comprehensive evaluation framework to
systematically assess the vulnerability of GFMs to adversarial attacks.
Methodologically, we evaluate the adversarial robustness of five
state-of-the-art GFMs using four widely adopted attack algorithms and three
defense strategies. Importantly, our benchmark provides an accessible and
comprehensive framework to analyze GFM vulnerabilities with respect to model
architecture, quantization schemes, and training datasets. Additionally, we
introduce GenoAdv, a new adversarial sample dataset designed to improve GFM
safety. Empirically, classification models exhibit greater robustness to
adversarial perturbations compared to generative models, highlighting the
impact of task type on model vulnerability. Moreover, adversarial attacks
frequently target biologically significant genomic regions, suggesting that
these models effectively capture meaningful sequence features.",http://arxiv.org/pdf/2505.10983v1,,False
A Dataset for Spatiotemporal-Sensitive POI Question Answering,16/05/2025,"Xiao Han, Dayan Pan, Xiangyu Zhao, Xuyuan Hu, Zhaolin Deng, Xiangjie Kong, Guojiang Shen","Spatiotemporal relationships are critical in data science, as many prediction
and reasoning tasks require analysis across both spatial and temporal
dimensions--for instance, navigating an unfamiliar city involves planning
itineraries that sequence locations and timing cultural experiences. However,
existing Question-Answering (QA) datasets lack sufficient
spatiotemporal-sensitive questions, making them inadequate benchmarks for
evaluating models' spatiotemporal reasoning capabilities. To address this gap,
we introduce POI-QA, a novel spatiotemporal-sensitive QA dataset centered on
Point of Interest (POI), constructed through three key steps: mining and
aligning open-source vehicle trajectory data from GAIA with high-precision
geographic POI data, rigorous manual validation of noisy spatiotemporal facts,
and generating bilingual (Chinese/English) QA pairs that reflect
human-understandable spatiotemporal reasoning tasks. Our dataset challenges
models to parse complex spatiotemporal dependencies, and evaluations of
state-of-the-art multilingual LLMs (e.g., Qwen2.5-7B, Llama3.1-8B) reveal stark
limitations: even the top-performing model (Qwen2.5-7B fine-tuned with
RAG+LoRA) achieves a top 10 Hit Ratio (HR@10) of only 0.41 on the easiest task,
far below human performance at 0.56. This underscores persistent weaknesses in
LLMs' ability to perform consistent spatiotemporal reasoning, while
highlighting POI-QA as a robust benchmark to advance algorithms sensitive to
spatiotemporal dynamics. The dataset is publicly available at
https://www.kaggle.com/ds/7394666.",http://arxiv.org/pdf/2505.10928v1,,False
A Physics-Informed Convolutional Long Short Term Memory Statistical Model for Fluid Thermodynamics Simulations,16/05/2025,"Luca Menicali, Andrew Grace, David H. Richter, Stefano Castruccio","Fluid thermodynamics underpins atmospheric dynamics, climate science,
industrial applications, and energy systems. However, direct numerical
simulations (DNS) of such systems are computationally prohibitive. To address
this, we present a novel physics-informed spatio-temporal surrogate model for
Rayleigh-B\'enard convection (RBC), a canonical example of convective fluid
flow. Our approach combines convolutional neural networks for spatial feature
extraction with an innovative recurrent architecture inspired by large language
models, comprising a context builder and a sequence generator to capture
temporal dynamics. Inference is penalized with respect to the governing partial
differential equations to ensure physical interpretability. Given the
sensitivity of turbulent convection to initial conditions, we quantify
uncertainty using a conformal prediction framework. This model replicates key
features of RBC dynamics while significantly reducing computational cost,
offering a scalable alternative to DNS for long-term simulations.",http://arxiv.org/pdf/2505.10919v1,,False
REI-Bench: Can Embodied Agents Understand Vague Human Instructions in Task Planning?,16/05/2025,"Chenxi Jiang, Chuhao Zhou, Jianfei Yang","Robot task planning decomposes human instructions into executable action
sequences that enable robots to complete a series of complex tasks. Although
recent large language model (LLM)-based task planners achieve amazing
performance, they assume that human instructions are clear and straightforward.
However, real-world users are not experts, and their instructions to robots
often contain significant vagueness. Linguists suggest that such vagueness
frequently arises from referring expressions (REs), whose meanings depend
heavily on dialogue context and environment. This vagueness is even more
prevalent among the elderly and children, who robots should serve more. This
paper studies how such vagueness in REs within human instructions affects
LLM-based robot task planning and how to overcome this issue. To this end, we
propose the first robot task planning benchmark with vague REs (REI-Bench),
where we discover that the vagueness of REs can severely degrade robot planning
performance, leading to success rate drops of up to 77.9%. We also observe that
most failure cases stem from missing objects in planners. To mitigate the REs
issue, we propose a simple yet effective approach: task-oriented context
cognition, which generates clear instructions for robots, achieving
state-of-the-art performance compared to aware prompt and chains of thought.
This work contributes to the research community of human-robot interaction
(HRI) by making robot task planning more practical, particularly for non-expert
users, e.g., the elderly and children.",http://arxiv.org/pdf/2505.10872v1,,False
ImputeINR: Time Series Imputation via Implicit Neural Representations for Disease Diagnosis with Missing Data,16/05/2025,"Mengxuan Li, Ke Liu, Jialong Guo, Jiajun Bu, Hongwei Wang, Haishuai Wang","Healthcare data frequently contain a substantial proportion of missing
values, necessitating effective time series imputation to support downstream
disease diagnosis tasks. However, existing imputation methods focus on discrete
data points and are unable to effectively model sparse data, resulting in
particularly poor performance for imputing substantial missing values. In this
paper, we propose a novel approach, ImputeINR, for time series imputation by
employing implicit neural representations (INR) to learn continuous functions
for time series. ImputeINR leverages the merits of INR in that the continuous
functions are not coupled to sampling frequency and have infinite sampling
frequency, allowing ImputeINR to generate fine-grained imputations even on
extremely sparse observed values. Extensive experiments conducted on eight
datasets with five ratios of masked values show the superior imputation
performance of ImputeINR, especially for high missing ratios in time series
data. Furthermore, we validate that applying ImputeINR to impute missing values
in healthcare data enhances the performance of downstream disease diagnosis
tasks. Codes are available.",http://arxiv.org/pdf/2505.10856v1,,False
AutoRAN: Weak-to-Strong Jailbreaking of Large Reasoning Models,16/05/2025,"Jiacheng Liang, Tanqiu Jiang, Yuhui Wang, Rongyi Zhu, Fenglong Ma, Ting Wang","This paper presents AutoRAN, the first automated, weak-to-strong jailbreak
attack framework targeting large reasoning models (LRMs). At its core, AutoRAN
leverages a weak, less-aligned reasoning model to simulate the target model's
high-level reasoning structures, generates narrative prompts, and iteratively
refines candidate prompts by incorporating the target model's intermediate
reasoning steps. We evaluate AutoRAN against state-of-the-art LRMs including
GPT-o3/o4-mini and Gemini-2.5-Flash across multiple benchmark datasets
(AdvBench, HarmBench, and StrongReject). Results demonstrate that AutoRAN
achieves remarkable success rates (approaching 100%) within one or a few turns
across different LRMs, even when judged by a robustly aligned external model.
This work reveals that leveraging weak reasoning models can effectively exploit
the critical vulnerabilities of much more capable reasoning models,
highlighting the need for improved safety measures specifically designed for
reasoning-based models. The code for replicating AutoRAN and running records
are available at: (https://github.com/JACKPURCELL/AutoRAN-public). (warning:
this paper contains potentially harmful content generated by LRMs.)",http://arxiv.org/pdf/2505.10846v1,,False
Learning When to Think: Shaping Adaptive Reasoning in R1-Style Models via Multi-Stage RL,16/05/2025,"Songjun Tu, Jiahao Lin, Qichao Zhang, Xiangyu Tian, Linjing Li, Xiangyuan Lan, Dongbin Zhao","Large reasoning models (LRMs) are proficient at generating explicit,
step-by-step reasoning sequences before producing final answers. However, such
detailed reasoning can introduce substantial computational overhead and
latency, particularly for simple problems. To address this over-thinking
problem, we explore how to equip LRMs with adaptive thinking capabilities:
enabling them to dynamically decide whether or not to engage in explicit
reasoning based on problem complexity. Building on R1-style distilled models,
we observe that inserting a simple ellipsis (""..."") into the prompt can
stochastically trigger either a thinking or no-thinking mode, revealing a
latent controllability in the reasoning behavior. Leveraging this property, we
propose AutoThink, a multi-stage reinforcement learning (RL) framework that
progressively optimizes reasoning policies via stage-wise reward shaping.
AutoThink learns to invoke explicit reasoning only when necessary, while
defaulting to succinct responses for simpler tasks. Experiments on five
mainstream mathematical benchmarks demonstrate that AutoThink achieves
favorable accuracy-efficiency trade-offs compared to recent prompting and
RL-based pruning methods. It can be seamlessly integrated into any R1-style
model, including both distilled and further fine-tuned variants. Notably,
AutoThink improves relative accuracy by 6.4 percent while reducing token usage
by 52 percent on DeepSeek-R1-Distill-Qwen-1.5B, establishing a scalable and
adaptive reasoning paradigm for LRMs.",http://arxiv.org/pdf/2505.10832v1,,False
