Title,Publication Date,Author(s),Abstract,Link,DOI,Relevant
Enhancing Forex Forecasting Accuracy: The Impact of Hybrid Variable Sets in Cognitive Algorithmic Trading Systems,20/11/2025,"Juan C. King, Jose M. Amigo","This paper presents the implementation of an advanced artificial intelligence-based algorithmic trading system specifically designed for the EUR-USD pair within the high-frequency environment of the Forex market. The methodological approach centers on integrating a holistic set of input features: key fundamental macroeconomic variables (for example, Gross Domestic Product and Unemployment Rate) collected from both the Euro Zone and the United States, alongside a comprehensive suite of technical variables (including indicators, oscillators, Fibonacci levels, and price divergences). The performance of the resulting algorithm is evaluated using standard machine learning metrics to quantify predictive accuracy and backtesting simulations across historical data to assess trading profitability and risk. The study concludes with a comparative analysis to determine which class of input features, fundamental or technical, provides greater and more reliable predictive capacity for generating profitable trading signals.",https://arxiv.org/pdf/2511.16657v1,,False
Toward Artificial Palpation: Representation Learning of Touch on Soft Bodies,20/11/2025,"Zohar Rimon, Elisei Shafer, Tal Tepper, Efrat Shimron, Aviv Tamar","Palpation, the use of touch in medical examination, is almost exclusively performed by humans. We investigate a proof of concept for an artificial palpation method based on self-supervised learning. Our key idea is that an encoder-decoder framework can learn a $\textit{representation}$ from a sequence of tactile measurements that contains all the relevant information about the palpated object. We conjecture that such a representation can be used for downstream tasks such as tactile imaging and change detection. With enough training data, it should capture intricate patterns in the tactile measurements that go beyond a simple map of forces -- the current state of the art. To validate our approach, we both develop a simulation environment and collect a real-world dataset of soft objects and corresponding ground truth images obtained by magnetic resonance imaging (MRI). We collect palpation sequences using a robot equipped with a tactile sensor, and train a model that predicts sensory readings at different positions on the object. We investigate the representation learned in this process, and demonstrate its use in imaging and change detection.",https://arxiv.org/pdf/2511.16596v1,,False
gfnx: Fast and Scalable Library for Generative Flow Networks in JAX,20/11/2025,"Daniil Tiapkin, Artem Agarkov, Nikita Morozov, Ian Maksimov, Askar Tsyganov, Timofei Gritsaev, Sergey Samsonov","In this paper, we present gfnx, a fast and scalable package for training and evaluating Generative Flow Networks (GFlowNets) written in JAX. gfnx provides an extensive set of environments and metrics for benchmarking, accompanied with single-file implementations of core objectives for training GFlowNets. We include synthetic hypergrids, multiple sequence generation environments with various editing regimes and particular reward designs for molecular generation, phylogenetic tree construction, Bayesian structure learning, and sampling from the Ising model energy. Across different tasks, gfnx achieves significant wall-clock speedups compared to Pytorch-based benchmarks (such as torchgfn library) and author implementations. For example, gfnx achieves up to 55 times speedup on CPU-based sequence generation environments, and up to 80 times speedup with the GPU-based Bayesian network structure learning setup. Our package provides a diverse set of benchmarks and aims to standardize empirical evaluation and accelerate research and applications of GFlowNets. The library is available on GitHub (https://github.com/d-tiapkin/gfnx) and on pypi (https://pypi.org/project/gfnx/). Documentation is available on https://gfnx.readthedocs.io.",https://arxiv.org/pdf/2511.16592v1,,False
Interfacial and bulk switching MoS2 memristors for an all-2D reservoir computing framework,20/11/2025,"Asmita S. Thool, Sourodeep Roy, Prahalad Kanti Barman, Kartick Biswas, Pavan Nukala, Abhishek Misra, Saptarshi Das, and Bhaswar Chakrabarti","In this study, we design a reservoir computing (RC) network by exploiting short- and long-term memory dynamics in Au/Ti/MoS$_2$/Au memristive devices. The temporal dynamics is engineered by controlling the thickness of the Chemical Vapor Deposited (CVD) MoS$_2$ films. Devices with a monolayer (1L)-MoS$_2$ film exhibit volatile (short-term memory) switching dynamics. We also report non-volatile resistance switching with excellent uniformity and analog behavior in conductance tuning for the multilayer (ML) MoS$_2$ memristive devices. We correlate this performance with trap-assisted space-charge limited conduction (SCLC) mechanism, leading to a bulk-limited resistance switching behavior. Four-bit reservoir states are generated using volatile memristors. The readout layer is implemented with an array of nonvolatile synapses. This small RC network achieves 89.56\% precision in a spoken-digit recognition task and is also used to analyze a nonlinear time series equation.",https://arxiv.org/pdf/2511.16557v1,,False
Large Language Model-Based Reward Design for Deep Reinforcement Learning-Driven Autonomous Cyber Defense,20/11/2025,"Sayak Mukherjee, Samrat Chatterjee, Emilie Purvine, Ted Fujimoto, Tegan Emerson","Designing rewards for autonomous cyber attack and defense learning agents in a complex, dynamic environment is a challenging task for subject matter experts. We propose a large language model (LLM)-based reward design approach to generate autonomous cyber defense policies in a deep reinforcement learning (DRL)-driven experimental simulation environment. Multiple attack and defense agent personas were crafted, reflecting heterogeneity in agent actions, to generate LLM-guided reward designs where the LLM was first provided with contextual cyber simulation environment information. These reward structures were then utilized within a DRL-driven attack-defense simulation environment to learn an ensemble of cyber defense policies. Our results suggest that LLM-guided reward designs can lead to effective defense strategies against diverse adversarial behaviors.",https://arxiv.org/pdf/2511.16483v1,,False
A Comparison Between Decision Transformers and Traditional Offline Reinforcement Learning Algorithms,20/11/2025,"Ali Murtaza Caunhye, Asad Jeewa","The field of Offline Reinforcement Learning (RL) aims to derive effective policies from pre-collected datasets without active environment interaction. While traditional offline RL algorithms like Conservative Q-Learning (CQL) and Implicit Q-Learning (IQL) have shown promise, they often face challenges in balancing exploration and exploitation, especially in environments with varying reward densities. The recently proposed Decision Transformer (DT) approach, which reframes offline RL as a sequence modelling problem, has demonstrated impressive results across various benchmarks. This paper presents a comparative study evaluating the performance of DT against traditional offline RL algorithms in dense and sparse reward settings for the ANT continous control environment. Our research investigates how these algorithms perform when faced with different reward structures, examining their ability to learn effective policies and generalize across varying levels of feedback. Through empirical analysis in the ANT environment, we found that DTs showed less sensitivity to varying reward density compared to other methods and particularly excelled with medium-expert datasets in sparse reward scenarios. In contrast, traditional value-based methods like IQL showed improved performance in dense reward settings with high-quality data, while CQL offered balanced performance across different data qualities. Additionally, DTs exhibited lower variance in performance but required significantly more computational resources compared to traditional approaches. These findings suggest that sequence modelling approaches may be more suitable for scenarios with uncertain reward structures or mixed-quality data, while value-based methods remain competitive in settings with dense rewards and high-quality demonstrations.",https://arxiv.org/pdf/2511.16475v1,,False
VLA-Pruner: Temporal-Aware Dual-Level Visual Token Pruning for Efficient Vision-Language-Action Inference,20/11/2025,"Ziyan Liu, Yeqiu Chen, Hongyi Cai, Tao Lin, Shuo Yang, Zheng Liu, Bo Zhao","Vision-Language-Action (VLA) models have shown great promise for embodied AI, yet the heavy computational cost of processing continuous visual streams severely limits their real-time deployment. Token pruning (keeping salient visual tokens and dropping redundant ones) has emerged as an effective approach for accelerating Vision-Language Models (VLMs), offering a solution for efficient VLA. However, these VLM-specific token pruning methods select tokens based solely on semantic salience metrics (e.g., prefill attention), while overlooking the VLA's intrinsic dual-system nature of high-level semantic understanding and low-level action execution. Consequently, these methods bias token retention toward semantic cues, discard critical information for action generation, and significantly degrade VLA performance. To bridge this gap, we propose VLA-Pruner, a versatile plug-and-play VLA-specific token prune method that aligns with the dual-system nature of VLA models and exploits the temporal continuity in robot manipulation. Specifically, VLA-Pruner adopts a dual-level importance criterion for visual token retention: vision-language prefill attention for semantic-level relevance and action decode attention, estimated via temporal smoothing, for action-level importance. Based on this criterion, VLA-Pruner proposes a novel dual-level token selection strategy that adaptively preserves a compact, informative set of visual tokens for both semantic understanding and action execution under given compute budget. Experiments show that VLA-Pruner achieves state-of-the-art performance across multiple VLA architectures and diverse robotic tasks.",https://arxiv.org/pdf/2511.16449v1,,False
PersonaDrift: A Benchmark for Temporal Anomaly Detection in Language-Based Dementia Monitoring,20/11/2025,"Joy Lai, Alex Mihailidis","People living with dementia (PLwD) often show gradual shifts in how they communicate, becoming less expressive, more repetitive, or drifting off-topic in subtle ways. While caregivers may notice these changes informally, most computational tools are not designed to track such behavioral drift over time. This paper introduces PersonaDrift, a synthetic benchmark designed to evaluate machine learning and statistical methods for detecting progressive changes in daily communication, focusing on user responses to a digital reminder system. PersonaDrift simulates 60-day interaction logs for synthetic users modeled after real PLwD, based on interviews with caregivers. These caregiver-informed personas vary in tone, modality, and communication habits, enabling realistic diversity in behavior. The benchmark focuses on two forms of longitudinal change that caregivers highlighted as particularly salient: flattened sentiment (reduced emotional tone and verbosity) and off-topic replies (semantic drift). These changes are injected progressively at different rates to emulate naturalistic cognitive trajectories, and the framework is designed to be extensible to additional behaviors in future use cases. To explore this novel application space, we evaluate several anomaly detection approaches, unsupervised statistical methods (CUSUM, EWMA, One-Class SVM), sequence models using contextual embeddings (GRU + BERT), and supervised classifiers in both generalized and personalized settings. Preliminary results show that flattened sentiment can often be detected with simple statistical models in users with low baseline variability, while detecting semantic drift requires temporal modeling and personalized baselines. Across both tasks, personalized classifiers consistently outperform generalized ones, highlighting the importance of individual behavioral context.",https://arxiv.org/pdf/2511.16445v1,,False
Generative Modeling of Clinical Time Series via Latent Stochastic Differential Equations,20/11/2025,"Muhammad Aslanimoghanloo, Ahmed ElGazzar, Marcel van Gerven","Clinical time series data from electronic health records and medical registries offer unprecedented opportunities to understand patient trajectories and inform medical decision-making. However, leveraging such data presents significant challenges due to irregular sampling, complex latent physiology, and inherent uncertainties in both measurements and disease progression. To address these challenges, we propose a generative modeling framework based on latent neural stochastic differential equations (SDEs) that views clinical time series as discrete-time partial observations of an underlying controlled stochastic dynamical system. Our approach models latent dynamics via neural SDEs with modality-dependent emission models, while performing state estimation and parameter learning through variational inference. This formulation naturally handles irregularly sampled observations, learns complex non-linear interactions, and captures the stochasticity of disease progression and measurement noise within a unified scalable probabilistic framework. We validate the framework on two complementary tasks: (i) individual treatment effect estimation using a simulated pharmacokinetic-pharmacodynamic (PKPD) model of lung cancer, and (ii) probabilistic forecasting of physiological signals using real-world intensive care unit (ICU) data from 12,000 patients. Results show that our framework outperforms ordinary differential equation and long short-term memory baseline models in accuracy and uncertainty estimation. These results highlight its potential for enabling precise, uncertainty-aware predictions to support clinical decision-making.",https://arxiv.org/pdf/2511.16427v1,,False
FreqFlow: Long-term forecasting using lightweight flow matching,20/11/2025,"Seyed Mohamad Moghadas, Bruno Cornelis, Adrian Munteanu","Multivariate time-series (MTS) forecasting is fundamental to applications ranging from urban mobility and resource management to climate modeling. While recent generative models based on denoising diffusion have advanced state-of-the-art performance in capturing complex data distributions, they suffer from significant computational overhead due to iterative stochastic sampling procedures that limit real-time deployment. Moreover, these models can be brittle when handling high-dimensional, non-stationary, and multi-scale periodic patterns characteristic of real-world sensor networks. We introduce FreqFlow, a novel framework that leverages conditional flow matching in the frequency domain for deterministic MTS forecasting. Unlike conventional approaches that operate in the time domain, FreqFlow transforms the forecasting problem into the spectral domain, where it learns to model amplitude and phase shifts through a single complex-valued linear layer. This frequency-domain formulation enables the model to efficiently capture temporal dynamics via complex multiplication, corresponding to scaling and temporal translations. The resulting architecture is exceptionally lightweight with only 89k parameters - an order of magnitude smaller than competing diffusion-based models-while enabling single-pass deterministic sampling through ordinary differential equation (ODE) integration. Our approach decomposes MTS signals into trend, seasonal, and residual components, with the flow matching mechanism specifically designed for residual learning to enhance long-term forecasting accuracy. Extensive experiments on real-world traffic speed, volume, and flow datasets demonstrate that FreqFlow achieves state-of-the-art forecasting performance, on average 7\% RMSE improvements, while being significantly faster and more parameter-efficient than existing methods",https://arxiv.org/pdf/2511.16426v1,,False
CorrectHDL: Agentic HDL Design with LLMs Leveraging High-Level Synthesis as Reference,20/11/2025,"Kangwei Xu, Grace Li Zhang, Ulf Schlichtmann, Bing Li","Large Language Models (LLMs) have demonstrated remarkable potential in hardware front-end design using hardware description languages (HDLs). However, their inherent tendency toward hallucination often introduces functional errors into the generated HDL designs. To address this issue, we propose the framework CorrectHDL that leverages high-level synthesis (HLS) results as functional references to correct potential errors in LLM-generated HDL designs.The input to the proposed framework is a C/C++ program that specifies the target circuit's functionality. The program is provided to an LLM to directly generate an HDL design, whose syntax errors are repaired using a Retrieval-Augmented Generation (RAG) mechanism. The functional correctness of the LLM-generated circuit is iteratively improved by comparing its simulated behavior with an HLS reference design produced by conventional HLS tools, which ensures the functional correctness of the result but can lead to suboptimal area and power efficiency. Experimental results demonstrate that circuits generated by the proposed framework achieve significantly better area and power efficiency than conventional HLS designs and approach the quality of human-engineered circuits. Meanwhile, the correctness of the resulting HDL implementation is maintained, highlighting the effectiveness and potential of agentic HDL design leveraging the generative capabilities of LLMs and the rigor of traditional correctness-driven IC design flows.",https://arxiv.org/pdf/2511.16395v1,,False
Unsupervised Graph Neural Network Framework for Balanced Multipatterning in Advanced Electronic Design Automation Layouts,20/11/2025,"Abdelrahman Helaly, Nourhan Sakr, Kareem Madkour, Ilhami Torunoglu","Multipatterning is an essential decomposition strategy in electronic design automation (EDA) that overcomes lithographic limitations when printing dense circuit layouts. Although heuristic-based backtracking and SAT solvers can address these challenges, they often struggle to simultaneously handle both complex constraints and secondary objectives. In this study, we present a hybrid workflow that casts multipatterning as a variant of a constrained graph coloring problem with the primary objective of minimizing feature violations and a secondary objective of balancing the number of features on each mask. Our pipeline integrates two main components: (1) A GNN-based agent, trained in an unsupervised manner to generate initial color predictions, which are refined by (2) refinement strategies (a GNN-based heuristic and simulated annealing) that together enhance solution quality and balance. Experimental evaluation in both proprietary data sets and publicly available open source layouts demonstrate complete conflict-free decomposition and consistent color balancing. The proposed framework provides a reproducible, data-efficient and deployable baseline for scalable layout decomposition in EDA workflows.",https://arxiv.org/pdf/2511.16374v1,,False
"Beyond Generative AI: World Models for Clinical Prediction, Counterfactuals, and Planning",20/11/2025,"Mohammad Areeb Qazi, Maryam Nadeem, Mohammad Yaqub","Healthcare requires AI that is predictive, reliable, and data-efficient. However, recent generative models lack physical foundation and temporal reasoning required for clinical decision support. As scaling language models show diminishing returns for grounded clinical reasoning, world models are gaining traction because they learn multimodal, temporally coherent, and action-conditioned representations that reflect the physical and causal structure of care. This paper reviews World Models for healthcare systems that learn predictive dynamics to enable multistep rollouts, counterfactual evaluation and planning. We survey recent work across three domains: (i) medical imaging and diagnostics (e.g., longitudinal tumor simulation, projection-transition modeling, and Joint Embedding Predictive Architecture i.e., JEPA-style predictive representation learning), (ii) disease progression modeling from electronic health records (generative event forecasting at scale), and (iii) robotic surgery and surgical planning (action-conditioned guidance and control). We also introduce a capability rubric: L1 temporal prediction, L2 action-conditioned prediction, L3 counterfactual rollouts for decision support, and L4 planning/control. Most reviewed systems achieve L1--L2, with fewer instances of L3 and rare L4. We identify cross-cutting gaps that limit clinical reliability; under-specified action spaces and safety constraints, weak interventional validation, incomplete multimodal state construction, and limited trajectory-level uncertainty calibration. This review outlines a research agenda for clinically robust prediction-first world models that integrate generative backbones (transformers, diffusion, VAE) with causal/mechanical foundation for safe decision support in healthcare.",https://arxiv.org/pdf/2511.16333v1,,False
Optimizing Operation Recipes with Reinforcement Learning for Safe and Interpretable Control of Chemical Processes,20/11/2025,"Dean Brandner, Sergio Lucia","Optimal operation of chemical processes is vital for energy, resource, and cost savings in chemical engineering. The problem of optimal operation can be tackled with reinforcement learning, but traditional reinforcement learning methods face challenges due to hard constraints related to quality and safety that must be strictly satisfied, and the large amount of required training data. Chemical processes often cannot provide sufficient experimental data, and while detailed dynamic models can be an alternative, their complexity makes it computationally intractable to generate the needed data. Optimal control methods, such as model predictive control, also struggle with the complexity of the underlying dynamic models. Consequently, many chemical processes rely on manually defined operation recipes combined with simple linear controllers, leading to suboptimal performance and limited flexibility.
  In this work, we propose a novel approach that leverages expert knowledge embedded in operation recipes. By using reinforcement learning to optimize the parameters of these recipes and their underlying linear controllers, we achieve an optimized operation recipe. This method requires significantly less data, handles constraints more effectively, and is more interpretable than traditional reinforcement learning methods due to the structured nature of the recipes. We demonstrate the potential of our approach through simulation results of an industrial batch polymerization reactor, showing that it can approach the performance of optimal controllers while addressing the limitations of existing methods.",https://arxiv.org/pdf/2511.16297v1,,False
GeoPTH: A Lightweight Approach to Category-Based Trajectory Retrieval via Geometric Prototype Trajectory Hashing,20/11/2025,"Yang Xu, Zuliang Yang, Kai Ming Ting","Trajectory similarity retrieval is an important part of spatiotemporal data mining, however, existing methods have the following limitations: traditional metrics are computationally expensive, while learning-based methods suffer from substantial training costs and potential instability. This paper addresses these problems by proposing \textbf{Geo}metric \textbf{P}rototype \textbf{T}rajectory \textbf{H}ashing (GeoPTH), a novel, lightweight, and non-learning framework for efficient category-based trajectory retrieval. GeoPTH constructs data-dependent hash functions by using representative trajectory prototypes, i.e., small point sets preserving geometric characteristics, as anchors. The hashing process is efficient, which involves mapping a new trajectory to its closest prototype via a robust, \textit{Hausdorff} metric. Extensive experiments show that GeoPTH's retrieval accuracy is highly competitive with both traditional metrics and state-of-the-art learning methods, and it significantly outperforms binary codes generated through simple binarization of the learned embeddings. Critically, GeoPTH consistently outperforms all competitors in terms of efficiency. Our work demonstrates that a lightweight, prototype-centric approach offers a practical and powerful alternative, achieving an exceptional retrieval performance and computational efficiency.",https://arxiv.org/pdf/2511.16258v1,,False
