Title,Publication Date,Author(s),Abstract,Link,DOI,Relevant
General sample size analysis for probabilities of causation: a delta method approach,19/02/2026,"Tianyuan Cheng, Ruirui Mao, Judea Pearl, Ang Li","Probabilities of causation (PoCs), such as the probability of necessity and sufficiency (PNS), are important tools for decision making but are generally not point identifiable. Existing work has derived bounds for these quantities using combinations of experimental and observational data. However, there is very limited research on sample size analysis, namely, how many experimental and observational samples are required to achieve a desired margin of error. In this paper, we propose a general sample size framework based on the delta method. Our approach applies to settings in which the target bounds of PoCs can be expressed as finite minima or maxima of linear combinations of experimental and observational probabilities. Through simulation studies, we demonstrate that the proposed sample size calculations lead to stable estimation of these bounds.",https://arxiv.org/pdf/2602.17070v1,,False
ReIn: Conversational Error Recovery with Reasoning Inception,19/02/2026,"Takyoung Kim, Jinseok Nam, Chandrayee Basu, Xing Fan, Chengyuan Ma, Heng Ji, Gokhan Tur, Dilek Hakkani-Tür","Conversational agents powered by large language models (LLMs) with tool integration achieve strong performance on fixed task-oriented dialogue datasets but remain vulnerable to unanticipated, user-induced errors. Rather than focusing on error prevention, this work focuses on error recovery, which necessitates the accurate diagnosis of erroneous dialogue contexts and execution of proper recovery plans. Under realistic constraints precluding model fine-tuning or prompt modification due to significant cost and time requirements, we explore whether agents can recover from contextually flawed interactions and how their behavior can be adapted without altering model parameters and prompts. To this end, we propose Reasoning Inception (ReIn), a test-time intervention method that plants an initial reasoning into the agent's decision-making process. Specifically, an external inception module identifies predefined errors within the dialogue context and generates recovery plans, which are subsequently integrated into the agent's internal reasoning process to guide corrective actions, without modifying its parameters or system prompts. We evaluate ReIn by systematically simulating conversational failure scenarios that directly hinder successful completion of user goals: user's ambiguous and unsupported requests. Across diverse combinations of agent models and inception modules, ReIn substantially improves task success and generalizes to unseen error types. Moreover, it consistently outperforms explicit prompt-modification approaches, underscoring its utility as an efficient, on-the-fly method. In-depth analysis of its operational mechanism, particularly in relation to instruction hierarchy, indicates that jointly defining recovery tools with ReIn can serve as a safe and effective strategy for improving the resilience of conversational agents without modifying the backbone models or system prompts.",https://arxiv.org/pdf/2602.17022v1,,False
Sonar-TS: Search-Then-Verify Natural Language Querying for Time Series Databases,19/02/2026,"Zhao Tan, Yiji Zhao, Shiyu Wang, Chang Xu, Yuxuan Liang, Xiping Liu, Shirui Pan, Ming Jin","Natural Language Querying for Time Series Databases (NLQ4TSDB) aims to assist non-expert users retrieve meaningful events, intervals, and summaries from massive temporal records. However, existing Text-to-SQL methods are not designed for continuous morphological intents such as shapes or anomalies, while time series models struggle to handle ultra-long histories. To address these challenges, we propose Sonar-TS, a neuro-symbolic framework that tackles NLQ4TSDB via a Search-Then-Verify pipeline. Analogous to active sonar, it utilizes a feature index to ping candidate windows via SQL, followed by generated Python programs to lock on and verify candidates against raw signals. To enable effective evaluation, we introduce NLQTSBench, the first large-scale benchmark designed for NLQ over TSDB-scale histories. Our experiments highlight the unique challenges within this domain and demonstrate that Sonar-TS effectively navigates complex temporal queries where traditional methods fail. This work presents the first systematic study of NLQ4TSDB, offering a general framework and evaluation standard to facilitate future research.",https://arxiv.org/pdf/2602.17001v1,,False
Discovering Universal Activation Directions for PII Leakage in Language Models,19/02/2026,"Leo Marchyok, Zachary Coalson, Sungho Keum, Sooel Son, Sanghyun Hong","Modern language models exhibit rich internal structure, yet little is known about how privacy-sensitive behaviors, such as personally identifiable information (PII) leakage, are represented and modulated within their hidden states. We present UniLeak, a mechanistic-interpretability framework that identifies universal activation directions: latent directions in a model's residual stream whose linear addition at inference time consistently increases the likelihood of generating PII across prompts. These model-specific directions generalize across contexts and amplify PII generation probability, with minimal impact on generation quality. UniLeak recovers such directions without access to training data or groundtruth PII, relying only on self-generated text. Across multiple models and datasets, steering along these universal directions substantially increases PII leakage compared to existing prompt-based extraction methods. Our results offer a new perspective on PII leakage: the superposition of a latent signal in the model's representations, enabling both risk amplification and mitigation.",https://arxiv.org/pdf/2602.16980v1,,False
Early-Warning Signals of Grokking via Loss-Landscape Geometry,19/02/2026,Yongzhong Xu,"Grokking -- the abrupt transition from memorization to generalization after prolonged training -- has been linked to confinement on low-dimensional execution manifolds in modular arithmetic. Whether this mechanism extends beyond arithmetic remains open. We study two sequence-learning benchmarks: SCAN compositional generalization and Dyck-1 depth prediction. Across both tasks and a wide range of learning rates, the commutator defect -- a curvature measure derived from non-commuting gradient updates -- rises well before generalization, with lead times following a superlinear power law (alpha approximately 1.18 for SCAN, approximately 1.13 for Dyck), consistent with prior results on modular arithmetic. Weight-space PCA reveals that spectral concentration is not a universal precursor; the commutator defect is. Causal interventions demonstrate a mechanistic role: amplifying non-commutativity accelerates grokking (roughly 32% on SCAN, roughly 50% on Dyck), while suppressing orthogonal gradient flow delays or prevents it. The three task families form a spectrum of causal sensitivity -- modular arithmetic is rigid, Dyck is responsive, SCAN is intermediate -- yet suppression delays or prevents grokking in all cases, establishing necessity as a universal finding. These results identify the commutator defect as a robust, architecture-agnostic, causally implicated early-warning signal for delayed generalization in transformers.",https://arxiv.org/pdf/2602.16967v1,,False
