Title,Publication Date,Author(s),Abstract,Link,DOI,Relevant
CaberNet: Causal Representation Learning for Cross-Domain HVAC Energy Prediction,10/11/2025,"Kaiyuan Zhai, Jiacheng Cui, Zhehao Zhang, Junyu Xue, Yang Deng, Kui Wu, Guoming Tang","Cross-domain HVAC energy prediction is essential for scalable building energy
management, particularly because collecting extensive labeled data for every
new building is both costly and impractical. Yet, this task remains highly
challenging due to the scarcity and heterogeneity of data across different
buildings, climate zones, and seasonal patterns. In particular, buildings
situated in distinct climatic regions introduce variability that often leads
existing methods to overfit to spurious correlations, rely heavily on expert
intervention, or compromise on data diversity. To address these limitations, we
propose CaberNet, a causal and interpretable deep sequence model that learns
invariant (Markov blanket) representations for robust cross-domain prediction.
In a purely data-driven fashion and without requiring any prior knowledge,
CaberNet integrates i) a global feature gate trained with a self-supervised
Bernoulli regularization to distinguish superior causal features from inferior
ones, and ii) a domain-wise training scheme that balances domain contributions,
minimizes cross-domain loss variance, and promotes latent factor independence.
We evaluate CaberNet on real-world datasets collected from three buildings
located in three climatically diverse cities, and it consistently outperforms
all baselines, achieving a 22.9\% reduction in normalized mean squared error
(NMSE) compared to the best benchmark. Our code is available at
https://github.com/rickzky1001/CaberNet-CRL.",http://arxiv.org/pdf/2511.06634v1,,False
How Do VLAs Effectively Inherit from VLMs?,10/11/2025,"Chuheng Zhang, Rushuai Yang, Xiaoyu Chen, Kaixin Wang, Li Zhao, Yi Chen, Jiang Bian","Vision-language-action (VLA) models hold the promise to attain generalizable
embodied control. To achieve this, a pervasive paradigm is to leverage the rich
vision-semantic priors of large vision-language models (VLMs). However, the
fundamental question persists: How do VLAs effectively inherit the prior
knowledge from VLMs? To address this critical question, we introduce a
diagnostic benchmark, GrinningFace, an emoji tabletop manipulation task where
the robot arm is asked to place objects onto printed emojis corresponding to
language instructions. This task design is particularly revealing -- knowledge
associated with emojis is ubiquitous in Internet-scale datasets used for VLM
pre-training, yet emojis themselves are largely absent from standard robotics
datasets. Consequently, they provide a clean proxy: successful task completion
indicates effective transfer of VLM priors to embodied control. We implement
this diagnostic task in both simulated environment and a real robot, and
compare various promising techniques for knowledge transfer. Specifically, we
investigate the effects of parameter-efficient fine-tuning, VLM freezing,
co-training, predicting discretized actions, and predicting latent actions.
Through systematic evaluation, our work not only demonstrates the critical
importance of preserving VLM priors for the generalization of VLA but also
establishes guidelines for future research in developing truly generalizable
embodied AI systems.",http://arxiv.org/pdf/2511.06619v1,,False
SPUR: A Plug-and-Play Framework for Integrating Spatial Audio Understanding and Reasoning into Large Audio-Language Models,10/11/2025,"S Sakshi, Vaibhavi Lokegaonkar, Neil Zhang, Ramani Duraiswami, Sreyan Ghosh, Dinesh Manocha, Lie Lu","Spatial perception is central to auditory intelligence, enabling accurate
understanding of real-world acoustic scenes and advancing human-level
perception of the world around us. While recent large audio-language models
(LALMs) show strong reasoning over complex audios, most operate on monaural
inputs and lack the ability to capture spatial cues such as direction,
elevation, and distance. We introduce SPUR, a lightweight, plug-in approach
that equips LALMs with spatial perception through minimal architectural
changes. SPUR consists of: (i) a First-Order Ambisonics (FOA) encoder that maps
(W, X, Y, Z) channels to rotation-aware, listener-centric spatial features,
integrated into target LALMs via a multimodal adapter; and (ii) SPUR-Set, a
spatial QA dataset combining open-source FOA recordings with controlled
simulations, emphasizing relative direction, elevation, distance, and overlap
for supervised spatial reasoning. Fine-tuning our model on the SPUR-Set
consistently improves spatial QA and multi-speaker attribution while preserving
general audio understanding. SPUR provides a simple recipe that transforms
monaural LALMs into spatially aware models. Extensive ablations validate the
effectiveness of our approach.",http://arxiv.org/pdf/2511.06606v1,,False
