Title,Publication Date,Author(s),Abstract,Link,DOI,Relevant
Dual-Granularity Contrastive Reward via Generated Episodic Guidance for Efficient Embodied RL,13/02/2026,"Xin Liu, Yixuan Li, Yuhui Chen, Yuxing Qin, Haoran Li, Dongbin Zhao","Designing suitable rewards poses a significant challenge in reinforcement learning (RL), especially for embodied manipulation. Trajectory success rewards are suitable for human judges or model fitting, but the sparsity severely limits RL sample efficiency. While recent methods have effectively improved RL via dense rewards, they rely heavily on high-quality human-annotated data or abundant expert supervision. To tackle these issues, this paper proposes Dual-granularity contrastive reward via generated Episodic Guidance (DEG), a novel framework to seek sample-efficient dense rewards without requiring human annotations or extensive supervision. Leveraging the prior knowledge of large video generation models, DEG only needs a small number of expert videos for domain adaptation to generate dedicated task guidance for each RL episode. Then, the proposed dual-granularity reward that balances coarse-grained exploration and fine-grained matching, will guide the agent to efficiently approximate the generated guidance video sequentially in the contrastive self-supervised latent space, and finally complete the target task. Extensive experiments on 18 diverse tasks across both simulation and real-world settings show that DEG can not only serve as an efficient exploration stimulus to help the agent quickly discover sparse success rewards, but also guide effective RL and stable policy convergence independently.",https://arxiv.org/pdf/2602.12636v1,,False
HyperMLP: An Integrated Perspective for Sequence Modeling,13/02/2026,"Jiecheng Lu, Shihao Yang","Self-attention is often viewed as probabilistic query-key lookup, motivating designs that preserve normalized attention scores and fixed positional semantics. We advocate a simpler and more unified perspective: an autoregressive attention head can be viewed as a dynamic two-layer MLP whose weights are instantiated from the context history. From this view, attention scores form an ever-growing hidden representation, and standard MLP activations such as ReLU or GLU naturally implement input-conditioned selection over a context-dependent memory pool rather than a probability distribution. Based on this formulation, we introduce HyperMLP and HyperGLU, which learn dynamic mixing in both feature space and sequence space, using a reverse-offset (lag) layout to align temporal mixing with autoregressive semantics. We provide theoretical characterizations of the expressivity and implications of this structure, and empirically show that HyperMLP/HyperGLU consistently outperform strong softmax-attention baselines under matched parameter budgets.",https://arxiv.org/pdf/2602.12601v1,,False
Can I Have Your Order? Monte-Carlo Tree Search for Slot Filling Ordering in Diffusion Language Models,13/02/2026,"Joshua Ong Jun Leang, Yu Zhao, Mihaela Cătălina Stoian, Wenda Li, Shay B. Cohen, Eleonora Giunchiglia","While plan-and-infill decoding in Masked Diffusion Models (MDMs) shows promise for mathematical and code reasoning, performance remains highly sensitive to slot infilling order, often yielding substantial output variance. We introduce McDiffuSE, a framework that formulates slot selection as decision making and optimises infilling orders through Monte Carlo Tree Search (MCTS). McDiffuSE uses look-ahead simulations to evaluate partial completions before commitment, systematically exploring the combinatorial space of generation orders. Experiments show an average improvement of 3.2% over autoregressive baselines and 8.0% over baseline plan-and-infill, with notable gains of 19.5% on MBPP and 4.9% on MATH500. Our analysis reveals that while McDiffuSE predominantly follows sequential ordering, incorporating non-sequential generation is essential for maximising performance. We observe that larger exploration constants, rather than increased simulations, are necessary to overcome model confidence biases and discover effective orderings. These findings establish MCTS-based planning as an effective approach for enhancing generation quality in MDMs.",https://arxiv.org/pdf/2602.12586v1,,False
A Theoretical Analysis of Mamba's Training Dynamics: Filtering Relevant Features for Generalization in State Space Models,13/02/2026,"Mugunthan Shandirasegaran, Hongkang Li, Songyang Zhang, Meng Wang, Shuai Zhang","The recent empirical success of Mamba and other selective state space models (SSMs) has renewed interest in non-attention architectures for sequence modeling, yet their theoretical foundations remain underexplored. We present a first-step analysis of generalization and learning dynamics for a simplified but representative Mamba block: a single-layer, single-head selective SSM with input-dependent gating, followed by a two-layer MLP trained via gradient descent (GD). Our study adopts a structured data model with tokens that include both class-relevant and class-irrelevant patterns under token-level noise and examines two canonical regimes: majority-voting and locality-structured data sequences. We prove that the model achieves guaranteed generalization by establishing non-asymptotic sample complexity and convergence rate bounds, which improve as the effective signal increases and the noise decreases. Furthermore, we show that the gating vector aligns with class-relevant features while ignoring irrelevant ones, thereby formalizing a feature-selection role similar to attention but realized through selective recurrence. Numerical experiments on synthetic data justify our theoretical results. Overall, our results provide principled insight into when and why Mamba-style selective SSMs learn efficiently, offering a theoretical counterpoint to Transformer-centric explanations.",https://arxiv.org/pdf/2602.12499v1,,False
Gradient-Enhanced Partitioned Gaussian Processes for Real-Time Quadrotor Dynamics Modeling,13/02/2026,"Xinhuan Sang, Adam Rozman, Sheryl Grace, Roberto Tron","We present a quadrotor dynamics Gaussian Process (GP) with gradient information that achieves real-time inference via state-space partitioning and approximation, and that includes aerodynamic effects using data from mid-fidelity potential flow simulations. While traditional GP-based approaches provide reliable Bayesian predictions with uncertainty quantification, they are computationally expensive and thus unsuitable for real-time simulations. To address this challenge, we integrate gradient information to improve accuracy and introduce a novel partitioning and approximation strategy to reduce online computational cost. In particular, for the latter, we associate a local GP with each non-overlapping region; by splitting the training data into local near and far subsets, and by using Schur complements, we show that a large part of the matrix inversions required for inference can be performed offline, enabling real-time inference at frequencies above 30 Hz on standard desktop hardware. To generate a training dataset that captures aerodynamic effects, such as rotor-rotor interactions and apparent wind direction, we use the CHARM code, which is a mid-fidelity aerodynamic solver. It is applied to the SUI Endurance quadrotor to predict force and torque, along with noise at three specified locations. The derivative information is obtained via finite differences. Experimental results demonstrate that the proposed partitioned GP with gradient conditioning achieves higher accuracy than standard partitioned GPs without gradient information, while greatly reducing computational time. This framework provides an efficient foundation for real-time aerodynamic prediction and control algorithms in complex and unsteady environments.",https://arxiv.org/pdf/2602.12487v1,,False
