Title,Publication Date,Author(s),Abstract,Link,DOI,Relevant
"TDGT: A Tabular Data Generation Toolkit supporting adaptive GPU-accelerated Bayesian mixture models, diffusion-based models, and latent-space generative modeling",30/06/2026,"Vasileios C. Pezoulas, Nikolaos S. Tachos, Eleni Georga, Kostas Marias, Manolis Tsiknakis, Dimitrios I. Fotiadis","The growing demand for privacy-preserving data sharing has positioned synthetic data generation as a critical component of responsible AI workflows. Despite notable advances in generative modeling, existing solutions often lack integration of adaptive generation strategies, multi-metric evaluation, and accessible end-to-end generators within a unified web-based toolkit. In this work, we introduce TDGT (Tabular Data Generation Toolkit), a web-based toolkit for synthetic tabular data generation and fidelity assessment. TDGT introduces the Adaptive Bayesian Mixture Synthesizer (ABMS), a novel algorithm that autonomously determines the optimal number of mixture components through iterative cluster quality optimization, eliminating the need for manual hyperparameter configuration. Building upon ABMS, we further propose VAE-ABMS, a hybrid architecture that couples Variational Autoencoder-based latent space learning with adaptive Bayesian mixture synthesis, enabling high-fidelity generation of complex, nonlinear tabular distributions. For large-scale scenarios, TDGT provides a GPU-accelerated variant of ABMS leveraging CUDA-based k-means clustering and Gaussian mixture fitting. Synthetic data fidelity is assessed through eleven statistical fidelity metrics spanning distributional divergence, structural correlation, and sample-level similarity, complemented by privacy risk indicators including k-anonymity scoring and disclosure rate estimation. The web-based toolkit supports a real-time streaming interface with interactive Plotly-based visualizations. TDGT is assessed across datasets from healthcare, socioeconomic modeling, and cybersecurity domains, demonstrating consistent generation fidelity and statistical coherence across heterogeneous feature types and data scales.",https://arxiv.org/pdf/2606.31268v1,,False
Long-term Traffic Simulation via Structured Autoregressive Modeling,30/06/2026,"Lingyu Xiao, Zexin Feng, Xintao Yan","Interactive traffic simulation is a vital world model for autonomous driving. A central challenge in long-horizon simulation is modeling sustained multi-agent interactions, which is further exacerbated by dynamic token cardinality as agents continuously enter and exit the scene. In this work, we propose that the solution lies in the synergy between the architectural inductive biases and statistical priors of large-scale sequence models, e.g., Large Language Models (LLMs). Our probing experiments reveal that the transferability of attention mechanisms and the distributional consistency between motion tokens and natural language enable small-scale, heavily frozen LLMs to rapidly adapt to traffic modeling. Building on this insight, we introduce RosettaSim, a unified framework that projects scene topology, agent states, and spawning intents into a structured autoregressive stream with variable length, achieving both strong short-term accuracy and stable long-horizon simulation fidelity. Furthermore, evaluating extended rollouts presents yet another hurdle, as one-to-one agent correspondence inevitably fades over time. To address this, we introduce Retrieval-based Traffic Evaluation (RTE), which retrieves semantically similar real-world scenarios as context-aware reference anchors. Experiments on the Waymo Open Sim Agent Challenge (WOSAC) demonstrate that RosettaSim achieves state-of-the-art performance in both short- and long-term simulation. Furthermore, RTE exhibits a stronger correlation with standard metrics ($r=0.83$) than existing approaches ($r=0.74$), indicating improved alignment with long-horizon simulation fidelity.",https://arxiv.org/pdf/2606.31209v1,,False
MIRTH: Mutual-Information Reasoning with Temporal Hubs for Vision-Language-Action Agents,30/06/2026,"Hao Sun, Yu Song, Shiyu Teng, Ziwei Niu, Yen-Wei Chen","VLA models have emerged as a powerful paradigm for transferring semantic knowledge from web-scale data to physical robotic control. However, current single-frame architectures suffer from intrinsic limitations: temporal myopia that discards historical dynamics, reasoning gaps between high-level instructions and low-level motor commands, and inference inefficiency due to autoregressive scalar decoding. In this work, we propose MIRTH, a unified framework designed to address these challenges. MIRTH augments a pretrained VLA backbone with three key innovations: (1) dual-scale temporal memory hubs that compress long-term scene evolution and short-term motion trends into compact embeddings; (2) latent reasoning tokens optimized via a mutual-information objective carving out a semantic plan space to align multimodal context with action trajectories; and (3) a parallel action decoding scheme that replaces autoregressive generation with vector-wise prediction to maximize control throughput. Extensive evaluations on the LIBERO simulation benchmark and a real-world LeRobot platform demonstrate that MIRTH achieves state-of-the-art performance and exhibiting emergent error recovery capabilities. The codes and collected datasets are released at http://github.com/kiva12138/mirth.",https://arxiv.org/pdf/2606.31167v1,,False
TAG-DLM: Diffusion Language Models for Text-Attributed Graph Learning,30/06/2026,"Lingjie Chen, Yuanchen Bei, Haobo Xu, Yanjun Zhao, Yuzhong Chen, Hanghang Tong","Text-attributed graphs (TAGs), where each node carries a natural language description, require models to jointly reason over text and graph topology. Existing approaches often handle the two modalities separately: graph neural networks operate on shallow text features, while hybrids of LLMs and graphs use the language model mainly as a text encoder and delegate structure learning to a separate graph module. We propose method that unifies textual reasoning and graph message passing within a masked diffusion language model, a language model with bidirectional attention and generative decoding. For each graph instance, method linearises a sampled local neighbourhood into a token sequence and injects graph structure through a topology attention mask, which realises message passing over the graph. Because the diffusion language model can both interpret and generate text, the method adapts to different tasks simply by changing the prompt, supporting node classification, link prediction, and cross-dataset transfer with no target-specific fine-tuning.
  Experiments show that method outperforms graph neural networks, graph transformers, and LLM-based baselines on all three TAG benchmarks across two tasks, improving over the strongest baseline by up to 3.9 points.",https://arxiv.org/pdf/2606.31166v1,,False
"LLM-Powered Interactive Robotic Action Synthesis from Multimodal Speech, Gestures, and Music",30/06/2026,"Snehasis Banerjee, Ranjan Dasgupta","The quest for intuitive and natural human-robot interaction (HRI) remains a significant challenge in robotics. Traditional methods often rely on rigid, pre-programmed commands that limit the robot's expressiveness and adaptability. This paper introduces a novel framework that leverages the reasoning capabilities of Large Language Models (LLMs) to synthesize complex robotic actions from a rich tapestry of multimodal human inputs: natural speech, hand gestures, and music/sound beats. Our system architecture integrates a speech transcription model, a gesture recognition module, and a signal processing pipeline for beat detection. These processed inputs are contextualized using prompt templates and fed into a LLM. The LLM, informed by a predefined robot action space, reasons over the combined inputs to generate a coherent sequence of actions. This sequence is dispatched to an action queue for execution on a quadruped robot over ROS. The framework has ability to interpret and fuse semantic commands from speech, deictic information from gestures, and rhythmic cues from music. This work represents a step towards creating robots that can interact with humans in a more fluid, creative, and context-aware manner.",https://arxiv.org/pdf/2606.31158v1,,False
A Modular Vision-Language-Action Robotics Framework for Indoor Environments,30/06/2026,"Anindya Jana, Snehasis Banerjee, Arup Sadhu, Ranjan Dasgupta","This paper presents an integrated system for the CMU Vision-Language-Action (VLA) Challenge, designed to enable an autonomous agent to perform complex tasks based on natural language instructions. Our framework employs a modular architecture that orchestrates environment mapping, question processing, and navigation. The system operates in two parallel streams: a perception pipeline that constructs a semantic voxel map from real-time camera feeds using OwlViT embeddings, and a language pipeline that classifies user commands with a Vision-Language Model. The mapping is time-constrained; the system proceeds with a partial map if a 500-second exploration limit is reached. The classified query is then grounded in the geometric and semantic context of the map to generate a detailed prompt for the VLM. This yields an actionable output, demonstrating a capable solution for bridging the gap between human language and robotic action.",https://arxiv.org/pdf/2606.31144v1,,False
Scenario Generation for Testing of Autonomous Driving Systems Using Real-World Failure Records,30/06/2026,"Anjali Parashar, Chuchu Fan","To ensure safe on-road behavior, pre-deployment testing and failure discovery of Autonomous Driving Systems (ADS) is crucial. Present day simulation based testing methods focus largely on mathematical models for efficient search of optimal scenarios, assuming a fixed scenario representation. On the other hand, real-world testing involves substantial manual effort to design scenario templates for testing. These templates represent distinct failure scenarios consisting of pre-deployment vehicle movements, map types, etc. Historical failure records for ADS are a reliable source of real-world failure conditions, which can be used for scenario generation. In this work, we propose a scenario generation pipeline using categorical and contextual information available from historical records in natural language format. Our approach consists of modular LLM based synthetic scenario generation, compatible with the testing constraints of a given system. We successfully apply our method to generate a diverse set of scenarios for testing autonomous navigation on Metadrive simulator using the NHTSA ADS crash records. Our approach results in accurate and diverse scenario generation with a combination of 4 road types, 3 non ego vehicle movement types, including on road anomalies in the form of working zones. Generated scenarios align with the provided testing conditions, and reveals interesting failures of the system within a limited testing budget of 20 scenarios. Code is available at https://github.com/anjaliParashar/crash2scenario.",https://arxiv.org/pdf/2606.31131v1,,False
Can Tabular In-Context Learners Generalize to Biomolecular Property Prediction?,30/06/2026,"Davy Guan, Lu Zhang, Asiri Wijesinghe, Allen Zhu, He Zhao, Helen Power, F. Hafna Ahmed, Andrew Warden, Cheng Soon Ong, Daniel M. Steinberg","Predicting biomolecular properties from limited labeled data is a central bottleneck in protein engineering and small-molecule design. As strong pretrained encoders now supply rich fixed-length representations, the difficulty has shifted from representation learning to building a data-efficient predictor for the few-shot regime. Tabular foundation models such as TabPFN3 and TabICL are unlikely candidates for this role: they are in-context learners pretrained on synthetic tables drawn from random causal graphs, a generative prior with no obvious correspondence to the processes that produce protein sequences or molecular graphs. That this tabular, causal inductive bias should transfer to biomolecular data at all is unintuitive, yet we find it does. Treating each method as a predictor-representation pair, we evaluate across two domains. Over a fixed ESMC representation, tabular in-context learning is consistently competitive for protein fitness regression on ProteinGym and a diverse esterase dataset. For small-molecule classification with ECFP/RDKit descriptors, no single pairing dominates across TDC ADMET, MoleculeNet, FS-Mol, and DrugOOD; representation choice becomes a primary determinant, as expected when the predictor's own prior is indifferent to molecular structure. We conclude that tabular foundation models are strong performers on biomolecular prediction tasks, but that their performance depends strongly on the sequence or molecular representation used.",https://arxiv.org/pdf/2606.31126v1,,False
Revealing Safety-Critical Scenarios for UTM via Transformer,30/06/2026,"Huaze Tang, Bill Zeng, Chao Wang, Zhenpeng Shi, Qian Zhang, Wenbo Ding","Unmanned Traffic Management (UTM) systems are cloud-based platforms designed to manage and coordinate multiple aerial vehicles remotely. UTM systems are safety-critical which cannot tolerate failures like crash or collision. To reveal latent vulnerabilities, there are neither optimal failure-exposing demonstrations nor clear reward signals. Additionally, UTM's self-healing capability introduces the ``long-tail effect'' of critical failures. We propose framing UTM vulnerability discovery as a sequence modeling problem amenable to transformer-based RL architectures. Our approach leverages attention mechanisms to directly model the relationship among system states, and predict optimal actions. Our framework introduces a Policy Model that generates targeted test scenarios and an Action Sampler that enforces domain constraints. We use a risk-based reward function to guide exploration. Through extensive evaluation on a 700-hour simulation study, we demonstrate an 8$\times$ improvement in vulnerability discovery efficiency compared to expert-guided testing. It also discovers critical edge cases that traditional methods have missed.",https://arxiv.org/pdf/2606.31114v1,,False
What Probing Reveals about Autonomous Driving: Linking Internal Prediction Errors to Ego Planning,30/06/2026,"Hyeonchang Jeon, Kyungbeom Kim, Eugene Vinitsky, Kyung-Joong Kim","Large-scale datasets and fast simulators have enabled improvements in driving policies that appear safe and robust, yet strong performance in nominal scenarios can still mask flawed reasoning and unsafe heuristics. Summary scores from closed-loop simulators do not give significant insight into the policy, making it difficult to determine whether they truly predict the motion of surrounding vehicles, how the ego vehicle generates future plans, or whether they merely rely on brittle heuristics that happen to succeed in nominal scenarios. To better understand the limits and weaknesses of driving policies, we focus on probing for forms of prediction, i.e., where surrounding vehicles will move next, and planning, i.e., understanding how to generate safe trajectories. We focus on these two capabilities because they reflect behaviors expected of effective driving policies, and use their presence or absence to assess policy quality across data-driven behavior cloning and simulation-driven reinforcement learning policies. To evaluate the presence of these capabilities, we investigate them as a function of scale, asking whether the closed-loop gains from larger datasets and longer simulation training reflect stronger prediction and planning or merely better behavioral heuristics. We use linear probing and targeted perturbations in both imitation learning and reinforcement learning models to track when these internal signals emerge, plateau, or fail. Despite good closed-loop performance, policies often fail to form timely surrounding-vehicle predictions during near-collision events, revealing a limitation in the predictive signals available for ego planning. Finally, causal intervention shows that correcting mistaken predictions improves ego planning toward safer trajectories.",https://arxiv.org/pdf/2606.31106v1,,False
A Three-Phase Foundation Model for Tax-Aware Personalized Portfolio Management,30/06/2026,Ramin Pishehvar,"We present a three-phase deep reinforcement learning system for personalized portfolio management that addresses three limitations shared by all prior financial RL work: 1) ticker lock-in, 2) monolithic objectives , and 3) static user models. Phase 1 pretrains a ticker-identity-free cross asset encoder via self-supervised learning on a multi-asset corpus, augmented by a frozen parallel branch using Chronos, a T5-based time series foundation model, fused via a learned gating mechanism. To our knowledge, this is the first application of a time series foundation model to portfolio management RL. The encoder generalizes to any publicly traded asset via a 50-dimensional observable metadata vector that requires no retraining for new tickers. Phase 2 fine-tunes a MoE (Mixture of Experts) portfolio actor critic with PPO under an objective-conditioned reward that simultaneously serves six distinct investment goals sampled per episode: short-term alpha, short-term gain, long-term gain, capital preservation, tax-loss harvesting, and long-term-gains-only. A MoE architecture assigns each objective to a specialized expert head (momentum, growth, defensive, tax-aware), and a learned intent router blends experts based on the active objective and current market regime, which eliminates cross-objective gradient conflict. Phase 3 adds a lightweight personalization layer further adapted at inference time to each individual via a 76-parameter LoRA module fine-tuned on real brokerage transaction history, inferring investment objectives from revealed trading behavior rather than questionnaires. A natural language intent parser converts free-form goals directly into structured investment objective parameters.",https://arxiv.org/pdf/2606.30997v1,,False
