Title,Publication Date,Author(s),Abstract,Link,DOI,Relevant
Good Token Hunting: A Hitchhiker's Guide to Token Selection for Visual Geometry Transformers,22/05/2026,"Shuhong Zheng, Michael Oechsle, Erik Sandström, Marie-Julie Rakotosaona, Federico Tombari, Igor Gilitschenski","Visual geometry transformers have become powerful architectures for multi-view 3D reconstruction, enabling joint prediction of multiple 3D attributes in a feed-forward manner. However, their computational cost grows quadratically with the input sequence length due to the global attention layers inside these models. This limits both their scalability and efficiency. In this work, we address this challenge with a simple yet general strategy: restricting the number of key/value tokens that each query interacts with during global attention. To achieve effective token selection, we introduce a two-stage framework. First, an inter-frame selection step operates at the frame level to identify frames that should be preserved. Second, an intra-frame selection step further discards more redundant tokens within the selected frames. Our analysis highlights the advantage of a diversity-based strategy for inter-frame selection, which ensures broad coverage of the scene. For intra-frame selection, we show that layer-aware sparsification is necessary, with the selection process guided by the entropy of the global attention pattern. Our approach offers a superior speed-accuracy trade-off compared to existing solutions. Extensive experiments show that it accelerates visual geometry transformers by over 85% for scenes with 500 images while maintaining, or even improving, baseline performance, which hints that how our token selection strategy can play a crucial role in future applications of visual geometry transformers. Our project website is available at https://zsh2000.github.io/good-token-hunting.github.io.",https://arxiv.org/pdf/2605.23892v1,,False
Entrywise Error Bounds for Spectral Ranking with Semi-Random Adversaries,22/05/2026,"Dongmin Lee, Anuran Makur, Japneet Singh","Bradley-Terry-Luce (BTL) model estimation is a well-established strategy to rank a collection of items given a dataset of pairwise comparisons. Although the theoretical performance of BTL estimation methods, such as spectral and maximum likelihood estimation, is well studied in the regime of uniformly sampled graphs, generalizing such results to a wider class of random graphs has proved challenging. In this work, we investigate the entry-wise error of spectral algorithms against a semi-random adversary that can arbitrarily boost the sampling probabilities of certain edges. We find that the performance of the unweighted spectral method is heavily dependent on the spectral properties of the generated graph. Furthermore, we show that asymptotic performance approaching that of uniformly sampled graphs can be recovered by appropriately reweighting the observed edges to counteract the adversary and restore the spectral gap. Finally, we provide numerical simulations that support our theoretical findings.",https://arxiv.org/pdf/2605.23854v1,,False
Preisach Attention: A Hysteretic Model of Sequential Memory,22/05/2026,Piotr Frydrych,"We introduce the Preisach Attention Layer (PAL), a novel sequence modelling architecture grounded in the classical Preisach hysteresis operator from mathematical physics. PAL replaces the softmax attention mechanism with a binary relay operator parameterised by learned activation and deactivation thresholds, maintaining a stack of local extrema as its internal state. A single-layer PAL-Transformer with O(1) depth is Turing-complete under arbitrary precision arithmetic, achievable through simulation of a two-stack pushdown automaton -- in contrast to the O(log n) depth required by standard hard-attention transformers. Second, we prove that the function classes computable by PAL and by the transformer are incomparable: PAL computes historical range statistics in O(1) layers that require O(log n) layers for transformers, while transformers support random-access retrieval that PAL cannot perform without auxiliary state. The separating property is rate-independence -- PAL responds only to the sequence of local extrema, not to absolute token positions or temporal spacing. Third, we show that the extremum stack constitutes a minimal sufficient statistic of the input history for all rate-independent functionals, providing a formal analogue of the wiping property in classical hysteresis theory. PAL is thus an efficient architecture for tasks with long episodic memory and weak positional dependence, with O(n log n) total inference cost versus O(n^2) for standard attention.",https://arxiv.org/pdf/2605.23603v1,,False
Learning Individual Dynamics from Sparse Cross-Sectional Snapshots,22/05/2026,"Christian Lagemann, Kai Lagemann, Steven L. Brunton, Sach Mukherjee","Predicting how a dynamical unit evolves over time - how an individual ages, an epidemic spreads, or a physical system degrades - typically requires dense longitudinal tracking. When only extremely sparse or entirely cross-sectional data is available, inferring individualized, continuous-time trajectories is fundamentally ill-posed. Existing methods force a strict compromise: sequence models (e.g. latent ODEs) require dense longitudinal data, while cross-sectional methods (e.g. optimal transport, flow matching-based) map aggregate populations, losing individual dynamics. In this paper, we demonstrate that this dichotomy can be broken. We introduce CADENCE, a principled probabilistic framework that recovers continuous individual trajectories from isolated snapshots by anchoring latent dynamics to static, individual-level contexts. We provide novel identifiability guarantees for single-timepoint trajectory inference. By combining a score-based spatial encoder (bijective Probability Flow ODE) to eliminate diffeomorphic ambiguities with a Soft Mixture-of-Experts (SMoE) router, we show that individual dynamical parameters and routing function are jointly identifiable. Across a suite of benchmarks spanning physical systems to real-world biological data, CADENCE, trained strictly on extremely sparse snapshots with context structure, matches or exceeds the performance of state-of-the-art sequential models trained on dense, full-trajectory data.",https://arxiv.org/pdf/2605.23470v1,,False
Hybrid Quantum-Classical Corrective Diffusion Modeling for Meteorological Downscaling,22/05/2026,"Rui Wang, Edoardo Pasetto, Amer Delilbasic, Morris Riedel, Kristel Michielsen, Gabriele Cavallaro","Statistical downscaling is a crucial component of the weather modeling field, where high-resolution outputs must be reconstructed from coarse-resolution inputs with the full cost of dynamical refinement. In this work, we investigate a hybrid quantum-classical corrective diffusion model for probabilistic statistical downscaling of weather fields. The proposed model inserts variational quantum circuit layers into the most compressed bottleneck of the diffusion UNet while leaving the regression branch fully classical. This placement tests whether quantum circuits can act as compact nonlinear feature maps for latent-channel mixing. We evaluate intra-channel and cross-channel ansätze on 10m wind components. On the 2020 validation set, the hybrid models remain stable, preserve the large-scale spatial organization of the generated wind fields, and improve both MAE and CRPS relative to a classical corrective diffusion model in several configurations. Structural diagnostics further show that the hybrid variants preserve kinetic-energy spectra and windspeed distributions similar to its classical counterpart while producing controlled changes in tail behavior, extreme-windspeed localization, and joint wind field components structure. Backend studies on the 2020 validation set show negligible impact from simulated device noise at the tested circuit scale, whereas real-hardware deployment remains limited by qubit availability and execution fidelity. The 2021 out-of-distribution test shows that these in-distribution gains do not transfer uniformly under temporal shift, revealing a generalization gap that motivates future mitigation through stabilization and regularization. These results show that bottleneck-level quantum hybridization can make a nontrivial contribution to weather statistical downscaling, while also highlighting that circuit scale and hardware deployment remain key limiting factors.",https://arxiv.org/pdf/2605.23403v1,,False
Parametric Prior Mapping Framework for Non-stationary Probabilistic Time Series Forecasting,22/05/2026,"Jinglin Li, Jun Tan, QI Fang, Ning Gui","Effectively modeling non-stationary dynamics in probabilistic multivariate time series(MTS) forecasting requires balancing expressiveness with robustness. Existing parametric approaches benefit from strong inductive biases but lack flexibility, whereas deep generative models struggle to capture complex temporal dependencies without extensive data and computation. We introduce Parametric Prior Mapping (PPM), a framework that injects parametric structural priors into a generative modeling process. Specifically, PPM utilizes a parametric estimator to derive a dynamic, adaptive prior that guides the learning of a complex predictive distribution via a learnable mapping. This design allows the model to retain the efficiency of parametric methods while exploiting the expressive power of generative models. Trained with a hybrid objective, PPM yields precise forecasts with well-calibrated uncertainty estimates. Empirical results show that PPM outperforms existing baselines in handling non-stationary data, offering a superior trade-off between accuracy and computational efficiency. The code is available at https://github.com/ljl8336/PPM.",https://arxiv.org/pdf/2605.23402v1,,False
Curriculum reinforcement learning with measurable task representation learning,22/05/2026,"Yongyan Wen, Siyuan Li, Mingjian Fu, Yiqin Yang, Xun Wang, Peng Liu","In curriculum reinforcement learning (CRL), an agent incrementally accumulates knowledge over a sequence of tasks (i.e., a curriculum), and the learning process is aimed at using the accumulated knowledge to finally solve a challenging target task. While early CRL works focus on sequencing candidate tasks, recent research explores automatic curriculum generation. Among the rich CRL literature, the interpolation-based CRL paradigm is a main body, which automatically generates intermediate tasks by interpolating between the initial task distribution and the target task distribution in task space with meaningful distance metrics (i.e., can measure the task similarity). However, in challenging navigation tasks, the non-Euclidean context (task) space invalidates this assumption. To achieve automatic curriculum generation in complex task, we propose a novel automatic curriculum generation approach based on measurable task representation learning. To better measure the similarity, we propose to transform the task space to a latent space. Through a variational autoencoder structure that encodes the reward and the state transitions, we achieve a latent task representation with a task similarity measurement property, and two close task embeddings correspond to two similar tasks in terms of rewards and state transitions. Based on the learned task representation, we further develop an automatic curriculum generation scheme, which can effectively generate new tasks more and more similar to the target task. We evaluate our method in a variety of challenging navigation tasks, and the experiment results indicate that the proposed approach surpasses state-of-the-art CRL approaches based on interpolation and generative adversarial networks.",https://arxiv.org/pdf/2605.23372v1,10.1016/j.neunet.2026.109019,False
Contrastive Distribution Matching for Amortized Sequential Monte Carlo in Discrete Diffusion,22/05/2026,"Jaihoon Kim, Taehoon Yoon, Prin Phunyaphibarn, Seungjun Kim, Morteza Mardani, Minhyuk Sung","Discrete diffusion models have emerged as powerful frameworks for generating structured categorical data. However, efficiently sampling from reward-tilted distributions remains a fundamental challenge. While Twisted Sequential Monte Carlo (SMC) offers asymptotic exactness for this task, estimating the optimal twist function in discrete state spaces necessitates costly Monte Carlo approximations, resulting a severe computational bottleneck at inference. To overcome this limitation, we introduce Contrastive Distribution Matching (CDM), a novel framework that amortizes the cost of SMC inference by learning a parameterized twist function via positive and negative samples. For efficient training, we reformulate the gradient estimator to leverage the closed-form forward kernels of discrete diffusion models. In practice, evaluating our learned twist function incurs less than 5% additional computational overhead compared to a single forward pass of the base model. Through extensive empirical evaluations, we demonstrate that CDM consistently outperforms existing baselines under matched wall-clock time. We validate the effectiveness and versatility of our approach across a diverse range of applications, including toxic text generation, regulatory DNA sequence design, protein designability, and diffusion large language model alignment.",https://arxiv.org/pdf/2605.23346v1,,False
Sparse Compositional Flow Matching by geometric assembly from motion primitives,22/05/2026,"Yan Tang, Yuanbo Tang, Tingyu Cao, Shaolun Huang, Yang Li","Embodied trajectories, such as the executable motion sequences of robotic manipulators, underwater vehicles, and mobile robots, are a fundamental output of embodied AI. Modern generative models often treat them as a dense, monolithic signal generated point by point, fitting an intricate high-dimensional posterior while leaving the data's latent structure unmodeled, the same sample inefficiency long identified by the structured generative model literature. We argue that a compositional latent structure is a natural choice: many embodied tasks share recurring motion fragments that can be made explicit as a finite repertoire of reusable motion primitives, and compositional units naturally align with subtask boundaries to support task decomposition. Existing compositional generators, however, compose in a latent space and rely on post-hoc decoding to relate sampled units to actual trajectory segments. We instead compose directly in the physical trajectory space through a flow-matching framework with two coupled designs. Motion-Primitive Dictionary Learning equips each atom with a learnable length mask and binary starting indicators so the atom itself is the primitive, reused verbatim wherever it is placed. Structural Sparse Flow Matching with Geometric Constraints then generates a binary placement matrix using duration-aware tokenization and a differentiable geometric loss that enforces spatial continuity and temporal contiguity where adjacent primitives meet. On Open X-Embodiment and 3DMoTraj, the framework attains state-of-the-art accuracy and reduces the FDE/ADE ratio from 1.8 to 1.07, improving ADE by 19.2% and FDE by 21.0% over the strongest baseline.",https://arxiv.org/pdf/2605.23341v1,,False
Reinforcement Learning for Microcanonical Graph Ensemble with Assortativity Constraints,22/05/2026,"Hoyun Choi, Junghyo Jo, Deok-Sun Lee","How network structure determines function is a fundamental question, and it can be investigated by graph ensembles with precisely controlled structural properties. Canonical approaches, formulated as exponential random graph models (ERGMs), enforce constraints only in expectation, allowing individual realizations to fluctuate around the target. Conversely, microcanonical ensembles impose hard constraints exactly, but practical sampling methods beyond fixing the degree sequence have remained out of reach. Here we introduce the Deep Microcanonical Graph Generator (DMGG), a reinforcement learning (RL) framework that transforms any given graph through degree-preserving rewirings to exactly reach a prescribed assortativity, which characterizes the degree--degree correlation of adjacent nodes. Instead of relying on the entropically dominated Metropolis--Hastings dynamics of the ERGM, DMGG employs a policy-guided search that maximally alters the joint-degree matrix. This eliminates exhaustive parameter tuning and accelerates generation by at least an order of magnitude while preserving configurational diversity. As DMGG generalizes across various graph sizes, sparsities, and topologies, it provides exact null models that allow for the quantitative isolation of secondary observables, such as the clustering coefficient. These results establish RL as a practical and powerful paradigm for generating hard-constrained graphs, opening avenues to investigate structure-function relationships free from ensemble artifacts.",https://arxiv.org/pdf/2605.23285v1,,False
"When Is Next-Token Prediction Useful? Marginalization, Ergodicity, Mixture Identifiability, Local Sufficiency, RAG, Tools, and Programming",22/05/2026,Francesco Corielli,"Language models trained on observed sequences are often described as learning the conditional distribution of the next token given previous tokens. This description is only conditionally correct. A model trained on realized token trajectories does not observe full conditional laws; it receives sampled continuations. Moreover, real language generation is conditioned not only on previous words but also on non-textual circumstances: facts, events, intentions, goals, beliefs, social context, and task-specific constraints. This paper distinguishes three objects that are often conflated: the full conditional language process conditioned on latent circumstances, the marginal text-only process obtained by integrating those circumstances out, and the model-induced distribution learned from finite observed corpora.
  The paper argues that interpreting model training as estimating the marginal text-only law requires strong assumptions of stationarity, representativeness, and ergodicity, assumptions that are standard in statistical estimation but problematic when applied to heterogeneous language corpora. Even if these assumptions hold, the marginal text-only law is useful only when the observed prefix is an approximately sufficient statistic for the latent circumstances relevant to continuation. In information-theoretic terms, usefulness requires that the residual conditional mutual information between the next token and the omitted circumstances, given the observed text, be small.
  The paper then extends this argument to heterogeneous training corpora.
  Finally, the paper interprets Retrieval Augmented Generation (RAG) and tool use as conditional sufficiency devices.",https://arxiv.org/pdf/2605.23278v1,,False
EvalVerse: Pipeline-Aware and Expert-Calibrated Benchmarking for Professional Cinematic Video Generation,22/05/2026,"Songlin Yang, Haobin Zhong, Ruilin Zhang, Xiaotong Zhao, Shuai Li, Kai Zheng, Xuyi Yang, Zhe Wang, Zhenchen Tang, Yang Li, Bohai Gu, Zhengwei Peng, Yidan Huang, Mengzhou Luo, Yihang Bo, Dalu Feng, Yujia Zhang, Juntao Ma, Ruiqi Wang, Lvmin Zhang, Yuwei Guo, Frank Guan, Maneesh Agrawala, Hongbo Fu, Alan Zhao, Anyi Rao","The rapid evolution of generative video foundation models has propelled the field toward professional-grade cinematic synthesis. To achieve such demanding quality, the community transitions towards Reinforcement Learning (RL) and agentic workflows. However, reliable evaluation has emerged as a critical bottleneck. Existing benchmarks predominantly evaluate ''whether it is right'' (basic prompt-following) while fundamentally neglecting ''whether it is good'' (cinematic quality, acting, and aesthetics). Furthermore, current automated metrics lack the domain-specific rigor required to provide trustworthy signals, creating a severe credibility gap between human aesthetic perception and machine scoring. To bridge this gap, we introduce EvalVerse, a comprehensive, pipeline-aware, and expert-calibrated evaluation framework. We treat video generation assessment not merely as an engineering task, but as a core scientific problem: the systematic digitization of subjective cinematic expertise. First, we organize domain knowledge into an evaluation taxonomy aligned with the professional filmmaking workflow (pre-production, production, and post-production). Second, we distill human expert judgments into a curated dataset with large-scale human annotations. Third, we inject this knowledge into Vision-Language Models (VLMs) through an expert-calibrated fine-tuning strategy, enabling the VLM to perform explicit Chain-of-Thought reasoning. Compared to previous works, EvalVerse not only retains compatibility with foundational ''rightness'' metrics, but also significantly expands the criteria to ''goodness'' and broaden the task coverage to complex multi-shot sequencing and audio-visual integration. Consequently, by providing granular diagnostic signals, EvalVerse transcends a static leaderboard and establishes a fundamental infrastructure for future work, such as reward models and evaluator agent.",https://arxiv.org/pdf/2605.23271v1,,False
Are Frontier LLMs Ready for Cybersecurity? Evidence for Vertical Foundation Models from Dual-Mode Vulnerability Benchmarks,22/05/2026,"Vivek Dahiya, Sunny Nehra, Vipul Dholariya, Bhavik Shangari, Chandra Khatri","We evaluate whether frontier LLMs are ready for cybersecurity through a dual-mode benchmark: white-box function-level vulnerability detection (VulnLLM-R, across C/Java/Python) and black-box web application security testing (five production-style applications with 118 ground-truth vulnerabilities across 20+ CWE families, which we will open-source). We test six frontier models (GPT-5.4, Codex~5.3, Claude Opus~4.6, Sonnet~4.6, Gemini~3.1~Pro and Gemini~3~Flash) and two domain-specialized models across four testing paradigms. Our findings are sobering: (1)~every frontier model produces 10-50% false positive rates in white-box detection, systematically over-predicting vulnerabilities; (2)~in black-box testing, frontier models achieve only 4-8% ground-truth coverage, improving to just 10-19% even with external security tools (Playwright MCP, Burp Suite MCP); (3)~structured penetration-testing methodology encoded in domain-specialized agents raises per-family detection above 50%, demonstrating that methodology, not scale, is the primary lever; and (4)~a domain-specialized defense model achieves the highest precision (0.904) and lowest false positive rate (9.7%) among all models, on a single GPU. We identify the absence of structured security testing traces end-to-end request/response sequences, failure-heavy data, and multi-step attack chains as the fundamental training data bottleneck, and propose self-play security testing as a data generation strategy. Our results make the case for vertical foundation models purpose-built for cybersecurity.",https://arxiv.org/pdf/2605.23243v1,,False
Autonomous Frontier-Based Exploration with VLM Guidance,22/05/2026,"Aarush Aitha, Avideh Zakhor","Autonomous robotic exploration of unknown and hazardous environments, a long-standing challenge, can be significantly improved by leveraging the advanced reasoning of Vision-Language Models (VLMs). We introduce a novel exploration pipeline where a VLM performs high-level strategic decision-making, guiding a conventional low-level robotics control stack. At decision points, the robot generates a multimodal prompt with its current map and visual imagery of potential paths, or frontiers. The VLM analyzes this prompt to select the most promising frontier, replacing simple geometric heuristics with contextual spatial reasoning. This approach, validated in simulation across six indoor environments, improves map coverage by up to 24\% over existing methods. Our pipeline is lightweight, training-free, and easily transferable to any robot with standard sensors and an internet connection.",https://arxiv.org/pdf/2605.23165v1,,False
"As X, Do Y: How Persona and Task Combine in Instruction-Tuned LLMs",22/05/2026,Eric Xu,"Role prompts of the form As X, do Y admit a clean linear decomposition at one specific site in the residual stream: the prompt-to-answer transition -- the last prompt token together with the first two generated tokens -- in an early/mid layer band. There, persona and task contribute through partially orthogonal additive directions. Forming a pure persona effect $Δ_X$, a pure task effect $Δ_Y$, and substituting $h_{BB} + Δ_X + Δ_Y$ for the clean residual yields downstream output within a small KL of clean on Gemma-2-2B-IT and Qwen-2.5-\{1.5B, 3B\}-Instruct, across a 12-cell short grid and a 48-cell long-persona grid, with persona-specific behavioral markers preserved.
  The natural inference from this additive structure is that the role prompt can be compressed into a single cached residual vector. \emph{We show it cannot.} Injecting the cached additive prediction -- or even the oracle clean residual $h_{XY}$ -- into a baseline host prompt with the persona text removed does not approach the clean long-persona target, at one site or at many layers. Persona-conditioned multi-token generation flows through attention back to the persona-text positions throughout the prompt, which no residual at one site reproduces.
  Local additivity in the residual stream does not imply prompt compressibility. The additive structure at the prompt-to-answer transition supports interpretability and fine-grained steering of persona or task contributions; persona-conditioned behavior across the full continuation depends on a distributed prompt/KV mechanism that local activation arithmetic does not displace.",https://arxiv.org/pdf/2605.23147v1,,False
