Title,Publication Date,Author(s),Abstract,Link,DOI,Relevant
TSSR: Two-Stage Swap-Reward-Driven Reinforcement Learning for Character-Level SMILES Generation,08/01/2026,"Jacob Ede Levine, Yun Lyan Luo, Sai Chandra Kosaraju","The design of reliable, valid, and diverse molecules is fundamental to modern drug discovery, as improved molecular generation supports efficient exploration of the chemical space for potential drug candidates and reduces the cost of early design efforts. Despite these needs, current chemical language models that generate molecules as SMILES strings are vulnerable to compounding token errors: many samples are unparseable or chemically implausible, and hard constraints meant to prevent failure can restrict exploration. To address this gap, we introduce TSSR, a Two-Stage, Swap-Reward-driven reinforcement learning (RL) framework for character-level SMILES generation. Stage one rewards local token swaps that repair syntax, promoting transitions from invalid to parseable strings. Stage two provides chemistry-aware feedback from RDKit diagnostics, rewarding reductions in valence, aromaticity, and connectivity issues. The reward decomposes into interpretable terms (swap efficiency, error reduction, distance to validity), is model agnostic, and requires no task-specific labels or hand-crafted grammars. We evaluated TSSR on the MOSES benchmark using a GRU policy trained with PPO in both pure RL (P-RL) from random initialization and fine-tuning RL (F-RL) starting from a pretrained chemical language model, assessing 10,000 generated SMILES per run. In P-RL, TSSR significantly improves syntactic validity, chemical validity, and novelty. In F-RL, TSSR preserves drug-likeness and synthesizability while increasing validity and novelty. Token-level analysis shows that syntax edits and chemistry fixes act jointly to reduce RDKit detected errors. TSSR converts a sparse terminal objective into a denser and more interpretable reward, improving both syntactic and chemical quality without reducing diversity. TSSR is dataset-agnostic and can be adapted to various reinforcement learning approaches.",https://arxiv.org/pdf/2601.04521v1,,False
Towards Spatio-Temporal Extrapolation of Phase-Field Simulations with Convolution-Only Neural Networks,08/01/2026,"Christophe Bonneville, Nathan Bieberdorf, Pieterjan Robbe, Mark Asta, Habib Najm, Laurent Capolungo, Cosmin Safta","Phase-field simulations of liquid metal dealloying (LMD) can capture complex microstructural evolutions but can be prohibitively expensive for large domains and long time horizons. In this paper, we introduce a fully convolutional, conditionally parameterized U-Net surrogate designed to extrapolate far beyond its training data in both space and time. The architecture integrates convolutional self-attention, physically informed padding, and a flood-fill corrector method to maintain accuracy under extreme extrapolation, while conditioning on simulation parameters allows for flexible time-step skipping and adaptation to varying alloy compositions. To remove the need for costly solver-based initialization, we couple the surrogate with a conditional diffusion model that generates synthetic, physically consistent initial conditions. We train our surrogate on simulations generated over small domain sizes and short time spans, but, by taking advantage of the convolutional nature of U-Nets, we are able to run and extrapolate surrogate simulations for longer time horizons than what would be achievable with classic numerical solvers. Across multiple alloy compositions, the framework is able to reproduce the LMD physics accurately. It predicts key quantities of interest and spatial statistics with relative errors typically below 5% in the training regime and under 15% during large-scale, long time-horizon extrapolations. Our framework can also deliver speed-ups of up to 36,000 times, bringing the time to run weeks-long simulations down to a few seconds. This work is a first stepping stone towards high-fidelity extrapolation in both space and time of phase-field simulation for LMD.",https://arxiv.org/pdf/2601.04510v1,,False
Surface-based Molecular Design with Multi-modal Flow Matching,08/01/2026,"Fang Wu, Zhengyuan Zhou, Shuting Jin, Xiangxiang Zeng, Jure Leskovec, Jinbo Xu","Therapeutic peptides show promise in targeting previously undruggable binding sites, with recent advancements in deep generative models enabling full-atom peptide co-design for specific protein receptors. However, the critical role of molecular surfaces in protein-protein interactions (PPIs) has been underexplored. To bridge this gap, we propose an omni-design peptides generation paradigm, called SurfFlow, a novel surface-based generative algorithm that enables comprehensive co-design of sequence, structure, and surface for peptides. SurfFlow employs a multi-modality conditional flow matching (CFM) architecture to learn distributions of surface geometries and biochemical properties, enhancing peptide binding accuracy. Evaluated on the comprehensive PepMerge benchmark, SurfFlow consistently outperforms full-atom baselines across all metrics. These results highlight the advantages of considering molecular surfaces in de novo peptide discovery and demonstrate the potential of integrating multiple protein modalities for more effective therapeutic peptide discovery.",https://arxiv.org/pdf/2601.04506v1,,False
A Generalized Adaptive Joint Learning Framework for High-Dimensional Time-Varying Models,08/01/2026,"Baolin Chen, Mengfei Ran","In modern biomedical and econometric studies, longitudinal processes are often characterized by complex time-varying associations and abrupt regime shifts that are shared across correlated outcomes. Standard functional data analysis (FDA) methods, which prioritize smoothness, often fail to capture these dynamic structural features, particularly in high-dimensional settings. This article introduces Adaptive Joint Learning (AJL), a regularization framework designed to simultaneously perform functional variable selection and structural changepoint detection in multivariate time-varying coefficient models. We propose a convex optimization procedure that synergizes adaptive group-wise penalization with fused regularization, effectively borrowing strength across multiple outcomes to enhance estimation efficiency. We provide a rigorous theoretical analysis of the estimator in the ultra-high-dimensional regime (p >> n), establishing non-asymptotic error bounds and proving that AJL achieves the oracle property--performing as well as if the true active set and changepoint locations were known a priori. A key theoretical contribution is the explicit handling of approximation bias via undersmoothing conditions to ensure valid asymptotic inference. The proposed method is validated through comprehensive simulations and an application to Primary Biliary Cirrhosis (PBC) data. The analysis uncovers synchronized phase transitions in disease progression and identifies a parsimonious set of time-varying prognostic markers.",https://arxiv.org/pdf/2601.04499v1,,False
A Closed-Loop Multi-Agent System Driven by LLMs for Meal-Level Personalized Nutrition Management,08/01/2026,Muqing Xu,"Personalized nutrition management aims to tailor dietary guidance to an individual's intake and phenotype, but most existing systems handle food logging, nutrient analysis and recommendation separately. We present a next-generation mobile nutrition assistant that combines image based meal logging with an LLM driven multi agent controller to provide meal level closed loop support. The system coordinates vision, dialogue and state management agents to estimate nutrients from photos and update a daily intake budget. It then adapts the next meal plan to user preferences and dietary constraints. Experiments with SNAPMe meal images and simulated users show competitive nutrient estimation, personalized menus and efficient task plans. These findings demonstrate the feasibility of multi agent LLM control for personalized nutrition and reveal open challenges in micronutrient estimation from images and in large scale real world studies.",https://arxiv.org/pdf/2601.04491v1,,False
