Title,Publication Date,Author(s),Abstract,Link,DOI,Relevant
Modeling Social Media Recommendation Impacts Using Academic Networks: A Graph Neural Network Approach,06/10/2024,"Sabrina Guidotti, Gregor Donabauer, Simone Somazzi, Udo Kruschwitz, Davide Taibi, Dimitri Ognibene","The widespread use of social media has highlighted potential negative impacts
on society and individuals, largely driven by recommendation algorithms that
shape user behavior and social dynamics. Understanding these algorithms is
essential but challenging due to the complex, distributed nature of social
media networks as well as limited access to real-world data. This study
proposes to use academic social networks as a proxy for investigating
recommendation systems in social media. By employing Graph Neural Networks
(GNNs), we develop a model that separates the prediction of academic infosphere
from behavior prediction, allowing us to simulate recommender-generated
infospheres and assess the model's performance in predicting future
co-authorships. Our approach aims to improve our understanding of
recommendation systems' roles and social networks modeling. To support the
reproducibility of our work we publicly make available our implementations:
https://github.com/DimNeuroLab/academic_network_project",http://arxiv.org/pdf/2410.04552v1,,False
Pullback Flow Matching on Data Manifolds,06/10/2024,"Friso de Kruiff, Erik Bekkers, Ozan Öktem, Carola-Bibiane Schönlieb, Willem Diepeveen","We propose Pullback Flow Matching (PFM), a novel framework for generative
modeling on data manifolds. Unlike existing methods that assume or learn
restrictive closed-form manifold mappings for training Riemannian Flow Matching
(RFM) models, PFM leverages pullback geometry and isometric learning to
preserve the underlying manifold's geometry while enabling efficient generation
and precise interpolation in latent space. This approach not only facilitates
closed-form mappings on the data manifold but also allows for designable latent
spaces, using assumed metrics on both data and latent manifolds. By enhancing
isometric learning through Neural ODEs and proposing a scalable training
objective, we achieve a latent space more suitable for interpolation, leading
to improved manifold learning and generative performance. We demonstrate PFM's
effectiveness through applications in synthetic data, protein dynamics and
protein sequence data, generating novel proteins with specific properties. This
method shows strong potential for drug discovery and materials science, where
generating novel samples with specific properties is of great interest.",http://arxiv.org/pdf/2410.04543v1,,False
Improved Off-policy Reinforcement Learning in Biological Sequence Design,06/10/2024,"Hyeonah Kim, Minsu Kim, Taeyoung Yun, Sanghyeok Choi, Emmanuel Bengio, Alex Hernández-García, Jinkyoo Park","Designing biological sequences with desired properties is a significant
challenge due to the combinatorially vast search space and the high cost of
evaluating each candidate sequence. To address these challenges, reinforcement
learning (RL) methods, such as GFlowNets, utilize proxy models for rapid reward
evaluation and annotated data for policy training. Although these approaches
have shown promise in generating diverse and novel sequences, the limited
training data relative to the vast search space often leads to the
misspecification of proxy for out-of-distribution inputs. We introduce
$\delta$-Conservative Search, a novel off-policy search method for training
GFlowNets designed to improve robustness against proxy misspecification. The
key idea is to incorporate conservativeness, controlled by parameter $\delta$,
to constrain the search to reliable regions. Specifically, we inject noise into
high-score offline sequences by randomly masking tokens with a Bernoulli
distribution of parameter $\delta$ and then denoise masked tokens using the
GFlowNet policy. Additionally, $\delta$ is adaptively adjusted based on the
uncertainty of the proxy model for each data point. This enables the reflection
of proxy uncertainty to determine the level of conservativeness. Experimental
results demonstrate that our method consistently outperforms existing machine
learning methods in discovering high-score sequences across diverse
tasks-including DNA, RNA, protein, and peptide design-especially in large-scale
scenarios.",http://arxiv.org/pdf/2410.04461v1,,False
TimeBridge: Non-Stationarity Matters for Long-term Time Series Forecasting,06/10/2024,"Peiyuan Liu, Beiliang Wu, Yifan Hu, Naiqi Li, Tao Dai, Jigang Bao, Shu-tao Xia","Non-stationarity poses significant challenges for multivariate time series
forecasting due to the inherent short-term fluctuations and long-term trends
that can lead to spurious regressions or obscure essential long-term
relationships. Most existing methods either eliminate or retain
non-stationarity without adequately addressing its distinct impacts on
short-term and long-term modeling. Eliminating non-stationarity is essential
for avoiding spurious regressions and capturing local dependencies in
short-term modeling, while preserving it is crucial for revealing long-term
cointegration across variates. In this paper, we propose TimeBridge, a novel
framework designed to bridge the gap between non-stationarity and dependency
modeling in long-term time series forecasting. By segmenting input series into
smaller patches, TimeBridge applies Integrated Attention to mitigate short-term
non-stationarity and capture stable dependencies within each variate, while
Cointegrated Attention preserves non-stationarity to model long-term
cointegration across variates. Extensive experiments show that TimeBridge
consistently achieves state-of-the-art performance in both short-term and
long-term forecasting. Additionally, TimeBridge demonstrates exceptional
performance in financial forecasting on the CSI 500 and S&P 500 indices,
further validating its robustness and effectiveness. Code is available at
\url{https://github.com/Hank0626/TimeBridge}.",http://arxiv.org/pdf/2410.04442v1,,False
GenSim: A General Social Simulation Platform with Large Language Model based Agents,06/10/2024,"Jiakai Tang, Heyang Gao, Xuchen Pan, Lei Wang, Haoran Tan, Dawei Gao, Yushuo Chen, Xu Chen, Yankai Lin, Yaliang Li, Bolin Ding, Jingren Zhou, Ji-Rong Wen","With the rapid advancement of large language models (LLMs), recent years have
witnessed many promising studies on leveraging LLM-based agents to simulate
human social behavior. While prior work has demonstrated significant potential
across various domains, much of it has focused on specific scenarios involving
a limited number of agents and has lacked the ability to adapt when errors
occur during simulation. To overcome these limitations, we propose a novel
LLM-agent-based simulation platform called \textit{GenSim}, which: (1)
\textbf{Abstracts a set of general functions} to simplify the simulation of
customized social scenarios; (2) \textbf{Supports one hundred thousand agents}
to better simulate large-scale populations in real-world contexts; (3)
\textbf{Incorporates error-correction mechanisms} to ensure more reliable and
long-term simulations. To evaluate our platform, we assess both the efficiency
of large-scale agent simulations and the effectiveness of the error-correction
mechanisms. To our knowledge, GenSim represents an initial step toward a
general, large-scale, and correctable social simulation platform based on LLM
agents, promising to further advance the field of social science.",http://arxiv.org/pdf/2410.04360v1,,False
"Spectral Densities, Structured Noise and Ensemble Averaging within Open Quantum Dynamics",05/10/2024,"Yannick Marcel Holtkamp, Emiliano Godinez-Ramirez, Ulrich Kleinekathöfer","Although recent advances in simulating open quantum systems have lead to
significant progress, the applicability of numerically exact methods is still
restricted to rather small systems. Hence, more approximate methods remain
relevant due to their computational efficiency, enabling simulations of larger
systems over extended timescales. In this study, we present advances for one
such method, namely the Numerical Integration of Schr\""odinger Equation (NISE).
Firstly, we introduce a modified ensemble-averaging procedure that improves the
long-time behavior of the thermalized variant of the NISE scheme, termed
Thermalized NISE. Secondly, we demonstrate how to use the NISE in conjunction
with (highly) structured spectral densities by utilizing a noise generating
algorithm for arbitrary structured noise. This algorithm also serves as a tool
for establishing best practices in determining spectral densities from excited
state calculations along molecular dynamics or quantum mechanics/molecular
mechanics trajectories. Finally, we assess the ability of the NISE approach to
calculate absorption spectra and demonstrate the utility of the proposed
modifications by determining population dynamics.",http://arxiv.org/pdf/2410.04294v1,10.1063/5.0224807,False
Constructing Cloze Questions Generatively,05/10/2024,"Yicheng Sun, Jie Wang","We present a generative method called CQG for constructing cloze questions
from a given article using neural networks and WordNet, with an emphasis on
generating multigram distractors. Built on sense disambiguation, text-to-text
transformation, WordNet's synset taxonomies and lexical labels, CQG selects an
answer key for a given sentence, segments it into a sequence of instances,
generates instance-level distractor candidates (IDCs) using a transformer and
sibling synsets.It then removes inappropriate IDCs, ranks the remaining IDCs
based on contextual embedding similarities, as well as synset and lexical
relatedness, forms distractor candidates by combinatorially replacing instances
with the corresponding top-ranked IDCs, and checks if they are legitimate
phrases. Finally, it selects top-ranked distractor candidates based on
contextual semantic similarities to the answer key. Experiments show that this
method significantly outperforms SOTA results. Human judges also confirm the
high qualities of the generated distractors.",http://arxiv.org/pdf/2410.04266v1,10.1109/IJCNN54540.2023.10191481,False
Compositional Diffusion Models for Powered Descent Trajectory Generation with Flexible Constraints,05/10/2024,"Julia Briden, Yilun Du, Enrico M. Zucchelli, Richard Linares","This work introduces TrajDiffuser, a compositional diffusion-based flexible
and concurrent trajectory generator for 6 degrees of freedom powered descent
guidance. TrajDiffuser is a statistical model that learns the multi-modal
distributions of a dataset of simulated optimal trajectories, each subject to
only one or few constraints that may vary for different trajectories. During
inference, the trajectory is generated simultaneously over time, providing
stable long-horizon planning, and constraints can be composed together,
increasing the model's generalizability and decreasing the training data
required. The generated trajectory is then used to initialize an optimizer,
increasing its robustness and speed.",http://arxiv.org/pdf/2410.04261v1,,False
Correlation-Aware Select and Merge Attention for Efficient Fine-Tuning and Context Length Extension,05/10/2024,"Ning Wang, Zekun Li, Tongxin Bai, Guoqi Li","Modeling long sequences is crucial for various large-scale models; however,
extending existing architectures to handle longer sequences presents
significant technical and resource challenges. In this paper, we propose an
efficient and flexible attention architecture that enables the extension of
context lengths in large language models with reduced computational resources
and fine-tuning time compared to other excellent methods. Specifically, we
introduce correlation-aware selection and merging mechanisms to facilitate
efficient sparse attention. In addition, we also propose a novel data
augmentation technique involving positional encodings to enhance generalization
to unseen positions. The results are as follows: First, using a single A100, we
achieve fine-tuning on Llama2-7B with a sequence length of 32K, which is more
efficient than other methods that rely on subsets for regression. Second, we
present a comprehensive method for extending context lengths across the
pre-training, fine-tuning, and inference phases. During pre-training, our
attention mechanism partially breaks translation invariance during token
selection, so we apply positional encodings only to the selected tokens. This
approach achieves relatively high performance and significant extrapolation
capabilities. For fine-tuning, we introduce Cyclic, Randomly Truncated, and
Dynamically Growing NTK Positional Embedding (CRD NTK). This design allows
fine-tuning with a sequence length of only 16K, enabling models such as
Llama2-7B and Mistral-7B to perform inference with context lengths of up to 1M
or even arbitrary lengths. Our method achieves 100\% accuracy on the passkey
task with a context length of 4M and maintains stable perplexity at a 1M
context length. This represents at least a 64-fold reduction in resource
requirements compared to traditional full-attention mechanisms, while still
achieving competitive performance.",http://arxiv.org/pdf/2410.04211v1,,False
Unsupervised Assessment of Landscape Shifts Based on Persistent Entropy and Topological Preservation,05/10/2024,Sebastian Basterrech,"Concept drift typically refers to the analysis of changes in data
distribution. A drift in the input data can have negative consequences on a
learning predictor and the system's stability. The majority of concept drift
methods emphasize the analysis of statistical changes in non-stationary data
over time. In this context, we consider another perspective, where the concept
drift also integrates substantial changes in the topological characteristics of
the data stream. In this article, we introduce a novel framework for monitoring
changes in multi-dimensional data streams. We explore a generalization of the
standard concept drift focusing on the changes in the topological
characteristics of the data. Our developed approach is based on persistent
entropy and topology-preserving projections in a continual learning scenario.
The framework operates in both unsupervised and supervised environments. To
demonstrate the utility of the proposed framework, we analyze the model across
three scenarios using data streams generated with MNIST samples. The obtained
results reveal the potential of applying topological data analysis for shift
detection and encourage further research in this area.",http://arxiv.org/pdf/2410.04183v1,,False
Applying Quantum Autoencoders for Time Series Anomaly Detection,05/10/2024,"Robin Frehner, Kurt Stockinger","Anomaly detection is an important problem with applications in various
domains such as fraud detection, pattern recognition or medical diagnosis.
Several algorithms have been introduced using classical computing approaches.
However, using quantum computing for solving anomaly detection problems in time
series data is a widely unexplored research field.
  This paper explores the application of quantum autoencoders to time series
anomaly detection. We investigate two primary techniques for classifying
anomalies: (1) Analyzing the reconstruction error generated by the quantum
autoencoder and (2) latent representation analysis. Our simulated experimental
results, conducted across various ansaetze, demonstrate that quantum
autoencoders consistently outperform classical deep learning-based autoencoders
across multiple datasets. Specifically, quantum autoencoders achieve superior
anomaly detection performance while utilizing 60-230 times fewer parameters and
requiring five times fewer training iterations. In addition, we implement our
quantum encoder on real quantum hardware. Our experimental results demonstrate
that quantum autoencoders achieve anomaly detection performance on par with
their simulated counterparts.",http://arxiv.org/pdf/2410.04154v1,,False
ECon: On the Detection and Resolution of Evidence Conflicts,05/10/2024,"Cheng Jiayang, Chunkit Chan, Qianqian Zhuang, Lin Qiu, Tianhang Zhang, Tengxiao Liu, Yangqiu Song, Yue Zhang, Pengfei Liu, Zheng Zhang","The rise of large language models (LLMs) has significantly influenced the
quality of information in decision-making systems, leading to the prevalence of
AI-generated content and challenges in detecting misinformation and managing
conflicting information, or ""inter-evidence conflicts."" This study introduces a
method for generating diverse, validated evidence conflicts to simulate
real-world misinformation scenarios. We evaluate conflict detection methods,
including Natural Language Inference (NLI) models, factual consistency (FC)
models, and LLMs, on these conflicts (RQ1) and analyze LLMs' conflict
resolution behaviors (RQ2). Our key findings include: (1) NLI and LLM models
exhibit high precision in detecting answer conflicts, though weaker models
suffer from low recall; (2) FC models struggle with lexically similar answer
conflicts, while NLI and LLM models handle these better; and (3) stronger
models like GPT-4 show robust performance, especially with nuanced conflicts.
For conflict resolution, LLMs often favor one piece of conflicting evidence
without justification and rely on internal knowledge if they have prior
beliefs.",http://arxiv.org/pdf/2410.04068v1,,False
Is Score Matching Suitable for Estimating Point Processes?,05/10/2024,"Haoqun Cao, Zizhuo Meng, Tianjun Ke, Feng Zhou","Score matching estimators have gained widespread attention in recent years
partly because they are free from calculating the integral of normalizing
constant, thereby addressing the computational challenges in maximum likelihood
estimation (MLE). Some existing works have proposed score matching estimators
for point processes. However, this work demonstrates that the incompleteness of
the estimators proposed in those works renders them applicable only to specific
problems, and they fail for more general point processes. To address this
issue, this work introduces the weighted score matching estimator to point
processes. Theoretically, we prove the consistency of our estimator and
establish its rate of convergence. Experimental results indicate that our
estimator accurately estimates model parameters on synthetic data and yields
results consistent with MLE on real data. In contrast, existing score matching
estimators fail to perform effectively. Codes are publicly available at
\url{https://github.com/KenCao2007/WSM_TPP}.",http://arxiv.org/pdf/2410.04037v1,,False
