Title,Publication Date,Author(s),Abstract,Link,DOI,Relevant
A Scientific Reasoning Model for Organic Synthesis Procedure Generation,15/12/2025,"Guoqing Liu, Junren Li, Zihan Zhao, Eray Inanc, Krzysztof Maziarz, Jose Garrido Torres, Victor Garcia Satorras, Shoko Ueda, Christopher M. Bishop, Marwin Segler","Solving computer-aided synthesis planning is essential for enabling fully automated, robot-assisted synthesis workflows and improving the efficiency of drug discovery. A key challenge, however, is bridging the gap between computational route design and practical laboratory execution, particularly the accurate prediction of viable experimental procedures for each synthesis step. In this work, we present QFANG, a scientific reasoning language model capable of generating precise, structured experimental procedures directly from reaction equations, with explicit chain-of-thought reasoning. To develop QFANG, we curated a high-quality dataset comprising 905,990 chemical reactions paired with structured action sequences, extracted and processed from patent literature using large language models. We introduce a Chemistry-Guided Reasoning (CGR) framework that produces chain-of-thought data grounded in chemical knowledge at scale. The model subsequently undergoes supervised fine-tuning to elicit complex chemistry reasoning. Finally, we apply Reinforcement Learning from Verifiable Rewards (RLVR) to further enhance procedural accuracy. Experimental results demonstrate that QFANG outperforms advanced general-purpose reasoning models and nearest-neighbor retrieval baselines, measured by traditional NLP similarity metrics and a chemically aware evaluator using an LLM-as-a-judge. Moreover, QFANG generalizes to certain out-of-domain reaction classes and adapts to variations in laboratory conditions and user-specific constraints. We believe that QFANG's ability to generate high-quality synthesis procedures represents an important step toward bridging the gap between computational synthesis planning and fully automated laboratory synthesis.",https://arxiv.org/pdf/2512.13668v1,,False
Advancing Machine Learning Optimization of Chiral Photonic Metasurface: Comparative Study of Neural Network and Genetic Algorithm Approaches,15/12/2025,"Davide Filippozzi, Alexandre Mayer, Nicolas Roy, Wei Fang, Arash Rahimi-Iman","Chiral photonic metasurfaces provide unique capabilities for tailoring light-matter interactions, which are essential for next-generation photonic devices. Here, we report an advanced optimization framework that combines deep learning and evolutionary algorithms to significantly improve both the design and performance of chiral photonic nanostructures. Building on previous work utilizing a three-layer perceptron reinforced learning and stochastic evolutionary algorithm with decaying changes and mass extinction for chiral photonic optimization, our study introduces a refined pipeline featuring a two-output neural network architecture to reduce the trade-off between high chiral dichroism (CD) and reflectivity. Additionally, we use an improved fitness function, and efficient data augmentation techniques. A comparative analysis between a neural network (NN)-based approach and a genetic algorithm (GA) is presented for structures of different interface pattern depth, material combinations, and geometric complexity. We demonstrate a twice higher CD and the impact of both the corner number and the refractive index contrast at the example of a GaP/air and PMMA/air metasurface as a result of superior optimization performance. Additionally, a substantial increase in the number of structures explored within limited computational resources is highlighted, with tailored spectral reflectivity suggested by our electromagnetic simulations, paving the way for chiral mirrors applicable to polarization-selective light-matter interaction studies.",https://arxiv.org/pdf/2512.13656v1,,False
Temporal Tokenization Strategies for Event Sequence Modeling with Large Language Models,15/12/2025,"Zefang Liu, Nam Nguyen, Yinzhu Quan, Austin Zhang","Representing continuous time is a critical and under-explored challenge in modeling temporal event sequences with large language models (LLMs). Various strategies like byte-level representations or calendar tokens have been proposed. However, the optimal approach remains unclear, especially given the diverse statistical distributions of real-world event data, which range from smooth log-normal to discrete, spiky patterns. This paper presents the first empirical study of temporal tokenization for event sequences, comparing distinct encoding strategies: naive numeric strings, high-precision byte-level representations, human-semantic calendar tokens, classic uniform binning, and adaptive residual scalar quantization. We evaluate these strategies by fine-tuning LLMs on real-world datasets that exemplify these diverse distributions. Our analysis reveals that no single strategy is universally superior; instead, prediction performance depends heavily on aligning the tokenizer with the data's statistical properties, with log-based strategies excelling on skewed distributions and human-centric formats proving robust for mixed modalities.",https://arxiv.org/pdf/2512.13618v1,,False
Do-Undo: Generating and Reversing Physical Actions in Vision-Language Models,15/12/2025,"Shweta Mahajan, Shreya Kadambi, Hoang Le, Munawar Hayat, Fatih Porikli","We introduce the Do-Undo task and benchmark to address a critical gap in vision-language models: understanding and generating physically plausible scene transformations driven by real-world actions. Unlike prior work focused on object-level edits, Do-Undo requires models to simulate the outcome of a physical action and then accurately reverse it, reflecting true cause-and-effect in the visual world. We curate a large-scale dataset of reversible actions from real-world videos and design a training strategy enforcing consistency for robust action grounding. Our experiments reveal that current models struggle with physical reversibility, underscoring the importance of this task for embodied AI, robotics, and physics-aware generative modeling. Do-Undo establishes an intuitive testbed for evaluating and advancing physical reasoning in multimodal systems.",https://arxiv.org/pdf/2512.13609v1,,False
ReFusion: A Diffusion Large Language Model with Parallel Autoregressive Decoding,15/12/2025,"Jia-Nan Li, Jian Guan, Wei Wu, Chongxuan Li","Autoregressive models (ARMs) are hindered by slow sequential inference. While masked diffusion models (MDMs) offer a parallel alternative, they suffer from critical drawbacks: high computational overhead from precluding Key-Value (KV) caching, and incoherent generation arising from learning dependencies over an intractable space of token combinations. To address these limitations, we introduce ReFusion, a novel masked diffusion model that achieves superior performance and efficiency by elevating parallel decoding from the token level to a higher slot level, where each slot is a fixed-length, contiguous sub-sequence. This is achieved through an iterative ``plan-and-infill'' decoding process: a diffusion-based planning step first identifies a set of weakly dependent slots, and an autoregressive infilling step then decodes these selected slots in parallel. The slot-based design simultaneously unlocks full KV cache reuse with a unified causal framework and reduces the learning complexity from the token combination space to a manageable slot-level permutation space. Extensive experiments on seven diverse benchmarks show that ReFusion not only overwhelmingly surpasses prior MDMs with 34% performance gains and an over 18$\times$ speedup on average, but also bridges the performance gap to strong ARMs while maintaining a 2.33$\times$ average speedup.",https://arxiv.org/pdf/2512.13586v1,,False
A Nonparametric Statistics Approach to Feature Selection in Deep Neural Networks with Theoretical Guarantees,15/12/2025,"Junye Du, Zhenghao Li, Zhutong Gu, Long Feng","This paper tackles the problem of feature selection in a highly challenging setting: $\mathbb{E}(y | \boldsymbol{x}) = G(\boldsymbol{x}_{\mathcal{S}_0})$, where $\mathcal{S}_0$ is the set of relevant features and $G$ is an unknown, potentially nonlinear function subject to mild smoothness conditions. Our approach begins with feature selection in deep neural networks, then generalizes the results to H{ö}lder smooth functions by exploiting the strong approximation capabilities of neural networks. Unlike conventional optimization-based deep learning methods, we reformulate neural networks as index models and estimate $\mathcal{S}_0$ using the second-order Stein's formula. This gradient-descent-free strategy guarantees feature selection consistency with a sample size requirement of $n = Ω(p^2)$, where $p$ is the feature dimension. To handle high-dimensional scenarios, we further introduce a screening-and-selection mechanism that achieves nonlinear selection consistency when $n = Ω(s \log p)$, with $s$ representing the sparsity level. Additionally, we refit a neural network on the selected features for prediction and establish performance guarantees under a relaxed sparsity assumption. Extensive simulations and real-data analyses demonstrate the strong performance of our method even in the presence of complex feature interactions.",https://arxiv.org/pdf/2512.13565v1,,False
Verifying Rumors via Stance-Aware Structural Modeling,15/12/2025,"Gibson Nkhata, Uttamasha Anjally Oyshi, Quan Mai, Susan Gauch","Verifying rumors on social media is critical for mitigating the spread of false information. The stances of conversation replies often provide important cues to determine a rumor's veracity. However, existing models struggle to jointly capture semantic content, stance information, and conversation strructure, especially under the sequence length constraints of transformer-based encoders. In this work, we propose a stance-aware structural modeling that encodes each post in a discourse with its stance signal and aggregates reply embedddings by stance category enabling a scalable and semantically enriched representation of the entire thread. To enhance structural awareness, we introduce stance distribution and hierarchical depth as covariates, capturing stance imbalance and the influence of reply depth. Extensive experiments on benchmark datasets demonstrate that our approach significantly outperforms prior methods in the ability to predict truthfulness of a rumor. We also demonstrate that our model is versatile for early detection and cross-platfrom generalization.",https://arxiv.org/pdf/2512.13559v1,,False
Adaptive Sampling for Hydrodynamic Stability,15/12/2025,"Anshima Singh, David J. Silvester","An adaptive sampling approach for efficient detection of bifurcation boundaries in parametrized fluid flow problems is presented herein. The study extends the machine-learning approach of Silvester (Machine Learning for Hydrodynamic Stability, arXiv:2407.09572), where a classifier network was trained on preselected simulation data to identify bifurcated and nonbifurcated flow regimes. In contrast, the proposed methodology introduces adaptivity through a flow-based deep generative model that automatically refines the sampling of the parameter space. The strategy has two components: a classifier network maps the flow parameters to a bifurcation probability, and a probability density estimation technique (KRnet) for the generation of new samples at each adaptive step. The classifier output provides a probabilistic measure of flow stability, and the Shannon entropy of these predictions is employed as an uncertainty indicator. KRnet is trained to approximate a probability density function that concentrates sampling in regions of high entropy, thereby directing computational effort towards the evolving bifurcation boundary. This coupling between classification and generative modeling establishes a feedback-driven adaptive learning process analogous to error-indicator based refinement in contemporary partial differential equation solution strategies. Starting from a uniform parameter distribution, the new approach achieves accurate bifurcation boundary identification with significantly fewer Navier--Stokes simulations, providing a scalable foundation for high-dimensional stability analysis.",https://arxiv.org/pdf/2512.13532v1,,False
Differentiable Evolutionary Reinforcement Learning,15/12/2025,"Sitao Cheng, Tianle Li, Xuhan Huang, Xunjian Yin, Difan Zou","The design of effective reward functions presents a central and often arduous challenge in reinforcement learning (RL), particularly when developing autonomous agents for complex reasoning tasks. While automated reward optimization approaches exist, they typically rely on derivative-free evolutionary heuristics that treat the reward function as a black box, failing to capture the causal relationship between reward structure and task performance. To bridge this gap, we propose Differentiable Evolutionary Reinforcement Learning (DERL), a bilevel framework that enables the autonomous discovery of optimal reward signals. In DERL, a Meta-Optimizer evolves a reward function (i.e., Meta-Reward) by composing structured atomic primitives, guiding the training of an inner-loop policy. Crucially, unlike previous evolution, DERL is differentiable in its metaoptimization: it treats the inner-loop validation performance as a signal to update the Meta-Optimizer via reinforcement learning. This allows DERL to approximate the ""meta-gradient"" of task success, progressively learning to generate denser and more actionable feedback. We validate DERL across three distinct domains: robotic agent (ALFWorld), scientific simulation (ScienceWorld), and mathematical reasoning (GSM8k, MATH). Experimental results show that DERL achieves state-of-the-art performance on ALFWorld and ScienceWorld, significantly outperforming methods relying on heuristic rewards, especially in out-of-distribution scenarios. Analysis of the evolutionary trajectory demonstrates that DERL successfully captures the intrinsic structure of tasks, enabling selfimproving agent alignment without human intervention.",https://arxiv.org/pdf/2512.13399v1,,False
Better LMO-based Momentum Methods with Second-Order Information,15/12/2025,"Sarit Khirirat, Abdurakhmon Sadiev, Yury Demidovich, Peter Richtárik","The use of momentum in stochastic optimization algorithms has shown empirical success across a range of machine learning tasks. Recently, a new class of stochastic momentum algorithms has emerged within the Linear Minimization Oracle (LMO) framework--leading to state-of-the-art methods, such as Muon, Scion, and Gluon, that effectively solve deep neural network training problems. However, traditional stochastic momentum methods offer convergence guarantees no better than the ${O}(1/K^{1/4})$ rate. While several approaches--such as Hessian-Corrected Momentum (HCM)--have aimed to improve this rate, their theoretical results are generally restricted to the Euclidean norm setting. This limitation hinders their applicability in problems, where arbitrary norms are often required. In this paper, we extend the LMO-based framework by integrating HCM, and provide convergence guarantees under relaxed smoothness and arbitrary norm settings. We establish improved convergence rates of ${O}(1/K^{1/3})$ for HCM, which can adapt to the geometry of the problem and achieve a faster rate than traditional momentum. Experimental results on training Multi-Layer Perceptrons (MLPs) and Long Short-Term Memory (LSTM) networks verify our theoretical observations.",https://arxiv.org/pdf/2512.13227v1,,False
Evaluating Adversarial Attacks on Federated Learning for Temperature Forecasting,15/12/2025,"Karina Chichifoi, Fabio Merizzi, Michele Colajanni","Deep learning and federated learning (FL) are becoming powerful partners for next-generation weather forecasting. Deep learning enables high-resolution spatiotemporal forecasts that can surpass traditional numerical models, while FL allows institutions in different locations to collaboratively train models without sharing raw data, addressing efficiency and security concerns. While FL has shown promise across heterogeneous regions, its distributed nature introduces new vulnerabilities. In particular, data poisoning attacks, in which compromised clients inject manipulated training data, can degrade performance or introduce systematic biases. These threats are amplified by spatial dependencies in meteorological data, allowing localized perturbations to influence broader regions through global model aggregation. In this study, we investigate how adversarial clients distort federated surface temperature forecasts trained on the Copernicus European Regional ReAnalysis (CERRA) dataset. We simulate geographically distributed clients and evaluate patch-based and global biasing attacks on regional temperature forecasts. Our results show that even a small fraction of poisoned clients can mislead predictions across large, spatially connected areas. A global temperature bias attack from a single compromised client shifts predictions by up to -1.7 K, while coordinated patch attacks more than triple the mean squared error and produce persistent regional anomalies exceeding +3.5 K. Finally, we assess trimmed mean aggregation as a defense mechanism, showing that it successfully defends against global bias attacks (2-13\% degradation) but fails against patch attacks (281-603\% amplification), exposing limitations of outlier-based defenses for spatially correlated data.",https://arxiv.org/pdf/2512.13207v1,,False
Efficient Adaptive Rejection Sampling for Accelerating Speculative Decoding in Large Language Models,15/12/2025,Chendong Sun,"Speculative Decoding is a prominent technique for accelerating the autoregressive inference of large language models (LLMs) by employing a fast draft model to propose candidate token sequences and a large target model to verify them in parallel. However, its core component -- the rejection sampling mechanism -- relies on a fixed, context-independent random threshold. This leads to a significant ""random rejection"" problem in high-uncertainty generation scenarios, where plausible candidate tokens are frequently rejected due to random chance, undermining inference efficiency. This paper introduces Efficient Adaptive Rejection Sampling (EARS), a novel method that dynamically adjusts the acceptance threshold by incorporating the target model's own predictive uncertainty, measured as \(1 - \max(P_{\mathrm{target}})\). By introducing a tolerance term proportional to this uncertainty, EARS intelligently relaxes the acceptance criterion when the model is uncertain, effectively reducing random rejections while maintaining strict standards when the model is confident. Experiments on creative writing and open-domain QA tasks demonstrate that EARS significantly enhances the efficiency of speculative decoding, achieving up to an 18.12% increase in throughput with a negligible 0.84% accuracy drop on the GSM8K benchmark. The method requires no modifications to model architectures and can be seamlessly integrated into existing speculative decoding frameworks.",https://arxiv.org/pdf/2512.13194v1,,False
WAY: Estimation of Vessel Destination in Worldwide AIS Trajectory,15/12/2025,"Jin Sob Kim, Hyun Joon Park, Wooseok Shin, Dongil Park, Sung Won Han","The Automatic Identification System (AIS) enables data-driven maritime surveillance but suffers from reliability issues and irregular intervals. We address vessel destination estimation using global-scope AIS data by proposing a differentiated approach that recasts long port-to-port trajectories as a nested sequence structure. Using spatial grids, this method mitigates spatio-temporal bias while preserving detailed resolution. We introduce a novel deep learning architecture, WAY, designed to process these reformulated trajectories for long-term destination estimation days to weeks in advance. WAY comprises a trajectory representation layer and Channel-Aggregative Sequential Processing (CASP) blocks. The representation layer generates multi-channel vector sequences from kinematic and non-kinematic features. CASP blocks utilize multi-headed channel- and self-attention for aggregation and sequential information delivery. Additionally, we propose a task-specialized Gradient Dropout (GD) technique to enable many-to-many training on single labels, preventing biased feedback surges by stochastically blocking gradient flow based on sample length. Experiments on 5-year AIS data demonstrate WAY's superiority over conventional spatial grid-based approaches regardless of trajectory progression. Results further confirm that adopting GD leads to performance gains. Finally, we explore WAY's potential for real-world application through multitask learning for ETA estimation.",https://arxiv.org/pdf/2512.13190v1,10.1109/TAES.2023.3269729,False
Stopping Rules for Stochastic Gradient Descent via Anytime-Valid Confidence Sequences,15/12/2025,"Liviu Aolaritei, Michael I. Jordan","We study stopping rules for stochastic gradient descent (SGD) for convex optimization from the perspective of anytime-valid confidence sequences. Classical analyses of SGD provide convergence guarantees in expectation or at a fixed horizon, but offer no statistically valid way to assess, at an arbitrary time, how close the current iterate is to the optimum. We develop an anytime-valid, data-dependent upper confidence sequence for the weighted average suboptimality of projected SGD, constructed via nonnegative supermartingales and requiring no smoothness or strong convexity. This confidence sequence yields a simple stopping rule that is provably $\varepsilon$-optimal with probability at least $1-α$ and is almost surely finite under standard stochastic approximation stepsizes. To the best of our knowledge, these are the first rigorous, time-uniform performance guarantees and finite-time $\varepsilon$-optimality certificates for projected SGD with general convex objectives, based solely on observable trajectory quantities.",https://arxiv.org/pdf/2512.13123v1,,False
Progressive Refinement of E-commerce Search Ranking Based on Short-Term Activities of the Buyer,15/12/2025,"Taoran Sheng, Sathappan Muthiah, Atiq Islam, Jinming Feng","In e-commerce shopping, aligning search results with a buyer's immediate needs and preferences presents a significant challenge, particularly in adapting search results throughout the buyer's shopping journey as they move from the initial stages of browsing to making a purchase decision or shift from one intent to another. This study presents a systematic approach to adapting e-commerce search results based on the current context. We start with basic methods and incrementally incorporate more contextual information and state-of-the-art techniques to improve the search outcomes. By applying this evolving contextual framework to items displayed on the search engine results page (SERP), we progressively align search outcomes more closely with the buyer's interests and current search intentions. Our findings demonstrate that this incremental enhancement, from simple heuristic autoregressive features to advanced sequence models, significantly improves ranker performance. The integration of contextual techniques enhances the performance of our production ranker, leading to improved search results in both offline and online A/B testing in terms of Mean Reciprocal Rank (MRR). Overall, the paper details iterative methodologies and their substantial contributions to search result contextualization on e-commerce platforms.",https://arxiv.org/pdf/2512.13037v1,10.1145/3726302.3731966,False
Scaling Bidirectional Spans and Span Violations in Attention Mechanism,15/12/2025,"Jongwook Kim, Sangheon Yun, Sukjin Yoon","The canonical $O(N^2)$ Transformer remains the empirical performance frontier in sequence modeling, and its training can be further optimized by addressing geometric inefficiency. We propose an optimization framework that leverages an asymmetric projection to decompose the backward-pass gradients into parallel spans and orthogonal violations, while keeping the canonical forward-pass $QKV$ structure intact. Through consistent experimental validation across various decomposition and projection setups, we provide strong theoretical evidence: the standard attention gradient is suboptimal. We demonstrated that selectively scaling these components, focusing primarily on $0^{th}$ order bidirectional parallel spans, yields the most effective learning signal. On the limited WikiText-2 dataset, and using a crude configuration, this method achieved a $0.56\%$ reduction in validation loss, confirming the framework's fundamental validity and suggesting significant potential gains on larger datasets and deeper training regimes",https://arxiv.org/pdf/2512.13033v1,,False
