Title,Publication Date,Author(s),Abstract,Link,DOI,Relevant
TSGM: Regular and Irregular Time-series Generation using Score-based Generative Models,26/11/2025,"Haksoo Lim, Jaehoon Lee, Sewon Park, Minjung Kim, Noseong Park","Score-based generative models (SGMs) have demonstrated unparalleled sampling quality and diversity in numerous fields, such as image generation, voice synthesis, and tabular data synthesis, etc. Inspired by those outstanding results, we apply SGMs to synthesize time-series by learning its conditional score function. To this end, we present a conditional score network for time-series synthesis, deriving a denoising score matching loss tailored for our purposes. In particular, our presented denoising score matching loss is the conditional denoising score matching loss for time-series synthesis. In addition, our framework is such flexible that both regular and irregular time-series can be synthesized with minimal changes to our model design. Finally, we obtain exceptional synthesis performance on various time-series datasets, achieving state-of-the-art sampling diversity and quality.",https://arxiv.org/pdf/2511.21335v1,,False
Sawtooth Sampling for Time Series Denoising Diffusion Implicit Models,26/11/2025,"Heiko Oppel, Andreas Spilz, Michael Munz","Denoising Diffusion Probabilistic Models (DDPMs) can generate synthetic timeseries data to help improve the performance of a classifier, but their sampling process is computationally expensive. We address this by combining implicit diffusion models with a novel Sawtooth Sampler that accelerates the reverse process and can be applied to any pretrained diffusion model. Our approach achieves a 30 times speed-up over the standard baseline while also enhancing the quality of the generated sequences for classification tasks.",https://arxiv.org/pdf/2511.21320v1,,False
A Physics-Informed U-net-LSTM Network for Data-Driven Seismic Response Modeling of Structures,26/11/2025,"Sutirtha Biswas, Kshitij Kumar Yadav","Accurate and efficient seismic response prediction is essential for the design of resilient structures. While the Finite Element Method (FEM) remains the standard for nonlinear seismic analysis, its high computational demands limit its scalability and real time applicability. Recent developments in deep learning, particularly Convolutional Neural Networks (CNNs), Recurrent Neural Networks (RNNs), and Long Short Term Memory (LSTM) models, have shown promise in reducing the computational cost of nonlinear seismic analysis of structures. However, these data driven models often struggle to generalize and capture the underlying physics, leading to reduced reliability. We propose a novel Physics Informed U Net LSTM framework that integrates physical laws with deep learning to enhance both accuracy and efficiency. By embedding domain specific constraints into the learning process, the proposed model achieves improved predictive performance over conventional Machine Learning architectures. This hybrid approach bridges the gap between purely data driven methods and physics based modeling, offering a robust and computationally efficient alternative for seismic response prediction of structures.",https://arxiv.org/pdf/2511.21276v1,,False
CAHS-Attack: CLIP-Aware Heuristic Search Attack Method for Stable Diffusion,26/11/2025,"Shuhan Xia, Jing Dai, Hui Ouyang, Yadong Shang, Dongxiao Zhao, Peipei Li","Diffusion models exhibit notable fragility when faced with adversarial prompts, and strengthening attack capabilities is crucial for uncovering such vulnerabilities and building more robust generative systems. Existing works often rely on white-box access to model gradients or hand-crafted prompt engineering, which is infeasible in real-world deployments due to restricted access or poor attack effect. In this paper, we propose CAHS-Attack , a CLIP-Aware Heuristic Search attack method. CAHS-Attack integrates Monte Carlo Tree Search (MCTS) to perform fine-grained suffix optimization, leveraging a constrained genetic algorithm to preselect high-potential adversarial prompts as root nodes, and retaining the most semantically disruptive outcome at each simulation rollout for efficient local search. Extensive experiments demonstrate that our method achieves state-of-the-art attack performance across both short and long prompts of varying semantics. Furthermore, we find that the fragility of SD models can be attributed to the inherent vulnerability of their CLIP-based text encoders, suggesting a fundamental security risk in current text-to-image pipelines.",https://arxiv.org/pdf/2511.21180v1,,False
SocialNav: Training Human-Inspired Foundation Model for Socially-Aware Embodied Navigation,26/11/2025,"Ziyi Chen, Yingnan Guo, Zedong Chu, Minghua Luo, Yanfen Shen, Mingchao Sun, Junjun Hu, Shichao Xie, Kuan Yang, Pei Shi, Zhining Gu, Lu Liu, Honglin Han, Xiaolong Wu, Mu Xu, Yu Zhang","Embodied navigation that adheres to social norms remains an open research challenge. Our \textbf{SocialNav} is a foundational model for socially-aware navigation with a hierarchical ""brain-action"" architecture, capable of understanding high-level social norms and generating low-level, socially compliant trajectories. To enable such dual capabilities, we construct the SocNav Dataset, a large-scale collection of 7 million samples, comprising (1) a Cognitive Activation Dataset providing social reasoning signals such as chain-of-thought explanations and social traversability prediction, and (2) an Expert Trajectories Pyramid aggregating diverse navigation demonstrations from internet videos, simulated environments, and real-world robots. A multi-stage training pipeline is proposed to gradually inject and refine navigation intelligence: we first inject general navigation skills and social norms understanding into the model via imitation learning, and then refine such skills through a deliberately designed Socially-Aware Flow Exploration GRPO (SAFE-GRPO), the first flow-based reinforcement learning framework for embodied navigation that explicitly rewards socially compliant behaviors. SocialNav achieves +38% success rate and +46% social compliance rate compared to the state-of-the-art method, demonstrating strong gains in both navigation performance and social compliance. Our project page: https://amap-eai.github.io/SocialNav/",https://arxiv.org/pdf/2511.21135v1,,False
Deformation-aware Temporal Generation for Early Prediction of Alzheimers Disease,26/11/2025,"Xin Honga, Jie Lin, Minghui Wang","Alzheimer's disease (AD), a degenerative brain condition, can benefit from early prediction to slow its progression. As the disease progresses, patients typically undergo brain atrophy. Current prediction methods for Alzheimers disease largely involve analyzing morphological changes in brain images through manual feature extraction. This paper proposes a novel method, the Deformation-Aware Temporal Generative Network (DATGN), to automate the learning of morphological changes in brain images about disease progression for early prediction. Given the common occurrence of missing data in the temporal sequences of MRI images, DATGN initially interpolates incomplete sequences. Subsequently, a bidirectional temporal deformation-aware module guides the network in generating future MRI images that adhere to the disease's progression, facilitating early prediction of Alzheimer's disease. DATGN was tested for the generation of temporal sequences of future MRI images using the ADNI dataset, and the experimental results are competitive in terms of PSNR and MMSE image quality metrics. Furthermore, when DATGN-generated synthetic data was integrated into the SVM vs. CNN vs. 3DCNN-based classification methods, significant improvements were achieved from 6. 21\% to 16\% in AD vs. NC classification accuracy and from 7. 34\% to 21. 25\% in AD vs. MCI vs. NC classification accuracy. The qualitative visualization results indicate that DATGN produces MRI images consistent with the brain atrophy trend in Alzheimer's disease, enabling early disease prediction.",https://arxiv.org/pdf/2511.21114v1,,False
Generative Early Stage Ranking,26/11/2025,"Juhee Hong, Meng Liu, Shengzhi Wang, Xiaoheng Mao, Huihui Cheng, Leon Gao, Christopher Leung, Jin Zhou, Chandra Mouli Sekar, Zhao Zhu, Ruochen Liu, Tuan Trieu, Dawei Sun, Jeet Kanjani, Rui Li, Jing Qian, Xuan Cao, Minjie Fan, Mingze Gao","Large-scale recommendations commonly adopt a multi-stage cascading ranking system paradigm to balance effectiveness and efficiency. Early Stage Ranking (ESR) systems utilize the ""user-item decoupling"" approach, where independently learned user and item representations are only combined at the final layer. While efficient, this design is limited in effectiveness, as it struggles to capture fine-grained user-item affinities and cross-signals. To address these, we propose the Generative Early Stage Ranking (GESR) paradigm, introducing the Mixture of Attention (MoA) module which leverages diverse attention mechanisms to bridge the effectiveness gap: the Hard Matching Attention (HMA) module encodes explicit cross-signals by computing raw match counts between user and item features; the Target-Aware Self Attention module generates target-aware user representations conditioned on the item, enabling more personalized learning; and the Cross Attention modules facilitate early and more enriched interactions between user-item features. MoA's specialized attention encodings are further refined in the final layer through a Multi-Logit Parameterized Gating (MLPG) module, which integrates the newly learned embeddings via gating and produces secondary logits that are fused with the primary logit. To address the efficiency and latency challenges, we have introduced a comprehensive suite of optimization techniques. These span from custom kernels that maximize the capabilities of the latest hardware to efficient serving solutions powered by caching mechanisms. The proposed GESR paradigm has shown substantial improvements in topline metrics, engagement, and consumption tasks, as validated by both offline and online experiments. To the best of our knowledge, this marks the first successful deployment of full target-aware attention sequence modeling within an ESR stage at such a scale.",https://arxiv.org/pdf/2511.21095v1,,False
ASR Error Correction in Low-Resource Burmese with Alignment-Enhanced Transformers using Phonetic Features,26/11/2025,"Ye Bhone Lin, Thura Aung, Ye Kyaw Thu, Thazin Myint Oo","This paper investigates sequence-to-sequence Transformer models for automatic speech recognition (ASR) error correction in low-resource Burmese, focusing on different feature integration strategies including IPA and alignment information. To our knowledge, this is the first study addressing ASR error correction specifically for Burmese. We evaluate five ASR backbones and show that our ASR Error Correction (AEC) approaches consistently improve word- and character-level accuracy over baseline outputs. The proposed AEC model, combining IPA and alignment features, reduced the average WER of ASR models from 51.56 to 39.82 before augmentation (and 51.56 to 43.59 after augmentation) and improving chrF++ scores from 0.5864 to 0.627, demonstrating consistent gains over the baseline ASR outputs without AEC. Our results highlight the robustness of AEC and the importance of feature design for improving ASR outputs in low-resource settings.",https://arxiv.org/pdf/2511.21088v1,,False
Data-Driven Assessment of Concrete Slab Integrity via Impact-Echo Signals and Neural Networks,26/11/2025,"Yeswanth Ravichandran, Duoduo Liao, Charan Teja Kurakula","Subsurface defects such as delamination, voids, and honeycombing critically affect the durability of concrete bridge decks but are difficult to detect reliably using visual inspection or manual sounding. This paper presents a machine learning based Impact Echo (IE) framework that automates both defect localization and multi-class classification of common concrete defects. Raw IE signals from Federal Highway Administration (FHWA) laboratory slabs and in-service bridge decks are transformed via Fast Fourier Transform (FFT) into dominant peak-frequency features and interpolated into spatial maps for defect zone visualization. Unsupervised k-means clustering highlights low-frequency, defect-prone regions, while Ground Truth Masks (GTMs) derived from seeded lab defects are used to validate spatial accuracy and generate high-confidence training labels. From these validated regions, spatially ordered peak-frequency sequences are constructed and fed into a stacked Long Short-Term Memory (LSTM) network that classifies four defect types shallow delamination, deep delamination, voids, and honeycombing with 73% overall accuracy. Field validation on the bridge deck demonstrates that models trained on laboratory data generalize under realistic coupling, noise, and environmental variability. The proposed framework enhances the objectivity, scalability, and repeatability of Non-Destructive Evaluation (NDE), supporting intelligent, data-driven bridge health monitoring at a network scale.",https://arxiv.org/pdf/2511.21080v1,,False
Zipf Distributions from Two-Stage Symbolic Processes: Stability Under Stochastic Lexical Filtering,26/11/2025,Vladimir Berman,"Zipf's law in language lacks a definitive origin, debated across fields. This study explains Zipf-like behavior using geometric mechanisms without linguistic elements. The Full Combinatorial Word Model (FCWM) forms words from a finite alphabet, generating a geometric distribution of word lengths. Interacting exponential forces yield a power-law rank-frequency curve, determined by alphabet size and blank symbol probability. Simulations support predictions, matching English, Russian, and mixed-genre data. The symbolic model suggests Zipf-type laws arise from geometric constraints, not communicative efficiency.",https://arxiv.org/pdf/2511.21060v1,,False
CNN-LSTM Hybrid Architecture for Over-the-Air Automatic Modulation Classification Using SDR,26/11/2025,"Dinanath Padhya, Krishna Acharya, Bipul Kumar Dahal, Dinesh Baniya Kshatri","Automatic Modulation Classification (AMC) is a core technology for future wireless communication systems, enabling the identification of modulation schemes without prior knowledge. This capability is essential for applications in cognitive radio, spectrum monitoring, and intelligent communication networks. We propose an AMC system based on a hybrid Convolutional Neural Network (CNN) and Long Short-Term Memory (LSTM) architecture, integrated with a Software Defined Radio (SDR) platform. The proposed architecture leverages CNNs for spatial feature extraction and LSTMs for capturing temporal dependencies, enabling efficient handling of complex, time-varying communication signals. The system's practical ability was demonstrated by identifying over-the-air (OTA) signals from a custom-built FM transmitter alongside other modulation schemes. The system was trained on a hybrid dataset combining the RadioML2018 dataset with a custom-generated dataset, featuring samples at Signal-to-Noise Ratios (SNRs) from 0 to 30dB. System performance was evaluated using accuracy, precision, recall, F1 score, and the Area Under the Receiver Operating Characteristic Curve (AUC-ROC). The optimized model achieved 93.48% accuracy, 93.53% precision, 93.48% recall, and an F1 score of 93.45%. The AUC-ROC analysis confirmed the model's discriminative power, even in noisy conditions. This paper's experimental results validate the effectiveness of the hybrid CNN-LSTM architecture for AMC, suggesting its potential application in adaptive spectrum management and advanced cognitive radio systems.",https://arxiv.org/pdf/2511.21040v1,,False
Probabilistic Wildfire Spread Prediction Using an Autoregressive Conditional Generative Adversarial Network,26/11/2025,"Taehoon Kang, Taeyong Kim","Climate change has intensified the frequency and severity of wildfires, making rapid and accurate prediction of fire spread essential for effective mitigation and response. Physics-based simulators such as FARSITE offer high-fidelity predictions but are computationally intensive, limiting their applicability in real-time decision-making, while existing deep learning models often yield overly smooth predictions that fail to capture the complex, nonlinear dynamics of wildfire propagation. This study proposes an autoregressive conditional generative adversarial network (CGAN) for probabilistic wildfire spread prediction. By formulating the prediction task as an autoregressive problem, the model learns sequential state transitions, ensuring long-term prediction stability. Experimental results demonstrate that the proposed CGAN-based model outperforms conventional deep learning models in both overall predictive accuracy and boundary delineation of fire perimeters. These results demonstrate that adversarial learning allows the model to capture the strong nonlinearity and uncertainty of wildfire spread, instead of simply fitting the pixel average. Furthermore, the autoregressive framework facilitates systematic temporal forecasting of wildfire evolution. The proposed CGAN-based autoregressive framework enhances both the accuracy and physical interpretability of wildfire spread prediction, offering a promising foundation for time-sensitive response and evacuation planning.",https://arxiv.org/pdf/2511.21019v1,,False
Gated KalmaNet: A Fading Memory Layer Through Test-Time Ridge Regression,26/11/2025,"Liangzu Peng, Aditya Chattopadhyay, Luca Zancato, Elvis Nunez, Wei Xia, Stefano Soatto","As efficient alternatives to softmax Attention, linear state-space models (SSMs) achieve constant memory and linear compute, but maintain only a lossy, fading summary of the past, often leading to inferior performance in recall oriented tasks. We propose Gated KalmaNet (GKA), a layer that reduces this gap by accounting for the full past when predicting the next token, while maintaining SSM-style efficiency. GKA achieves this by solving an online ridge regression problem at test time, with constant memory and linear compute cost in the sequence length. Drawing inspiration from the Kalman Filter, we iteratively solve the online ridge regression problem. However, a critical insight is that standard Kalman filter equations are numerically unstable in low-precision environments (like bfloat16) and difficult to parallelize in modern hardware. We address both challenges through two key innovations: (1) an adaptive regularization strategy with input-dependent gating that controls the condition number of the ridge regression, ensuring numerical stability while balancing memory retention. And (2) the use of Chebyshev Iteration instead of other conventional iterative solvers, which we demonstrate to be more stable in low-precision settings. To further improve scalability, we develop a hardware-aware chunk-wise implementation of Chebyshev Iteration along with custom kernels for backpropagating through our adaptive regularization and gating mechanisms. Empirically, GKA shows strong language understanding capabilites on short-context tasks outperforming existing SSM layers (like Mamba2, GLA and Gated DeltaNet). On long-context, GKA excels at real-world RAG and LongQA tasks up to 128k tokens, achieving more than $10$% relative improvement over other fading memory baselines.",https://arxiv.org/pdf/2511.21016v1,,False
AI4X Roadmap: Artificial Intelligence for the advancement of scientific pursuit and its future directions,26/11/2025,"Stephen G. Dale, Nikita Kazeev, Alastair J. A. Price, Victor Posligua, Stephan Roche, O. Anatole von Lilienfeld, Konstantin S. Novoselov, Xavier Bresson, Gianmarco Mengaldo, Xudong Chen, Terence J. O'Kane, Emily R. Lines, Matthew J. Allen, Amandine E. Debus, Clayton Miller, Jiayu Zhou, Hiroko H. Dodge, David Rousseau, Andrey Ustyuzhanin, Ziyun Yan, Mario Lanza, Fabio Sciarrino, Ryo Yoshida, Zhidong Leong, Teck Leong Tan, Qianxiao Li, Adil Kabylda, Igor Poltavsky, Alexandre Tkatchenko, Sherif Abdulkader Tawfik, Prathami Divakar Kamath, Theo Jaffrelot Inizan, Kristin A. Persson, Bryant Y. Li, Vir Karan, Chenru Duan, Haojun Jia, Qiyuan Zhao, Hiroyuki Hayashi, Atsuto Seko, Isao Tanaka, Omar M. Yaghi, Tim Gould, Bun Chan, Stefan Vuckovic, Tianbo Li, Min Lin, Zehcen Tang, Yang Li, Yong Xu, Amrita Joshi, Xiaonan Wang, Leonard W. T. Ng, Sergei V. Kalinin, Mahshid Ahmadi, Jiyizhe Zhang, Shuyuan Zhang, Alexei Lapkin, Ming Xiao, Zhe Wu, Kedar Hippalgaonkar, Limsoon Wong, Lorenzo Bastonero, Nicola Marzari, Dorye Luis Esteras Cordoba, Andrei Tomut, Alba Quinones Andrade, Jose-Hugo Garcia","Artificial intelligence and machine learning are reshaping how we approach scientific discovery, not by replacing established methods but by extending what researchers can probe, predict, and design. In this roadmap we provide a forward-looking view of AI-enabled science across biology, chemistry, climate science, mathematics, materials science, physics, self-driving laboratories and unconventional computing. Several shared themes emerge: the need for diverse and trustworthy data, transferable electronic-structure and interatomic models, AI systems integrated into end-to-end scientific workflows that connect simulations to experiments and generative systems grounded in synthesisability rather than purely idealised phases. Across domains, we highlight how large foundation models, active learning and self-driving laboratories can close loops between prediction and validation while maintaining reproducibility and physical interpretability. Taken together, these perspectives outline where AI-enabled science stands today, identify bottlenecks in data, methods and infrastructure, and chart concrete directions for building AI systems that are not only more powerful but also more transparent and capable of accelerating discovery in complex real-world environments.",https://arxiv.org/pdf/2511.20976v1,,False
"Crowdsourcing the Frontier: Advancing Hybrid Physics-ML Climate Simulation via $50,000 Kaggle Competition",26/11/2025,"Jerry Lin, Zeyuan Hu, Tom Beucler, Katherine Frields, Hannah Christensen, Walter Hannah, Helge Heuer, Peter Ukkonnen, Laura A. Mansfield, Tian Zheng, Liran Peng, Ritwik Gupta, Pierre Gentine, Yusef Al-Naher, Mingjiang Duan, Kyo Hattori, Weiliang Ji, Chunhan Li, Kippei Matsuda, Naoki Murakami, Shlomo Ron, Marec Serlin, Hongjian Song, Yuma Tanabe, Daisuke Yamamoto, Jianyao Zhou, Mike Pritchard","Subgrid machine-learning (ML) parameterizations have the potential to introduce a new generation of climate models that incorporate the effects of higher-resolution physics without incurring the prohibitive computational cost associated with more explicit physics-based simulations. However, important issues, ranging from online instability to inconsistent online performance, have limited their operational use for long-term climate projections. To more rapidly drive progress in solving these issues, domain scientists and machine learning researchers opened up the offline aspect of this problem to the broader machine learning and data science community with the release of ClimSim, a NeurIPS Datasets and Benchmarks publication, and an associated Kaggle competition. This paper reports on the downstream results of the Kaggle competition by coupling emulators inspired by the winning teams' architectures to an interactive climate model (including full cloud microphysics, a regime historically prone to online instability) and systematically evaluating their online performance. Our results demonstrate that online stability in the low-resolution, real-geography setting is reproducible across multiple diverse architectures, which we consider a key milestone. All tested architectures exhibit strikingly similar offline and online biases, though their responses to architecture-agnostic design choices (e.g., expanding the list of input variables) can differ significantly. Multiple Kaggle-inspired architectures achieve state-of-the-art (SOTA) results on certain metrics such as zonal mean bias patterns and global RMSE, indicating that crowdsourcing the essence of the offline problem is one path to improving online performance in hybrid physics-AI climate simulation.",https://arxiv.org/pdf/2511.20963v1,,False
