Title,Publication Date,Author(s),Abstract,Link,DOI,Relevant
Shylock: Causal Discovery in Multivariate Time Series based on Hybrid Constraints,24/10/2025,"Shuo Li, Keqin Xu, Jie Liu, Dan Ye","Causal relationship discovery has been drawing increasing attention due to
its prevalent application. Existing methods rely on human experience,
statistical methods, or graphical criteria methods which are error-prone, stuck
at the idealized assumption, and rely on a huge amount of data. And there is
also a serious data gap in accessing Multivariate time series(MTS) in many
areas, adding difficulty in finding their causal relationship. Existing methods
are easy to be over-fitting on them. To fill the gap we mentioned above, in
this paper, we propose Shylock, a novel method that can work well in both
few-shot and normal MTS to find the causal relationship. Shylock can reduce the
number of parameters exponentially by using group dilated convolution and a
sharing kernel, but still learn a better representation of variables with time
delay. By combing the global constraint and the local constraint, Shylock
achieves information sharing among networks to help improve the accuracy. To
evaluate the performance of Shylock, we also design a data generation method to
generate MTS with time delay. We evaluate it on commonly used benchmarks and
generated datasets. Extensive experiments show that Shylock outperforms two
existing state-of-art methods on both few-shot and normal MTS. We also
developed Tcausal, a library for easy use and deployed it on the EarthDataMiner
platform",http://arxiv.org/pdf/2510.21181v1,,False
Uncertainty-Aware Multi-Objective Reinforcement Learning-Guided Diffusion Models for 3D De Novo Molecular Design,24/10/2025,"Lianghong Chen, Dongkyu Eugene Kim, Mike Domaratzki, Pingzhao Hu","Designing de novo 3D molecules with desirable properties remains a
fundamental challenge in drug discovery and molecular engineering. While
diffusion models have demonstrated remarkable capabilities in generating
high-quality 3D molecular structures, they often struggle to effectively
control complex multi-objective constraints critical for real-world
applications. In this study, we propose an uncertainty-aware Reinforcement
Learning (RL) framework to guide the optimization of 3D molecular diffusion
models toward multiple property objectives while enhancing the overall quality
of the generated molecules. Our method leverages surrogate models with
predictive uncertainty estimation to dynamically shape reward functions,
facilitating balance across multiple optimization objectives. We
comprehensively evaluate our framework across three benchmark datasets and
multiple diffusion model architectures, consistently outperforming baselines
for molecular quality and property optimization. Additionally, Molecular
Dynamics (MD) simulations and ADMET profiling of top generated candidates
indicate promising drug-like behavior and binding stability, comparable to
known Epidermal Growth Factor Receptor (EGFR) inhibitors. Our results
demonstrate the strong potential of RL-guided generative diffusion models for
advancing automated molecular design.",http://arxiv.org/pdf/2510.21153v1,,False
String Seed of Thought: Prompting LLMs for Distribution-Faithful and Diverse Generation,24/10/2025,"Kou Misaki, Takuya Akiba","We introduce String Seed of Thought (SSoT), a novel prompting method for LLMs
that improves Probabilistic Instruction Following (PIF). We define PIF as a
task requiring an LLM to select its answer from a predefined set of options,
each associated with a specific probability, such that the empirical
distribution of the generated answers aligns with the target distribution when
prompted multiple times. While LLMs excel at tasks with single, deterministic
answers, they often fail at PIF, exhibiting biases problematic for applications
requiring non-deterministic behaviors, such as human-behavior simulation,
content diversification, and multiplayer games. It also harms the diversity of
generated responses, a crucial factor in test-time scaling, by causing the
outputs to collapse into a limited set of answers. To address this, we propose
SSoT, a simple prompting method that instructs an LLM to first output a random
string to generate sufficient entropy. SSoT also instructs the LLM to extract
randomness by manipulating this string to derive a final answer, thereby
preserving diversity while adhering to specific constraints. We demonstrate
that SSoT significantly improves the PIF performance of LLMs, approaching the
ideal performance of a pseudo-random number generator. Furthermore, our
experiments on NoveltyBench show SSoT's benefits extend beyond closed-set tasks
to open-ended tasks by enhancing response diversity.",http://arxiv.org/pdf/2510.21150v1,,False
PanicToCalm: A Proactive Counseling Agent for Panic Attacks,24/10/2025,"Jihyun Lee, Yejin Min, San Kim, Yejin Jeon, SungJun Yang, Hyounghun Kim, Gary Geunbae Lee","Panic attacks are acute episodes of fear and distress, in which timely,
appropriate intervention can significantly help individuals regain stability.
However, suitable datasets for training such models remain scarce due to
ethical and logistical issues. To address this, we introduce PACE, which is a
dataset that includes high-distress episodes constructed from first-person
narratives, and structured around the principles of Psychological First Aid
(PFA). Using this data, we train PACER, a counseling model designed to provide
both empathetic and directive support, which is optimized through supervised
learning and simulated preference alignment. To assess its effectiveness, we
propose PanicEval, a multi-dimensional framework covering general counseling
quality and crisis-specific strategies. Experimental results show that PACER
outperforms strong baselines in both counselor-side metrics and client affect
improvement. Human evaluations further confirm its practical value, with PACER
consistently preferred over general, CBT-based, and GPT-4-powered models in
panic scenarios (Code is available at https://github.com/JihyunLee1/PanicToCalm
).",http://arxiv.org/pdf/2510.21143v1,,False
Enhanced Evolutionary Multi-Objective Deep Reinforcement Learning for Reliable and Efficient Wireless Rechargeable Sensor Networks,24/10/2025,"Bowei Tong, Hui Kang, Jiahui Li, Geng Sun, Jiacheng Wang, Yaoqi Yang, Bo Xu, Dusit Niyato","Despite rapid advancements in sensor networks, conventional battery-powered
sensor networks suffer from limited operational lifespans and frequent
maintenance requirements that severely constrain their deployment in remote and
inaccessible environments. As such, wireless rechargeable sensor networks
(WRSNs) with mobile charging capabilities offer a promising solution to extend
network lifetime. However, WRSNs face critical challenges from the inherent
trade-off between maximizing the node survival rates and maximizing charging
energy efficiency under dynamic operational conditions. In this paper, we
investigate a typical scenario where mobile chargers move and charge the
sensor, thereby maintaining the network connectivity while minimizing the
energy waste. Specifically, we formulate a multi-objective optimization problem
that simultaneously maximizes the network node survival rate and mobile charger
energy usage efficiency across multiple time slots, which presents NP-hard
computational complexity with long-term temporal dependencies that make
traditional optimization approaches ineffective. To address these challenges,
we propose an enhanced evolutionary multi-objective deep reinforcement learning
algorithm, which integrates a long short-term memory (LSTM)-based policy
network for temporal pattern recognition, a multilayer perceptron-based
prospective increment model for future state prediction, and a time-varying
Pareto policy evaluation method for dynamic preference adaptation. Extensive
simulation results demonstrate that the proposed algorithm significantly
outperforms existing approaches in balancing node survival rate and energy
efficiency while generating diverse Pareto-optimal solutions. Moreover, the
LSTM-enhanced policy network converges 25% faster than conventional networks,
with the time-varying evaluation method effectively adapting to dynamic
conditions.",http://arxiv.org/pdf/2510.21127v1,,False
Generalizable Hierarchical Skill Learning via Object-Centric Representation,24/10/2025,"Haibo Zhao, Yu Qi, Boce Hu, Yizhe Zhu, Ziyan Chen, Heng Tian, Xupeng Zhu, Owen Howell, Haojie Huang, Robin Walters, Dian Wang, Robert Platt","We present Generalizable Hierarchical Skill Learning (GSL), a novel framework
for hierarchical policy learning that significantly improves policy
generalization and sample efficiency in robot manipulation. One core idea of
GSL is to use object-centric skills as an interface that bridges the high-level
vision-language model and the low-level visual-motor policy. Specifically, GSL
decomposes demonstrations into transferable and object-canonicalized skill
primitives using foundation models, ensuring efficient low-level skill learning
in the object frame. At test time, the skill-object pairs predicted by the
high-level agent are fed to the low-level module, where the inferred canonical
actions are mapped back to the world frame for execution. This structured yet
flexible design leads to substantial improvements in sample efficiency and
generalization of our method across unseen spatial arrangements, object
appearances, and task compositions. In simulation, GSL trained with only 3
demonstrations per task outperforms baselines trained with 30 times more data
by 15.5 percent on unseen tasks. In real-world experiments, GSL also surpasses
the baseline trained with 10 times more data.",http://arxiv.org/pdf/2510.21121v1,,False
