Title,Publication Date,Author(s),Abstract,Link,DOI,Relevant
Remember to be Curious: Episodic Context and Persistent Worlds for 3D Exploration,21/05/2026,"Lily Goli, Justin Kerr, Daniele Reda, Alec Jacobson, Andrea Tagliasacchi, Angjoo Kanazawa","Exploration is a prerequisite for learning useful behaviors in sparse-reward, long-horizon tasks, particularly within 3D environments. Curiosity-driven reinforcement learning addresses this via intrinsic rewards derived from the mismatch between the agent's predictive model of the world and reality. However, translating this intrinsic motivation to complex, photorealistic environments remains difficult, as agents can become trapped in local loops and receive fresh rewards for revisiting forgotten states. In this work, we demonstrate that this failure stems from a lack of spatial persistence and episodic context. We show that effective curiosity requires a model of the world that is persistent and continuously updated, paired with an agent that maintains an episodic trajectory history to navigate toward novel regions. We achieve this using an online 3D reconstruction as a persistent model of the world, while the agent policy is parameterized as a sequence model over RGB observations to maintain episodic context. This design enables effective exploration during training while allowing the agent to navigate using solely RGB frames at deployment. Trained purely via curiosity on HM3D, our agent outperforms RL-based active mapping baselines and generalizes zero-shot to Gibson and AI-generated worlds. Our end-to-end policy enables efficient adaptation to downstream tasks, such as apple picking and image-goal navigation, outperforming from-scratch baselines. Please see video results at https://recuriosity.github.io/.",https://arxiv.org/pdf/2605.22814v1,,False
Gated DeltaNet-2: Decoupling Erase and Write in Linear Attention,21/05/2026,"Ali Hatamizadeh, Yejin Choi, Jan Kautz","Linear attention replaces the unbounded cache of softmax attention with a fixed-size recurrent state, reducing sequence mixing to linear time and decoding to constant memory. The hard part is not just what to forget, but how to edit this compressed memory without scrambling existing associations. Delta-rule models subtract the current read before writing a new value, and Kimi Delta Attention (KDA) sharpens forgetting with channel-wise decay. But the active edit still uses a single scalar gate to control two different things: how much old content to erase on the key side and how much new content to commit on the value side. We introduce Gated DeltaNet-2, which generalizes both Gated DeltaNet and KDA by inheriting adaptive forgetting and channel-wise decay while addressing their shared limitation, the scalar tie between erasing and writing. Gated Delta Rule-2 separates these roles with a channel-wise erase gate b_t and a channel-wise write gate w_t, reducing to KDA when both gates collapse to the same scalar and to Gated DeltaNet when the decay also collapses. We derive a fast-weight update view, a chunkwise WY algorithm with channel-wise decay absorbed into asymmetric erase factors, and a gate-aware backward pass that preserves efficient parallel training. At 1.3B parameters trained on 100B FineWeb-Edu tokens, Gated DeltaNet-2 achieves the strongest overall results among Mamba-2, Gated DeltaNet, KDA, and Mamba-3 variants across language modeling, commonsense reasoning, and retrieval. Its advantage is most pronounced on long-context RULER needle-in-a-haystack benchmarks, where it improves the evaluated multi-key retrieval setting and remains strong in both recurrent and hybrid settings. Code is available at https://github.com/NVlabs/GatedDeltaNet-2.",https://arxiv.org/pdf/2605.22791v1,,False
Superhuman Safe and Agile Racing through Multi-Agent Reinforcement Learning,21/05/2026,"Ismail Geles, Leonard Bauersfeld, Markus Wulfmeier, Davide Scaramuzza","Autonomous systems have achieved superhuman performance in isolation or simulation, yet they remain brittle in shared, dynamic real-world spaces. This failure stems from the dominant single-agent paradigm for physical applications, where other actors are ignored or treated as environmental noise, preventing effective coordination. Here we show that multi-agent reinforcement learning provides the essential safety scaffolding required for real-world interaction. Using high-speed quadrotor racing as a high-stakes testbed, we train agents to navigate complex aerodynamic interactions and strategic maneuvering with a variable number of racers. Through league-based self-play, agents evolve sophisticated anticipatory behaviors, including proactive collision avoidance, overtaking, and handling multi-agent physical interactions, including aerodynamic downwash. Our agents outperform a champion-level human pilot in multi-player races at speeds exceeding 22 m/s, while simultaneously reducing collision rates by 50 % compared to state-of-the-art single-agent baselines. Crucially, training with diverse artificial agents enables zero-shot generalization to safer human interaction. These results suggest that the path to robust robotic co-existence lies not in isolated safety constraints, but in the rigorous demands of multi-agent interaction. Multimedia materials are available at: https://rpg.ifi.uzh.ch/marl",https://arxiv.org/pdf/2605.22748v1,,False
HarnessAPI: A Skill-First Framework for Unified Streaming APIs and MCP Tools,21/05/2026,Edwin Jose,"Every Python function deployed as an LLM tool must today exist in two forms: an HTTP endpoint for human-facing clients and CI pipelines, and an MCP tool registration for agent runtimes such as Claude and Cursor. These representations share business logic yet diverge in all the surrounding machinery (routing, validation, serialisation, streaming, and schema maintenance), and they drift apart as the underlying code evolves. We present HarnessAPI, a Python framework that eliminates this duplication by treating a typed skill folder as the single source of truth. From one handler.py plus Pydantic schemas, the framework automatically derives a streaming HTTP endpoint with Server-Sent Events, an interactive OpenAPI/Swagger UI, and a zero-configuration MCP tool, all served from a single process. Dual-mode content negotiation lets the same handler serve SSE-streaming and JSON-returning clients with no handler changes. A dynamic code-generation mechanism ensures Pydantic type annotations propagate correctly to FastMCP's inspection layer, resolving a technical limitation that prevents naive closure-based registration. Measured across six representative skills using cloc, HarnessAPI reduces framework-facing boilerplate by 74% compared with a manually maintained dual-stack implementation (FastAPI server + FastMCP server). HarnessAPI subclasses FastAPI, inheriting its full middleware, dependency-injection, and deployment ecosystem. It is available at https://github.com/edwinjosechittilappilly/harnessapi and on PyPI (pip install harnessapi)",https://arxiv.org/pdf/2605.22733v1,,False
Live Music Diffusion Models: Efficient Fine-Tuning and Post-Training of Interactive Diffusion Music Generators,21/05/2026,"Zachary Novack, Stephen Brade, Haven Kim, Hugo Flores García, Nithya Shikarpur, Chinmay Talegaonkar, Suwan Kim, Valerie K. Chen, Julian McAuley, Taylor Berg-Kirkpatrick, Cheng-Zhi Anna Huang","Interactive streaming music generation promises the use of generative models for live performance and co-creation that is impossible with offline models. However, SOTA models exist in the discrete-AR regime, requiring industrial levels of compute for both training and inference. In this work, we investigate whether audio diffusion models, with their wide support in the open-source community but non-streaming bidirectional nature, can be repurposed efficiently into interactive models accessible on consumer hardware. By taking a critical look at the modern pipeline for block-wise outpainting diffusion, we identify critical inefficiencies during inference that result in strictly worse computational efficiency than their discrete-AR counterparts. We propose Live Music Diffusion Models (LMDMs), a simple modification of the generative diffusion process that recovers, and then outperforms, the inference complexity of the discrete Live Music Models (LMMs) through block-wise KV Caching. Unlike LMMs, LMDMs further enable stable post-training alignment through our novel ARC-Forcing paradigm, reducing error accumulation without any explicit RL or reward models. We demonstrate the application of LMDMs in a number of creative domains, including text-conditioned generation, sketch-based music synthesis, and jamming. We finally show how LMDMs can be used as a generative instrument in a real artist-AI collaboration, utilizing LMDMs as a ""generative delay"" to transform musicians' improvisation live for variable timbral effects while running locally on a consumer gaming laptop.",https://arxiv.org/pdf/2605.22717v1,,False
AnyMo: Geometry-Aware Setup-Agnostic Modeling of Human Motion in the Wild,21/05/2026,"Baiyu Chen, Zechen Li, Wilson Wongso, Lihuan Li, Xiachong Lin, Hao Xue, Benjamin Tag, Flora Salim","As wearable and mobile devices become increasingly embedded in daily life, they offer a practical way to continuously sense human motion in the wild. But inertial signals are highly dependent on the sensing setup, including body location, mounting position, sensor orientation, device hardware, and sampling protocol. This setup dependence makes it difficult to learn motion representations that transfer across devices and datasets, and limits the broader use of wearable IMUs beyond closed-set recognition. We introduce AnyMo, a geometry-aware framework for setup-agnostic human motion modeling. AnyMo uses physics-grounded IMU simulation over dense body-surface placements to generate diverse and plausible synthetic signals, pre-trains a graph encoder from paired synthetic placement views and masked partial observations, tokenizes multi-position IMU into full-body motion tokens, and aligns these tokens with an LLM for motion-language understanding. We evaluate AnyMo on three complementary tasks: zero-shot activity recognition across 14 unseen downstream datasets, cross-modal retrieval, and wearable IMU motion captioning, where it improves average Accuracy/F1/R@2 by 11.7\%/11.6\%/22.6\% on HAR, increases zero-shot IMU-to-text and text-to-IMU retrieval MRR by 15.9\% and 28.6\%, respectively, and improves zero-shot captioning BERT-F1 by 18.8\%. These results support AnyMo as a generalist model for wearable motion understanding in the wild. Project page: https://baiyuchen.com/project/AnyMo.",https://arxiv.org/pdf/2605.22715v1,,False
ChronoVAE-HOPE: Beyond Attention -- A Next-Generation VAE Foundation Model for Specialized Time Series Classification,21/05/2026,"José Alberto Rodríguez, Luis Balderas, Miguel Lastra, Antonio Arauzo-Azofra, José M. Benítez","Time Series Foundation Models (TSFMs) have become a new component of the state-of-the-art in general time series forecasting. However, adapting them to specialized classification tasks remains constrained by two interconnected challenges: the quadratic cost of standard attention mechanisms and the inability to disentangle the structural components underlying time series variability. This technical report introduces ChronoVAE-HOPE, a next-generation TSFM that reconciles massive generalization with structured latent representation for time series classification. The core of the proposal is a Variational Autoencoder (VAE) framework built upon the HOPE Block, which replaces quadratic attention with a dual-memory system: Titans modules for dynamic short-term retention and a Continuum Memory System (CMS) for the abstraction of long-term historical context. A key architectural novelty is the disentangled latent space, which factorizes representations into independent trend and seasonal components via dedicated encoder heads and separate decoder pathways. ChronoVAE-HOPE undergoes self-supervised pre-training on the Monash archive, combining a Masked Time Series Modeling (MTSM) auxiliary objective with a disentangled VAE reconstruction loss. The pre-trained encoder is subsequently frozen and used to generate fixed-length embeddings for downstream classification on the UCR benchmark datasets. Empirical results demonstrate strong performance across diverse temporal domains, particularly in settings characterized by strict causal structure. ChronoVAE-HOPE establishes a robust and interpretable framework for the adaptation of foundation models to time series classification through structured generative representations.",https://arxiv.org/pdf/2605.22684v1,,False
Contractual Skills: A GovernSpec Design Framework for Enterprise AI Agents,21/05/2026,Ting Liu,"Skills are increasingly used to package agent instructions, workflows, scripts, and reference materials. In enterprise settings, however, skills often need to express more than task guidance: they must make goals, input boundaries, permissions, evidence requirements, output contracts, quality criteria, verification steps, human approval points, and handoff rules inspectable. This paper proposes contractual skills, a GovernSpec-inspired design framework for organizing SKILL.md files as readable task contracts while preserving lightweight skill discovery and progressive loading. The framework clarifies the boundary between contractual skills, GovernSpec YAML contracts, Model Context Protocol surfaces, tool adapters, runtime guardrails, tracing, and evaluation systems.
  We evaluate the framework with two offline experiments. A text-generation study covers three enterprise skills, fifteen synthetic tasks, four instruction conditions, and eight generation models, yielding 960 outputs and 1680 cross-judge score records. Contractual skills outperform no-skill and minimal-skill baselines on all tested models. Relative to information-rich plain expanded skills, the gains are small and mixed, suggesting that contractual fields mainly improve checkability and maintainability rather than raw generation quality. A tool-calling challenge covers eight models and 192 simulated tool-call records. Skills usually reduce high-risk tool attempts, but model differences remain and runtime tool guardrails are still required. The results suggest that contractual skills are best understood as a governance layer that makes task intent, boundaries, and acceptance criteria explicit, not as a standalone safety mechanism.",https://arxiv.org/pdf/2605.22634v1,,False
Evolutionary Multi-Task Optimization for LLM-Guided Program Discovery,21/05/2026,"Halil Alperen Gozeten, Xuechen Zhang, Emrullah Ildiz, Ege Onur Taga, Tara Javidi, Samet Oymak","Recent LLM-guided evolutionary search methods have shown that iterative program mutation can discover strong algorithms, but they typically optimize each task independently, even when related tasks share reusable structure. We introduce Evolutionary Multi-Task Optimization (EMO) for LLM-guided program discovery, and propose EMO-STA (Shared-Then-Adapt), a two-stage framework that first evolves a shared archive of executable programs across a task family and then adapts selected shared candidates to each target task. Within EMO-STA, we explore multiple adaptation strategies, including warm-starting from the shared archive, adapting the best average shared program, and adapting the shared program that performs best on each target task. Across eight task families spanning continuous optimization, geometric construction, modeling, and algorithmic optimization, EMO-STA improves over matched-compute single-task evolution in most settings, with STA Best-Local providing the strongest in-distribution adaptation and STA Best-Shared yielding robust transfer to unseen tasks. Compute-allocation experiments show that allocating a substantial fraction of the family-level budget to shared evolution is consistently beneficial, with roughly balanced shared and adaptation budgets often being optimal. Beyond compute efficiency, we show that shared evolution can mitigate overfitting in low-evidence settings (e.g. few training data), including ARC tasks and time-series feature engineering, by favoring programs that generalize across all tasks rather than exploiting task-specific brittle artifacts.",https://arxiv.org/pdf/2605.22613v1,,False
Benchmarking Machine Learning Architectures for Antimicrobial Stewardship in Pediatric ICUs,21/05/2026,"Niklas Raehse, Luregn J. Schlapbach, Daphné Chopard","Antimicrobial stewardship (AMS) is critical in pediatric intensive care units (PICUs), where diagnostic uncertainty often drives broad-spectrum antibiotic use, increasing antimicrobial resistance and potential long-term harms. Machine learning offers a promising approach for identifying patient-level opportunities for stewardship interventions from electronic health record data, yet prior work has focused largely on adult populations and static tabular representations. We present a systematic benchmarking study of AMS intervention prediction in the PICU across a public dataset and a private institutional cohort. We define four clinically relevant proxy targets for reducing antibiotic exposure: intravenous-to-oral switching, de-escalation, discontinuation, and short-course therapy. Under a unified evaluation framework, we compare tabular, sequence-based, and graph-based temporal models at multiple temporal resolutions. We find that predictive performance is driven primarily by target prevalence and dataset characteristics rather than model complexity. Sequence models improve the precision-recall trade-off over tabular approaches at coarse (24-hour) resolution, while finer temporal modeling provides limited additional benefit. However, these gains come at the cost of poorer calibration, with simpler tabular models yielding more reliable probability estimates. Multi-task learning produces only marginal improvements, suggesting limited shared structure across stewardship targets. Our findings highlight the importance of target design, temporal representation, and calibration in clinical machine learning, and provide practical guidance for developing reliable decision support systems for pediatric AMS.",https://arxiv.org/pdf/2605.22611v1,,False
MoSA: Motion-constrained Stress Adaptation for Mitigating Real-to-Sim Gap in Continuum Dynamics via Learning Residual Anisotropy,21/05/2026,"Jiaxu Wang, Junhao He, Jingkai Sun, Yi Gu, Yunyang Mo, Jiahang Cao, Qiang Zhang, Renjing Xu","Learning real-world dynamics from visual observations is crucial for various domains. A common strategy is to calibrate simulators by estimating physical parameters, yet accuracy is ultimately bounded by the underlying physical models, which often assume materials are homogeneous and isotropic. Even if reasonable, real-world objects typically exhibit mild anisotropy and heterogeneity. After the near-isotropic backbone is well calibrated, these residual effects become the key bottleneck for further closing the real-to-sim gap. Although neural networks can fit dynamics end-to-end, such black-box modeling discards strong physical priors, leading to poor data efficiency and overfitting. Therefore, we propose MoSA, a motion-constrained stress adaptation framework that targets these residual effects to further improve real-to-sim dynamics learning. MoSA uses an isotropic model as a physics prior and learns residual stress operators to capture mild anisotropy and heterogeneity. It progressively adapts stresses via microplane-constrained redistribution in a physics-informed cascaded network. We further impose motion constraints by supervising temporal and spatial derivatives of the deformation field. Experimentally, our learned dynamics achieves superior accuracy, generalization, and robustness, while learning physically meaningful residual anisotropy. Finally, we validate MoSA in a robot manipulation setting, showing that better real-to-sim dynamics modeling translates into more reliable sim-to-real transfer. Project Page is available at https://mercerai.github.io/MoSA/.",https://arxiv.org/pdf/2605.22597v1,,False
Meta-Learning for Rapid Adaptation in Reference Tracking of Uncertain Nonlinear Systems,21/05/2026,"Jiaqi Yan, Ankush Chakrabarty, Niklas Schmid, John Lygeros, Alisa Rupenyan","In this paper, we address the problem of reference tracking for uncertain nonlinear systems. Since collecting data from the target system (i.e., the system of interest) is often challenging, our objective is to design optimal controllers using limited target system data. Meta-learning provides a promising paradigm by leveraging offline data from source systems (systems sharing structural similarities with the target system) to accelerate training and enhance control performance. Motivated by this idea, we propose a meta-learning-based control framework that tailors the implicit model-agnostic meta-learning (iMAML) algorithm to the control setting. The framework operates in two phases: an (offline) meta-training phase, where an aggregated representation is learned from source data to capture the shared system dynamics among similar systems, and an (online) meta-adaptation phase, where this representation is fine-tuned on the target system using only a few data samples and limited adaptation steps. We formulate this framework as a bi-level optimization problem and provide an efficient solution with reduced storage complexity and few approximations. The proposed framework is general, allowing various learning algorithms to be integrated. To demonstrate this flexibility, we propose two specific learning algorithms that can be incorporated into our framework based on a neural state-space model and a deep Q-network, respectively. The primary distinction between these approaches is whether explicit system identification is required. Numerical simulations and hardware experiments demonstrate that the proposed methods enhance control performance and consistently outperform baseline approaches.",https://arxiv.org/pdf/2605.22513v1,,False
Generative Modeling by Value-Driven Transport,21/05/2026,"Pablo Moreno-Muñoz, Adrian Müller, Gergely Neu","We propose a new framework for generative modeling based on a discrete-time stochastic control formulation of measure transport. Adapting classic results from control theory, we formulate our problem as a linear program whose dual variables correspond to the \emph{optimal value function} of the control problem, which directly encodes the optimal control policy. Exploiting this LP formulation, we develop an efficient simulation-free primal-dual algorithm for computing approximately optimal value functions and the associated \emph{value-driven transport} (VDT) policies which approximate the true optimal policy. We show that well-trained VDT policies enjoy numerous favorable properties in comparison with other state-of-the-art methods based on flows, diffusions, or Schrödinger bridges: they lead to straight transport paths which can be simulated quickly and robustly, and can be enhanced in all the same ways as diffusion and flow-based models (e.g., conditional generation, classifier-free guidance, unpaired data-to-data translation are all easy to incorporate). We evaluate our methodology in a range of experiments, with results that indicate strong performance and good potential for scalability.",https://arxiv.org/pdf/2605.22507v1,,False
Understanding Multimodal Failure in Action-Chunking Behavioral Cloning,21/05/2026,"Lorenzo Mazza, Massimiliano Datres, Ariel Rodriguez, Sebastian Bodenstedt, Gitta Kutyniok, Stefanie Speidel","Behavioral cloning becomes difficult when the same observation admits several valid actions. We study this problem for action-chunking policies and show that different multimodal parameterizations fail in different ways. For latent-variable policies, posterior-prior regularization makes deployment-time sampling more reliable, but excessive regularization removes the action-conditioned information needed to distinguish demonstrated modes. Reducing this regularization can preserve mode information, but then success depends on whether the prior covers the relevant latent regions. For action-space generative policies, multimodality is constrained by the smoothness of the base-to-action transport: a map with small Lipschitz constant cannot assign substantial probability to many well-separated modes. Covering many modes therefore requires either sharp transitions in base space or off-support bridge regions in action space. Experiments on synthetic multimodal tasks and robotic simulation benchmarks support these mechanisms.",https://arxiv.org/pdf/2605.22493v1,,False
