Title,Publication Date,Author(s),Abstract,Link,DOI,Relevant
ILAEDA: An Imitation Learning Based Approach for Automatic Exploratory Data Analysis,15/10/2024,"Abhijit Manatkar, Devarsh Patel, Hima Patel, Naresh Manwani","Automating end-to-end Exploratory Data Analysis (AutoEDA) is a challenging
open problem, often tackled through Reinforcement Learning (RL) by learning to
predict a sequence of analysis operations (FILTER, GROUP, etc). Defining
rewards for each operation is a challenging task and existing methods rely on
various \emph{interestingness measures} to craft reward functions to capture
the importance of each operation. In this work, we argue that not all of the
essential features of what makes an operation important can be accurately
captured mathematically using rewards. We propose an AutoEDA model trained
through imitation learning from expert EDA sessions, bypassing the need for
manually defined interestingness measures. Our method, based on generative
adversarial imitation learning (GAIL), generalizes well across datasets, even
with limited expert data. We also introduce a novel approach for generating
synthetic EDA demonstrations for training. Our method outperforms the existing
state-of-the-art end-to-end EDA approach on benchmarks by upto 3x, showing
strong performance and generalization, while naturally capturing diverse
interestingness measures in generated EDA sessions.",http://arxiv.org/pdf/2410.11276v1,,False
Bayes Adaptive Monte Carlo Tree Search for Offline Model-based Reinforcement Learning,15/10/2024,"Jiayu Chen, Wentse Chen, Jeff Schneider","Offline reinforcement learning (RL) is a powerful approach for data-driven
decision-making and control. Compared to model-free methods, offline
model-based reinforcement learning (MBRL) explicitly learns world models from a
static dataset and uses them as surrogate simulators, improving the data
efficiency and enabling the learned policy to potentially generalize beyond the
dataset support. However, there could be various MDPs that behave identically
on the offline dataset and so dealing with the uncertainty about the true MDP
can be challenging. In this paper, we propose modeling offline MBRL as a Bayes
Adaptive Markov Decision Process (BAMDP), which is a principled framework for
addressing model uncertainty. We further introduce a novel Bayes Adaptive
Monte-Carlo planning algorithm capable of solving BAMDPs in continuous state
and action spaces with stochastic transitions. This planning process is based
on Monte Carlo Tree Search and can be integrated into offline MBRL as a policy
improvement operator in policy iteration. Our ``RL + Search"" framework follows
in the footsteps of superhuman AIs like AlphaZero, improving on current offline
MBRL methods by incorporating more computation input. The proposed algorithm
significantly outperforms state-of-the-art model-based and model-free offline
RL methods on twelve D4RL MuJoCo benchmark tasks and three target tracking
tasks in a challenging, stochastic tokamak control simulator.",http://arxiv.org/pdf/2410.11234v1,,False
Latent-Predictive Empowerment: Measuring Empowerment without a Simulator,15/10/2024,"Andrew Levy, Alessandro Allievi, George Konidaris","Empowerment has the potential to help agents learn large skillsets, but is
not yet a scalable solution for training general-purpose agents. Recent
empowerment methods learn diverse skillsets by maximizing the mutual
information between skills and states; however, these approaches require a
model of the transition dynamics, which can be challenging to learn in
realistic settings with high-dimensional and stochastic observations. We
present Latent-Predictive Empowerment (LPE), an algorithm that can compute
empowerment in a more practical manner. LPE learns large skillsets by
maximizing an objective that is a principled replacement for the mutual
information between skills and states and that only requires a simpler
latent-predictive model rather than a full simulator of the environment. We
show empirically in a variety of settings--including ones with high-dimensional
observations and highly stochastic transition dynamics--that our empowerment
objective (i) learns similar-sized skillsets as the leading empowerment
algorithm that assumes access to a model of the transition dynamics and (ii)
outperforms other model-based approaches to empowerment.",http://arxiv.org/pdf/2410.11155v1,,False
