Title,Publication Date,Author(s),Abstract,Link,DOI,Relevant
LMPath: Language-Mediated Priors and Path Generation for Aerial Exploration,13/05/2026,"Jonathan A. Diller, Fernando Cladera, Camillo J. Taylor, Vijay Kumar","Traditional autonomous UAV search missions rely on geometric coverage patterns that ignore the semantic context of the target, leading to significant time waste in large-scale environments. In this paper we present LMPath, a pipeline for generating language-mediated exploration priors for Unmanned Aerial Vehicle (UAV) search missions that leverages semantics. Given a basic geofence and an object of interest prompt, LMPath uses generative language models to determine what regions of the environment should contain that object and a foundation vision model ran over satellite imagery to segment sub-regions that form the exploration prior. This prior can then be used to generate UAV paths with various objectives, such as minimizing the expected time to locate the object of interest, maximizing the probability that the object is found given a limited travel distance, or narrowing down the search space to sub-regions that are most likely to contain the object. To demonstrate it's capabilities, we used LMPath to generate various UAV paths and ran them using a real UAV over large-scale environments. We also ran simulations to demonstrate how paths generated using LMPath outperform traditional path planning approaches for search missions.",https://arxiv.org/pdf/2605.13782v1,,False
Beyond Mode-Seeking RL: Trajectory-Balance Post-Training for Diffusion Language Models,13/05/2026,"Saba Ahmadi, Prasanna Parthasarathi, Yufei Cui","Diffusion language models are a promising alternative to autoregressive models, yet post-training methods for them largely adapt reward-maximizing objectives. We identify a central failure mode in this setting we call trajectory locking: sampled reward-driven updates over-concentrate probability mass onto a narrow set of denoising paths, reducing coverage of alternative correct solutions under repeated sampling. To address this, we propose TraFL (Trajectory Flow baLancing), a trajectory-balance objective that trains the policy toward a reward-tilted target distribution anchored to a frozen reference model. We make this practical for diffusion language models with a diffusion-compatible sequence-level surrogate and a learned prompt-dependent normalization. Across mathematical reasoning and code generation benchmarks, TraFL is the only evaluated post-training method that improves over the base model in every benchmark-length setting, with gains that persist as the sampling budget increases. The improvements transfer to held-out evaluations: TraFL stays above the base model on Minerva Math and is the strongest method on every LiveCodeBench difficulty split.",https://arxiv.org/pdf/2605.13935v1,,False
AnyFlow: Any-Step Video Diffusion Model with On-Policy Flow Map Distillation,13/05/2026,"Yuchao Gu, Guian Fang, Yuxin Jiang, Weijia Mao, Song Han, Han Cai, Mike Zheng Shou","Few-step video generation has been significantly advanced by consistency distillation. However, the performance of consistency-distilled models often degrades as more sampling steps are allocated at test time, limiting their effectiveness for any-step video diffusion. This limitation arises because consistency distillation replaces the original probability-flow ODE trajectory with a consistency-sampling trajectory, weakening the desirable test-time scaling behavior of ODE sampling. To address this limitation, we introduce AnyFlow, the first any-step video diffusion distillation framework based on flow maps. Instead of distilling a model for only a few fixed sampling steps, AnyFlow optimizes the full ODE sampling trajectory. To this end, we shift the distillation target from endpoint consistency mapping $(z_{t}\rightarrow z_{0})$ to flow-map transition learning $(z_{t}\rightarrow z_{r})$ over arbitrary time intervals. We further propose Flow Map Backward Simulation, which decomposes a full Euler rollout into shortcut flow-map transitions, enabling efficient on-policy distillation that reduces test-time errors (i.e., discretization error in few-step sampling and exposure bias in causal generation). Extensive experiments across both bidirectional and causal architectures, at scales ranging from 1.3B to 14B parameters, demonstrate that AnyFlow achieves performance matches or surpasses consistency-based counterparts in the few-step regime, while scaling with sampling step budgets.",https://arxiv.org/pdf/2605.13724v1,,False
FSCM: Frequency-Enhanced Spatial-Spectral Coupled Mamba for Infrared Hyperspectral Image Colorization,13/05/2026,"Tingting Liu, Yuan Liu, Guiping Chen, Xiubao Sui, Qian Chen","Thermal infrared imaging is robust to illumination variations and smoke interference, making it important for all-weather perception. However, the lack of natural color and fine texture limits target recognition, human visual interpretation, and the transfer of visible-light models. Existing infrared colorization methods mainly rely on single-band images, where insufficient spectral cues may lead to structural distortion and semantic confusion. Although infrared hyperspectral images provide rich spectral responses and material information, existing single-band frameworks remain limited in modeling spatial-spectral coupling and weak texture details. To address these issues, this paper presents FSCM, a spectral-information-guided GAN framework. Within FSCM, a frequency-enhanced spatial-spectral state-space generator composed of cascaded FSB units is constructed. Each FSB integrates three complementary components: state-space modeling captures global spatial-spectral dependencies; the frequency enhancement module (FEM) combines multi-level wavelet decomposition and Fourier gating to recover structural contours, directional high-frequency details, and global frequency responses; and the dual-stream hybrid gating module (DGM) integrates deformation-aware sampling with sparse attention to enhance effective local structures and suppress background interference. Additionally, an online semantic segmentation-guided loss is introduced to constrain the generated results, improving semantic consistency in complex road scenes. Experiments show that FSCM outperforms existing infrared colorization methods in visual quality and semantic fidelity.",https://arxiv.org/pdf/2605.15880v1,,False
A Hierarchical Language Model with Predictable Scaling Laws and Provable Benefits of Reasoning,13/05/2026,"Jason Gaitonde, Frederic Koehler, Elchanan Mossel, Joonhyung Shin, Allan Sly","We introduce a family of synthetic languages with hierarchical structure -- generated by a broadcast process on trees -- for which the role of context length and reasoning in autoregressive generation can be analyzed precisely. At the heart of our analytic approach is an \emph{exact $k$-gram ansatz} in place of transformers with context length $k$, a substitution we then validate empirically. Using this ansatz we derive explicit asymptotic predictions for distributional statistics of the sequences produced by a trained model, instantiated in two settings. For the \emph{Ising broadcast process} (a soft-constrained language), we prove that the variance of the generated sum scales log-linearly in the context depth and its kurtosis converges to that of a Gaussian -- both deviating from the true language for any sublinear context. For the \emph{coloring broadcast process} (a hard-constrained language) in the freezing regime, bounded-context autoregression produces sequences that, with high probability, are inconsistent with \emph{any} valid coloring of the underlying tree. Together these results imply an $Ω(n)$ lower bound on the context length required to faithfully sample length-$n$ sequences. In contrast, we prove that an autoregressive \emph{reasoning} model with only $Θ(\log n)$ working memory can sample exactly from the true language -- an exponential improvement. We confirm both the lower-bound predictions and the reasoning-based upper bound empirically with transformers trained on the synthetic language; the trained models track our asymptotic predictions quantitatively across a wide range of context sizes.",https://arxiv.org/pdf/2605.13687v1,,False
Sampling from Flow Language Models via Marginal-Conditioned Bridges,13/05/2026,"Iskander Azangulov, Leo Zhang","Flow Language Models (FLMs) are a recently introduced class of language models which adapt continuous flow matching for one-hot encoded token sequences. Their denoisers have a special structure absent from generic continuous diffusion models: each block of the denoising mean is a posterior marginal distribution over the clean token at that position. Standard DDPM-style samplers collapse these marginals to a single conditional-mean endpoint and bridge toward this simplex-valued point, which is generally not a valid one-hot sequence. We argue that the natural sampler for an FLM is instead posterior-predictive. At each reverse step, we sample a clean one-hot endpoint from the factorized posterior defined by the FLM token marginals, and then sample the next continuous state from the analytic Ornstein--Uhlenbeck bridge conditioned on that endpoint. The method is training-free, uses the same model evaluations as standard sampling, and gives a principled interface for token-level decoding controls such as temperature scaling and nucleus truncation. We show that, under exact posterior marginals, the endpoint approximation error is exactly the conditional multi-information among token positions. The induced one-step bridge kernel preserves all token-wise posterior-predictive marginals and loses only the residual cross-position dependence. Finally, we prove a Girsanov path-space comparison showing that the marginal-conditioned bridge has a no-larger denoising-error term than the frozen conditional-mean bridge, with strict improvement whenever intermediate coordinate-wise bridge observations reveal additional information about the clean token. Experiments with FLMs show that the sampler improves the quality--diversity tradeoff. Code is available at: github.com/imbirik/mcb.",https://arxiv.org/pdf/2605.13681v1,,False
HetScene: Heterogeneity-Aware Diffusion for Dense Indoor Scene Generation,13/05/2026,"Zini Chen, Junming Huang, Rong Zhang, Jiamin Xu, Cheng Peng, Chi Wang, Weiwei Xu","Generating controllable and physically plausible indoor scenes is a pivotal prerequisite for constructing high-fidelity simulation environments for embodied AI. However, existing deeplearning-based methods usually treat all objects as homogeneous instances within a unified generation process. While effective for sparse and simplistic layouts, they struggle to model realistic layouts with dense object arrangements and complex spatial dependencies, leadingto limited scalability and degraded physical plausibility. To deal with these challenges, we revisit indoor layout generation from the perspective of structural heterogeneity and decompose the objects into primary objects and secondary objects according to their distinct roles in shaping a scene. Based on this decomposition, we propose HetScene, a heterogeneous two-stage generation framework that decouples indoor layout synthesis into Structural Layout Generation (SLG) and Contextual Layout Generation (CLG). SLG first generates globally coherent structural layouts with only primary objects conditioned on text descriptions, top-down binary room masks, and spatial relation graphs, establishing a stable global macro-skeleton of large core furniture.",https://arxiv.org/pdf/2605.13586v1,,False
Mixed neural posterior estimation for simulators with discrete and continuous parameters,13/05/2026,"Jan Boelts, Cornelius Schröder, Jonas Beck, Jakob H. Macke, Michael Deistler, Daniel Gedon","Neural Posterior Estimation (NPE) enables rapid parameter inference for complex simulators with intractable likelihoods. NPE trains an inference network to estimate a probability density over parameters given data, typically assumed to be \emph{continuous}. However, many scientific models involve parameter spaces that are \emph{mixed}, that is, they contain both discrete and continuous dimensions. We address this limitation by extending NPE to mixed parameter spaces through an inference network that jointly handles discrete and continuous parameters. The inference network factorizes the joint posterior into discrete and continuous components, combining an autoregressive classifier for the discrete parameters with a generative model for the continuous parameters, trained jointly under a single simulation-based objective. In addition, we propose a diagnostic tool to assess the calibration of the mixed posterior approximation. Across tractable toy examples and real-world scientific simulators, our joint inference approach yields accurate and calibrated posteriors. The inference framework is available in the \texttt{sbi} Python package.",https://arxiv.org/pdf/2605.13551v1,,False
AttenA+: Rectifying Action Inequality in Robotic Foundation Models,13/05/2026,"Daojie Peng, Fulong Ma, Jiahang Cao, Qiang Zhang, Xupeng Xie, Jian Guo, Ping Luo, Andrew F. Luo, Boyu Zhou, Jun Ma","Existing robotic foundation models, while powerful, are predicated on an implicit assumption of temporal homogeneity: treating all actions as equally informative during optimization. This ""flat"" training paradigm, inherited from language modeling, remains indifferent to the underlying physical hierarchy of manipulation. In reality, robot trajectories are fundamentally heterogeneous, where low-velocity segments often dictate task success through precision-demanding interactions, while high-velocity motions serve as error-tolerant transitions. Such a misalignment between uniform loss weighting and physical criticality fundamentally limits the performance of current Vision-Language-Action (VLA) models and World-Action Models (WAM) in complex, long-horizon tasks. To rectify this, we introduce AttenA+, an architecture-agnostic framework that prioritizes kinematically critical segments via velocity-driven action attention. By reweighting the training objective based on the inverse velocity field, AttenA+ naturally aligns the model's learning capacity with the physical demands of manipulation. As a plug-and-play enhancement, AttenA+ can be integrated into existing backbones without structural modifications or additional parameters. Extensive experiments demonstrate that AttenA+ significantly elevates the ceilings of current state-of-the-art models. Specifically, it improves OpenVLA-OFT to 98.6% (+1.5%) on the Libero benchmark and pushes FastWAM to 92.4% (+0.6%) on RoboTwin 2.0. Real-world validation on a Franka manipulator further showcases its robustness and cross-task generalization. Our work suggests that mining the intrinsic structural priors of action sequences offers a highly efficient, physics-aware complement to standard scaling laws, paving a new path for general-purpose robotic control.",https://arxiv.org/pdf/2605.13548v1,,False
RealICU: Do LLM Agents Understand Long-Context ICU Data? A Benchmark Beyond Behavior Imitation,13/05/2026,"Chengzhi Shen, Weixiang Shen, Tobias Susetzky, Chen, Chen, Jun Li, Yuyuan Liu, Xuepeng Zhang, Zhenyu Gong, Daniel Rueckert, Jiazhen Pan","Intensive care units (ICU) generate long, dense and evolving streams of clinical information, where physicians must repeatedly reassess patient states under time pressure, underscoring a clear need for reliable AI decision support. Existing ICU benchmarks typically treat historical clinician actions as ground truth. However, these actions are made under incomplete information and limited temporal context of the underlying patient state, and may therefore be suboptimal, making it difficult to assess the true reasoning capabilities of AI systems. We introduce RealICU, a hindsight-annotated benchmark for evaluating large language models (LLMs) under realistic ICU conditions, where labels are created after senior physicians review the full patient trajectory. We formulate four physician-motivated tasks: assess Patient Status, Acute Problems, Recommended Actions, and Red Flag actions that risk unsafe outcomes. We partition each trajectory with 30-min windows and release two datasets: RealICU-Gold with 930-window annotations from 94 MIMIC-IV patients, and RealICU-Scale with 11,862 windows extended by Oracle, a physician-validated LLM hindsight labeler. Existing LLMs including memory-augmented ones performed poorly on RealICU, exposing two failure modes: a recall-safety tradeoff for clinical recommendations, and an anchoring bias to early interpretations of the patient. We further introduce ICU-Evo to study structured-memory agents that improves long-horizon reasoning but does not fully eliminate safety failures. Together, RealICU provides a clinically grounded testbed for measuring and improving AI sequential decision-support in high-stakes care. Project page: https://chengzhi-leo.github.io/RealICU-Bench/",https://arxiv.org/pdf/2605.13542v1,,False
Path-independent Flow Matching for Multi-parameter Generative Dynamics,13/05/2026,"Francisco Téllez, AmirHossein Zamani, Philippe Martin, Shuang Ni, Guy Wolf, Eugene Belilovsky, Sina Sanjari, Yanlei Zhang","Flow Matching is a powerful framework for learning transport maps between probability distributions. Yet its standard single-parameter formulation is not designed to capture multi-parameter variations where the resulting transport should be path-independent. Path independence is crucial because it ensures that transformations depend only on the initial and target distributions, not on the specific path. In this work, we introduce Path-independent Flow Matching (PiFM), a method for learning vector fields whose induced flows yield path-independent transport between distributions. We show that PiFM generalizes Flow Matching to higher-dimensional parameter domains while enforcing structural conditions that ensure consistency of composed transformations. In addition, we show that, under suitable assumptions, PiFM approximates the Wasserstein barycenter, linking the framework to a notion of distributional interpolation. To enable practical training, we propose a tractable, simulation-free objective that regresses onto multi-parameter conditional probability paths. We showcase empirically that PiFM outperforms other approaches on both synthetic and real world data in interpolating path-independent trajectories and generating desired out of distribution samples.",https://arxiv.org/pdf/2605.13487v1,,False
Cognifold: Always-On Proactive Memory via Cognitive Folding,13/05/2026,"Suli Wang, Yiqun Duan, Yu Deng, Rundong Zhao, Dai Shi, Xinliang Zhou","Existing agent memory remains predominantly reactive and retrieval-based, lacking the capacity to autonomously organize experience into persistent cognitive structure. Toward genuinely autonomous agents, we introduce Cognifold, a brain-inspired ""always-on"" agent memory designed for the next generation of proactive assistants. CogniFold continuously folds fragmented event streams into self-emerging cognitive structures, bootstrapping progressively higher-level cognition from incoming events and accumulated knowledge. We ground this by extending Complementary Learning Systems (CLS) theory from two layers (hippocampus, neocortex) to three, adding a prefrontal intent layer. Emulating the prefrontal cortex as the locus of intentional control and decision-making, CogniFold achieves this through graph-topology self-organization: cognitive structures proactively assemble under the stream, merge when semantically similar, decay when stale, relink through associative recall, and surface intents when concept-cluster density crosses a threshold. We evaluate structural formation using CogEval-Bench, demonstrating that CogniFold uniquely produces memory structures that match cognitive expectations and concept emergence. Furthermore, across 7 broad-coverage benchmarks spanning five cognitive domains, we validate that CogniFold simultaneously performs robustly on conventional memory benchmarks.",https://arxiv.org/pdf/2605.13438v1,,False
TRIAGE: Evaluating Prospective Metacognitive Control in LLMs under Resource Constraints,13/05/2026,"Zabir Al Nazi, Shubhashis Roy Dipta","Deploying language models as autonomous agents requires more than per-task accuracy: when an agent faces a queue of problems under a finite token budget, it must decide which to attempt, in what order, and how much compute to commit to each, all before any execution feedback is available. This is the prospective form of metacognitive control studied for decades in human cognition, yet whether language models possess it remains untested. We introduce TRIAGE, an evaluation framework in which a model receives a task pool and a token budget calibrated to its own baseline cost, and commits to a single ordered plan that jointly encodes selection, sequencing, and per-problem allocation. Plans are scored against an oracle with full knowledge of the model's solvability and cost on each problem, yielding a triage efficiency ratio on a common scale. We evaluate frontier and open-source models, with and without reasoning enabled, across competition mathematics, graduate-level science, code generation, and expert multidisciplinary knowledge, and find that current language models exhibit substantial gaps in prospective metacognitive control, revealing a previously unmeasured capability dimension with direct implications for resource-efficient agent deployment.",https://arxiv.org/pdf/2605.13414v1,,False
Phasor Memory Networks: Stable Backpropagation Through Time for Scalable Explicit Memory,13/05/2026,"Sungwoo Goo, Hwi-yeol Yun, Sangkeun Jung","For over a decade, explicit memory architectures like the Neural Turing Machine have remained theoretically appealing yet practically intractable for language modeling due to catastrophic gradient instability during Backpropagation Through Time. In this work, we break this stalemate with \textit{Phasor Memory Network} (PMNet), a novel architecture that structurally resolves memory volatility through \textit{Unitary Phasor Dynamics} and \textit{Hierarchical Learnable Anchors}. Rather than relying on brute-force scaling, we present a mechanistic proof-of-concept in a controlled byte-level setting. By constraining recurrent state updates to phase rotations on a complex unit circle, PMNet preserves gradient norms and inherently prevents divergence without the need for specialized initialization. We empirically demonstrate the active actuation of the memory module through a synthetic Copy-Paste task, where PMNet utilizes an expansive \textit{85-slot hierarchical memory tree} ($=\sum^{4}_{h=1}4^{h-1}$) to achieve near 100\% exact retrieval across temporal distances that completely exceed the local sliding window attention's receptive field. Furthermore, despite being a compact 119M parameter model trained on 18.8B tokens, PMNet matches the zero-shot long-context robustness of a Mamba model that is three times larger. Our ablation studies and gradient analyses confirm that the historical failure of explicit memory was a structural alignment problem, which PMNet effectively overcomes, providing a theoretically grounded foundation for scalable sequence modeling.",https://arxiv.org/pdf/2605.13370v1,,False
Speculative Interaction Agents: Building Real-Time Agents with Asynchronous I/O and Speculative Tool Calling,13/05/2026,"Coleman Hooper, Minwoo Kang, Suhong Moon, Nicholas Lee, Eric Wen, John Wawrzynek, Michael W. Mahoney, Yakun Sophia Shao, Amir Gholami, Kurt Keutzer","There is a growing demand for agentic AI technologies for a range of downstream applications like customer service and personal assistants. For applications where the agent needs to interact with a person, real-time low-latency responsiveness is required; for example, with voice-controlled applications, under 1 second of latency is typically required for the interaction to feel seamless. However, if we want the LLM to reason and execute an agentic workflow with tool calling, this can add several seconds or more of latency, which is prohibitive for real-time latency-sensitive applications. In our work, we propose Speculative Interaction Agents to enable real-time interaction even for agents with complex multi-turn tool calling. We propose Asynchronous I/O, which decouples the core agent reason-and-act thread from waiting for additional information from either the user or environment, thereby allowing for overlapping agentic processing while waiting on external delays. We also propose Speculative Tool Calling as a method to manage task execution when the agent is still unsure if it has received the full information or if additional user information may later be provided. For strong cloud models, our method can be applied out-of-the-box to existing real-time cloud APIs, providing 1.3-1.7$\times$ speedups with minor accuracy loss. To enable real-time interaction with small edge-scale models, we also present a clock-based training methodology that adapts the model to handle streaming inputs and asynchronous responses, and demonstrate a synthetic data generation strategy for SFT. Altogether, this approach provides 1.6-2.2$\times$ speedups with the Qwen2.5-3B-Instruct and Llama-3.2-3B-Instruct models across multiple tool calling benchmarks.",https://arxiv.org/pdf/2605.13360v2,,False
