Title,Publication Date,Author(s),Abstract,Link,DOI,Relevant
Physics-Driven Learning Framework for Tomographic Tactile Sensing,03/12/2025,"Xuanxuan Yang, Xiuyang Zhang, Haofeng Chen, Gang Ma, Xiaojie Wang","Electrical impedance tomography (EIT) provides an attractive solution for large-area tactile sensing due to its minimal wiring and shape flexibility, but its nonlinear inverse problem often leads to severe artifacts and inaccurate contact reconstruction. This work presents PhyDNN, a physics-driven deep reconstruction framework that embeds the EIT forward model directly into the learning objective. By jointly minimizing the discrepancy between predicted and ground-truth conductivity maps and enforcing consistency with the forward PDE, PhyDNN reduces the black-box nature of deep networks and improves both physical plausibility and generalization. To enable efficient backpropagation, we design a differentiable forward-operator network that accurately approximates the nonlinear EIT response, allowing fast physics-guided training. Extensive simulations and real tactile experiments on a 16-electrode soft sensor show that PhyDNN consistently outperforms NOSER, TV, and standard DNNs in reconstructing contact shape, location, and pressure distribution. PhyDNN yields fewer artifacts, sharper boundaries, and higher metric scores, demonstrating its effectiveness for high-quality tomographic tactile sensing.",https://arxiv.org/pdf/2512.03512v1,,False
Think Before You Drive: World Model-Inspired Multimodal Grounding for Autonomous Vehicles,03/12/2025,"Haicheng Liao, Huanming Shen, Bonan Wang, Yongkang Li, Yihong Tang, Chengyue Wang, Dingyi Zhuang, Kehua Chen, Hai Yang, Chengzhong Xu, Zhenning Li","Interpreting natural-language commands to localize target objects is critical for autonomous driving (AD). Existing visual grounding (VG) methods for autonomous vehicles (AVs) typically struggle with ambiguous, context-dependent instructions, as they lack reasoning over 3D spatial relations and anticipated scene evolution. Grounded in the principles of world models, we propose ThinkDeeper, a framework that reasons about future spatial states before making grounding decisions. At its core is a Spatial-Aware World Model (SA-WM) that learns to reason ahead by distilling the current scene into a command-aware latent state and rolling out a sequence of future latent states, providing forward-looking cues for disambiguation. Complementing this, a hypergraph-guided decoder then hierarchically fuses these states with the multimodal input, capturing higher-order spatial dependencies for robust localization. In addition, we present DrivePilot, a multi-source VG dataset in AD, featuring semantic annotations generated by a Retrieval-Augmented Generation (RAG) and Chain-of-Thought (CoT)-prompted LLM pipeline. Extensive evaluations on six benchmarks, ThinkDeeper ranks #1 on the Talk2Car leaderboard and surpasses state-of-the-art baselines on DrivePilot, MoCAD, and RefCOCO/+/g benchmarks. Notably, it shows strong robustness and efficiency in challenging scenes (long-text, multi-agent, ambiguity) and retains superior performance even when trained on 50% of the data.",https://arxiv.org/pdf/2512.03454v1,,False
GalaxyDiT: Efficient Video Generation with Guidance Alignment and Adaptive Proxy in Diffusion Transformers,03/12/2025,"Zhiye Song, Steve Dai, Ben Keller, Brucek Khailany","Diffusion models have revolutionized video generation, becoming essential tools in creative content generation and physical simulation. Transformer-based architectures (DiTs) and classifier-free guidance (CFG) are two cornerstones of this success, enabling strong prompt adherence and realistic video quality. Despite their versatility and superior performance, these models require intensive computation. Each video generation requires dozens of iterative steps, and CFG doubles the required compute. This inefficiency hinders broader adoption in downstream applications.
  We introduce GalaxyDiT, a training-free method to accelerate video generation with guidance alignment and systematic proxy selection for reuse metrics. Through rank-order correlation analysis, our technique identifies the optimal proxy for each video model, across model families and parameter scales, thereby ensuring optimal computational reuse. We achieve $1.87\times$ and $2.37\times$ speedup on Wan2.1-1.3B and Wan2.1-14B with only 0.97% and 0.72% drops on the VBench-2.0 benchmark. At high speedup rates, our approach maintains superior fidelity to the base model, exceeding prior state-of-the-art approaches by 5 to 10 dB in peak signal-to-noise ratio (PSNR).",https://arxiv.org/pdf/2512.03451v1,,False
World Models for Autonomous Navigation of Terrestrial Robots from LIDAR Observations,03/12/2025,"Raul Steinmetz, Fabio Demo Rosa, Victor Augusto Kich, Jair Augusto Bottega, Ricardo Bedin Grando, Daniel Fernando Tello Gamarra","Autonomous navigation of terrestrial robots using Reinforcement Learning (RL) from LIDAR observations remains challenging due to the high dimensionality of sensor data and the sample inefficiency of model-free approaches. Conventional policy networks struggle to process full-resolution LIDAR inputs, forcing prior works to rely on simplified observations that reduce spatial awareness and navigation robustness. This paper presents a novel model-based RL framework built on top of the DreamerV3 algorithm, integrating a Multi-Layer Perceptron Variational Autoencoder (MLP-VAE) within a world model to encode high-dimensional LIDAR readings into compact latent representations. These latent features, combined with a learned dynamics predictor, enable efficient imagination-based policy optimization. Experiments on simulated TurtleBot3 navigation tasks demonstrate that the proposed architecture achieves faster convergence and higher success rate compared to model-free baselines such as SAC, DDPG, and TD3. It is worth emphasizing that the DreamerV3-based agent attains a 100% success rate across all evaluated environments when using the full dataset of the Turtlebot3 LIDAR (360 readings), while model-free methods plateaued below 85%. These findings demonstrate that integrating predictive world models with learned latent representations enables more efficient and robust navigation from high-dimensional sensory data.",https://arxiv.org/pdf/2512.03429v1,,False
Better World Models Can Lead to Better Post-Training Performance,03/12/2025,"Prakhar Gupta, Henry Conklin, Sarah-Jane Leslie, Andrew Lee","In this work we study how explicit world-modeling objectives affect the internal representations and downstream capability of Transformers across different training stages. We use a controlled 2x2x2 Rubik's Cube and ask: (1) how does explicitly pretraining a world model affect the model's latent representations, and (2) how does world-model quality affect the model's performance after reinforcement learning post-training? We compare standard next-token prediction to two explicit world-modeling strategies -- (i) state-prediction pretraining and (ii) a joint state-prediction + next-token objective -- and assess task performance after Group Relative Policy Optimization (GRPO) is applied as post-training. We evaluate the representation quality with linear probes and causal interventions. We find that explicit world-modeling yields more linearly decodable and causally steerable state representations. More importantly, we find that improved state representations lead to higher gains for GRPO, especially on harder cube states. Our results indicate that sharpening state representations can improve the effectiveness of post-training for sequence-planning tasks.",https://arxiv.org/pdf/2512.03400v1,,False
FireSentry: A Multi-Modal Spatio-temporal Benchmark Dataset for Fine-Grained Wildfire Spread Forecasting,03/12/2025,"Nan Zhou, Huandong Wang, Jiahao Li, Han Li, Yali Song, Qiuhua Wang, Yong Li, Xinlei Chen","Fine-grained wildfire spread prediction is crucial for enhancing emergency response efficacy and decision-making precision. However, existing research predominantly focuses on coarse spatiotemporal scales and relies on low-resolution satellite data, capturing only macroscopic fire states while fundamentally constraining high-precision localized fire dynamics modeling capabilities. To bridge this gap, we present FireSentry, a provincial-scale multi-modal wildfire dataset characterized by sub-meter spatial and sub-second temporal resolution. Collected using synchronized UAV platforms, FireSentry provides visible and infrared video streams, in-situ environmental measurements, and manually validated fire masks. Building on FireSentry, we establish a comprehensive benchmark encompassing physics-based, data-driven, and generative models, revealing the limitations of existing mask-only approaches. Our analysis proposes FiReDiff, a novel dual-modality paradigm that first predicts future video sequences in the infrared modality, and then precisely segments fire masks in the mask modality based on the generated dynamics. FiReDiff achieves state-of-the-art performance, with video quality gains of 39.2% in PSNR, 36.1% in SSIM, 50.0% in LPIPS, 29.4% in FVD, and mask accuracy gains of 3.3% in AUPRC, 59.1% in F1 score, 42.9% in IoU, and 62.5% in MSE when applied to generative models. The FireSentry benchmark dataset and FiReDiff paradigm collectively advance fine-grained wildfire forecasting and dynamic disaster simulation. The processed benchmark dataset is publicly available at: https://github.com/Munan222/FireSentry-Benchmark-Dataset.",https://arxiv.org/pdf/2512.03369v1,,False
Breaking Determinism: Stochastic Modeling for Reliable Off-Policy Evaluation in Ad Auctions,03/12/2025,"Hongseon Yeom, Jaeyoul Shin, Soojin Min, Jeongmin Yoon, Seunghak Yu, Dongyeop Kang","Online A/B testing, the gold standard for evaluating new advertising policies, consumes substantial engineering resources and risks significant revenue loss from deploying underperforming variations. This motivates the use of Off-Policy Evaluation (OPE) for rapid, offline assessment. However, applying OPE to ad auctions is fundamentally more challenging than in domains like recommender systems, where stochastic policies are common. In online ad auctions, it is common for the highest-bidding ad to win the impression, resulting in a deterministic, winner-takes-all setting. This results in zero probability of exposure for non-winning ads, rendering standard OPE estimators inapplicable. We introduce the first principled framework for OPE in deterministic auctions by repurposing the bid landscape model to approximate the propensity score. This model allows us to derive robust approximate propensity scores, enabling the use of stable estimators like Self-Normalized Inverse Propensity Scoring (SNIPS) for counterfactual evaluation. We validate our approach on the AuctionNet simulation benchmark and against 2-weeks online A/B test from a large-scale industrial platform. Our method shows remarkable alignment with online results, achieving a 92\% Mean Directional Accuracy (MDA) in CTR prediction, significantly outperforming the parametric baseline. MDA is the most critical metric for guiding deployment decisions, as it reflects the ability to correctly predict whether a new model will improve or harm performance. This work contributes the first practical and validated framework for reliable OPE in deterministic auction environments, offering an efficient alternative to costly and risky online experiments.",https://arxiv.org/pdf/2512.03354v1,,False
Step-by-step Layered Design Generation,03/12/2025,"Faizan Farooq Khan, K J Joseph, Koustava Goswami, Mohamed Elhoseiny, Balaji Vasan Srinivasan","Design generation, in its essence, is a step-by-step process where designers progressively refine and enhance their work through careful modifications. Despite this fundamental characteristic, existing approaches mainly treat design synthesis as a single-step generation problem, significantly underestimating the inherent complexity of the creative process. To bridge this gap, we propose a novel problem setting called Step-by-Step Layered Design Generation, which tasks a machine learning model with generating a design that adheres to a sequence of instructions from a designer. Leveraging recent advancements in multi-modal LLMs, we propose SLEDGE: Step-by-step LayEred Design GEnerator to model each update to a design as an atomic, layered change over its previous state, while being grounded in the instruction. To complement our new problem setting, we introduce a new evaluation suite, including a dataset and a benchmark. Our exhaustive experimental analysis and comparison with state-of-the-art approaches tailored to our new setup demonstrate the efficacy of our approach. We hope our work will attract attention to this pragmatic and under-explored research area.",https://arxiv.org/pdf/2512.03335v1,,False
When does Gaussian equivalence fail and how to fix it: Non-universal behavior of random features with quadratic scaling,03/12/2025,"Garrett G. Wen, Hong Hu, Yue M. Lu, Zhou Fan, Theodor Misiakiewicz","A major effort in modern high-dimensional statistics has been devoted to the analysis of linear predictors trained on nonlinear feature embeddings via empirical risk minimization (ERM). Gaussian equivalence theory (GET) has emerged as a powerful universality principle in this context: it states that the behavior of high-dimensional, complex features can be captured by Gaussian surrogates, which are more amenable to analysis. Despite its remarkable successes, numerical experiments show that this equivalence can fail even for simple embeddings -- such as polynomial maps -- under general scaling regimes.
  We investigate this breakdown in the setting of random feature (RF) models in the quadratic scaling regime, where both the number of features and the sample size grow quadratically with the data dimension. We show that when the target function depends on a low-dimensional projection of the data, such as generalized linear models, GET yields incorrect predictions. To capture the correct asymptotics, we introduce a Conditional Gaussian Equivalent (CGE) model, which can be viewed as appending a low-dimensional non-Gaussian component to an otherwise high-dimensional Gaussian model. This hybrid model retains the tractability of the Gaussian framework and accurately describes RF models in the quadratic scaling regime. We derive sharp asymptotics for the training and test errors in this setting, which continue to agree with numerical simulations even when GET fails.
  Our analysis combines general results on CLT for Wiener chaos expansions and a careful two-phase Lindeberg swapping argument. Beyond RF models and quadratic scaling, our work hints at a rich landscape of universality phenomena in high-dimensional ERM.",https://arxiv.org/pdf/2512.03325v1,,False
Evaluating Generalization Capabilities of LLM-Based Agents in Mixed-Motive Scenarios Using Concordia,03/12/2025,"Chandler Smith, Marwa Abdulhai, Manfred Diaz, Marko Tesic, Rakshit S. Trivedi, Alexander Sasha Vezhnevets, Lewis Hammond, Jesse Clifton, Minsuk Chang, Edgar A. Duéñez-Guzmán, John P. Agapiou, Jayd Matyas, Danny Karmon, Akash Kundu, Aliaksei Korshuk, Ananya Ananya, Arrasy Rahman, Avinaash Anand Kulandaivel, Bain McHale, Beining Zhang, Buyantuev Alexander, Carlos Saith Rodriguez Rojas, Caroline Wang, Chetan Talele, Chenao Liu, Chichen Lin, Diana Riazi, Di Yang Shi, Emanuel Tewolde, Elizaveta Tennant, Fangwei Zhong, Fuyang Cui, Gang Zhao, Gema Parreño Piqueras, Hyeonggeun Yun, Ilya Makarov, Jiaxun Cui, Jebish Purbey, Jim Dilkes, Jord Nguyen, Lingyun Xiao, Luis Felipe Giraldo, Manuela Chacon-Chamorro, Manuel Sebastian Rios Beltran, Marta Emili García Segura, Mengmeng Wang, Mogtaba Alim, Nicanor Quijano, Nico Schiavone, Olivia Macmillan-Scott, Oswaldo Peña, Peter Stone, Ram Mohan Rao Kadiyala, Rolando Fernandez, Ruben Manrique, Sunjia Lu, Sheila A. McIlraith, Shamika Dhuri, Shuqing Shi, Siddhant Gupta, Sneheel Sarangi, Sriram Ganapathi Subramanian, Taehun Cha, Toryn Q. Klassen, Wenming Tu, Weijian Fan, Wu Ruiyang, Xue Feng, Yali Du, Yang Liu, Yiding Wang, Yipeng Kang, Yoonchang Sung, Yuxuan Chen, Zhaowei Zhang, Zhihan Wang, Zhiqiang Wu, Ziang Chen, Zilong Zheng, Zixia Jia, Ziyan Wang, Dylan Hadfield-Menell, Natasha Jaques, Tim Baarslag, Jose Hernandez-Orallo, Joel Z. Leibo","Large Language Model (LLM) agents have demonstrated impressive capabilities for social interaction and are increasingly being deployed in situations where they might engage with both human and artificial agents. These interactions represent a critical frontier for LLM-based agents, yet existing evaluation methods fail to measure how well these capabilities generalize to novel social situations. In this paper, we introduce a method for evaluating the ability of LLM-based agents to cooperate in zero-shot, mixed-motive environments using Concordia, a natural language multi-agent simulation environment. Our method measures general cooperative intelligence by testing an agent's ability to identify and exploit opportunities for mutual gain across diverse partners and contexts. We present empirical results from the NeurIPS 2024 Concordia Contest, where agents were evaluated on their ability to achieve mutual gains across a suite of diverse scenarios ranging from negotiation to collective action problems. Our findings reveal significant gaps between current agent capabilities and the robust generalization required for reliable cooperation, particularly in scenarios demanding persuasion and norm enforcement.",https://arxiv.org/pdf/2512.03318v1,,False
