Title,Publication Date,Author(s),Abstract,Link,DOI,Relevant
Negative Dependence as a toolbox for machine learning : review and new developments,11/02/2025,"Hoang-Son Tran, Vladimir Petrovic, Remi Bardenet, Subhroshekhar Ghosh","Negative dependence is becoming a key driver in advancing learning
capabilities beyond the limits of traditional independence. Recent developments
have evidenced support towards negatively dependent systems as a learning
paradigm in a broad range of fundamental machine learning challenges including
optimization, sampling, dimensionality reduction and sparse signal recovery,
often surpassing the performance of current methods based on statistical
independence. The most popular negatively dependent model has been that of
determinantal point processes (DPPs), which have their origins in quantum
theory. However, other models, such as perturbed lattice models, strongly
Rayleigh measures, zeros of random functions have gained salience in various
learning applications. In this article, we review this burgeoning field of
research, as it has developed over the past two decades or so. We also present
new results on applications of DPPs to the parsimonious representation of
neural networks. In the limited scope of the article, we mostly focus on
aspects of this area to which the authors contributed over the recent years,
including applications to Monte Carlo methods, coresets and stochastic gradient
descent, stochastic networks, signal processing and connections to quantum
computation. However, starting from basics of negative dependence for the
uninitiated reader, extensive references are provided to a broad swath of
related developments which could not be covered within our limited scope. While
existing works and reviews generally focus on specific negatively dependent
models (e.g. DPPs), a notable feature of this article is that it addresses
negative dependence as a machine learning methodology as a whole. In this vein,
it covers within its span an array of negatively dependent models and their
applications well beyond DPPs, thereby putting forward a very general and
rather unique perspective.",http://arxiv.org/pdf/2502.07285v1,,False
NARCE: A Mamba-Based Neural Algorithmic Reasoner Framework for Online Complex Event Detection,11/02/2025,"Liying Han, Gaofeng Dong, Xiaomin Ouyang, Lance Kaplan, Federico Cerutti, Mani Srivastava","Current machine learning models excel in short-span perception tasks but
struggle to derive high-level insights from long-term observation, a capability
central to understanding complex events (CEs). CEs, defined as sequences of
short-term atomic events (AEs) governed by spatiotemporal rules, are
challenging to detect online due to the need to extract meaningful patterns
from long and noisy sensor data while ignoring irrelevant events. We
hypothesize that state-based methods are well-suited for CE detection, as they
capture event progression through state transitions without requiring long-term
memory. Baseline experiments validate this, demonstrating that the state-space
model Mamba outperforms existing architectures. However, Mamba's reliance on
extensive labeled data, which are difficult to obtain, motivates our second
hypothesis: decoupling CE rule learning from noisy sensor data can reduce data
requirements. To address this, we propose NARCE, a framework that combines
Neural Algorithmic Reasoning (NAR) to split the task into two components: (i)
learning CE rules independently of sensor data using synthetic concept traces
generated by LLMs and (ii) mapping sensor inputs to these rules via an adapter.
Our results show that NARCE outperforms baselines in accuracy, generalization
to unseen and longer sensor data, and data efficiency, significantly reducing
annotation costs while advancing robust CE detection.",http://arxiv.org/pdf/2502.07250v1,,False
Linear Transformers as VAR Models: Aligning Autoregressive Attention Mechanisms with Autoregressive Forecasting,11/02/2025,"Jiecheng Lu, Shihao Yang","Autoregressive attention-based time series forecasting (TSF) has drawn
increasing interest, with mechanisms like linear attention sometimes
outperforming vanilla attention. However, deeper Transformer architectures
frequently misalign with autoregressive objectives, obscuring the underlying
VAR structure embedded within linear attention and hindering their ability to
capture the data generative processes in TSF. In this work, we first show that
a single linear attention layer can be interpreted as a dynamic vector
autoregressive (VAR) structure. We then explain that existing multi-layer
Transformers have structural mismatches with the autoregressive forecasting
objective, which impair interpretability and generalization ability. To address
this, we show that by rearranging the MLP, attention, and input-output flow,
multi-layer linear attention can also be aligned as a VAR model. Then, we
propose Structural Aligned Mixture of VAR (SAMoVAR), a linear Transformer
variant that integrates interpretable dynamic VAR weights for multivariate TSF.
By aligning the Transformer architecture with autoregressive objectives,
SAMoVAR delivers improved performance, interpretability, and computational
efficiency, comparing to SOTA TSF models.",http://arxiv.org/pdf/2502.07244v1,,False
Contextual Gesture: Co-Speech Gesture Video Generation through Context-aware Gesture Representation,11/02/2025,"Pinxin Liu, Pengfei Zhang, Hyeongwoo Kim, Pablo Garrido, Ari Sharpio, Kyle Olszewski","Co-speech gesture generation is crucial for creating lifelike avatars and
enhancing human-computer interactions by synchronizing gestures with speech.
Despite recent advancements, existing methods struggle with accurately
identifying the rhythmic or semantic triggers from audio for generating
contextualized gesture patterns and achieving pixel-level realism. To address
these challenges, we introduce Contextual Gesture, a framework that improves
co-speech gesture video generation through three innovative components: (1) a
chronological speech-gesture alignment that temporally connects two modalities,
(2) a contextualized gesture tokenization that incorporate speech context into
motion pattern representation through distillation, and (3) a structure-aware
refinement module that employs edge connection to link gesture keypoints to
improve video generation. Our extensive experiments demonstrate that Contextual
Gesture not only produces realistic and speech-aligned gesture videos but also
supports long-sequence generation and video gesture editing applications, shown
in Fig.1 Project Page: https://andypinxinliu.github.io/Contextual-Gesture/.",http://arxiv.org/pdf/2502.07239v1,,False
Does Training on Synthetic Data Make Models Less Robust?,11/02/2025,"Lingze Zhang, Ellie Pavlick","An increasingly common practice is to train large language models (LLMs)
using synthetic data. Often this synthetic data is produced by the same or
similar LLMs as those it is being used to train. This raises the question of
whether the synthetic data might in fact exacerbate certain ""blindspots"" by
reinforcing heuristics that the LLM already encodes. In this paper, we conduct
simulated experiments on the natural language inference (NLI) task with
Llama-2-7B-hf models. We use MultiNLI as the general task and HANS, a targeted
evaluation set designed to measure the presence of specific heuristic
strategies for NLI, as our ""blindspot"" task. Our goal is to determine whether
performance disparities between the general and blind spot tasks emerge. Our
results indicate that synthetic data does not reinforce blindspots in the way
we expected. Specifically, we see that, while fine-tuning with synthetic data
doesn't necessarily reduce the use of the heuristic, it also does not make it
worse as we hypothesized.",http://arxiv.org/pdf/2502.07164v1,,False
Language-TPP: Integrating Temporal Point Processes with Language Models for Event Analysis,11/02/2025,"Quyu Kong, Yixuan Zhang, Yang Liu, Panrong Tong, Enqi Liu, Feng Zhou","Temporal Point Processes (TPPs) have been widely used for event sequence
modeling, but they often struggle to incorporate rich textual event
descriptions effectively. Conversely, while Large Language Models (LLMs) have
been shown remarkable capabilities in processing textual data, they lack
mechanisms for handling temporal dynamics. To bridge this gap, we introduce
Language-TPP, a unified framework that integrates TPPs with LLMs for enhanced
event sequence modeling. Language-TPP introduces a novel temporal encoding
mechanism that converts continuous time intervals into specialized byte-tokens,
enabling seamless integration with standard LLM architectures. This approach
allows Language-TPP to achieve state-of-the-art performance across multiple TPP
tasks, including event time prediction, type prediction, and intensity
estimation, on five datasets. Additionally, we demonstrate that incorporating
temporal information significantly improves the quality of generated event
descriptions.",http://arxiv.org/pdf/2502.07139v1,,False
