Title,Publication Date,Author(s),Abstract,Link,DOI,Relevant
Expectation Error Bounds for Transfer Learning in Linear Regression and Linear Neural Networks,30/03/2026,"Meitong Liu, Christopher Jung, Rui Li, Xue Feng, Han Zhao","In transfer learning, the learner leverages auxiliary data to improve generalization on a main task. However, the precise theoretical understanding of when and how auxiliary data help remains incomplete. We provide new insights on this issue in two canonical linear settings: ordinary least squares regression and under-parameterized linear neural networks. For linear regression, we derive exact closed-form expressions for the expected generalization error with bias-variance decomposition, yielding necessary and sufficient conditions for auxiliary tasks to improve generalization on the main task. We also derive globally optimal task weights as outputs of solvable optimization programs, with consistency guarantees for empirical estimates. For linear neural networks with shared representations of width $q \leq K$, where $K$ is the number of auxiliary tasks, we derive a non-asymptotic expectation bound on the generalization error, yielding the first non-vacuous sufficient condition for beneficial auxiliary learning in this setting, as well as principled directions for task weight curation. We achieve this by proving a new column-wise low-rank perturbation bound for random matrices, which improves upon existing bounds by preserving fine-grained column structures. Our results are verified on synthetic data simulated with controlled parameters.",https://arxiv.org/pdf/2603.28739v1,,False
Fine-Tuning Large Language Models for Cooperative Tactical Deconfliction of Small Unmanned Aerial Systems,30/03/2026,"Iman Sharifi, Alex Zongo, Peng Wei","The growing deployment of small Unmanned Aerial Systems (sUASs) in low-altitude airspaces has increased the need for reliable tactical deconfliction under safety-critical constraints. Tactical deconfliction involves short-horizon decision-making in dense, partially observable, and heterogeneous multi-agent environments, where both cooperative separation assurance and operational efficiency must be maintained. While Large Language Models (LLMs) exhibit strong reasoning capabilities, their direct application to air traffic control remains limited by insufficient domain grounding and unpredictable output inconsistency. This paper investigates LLMs as decision-makers in cooperative multi-agent tactical deconfliction using fine-tuning strategies that align model outputs to human operator heuristics. We propose a simulation-to-language data generation pipeline based on the BlueSky air traffic simulator that produces rule-consistent deconfliction datasets reflecting established safety practices. A pretrained Qwen-Math-7B model is fine-tuned using two parameter-efficient strategies: supervised fine-tuning with Low-Rank Adaptation (LoRA) and preference-based fine-tuning combining LoRA with Group-Relative Policy Optimization (GRPO). Experimental results on validation datasets and closed-loop simulations demonstrate that supervised LoRA fine-tuning substantially improves decision accuracy, consistency, and separation performance compared to the pretrained LLM, with significant reductions in near mid-air collisions. GRPO provides additional coordination benefits but exhibits reduced robustness when interacting with heterogeneous agent policies.",https://arxiv.org/pdf/2603.28561v1,,False
Multimodal Analytics of Cybersecurity Crisis Preparation Exercises: What Predicts Success?,30/03/2026,"Conrad Borchers, Valdemar Švábenský, Sandesh K. Kafle, Kevin K. Tang, Jan Vykopal","Instructional alignment, the match between intended cognition and enacted activity, is central to effective instruction but hard to operationalize at scale. We examine alignment in cybersecurity simulations using multimodal traces from 23 teams (76 students) across five exercise sessions. Study 1 codes objectives and team emails with Bloom's taxonomy and models the completion of key exercise tasks with generalized linear mixed models. Alignment, defined as the discrepancy between required and enacted Bloom levels, predicts success, whereas the Bloom category alone does not predict success once discrepancy is considered. Study 2 compares predictive feature families using grouped cross-validation and l1-regularized logistic regression. Text embeddings and log features outperform Bloom-only models (AUC~0.74 and 0.71 vs. 0.55), and their combination performs best (Test AUC~0.80), with Bloom frequencies adding little. Overall, the work offers a measure of alignment for simulations and shows that multimodal traces best forecast performance, while alignment provides interpretable diagnostic insight.",https://arxiv.org/pdf/2603.28553v1,,False
AceleradorSNN: A Neuromorphic Cognitive System Integrating Spiking Neural Networks and DynamicImage Signal Processing on FPGA,30/03/2026,"Daniel Gutierrez, Ruben Martinez, Leyre Arnedo, Antonio Cuesta, Soukaina El Hamry","The demand for high-speed, low-latency, and energy-efficient object detection in autonomous systems -- such as advanced driver-assistance systems (ADAS), unmanned aerial vehicles (UAVs), and Industry 4.0 robotics -- has exposed the limitations of traditional Convolutional Neural Networks (CNNs). To address these challenges, we have developed AceleradorSNN, a third-generation artificial intelligence cognitive system. This architecture integrates a Neuromorphic Processing Unit (NPU) based on Spiking Neural Networks (SNNs) to process asynchronous data from Dynamic Vision Sensors (DVS), alongside a dynamically reconfigurable Cognitive Image Signal Processor (ISP) for RGB cameras. This paper details the hardware-oriented design of both IP cores, the evaluation of surrogate-gradienttrained SNN backbones, and the real-time streaming ISP architecture implemented on Field-Programmable Gate Arrays (FPGA).",https://arxiv.org/pdf/2603.28429v1,,False
Profile Graphical Models,30/03/2026,"Alejandra Avalos-Pacheco, Monia Lupparelli, Francesco C. Stingo","We introduce a novel class of graphical models, termed profile graphical models, that represent, within a single graph, how an external factor influences the dependence structure of a multivariate set of variables. This class is quite general and includes multiple graphs and chain graphs as special cases. Profile graphical models capture the conditional distributions of a multivariate random vector given different levels of a risk factor, and learn how the conditional independence structure among variables may vary across these risk profiles; we formally define this family of models and establish their corresponding Markov properties. We derive key structural and probabilistic properties that underpin a more powerful inferential framework than existing approaches, underscoring that our contribution extends beyond a novel graphical representation.Furthermore, we show that the resulting profile undirected graphical models are independence-compatible with two-block LWF chain graph models.We then develop a Bayesian approach for Gaussian undirected profile graphical models based on continuous spike-and-slab priors to learn shared sparsity structures across different levels of the risk factor. We also design a fast EM algorithm for efficient inference. Inferential properties are explored through simulation studies, including the comparison with competing methods. The practical utility of this class of models is demonstrated through the analysis of protein network data from various subtypes of acute myeloid leukemia. Our results show a more parsimonious network and greater patient heterogeneity than its competitors, highlighting its enhanced ability to capture subject-specific differences.",https://arxiv.org/pdf/2603.28423v1,,False
LDDMM stochastic interpolants: an application to domain uncertainty quantification in hemodynamics,30/03/2026,"Sarah Katz, Francesco Romor, Jia-Jie Zhu, Alfonso Caiazzo","We introduce a novel conditional stochastic interpolant framework for generative modeling of three-dimensional shapes. The method builds on a recent LDDMM-based registration approach to learn the conditional drift between geometries. By leveraging the resulting pull-back and push-forward operators, we extend this formulation beyond standard Cartesian grids to complex shapes and random variables defined on distinct domains. We present an application in the context of cardiovascular simulations, where aortic shapes are generated from an initial cohort of patients. The conditioning variable is a latent geometric representation defined by a set of centerline points and the radii of the corresponding inscribed spheres. This methodology facilitates both data augmentation for three-dimensional biomedical shapes, and the generation of random perturbations of controlled magnitude for a given shape. These capabilities are essential for quantifying the impact of domain uncertainties arising from medical image segmentation on the estimation of relevant biomarkers.",https://arxiv.org/pdf/2603.28324v1,,False
MR-ImagenTime: Multi-Resolution Time Series Generation through Dual Image Representations,30/03/2026,"Xianyong Xu, Yuanjun Zuo, Zhihong Huang, Yihan Qin, Haoxian Xu, Leilei Du, Haotian Wang","Time series forecasting is vital across many domains, yet existing models struggle with fixed-length inputs and inadequate multi-scale modeling. We propose MR-CDM, a framework combining hierarchical multi-resolution trend decomposition, an adaptive embedding mechanism for variable-length inputs, and a multi-scale conditional diffusion process. Evaluations on four real-world datasets demonstrate that MR-CDM significantly outperforms state-of-the-art baselines (e.g., CSDI, Informer), reducing MAE and RMSE by approximately 6-10 to a certain degree.",https://arxiv.org/pdf/2603.28253v1,,False
An Optimal Battery-Free Approach for Emission Reduction by Storing Solar Surplus in Building Thermal Mass,30/03/2026,"Michela Boffi, Jessica Leoni, Fabrizio Leonforte, Mara Tanelli, Paolo Oliaro","Decarbonization in buildings calls for advanced control strategies that coordinate on-site renewables, grid electricity, and thermal demand. Literature approaches typically rely on demand side management strategies or on active energy storage, like batteries. However, the first solution often neglects carbon-aware objectives, and could lead to grid overload issues, while batteries entail environmental, end-of-life, and cost concerns. To overcome these limitations, we propose an optimal, carbon-aware optimization strategy that exploits the building's thermal mass as a passive storage, avoiding dedicated batteries. Specifically, when a surplus of renewable energy is available, our strategy computes the optimal share of surplus to store by temporarily adjusting the indoor temperature setpoint within comfort bounds. Thus, by explicitly accounting for forecasts of building energy consumption, solar production, and time-varying grid carbon intensity, our strategy enables emissions-aware load shifting while maintaining comfort. We evaluate the approach by simulating three TRNSYS models of the same system with different thermal mass. In all cases, the results show consistent reductions in grid electricity consumption with respect to a baseline that does not leverage surplus renewable generation. These findings highlight the potential of thermal-mass-based control for building decarbonization.",https://arxiv.org/pdf/2603.28217v1,,False
ERPO: Token-Level Entropy-Regulated Policy Optimization for Large Reasoning Models,30/03/2026,"Song Yu, Li Li","Reinforcement learning from verifiable rewards (RLVR) has significantly advanced the reasoning capabilities of large language models. However, standard Group Relative Policy Optimization (GRPO) typically assigns a uniform, sequence-level advantage to all tokens, thereby overlooking the intrinsic information heterogeneity along reasoning chains. We show that this coarse-grained credit assignment leads to premature entropy collapse and encourages the model to generate redundant, low-quality reasoning paths. Through systematic empirical analysis, we identify Critical Decision Pivots (CDPs): transient high-entropy states where the policy's trajectory is most sensitive to perturbations. These pivots represent the ""forks in the road"" where effective multi-path exploration is most crucial yet often suppressed by uniform advantage signals. Building on these insights, we propose Entropy-Regulated Policy Optimization (ERPO), which transitions the optimization focus from coarse sequences to fine-grained token dynamics. ERPO introduces three synergistic components: (i) Entropy-aware Gating, which adaptively amplifies exploration at CDPs to facilitate diverse path discovery; (ii) Bucket-based Implicit Normalization, which mitigates difficulty bias by aligning token progress windows; and (iii) Result-anchored Advantage Synthesis, which re-weights token-level signals via outcome-driven anchors. Extensive experiments on competitive mathematical benchmarks (e.g., MATH, AIME) demonstrate that ERPO significantly outperforms GRPO. Notably, ERPO not only boosts reasoning accuracy but also yields significantly more concise and robust derivation paths, establishing a new efficiency-accuracy frontier for large reasoning models.",https://arxiv.org/pdf/2603.28204v1,,False
Differentiable Power-Flow Optimization,30/03/2026,"Muhammed Öz, Jasmin Hörter, Kaleb Phipps, Charlotte Debus, Achim Streit, Markus Götz","With the rise of renewable energy sources and their high variability in generation, the management of power grids becomes increasingly complex and computationally demanding. Conventional AC-power-flow simulations, which use the Newton-Raphson (NR) method, suffer from poor scalability, making them impractical for emerging use cases such as joint transmission-distribution modeling and global grid analysis. At the same time, purely data-driven surrogate models lack physical guarantees and may violate fundamental constraints. In this work, we propose Differentiable Power-Flow (DPF), a reformulation of the AC power-flow problem as a differentiable simulation. DPF enables end-to-end gradient propagation from the physical power mismatches to the underlying simulation parameters, thereby allowing these parameters to be identified efficiently using gradient-based optimization. We demonstrate that DPF provides a scalable alternative to NR by leveraging GPU acceleration, sparse tensor representations, and batching capabilities available in modern machine-learning frameworks such as PyTorch. DPF is especially suited as a tool for time-series analyses due to its efficient reuse of previous solutions, for N-1 contingency-analyses due to its ability to process cases in batches, and as a screening tool by leveraging its speed and early stopping capability. The code is available in the authors' code repository.",https://arxiv.org/pdf/2603.28203v1,,False
Koopman-based surrogate modeling for reinforcement-learning-control of Rayleigh-Benard convection,30/03/2026,"Tim Plotzki, Sebastian Peitz","Training reinforcement learning (RL) agents to control fluid dynamics systems is computationally expensive due to the high cost of direct numerical simulations (DNS) of the governing equations. Surrogate models offer a promising alternative by approximating the dynamics at a fraction of the computational cost, but their feasibility as training environments for RL is limited by distribution shifts, as policies induce state distributions not covered by the surrogate training data. In this work, we investigate the use of Linear Recurrent Autoencoder Networks (LRANs) for accelerating RL-based control of 2D Rayleigh-Bénard convection. We evaluate two training strategies: a surrogate trained on precomputed data generated with random actions, and a policy-aware surrogate trained iteratively using data collected from an evolving policy. Our results show that while surrogate-only training leads to reduced control performance, combining surrogates with DNS in a pretraining scheme recovers state-of-the-art performance while reducing training time by more than 40%. We demonstrate that policy-aware training mitigates the effects of distribution shift, enabling more accurate predictions in policy-relevant regions of the state space.",https://arxiv.org/pdf/2603.28074v1,,False
Synonymix: Unified Group Personas for Generative Simulations,30/03/2026,"Huanxing Chen, Aditesh Kumar","Generative agent simulations operate at two scales: individual personas for character interaction, and population models for collective behavior analysis and intervention testing. We propose a third scale: meso-level simulation - interaction with group-level representations that retain grounding in rich individual experience. To enable this, we present Synonymix, a pipeline that constructs a ""unigraph"" from multiple life story personas via graph-based abstraction and merging, producing a queryable collective representation that can be explored for sensemaking or sampled for synthetic persona generation. Evaluating synthetic agents on General Social Survey items, we demonstrate behavioral signal preservation beyond demographic baselines (p<0.001, r=0.59) with demonstrable privacy guarantee (max source contribution <13%). We invite discussion on interaction modalities enabled by meso-level simulations, and whether ""high-fidelity"" personas can ever capture the texture of lived experience.",https://arxiv.org/pdf/2603.28066v1,,False
Efficient Domain Adaptation for Text Line Recognition via Decoupled Language Models,30/03/2026,"Arundhathi Dev, Justin Zhan","Optical character recognition remains critical infrastructure for document digitization, yet state-of-the-art performance is often restricted to well-resourced institutions by prohibitive computational barriers. End-to-end transformer architectures achieve strong accuracy but demand hundreds of GPU hours for domain adaptation, limiting accessibility for practitioners and digital humanities scholars. We present a modular detection-and-correction framework that achieves near-SOTA accuracy with single-GPU training. Our approach decouples lightweight visual character detection (domain-agnostic) from domain-specific linguistic correction using pretrained sequence models including T5, ByT5, and BART. By training the correctors entirely on synthetic noise, we enable annotation-free domain adaptation without requiring labeled target images. Evaluating across modern clean handwriting, cursive script, and historical documents, we identify a critical ""Pareto frontier"" in architecture selection: T5-Base excels on modern text with standard vocabulary, whereas ByT5-Base dominates on historical documents by reconstructing archaic spellings at the byte level. Our results demonstrate that this decoupled paradigm matches end-to-end transformer accuracy while reducing compute by approximately 95%, establishing a viable, resource-efficient alternative to monolithic OCR architectures.",https://arxiv.org/pdf/2603.28028v1,,False
HeteroHub: An Applicable Data Management Framework for Heterogeneous Multi-Embodied Agent System,30/03/2026,"Xujia Li, Xin Li, Junquan Huang, Beirong Cui, Zibin Wu, Lei Chen","Heterogeneous Multi-Embodied Agent Systems involve coordinating multiple embodied agents with diverse capabilities to accomplish tasks in dynamic environments. This process requires the collection, generation, and consumption of massive, heterogeneous data, which primarily falls into three categories: static knowledge regarding the agents, tasks, and environments; multimodal training datasets tailored for various AI models; and high-frequency sensor streams. However, existing frameworks lack a unified data management infrastructure to support the real-world deployment of such systems. To address this gap, we present \textbf{HeteroHub}, a data-centric framework that integrates static metadata, task-aligned training corpora, and real-time data streams. The framework supports task-aware model training, context-sensitive execution, and closed-loop control driven by real-world feedback. In our demonstration, HeteroHub successfully coordinates multiple embodied AI agents to execute complex tasks, illustrating how a robust data management framework can enable scalable, maintainable, and evolvable embodied AI systems.",https://arxiv.org/pdf/2603.28010v1,,False
Scaling Atomistic Protein Binder Design with Generative Pretraining and Test-Time Compute,30/03/2026,"Kieran Didi, Zuobai Zhang, Guoqing Zhou, Danny Reidenbach, Zhonglin Cao, Sooyoung Cha, Tomas Geffner, Christian Dallago, Jian Tang, Michael M. Bronstein, Martin Steinegger, Emine Kucukbenli, Arash Vahdat, Karsten Kreis","Protein interaction modeling is central to protein design, which has been transformed by machine learning with applications in drug discovery and beyond. In this landscape, structure-based de novo binder design is cast as either conditional generative modeling or sequence optimization via structure predictors (""hallucination""). We argue that this is a false dichotomy and propose Proteina-Complexa, a novel fully atomistic binder generation method unifying both paradigms. We extend recent flow-based latent protein generation architectures and leverage the domain-domain interactions of monomeric computationally predicted protein structures to construct Teddymer, a new large-scale dataset of synthetic binder-target pairs for pretraining. Combined with high-quality experimental multimers, this enables training a strong base model. We then perform inference-time optimization with this generative prior, unifying the strengths of previously distinct generative and hallucination methods. Proteina-Complexa sets a new state of the art in computational binder design benchmarks: it delivers markedly higher in-silico success rates than existing generative approaches, and our novel test-time optimization strategies greatly outperform previous hallucination methods under normalized compute budgets. We also demonstrate interface hydrogen bond optimization, fold class-guided binder generation, and extensions to small molecule targets and enzyme design tasks, again surpassing prior methods. Code, models and new data will be publicly released.",https://arxiv.org/pdf/2603.27950v1,,False
