Title,Publication Date,Author(s),Abstract,Link,DOI,Relevant
Disentangling Continuous-Time Latent Dynamics: Identifiability of Latent SDEs via Diffusion Shifts,26/06/2026,"Yuanyuan Wang, Wenjie Wang, Haoxuan Li, Mingming Gong, Kun Zhang","Causal representation learning for time series has developed strong identifiability results in discrete-time latent causal models, but identifiability in continuous-time latent stochastic differential equation (SDE) models remains largely open. We address this gap using environment-induced shifts in diffusion covariance. We study additive-noise latent SDEs observed through an unknown nonlinear diffeomorphism, with shared drift but environment-specific diffusion covariance. We show that two diagonal diffusion regimes with pairwise distinct coordinate-wise variance ratios identify the latent coordinates up to permutation and scaling, without any sparsity assumption on the drift. We first prove this result for linear Ornstein--Uhlenbeck systems and then extend it to general additive-noise latent SDEs. Under mild smoothness, the instantaneous drift-Jacobian causal graph is identifiable up to the same permutation. We propose a two-stage estimator for latent disentanglement and optional graph recovery; experiments on synthetic systems confirm the predicted identifiability boundary, and an application to Hardanger Bridge monitoring data illustrates the approach on real sensor trajectories.",https://arxiv.org/pdf/2606.28228v1,,False
Exposure Bias Can Alleviate Itself via Directional and Frequency Rectification in Flow Matching,26/06/2026,"Guanbo Huang, Jingjia Mao, Fanding Huang, Fengkai Liu, Xiangyang Luo, Yaoyuan Liang, Jiasheng Lu, Xiaoe Wang, Pei Liu, Ruiliu Fu, Ruqi Huang, Shao-Lun Huang","Flow Matching (FM) has achieved remarkable generative performance, yet it suffers from exposure bias due to discrepancies between training and inference. Existing mitigation strategies typically rely on static constraints or external heuristics. In this work, we propose that exposure bias itself inherently contains dynamic signals that can guide its own rectification. To leverage this, we introduce DEFAR (DirEctional-Frequency Adaptive Rectification). This framework simulates the single-step inference process during training to identify exposure bias. It utilizes directional and frequency-adaptive feedback signals from the bias itself to enhance the model's bias tolerance. It consists of two key components: (1) Anti-Drift Rectification (ADR). ADR treats inference-time drift as a signal to learn the direction to steer deviated states back toward the target. ADR endows the model with intrinsic active self-rectification capabilities; (2) Frequency Compensation (FC). Empirically, we observe that accumulated bias often stems from a lack of low-frequency components in high-noise stages, and exposure bias carries the missing frequency. FC leverages the bias itself as a self-feedback weighting factor to reinforce the missing frequency components. Experiments on CIFAR-10, CelebA-64, and ImageNet-256/512 show that DEFAR outperforms prior baselines and further demonstrates favorable scalability, compatibility, and inference robustness.",https://arxiv.org/pdf/2606.28226v1,,False
PhysisForcing: Physics Reinforced World Simulator for Robotic Manipulation,26/06/2026,"Peiwen Zhang, Yufan Deng, Shangkun Sun, Juncheng Ma, Duomin Wang, Jonas Du, Zilin Pan, Ye Huang, Hao Liang, Songyan Huang, Ruihua Zhang, Enze Xie, Ming-Yu Liu, Daquan Zhou","Video generation models have emerged as a promising paradigm for embodied world simulation. However, both general-domain video generators and robot-specific data fine-tuned models can still produce physically implausible manipulations, including discontinuous motion trajectories and inconsistent robot-object interactions, which limits their reliability as world simulators. Through extensive experiments, we find that such physical instability mainly arises from two factors: deformation of moving objects and implausible spatio-temporal correlations among interacting entities, particularly during contact. Building on this observation, we propose PhysisForcing, a scalable training framework that strengthens physical consistency by focusing supervision on physics-informative regions through joint optimization of pixel-level and semantic-level features. The framework consists of a pixel-level trajectory alignment loss, which supervises DiT features using reference point trajectories, and a semantic-level relational alignment loss, which aligns DiT features with inter-region relations extracted from a frozen video understanding encoder. Extensive experiments on R-Bench, PAI-Bench, and EZS-Bench show that PhysisForcing consistently improves embodied video generation over strong baselines, improving the Wan2.2-I2V-A14B and Cosmos3-Nano base models on R-Bench by 22.3\% and 9.2\% (7.1\% and 3.7\% over vanilla finetuning), with the Cosmos3-Nano variant attaining the best overall score. Beyond generation, as a world model under the WorldArena action-planner protocol it raises the closed-loop success rate from 16.0\% to 24.0\% and further improves downstream policy success, indicating that physically aligned video models yield stronger representations for robotic manipulation.",https://arxiv.org/pdf/2606.28128v1,,False
From Tokens to States: LLMs as a Special Case of World Models and the Continuous Path Beyond,26/06/2026,Paul Dubois,"The AI community has framed the relationship between large language models (LLMs) and world models as a dichotomy: LLMs predict tokens; world models simulate reality. Yann LeCun argues in 2022 that reaching general intelligence requires abandoning autoregressive token prediction in favour of latent-space architectures. This framing is unnecessarily binary. Two claims will be defended. First, LLMs are a degenerate special case of world models: the state space is the set of all token sequences, the only action is appending one token, and world models are therefore a strict generalisation of LLMs, not a replacement. Second, there is a natural continuous spectrum from NTP to JEPA, with multi-token prediction, future-summary prediction, and next-latent prediction as intermediate stations already populated by current research. Moving along this spectrum relaxes the LLM constraints one by one. It also progressively surrenders the two practical advantages that make LLMs trainable at scale: internet-scale self-supervised data, and a transformer architecture co-designed for discrete token prediction. Both are examined as open research questions: the data question (the cliff from self-supervised text to instrumented action-labelled environments) and the architecture question (whether the transformer generalises to continuous-state prediction, or whether a new primitive is needed).",https://arxiv.org/pdf/2606.28127v1,,False
AI-Driven Synthesis for High-Tech System Design: Automating Innovation,26/06/2026,"Luuk Oerlemans, Steven Westerhof, Theo Hofman","This article addresses the combinatorial complexity inherent in modern high-tech system design by presenting automation-in-design (AiD) as a transformative paradigm. We propose computational design synthesis (CDS), a framework utilising deep learning and generative AI to automate the creation of novel systems. Two case studies (e-drive system design and spatial dimensioning problem) serve as proof-points for this approach. The AI-driven methods used in the case studies represent a fundamental shift in engineering, advancing from simulation-based optimisation towards autonomous design with minimal human supervision.",https://arxiv.org/pdf/2606.28126v1,,False
MultiHashFormer: Hash-based Generative Language Models,26/06/2026,"Huiyin Xue, Atsuki Yamaguchi, Nikolaos Aletras","Language models (LMs) represent tokens using embedding matrices that scale linearly with the vocabulary size. To constrain the parameter footprint, prior work proposes hashing many tokens into a single vector within encoder-only models. While this offers parameter efficiency, many-to-one collisions prevent its use in causal LMs. In this paper, we propose MultiHashFormer, a new framework that allows hash-based autoregression. Each token is represented as a unique hash signature, a short sequence of discrete hash IDs, generated by multiple independent hash functions. A Hash Encoder compresses this signature into a single latent vector for processing by a Transformer decoder. Then, a Hash Decoder generates the hash signature of the next token, which is then mapped back to text. We evaluate our approach at the 100M, 1B and 3B parameter scales, demonstrating that MultiHashFormer consistently outperforms standard Transformer LMs across multiple benchmarks. Furthermore, we show that our model handles multilingual vocabulary expansion with a constant parameter footprint without any modifications.",https://arxiv.org/pdf/2606.28057v1,,False
From Detection to Action: Using LLM Agents for Fault-Tolerant Control,26/06/2026,"Javal Vyas, Milapji Singh Gill, Artan Markaj, Felix Gehlhoff, Mehmet Mercangöz","We propose an agentic Large Language Model (LLM) framework for active Fault-Tolerant Control (FTC) that transforms fault detection outputs into constraint-aware recovery actions grounded in plant-specific knowledge. The approach couples (i) a multi-agent workflow that decomposes operator duties into monitoring, planning, action synthesis, simulation, validation, and reprompting; (ii) a Digital Process Plant Twin (DPPT) that exposes plant data, models, and a simulation service for pre-execution testing; and (iii) a Graph Retrieval-Augmented Generation (Graph RAG) layer built on the CPSMod ontology, which organizes plant knowledge (structure, function, hybrid dynamics, control context, and fault semantics) into a graph that supports relation-aware, multi-hop retrieval for the agents. Corrective actions are generated as minimal-risk state-machine recovery paths and corresponding discrete commands or continuous setpoint adaptations, then validated deterministically against interlocks, envelopes, and dynamic feasibility before any actuation. If no acceptable plan is found within a bounded time window, control is handed to a safety fallback. The framework is evaluated in simulation on two representative benchmarks: a discrete batch Mixing Module and a Continuous Stirred-Tank Reactor (CSTR) under closed-loop PID regulation. Results with lightweight LLMs (GPT-4o-mini and GPT-4.1-mini) show that semantically grounded agents can derive valid recovery decisions within latency budgets compatible with the respective process dynamics, demonstrating a practical pathway from detection to validated corrective action across both discrete and continuous FTC tasks.",https://arxiv.org/pdf/2606.28011v1,,False
Parallel Rollout Approximation for Pixel-Space Autoregressive Image Generation,26/06/2026,"Jiayi Xu, Di He, Guolin Ke","Pixel-space continuous-token autoregressive (AR) generation directly models images as sequences of raw pixel patches, avoiding discrete tokenization or a separately pretrained tokenizer. However, it faces coupled challenges: high-dimensional patch generation causes large single-step errors, and teacher-forced training creates a train--inference gap that makes these errors accumulate across AR steps. Existing fixes such as $x$-prediction and input noise injection only partially mitigate these issues. Exact rollout training better matches inference-time conditions, but is impractical due to prohibitively slow sequential sampling. We propose \emph{Parallel Rollout Approximation} (PRA), a scalable framework that addresses both challenges jointly. PRA generates low-dimensional intermediate states instead of high-dimensional pixel patches, then maps them back to pixel-space tokens with a pixel decoder, preserving a pixel-in, pixel-out AR interface. It also constructs inference-like pixel inputs through the same intermediate-state-to-pixel path used at inference, independently across positions, approximating the pixel-feedback interface encountered during inference-time rollout while retaining parallel teacher-forced training. On class-conditional ImageNet-1K generation at $256\times256$ resolution, PRA-S with 135M parameters achieves an FID of 2.58, surpassing the previous billion-scale pixel-space AR result of 3.60. Scaling to PRA-L with 511M parameters further improves FID to 1.94, establishing a new state of the art among pixel-space AR models. Beyond generation, PRA achieves higher ImageNet classification probing accuracy than other AR and diffusion baselines, suggesting its potential for unified pixel-space image generation and understanding.",https://arxiv.org/pdf/2606.27978v1,,False
ProMSA:Progressive Multimodal Search Agents for Knowledge-Based Visual Question Answering,26/06/2026,"ZhengXian Wu, Hangrui Xu, Kai Shi, Zhuohong Chen, Yunyao Yu, Chuanrui Zhang, Zirui Liao, Jun Yang, Zhenyu Yang, Haonan Lu, Haoqian Wang","Knowledge-based Visual Question Answering (KB-VQA) requires models to combine image understanding with external knowledge. Most prior methods use a fixed retrieve-then-generate pipeline with a pre-selected retriever and a static top-k setting, which is not adaptive during reasoning. We propose ProMSA, a progressive multimodal search agent for KB-VQA. Given an image-question pair, the agent iteratively chooses image search, text search, or stop, under explicit tool-call budgets and with deduplication to avoid redundant retrieval. For training, we first use rejection-sampling SFT to learn valid tool-use formats, then optimize the agent with TN-GSPO, a sequence-level RL objective that normalizes updates by both generation length and tool-interaction depth. Experiments on E-VQA and InfoSeek show consistent gains over strong RAG and agent baselines, and improved retrieval and end-to-end accuracy. The code is available at https://github.com/DingWu1021/Promsa.",https://arxiv.org/pdf/2606.27974v1,,False
Two-Stage Fine-Tuning for Protein Sequence Generation with Targeted Amino-Acid Composition,26/06/2026,"Violeta Basten-Romero, Rubén Muñoz-Tafalla, Anna María Díaz-Rovira, Bertran Miquel-Oliver, Isaac Filella-Merce, Víctor Guallar","Protein language models are standard priors for biological sequence generation, but steering them toward explicit distributional design targets remains largely unexplored. We study a constrained protein generation problem in which sequences must match a desired amino-acid (AA) composition profile while preserving plausible sequence statistics and diversity. The motivating application is synthetic feed protein design, where the AA composition of dietary proteins directly determines their nutritional value. We propose a two-stage pipeline in which domain-adaptive fine-tuning (FT) on an in-domain protein dataset is followed by iterative reward-weighted FT via reinforcement learning (RL) anchored against the FT model as a frozen reference. We evaluate the pipeline on two AA compositions and find that FT brings the average composition close to the target, while the subsequent RL enforces specific sequence constraints that FT alone cannot satisfy. We additionally evaluate the design choices of the proposed composition reward term against two baselines and an ablated variant, isolate the contribution of each training stage, and verify that AA composition alignment is achieved without degrading sequence quality.",https://arxiv.org/pdf/2606.27939v1,,False
S$^2$-VLA: State-Space Guided Vision-Language-Action Models for Long-Horizon Manipulation,26/06/2026,"Zhipeng Xie, Zongyi Han, Xiangyi Wei, Shiliang Sun, Yang Li, Jing Zhao","Vision-Language-Action (VLA) models have demonstrated strong capabilities in robotic manipulation, but their performance degrades significantly in long-horizon tasks due to cumulative error propagation. This limitation largely arises from static feature fusion mechanisms that rely on fixed weights to combine visual, language, and action representations, preventing the model from adapting to different phases of task execution. To address this limitation, we propose S$^2$-VLA, a framework that introduces a State-Space Guided Adaptive Attention (SSGAA) mechanism. SSGAA maintains a belief state that tracks task progression and generates dynamic gating weights to adaptively fuse information from three complementary sources visual features for spatial perception, task intents for high-level task planning, and temporal action sequences for execution consistency. This adaptive fusion allows the model to shift its focus throughout task execution, aligning with the evolving requirements of different task stages. Despite its compact 2B parameter size, S$^2$-VLA consistently outperforms larger 7B-scale models and achieves state-of-the-art performance on long-horizon manipulation benchmarks, including LIBERO and SimplerEnv. highlighting the importance of adaptive feature fusion for long-horizon robotic manipulation.",https://arxiv.org/pdf/2606.27872v1,,False
Hippocampus-DETR: An Explicit Memory Object Detection Framework Based on Hippocampus Modeling,26/06/2026,"Zhaoning Shi, Bo Ma, Hao Xu, Zepeng Yang, Bo Liang","This paper addresses the lack of explicit memory mechanisms in current object detection models and proposes Hippocampus-DETR, a novel detection framework based on biological hippocampal memory modeling. This framework integrates a hippocampal memory network module, HipNet, into the DETR architecture and systematically simulates the anatomical structure and functional organization of hippocampal subregions, including the entorhinal cortex, dentate gyrus, CA3, CA1, and subiculum. Through this design, Hippocampus-DETR realizes pattern separation, pattern completion, importance filtering, and information integration of visual encoding features. During training, different memory submodules are optimized using a layer-wise training strategy, ultimately forming a memory system with memory retrieval and completion capabilities. Experimental results demonstrate that Hippocampus-DETR achieves higher detection accuracy than current mainstream models. More importantly, models equipped with this framework also exhibit excellent generalization ability and data efficiency in tasks such as few-shot image classification, multimodal feature construction, and image restoration. Subsequent experiments further validate the functional necessity and internal interpretability of each memory submodule. This study not only provides a novel object detection framework, but also offers a feasible technical pathway for integrating neurocognitive mechanisms with deep learning models, highlighting its significant value in improving model learning efficiency and task robustness. The project is available at https://github.com/2186cloud/hipnet.",https://arxiv.org/pdf/2606.27831v1,,False
NormAct: A Benchmark for Hidden Social Norm Compliance in Embodied Planning,26/06/2026,"Shiyun Zhao, Xinwei Song, Tianyu Guo, Xiaomeng Gao, Mingyuan Liu, Xu Han, Yuanyuan Zhang, Zhenliang Zhang, Xue Feng, Bo Dai","Multimodal large language models (MLLMs) are increasingly deployed as embodied planners in egocentric environments, where task success requires not only achieving instructed goals but also acting in socially appropriate ways. While explicit goals may render certain actions optimal, implicit social norms often impose hidden constraints. Existing evaluations typically focus on explicit goal achievement or direct norm knowledge, seldom assessing whether planners can infer and apply these hidden constraints within action sequences. We introduce NormAct, a benchmark for embodied social-norm interactions that evaluates plans on Goal Achievement, Norm Compliance, and overall Task Success. NormAct uniquely embeds hidden norms within ordinary tasks, testing whether models can realize them without explicit instruction. Experiments with state-of-the-art MLLMs (GPT-5.4, Claude Opus 4.7, Gemini 3 Pro) reveal a significant gap: models achieve explicit goals in 67.3\% of cases, but comply with hidden norms in only 26.4\%. Cue-condition experiments indicate that this gap stems not from a lack of general social knowledge, but from challenges in activating and grounding relevant norms in context. To address this, we propose NormPerceptor, a context-conditioned cue generator that infers scene-relevant norms prior to planning, increasing Task Success from 24.2\% to 46.7\%. Our results underscore the importance of enabling embodied agents to proactively detect hidden norms, ground them in visual evidence, and integrate them as action-planning constraints. Our benchmark is publicly available at https://huggingface.co/datasets/Caleb196x/NormAct.",https://arxiv.org/pdf/2606.27826v1,,False
CANNs: A Toolkit for Research on Continuous Attractor Neural Networks,26/06/2026,"Sichao He, Aiersi Tuerhong, Shangjun She, Tianhao Chu, Yuling Wu, Junfeng Zuo, Si Wu","Continuous attractor neural networks (CANNs) are the canonical computational framework for how the brain encodes continuous variables such as spatial position, head direction, and movement direction, and explain the activity of hippocampal place cells, entorhinal grid cells, and head-direction cells. CANN research, however, is fragmented: most results rest on lab-specific implementations, general-purpose simulators lack CANN-specific abstractions, and the path from spike trains to attractor geometry in real recordings lacks a standardized toolkit. Here, we present a comprehensive open-source toolkit that unifies the full CANN research workflow. It combines three tightly integrated components: 1) canns, a Python library on BrainPy/JAX that provides standardized 1D/2D CANNs, spike-frequency-adaptation variants, grid cell networks, hierarchical path-integration models, and brain-inspired attractor architectures, together with curated datasets, task generators, an analyzer module and trainer modules for biologically plausible plasticity; 2) canns-lib, a Rust acceleration backend delivering hundreds-of-times speedups for spatial-navigation workloads and modest gains for Ripser-based persistent homology; 3) ASA (Attractor Structure Analyzer), a PySide6 pipeline applying persistent homology and cohomology to experimental neural recordings to detect ring-like and toroidal attractor signatures in real data. The toolkit ships with full-detail reproducible pipelines that recover recent CANN results including SFA-driven anticipative tracking, theta sweeps in head-direction/place/grid systems, and hierarchical path integration.",https://arxiv.org/pdf/2606.27783v1,,False
Learning to Reason with Curriculum II: Compositional Generalization,26/06/2026,"Nived Rajaraman, Audrey Huang, Miroslav Dudik, Robert Schapire, Dylan Foster, Akshay Krishnamurthy","Compositional generalization, the ability to solve complex problems by combining solutions to simpler sub-problems, is a fundamental capability of both natural and artificial intelligence, and a key mechanism underlying chain-of-thought reasoning. However, the theoretical underpinnings of compositional generalization remain poorly understood: when and why does decomposing a problem into parts yield more efficient learning than solving it directly? We study this question through the canonical problem of learning to simulate semiautomata (predicting the outcome of $T$ steps of sequential computation), a model that captures state tracking, regular language recognition, and modular arithmetic. We show that an autocurriculum-based approach building on Part I of this series, recursively decomposing longer sequences into shorter sub-problems, learning to solve them, and composing the solutions, achieves dramatically better statistical complexity than direct methods. (i) For a setting inspired by supervised fine-tuning (SFT) where the learner receives interactive feedback on intermediate states of the computation, curriculum facilitates learning from only $2^{\mathcal{O}(\sqrt{\log T})}$ tokens of supervision; i.e., subpolynomial in the sequence length $T$, overcoming the $Ω(T)$ token barrier required by direct simulation. (ii) For a setting inspired by reinforcement learning with verifiable rewards (RLVR), where the learner improves a pre-trained reference model using an outcome verifier, we show that curriculum reduces the requirement on the reference model from coverage at the full sequence length $T$ to coverage at a shorter block length $B \ll T$, an exponentially weaker condition.",https://arxiv.org/pdf/2606.27721v1,,False
