Title,Publication Date,Author(s),Abstract,Link,DOI,Relevant
Scheduling LLM Inference with Uncertainty-Aware Output Length Predictions,01/04/2026,"Haoyu Zheng, Yongqiang Zhang, Fangcheng Fu, Xiaokai Zhou, Hao Luo, Hongchao Zhu, Yuanyuan Zhu, Hao Wang, Xiao Yan, Jiawei Jiang","To schedule LLM inference, the \textit{shortest job first} (SJF) principle is favorable by prioritizing requests with short output lengths to avoid head-of-line (HOL) blocking. Existing methods usually predict a single output length for each request to facilitate scheduling. We argue that such a \textit{point estimate} does not match the \textit{stochastic} decoding process of LLM inference, where output length is \textit{uncertain} by nature and determined by when the end-of-sequence (EOS) token is sampled. Hence, the output length of each request should be fitted with a distribution rather than a single value. With an in-depth analysis of empirical data and the stochastic decoding process, we observe that output length follows a heavy-tailed distribution and can be fitted with the log-t distribution. On this basis, we propose a simple metric called Tail Inflated Expectation (TIE) to replace the output length in SJF scheduling, which adjusts the expectation of a log-t distribution with its tail probabilities to account for the risk that a request generates long outputs. To evaluate our TIE scheduler, we compare it with three strong baselines, and the results show that TIE reduces the per-token latency by $2.31\times$ for online inference and improves throughput by $1.42\times$ for offline data generation.",https://arxiv.org/pdf/2604.00499v1,,False
Pricing Lookback Options on a Quantum Computer,01/04/2026,"Florence Paquette, Tania Belabbas, Emmanuel Hamel, Anne MacKay","We develop a quantum algorithm to price discretely monitored lookback options in the Black-Scholes framework using imaginary time evolution. By rewriting the pricing PDE as a Schrodinger-type equation, the problem becomes the imaginary time evolution of a quantum state under a non-Hermitian Hamiltonian. This evolution is approximated with the Variational Quantum imaginary time evolution (VarQITE) method, which replaces the exact non-unitary dynamics with a parameterized, hardware-efficient quantum circuit. A central challenge arises from jump conditions caused by the discrete updating of the running maximum. This feature is not present in standard quantum treatments of European or Asian options. To address this, we propose two quantum-compatible formulations: (i) a sequential approach that models jumps via dedicated jump Hamiltonians applied at monitoring dates, and (ii) a simultaneous multi-function evolution that removes explicit jumps at the expense of an increased number of dimensions. We compare both approaches in terms of qubit resources, circuit complexity and numerical accuracy, and benchmark them against Monte Carlo simulations. Our results show that discretely monitored, path-dependent options with jump conditions can be handled within a variational quantum framework, paving the way toward the quantum pricing of more complex derivatives with non-smooth dynamics.",https://arxiv.org/pdf/2604.00389v1,,False
Deep Learning-Accelerated Surrogate Optimization for High-Dimensional Well Control in Stress-Sensitive Reservoirs,01/04/2026,"Mahammad Valiyev, Jodel Cornelio, Behnam Jafarpour","Production optimization in stress-sensitive unconventional reservoirs is governed by a nonlinear trade-off between pressure-driven flow and stress-induced degradation of fracture conductivity and matrix permeability. While higher drawdown improves short-term production, it accelerates permeability loss and reduces long-term recovery. Identifying optimal, time-varying control strategies requires repeated evaluations of fully coupled flow-geomechanics simulators, making conventional optimization computationally expensive.
  We propose a deep learning-based surrogate optimization framework for high-dimensional well control. Unlike prior approaches that rely on predefined control parameterizations or generic sampling, our method treats well control as a continuous, high-dimensional problem and introduces a problem-informed sampling strategy that aligns training data with trajectories encountered during optimization. A neural network proxy is trained to approximate the mapping between bottomhole pressure trajectories and cumulative production using data from a coupled flow-geomechanics model.
  The proxy is embedded within a constrained optimization workflow, enabling rapid evaluation of control strategies. Across multiple initializations, the surrogate achieves agreement with full-physics solutions within 2-5 percent, while reducing computational cost by up to three orders of magnitude. Discrepancies are mainly associated with trajectories near the boundary of the training distribution and local optimization effects.
  This framework shows that combining surrogate modeling with problem-informed sampling enables scalable and reliable optimization for high-dimensional, simulator-based problems, with broader applicability to PDE-constrained systems.",https://arxiv.org/pdf/2604.00352v1,,False
