Title,Publication Date,Author(s),Abstract,Link,DOI,Relevant
The Simulacrum: Decision-Theoretic Pretraining for Near-Optimal Time-Series Forecasting and Inference,26/06/2026,"Pablo Montero-Manso, Marcel Scharth","We introduce a neural network-based framework for learning time series estimators through a process we term decision-theoretic pretraining. Analysts specify a generative world, a distribution over data-generating processes, and a target decision objective. A neural network trained on stratified simulations from this world approximates the corresponding optimal decision rule, yielding a neural estimator that provides forecasts, parameter estimates, predictive intervals, or model-selection for zero-shot inference on previously unseen time series.
  The joint specification of the generative world and objective enables the estimators to directly approximate process-level, finite-sample properties: near-optimal risk, bias control, minimax performance, and uniform calibration. Our experiments demonstrate that these neural estimators can outperform traditional baselines such as maximum likelihood estimation and model selection via AICc, for the same model structural model classes. Furthermore, even when trained purely on simulations of structural models, they achieve competitive or state-of-the-art forecasting accuracy on major real-world benchmarks, compared with statistical, neural or large pre-trained models.
  We illustrate the framework by addressing two longstanding challenges: finite-sample bias and miscalibration in AR(p) models, and the forecast combination puzzle. These applications highlight the approach's main advantage: its ability to approximate solutions to analytically intractable or computationally prohibitive time series problems, including complex structural equations or optimality criteria. Ultimately, by enabling explicit control over decision-theoretic trade-offs, the framework equips analysts with highly efficient estimation tools tailored to their specific analytical needs.",https://arxiv.org/pdf/2606.27711v1,,False
Are Time-Series Foundation Models Ready for E-Nose Data? An Empirical Assessment of Their Embeddings,26/06/2026,"Taeyeong Choi, Mohammed Kamruzzaman","Inspired by advances in natural language processing and computer vision, ""time-series foundation models"" (TSFMs) have recently been introduced with the promise of strong generalization across diverse time-series tasks, including forecasting, classification, and anomaly detection, as well as across domains such as healthcare, climate science, and manufacturing. However, their utility for gas-sensing data remains largely unexplored. To address this gap, this paper systematically evaluates recent TSFMs on electronic nose (E-Nose) data. In particular, we investigate whether embeddings produced by representative TSFMs, including Chronos-2 and MOMENT, provide effective representations for gas identification and concentration prediction. Specifically, we show that fine-tuning is necessary to achieve satisfactory performance on E-Nose data, and fusing TSFM embeddings with representations learned by specialized predictive models can further improve the performance, suggesting both the potential and limitations of current TSFMs for gas-sensing applications.",https://arxiv.org/pdf/2606.27672v1,,False
Masked Language Flow Models,26/06/2026,"Iskander Azangulov, Kianoosh Ashouritaklimi, Leo Zhang, Simon Vary, Patrick Rebeschini","Masked Diffusion Models (MDMs) promise fast, parallel language generation, but their reverse transition factorises across token positions -- an approximation that breaks down in the few-step sampling regime where parallel generation ought to provide the greatest efficiency gains. Flow Language Models (FLMs) sidestep this limitation by learning a continuous flow that transports noise toward clean sequences represented in Euclidean space, inducing a flow map that can be distilled for single-step generation. However, this makes complex tasks requiring multi-step reasoning problematic for FLMs, as FLMs are forced to decode every token during generation. To address this, we introduce Masked Language Flow Models (MLFMs), which incorporate masking into FLMs using a continuous stochastic interpolant to bridge partially masked and clean sequences. This design enables conditional generation via continuous flows and allows pretrained MDMs to be converted into MLFMs through a simple, lightweight adaptation. Leveraging this flexibility, we propose a novel sampler that alternates continuous denoising with the discrete unmasking of confident tokens to better support multi-step reasoning. We evaluate our approach on GSM8K and MT-Bench and find, for the first time, that flow-based language models can be scaled to solve downstream reasoning and instruction-following tasks.",https://arxiv.org/pdf/2606.27617v1,,False
