Title,Publication Date,Author(s),Abstract,Link,DOI,Relevant
Mind the Gap: Bridging Prior Shift in Realistic Few-Shot Crop-Type Classification,20/11/2025,"Joana Reuss, Ekaterina Gikalo, Marco Körner","Real-world agricultural distributions often suffer from severe class imbalance, typically following a long-tailed distribution. Labeled datasets for crop-type classification are inherently scarce and remain costly to obtain. When working with such limited data, training sets are frequently constructed to be artificially balanced -- in particular in the case of few-shot learning -- failing to reflect real-world conditions. This mismatch induces a shift between training and test label distributions, degrading real-world generalization. To address this, we propose Dirichlet Prior Augmentation (DirPA), a novel method that simulates an unknown label distribution skew of the target domain proactively during model training. Specifically, we model the real-world distribution as Dirichlet-distributed random variables, effectively performing a prior augmentation during few-shot learning. Our experiments show that DirPA successfully shifts the decision boundary and stabilizes the training process by acting as a dynamic feature regularizer.",https://arxiv.org/pdf/2511.16218v1,,False
CausalMamba: Interpretable State Space Modeling for Temporal Rumor Causality,20/11/2025,"Xiaotong Zhan, Xi Cheng","Rumor detection on social media remains a challenging task due to the complex propagation dynamics and the limited interpretability of existing models. While recent neural architectures capture content and structural features, they often fail to reveal the underlying causal mechanisms of misinformation spread. We propose CausalMamba, a novel framework that integrates Mamba-based sequence modeling, graph convolutional networks (GCNs), and differentiable causal discovery via NOTEARS. CausalMamba learns joint representations of temporal tweet sequences and reply structures, while uncovering latent causal graphs to identify influential nodes within each propagation chain. Experiments on the Twitter15 dataset show that our model achieves competitive classification performance compared to strong baselines, and uniquely enables counterfactual intervention analysis. Qualitative results demonstrate that removing top-ranked causal nodes significantly alters graph connectivity, offering interpretable insights into rumor dynamics. Our framework provides a unified approach for rumor classification and influence analysis, paving the way for more explainable and actionable misinformation detection systems.",https://arxiv.org/pdf/2511.16191v1,,False
FOOTPASS: A Multi-Modal Multi-Agent Tactical Context Dataset for Play-by-Play Action Spotting in Soccer Broadcast Videos,20/11/2025,"Jeremie Ochin, Raphael Chekroun, Bogdan Stanciulescu, Sotiris Manitsaris","Soccer video understanding has motivated the creation of datasets for tasks such as temporal action localization, spatiotemporal action detection (STAD), or multiobject tracking (MOT). The annotation of structured sequences of events (who does what, when, and where) used for soccer analytics requires a holistic approach that integrates both STAD and MOT. However, current action recognition methods remain insufficient for constructing reliable play-by-play data and are typically used to assist rather than fully automate annotation. Parallel research has advanced tactical modeling, trajectory forecasting, and performance analysis, all grounded in game-state and play-by-play data. This motivates leveraging tactical knowledge as a prior to support computer-vision-based predictions, enabling more automated and reliable extraction of play-by-play data. We introduce Footovision Play-by-Play Action Spotting in Soccer Dataset (FOOTPASS), the first benchmark for play-by-play action spotting over entire soccer matches in a multi-modal, multi-agent tactical context. It enables the development of methods for player-centric action spotting that exploit both outputs from computer-vision tasks (e.g., tracking, identification) and prior knowledge of soccer, including its tactical regularities over long time horizons, to generate reliable play-by-play data streams. These streams form an essential input for data-driven sports analytics.",https://arxiv.org/pdf/2511.16183v1,,False
MagBotSim: Physics-Based Simulation and Reinforcement Learning Environments for Magnetic Robotics,20/11/2025,"Lara Bergmann, Cedric Grothues, Klaus Neumann","Magnetic levitation is about to revolutionize in-machine material flow in industrial automation. Such systems are flexibly configurable and can include a large number of independently actuated shuttles (movers) that dynamically rebalance production capacity. Beyond their capabilities for dynamic transportation, these systems possess the inherent yet unexploited potential to perform manipulation. By merging the fields of transportation and manipulation into a coordinated swarm of magnetic robots (MagBots), we enable manufacturing systems to achieve significantly higher efficiency, adaptability, and compactness. To support the development of intelligent algorithms for magnetic levitation systems, we introduce MagBotSim (Magnetic Robotics Simulation): a physics-based simulation for magnetic levitation systems. By framing magnetic levitation systems as robot swarms and providing a dedicated simulation, this work lays the foundation for next generation manufacturing systems powered by Magnetic Robotics. MagBotSim's documentation, videos, experiments, and code are available at: https://ubi-coro.github.io/MagBotSim/",https://arxiv.org/pdf/2511.16158v1,,False
Learning Tractable Distributions Of Language Model Continuations,20/11/2025,"Gwen Yidou-Weng, Ian Li, Anji Liu, Oliver Broadrick, Guy Van den Broeck, Benjie Wang","Controlled language generation conditions text on sequence-level constraints (for example, syntax, style, or safety). These constraints may depend on future tokens, which makes directly conditioning an autoregressive language model (LM) generally intractable. Prior work uses tractable surrogates such as hidden Markov models (HMMs) to approximate the distribution over continuations and adjust the model's next-token logits at decoding time. However, we find that these surrogates are often weakly context aware, which reduces query quality. We propose Learning to Look Ahead (LTLA), a hybrid approach that pairs the same base language model for rich prefix encoding with a fixed tractable surrogate model that computes exact continuation probabilities. Two efficiency pitfalls arise when adding neural context: (i) naively rescoring the prefix with every candidate next token requires a sweep over the entire vocabulary at each step, and (ii) predicting fresh surrogate parameters for each prefix, although tractable at a single step, forces recomputation of future probabilities for every new prefix and eliminates reuse. LTLA avoids both by using a single batched HMM update to account for all next-token candidates at once, and by conditioning only the surrogate's latent state prior on the LM's hidden representations while keeping the surrogate decoder fixed, so computations can be reused across prefixes. Empirically, LTLA attains higher conditional likelihood than an unconditional HMM, approximates continuation distributions for vision-language models where a standalone HMM cannot encode visual context, and improves constraint satisfaction at comparable fluency on controlled-generation tasks, with minimal inference overhead.",https://arxiv.org/pdf/2511.16054v1,,False
An Aligned Constraint Programming Model For Serial Batch Scheduling With Minimum Batch Size,20/11/2025,"Jorge A. Huertas, Pascal Van Hentenryck","In serial batch (s-batch) scheduling, jobs from similar families are grouped into batches and processed sequentially to avoid repetitive setups that are required when processing consecutive jobs of different families. Despite its large success in scheduling, only three Constraint Programming (CP) models have been proposed for this problem considering minimum batch sizes, which is a common requirement in many practical settings, including the ion implantation area in semiconductor manufacturing. These existing CP models rely on a predefined virtual set of possible batches that suffers from the curse of dimensionality and adds complexity to the problem. This paper proposes a novel CP model that does not rely on this virtual set. Instead, it uses key alignment parameters that allow it to reason directly on the sequences of same-family jobs scheduled on the machines, resulting in a more compact formulation. This new model is further improved by exploiting the problem's structure with tailored search phases and strengthened inference levels of the constraint propagators. The extensive computational experiments on nearly five thousand instances compare the proposed models against existing methods in the literature, including mixed-integer programming formulations, tabu search meta-heuristics, and CP approaches. The results demonstrate the superiority of the proposed models on small-to-medium instances with up to 100 jobs, and their ability to find solutions up to 25\% better than the ones produces by existing methods on large-scale instances with up to 500 jobs, 10 families, and 10 machines.",https://arxiv.org/pdf/2511.16045v1,,False
Physically Realistic Sequence-Level Adversarial Clothing for Robust Human-Detection Evasion,20/11/2025,"Dingkun Zhou, Patrick P. K. Chan, Hengxu Wu, Shikang Zheng, Ruiqi Huang, Yuanjie Zhao","Deep neural networks used for human detection are highly vulnerable to adversarial manipulation, creating safety and privacy risks in real surveillance environments. Wearable attacks offer a realistic threat model, yet existing approaches usually optimize textures frame by frame and therefore fail to maintain concealment across long video sequences with motion, pose changes, and garment deformation. In this work, a sequence-level optimization framework is introduced to generate natural, printable adversarial textures for shirts, trousers, and hats that remain effective throughout entire walking videos in both digital and physical settings. Product images are first mapped to UV space and converted into a compact palette and control-point parameterization, with ICC locking to keep all colors printable. A physically based human-garment pipeline is then employed to simulate motion, multi-angle camera viewpoints, cloth dynamics, and illumination variation. An expectation-over-transformation objective with temporal weighting is used to optimize the control points so that detection confidence is minimized across whole sequences. Extensive experiments demonstrate strong and stable concealment, high robustness to viewpoint changes, and superior cross-model transferability. Physical garments produced with sublimation printing achieve reliable suppression under indoor and outdoor recordings, confirming real-world feasibility.",https://arxiv.org/pdf/2511.16020v1,,False
Synergizing Deconfounding and Temporal Generalization For Time-series Counterfactual Outcome Estimation,20/11/2025,"Yiling Liu, Juncheng Dong, Chen Fu, Wei Shi, Ziyang Jiang, Zhigang Hua, David Carlson","Estimating counterfactual outcomes from time-series observations is crucial for effective decision-making, e.g. when to administer a life-saving treatment, yet remains significantly challenging because (i) the counterfactual trajectory is never observed and (ii) confounders evolve with time and distort estimation at every step. To address these challenges, we propose a novel framework that synergistically integrates two complementary approaches: Sub-treatment Group Alignment (SGA) and Random Temporal Masking (RTM). Instead of the coarse practice of aligning marginal distributions of the treatments in latent space, SGA uses iterative treatment-agnostic clustering to identify fine-grained sub-treatment groups. Aligning these fine-grained groups achieves improved distributional matching, thus leading to more effective deconfounding. We theoretically demonstrate that SGA optimizes a tighter upper bound on counterfactual risk and empirically verify its deconfounding efficacy. RTM promotes temporal generalization by randomly replacing input covariates with Gaussian noises during training. This encourages the model to rely less on potentially noisy or spuriously correlated covariates at the current step and more on stable historical patterns, thereby improving its ability to generalize across time and better preserve underlying causal relationships. Our experiments demonstrate that while applying SGA and RTM individually improves counterfactual outcome estimation, their synergistic combination consistently achieves state-of-the-art performance. This success comes from their distinct yet complementary roles: RTM enhances temporal generalization and robustness across time steps, while SGA improves deconfounding at each specific time point.",https://arxiv.org/pdf/2511.16006v1,,False
Hiding in the AI Traffic: Abusing MCP for LLM-Powered Agentic Red Teaming,20/11/2025,"Strahinja Janjuesvic, Anna Baron Garcia, Sohrob Kazerounian","Generative AI is reshaping offensive cybersecurity by enabling autonomous red team agents that can plan, execute, and adapt during penetration tests. However, existing approaches face trade-offs between generality and specialization, and practical deployments reveal challenges such as hallucinations, context limitations, and ethical concerns. In this work, we introduce a novel command & control (C2) architecture leveraging the Model Context Protocol (MCP) to coordinate distributed, adaptive reconnaissance agents covertly across networks. Notably, we find that our architecture not only improves goal-directed behavior of the system as whole, but also eliminates key host and network artifacts that can be used to detect and prevent command & control behavior altogether. We begin with a comprehensive review of state-of-the-art generative red teaming methods, from fine-tuned specialist models to modular or agentic frameworks, analyzing their automation capabilities against task-specific accuracy. We then detail how our MCP-based C2 can overcome current limitations by enabling asynchronous, parallel operations and real-time intelligence sharing without periodic beaconing. We furthermore explore advanced adversarial capabilities of this architecture, its detection-evasion techniques, and address dual-use ethical implications, proposing defensive measures and controlled evaluation in lab settings. Experimental comparisons with traditional C2 show drastic reductions in manual effort and detection footprint. We conclude with future directions for integrating autonomous exploitation, defensive LLM agents, predictive evasive maneuvers, and multi-agent swarms. The proposed MCP-enabled C2 framework demonstrates a significant step toward realistic, AI-driven red team operations that can simulate advanced persistent threats while informing the development of next-generation defensive systems.",https://arxiv.org/pdf/2511.15998v1,,False
Machine Learning vs. Randomness: Challenges in Predicting Binary Options Movements,20/11/2025,"Gabriel M. Arantes, Richard F. Pinto, Bruno L. Dalmazo, Eduardo N. Borges, Giancarlo Lucca, Viviane L. D. de Mattos, Fabian C. Cardoso, Rafael A. Berri","Binary options trading is often marketed as a field where predictive models can generate consistent profits. However, the inherent randomness and stochastic nature of binary options make price movements highly unpredictable, posing significant challenges for any forecasting approach. This study demonstrates that machine learning algorithms struggle to outperform a simple baseline in predicting binary options movements. Using a dataset of EUR/USD currency pairs from 2021 to 2023, we tested multiple models, including Random Forest, Logistic Regression, Gradient Boosting, and k-Nearest Neighbors (kNN), both before and after hyperparameter optimization. Furthermore, several neural network architectures, including Multi-Layer Perceptrons (MLP) and a Long Short-Term Memory (LSTM) network, were evaluated under different training conditions. Despite these exhaustive efforts, none of the models surpassed the ZeroR baseline accuracy, highlighting the inherent randomness of binary options. These findings reinforce the notion that binary options lack predictable patterns, making them unsuitable for machine learning-based forecasting.",https://arxiv.org/pdf/2511.15960v1,10.1007/978-3-032-10486-1_43,False
