Title,Publication Date,Author(s),Abstract,Link,DOI,Relevant
LAtent Phase Inference from Short time sequences using SHallow REcurrent Decoders (LAPIS-SHRED),01/04/2026,"Yuxuan Bao, Xingyue Zhang, J. Nathan Kutz","Reconstructing full spatio-temporal dynamics from sparse observations in both space and time remains a central challenge in complex systems, as measurements can be spatially incomplete and can be also limited to narrow temporal windows. Yet approximating the complete spatio-temporal trajectory is essential for mechanistic insight and understanding, model calibration, and operational decision-making. We introduce LAPIS-SHRED (LAtent Phase Inference from Short time sequence using SHallow REcurrent Decoders), a modular architecture that reconstructs and/or forecasts complete spatiotemporal dynamics from sparse sensor observations confined to short temporal windows. LAPIS-SHRED operates through a three-stage pipeline: (i) a SHRED model is pre-trained entirely on simulation data to map sensor time-histories into a structured latent space, (ii) a temporal sequence model, trained on simulation-derived latent trajectories, learns to propagate latent states forward or backward in time to span unobserved temporal regions from short observational time windows, and (iii) at deployment, only a short observation window of hyper-sparse sensor measurements from the true system is provided, from which the frozen SHRED model and the temporal model jointly reconstruct or forecast the complete spatiotemporal trajectory. The framework supports bidirectional inference, inherits data assimilation and multiscale reconstruction capabilities from its modular structure, and accommodates extreme observational constraints including single-frame terminal inputs. We evaluate LAPIS-SHRED on six experiments spanning complex spatio-temporal physics: turbulent flows, multiscale propulsion physics, volatile combustion transients, and satellite-derived environmental fields, highlighting a lightweight, modular architecture suited for operational settings where observation is constrained by physical or logistical limitations.",https://arxiv.org/pdf/2604.01216v1,,False
NeuroDDAF: Neural Dynamic Diffusion-Advection Fields with Evidential Fusion for Air Quality Forecasting,01/04/2026,"Prasanjit Dey, Soumyabrata Dev, Angela Meyer, Bianca Schoen-Phelan","Accurate air quality forecasting is crucial for protecting public health and guiding environmental policy, yet it remains challenging due to nonlinear spatiotemporal dynamics, wind-driven transport, and distribution shifts across regions. Physics-based models are interpretable but computationally expensive and often rely on restrictive assumptions, whereas purely data-driven models can be accurate but may lack robustness and calibrated uncertainty. To address these limitations, we propose Neural Dynamic Diffusion-Advection Fields (NeuroDDAF), a physics-informed forecasting framework that unifies neural representation learning with open-system transport modeling. NeuroDDAF integrates (i) a GRU-Graph Attention encoder to capture temporal dynamics and wind-aware spatial interactions, (ii) a Fourier-domain diffusion-advection module with learnable residuals, (iii) a wind-modulated latent Neural ODE to model continuous-time evolution under time-varying connectivity, and (iv) an evidential fusion mechanism that adaptively combines physics-guided and neural forecasts while quantifying uncertainty. Experiments on four urban datasets (Beijing, Shenzhen, Tianjin, and Ancona) across 1-3 day horizons show that NeuroDDAF consistently outperforms strong baselines, including AirPhyNet, achieving up to 9.7% reduction in RMSE and 9.4% reduction in MAE on long-term forecasts. On the Beijing dataset, NeuroDDAF attains an RMSE of 41.63 $μ$g/m$^3$ for 1-day prediction and 48.88 $μ$g/m$^3$ for 3-day prediction, representing the best performance among all compared methods. In addition, NeuroDDAF improves cross-city generalization and yields well-calibrated uncertainty estimates, as confirmed by ensemble variance analysis and case studies under varying wind conditions.",https://arxiv.org/pdf/2604.01175v1,,False
Bridging the Simulation-to-Experiment Gap with Generative Models using Adversarial Distribution Alignment,01/04/2026,"Kai Nelson, Tobias Kreiman, Sergey Levine, Aditi S. Krishnapriyan","A fundamental challenge in science and engineering is the simulation-to-experiment gap. While we often possess prior knowledge of physical laws, these physical laws can be too difficult to solve exactly for complex systems. Such systems are commonly modeled using simulators, which impose computational approximations. Meanwhile, experimental measurements more faithfully represent the real world, but experimental data typically consists of observations that only partially reflect the system's full underlying state. We propose a data-driven distribution alignment framework that bridges this simulation-to-experiment gap by pre-training a generative model on fully observed (but imperfect) simulation data, then aligning it with partial (but real) observations of experimental data. While our method is domain-agnostic, we ground our approach in the physical sciences by introducing Adversarial Distribution Alignment (ADA). This method aligns a generative model of atomic positions -- initially trained on a simulated Boltzmann distribution -- with the distribution of experimental observations. We prove that our method recovers the target observable distribution, even with multiple, potentially correlated observables. We also empirically validate our framework on synthetic, molecular, and experimental protein data, demonstrating that it can align generative models with diverse observables. Our code is available at https://kaityrusnelson.com/ada/.",https://arxiv.org/pdf/2604.01169v1,,False
Inverse Design of Optical Multilayer Thin Films using Robust Masked Diffusion Models,01/04/2026,"Jonas Schaible, Asena Karolin Özdemir, Charlotte Debus, Sven Burger, Achim Streit, Christiane Becker, Klaus Jäger, Markus Götz","Inverse design of optical multilayer stacks seeks to infer layer materials, thicknesses, and ordering from a desired target spectrum. It is a long-standing challenge due to the large design space and non-unique solutions. We introduce \texttt{OptoLlama}, a masked diffusion language model for inverse thin-film design from optical spectra. Representing multilayer stacks as sequences of material-thickness tokens, \texttt{OptoLlama} conditions generation on reflectance, absorptance, and transmittance spectra and learns a probabilistic mapping from optical response to structure. Evaluated on a representative test set of 3,000 targets, \texttt{OptoLlama} reduces the mean absolute spectral error by 2.9-fold relative to a nearest-neighbor template baseline and by 3.45-fold relative to the state-of-the-art data-driven baseline, called \texttt{OptoGPT}. Case studies on designed and expert-defined targets show that the model reproduces characteristic spectral features and recovers physically meaningful stack motifs, including distributed Bragg reflectors. These results establish diffusion-based sequence modeling as a powerful framework for inverse photonic design.",https://arxiv.org/pdf/2604.01106v1,,False
EgoSim: Egocentric World Simulator for Embodied Interaction Generation,01/04/2026,"Jinkun Hao, Mingda Jia, Ruiyan Wang, Xihui Liu, Ran Yi, Lizhuang Ma, Jiangmiao Pang, Xudong Xu","We introduce EgoSim, a closed-loop egocentric world simulator that generates spatially consistent interaction videos and persistently updates the underlying 3D scene state for continuous simulation. Existing egocentric simulators either lack explicit 3D grounding, causing structural drift under viewpoint changes, or treat the scene as static, failing to update world states across multi-stage interactions. EgoSim addresses both limitations by modeling 3D scenes as updatable world states. We generate embodiment interactions via a Geometry-action-aware Observation Simulation model, with spatial consistency from an Interaction-aware State Updating module. To overcome the critical data bottleneck posed by the difficulty in acquiring densely aligned scene-interaction training pairs, we design a scalable pipeline that extracts static point clouds, camera trajectories, and embodiment actions from in-the-wild large-scale monocular egocentric videos. We further introduce EgoCap, a capture system that enables low-cost real-world data collection with uncalibrated smartphones. Extensive experiments demonstrate that EgoSim significantly outperforms existing methods in terms of visual quality, spatial consistency, and generalization to complex scenes and in-the-wild dexterous interactions, while supporting cross-embodiment transfer to robotic manipulation. Codes and datasets will be open soon. The project page is at egosimulator.github.io.",https://arxiv.org/pdf/2604.01001v1,,False
Bridging Structured Knowledge and Data: A Unified Framework with Finance Applications,01/04/2026,"Yi Cao, Zexun Chen, Lin William Cong, Heqing Shi","We develop Structured-Knowledge-Informed Neural Networks (SKINNs), a unified estimation framework that embeds theoretical, simulated, previously learned, or cross-domain insights as differentiable constraints within flexible neural function approximation. SKINNs jointly estimate neural network parameters and economically meaningful structural parameters in a single optimization problem, enforcing theoretical consistency not only on observed data but over a broader input domain through collocation, and therefore nesting approaches such as functional GMM, Bayesian updating, transfer learning, PINNs, and surrogate modeling. SKINNs define a class of M-estimators that are consistent and asymptotically normal with root-N convergence, sandwich covariance, and recovery of pseudo-true parameters under misspecification. We establish identification of structural parameters under joint flexibility, derive generalization and target-risk bounds under distributional shift in a convex proxy, and provide a restricted-optimal characterization of the weighting parameter that governs the bias-variance tradeoff. In an illustrative financial application to option pricing, SKINNs improve out-of-sample valuation and hedging performance, particularly at longer horizons and during high-volatility regimes, while recovering economically interpretable structural parameters with improved stability relative to conventional calibration. More broadly, SKINNs provide a general econometric framework for combining model-based reasoning with high-dimensional, data-driven estimation.",https://arxiv.org/pdf/2604.00987v1,,False
Proactive Agent Research Environment: Simulating Active Users to Evaluate Proactive Assistants,01/04/2026,"Deepak Nathani, Cheng Zhang, Chang Huan, Jiaming Shan, Yinfei Yang, Alkesh Patel, Zhe Gan, William Yang Wang, Michael Saxon, Xin Eric Wang","Proactive agents that anticipate user needs and autonomously execute tasks hold great promise as digital assistants, yet the lack of realistic user simulation frameworks hinders their development. Existing approaches model apps as flat tool-calling APIs, failing to capture the stateful and sequential nature of user interaction in digital environments and making realistic user simulation infeasible. We introduce Proactive Agent Research Environment (Pare), a framework for building and evaluating proactive agents in digital environments. Pare models applications as finite state machines with stateful navigation and state-dependent action space for the user simulator, enabling active user simulation. Building on this foundation, we present Pare-Bench, a benchmark of 143 diverse tasks spanning communication, productivity, scheduling, and lifestyle apps, designed to test context observation, goal inference, intervention timing, and multi-app orchestration.",https://arxiv.org/pdf/2604.00842v1,,False
A Benchmark of State-Space Models vs. Transformers and BiLSTM-based Models for Historical Newspaper OCR,01/04/2026,"Merveilles Agbeti-messan, Thierry Paquet, Clément Chatelain, Pierrick Tranouez, Stéphane Nicolas","End-to-end OCR for historical newspapers remains challenging, as models must handle long text sequences, degraded print quality, and complex layouts. While Transformer-based recognizers dominate current research, their quadratic complexity limits efficient paragraph-level transcription and large-scale deployment. We investigate linear-time State-Space Models (SSMs), specifically Mamba, as a scalable alternative to Transformer-based sequence modeling for OCR.
  We present to our knowledge, the first OCR architecture based on SSMs, combining a CNN visual encoder with bi-directional and autoregressive Mamba sequence modeling, and conduct a large-scale benchmark comparing SSMs with Transformer- and BiLSTM-based recognizers. Multiple decoding strategies (CTC, autoregressive, and non-autoregressive) are evaluated under identical training conditions alongside strong neural baselines (VAN, DAN, DANIEL) and widely used off-the-shelf OCR engines (PERO-OCR, Tesseract OCR, TrOCR, Gemini).
  Experiments on historical newspapers from the Bibliothèque nationale du Luxembourg, with newly released >99% verified gold-standard annotations, and cross-dataset tests on Fraktur and Antiqua lines, show that all neural models achieve low error rates (~2% CER), making computational efficiency the main differentiator. Mamba-based models maintain competitive accuracy while halving inference time and exhibiting superior memory scaling (1.26x vs 2.30x growth at 1000 chars), reaching 6.07% CER at the severely degraded paragraph level compared to 5.24% for DAN, while remaining 2.05x faster.
  We release code, trained models, and standardized evaluation protocols to enable reproducible research and guide practitioners in large-scale cultural heritage OCR.",https://arxiv.org/pdf/2604.00725v1,,False
Embedded Variational Neural Stochastic Differential Equations for Learning Heterogeneous Dynamics,01/04/2026,"Sandeep Kumar Samota, Reema Gupta, Snehashish Chakraverty","This study examines the challenges of modeling complex and noisy data related to socioeconomic factors over time, with a focus on data from various districts in Odisha, India. Traditional time-series models struggle to capture both trends and variations together in this type of data. To tackle this, a Variational Neural Stochastic Differential Equation (V-NSDE) model is designed that combines the expressive dynamics of Neural SDEs with the generative capabilities of Variational Autoencoders (VAEs). This model uses an encoder and a decoder. The encoder takes the initial observations and district embeddings and translates them into a Gaussian distribution, which determines the mean and log-variance of the first latent state. Then the obtained latent state initiates the Neural SDE, which utilize neural networks to determine the drift and diffusion functions that govern continuous-time latent dynamics. These governing functions depend on the time index, latent state, and district embedding, which help the model learn the unique characteristics specific to each district. After that, using a probabilistic decoder, the observations are reconstructed from the latent trajectory. The decoder outputs a mean and log-variance for each time step, which follows the Gaussian likelihood. The Evidence Lower Bound (ELBO) training loss improves by adding a KL-divergence regularization term to the negative log-likelihood (nll). The obtained results demonstrate the effective learning of V-NSDE in recognizing complex patterns over time, yielding realistic outcomes that include clear trends and random fluctuations across different areas.",https://arxiv.org/pdf/2604.00669v1,,False
Streaming Model Cascades for Semantic SQL,01/04/2026,"Paweł Liskowski, Kyle Schmaus","Modern data warehouses extend SQL with semantic operators that invoke large language models on each qualifying row, but the per-row inference cost is prohibitive at scale. Model cascades reduce this cost by routing most rows through a fast proxy model and delegating uncertain cases to an expensive oracle. Existing frameworks, however, require global dataset access and optimize a single quality metric, limiting their applicability in distributed systems where data is partitioned across independent workers. We present two adaptive cascade algorithms designed for streaming, per-partition execution in which each worker processes its partition independently without inter-worker communication. SUPG-IT extends the SUPG statistical framework to streaming execution with iterative threshold refinement and joint precision-recall guarantees. GAMCAL replaces user-specified quality targets with a learned calibration model: a Generalized Additive Model maps proxy scores to calibrated probabilities with uncertainty quantification, enabling direct optimization of a cost-quality tradeoff through a single parameter. Experiments on six datasets in a production semantic SQL engine show that both algorithms achieve F1 > 0.95 on every dataset. GAMCAL achieves higher F1 per oracle call at cost-sensitive operating points, while SUPG-IT reaches a higher quality ceiling with formal guarantees on precision and recall.",https://arxiv.org/pdf/2604.00660v1,,False
A Survey of On-Policy Distillation for Large Language Models,01/04/2026,"Mingyang Song, Mao Zheng","Knowledge distillation has become a primary mechanism for transferring reasoning and domain expertise from frontier Large Language Models (LLMs) to smaller, deployable students. However, the dominant paradigm remains \textit{off-policy}: students train on static teacher-generated data and never encounter their own errors during learning. This train--test mismatch, an instance of \textit{exposure bias}, causes prediction errors to compound autoregressively at inference time. On-Policy Distillation (OPD) addresses this by letting the student generate its own trajectories and receive teacher feedback on these self-generated outputs, grounding distillation in the theory of interactive imitation learning. Despite rapid growth spanning divergence minimization, reward-guided learning, and self-play, the OPD literature remains fragmented with no unified treatment. This survey provides the first comprehensive overview of OPD for LLMs. We introduce a unified $f$-divergence framework over on-policy samples and organize the landscape along three orthogonal dimensions: \emph{feedback signal} (logit-based, outcome-based, or self-play), \emph{teacher access} (white-box, black-box, or teacher-free), and \emph{loss granularity} (token-level, sequence-level, or hybrid). We systematically analyze representative methods, examine industrial deployments, and identify open problems including distillation scaling laws, uncertainty-aware feedback, and agent-level distillation.",https://arxiv.org/pdf/2604.00626v1,,False
Multi-Camera View Scaling for Data-Efficient Robot Imitation Learning,01/04/2026,"Yichen Xie, Yixiao Wang, Shuqi Zhao, Cheng-En Wu, Masayoshi Tomizuka, Jianwen Xie, Hao-Shu Fang","The generalization ability of imitation learning policies for robotic manipulation is fundamentally constrained by the diversity of expert demonstrations, while collecting demonstrations across varied environments is costly and difficult in practice. In this paper, we propose a practical framework that exploits inherent scene diversity without additional human effort by scaling camera views during demonstration collection. Instead of acquiring more trajectories, multiple synchronized camera perspectives are used to generate pseudo-demonstrations from each expert trajectory, which enriches the training distribution and improves viewpoint invariance in visual representations. We analyze how different action spaces interact with view scaling and show that camera-space representations further enhance diversity. In addition, we introduce a multiview action aggregation method that allows single-view policies to benefit from multiple cameras during deployment. Extensive experiments in simulation and real-world manipulation tasks demonstrate significant gains in data efficiency and generalization compared to single-view baselines. Our results suggest that scaling camera views provides a practical and scalable solution for imitation learning, which requires minimal additional hardware setup and integrates seamlessly with existing imitation learning algorithms. The website of our project is https://yichen928.github.io/robot_multiview.",https://arxiv.org/pdf/2604.00557v1,,False
Learning from Many and Adapting to the Unknown in Open-set Test Streams,01/04/2026,"Xiao Zhang, Juntao Lyu, Tianyu Hu, Qianchuan Zhao, Huimin Ma","Large Language Models (LLMs) generalize across tasks via reusable representations and flexible reasoning, yet remain brittle in real deployment under evolving tasks and continual distribution shift. A common approach is Test-Time Adaptation (TTA), existing ones of which updates models with hand-designed unsupervised objectives over the full parameter space and mostly overlook preserving shared source knowledge and the reliability of adaptation signals. Drawing on molecular signaling cascades of memory updating in Drosophila, we propose Synapse Consolidation (SyCo), a parameter-efficient LLM adaptation method that updates low-rank adapters through Rac1 and MAPK pathways under the guidance of a structured TTA objective driven by problem understanding, process understanding, and source-domain guardrail. Rac1 confines plasticity to a tail-gradient subspace that is less critical for source knowledge, enabling rapid specialization while preserving source representations. MAPK uses a tiered controller to suppress noisy updates and consolidate useful adaptations under non-stationary streams. To model real deployments with multiple sources and continually emerging tasks, we introduce Multi-source Open-set Adaptation (MOA) setting, where a model is trained on multiple labeled source tasks and then adapts on open, non-stationary unlabeled test streams that mix seen and unseen tasks with partial overlap in label and intent space. Across 18 NLP datasets and the MOA setting, SyCo consistently outperforms strong baselines, achieving 78.31\% on unseen-task adaptation and 85.37\% on unseen-data shifts.",https://arxiv.org/pdf/2604.00533v1,,False
"Think, Act, Build: An Agentic Framework with Vision Language Models for Zero-Shot 3D Visual Grounding",01/04/2026,"Haibo Wang, Zihao Lin, Zhiyang Xu, Lifu Huang","3D Visual Grounding (3D-VG) aims to localize objects in 3D scenes via natural language descriptions. While recent advancements leveraging Vision-Language Models (VLMs) have explored zero-shot possibilities, they typically suffer from a static workflow relying on preprocessed 3D point clouds, essentially degrading grounding into proposal matching. To bypass this reliance, our core motivation is to decouple the task: leveraging 2D VLMs to resolve complex spatial semantics, while relying on deterministic multi-view geometry to instantiate the 3D structure. Driven by this insight, we propose ""Think, Act, Build (TAB)"", a dynamic agentic framework that reformulates 3D-VG tasks as a generative 2D-to-3D reconstruction paradigm operating directly on raw RGB-D streams. Specifically, guided by a specialized 3D-VG skill, our VLM agent dynamically invokes visual tools to track and reconstruct the target across 2D frames. Crucially, to overcome the multi-view coverage deficit caused by strict VLM semantic tracking, we introduce the Semantic-Anchored Geometric Expansion, a mechanism that first anchors the target in a reference video clip and then leverages multi-view geometry to propagate its spatial location across unobserved frames. This enables the agent to ""Build"" the target's 3D representation by aggregating these multi-view features via camera parameters, directly mapping 2D visual cues to 3D coordinates. Furthermore, to ensure rigorous assessment, we identify flaws such as reference ambiguity and category errors in existing benchmarks and manually refine the incorrect queries. Extensive experiments on ScanRefer and Nr3D demonstrate that our framework, relying entirely on open-source models, significantly outperforms previous zero-shot methods and even surpasses fully supervised baselines.",https://arxiv.org/pdf/2604.00528v1,,False
