Title,Publication Date,Author(s),Abstract,Link,DOI,Relevant
Multi-Task Bayesian In-Context Learning,18/06/2026,"Qingyang Zhu, Eric Karl Oermann, Kyunghyun Cho","Bayesian predictive inference provides a principled framework for uncertainty quantification, data efficiency, and robust generalization. However, exact inference is often intractable, and scalable approximations may remain computationally expensive or require restrictive modeling assumptions that degrade predictive performance. Prior-Data Fitted and in-context models have recently emerged as an amortized alternative by learning to map datasets directly to predictive distributions, but existing approaches are tightly coupled to the support of the training prior and lack explicit mechanisms for adapting to new priors at test time, resulting in limited robustness under distribution shift. We introduce a multi-task in-context learning framework for amortized hierarchical Bayesian predictive inference that explicitly represents prior information as a prefix of in-context datasets. A transformer trained on sequences of prior and target tasks learns to adapt its predictions across families of priors. On a suite of evaluations with increasing difficulty, including out-of-meta-distribution priors and priors with high-dimensional latent structures, our method matches oracle Bayesian predictors while being orders of magnitude faster. We further demonstrate its practical relevance on a real-world spatiotemporal temperature prediction benchmark. Code is available at https://github.com/martianmartina/multi-task-bayesian-icl/.",https://arxiv.org/pdf/2606.20538v1,,False
Entropy Estimation in Multi-Qutrit Systems via Variational and Classical Neural Networks,18/06/2026,"Sai Sakunthala Guddanti, Anil Prabhakar, Ria Rushin Joseph","We present a systematic study of von Neumann entropy estimation in multi-qutrit quantum systems using two complementary approaches: variational quantum algorithms (VQAs) and classical convolutional neural networks (CNNs), evaluated using an ideal (noise-free) quantum simulator. For systems up to three qutrits, we construct and evaluate 11 hardware-efficient SU(3)-inspired ansatzes. A parameter sweep shows that estimation accuracy is primarily determined by the number of trainable parameters, provided sufficient entanglement is present. Based on this study, we fix the parameter count to approximately 120 for subsequent experiments, observing that increasing entangling-gate counts beyond a threshold yields only marginal improvements. For larger systems (two to five qutrits), we use a CNN trained on measurement outcomes from tensor-product mutually unbiased bases. The model achieves accurate and stable predictions and exhibits a systematic improvement in performance with system size, with the highest errors for two-qutrit systems and the lowest for five-qutrit systems. Notably, using only 12.5% of the measurements required for full state tomography is sufficient to reach 90th-percentile absolute errors of approximately 0.13-0.16 nats for both four- and five-qutrit systems. The CNN model is also robust to shot noise and generalizes well to out-of-distribution states. Overall, within the simulated settings studied here, our results indicate a transition in practical methods: VQAs are effective for small systems, while CNN-based estimators offer improved scalability and robustness for larger qutrit systems.",https://arxiv.org/pdf/2606.20504v1,,False
Thermodynamic Measure of Intelligence,18/06/2026,Ishanu Chattopadhyay,"Can intelligence be measured? We propose that intelligence can be defined as the lawful amplification of rare but valid futures: a system increases the probability of outcomes that would be unlikely under passive dynamics but remain admissible under the constraints of the domain. We start with the premise that an intelligent system must model the world and its own place within it. Because the system is part of the world it models, this leads naturally to recursive self-simulation: the system represents futures in which its own actions are part of the trajectory. Our central results give a necessity statement and a conditional near-sufficiency statement connecting this architecture to a precise thermodynamic measure of lawful amplification of rare-valid futures: high rare-valid lift is impossible unless the internal simulation identifies rare-valid futures with high fidelity; conversely, when rare-valid fidelity is high and the simulation contains an effective policy, the achievable lift approaches the actuation-limited optimum. Thus recursive self-simulation is not merely a plausible feature of intelligence but, under the stated assumptions, is necessary and nearly sufficient for high thermodynamic intelligence. The resulting framework makes intelligence measurable on a universal scale, from passive matter and feedback controllers, large language models, and humans as text generators to Maxwell-demon-like information engines.",https://arxiv.org/pdf/2606.20231v1,,False
FlowMaps: Modeling Long-Term Multimodal Object Dynamics with Flow Matching,18/06/2026,"Francesco Argenziano, Miguel Saavedra-Ruiz, Sacha Morin, Charlie Gauthier, Daniele Nardi, Liam Paull","Joint spatial and temporal understanding of 3D scenes is a crucial requirement for robots deployed in everyday household environments. Such agents must not only comprehend and navigate spatial layouts, but also reason about how these spaces evolve over time. In particular, humans interact with objects daily, causing them to change position throughout the environment and making it difficult for robots to reliably associate current observations with previously seen objects. However, these interactions are not random: human habits and routines induce spatio-temporally consistent patterns in object locations, which robotic agents can potentially learn and then exploit for downstream tasks such as navigation. To this end, we introduce FlowMaps, a latent flow matching model for estimating multimodal distributions over the future locations of dynamic objects in a continuous 3D space. By learning the implicit dependencies among objects and their temporal evolution, FlowMaps predicts likely changes in object locations conditioned on past human interactions, while supporting generalization across previously unseen environments that share similar object routines. To demonstrate the utility of this method, we deploy FlowMaps in a downstream dynamic Object Navigation task in both simulated and real-world environments. Across more than 600 episodes, FlowMaps outperforms state-of-the-art approaches, showing that modeling object dynamics through continuous, multimodal spatio-temporal distributions improves robotic search and navigation in changing household environments. Code and additional material is available at https://fra-tsuna.github.io/flowmaps/.",https://arxiv.org/pdf/2606.20209v1,,False
"MedRLM: Recursive Multimodal Health Intelligence for Long-Context Clinical Reasoning, Sensor-Guided Screening, Evidence-Grounded Decision Support, and Community-to-Tertiary Referral Optimization",18/06/2026,Aueaphum Aueawatthanaphisut,"Real-world clinical decision support requires reasoning over heterogeneous and longitudinal patient information rather than answering isolated medical questions. However, current medical large language models and retrieval-augmented generation systems often rely on single-step prompting or retrieval, which can be fragile when clinical evidence is distributed across long electronic health records, medical images, sensor streams, guidelines, and referral constraints. This paper proposes MedRLM, a Recursive Multimodal Health Intelligence framework for long-context clinical reasoning, sensor-guided screening, and community-to-tertiary referral support. Instead of compressing all patient information into one prompt, MedRLM treats the patient case as an external clinical environment that can be recursively inspected, decomposed, retrieved, verified, and synthesized. The framework coordinates specialized agents for clinical text, longitudinal EHR, medical imaging, physiological sensor signals, guideline retrieval, uncertainty auditing, and referral planning. It further introduces a Clinical Evidence Graph Memory to connect patient-specific observations with retrieved evidence, standardized definitions, sensor-derived biomarkers, and referral criteria. A sensor-guided recursive triggering mechanism activates deeper reasoning when abnormal physiological or behavioral patterns are detected, while uncertainty-gated refinement supports clinician review for high-risk or low-confidence cases. We also outline a real-data evaluation design using public and credentialed clinical datasets spanning EHR, radiology, ECG, ICU time series, and referral-proxy outcomes. MedRLM aims to move medical AI from static question answering toward auditable, multimodal, and workflow-aware clinical decision support.",https://arxiv.org/pdf/2606.20164v1,,False
Frequency-Aware Flow Matching for Continuous and Consistent Robotic Action Generation,18/06/2026,"Jianing Guo, Fangzheng Chen, Zihao Mao, Wong Lik Hang Kenny, Zhenhong Wu, Yu Li, Yishuai Cai, Yuanpei Chen, Yikun Ban, Kai Chen, Qi Dou, Yaodong Yang, Xianglong Liu, Huijie Zhao, Simin Li","Flow matching has emerged as a standard paradigm for robotic manipulation owing to its strong expressive power for modelling complex, multimodal action distributions, alongside similar approaches like diffusion policy. However, existing methods rely on discretized action chunks, making them brittle to demonstrations collected at heterogeneous control frequencies and prone to temporally inconsistent actions that degrade control stability. In this paper, we propose Frequency-Aware Flow Matching (FAFM), which outputs continuous, temporally consistent actions. To handle heterogeneous frequency input, we transform discrete action sequences into the frequency domain with the discrete cosine transform (DCT), perform flow matching over the resulting coefficients, and reconstruct continuous actions via cosine basis expansion. To generate temporally consistent actions, we regularize the first-order temporal derivative to promote smooth actions. This corresponds to a Sobolev-type constraint that suppresses high-frequency errors and discourages abrupt action changes. Our FAFM is simple, introduces no additional network parameters and applies to standalone flow-matching policies and vision-language action models. Across synthetic toy benchmark, obstacle avoidance, LapGym, and LIBERO, FAFM improves success rates, multimodal expressivity, motion smoothness, convergence speed, robustness to mechanical bias and mixed-frequency input. These gains are consistent when deployed on a real-world Franka robot. Code available at https://anonymous.4open.science/r/FAFM.",https://arxiv.org/pdf/2606.20135v1,,False
Variable-Length Tokenization via Learnable Global Merging for Diffusion Transformers,18/06/2026,"Dong Hoon Lee, Seunghoon Hong","Latent Diffusion Models (LDMs) have become dominant in visual synthesis, but their quality-compute trade-off is largely constrained by the tokenizer's fixed compression ratio. Variable-length tokenizers (VLTs) promise adaptive compression by varying token counts, allowing diffusion models to flexibly balance quality and compute. However, conventional VLTs modulate length by truncating ordered token sequences, which makes token semantics depend on token position and breaks representational alignment across lengths. This leads to a cross-length shift in the latent distribution that hinders a single variable-length diffusion model from operating effectively. To address this, we propose a novel variable-length tokenizer that modulates length by merging tokens. We show that encouraging similar tokens to merge enables direct cross-length representation alignment when the diffusion transformer operates according to the merging pattern. Since conventional merging methods are data-dependent, making the merging pattern inaccessible during generation, we introduce learnable global merging, which is data-independent, to ensure compatibility with diffusion transformers. On ImageNet 256$\times$256 generation, our merging-based variable-length tokenizer integrated with a diffusion transformer achieves a superior gFID-compute trade-off compared to prior VLT methods. Code is available at [this https URL](https://github.com/movinghoon/lgm)",https://arxiv.org/pdf/2606.20076v1,,False
Connect the Dots: Training LLMs for Long-Lifecycle Agents with Cross-Domain Generalization Via Reinforcement Learning,18/06/2026,"Yanxi Chen, Weijie Shi, Yuexiang Xie, Boyi Hu, Yaliang Li, Bolin Ding, Jingren Zhou","This work presents a general framework for training large language models (LLMs) to ""Connect the Dots"" (CoD), a meta-capability required by long-lifecycle agents: as an LLM-based AI agent gets deployed in an environment, it solves a long sequence of tasks while continuously exploring the environment, learning from its own experiences, and iteratively self-updating its context about the environment, thereby achieving progressively better performance on future tasks conditioned on the updated context. Major components of the CoD framework include: (1) algorithm design and infrastructure for end-to-end reinforcement learning (RL) with long rollout sequences interleaving solve-task and update-context episodes; (2) tasks and environments for incentivizing and eliciting the targeted meta-capability in LLMs during training, as well as for faithfully measuring progress during evaluation. We present proof-of-concept implementations of the CoD framework, including a GRPO-style RL algorithm with fine-grained credit assignment, as well as tasks and environments tailored to the targeted meta-capability (rather than domain-specific LLM capabilities or standard task-by-task RL). Empirical results validate the efficacy of end-to-end RL training in the CoD setting, and demonstrate the potential for out-of-distribution generalization -- within the training domains, across different domains, and from CoD to Ralph-loop settings -- of the elicited meta-capability. Our investigation of CoD connects several lines of prior works, and opens up new opportunities for advancing LLMs and AI agents. To facilitate further research and applications, we release our implementations at \url{https://github.com/agentscope-ai/Trinity-RFT/tree/research/cod/examples/research_cod}.",https://arxiv.org/pdf/2606.20002v1,,False
Semantic-Anchored Evidential Fusion for Domain-Robust Whole-Slide Survival Analysis,18/06/2026,"Yucheng Xing, Ling Huang, Pei Liu, Jingying Ma, Jiaqing Xu, Kai He, Mengling Feng","Whole-slide images (WSIs) are widely used for computational cancer prognosis. However, most existing methods primarily focus on in-domain performance and fail to generalize across clinical centers. This limitation stems from their reliance on pixel-derived representations that are highly susceptible to domain-specific artifacts caused by staining protocols and scanner hardware. We hypothesize that high-level pathology semantics, such as tumor grade and micro-environmental architecture, provide a domain-invariant semantic representation that mirrors the robust diagnostic logic of human pathologists. Therefore, we propose a Semantic-Anchored Evidential Fusion Survival (SAEFS) framework, where SAEFS derives semantic anchors from WSIs via Visual Question Answering (VQA), employs a dual-stream WSI evidence extraction architecture, uses Dirichlet-based Subjective Logic to model uncertainty, and fuses semantic and visual evidence through a cautious conjunction rule to avoid overconfident fusion from correlated sources. Trained exclusively on one source domain and evaluated zero-shot across four unseen domains, SAEFS consistently outperforms state-of-the-art models both in prediction accuracy and reliability, improving the average C-index by 10.2%. Quantitative analyses further show that VQA-derived semantic features exhibit significantly lower cross-center divergence than pixel-derived features, highlighting their robustness for cross-center clinical applications.",https://arxiv.org/pdf/2606.19966v1,,False
ADaPT: Token-Level Decoupling for Efficient Large Reasoning Models,18/06/2026,"Tingyun Li, Zishang Jiang, Jinyi Han, Xinyi Wang, Sihang Jiang, Han Xia, Zhaoqian Dai, Shuguang Ma, Fei Yu, Jiaqing Liang, Yanghua Xiao","Large reasoning models rely on long chain-of-thought to achieve strong performance, but applying such reasoning uniformly incurs high computational cost. Existing efficiency-oriented methods attempt to shorten or mix reasoning strategies, yet often degrade reasoning capability. We identify the root cause as sequence-level coupling between efficiency incentives and correctness optimization, which implicitly penalizes long but correct reasoning trajectories. To address this issue, we propose Adaptive Dual-Process Thinking (ADaPT), a token-level dual-process framework that explicitly decouples efficiency and correctness signals during training. ADaPT introduces a mode-selection token to control fast and slow reasoning, applying efficiency-related rewards exclusively to this token to avoid penalizing correct long reasoning while encouraging efficiency when appropriate. Moreover, ADaPT enables precise and continuous control over the efficiency-performance trade-off at inference time: by adjusting the generation probability of the mode-selection token, a single trained model can smoothly move along the efficiency-performance Pareto frontier. Extensive experiments demonstrate that ADaPT significantly reduces inference cost while maintaining strong reasoning performance across multiple benchmarks.",https://arxiv.org/pdf/2606.19919v1,,False
MetaResearcher: Scaling Deep Research via Self-Reflective Reinforcement Learning in Adversarial Virtual Environments,18/06/2026,"Wei Yu, Suxing Liu, Minjie Yu, Jiahao Wang, Zhijian Zheng, Haocheng Deng, Bing Li","Deep research agents have demonstrated remarkable capabilities in autonomous information gathering and synthesis, yet their training remains constrained by the static nature of simulated environments, the limits of fact-retrieval-only task designs, and the inefficiency of outcome-based reinforcement learning. In this work, we propose MetaResearcher, a novel framework that scales deep research agent training across four synergistic dimensions. First, we introduce an Evolving Virtual World that injects temporal dynamics and adversarial misinformation into the training environment, forcing agents to develop source credibility assessment and temporal conflict resolution skills. Second, we design Discovery-Oriented Tasks -- including hypothesis generation and contradiction resolution -- that transcend simple fact retrieval and push agents toward genuine research behaviors. Third, we propose a Self-Reflective Meta-Reward mechanism within the GRPO framework that jointly optimizes for answer correctness, search path efficiency, reflection depth, and tool call diversity, directly addressing the repetitive action loop problem observed in prior work. Fourth, we introduce a Heterogeneous Multi-Agent Swarm architecture comprising specialized Scout, Filter, and Synthesizer models that learn collaborative research strategies through coordinated reinforcement learning. Built upon the LiteResearcher infrastructure, MetaResearcher requires zero marginal API cost for training while targeting substantial improvements in both benchmark performance (GAIA, Xbench-DS) and epistemic robustness under adversarial conditions. We present the complete framework design, training methodology, and planned experimental validation.",https://arxiv.org/pdf/2606.19893v1,,False
SL-S4Wave: Self-Supervised Learning of Physiological Waveforms with Structured State Space Models,18/06/2026,"Feng Wu, Harsh Deep, Eric Lehman, Sanyam Kapoor, Guoshuai Zhao, Rahul Krishnan, Gari Clifford, Li-wei H Lehman","Modeling long-sequence medical time series data, such as electrocardiograms (ECG), poses significant challenges due to high sampling rates, multichannel signal complexity, inherent noise, and limited labeled data. While recent self-supervised learning (SSL) methods, based on various encoder architectures such as convolutional neural networks, have been proposed to learn representations from unlabeled data, they often fall short in capturing long-range dependencies and noise-invariant features. Structured state space models (S4) excel at long-sequence modeling, but existing S4 architectures fail to capture the unique characteristics of multichannel physiological waveforms. In this work, we propose SL-S4Wave, a self-supervised learning framework that combines contrastive learning with a tailored encoder built on structured state space models. The encoder incorporates multi-layer global convolution using multiscale subkernels, enabling the capture of both fine-grained local patterns and long-range temporal dependencies in noisy, high-resolution multichannel waveforms. Extensive experiments on real-world datasets demonstrate that SL-S4Wave (1) consistently outperforms state-of-the-art supervised and self-supervised baselines in a challenging arrhythmia detection task, (2) achieves high performance with significantly fewer labeled examples, showcasing strong label efficiency, and (3) maintains robust performance on long waveform segments, highlighting its capacity to model complex temporal dynamics in long sequences that most existing approaches fail to efficiently model, and (4) transfers effectively to unseen arrhythmia types, underscoring its robust cross-domain generalization. We additionally evaluate SL-S4Wave on multiple EEG tasks, achieving superior performance over strong baselines, demonstrating generalizability of our approach beyond cardiac waveforms.",https://arxiv.org/pdf/2606.19888v1,,False
Leverage Is Not Reach: A Control-Window Law for Single-Neuron Steering in Language Models,18/06/2026,Hongliang Liu,"Aligned language models gate behaviors such as refusal and language routing through sparse feed forward neurons, yet no theory predicts when a single neuron intervention controls a behavior coherently rather than collapsing the output. We develop a budget normalized control window framework for single neuron steering. A dose along one write direction reduces to one control coordinate: the alignment between the residual stream and the write, driven along a universal saturation curve in units of a coherence budget set by the residual norm divided by the write norm. Coherent control exists when a behavior trigger lies below the collapse ceiling. The same coordinate governs benign mode switches and refusal; the ceiling follows from weights and one generic forward pass, while triggers are measured at rollout. On fifteen held out neurons, the predicted ceiling has mean absolute error 0.14, about 0.07 in bulk layers, and the committed open or closed verdict holds on eleven against a ten of fifteen majority baseline. Closed cases expose three failure modes rather than violations: collapse before trigger, too little depth to propagate, or a normalization that caps how far one neuron can push. The law explains why local gradient attribution anti predicts control: true controllers write off the readout axis and carry a near zero first order gradient. A forward only contrastive screen made precise by the window recovers controllers that attribution misses. On refusal, the hardest case, intervention success is typed, not scalar: coherent bypass and strict actionable reach separate, so a neuron can flip refusal in fluent, on task text with no actionable content, and genuine actionable reach appears only for three of six audited Llama pivots and only at later rollout horizons. Single neuron steering is therefore a budgeted, typed audit of controllability rather than a fixed dose anecdote.",https://arxiv.org/pdf/2606.19831v1,,False
TelcoAgent: A Scalable 5G Multi-KPM Forecasting With 3GPP-Grounded Explainability,18/06/2026,"Geon Kim, Dara Ron, Sukhdeep Singh, Suyog Moogi, Pranshav Gajjar, V V N K Someswara Rao Koduri, Een Kee Hong, Vijay K. Shah","Key Performance Measurement (KPM) forecasting is essential for proactive network management of 5G and next-generation telecom networks. However, existing machine learning (ML) approaches face significant limitations in scalability and explainability, restricting their effectiveness in real-world deployments. We propose TelcoAgent, a foundation model-based framework that enables accurate, scalable, and explainable forecasting of multiple KPMs across diverse network cells without the need for site-specific training. Specifically, the framework comprises three key components: (i) an automated three-agent pipeline that constructs a 3rd Generation Partnership Project (3GPP) knowledge graph directly from specification documents, (ii) a scalable, time-series foundation model (TSFM)-based prediction pipeline to deliver accurate, zero-shot forecasting, and finally (iii) a reasoning and explanation pipeline that provides actionable, domain-grounded diagnostics. Evaluated using a 3-month, real-world, city-scale 5G KPM dataset from a U.S.-based network operator, TelcoAgent demonstrates high forecasting accuracy for all 7 considered KPMs per cell across 200 cells, while delivering explainable insights and actionable instructions to address network degradations.",https://arxiv.org/pdf/2606.19821v1,,False
