Title,Publication Date,Author(s),Abstract,Link,DOI,Relevant
Automatic Curriculum Learning for Driving Scenarios: Towards Robust and Efficient Reinforcement Learning,13/05/2025,"Ahmed Abouelazm, Tim Weinstein, Tim Joseph, Philip Schörner, J. Marius Zöllner","This paper addresses the challenges of training end-to-end autonomous driving
agents using Reinforcement Learning (RL). RL agents are typically trained in a
fixed set of scenarios and nominal behavior of surrounding road users in
simulations, limiting their generalization and real-life deployment. While
domain randomization offers a potential solution by randomly sampling driving
scenarios, it frequently results in inefficient training and sub-optimal
policies due to the high variance among training scenarios. To address these
limitations, we propose an automatic curriculum learning framework that
dynamically generates driving scenarios with adaptive complexity based on the
agent's evolving capabilities. Unlike manually designed curricula that
introduce expert bias and lack scalability, our framework incorporates a
``teacher'' that automatically generates and mutates driving scenarios based on
their learning potential -- an agent-centric metric derived from the agent's
current policy -- eliminating the need for expert design. The framework
enhances training efficiency by excluding scenarios the agent has mastered or
finds too challenging. We evaluate our framework in a reinforcement learning
setting where the agent learns a driving policy from camera images. Comparative
results against baseline methods, including fixed scenario training and domain
randomization, demonstrate that our approach leads to enhanced generalization,
achieving higher success rates: +9\% in low traffic density, +21\% in high
traffic density, and faster convergence with fewer training steps. Our findings
highlight the potential of ACL in improving the robustness and efficiency of
RL-based autonomous driving agents.",http://arxiv.org/pdf/2505.08264v1,,False
Object detection in adverse weather conditions for autonomous vehicles using Instruct Pix2Pix,13/05/2025,"Unai Gurbindo, Axel Brando, Jaume Abella, Caroline König","Enhancing the robustness of object detection systems under adverse weather
conditions is crucial for the advancement of autonomous driving technology.
This study presents a novel approach leveraging the diffusion model Instruct
Pix2Pix to develop prompting methodologies that generate realistic datasets
with weather-based augmentations aiming to mitigate the impact of adverse
weather on the perception capabilities of state-of-the-art object detection
models, including Faster R-CNN and YOLOv10. Experiments were conducted in two
environments, in the CARLA simulator where an initial evaluation of the
proposed data augmentation was provided, and then on the real-world image data
sets BDD100K and ACDC demonstrating the effectiveness of the approach in real
environments.
  The key contributions of this work are twofold: (1) identifying and
quantifying the performance gap in object detection models under challenging
weather conditions, and (2) demonstrating how tailored data augmentation
strategies can significantly enhance the robustness of these models. This
research establishes a solid foundation for improving the reliability of
perception systems in demanding environmental scenarios, and provides a pathway
for future advancements in autonomous driving.",http://arxiv.org/pdf/2505.08228v1,,False
An Effective Flow-based Method for Positive-Unlabeled Learning: 2-HNC,13/05/2025,"Dorit Hochbaum, Torpong Nitayanont","In many scenarios of binary classification, only positive instances are
provided in the training data, leaving the rest of the data unlabeled. This
setup, known as positive-unlabeled (PU) learning, is addressed here with a
network flow-based method which utilizes pairwise similarities between samples.
The method we propose here, 2-HNC, leverages Hochbaum's Normalized Cut (HNC)
and the set of solutions it provides by solving a parametric minimum cut
problem. The set of solutions, that are nested partitions of the samples into
two sets, correspond to varying tradeoff values between the two goals: high
intra-similarity inside the sets and low inter-similarity between the two sets.
This nested sequence is utilized here to deliver a ranking of unlabeled samples
by their likelihood of being negative. Building on this insight, our method,
2-HNC, proceeds in two stages. The first stage generates this ranking without
assuming any negative labels, using a problem formulation that is constrained
only on positive labeled samples. The second stage augments the positive set
with likely-negative samples and recomputes the classification. The final label
prediction selects among all generated partitions in both stages, the one that
delivers a positive class proportion, closest to a prior estimate of this
quantity, which is assumed to be given. Extensive experiments across synthetic
and real datasets show that 2-HNC yields strong performance and often surpasses
existing state-of-the-art algorithms.",http://arxiv.org/pdf/2505.08212v1,,False
A Multi-scale Representation Learning Framework for Long-Term Time Series Forecasting,13/05/2025,"Boshi Gao, Qingjian Ni, Fanbo Ju, Yu Chen, Ziqi Zhao","Long-term time series forecasting (LTSF) offers broad utility in practical
settings like energy consumption and weather prediction. Accurately predicting
long-term changes, however, is demanding due to the intricate temporal patterns
and inherent multi-scale variations within time series. This work confronts key
issues in LTSF, including the suboptimal use of multi-granularity information,
the neglect of channel-specific attributes, and the unique nature of trend and
seasonal components, by introducing a proficient MLP-based forecasting
framework. Our method adeptly disentangles complex temporal dynamics using
clear, concurrent predictions across various scales. These multi-scale
forecasts are then skillfully integrated through a system that dynamically
assigns importance to information from different granularities, sensitive to
individual channel characteristics. To manage the specific features of temporal
patterns, a two-pronged structure is utilized to model trend and seasonal
elements independently. Experimental results on eight LTSF benchmarks
demonstrate that MDMixer improves average MAE performance by 4.64% compared to
the recent state-of-the-art MLP-based method (TimeMixer), while achieving an
effective balance between training efficiency and model interpretability.",http://arxiv.org/pdf/2505.08199v1,,False
Aitomia: Your Intelligent Assistant for AI-Driven Atomistic and Quantum Chemical Simulations,13/05/2025,"Jinming Hu, Hassan Nawaz, Yuting Rui, Lijie Chi, Arif Ullah, Pavlo O. Dral","We have developed Aitomia - a platform powered by AI to assist in performing
AI-driven atomistic and quantum chemical (QC) simulations. This intelligent
assistant platform is equipped with chatbots and AI agents to help experts and
guide non-experts in setting up and running the atomistic simulations,
monitoring their computation status, analyzing the simulation results, and
summarizing them for the user in text and graphical forms. We achieve these
goals by exploiting fine-tuned open-source large language models (LLMs),
rule-based agents, and a retrieval-augmented generation (RAG) system. Aitomia
leverages the versatility of our MLatom ecosystem for AI-enhanced computational
chemistry. This intelligent assistant is going to be integrated into the
Aitomistic Hub and XACS online computing services, with some functionality
already publicly available as described at http://mlatom.com/aitomia. Aitomia
is expected to lower the barrier to performing atomistic simulations,
accelerating research and development in the relevant fields.",http://arxiv.org/pdf/2505.08195v1,,False
Foundation Models Knowledge Distillation For Battery Capacity Degradation Forecast,13/05/2025,"Joey Chan, Zhen Chen, Ershun Pan","Accurate estimation of lithium-ion battery capacity degradation is critical
for enhancing the reliability and safety of battery operations. Traditional
expert models, tailored to specific scenarios, provide isolated estimations.
With the rapid advancement of data-driven techniques, a series of
general-purpose time-series foundation models have been developed. However,
foundation models specifically designed for battery capacity degradation remain
largely unexplored. To enable zero-shot generalization in battery degradation
prediction using large model technology, this study proposes a
degradation-aware fine-tuning strategy for time-series foundation models. We
apply this strategy to fine-tune the Timer model on approximately 10 GB of
open-source battery charge discharge data. Validation on our released
CycleLife-SJTUIE dataset demonstrates that the fine-tuned Battery-Timer
possesses strong zero-shot generalization capability in capacity degradation
forecasting. To address the computational challenges of deploying large models,
we further propose a knowledge distillation framework that transfers the
knowledge of pre-trained foundation models into compact expert models.
Distillation results across several state-of-the-art time-series expert models
confirm that foundation model knowledge significantly improves the
multi-condition generalization of expert models.",http://arxiv.org/pdf/2505.08151v1,,False
Beyond Basic A/B testing: Improving Statistical Efficiency for Business Growth,13/05/2025,"Changshuai Wei, Phuc Nguyen, Benjamin Zelditch, Joyce Chen","The standard A/B testing approaches are mostly based on t-test in large scale
industry applications. These standard approaches however suffers from low
statistical power in business settings, due to nature of small sample-size or
non-Gaussian distribution or return-on-investment (ROI) consideration. In this
paper, we propose several approaches to addresses these challenges: (i)
regression adjustment, generalized estimating equation, Man-Whitney U and
Zero-Trimmed U that addresses each of these issues separately, and (ii) a novel
doubly robust generalized U that handles ROI consideration, distribution
robustness and small samples in one framework. We provide theoretical results
on asymptotic normality and efficiency bounds, together with insights on the
efficiency gain from theoretical analysis. We further conduct comprehensive
simulation studies and apply the methods to multiple real A/B tests.",http://arxiv.org/pdf/2505.08128v1,,False
