Title,Publication Date,Author(s),Abstract,Link,DOI,Relevant
Optimizing Electric Vehicles Charging using Large Language Models and Graph Neural Networks,05/02/2025,"Stavros Orfanoudakis, Peter Palensky, Pedro P. Vergara","Maintaining grid stability amid widespread electric vehicle (EV) adoption is
vital for sustainable transportation. Traditional optimization methods and
Reinforcement Learning (RL) approaches often struggle with the high
dimensionality and dynamic nature of real-time EV charging, leading to
sub-optimal solutions. To address these challenges, this study demonstrates
that combining Large Language Models (LLMs), for sequence modeling, with Graph
Neural Networks (GNNs), for relational information extraction, not only
outperforms conventional EV smart charging methods, but also paves the way for
entirely new research directions and innovative solutions.",http://arxiv.org/pdf/2502.03067v1,,False
Understanding and Enhancing the Transferability of Jailbreaking Attacks,05/02/2025,"Runqi Lin, Bo Han, Fengwang Li, Tongling Liu","Jailbreaking attacks can effectively manipulate open-source large language
models (LLMs) to produce harmful responses. However, these attacks exhibit
limited transferability, failing to disrupt proprietary LLMs consistently. To
reliably identify vulnerabilities in proprietary LLMs, this work investigates
the transferability of jailbreaking attacks by analysing their impact on the
model's intent perception. By incorporating adversarial sequences, these
attacks can redirect the source LLM's focus away from malicious-intent tokens
in the original input, thereby obstructing the model's intent recognition and
eliciting harmful responses. Nevertheless, these adversarial sequences fail to
mislead the target LLM's intent perception, allowing the target LLM to refocus
on malicious-intent tokens and abstain from responding. Our analysis further
reveals the inherent distributional dependency within the generated adversarial
sequences, whose effectiveness stems from overfitting the source LLM's
parameters, resulting in limited transferability to target LLMs. To this end,
we propose the Perceived-importance Flatten (PiF) method, which uniformly
disperses the model's focus across neutral-intent tokens in the original input,
thus obscuring malicious-intent tokens without relying on overfitted
adversarial sequences. Extensive experiments demonstrate that PiF provides an
effective and efficient red-teaming evaluation for proprietary LLMs.",http://arxiv.org/pdf/2502.03052v1,,False
Large Language Models Are Universal Recommendation Learners,05/02/2025,"Junguang Jiang, Yanwen Huang, Bin Liu, Xiaoyu Kong, Ziru Xu, Han Zhu, Jian Xu, Bo Zheng","In real-world recommender systems, different tasks are typically addressed
using supervised learning on task-specific datasets with carefully designed
model architectures. We demonstrate that large language models (LLMs) can
function as universal recommendation learners, capable of handling multiple
tasks within a unified input-output framework, eliminating the need for
specialized model designs. To improve the recommendation performance of LLMs,
we introduce a multimodal fusion module for item representation and a
sequence-in-set-out approach for efficient candidate generation. When applied
to industrial-scale data, our LLM achieves competitive results with expert
models elaborately designed for different recommendation tasks. Furthermore,
our analysis reveals that recommendation outcomes are highly sensitive to text
input, highlighting the potential of prompt engineering in optimizing
industrial-scale recommender systems.",http://arxiv.org/pdf/2502.03041v1,,False
"Label Anything: An Interpretable, High-Fidelity and Prompt-Free Annotator",05/02/2025,"Wei-Bin Kou, Guangxu Zhu, Rongguang Ye, Shuai Wang, Ming Tang, Yik-Chung Wu","Learning-based street scene semantic understanding in autonomous driving (AD)
has advanced significantly recently, but the performance of the AD model is
heavily dependent on the quantity and quality of the annotated training data.
However, traditional manual labeling involves high cost to annotate the vast
amount of required data for training robust model. To mitigate this cost of
manual labeling, we propose a Label Anything Model (denoted as LAM), serving as
an interpretable, high-fidelity, and prompt-free data annotator. Specifically,
we firstly incorporate a pretrained Vision Transformer (ViT) to extract the
latent features. On top of ViT, we propose a semantic class adapter (SCA) and
an optimization-oriented unrolling algorithm (OptOU), both with a quite small
number of trainable parameters. SCA is proposed to fuse ViT-extracted features
to consolidate the basis of the subsequent automatic annotation. OptOU consists
of multiple cascading layers and each layer contains an optimization
formulation to align its output with the ground truth as closely as possible,
though which OptOU acts as being interpretable rather than learning-based
blackbox nature. In addition, training SCA and OptOU requires only a single
pre-annotated RGB seed image, owing to their small volume of learnable
parameters. Extensive experiments clearly demonstrate that the proposed LAM can
generate high-fidelity annotations (almost 100% in mIoU) for multiple
real-world datasets (i.e., Camvid, Cityscapes, and Apolloscapes) and CARLA
simulation dataset.",http://arxiv.org/pdf/2502.02972v1,,False
LLM-KT: Aligning Large Language Models with Knowledge Tracing using a Plug-and-Play Instruction,05/02/2025,"Ziwei Wang, Jie Zhou, Qin Chen, Min Zhang, Bo Jiang, Aimin Zhou, Qinchun Bai, Liang He","The knowledge tracing (KT) problem is an extremely important topic in
personalized education, which aims to predict whether students can correctly
answer the next question based on their past question-answer records. Prior
work on this task mainly focused on learning the sequence of behaviors based on
the IDs or textual information. However, these studies usually fail to capture
students' sufficient behavioral patterns without reasoning with rich world
knowledge about questions. In this paper, we propose a large language models
(LLMs)-based framework for KT, named \texttt{\textbf{LLM-KT}}, to integrate the
strengths of LLMs and traditional sequence interaction models. For task-level
alignment, we design Plug-and-Play instruction to align LLMs with KT,
leveraging LLMs' rich knowledge and powerful reasoning capacity. For
modality-level alignment, we design the plug-in context and sequence to
integrate multiple modalities learned by traditional methods. To capture the
long context of history records, we present a plug-in context to flexibly
insert the compressed context embedding into LLMs using question-specific and
concept-specific tokens. Furthermore, we introduce a plug-in sequence to
enhance LLMs with sequence interaction behavior representation learned by
traditional sequence models using a sequence adapter. Extensive experiments
show that \texttt{\textbf{LLM-KT}} obtains state-of-the-art performance on four
typical datasets by comparing it with approximately 20 strong baselines.",http://arxiv.org/pdf/2502.02945v1,,False
MobiCLR: Mobility Time Series Contrastive Learning for Urban Region Representations,05/02/2025,"Namwoo Kim, Takahiro Yabe, Chanyoung Park, Yoonjin Yoon","Recently, learning effective representations of urban regions has gained
significant attention as a key approach to understanding urban dynamics and
advancing smarter cities. Existing approaches have demonstrated the potential
of leveraging mobility data to generate latent representations, providing
valuable insights into the intrinsic characteristics of urban areas. However,
incorporating the temporal dynamics and detailed semantics inherent in human
mobility patterns remains underexplored. To address this gap, we propose a
novel urban region representation learning model, Mobility Time Series
Contrastive Learning for Urban Region Representations (MobiCLR), designed to
capture semantically meaningful embeddings from inflow and outflow mobility
patterns. MobiCLR uses contrastive learning to enhance the discriminative power
of its representations, applying an instance-wise contrastive loss to capture
distinct flow-specific characteristics. Additionally, we develop a regularizer
to align output features with these flow-specific representations, enabling a
more comprehensive understanding of mobility dynamics. To validate our model,
we conduct extensive experiments in Chicago, New York, and Washington, D.C. to
predict income, educational attainment, and social vulnerability. The results
demonstrate that our model outperforms state-of-the-art models.",http://arxiv.org/pdf/2502.02912v1,,False
Policy Abstraction and Nash Refinement in Tree-Exploiting PSRO,05/02/2025,"Christine Konicki, Mithun Chakraborty, Michael P. Wellman","Policy Space Response Oracles (PSRO) interleaves empirical game-theoretic
analysis with deep reinforcement learning (DRL) to solve games too complex for
traditional analytic methods. Tree-exploiting PSRO (TE-PSRO) is a variant of
this approach that iteratively builds a coarsened empirical game model in
extensive form using data obtained from querying a simulator that represents a
detailed description of the game. We make two main methodological advances to
TE-PSRO that enhance its applicability to complex games of imperfect
information. First, we introduce a scalable representation for the empirical
game tree where edges correspond to implicit policies learned through DRL.
These policies cover conditions in the underlying game abstracted in the game
model, supporting sustainable growth of the tree over epochs. Second, we
leverage extensive form in the empirical model by employing refined Nash
equilibria to direct strategy exploration. To enable this, we give a modular
and scalable algorithm based on generalized backward induction for computing a
subgame perfect equilibrium (SPE) in an imperfect-information game. We
experimentally evaluate our approach on a suite of games including an
alternating-offer bargaining game with outside offers; our results demonstrate
that TE-PSRO converges toward equilibrium faster when new strategies are
generated based on SPE rather than Nash equilibrium, and with reasonable
time/memory requirements for the growing empirical model.",http://arxiv.org/pdf/2502.02901v1,,False
