Title,Publication Date,Author(s),Abstract,Link,DOI,Relevant
Astra: General Interactive World Model with Autoregressive Denoising,09/12/2025,"Yixuan Zhu, Jiaqi Feng, Wenzhao Zheng, Yuan Gao, Xin Tao, Pengfei Wan, Jie Zhou, Jiwen Lu","Recent advances in diffusion transformers have empowered video generation models to generate high-quality video clips from texts or images. However, world models with the ability to predict long-horizon futures from past observations and actions remain underexplored, especially for general-purpose scenarios and various forms of actions. To bridge this gap, we introduce Astra, an interactive general world model that generates real-world futures for diverse scenarios (e.g., autonomous driving, robot grasping) with precise action interactions (e.g., camera motion, robot action). We propose an autoregressive denoising architecture and use temporal causal attention to aggregate past observations and support streaming outputs. We use a noise-augmented history memory to avoid over-reliance on past frames to balance responsiveness with temporal coherence. For precise action control, we introduce an action-aware adapter that directly injects action signals into the denoising process. We further develop a mixture of action experts that dynamically route heterogeneous action modalities, enhancing versatility across diverse real-world tasks such as exploration, manipulation, and camera control. Astra achieves interactive, consistent, and general long-term video prediction and supports various forms of interactions. Experiments across multiple datasets demonstrate the improvements of Astra in fidelity, long-range prediction, and action alignment over existing state-of-the-art world models.",https://arxiv.org/pdf/2512.08931v1,,False
Open Polymer Challenge: Post-Competition Report,09/12/2025,"Gang Liu, Sobin Alosious, Subhamoy Mahajan, Eric Inae, Yihan Zhu, Yuhan Liu, Renzheng Zhang, Jiaxin Xu, Addison Howard, Ying Li, Tengfei Luo, Meng Jiang","Machine learning (ML) offers a powerful path toward discovering sustainable polymer materials, but progress has been limited by the lack of large, high-quality, and openly accessible polymer datasets. The Open Polymer Challenge (OPC) addresses this gap by releasing the first community-developed benchmark for polymer informatics, featuring a dataset with 10K polymers and 5 properties: thermal conductivity, radius of gyration, density, fractional free volume, and glass transition temperature. The challenge centers on multi-task polymer property prediction, a core step in virtual screening pipelines for materials discovery. Participants developed models under realistic constraints that include small data, label imbalance, and heterogeneous simulation sources, using techniques such as feature-based augmentation, transfer learning, self-supervised pretraining, and targeted ensemble strategies. The competition also revealed important lessons about data preparation, distribution shifts, and cross-group simulation consistency, informing best practices for future large-scale polymer datasets. The resulting models, analysis, and released data create a new foundation for molecular AI in polymer science and are expected to accelerate the development of sustainable and energy-efficient materials. Along with the competition, we release the test dataset at https://www.kaggle.com/datasets/alexliu99/neurips-open-polymer-prediction-2025-test-data. We also release the data generation pipeline at https://github.com/sobinalosious/ADEPT, which simulates more than 25 properties, including thermal conductivity, radius of gyration, and density.",https://arxiv.org/pdf/2512.08896v1,,False
Explainable Anomaly Detection for Industrial IoT Data Streams,09/12/2025,"Ana Rita Paupério, Diogo Risca, Afonso Lourenço, Goreti Marreiros, Ricardo Martins","Industrial maintenance is being transformed by the Internet of Things and edge computing, generating continuous data streams that demand real-time, adaptive decision-making under limited computational resources. While data stream mining (DSM) addresses this challenge, most methods assume fully supervised settings, yet in practice, ground-truth labels are often delayed or unavailable. This paper presents a collaborative DSM framework that integrates unsupervised anomaly detection with interactive, human-in-the-loop learning to support maintenance decisions. We employ an online Isolation Forest and enhance interpretability using incremental Partial Dependence Plots and a feature importance score, derived from deviations of Individual Conditional Expectation curves from a fading average, enabling users to dynamically reassess feature relevance and adjust anomaly thresholds. We describe the real-time implementation and provide initial results for fault detection in a Jacquard loom unit. Ongoing work targets continuous monitoring to predict and explain imminent bearing failures.",https://arxiv.org/pdf/2512.08885v1,10.1145/3748522.3780009,False
When Tables Leak: Attacking String Memorization in LLM-Based Tabular Data Generation,09/12/2025,"Joshua Ward, Bochao Gu, Chi-Hua Wang, Guang Cheng","Large Language Models (LLMs) have recently demonstrated remarkable performance in generating high-quality tabular synthetic data. In practice, two primary approaches have emerged for adapting LLMs to tabular data generation: (i) fine-tuning smaller models directly on tabular datasets, and (ii) prompting larger models with examples provided in context. In this work, we show that popular implementations from both regimes exhibit a tendency to compromise privacy by reproducing memorized patterns of numeric digits from their training data. To systematically analyze this risk, we introduce a simple No-box Membership Inference Attack (MIA) called LevAtt that assumes adversarial access to only the generated synthetic data and targets the string sequences of numeric digits in synthetic observations. Using this approach, our attack exposes substantial privacy leakage across a wide range of models and datasets, and in some cases, is even a perfect membership classifier on state-of-the-art models. Our findings highlight a unique privacy vulnerability of LLM-based synthetic data generation and the need for effective defenses. To this end, we propose two methods, including a novel sampling strategy that strategically perturbs digits during generation. Our evaluation demonstrates that this approach can defeat these attacks with minimal loss of fidelity and utility of the synthetic data.",https://arxiv.org/pdf/2512.08875v1,,False
Refining Diffusion Models for Motion Synthesis with an Acceleration Loss to Generate Realistic IMU Data,09/12/2025,"Lars Ole Häusler, Lena Uhlenberg, Göran Köber, Diyora Salimova, Oliver Amft","We propose a text-to-IMU (inertial measurement unit) motion-synthesis framework to obtain realistic IMU data by fine-tuning a pretrained diffusion model with an acceleration-based second-order loss (L_acc). L_acc enforces consistency in the discrete second-order temporal differences of the generated motion, thereby aligning the diffusion prior with IMU-specific acceleration patterns. We integrate L_acc into the training objective of an existing diffusion model, finetune the model to obtain an IMU-specific motion prior, and evaluate the model with an existing text-to-IMU framework that comprises surface modelling and virtual sensor simulation. We analysed acceleration signal fidelity and differences between synthetic motion representation and actual IMU recordings. As a downstream application, we evaluated Human Activity Recognition (HAR) and compared the classification performance using data of our method with the earlier diffusion model and two additional diffusion model baselines. When we augmented the earlier diffusion model objective with L_acc and continued training, L_acc decreased by 12.7% relative to the original model. The improvements were considerably larger in high-dynamic activities (i.e., running, jumping) compared to low-dynamic activities~(i.e., sitting, standing). In a low-dimensional embedding, the synthetic IMU data produced by our refined model shifts closer to the distribution of real IMU recordings. HAR classification trained exclusively on our refined synthetic IMU data improved performance by 8.7% compared to the earlier diffusion model and by 7.6% over the best-performing comparison diffusion model. We conclude that acceleration-aware diffusion refinement provides an effective approach to align motion generation and IMU synthesis and highlights how flexible deep learning pipelines are for specialising generic text-to-motion priors to sensor-specific tasks.",https://arxiv.org/pdf/2512.08859v1,,False
Can TabPFN Compete with GNNs for Node Classification via Graph Tabularization?,09/12/2025,"Jeongwhan Choi, Woosung Kang, Minseo Kim, Jongwoo Kim, Noseong Park","Foundation models pretrained on large data have demonstrated remarkable zero-shot generalization capabilities across domains. Building on the success of TabPFN for tabular data and its recent extension to time series, we investigate whether graph node classification can be effectively reformulated as a tabular learning problem. We introduce TabPFN-GN, which transforms graph data into tabular features by extracting node attributes, structural properties, positional encodings, and optionally smoothed neighborhood features. This enables TabPFN to perform direct node classification without any graph-specific training or language model dependencies. Our experiments on 12 benchmark datasets reveal that TabPFN-GN achieves competitive performance with GNNs on homophilous graphs and consistently outperforms them on heterophilous graphs. These results demonstrate that principled feature engineering can bridge the gap between tabular and graph domains, providing a practical alternative to task-specific GNN training and LLM-dependent graph foundation models.",https://arxiv.org/pdf/2512.08798v1,,False
De novo generation of functional terpene synthases using TpsGPT,09/12/2025,"Hamsini Ramanathan, Roman Bushuiev, Matouš Soldát, Jirí Kohout, Téo Hebra, Joshua David Smith, Josef Sivic, Tomáš Pluskal","Terpene synthases (TPS) are a key family of enzymes responsible for generating the diverse terpene scaffolds that underpin many natural products, including front-line anticancer drugs such as Taxol. However, de novo TPS design through directed evolution is costly and slow. We introduce TpsGPT, a generative model for scalable TPS protein design, built by fine-tuning the protein language model ProtGPT2 on 79k TPS sequences mined from UniProt. TpsGPT generated de novo enzyme candidates in silico and we evaluated them using multiple validation metrics, including EnzymeExplorer classification, ESMFold structural confidence (pLDDT), sequence diversity, CLEAN classification, InterPro domain detection, and Foldseek structure alignment. From an initial pool of 28k generated sequences, we identified seven putative TPS enzymes that satisfied all validation criteria. Experimental validation confirmed TPS enzymatic activity in at least two of these sequences. Our results show that fine-tuning of a protein language model on a carefully curated, enzyme-class-specific dataset, combined with rigorous filtering, can enable the de novo generation of functional, evolutionarily distant enzymes.",https://arxiv.org/pdf/2512.08772v1,,False
Data-Driven Dynamic Parameter Learning of manipulator robots,09/12/2025,"Mohammed Elseiagy, Tsige Tadesse Alemayoh, Ranulfo Bezerra, Shotaro Kojima, Kazunori Ohno","Bridging the sim-to-real gap remains a fundamental challenge in robotics, as accurate dynamic parameter estimation is essential for reliable model-based control, realistic simulation, and safe deployment of manipulators. Traditional analytical approaches often fall short when faced with complex robot structures and interactions. Data-driven methods offer a promising alternative, yet conventional neural networks such as recurrent models struggle to capture long-range dependencies critical for accurate estimation. In this study, we propose a Transformer-based approach for dynamic parameter estimation, supported by an automated pipeline that generates diverse robot models and enriched trajectory data using Jacobian-derived features. The dataset consists of 8,192 robots with varied inertial and frictional properties. Leveraging attention mechanisms, our model effectively captures both temporal and spatial dependencies. Experimental results highlight the influence of sequence length, sampling rate, and architecture, with the best configuration (sequence length 64, 64 Hz, four layers, 32 heads) achieving a validation R2 of 0.8633. Mass and inertia are estimated with near-perfect accuracy, Coulomb friction with moderate-to-high accuracy, while viscous friction and distal link center-of-mass remain more challenging. These results demonstrate that combining Transformers with automated dataset generation and kinematic enrichment enables scalable, accurate dynamic parameter estimation, contributing to improved sim-to-real transfer in robotic systems",https://arxiv.org/pdf/2512.08767v1,,False
Performance Comparison of Aerial RIS and STAR-RIS in 3D Wireless Environments,09/12/2025,"Dongdong Yang, Bin Li, Jiguang He","Reconfigurable intelligent surface (RIS) and simultaneously transmitting and reflecting RIS (STAR-RIS) have emerged as key enablers for enhancing wireless coverage and capacity in next-generation networks. When mounted on unmanned aerial vehicles (UAVs), they benefit from flexible deployment and improved line-of-sight conditions. Despite their promising potential, a comprehensive performance comparison between aerial RIS and STAR-RIS architectures has not been thoroughly investigated. This letter presents a detailed performance comparison between aerial RIS and STAR-RIS in three-dimensional wireless environments. Accurate channel models incorporating directional radiation patterns are established, and the influence of deployment altitude and orientation is thoroughly examined. To optimize the system sum-rate, we formulate joint optimization problems for both architectures and propose an efficient solution based on the weighted minimum mean square error and block coordinate descent algorithms. Simulation results reveal that STAR-RIS outperforms RIS in low-altitude scenarios due to its full-space coverage capability, whereas RIS delivers better performance near the base station at higher altitudes. The findings provide practical insights for the deployment of aerial intelligent surfaces in future 6G communication systems.",https://arxiv.org/pdf/2512.08755v1,,False
Neural Ordinary Differential Equations for Simulating Metabolic Pathway Dynamics from Time-Series Multiomics Data,09/12/2025,"Udesh Habaraduwa, Andrei Lixandru","The advancement of human healthspan and bioengineering relies heavily on predicting the behavior of complex biological systems. While high-throughput multiomics data is becoming increasingly abundant, converting this data into actionable predictive models remains a bottleneck. High-capacity, datadriven simulation systems are critical in this landscape; unlike classical mechanistic models restricted by prior knowledge, these architectures can infer latent interactions directly from observational data, allowing for the simulation of temporal trajectories and the anticipation of downstream intervention effects in personalized medicine and synthetic biology. To address this challenge, we introduce Neural Ordinary Differential Equations (NODEs) as a dynamic framework for learning the complex interplay between the proteome and metabolome. We applied this framework to time-series data derived from engineered Escherichia coli strains, modeling the continuous dynamics of metabolic pathways. The proposed NODE architecture demonstrates superior performance in capturing system dynamics compared to traditional machine learning pipelines. Our results show a greater than 90% improvement in root mean squared error over baselines across both Limonene (up to 94.38% improvement) and Isopentenol (up to 97.65% improvement) pathway datasets. Furthermore, the NODE models demonstrated a 1000x acceleration in inference time, establishing them as a scalable, high-fidelity tool for the next generation of metabolic engineering and biological discovery.",https://arxiv.org/pdf/2512.08732v1,,False
Protein Secondary Structure Prediction Using Transformers,09/12/2025,Manzi Kevin Maxime,"Predicting protein secondary structures such as alpha helices, beta sheets, and coils from amino acid sequences is essential for understanding protein function. This work presents a transformer-based model that applies attention mechanisms to protein sequence data to predict structural motifs. A sliding-window data augmentation technique is used on the CB513 dataset to expand the training samples. The transformer shows strong ability to generalize across variable-length sequences while effectively capturing both local and long-range residue interactions.",https://arxiv.org/pdf/2512.08613v1,,False
Beyond Wave Variables: A Data-Driven Ensemble Approach for Enhanced Teleoperation Transparency and Stability,09/12/2025,"Nour Mitiche, Farid Ferguene, Mourad Oussalah","Time delays in communication channels present significant challenges for bilateral teleoperation systems, affecting both transparency and stability. Although traditional wave variable-based methods for a four-channel architecture ensure stability via passivity, they remain vulnerable to wave reflections and disturbances like variable delays and environmental noise. This article presents a data-driven hybrid framework that replaces the conventional wave-variable transform with an ensemble of three advanced sequence models, each optimized separately via the state-of-the-art Optuna optimizer, and combined through a stacking meta-learner. The base predictors include an LSTM augmented with Prophet for trend correction, an LSTM-based feature extractor paired with clustering and a random forest for improved regression, and a CNN-LSTM model for localized and long-term dynamics. Experimental validation was performed in Python using data generated from the baseline system implemented in MATLAB/Simulink. The results show that our optimized ensemble achieves a transparency comparable to the baseline wave-variable system under varying delays and noise, while ensuring stability through passivity constraints.",https://arxiv.org/pdf/2512.08436v1,,False
Multi-Agent Deep Reinforcement Learning for Collaborative UAV Relay Networks under Jamming Atatcks,09/12/2025,"Thai Duong Nguyen, Ngoc-Tan Nguyen, Thanh-Dao Nguyen, Nguyen Van Huynh, Dinh-Hieu Tran, Symeon Chatzinotas","The deployment of Unmanned Aerial Vehicle (UAV) swarms as dynamic communication relays is critical for next-generation tactical networks. However, operating in contested environments requires solving a complex trade-off, including maximizing system throughput while ensuring collision avoidance and resilience against adversarial jamming. Existing heuristic-based approaches often struggle to find effective solutions due to the dynamic and multi-objective nature of this problem. This paper formulates this challenge as a cooperative Multi-Agent Reinforcement Learning (MARL) problem, solved using the Centralized Training with Decentralized Execution (CTDE) framework. Our approach employs a centralized critic that uses global state information to guide decentralized actors which operate using only local observations. Simulation results show that our proposed framework significantly outperforms heuristic baselines, increasing the total system throughput by approximately 50% while simultaneously achieving a near-zero collision rate. A key finding is that the agents develop an emergent anti-jamming strategy without explicit programming. They learn to intelligently position themselves to balance the trade-off between mitigating interference from jammers and maintaining effective communication links with ground users.",https://arxiv.org/pdf/2512.08341v1,,False
Robust Finetuning of Vision-Language-Action Robot Policies via Parameter Merging,09/12/2025,"Yajat Yadav, Zhiyuan Zhou, Andrew Wagenmaker, Karl Pertsch, Sergey Levine","Generalist robot policies, trained on large and diverse datasets, have demonstrated the ability to generalize across a wide spectrum of behaviors, enabling a single policy to act in varied real-world environments. However, they still fall short on new tasks not covered in the training data. When finetuned on limited demonstrations of a new task, these policies often overfit to the specific demonstrations--not only losing their prior abilities to solve a wide variety of generalist tasks but also failing to generalize within the new task itself. In this work, we aim to develop a method that preserves the generalization capabilities of the generalist policy during finetuning, allowing a single policy to robustly incorporate a new skill into its repertoire. Our goal is a single policy that both learns to generalize to variations of the new task and retains the broad competencies gained from pretraining. We show that this can be achieved through a simple yet effective strategy: interpolating the weights of a finetuned model with that of the pretrained model. We show, across extensive simulated and real-world experiments, that such model merging produces a single model that inherits the generalist abilities of the base model and learns to solve the new task robustly, outperforming both the pretrained and finetuned model on out-of-distribution variations of the new task. Moreover, we show that model merging enables continual acquisition of new skills in a lifelong learning setting, without sacrificing previously learned generalist abilities.",https://arxiv.org/pdf/2512.08333v1,,False
Magnetic activity of ultracool dwarfs in the LAMOST DR11,09/12/2025,"Yue Xiang, Shenghong Gu, Dongtao Cao","Ultracool dwarfs consist of lowest-mass stars and brown dwarfs. Their interior is fully convective, different from that of the partly-convective Sun-like stars. Magnetic field generation process beneath the surface of ultracool dwarfs is still poorly understood and controversial. To increase samples of active ultracool dwarfs significantly, we have identified 962 ultracool dwarfs in the latest LAMOST data release, DR11. We also simulate the Chinese Space Station Survey Telescope (CSST) low-resolution slitless spectra by degrading the LAMOST spectra. A semi-supervised machine learning approach with an autoencoder model is built to identify ultracool dwarfs with the simulated CSST spectra, which demonstrates the capability of the CSST all-sky slitless spectroscopic survey on the detection of ultracool dwarfs. Magnetic activity of the ultracool dwarfs is investigated by using the H$α$ line emission as a proxy. The rotational periods of 82 ultracool dwarfs are derived based on the Kepler/K2 light curves. We also derive the activity-rotation relation of the ultracool dwarfs, which is saturated around a Rossby number of 0.12.",https://arxiv.org/pdf/2512.08305v1,,False
AgentEval: Generative Agents as Reliable Proxies for Human Evaluation of AI-Generated Content,09/12/2025,"Thanh Vu, Richi Nayak, Thiru Balasubramaniam","Modern businesses are increasingly challenged by the time and expense required to generate and assess high-quality content. Human writers face time constraints, and extrinsic evaluations can be costly. While Large Language Models (LLMs) offer potential in content creation, concerns about the quality of AI-generated content persist. Traditional evaluation methods, like human surveys, further add operational costs, highlighting the need for efficient, automated solutions. This research introduces Generative Agents as a means to tackle these challenges. These agents can rapidly and cost-effectively evaluate AI-generated content, simulating human judgment by rating aspects such as coherence, interestingness, clarity, fairness, and relevance. By incorporating these agents, businesses can streamline content generation and ensure consistent, high-quality output while minimizing reliance on costly human evaluations. The study provides critical insights into enhancing LLMs for producing business-aligned, high-quality content, offering significant advancements in automated content generation and evaluation.",https://arxiv.org/pdf/2512.08273v1,,False
