Title,Publication Date,Author(s),Abstract,Link,DOI,Relevant
Privacy-Preserving Operating Room Workflow Analysis using Digital Twins,17/04/2025,"Alejandra Perez, Han Zhang, Yu-Chun Ku, Lalithkumar Seenivasan, Roger Soberanis, Jose L. Porras, Richard Day, Jeff Jopling, Peter Najjar, Mathias Unberath","Purpose: The operating room (OR) is a complex environment where optimizing
workflows is critical to reduce costs and improve patient outcomes. The use of
computer vision approaches for the automatic recognition of perioperative
events enables identification of bottlenecks for OR optimization. However,
privacy concerns limit the use of computer vision for automated event detection
from OR videos, which makes privacy-preserving approaches needed for OR
workflow analysis. Methods: We propose a two-stage pipeline for
privacy-preserving OR video analysis and event detection. In the first stage,
we leverage vision foundation models for depth estimation and semantic
segmentation to generate de-identified Digital Twins (DT) of the OR from
conventional RGB videos. In the second stage, we employ the SafeOR model, a
fused two-stream approach that processes segmentation masks and depth maps for
OR event detection. We evaluate this method on an internal dataset of 38
simulated surgical trials with five event classes. Results: Our results
indicate that this DT-based approach to the OR event detection model achieves
performance on par and sometimes even better than raw RGB video-based models on
detecting OR events. Conclusion: DTs enable privacy-preserving OR workflow
analysis, facilitating the sharing of de-identified data across institutions
and they can potentially enhance model generalizability by mitigating
domain-specific appearance differences.",http://arxiv.org/pdf/2504.12552v1,,False
Memorization vs. Reasoning: Updating LLMs with New Knowledge,16/04/2025,"Aochong Oliver Li, Tanya Goyal","Large language models (LLMs) encode vast amounts of pre-trained knowledge in
their parameters, but updating them as real-world information evolves remains a
challenge. Existing methodologies and benchmarks primarily target entity
substitutions, failing to capture the full breadth of complex real-world
dynamics. In this paper, we introduce Knowledge Update Playground (KUP), an
automatic pipeline for simulating realistic knowledge updates reflected in an
evidence corpora. KUP's evaluation framework includes direct and indirect
probes to both test memorization of updated facts and reasoning over them, for
any update learning methods. Next, we present a lightweight method called
memory conditioned training (MCT), which conditions tokens in the update corpus
on self-generated ""memory"" tokens during training. Our strategy encourages LLMs
to surface and reason over newly memorized knowledge at inference. Our results
on two strong LLMs show that (1) KUP benchmark is highly challenging, with the
best CPT models achieving $<2\%$ in indirect probing setting (reasoning) and
(2) MCT training significantly outperforms prior continued pre-training (CPT)
baselines, improving direct probing (memorization) results by up to $25.4\%$.",http://arxiv.org/pdf/2504.12523v1,,False
Continual Learning Strategies for 3D Engineering Regression Problems: A Benchmarking Study,16/04/2025,"Kaira M. Samuel, Faez Ahmed","Engineering problems that apply machine learning often involve
computationally intensive methods but rely on limited datasets. As engineering
data evolves with new designs and constraints, models must incorporate new
knowledge over time. However, high computational costs make retraining models
from scratch infeasible. Continual learning (CL) offers a promising solution by
enabling models to learn from sequential data while mitigating catastrophic
forgetting, where a model forgets previously learned mappings. This work
introduces CL to engineering design by benchmarking several CL methods on
representative regression tasks. We apply these strategies to five engineering
datasets and construct nine new engineering CL benchmarks to evaluate their
ability to address forgetting and improve generalization. Preliminary results
show that applying existing CL methods to these tasks improves performance over
naive baselines. In particular, the Replay strategy achieved performance
comparable to retraining in several benchmarks while reducing training time by
nearly half, demonstrating its potential for real-world engineering workflows.
The code and datasets used in this work will be available at:
https://github.com/kmsamuel/cl-for-engineering-release.",http://arxiv.org/pdf/2504.12503v1,,False
Learning Transferable Friction Models and LuGre Identification via Physics Informed Neural Networks,16/04/2025,"Asutay Ozmen, João P. Hespanha, Katie Byl","Accurately modeling friction in robotics remains a core challenge, as
robotics simulators like Mujoco and PyBullet use simplified friction models or
heuristics to balance computational efficiency with accuracy, where these
simplifications and approximations can lead to substantial differences between
simulated and physical performance. In this paper, we present a
physics-informed friction estimation framework that enables the integration of
well-established friction models with learnable components-requiring only
minimal, generic measurement data. Our approach enforces physical consistency
yet retains the flexibility to adapt to real-world complexities. We
demonstrate, on an underactuated and nonlinear system, that the learned
friction models, trained solely on small and noisy datasets, accurately
simulate dynamic friction properties and reduce the sim-to-real gap. Crucially,
we show that our approach enables the learned models to be transferable to
systems they are not trained on. This ability to generalize across multiple
systems streamlines friction modeling for complex, underactuated tasks,
offering a scalable and interpretable path toward bridging the sim-to-real gap
in robotics and control.",http://arxiv.org/pdf/2504.12441v1,,False
Diffusion Based Robust LiDAR Place Recognition,16/04/2025,"Benjamin Krummenacher, Jonas Frey, Turcan Tuna, Olga Vysotska, Marco Hutter","Mobile robots on construction sites require accurate pose estimation to
perform autonomous surveying and inspection missions. Localization in
construction sites is a particularly challenging problem due to the presence of
repetitive features such as flat plastered walls and perceptual aliasing due to
apartments with similar layouts inter and intra floors. In this paper, we focus
on the global re-positioning of a robot with respect to an accurate scanned
mesh of the building solely using LiDAR data. In our approach, a neural network
is trained on synthetic LiDAR point clouds generated by simulating a LiDAR in
an accurate real-life large-scale mesh. We train a diffusion model with a
PointNet++ backbone, which allows us to model multiple position candidates from
a single LiDAR point cloud. The resulting model can successfully predict the
global position of LiDAR in confined and complex sites despite the adverse
effects of perceptual aliasing. The learned distribution of potential global
positions can provide multi-modal position distribution. We evaluate our
approach across five real-world datasets and show the place recognition
accuracy of 77% +/-2m on average while outperforming baselines at a factor of 2
in mean error.",http://arxiv.org/pdf/2504.12412v1,,False
Activated LoRA: Fine-tuned LLMs for Intrinsics,16/04/2025,"Kristjan Greenewald, Luis Lastras, Thomas Parnell, Vraj Shah, Lucian Popa, Giulio Zizzo, Chulaka Gunasekara, Ambrish Rawat, David Cox","Low-Rank Adaptation (LoRA) has emerged as a highly efficient framework for
finetuning the weights of large foundation models, and has become the go-to
method for data-driven customization of LLMs. Despite the promise of highly
customized behaviors and capabilities, switching between relevant LoRAs in a
multiturn setting is highly inefficient, as the key-value (KV) cache of the
entire turn history must be recomputed with the LoRA weights before generation
can begin. To address this problem, we propose Activated LoRA (aLoRA), which
modifies the LoRA framework to only adapt weights for the tokens in the
sequence \emph{after} the aLoRA is invoked. This change crucially allows aLoRA
to accept the base model's KV cache of the input string, meaning that aLoRA can
be instantly activated whenever needed in a chain without recomputing the
cache. This enables building what we call \emph{intrinsics}, i.e. highly
specialized models invoked to perform well-defined operations on portions of an
input chain or conversation that otherwise uses the base model by default. We
use aLoRA to train a set of intrinsics models, demonstrating competitive
accuracy with standard LoRA while achieving significant inference benefits.",http://arxiv.org/pdf/2504.12397v1,,False
SCENT: Robust Spatiotemporal Learning for Continuous Scientific Data via Scalable Conditioned Neural Fields,16/04/2025,"David Keetae Park, Xihaier Luo, Guang Zhao, Seungjun Lee, Miruna Oprescu, Shinjae Yoo","Spatiotemporal learning is challenging due to the intricate interplay between
spatial and temporal dependencies, the high dimensionality of the data, and
scalability constraints. These challenges are further amplified in scientific
domains, where data is often irregularly distributed (e.g., missing values from
sensor failures) and high-volume (e.g., high-fidelity simulations), posing
additional computational and modeling difficulties. In this paper, we present
SCENT, a novel framework for scalable and continuity-informed spatiotemporal
representation learning. SCENT unifies interpolation, reconstruction, and
forecasting within a single architecture. Built on a transformer-based
encoder-processor-decoder backbone, SCENT introduces learnable queries to
enhance generalization and a query-wise cross-attention mechanism to
effectively capture multi-scale dependencies. To ensure scalability in both
data size and model complexity, we incorporate a sparse attention mechanism,
enabling flexible output representations and efficient evaluation at arbitrary
resolutions. We validate SCENT through extensive simulations and real-world
experiments, demonstrating state-of-the-art performance across multiple
challenging tasks while achieving superior scalability.",http://arxiv.org/pdf/2504.12262v1,,False
Watermarking Needs Input Repetition Masking,16/04/2025,"David Khachaturov, Robert Mullins, Ilia Shumailov, Sumanth Dathathri","Recent advancements in Large Language Models (LLMs) raised concerns over
potential misuse, such as for spreading misinformation. In response two counter
measures emerged: machine learning-based detectors that predict if text is
synthetic, and LLM watermarking, which subtly marks generated text for
identification and attribution. Meanwhile, humans are known to adjust language
to their conversational partners both syntactically and lexically. By
implication, it is possible that humans or unwatermarked LLMs could
unintentionally mimic properties of LLM generated text, making counter measures
unreliable. In this work we investigate the extent to which such conversational
adaptation happens. We call the concept $\textit{mimicry}$ and demonstrate that
both humans and LLMs end up mimicking, including the watermarking signal even
in seemingly improbable settings. This challenges current academic assumptions
and suggests that for long-term watermarking to be reliable, the likelihood of
false positives needs to be significantly lower, while longer word sequences
should be used for seeding watermarking mechanisms.",http://arxiv.org/pdf/2504.12229v1,,False
"Reasoning-Based AI for Startup Evaluation (R.A.I.S.E.): A Memory-Augmented, Multi-Step Decision Framework",16/04/2025,"Jack Preuveneers, Joseph Ternasky, Fuat Alican, Yigit Ihlamur","We present a novel framework that bridges the gap between the
interpretability of decision trees and the advanced reasoning capabilities of
large language models (LLMs) to predict startup success. Our approach leverages
chain-of-thought prompting to generate detailed reasoning logs, which are
subsequently distilled into structured, human-understandable logical rules. The
pipeline integrates multiple enhancements - efficient data ingestion, a
two-step refinement process, ensemble candidate sampling, simulated
reinforcement learning scoring, and persistent memory - to ensure both stable
decision-making and transparent output. Experimental evaluations on curated
startup datasets demonstrate that our combined pipeline improves precision by
54% from 0.225 to 0.346 and accuracy by 50% from 0.46 to 0.70 compared to a
standalone OpenAI o3 model. Notably, our model achieves over 2x the precision
of a random classifier (16%). By combining state-of-the-art AI reasoning with
explicit rule-based explanations, our method not only augments traditional
decision-making processes but also facilitates expert intervention and
continuous policy refinement. This work lays the foundation for the
implementation of interpretable LLM-powered decision frameworks in high-stakes
investment environments and other domains that require transparent and
data-driven insights.",http://arxiv.org/pdf/2504.12090v1,,False
Optimizing Compound Retrieval Systems,16/04/2025,"Harrie Oosterhuis, Rolf Jagerman, Zhen Qin, Xuanhui Wang","Modern retrieval systems do not rely on a single ranking model to construct
their rankings. Instead, they generally take a cascading approach where a
sequence of ranking models are applied in multiple re-ranking stages. Thereby,
they balance the quality of the top-K ranking with computational costs by
limiting the number of documents each model re-ranks. However, the cascading
approach is not the only way models can interact to form a retrieval system.
  We propose the concept of compound retrieval systems as a broader class of
retrieval systems that apply multiple prediction models. This encapsulates
cascading models but also allows other types of interactions than top-K
re-ranking. In particular, we enable interactions with large language models
(LLMs) which can provide relative relevance comparisons. We focus on the
optimization of compound retrieval system design which uniquely involves
learning where to apply the component models and how to aggregate their
predictions into a final ranking. This work shows how our compound approach can
combine the classic BM25 retrieval model with state-of-the-art (pairwise) LLM
relevance predictions, while optimizing a given ranking metric and efficiency
target. Our experimental results show optimized compound retrieval systems
provide better trade-offs between effectiveness and efficiency than cascading
approaches, even when applied in a self-supervised manner.
  With the introduction of compound retrieval systems, we hope to inspire the
information retrieval field to more out-of-the-box thinking on how prediction
models can interact to form rankings.",http://arxiv.org/pdf/2504.12063v1,10.1145/3726302.3730051,False
Analysis of Pseudo-Labeling for Online Source-Free Universal Domain Adaptation,16/04/2025,"Pascal Schlachter, Jonathan Fuss, Bin Yang","A domain (distribution) shift between training and test data often hinders
the real-world performance of deep neural networks, necessitating unsupervised
domain adaptation (UDA) to bridge this gap. Online source-free UDA has emerged
as a solution for practical scenarios where access to source data is restricted
and target data is received as a continuous stream. However, the open-world
nature of many real-world applications additionally introduces category shifts
meaning that the source and target label spaces may differ. Online source-free
universal domain adaptation (SF-UniDA) addresses this challenge. Existing
methods mainly rely on self-training with pseudo-labels, yet the relationship
between pseudo-labeling and adaptation outcomes has not been studied yet. To
bridge this gap, we conduct a systematic analysis through controlled
experiments with simulated pseudo-labeling, offering valuable insights into
pseudo-labeling for online SF-UniDA. Our findings reveal a substantial gap
between the current state-of-the-art and the upper bound of adaptation achieved
with perfect pseudo-labeling. Moreover, we show that a contrastive loss enables
effective adaptation even with moderate pseudo-label accuracy, while a
cross-entropy loss, though less robust to pseudo-label errors, achieves
superior results when pseudo-labeling approaches perfection. Lastly, our
findings indicate that pseudo-label accuracy is in general more crucial than
quantity, suggesting that prioritizing fewer but high-confidence pseudo-labels
is beneficial. Overall, our study highlights the critical role of
pseudo-labeling in (online) SF-UniDA and provides actionable insights to drive
future advancements in the field. Our code is available at
https://github.com/pascalschlachter/PLAnalysis.",http://arxiv.org/pdf/2504.11992v1,,False
Causality-enhanced Decision-Making for Autonomous Mobile Robots in Dynamic Environments,16/04/2025,"Luca Castri, Gloria Beraldo, Nicola Bellotto","The growing integration of robots in shared environments -- such as
warehouses, shopping centres, and hospitals -- demands a deep understanding of
the underlying dynamics and human behaviours, including how, when, and where
individuals engage in various activities and interactions. This knowledge goes
beyond simple correlation studies and requires a more comprehensive causal
analysis. By leveraging causal inference to model cause-and-effect
relationships, we can better anticipate critical environmental factors and
enable autonomous robots to plan and execute tasks more effectively. To this
end, we propose a novel causality-based decision-making framework that reasons
over a learned causal model to predict battery usage and human obstructions,
understanding how these factors could influence robot task execution. Such
reasoning framework assists the robot in deciding when and how to complete a
given task. To achieve this, we developed also PeopleFlow, a new Gazebo-based
simulator designed to model context-sensitive human-robot spatial interactions
in shared workspaces. PeopleFlow features realistic human and robot
trajectories influenced by contextual factors such as time, environment layout,
and robot state, and can simulate a large number of agents. While the simulator
is general-purpose, in this paper we focus on a warehouse-like environment as a
case study, where we conduct an extensive evaluation benchmarking our causal
approach against a non-causal baseline. Our findings demonstrate the efficacy
of the proposed solutions, highlighting how causal reasoning enables autonomous
robots to operate more efficiently and safely in dynamic environments shared
with humans.",http://arxiv.org/pdf/2504.11901v2,,False
Manifold meta-learning for reduced-complexity neural system identification,16/04/2025,"Marco Forgione, Ankush Chakrabarty, Dario Piga, Matteo Rufolo, Alberto Bemporad","System identification has greatly benefited from deep learning techniques,
particularly for modeling complex, nonlinear dynamical systems with partially
unknown physics where traditional approaches may not be feasible. However, deep
learning models often require large datasets and significant computational
resources at training and inference due to their high-dimensional
parameterizations. To address this challenge, we propose a meta-learning
framework that discovers a low-dimensional manifold within the parameter space
of an over-parameterized neural network architecture. This manifold is learned
from a meta-dataset of input-output sequences generated by a class of related
dynamical systems, enabling efficient model training while preserving the
network's expressive power for the considered system class. Unlike bilevel
meta-learning approaches, our method employs an auxiliary neural network to map
datasets directly onto the learned manifold, eliminating the need for costly
second-order gradient computations during meta-training and reducing the number
of first-order updates required in inference, which could be expensive for
large models. We validate our approach on a family of Bouc-Wen oscillators,
which is a well-studied nonlinear system identification benchmark. We
demonstrate that we are able to learn accurate models even in small-data
scenarios.",http://arxiv.org/pdf/2504.11811v1,,False
Steering Prosocial AI Agents: Computational Basis of LLM's Decision Making in Social Simulation,16/04/2025,Ji Ma,"Large language models (LLMs) increasingly serve as human-like decision-making
agents in social science and applied settings. These LLM-agents are typically
assigned human-like characters and placed in real-life contexts. However, how
these characters and contexts shape an LLM's behavior remains underexplored.
This study proposes and tests methods for probing, quantifying, and modifying
an LLM's internal representations in a Dictator Game -- a classic behavioral
experiment on fairness and prosocial behavior. We extract ``vectors of variable
variations'' (e.g., ``male'' to ``female'') from the LLM's internal state.
Manipulating these vectors during the model's inference can substantially alter
how those variables relate to the model's decision-making. This approach offers
a principled way to study and regulate how social concepts can be encoded and
engineered within transformer-based models, with implications for alignment,
debiasing, and designing AI agents for social simulations in both academic and
commercial applications.",http://arxiv.org/pdf/2504.11671v1,,False
Generalized probabilistic canonical correlation analysis for multi-modal data integration with full or partial observations,15/04/2025,"Tianjian Yang, Wei Vivian Li","Background: The integration and analysis of multi-modal data are increasingly
essential across various domains including bioinformatics. As the volume and
complexity of such data grow, there is a pressing need for computational models
that not only integrate diverse modalities but also leverage their
complementary information to improve clustering accuracy and insights,
especially when dealing with partial observations with missing data. Results:
We propose Generalized Probabilistic Canonical Correlation Analysis (GPCCA), an
unsupervised method for the integration and joint dimensionality reduction of
multi-modal data. GPCCA addresses key challenges in multi-modal data analysis
by handling missing values within the model, enabling the integration of more
than two modalities, and identifying informative features while accounting for
correlations within individual modalities. The model demonstrates robustness to
various missing data patterns and provides low-dimensional embeddings that
facilitate downstream clustering and analysis. In a range of simulation
settings, GPCCA outperforms existing methods in capturing essential patterns
across modalities. Additionally, we demonstrate its applicability to
multi-omics data from TCGA cancer datasets and a multi-view image dataset.
Conclusion: GPCCA offers a useful framework for multi-modal data integration,
effectively handling missing data and providing informative low-dimensional
embeddings. Its performance across cancer genomics and multi-view image data
highlights its robustness and potential for broad application. To make the
method accessible to the wider research community, we have released an R
package, GPCCA, which is available at https://github.com/Kaversoniano/GPCCA.",http://arxiv.org/pdf/2504.11610v1,,False
REAL: Benchmarking Autonomous Agents on Deterministic Simulations of Real Websites,15/04/2025,"Divyansh Garg, Shaun VanWeelden, Diego Caples, Andis Draguns, Nikil Ravi, Pranav Putta, Naman Garg, Tomas Abraham, Michael Lara, Federico Lopez, James Liu, Atharva Gundawar, Prannay Hebbar, Youngchul Joo, Jindong Gu, Charles London, Christian Schroeder de Witt, Sumeet Motwani","We introduce REAL, a benchmark and framework for multi-turn agent evaluations
on deterministic simulations of real-world websites. REAL comprises
high-fidelity, deterministic replicas of 11 widely-used websites across domains
such as e-commerce, travel, communication, and professional networking. We also
release a benchmark consisting of 112 practical tasks that mirror everyday
complex user interactions requiring both accurate information retrieval and
state-changing actions. All interactions occur within this fully controlled
setting, eliminating safety risks and enabling robust, reproducible evaluation
of agent capability and reliability. Our novel evaluation framework combines
programmatic checks of website state for action-based tasks with rubric-guided
LLM-based judgments for information retrieval. The framework supports both
open-source and proprietary agent systems through a flexible evaluation harness
that accommodates black-box commands within browser environments, allowing
research labs to test agentic systems without modification. Our empirical
results show that frontier language models achieve at most a 41% success rate
on REAL, highlighting critical gaps in autonomous web navigation and task
completion capabilities. Our framework supports easy integration of new tasks,
reproducible evaluation, and scalable post-training data generation, marking a
significant step forward in evaluating and advancing agent capabilities.",http://arxiv.org/pdf/2504.11543v2,,False
