Title,Publication Date,Author(s),Abstract,Link,DOI,Relevant
Robust and Efficient Quantum Reservoir Computing with Discrete Time Crystal,21/08/2025,"Da Zhang, Xin Li, Yibin Guo, Haifeng Yu, Yirong Jin, Zhang-Qi Yin","The rapid development of machine learning and quantum computing has placed
quantum machine learning at the forefront of research. However, existing
quantum machine learning algorithms based on quantum variational algorithms
face challenges in trainability and noise robustness. In order to address these
challenges, we introduce a gradient-free, noise-robust quantum reservoir
computing algorithm that harnesses discrete time crystal dynamics as a
reservoir. We first calibrate the memory, nonlinear, and information scrambling
capacities of the quantum reservoir, revealing their correlation with dynamical
phases and non-equilibrium phase transitions. We then apply the algorithm to
the binary classification task and establish a comparative quantum kernel
advantage. For ten-class classification, both noisy simulations and
experimental results on superconducting quantum processors match ideal
simulations, demonstrating the enhanced accuracy with increasing system size
and confirming the topological noise robustness. Our work presents the first
experimental demonstration of quantum reservoir computing for image
classification based on digital quantum simulation. It establishes the
correlation between quantum many-body non-equilibrium phase transitions and
quantum machine learning performance, providing new design principles for
quantum reservoir computing and broader quantum machine learning algorithms in
the NISQ era.",http://arxiv.org/pdf/2508.15230v1,,False
Learning ECG Representations via Poly-Window Contrastive Learning,21/08/2025,"Yi Yuan, Joseph Van Duyn, Runze Yan, Zhuoyi Huang, Sulaiman Vesal, Sergey Plis, Xiao Hu, Gloria Hyunjung Kwak, Ran Xiao, Alex Fedorov","Electrocardiogram (ECG) analysis is foundational for cardiovascular disease
diagnosis, yet the performance of deep learning models is often constrained by
limited access to annotated data. Self-supervised contrastive learning has
emerged as a powerful approach for learning robust ECG representations from
unlabeled signals. However, most existing methods generate only pairwise
augmented views and fail to leverage the rich temporal structure of ECG
recordings. In this work, we present a poly-window contrastive learning
framework. We extract multiple temporal windows from each ECG instance to
construct positive pairs and maximize their agreement via statistics. Inspired
by the principle of slow feature analysis, our approach explicitly encourages
the model to learn temporally invariant and physiologically meaningful features
that persist across time. We validate our approach through extensive
experiments and ablation studies on the PTB-XL dataset. Our results demonstrate
that poly-window contrastive learning consistently outperforms conventional
two-view methods in multi-label superclass classification, achieving higher
AUROC (0.891 vs. 0.888) and F1 scores (0.680 vs. 0.679) while requiring up to
four times fewer pre-training epochs (32 vs. 128) and 14.8% in total wall clock
pre-training time reduction. Despite processing multiple windows per sample, we
achieve a significant reduction in the number of training epochs and total
computation time, making our method practical for training foundational models.
Through extensive ablations, we identify optimal design choices and demonstrate
robustness across various hyperparameters. These findings establish poly-window
contrastive learning as a highly efficient and scalable paradigm for automated
ECG analysis and provide a promising general framework for self-supervised
representation learning in biomedical time-series data.",http://arxiv.org/pdf/2508.15225v1,,False
SleepDIFFormer: Sleep Stage Classification via Multivariate Differential Transformer,21/08/2025,"Benjamin Wei Hao Chin, Yuin Torng Yew, Haocheng Wu, Lanxin Liang, Chow Khuen Chan, Norita Mohd Zain, Siti Balqis Samdin, Sim Kuan Goh","Classification of sleep stages is essential for assessing sleep quality and
diagnosing sleep disorders such as insomnia. However, manual inspection of EEG
characteristics for each stage is time-consuming and prone to human error.
Although machine learning and deep learning methods have been actively
developed, they continue to face challenges from the non-stationarity and
variability of electroencephalography (EEG) and electrooculography (EOG)
signals, often leading to poor generalization on unseen datasets. This research
proposed a Sleep Stage Classification method by developing Multivariate
Differential Transformer (SleepDIFFormer) for joint EEG and EOG representation
learning. Specifically, SleepDIFFormer was developed to process EEG and EOG
signals using our Multivariate Differential Transformer Architecture (MDTA) for
time series, trained with cross-domain alignment. Our method mitigated spatial
and temporal attention noise while learning a domain-invariant joint EEG-EOG
representation through feature distribution alignment, thereby enabling
generalization to unseen target datasets. Empirically, we evaluated our method
on five different sleep staging datasets and compared it with existing
approaches, achieving state-of-the-art performance. We also conducted thorough
ablation analyses of SleepDIFFormer and interpreted the differential attention
weights, highlighting their relevance to characteristic sleep EEG patterns.
These findings have implications for advancing automated sleep stage
classification and its application to sleep quality assessment. Our source code
is publicly available at https://github.com/Ben1001409/SleepDIFFormer",http://arxiv.org/pdf/2508.15215v1,,False
SparK: Query-Aware Unstructured Sparsity with Recoverable KV Cache Channel Pruning,21/08/2025,"Huanxuan Liao, Yixing Xu, Shizhu He, Guanchen Li, Xuanwu Yin, Dong Li, Emad Barsoum, Jun Zhao, Kang Liu","Long-context inference in large language models (LLMs) is increasingly
constrained by the KV cache bottleneck: memory usage grows linearly with
sequence length, while attention computation scales quadratically. Existing
approaches address this issue by compressing the KV cache along the temporal
axis through strategies such as token eviction or merging to reduce memory and
computational overhead. However, these methods often neglect fine-grained
importance variations across feature dimensions (i.e., the channel axis),
thereby limiting their ability to effectively balance efficiency and model
accuracy. In reality, we observe that channel saliency varies dramatically
across both queries and positions: certain feature channels carry near-zero
information for a given query, while others spike in relevance. To address this
oversight, we propose SPARK, a training-free plug-and-play method that applies
unstructured sparsity by pruning KV at the channel level, while dynamically
restoring the pruned entries during attention score computation. Notably, our
approach is orthogonal to existing KV compression and quantization techniques,
making it compatible for integration with them to achieve further acceleration.
By reducing channel-level redundancy, SPARK enables processing of longer
sequences within the same memory budget. For sequences of equal length, SPARK
not only preserves or improves model accuracy but also reduces KV cache storage
by over 30% compared to eviction-based methods. Furthermore, even with an
aggressive pruning ratio of 80%, SPARK maintains performance with less
degradation than 5% compared to the baseline eviction method, demonstrating its
robustness and effectiveness. Our code will be available at
https://github.com/Xnhyacinth/SparK.",http://arxiv.org/pdf/2508.15212v1,,False
A Unified Framework for Inference with General Missingness Patterns and Machine Learning Imputation,21/08/2025,"Xingran Chen, Tyler McCormick, Bhramar Mukherjee, Zhenke Wu","Pre-trained machine learning (ML) predictions have been increasingly used to
complement incomplete data to enable downstream scientific inquiries, but their
naive integration risks biased inferences. Recently, multiple methods have been
developed to provide valid inference with ML imputations regardless of
prediction quality and to enhance efficiency relative to complete-case
analyses. However, existing approaches are often limited to missing outcomes
under a missing-completely-at-random (MCAR) assumption, failing to handle
general missingness patterns under the more realistic missing-at-random (MAR)
assumption. This paper develops a novel method which delivers valid statistical
inference framework for general Z-estimation problems using ML imputations
under the MAR assumption and for general missingness patterns. The core
technical idea is to stratify observations by distinct missingness patterns and
construct an estimator by appropriately weighting and aggregating
pattern-specific information through a masking-and-imputation procedure on the
complete cases. We provide theoretical guarantees of asymptotic normality of
the proposed estimator and efficiency dominance over weighted complete-case
analyses. Practically, the method affords simple implementations by leveraging
existing weighted complete-case analysis software. Extensive simulations are
carried out to validate theoretical results. The paper concludes with a brief
discussion on practical implications, limitations, and potential future
directions.",http://arxiv.org/pdf/2508.15162v1,,False
