Title,Publication Date,Author(s),Abstract,Link,DOI,Relevant
Catastrophic Forgetting Resilient One-Shot Incremental Federated Learning,19/02/2026,"Obaidullah Zaland, Zulfiqar Ahmad Khan, Monowar Bhuyan","Modern big-data systems generate massive, heterogeneous, and geographically dispersed streams that are large-scale and privacy-sensitive, making centralization challenging. While federated learning (FL) provides a privacy-enhancing training mechanism, it assumes a static data flow and learns a collaborative model over multiple rounds, making learning with \textit{incremental} data challenging in limited-communication scenarios. This paper presents One-Shot Incremental Federated Learning (OSI-FL), the first FL framework that addresses the dual challenges of communication overhead and catastrophic forgetting. OSI-FL communicates category-specific embeddings, devised by a frozen vision-language model (VLM) from each client in a single communication round, which a pre-trained diffusion model at the server uses to synthesize new data similar to the client's data distribution. The synthesized samples are used on the server for training. However, two challenges still persist: i) tasks arriving incrementally need to retrain the global model, and ii) as future tasks arrive, retraining the model introduces catastrophic forgetting. To this end, we augment training with Selective Sample Retention (SSR), which identifies and retains the top-p most informative samples per category and task pair based on sample loss. SSR bounds forgetting by ensuring that representative retained samples are incorporated into training in further iterations. The experimental results indicate that OSI-FL outperforms baselines, including traditional and one-shot FL approaches, in both class-incremental and domain-incremental scenarios across three benchmark datasets.",https://arxiv.org/pdf/2602.17625v1,,False
Towards Anytime-Valid Statistical Watermarking,19/02/2026,"Baihe Huang, Eric Xu, Kannan Ramchandran, Jiantao Jiao, Michael I. Jordan","The proliferation of Large Language Models (LLMs) necessitates efficient mechanisms to distinguish machine-generated content from human text. While statistical watermarking has emerged as a promising solution, existing methods suffer from two critical limitations: the lack of a principled approach for selecting sampling distributions and the reliance on fixed-horizon hypothesis testing, which precludes valid early stopping. In this paper, we bridge this gap by developing the first e-value-based watermarking framework, Anchored E-Watermarking, that unifies optimal sampling with anytime-valid inference. Unlike traditional approaches where optional stopping invalidates Type-I error guarantees, our framework enables valid, anytime-inference by constructing a test supermartingale for the detection process. By leveraging an anchor distribution to approximate the target model, we characterize the optimal e-value with respect to the worst-case log-growth rate and derive the optimal expected stopping time. Our theoretical claims are substantiated by simulations and evaluations on established benchmarks, showing that our framework can significantly enhance sample efficiency, reducing the average token budget required for detection by 13-15% relative to state-of-the-art baselines.",https://arxiv.org/pdf/2602.17608v1,,False
Conditional Flow Matching for Continuous Anomaly Detection in Autonomous Driving on a Manifold-Aware Spectral Space,19/02/2026,Antonio Guillen-Perez,"Safety validation for Level 4 autonomous vehicles (AVs) is currently bottlenecked by the inability to scale the detection of rare, high-risk long-tail scenarios using traditional rule-based heuristics. We present Deep-Flow, an unsupervised framework for safety-critical anomaly detection that utilizes Optimal Transport Conditional Flow Matching (OT-CFM) to characterize the continuous probability density of expert human driving behavior. Unlike standard generative approaches that operate in unstable, high-dimensional coordinate spaces, Deep-Flow constrains the generative process to a low-rank spectral manifold via a Principal Component Analysis (PCA) bottleneck. This ensures kinematic smoothness by design and enables the computation of the exact Jacobian trace for numerically stable, deterministic log-likelihood estimation. To resolve multi-modal ambiguity at complex junctions, we utilize an Early Fusion Transformer encoder with lane-aware goal conditioning, featuring a direct skip-connection to the flow head to maintain intent-integrity throughout the network. We introduce a kinematic complexity weighting scheme that prioritizes high-energy maneuvers (quantified via path tortuosity and jerk) during the simulation-free training process. Evaluated on the Waymo Open Motion Dataset (WOMD), our framework achieves an AUC-ROC of 0.766 against a heuristic golden set of safety-critical events. More significantly, our analysis reveals a fundamental distinction between kinematic danger and semantic non-compliance. Deep-Flow identifies a critical predictability gap by surfacing out-of-distribution behaviors, such as lane-boundary violations and non-normative junction maneuvers, that traditional safety filters overlook. This work provides a mathematically rigorous foundation for defining statistical safety gates, enabling objective, data-driven validation for the safe deployment of autonomous fleets.",https://arxiv.org/pdf/2602.17586v1,,False
The Anxiety of Influence: Bloom Filters in Transformer Attention Heads,19/02/2026,Peter Balogh,"Some transformer attention heads appear to function as membership testers, dedicating themselves to answering the question ""has this token appeared before in the context?"" We identify these heads across four language models (GPT-2 small, medium, and large; Pythia-160M) and show that they form a spectrum of membership-testing strategies. Two heads (L0H1 and L0H5 in GPT-2 small) function as high-precision membership filters with false positive rates of 0-4\% even at 180 unique context tokens -- well above the $d_\text{head} = 64$ bit capacity of a classical Bloom filter. A third head (L1H11) shows the classic Bloom filter capacity curve: its false positive rate follows the theoretical formula $p \approx (1 - e^{-kn/m})^k$ with $R^2 = 1.0$ and fitted capacity $m \approx 5$ bits, saturating by $n \approx 20$ unique tokens. A fourth head initially identified as a Bloom filter (L3H0) was reclassified as a general prefix-attention head after confound controls revealed its apparent capacity curve was a sequence-length artifact. Together, the three genuine membership-testing heads form a multi-resolution system concentrated in early layers (0-1), taxonomically distinct from induction and previous-token heads, with false positive rates that decay monotonically with embedding distance -- consistent with distance-sensitive Bloom filters. These heads generalize broadly: they respond to any repeated token type, not just repeated names, with 43\% higher generalization than duplicate-token-only heads. Ablation reveals these heads contribute to both repeated and novel token processing, indicating that membership testing coexists with broader computational roles. The reclassification of L3H0 through confound controls strengthens rather than weakens the case: the surviving heads withstand the scrutiny that eliminated a false positive in our own analysis.",https://arxiv.org/pdf/2602.17526v1,,False
Variational Grey-Box Dynamics Matching,19/02/2026,"Gurjeet Sangra Singh, Frantzeska Lavda, Giangiacomo Mercatali, Alexandros Kalousis","Deep generative models such as flow matching and diffusion models have shown great potential in learning complex distributions and dynamical systems, but often act as black-boxes, neglecting underlying physics. In contrast, physics-based simulation models described by ODEs/PDEs remain interpretable, but may have missing or unknown terms, unable to fully describe real-world observations. We bridge this gap with a novel grey-box method that integrates incomplete physics models directly into generative models. Our approach learns dynamics from observational trajectories alone, without ground-truth physics parameters, in a simulation-free manner that avoids scalability and stability issues of Neural ODEs. The core of our method lies in modelling a structured variational distribution within the flow matching framework, by using two latent encodings: one to model the missing stochasticity and multi-modal velocity, and a second to encode physics parameters as a latent variable with a physics-informed prior. Furthermore, we present an adaptation of the framework to handle second-order dynamics. Our experiments on representative ODE/PDE problems show that our method performs on par with or superior to fully data-driven approaches and previous grey-box baselines, while preserving the interpretability of the physics model. Our code is available at https://github.com/DMML-Geneva/VGB-DM.",https://arxiv.org/pdf/2602.17477v1,,False
Improving LLM-based Recommendation with Self-Hard Negatives from Intermediate Layers,19/02/2026,"Bingqian Li, Bowen Zheng, Xiaolei Wang, Long Zhang, Jinpeng Wang, Sheng Chen, Wayne Xin Zhao, Ji-rong Wen","Large language models (LLMs) have shown great promise in recommender systems, where supervised fine-tuning (SFT) is commonly used for adaptation. Subsequent studies further introduce preference learning to incorporate negative samples into the training process. However, existing methods rely on sequence-level, offline-generated negatives, making them less discriminative and informative when adapting LLMs to recommendation tasks with large negative item spaces. To address these challenges, we propose ILRec, a novel preference fine-tuning framework for LLM-based recommendation, leveraging self-hard negative signals extracted from intermediate layers to improve preference learning. Specifically, we identify self-hard negative tokens from intermediate layers as fine-grained negative supervision that dynamically reflects the model's preference learning process. To effectively integrate these signals into training, we design a two-stage framework comprising cross-layer preference optimization and cross-layer preference distillation, enabling the model to jointly discriminate informative negatives and enhance the quality of negative signals from intermediate layers. In addition, we introduce a lightweight collaborative filtering model to assign token-level rewards for negative signals, mitigating the risk of over-penalizing false negatives. Extensive experiments on three datasets demonstrate ILRec's effectiveness in enhancing the performance of LLM-based recommender systems.",https://arxiv.org/pdf/2602.17410v1,,False
MDP Planning as Policy Inference,19/02/2026,David Tolpin,"We cast episodic Markov decision process (MDP) planning as Bayesian inference over _policies_. A policy is treated as the latent variable and is assigned an unnormalized probability of optimality that is monotone in its expected return, yielding a posterior distribution whose modes coincide with return-maximizing solutions while posterior dispersion represents uncertainty over optimal behavior. To approximate this posterior in discrete domains, we adapt variational sequential Monte Carlo (VSMC) to inference over deterministic policies under stochastic dynamics, introducing a sweep that enforces policy consistency across revisited states and couples transition randomness across particles to avoid confounding from simulator noise. Acting is performed by posterior predictive sampling, which induces a stochastic control policy through a Thompson-sampling interpretation rather than entropy regularization. Across grid worlds, Blackjack, Triangle Tireworld, and Academic Advising, we analyze the structure of inferred policy distributions and compare the resulting behavior to discrete Soft Actor-Critic, highlighting qualitative and statistical differences that arise from policy-level uncertainty.",https://arxiv.org/pdf/2602.17375v1,,False
Shortcut learning in geometric knot classification,19/02/2026,"Djordje Mihajlovic, Davide Michieletto","Classifying the topology of closed curves is a central problem in low dimensional topology with applications beyond mathematics spanning protein folding, polymer physics and even magnetohydrodynamics. The central problem is how to determine whether two embeddings of a closed arc are equivalent under ambient isotopy. Given the striking ability of neural networks to solve complex classification tasks, it is therefore natural to ask if the knot classification problem can be tackled using Machine Learning (ML). In this paper, we investigate generic shortcut methods employed by ML to solve the knot classification challenge and specifically discover hidden non-topological features in training data generated through Molecular Dynamics simulations of polygonal knots that are used by ML to arrive to positive classifications results. We then provide a rigorous foundation for future attempts to tackle the knot classification challenge using ML by developing a publicly-available (i) dataset, that aims to remove the potential of non-topological feature classification and (ii) code, that can generate knot embeddings that faithfully explore chosen geometric state space with fixed knot topology. We expect that our work will accelerate the development of ML models that can solve complex geometric knot classification challenges.",https://arxiv.org/pdf/2602.17350v1,,False
Efficient privacy loss accounting for subsampling and random allocation,19/02/2026,"Vitaly Feldman, Moshe Shenfeld","We consider the privacy amplification properties of a sampling scheme in which a user's data is used in $k$ steps chosen randomly and uniformly from a sequence (or set) of $t$ steps. This sampling scheme has been recently applied in the context of differentially private optimization (Chua et al., 2024a; Choquette-Choo et al., 2025) and communication-efficient high-dimensional private aggregation (Asi et al., 2025), where it was shown to have utility advantages over the standard Poisson sampling. Theoretical analyses of this sampling scheme (Feldman & Shenfeld, 2025; Dong et al., 2025) lead to bounds that are close to those of Poisson sampling, yet still have two significant shortcomings. First, in many practical settings, the resulting privacy parameters are not tight due to the approximation steps in the analysis. Second, the computed parameters are either the hockey stick or Renyi divergence, both of which introduce overheads when used in privacy loss accounting.
  In this work, we demonstrate that the privacy loss distribution (PLD) of random allocation applied to any differentially private algorithm can be computed efficiently. When applied to the Gaussian mechanism, our results demonstrate that the privacy-utility trade-off for random allocation is at least as good as that of Poisson subsampling. In particular, random allocation is better suited for training via DP-SGD. To support these computations, our work develops new tools for general privacy loss accounting based on a notion of PLD realization. This notion allows us to extend accurate privacy loss accounting to subsampling which previously required manual noise-mechanism-specific analysis.",https://arxiv.org/pdf/2602.17284v1,,False
Learning a Latent Pulse Shape Interface for Photoinjector Laser Systems,19/02/2026,"Alexander Klemps, Denis Ilia, Pradeep Kr. Banerjee, Ye Chen, Henrik Tünnermann, Nihat Ay","Controlling the longitudinal laser pulse shape in photoinjectors of Free-Electron Lasers is a powerful lever for optimizing electron beam quality, but systematic exploration of the vast design space is limited by the cost of brute-force pulse propagation simulations. We present a generative modeling framework based on Wasserstein Autoencoders to learn a differentiable latent interface between pulse shaping and downstream beam dynamics. Our empirical findings show that the learned latent space is continuous and interpretable while maintaining high-fidelity reconstructions. Pulse families such as higher-order Gaussians trace coherent trajectories, while standardizing the temporal pulse lengths shows a latent organization correlated with pulse energy. Analysis via principal components and Gaussian Mixture Models reveals a well behaved latent geometry, enabling smooth transitions between distinct pulse types via linear interpolation. The model generalizes from simulated data to real experimental pulse measurements, accurately reconstructing pulses and embedding them consistently into the learned manifold. Overall, the approach reduces reliance on expensive pulse-propagation simulations and facilitates downstream beam dynamics simulation and analysis.",https://arxiv.org/pdf/2602.17263v1,,False
Decoding the Human Factor: High Fidelity Behavioral Prediction for Strategic Foresight,19/02/2026,"Ben Yellin, Ehud Ezra, Mark Foreman, Shula Grinapol","Predicting human decision-making in high-stakes environments remains a central challenge for artificial intelligence. While large language models (LLMs) demonstrate strong general reasoning, they often struggle to generate consistent, individual-specific behavior, particularly when accurate prediction depends on complex interactions between psychological traits and situational constraints. Prompting-based approaches can be brittle in this setting, exhibiting identity drift and limited ability to leverage increasingly detailed persona descriptions. To address these limitations, we introduce the Large Behavioral Model (LBM), a behavioral foundation model fine-tuned to predict individual strategic choices with high fidelity. LBM shifts from transient persona prompting to behavioral embedding by conditioning on a structured, high-dimensional trait profile derived from a comprehensive psychometric battery. Trained on a proprietary dataset linking stable dispositions, motivational states, and situational constraints to observed choices, LBM learns to map rich psychological profiles to discrete actions across diverse strategic dilemmas. In a held-out scenario evaluation, LBM fine-tuning improves behavioral prediction relative to the unadapted Llama-3.1-8B-Instruct backbone and performs comparably to frontier baselines when conditioned on Big Five traits. Moreover, we find that while prompting-based baselines exhibit a complexity ceiling, LBM continues to benefit from increasingly dense trait profiles, with performance improving as additional trait dimensions are provided. Together, these results establish LBM as a scalable approach for high-fidelity behavioral simulation, enabling applications in strategic foresight, negotiation analysis, cognitive security, and decision support.",https://arxiv.org/pdf/2602.17222v1,,False
MGD: Moment Guided Diffusion for Maximum Entropy Generation,19/02/2026,"Etienne Lempereur, Nathanaël Cuvelle--Magar, Florentin Coeurdoux, Stéphane Mallat, Eric Vanden-Eijnden","Generating samples from limited information is a fundamental problem across scientific domains. Classical maximum entropy methods provide principled uncertainty quantification from moment constraints but require sampling via MCMC or Langevin dynamics, which typically exhibit exponential slowdown in high dimensions. In contrast, generative models based on diffusion and flow matching efficiently transport noise to data but offer limited theoretical guarantees and can overfit when data is scarce. We introduce Moment Guided Diffusion (MGD), which combines elements of both approaches. Building on the stochastic interpolant framework, MGD samples maximum entropy distributions by solving a stochastic differential equation that guides moments toward prescribed values in finite time, thereby avoiding slow mixing in equilibrium-based methods. We formally obtain, in the large-volatility limit, convergence of MGD to the maximum entropy distribution and derive a tractable estimator of the resulting entropy computed directly from the dynamics. Applications to financial time series, turbulent flows, and cosmological fields using wavelet scattering moments yield estimates of negentropy for high-dimensional multiscale processes.",https://arxiv.org/pdf/2602.17211v1,,False
Continual uncertainty learning,19/02/2026,"Heisei Yonezawa, Ansei Yonezawa, Itsuro Kajiwara","Robust control of mechanical systems with multiple uncertainties remains a fundamental challenge, particularly when nonlinear dynamics and operating-condition variations are intricately intertwined. While deep reinforcement learning (DRL) combined with domain randomization has shown promise in mitigating the sim-to-real gap, simultaneously handling all sources of uncertainty often leads to sub-optimal policies and poor learning efficiency. This study formulates a new curriculum-based continual learning framework for robust control problems involving nonlinear dynamical systems in which multiple sources of uncertainty are simultaneously superimposed. The key idea is to decompose a complex control problem with multiple uncertainties into a sequence of continual learning tasks, in which strategies for handling each uncertainty are acquired sequentially. The original system is extended into a finite set of plants whose dynamic uncertainties are gradually expanded and diversified as learning progresses. The policy is stably updated across the entire plant sets associated with tasks defined by different uncertainty configurations without catastrophic forgetting. To ensure learning efficiency, we jointly incorporate a model-based controller (MBC), which guarantees a shared baseline performance across the plant sets, into the learning process to accelerate the convergence. This residual learning scheme facilitates task-specific optimization of the DRL agent for each uncertainty, thereby enhancing sample efficiency. As a practical industrial application, this study applies the proposed method to designing an active vibration controller for automotive powertrains. We verified that the resulting controller is robust against structural nonlinearities and dynamic variations, realizing successful sim-to-real transfer.",https://arxiv.org/pdf/2602.17174v1,,False
JEPA-DNA: Grounding Genomic Foundation Models through Joint-Embedding Predictive Architectures,19/02/2026,"Ariel Larey, Elay Dahan, Amit Bleiweiss, Raizy Kellerman, Guy Leib, Omri Nayshool, Dan Ofer, Tal Zinger, Dan Dominissini, Gideon Rechavi, Nicole Bussola, Simon Lee, Shane O'Connell, Dung Hoang, Marissa Wirth, Alexander W. Charney, Nati Daniel, Yoli Shavit","Genomic Foundation Models (GFMs) have largely relied on Masked Language Modeling (MLM) or Next Token Prediction (NTP) to learn the language of life. While these paradigms excel at capturing local genomic syntax and fine-grained motif patterns, they often fail to capture the broader functional context, resulting in representations that lack a global biological perspective. We introduce JEPA-DNA, a novel pre-training framework that integrates the Joint-Embedding Predictive Architecture (JEPA) with traditional generative objectives. JEPA-DNA introduces latent grounding by coupling token-level recovery with a predictive objective in the latent space by supervising a CLS token. This forces the model to predict the high-level functional embeddings of masked genomic segments rather than focusing solely on individual nucleotides. JEPA-DNA extends both NTP and MLM paradigms and can be deployed either as a standalone from-scratch objective or as a continual pre-training enhancement for existing GFMs. Our evaluations across a diverse suite of genomic benchmarks demonstrate that JEPA-DNA consistently yields superior performance in supervised and zero-shot tasks compared to generative-only baselines. By providing a more robust and biologically grounded representation, JEPA-DNA offers a scalable path toward foundation models that understand not only the genomic alphabet, but also the underlying functional logic of the sequence.",https://arxiv.org/pdf/2602.17162v1,,False
TimeOmni-VL: Unified Models for Time Series Understanding and Generation,19/02/2026,"Tong Guan, Sheng Pan, Johan Barthelemy, Zhao Li, Yujun Cai, Cesare Alippi, Ming Jin, Shirui Pan","Recent time series modeling faces a sharp divide between numerical generation and semantic understanding, with research showing that generation models often rely on superficial pattern matching, while understanding-oriented models struggle with high-fidelity numerical output. Although unified multimodal models (UMMs) have bridged this gap in vision, their potential for time series remains untapped. We propose TimeOmni-VL, the first vision-centric framework that unifies time series understanding and generation through two key innovations: (1) Fidelity-preserving bidirectional mapping between time series and images (Bi-TSI), which advances Time Series-to-Image (TS2I) and Image-to-Time Series (I2TS) conversions to ensure near-lossless transformations. (2) Understanding-guided generation. We introduce TSUMM-Suite, a novel dataset consists of six understanding tasks rooted in time series analytics that are coupled with two generation tasks. With a calibrated Chain-of-Thought, TimeOmni-VL is the first to leverage time series understanding as an explicit control signal for high-fidelity generation. Experiments confirm that this unified approach significantly improves both semantic understanding and numerical precision, establishing a new frontier for multimodal time series modeling.",https://arxiv.org/pdf/2602.17149v1,,False
