Title,Publication Date,Author(s),Abstract,Link,DOI,Relevant
Universal Modelling of Autocovariance Functions via Spline Kernels,27/06/2025,Lachlan Astfalck,"Flexible modelling of the autocovariance function (ACF) is central to
time-series, spatial, and spatio-temporal analysis. Modern applications often
demand flexibility beyond classical parametric models, motivating
non-parametric descriptions of the ACF. Bochner's Theorem guarantees that any
positive spectral measure yields a valid ACF via the inverse Fourier transform;
however, existing non-parametric approaches in the spectral domain rarely
return closed-form expressions for the ACF itself. We develop a flexible,
closed-form class of non-parametric ACFs by deriving the inverse Fourier
transform of B-spline spectral bases with arbitrary degree and knot placement.
This yields a general class of ACF with three key features: (i) it is provably
dense, under an $L^1$ metric, in the space of weakly stationary, mean-square
continuous ACFs with mild regularity conditions; (ii) it accommodates
univariate, multivariate, and multidimensional processes; and (iii) it
naturally supports non-separable structure without requiring explicit
imposition. Jackson-type approximation bounds establish convergence rates, and
empirical results on simulated and real-world data demonstrate accurate process
recovery. The method provides a practical and theoretically grounded approach
for constructing a non-parametric class of ACF.",http://arxiv.org/pdf/2506.21953v1,,False
Physics-informed network paradigm with data generation and background noise removal for diverse distributed acoustic sensing applications,27/06/2025,"Yangyang Wan, Haotian Wang, Xuhui Yu, Jiageng Chen, Xinyu Fan, Zuyuan He","Distributed acoustic sensing (DAS) has attracted considerable attention
across various fields and artificial intelligence (AI) technology plays an
important role in DAS applications to realize event recognition and denoising.
Existing AI models require real-world data (RWD), whether labeled or not, for
training, which is contradictory to the fact of limited available event data in
real-world scenarios. Here, a physics-informed DAS neural network paradigm is
proposed, which does not need real-world events data for training. By
physically modeling target events and the constraints of real world and DAS
system, physical functions are derived to train a generative network for
generation of DAS events data. DAS debackground net is trained by using the
generated DAS events data to eliminate background noise in DAS data. The
effectiveness of the proposed paradigm is verified in event identification
application based on a public dataset of DAS spatiotemporal data and in belt
conveyor fault monitoring application based on DAS time-frequency data, and
achieved comparable or better performance than data-driven networks trained
with RWD. Owing to the introduction of physical information and capability of
background noise removal, the paradigm demonstrates generalization in same
application on different sites. A fault diagnosis accuracy of 91.8% is achieved
in belt conveyor field with networks which transferred from simulation test
site without any fault events data of test site and field for training. The
proposed paradigm is a prospective solution to address significant obstacles of
data acquisition and intense noise in practical DAS applications and explore
more potential fields for DAS.",http://arxiv.org/pdf/2506.21952v1,,False
Joint Task Offloading and Resource Allocation in Low-Altitude MEC via Graph Attention Diffusion,27/06/2025,"Yifan Xue, Ruihuai Liang, Bo Yang, Xuelin Cao, Zhiwen Yu, Mérouane Debbah, Chau Yuen","With the rapid development of the low-altitude economy, air-ground integrated
multi-access edge computing (MEC) systems are facing increasing demands for
real-time and intelligent task scheduling. In such systems, task offloading and
resource allocation encounter multiple challenges, including node
heterogeneity, unstable communication links, and dynamic task variations. To
address these issues, this paper constructs a three-layer heterogeneous MEC
system architecture for low-altitude economic networks, encompassing aerial and
ground users as well as edge servers. The system is systematically modeled from
the perspectives of communication channels, computational costs, and constraint
conditions, and the joint optimization problem of offloading decisions and
resource allocation is uniformly abstracted into a graph-structured modeling
task. On this basis, we propose a graph attention diffusion-based solution
generator (GADSG). This method integrates the contextual awareness of graph
attention networks with the solution distribution learning capability of
diffusion models, enabling joint modeling and optimization of discrete
offloading variables and continuous resource allocation variables within a
high-dimensional latent space. We construct multiple simulation datasets with
varying scales and topologies. Extensive experiments demonstrate that the
proposed GADSG model significantly outperforms existing baseline methods in
terms of optimization performance, robustness, and generalization across task
structures, showing strong potential for efficient task scheduling in dynamic
and complex low-altitude economic network environments.",http://arxiv.org/pdf/2506.21933v1,,False
Do Vision-Language Models Have Internal World Models? Towards an Atomic Evaluation,27/06/2025,"Qiyue Gao, Xinyu Pi, Kevin Liu, Junrong Chen, Ruolan Yang, Xinqi Huang, Xinyu Fang, Lu Sun, Gautham Kishore, Bo Ai, Stone Tao, Mengyang Liu, Jiaxi Yang, Chao-Jung Lai, Chuanyang Jin, Jiannan Xiang, Benhao Huang, Zeming Chen, David Danks, Hao Su, Tianmin Shu, Ziqiao Ma, Lianhui Qin, Zhiting Hu","Internal world models (WMs) enable agents to understand the world's state and
predict transitions, serving as the basis for advanced deliberative reasoning.
Recent large Vision-Language Models (VLMs), such as OpenAI o3, GPT-4o and
Gemini, exhibit potential as general-purpose WMs. While the latest studies have
evaluated and shown limitations in specific capabilities such as visual
understanding, a systematic evaluation of VLMs' fundamental WM abilities
remains absent. Drawing on comparative psychology and cognitive science, we
propose a two-stage framework that assesses Perception (visual, spatial,
temporal, quantitative, and motion) and Prediction (mechanistic simulation,
transitive inference, compositional inference) to provide an atomic evaluation
of VLMs as WMs. Guided by this framework, we introduce WM-ABench, a large-scale
benchmark comprising 23 fine-grained evaluation dimensions across 6 diverse
simulated environments with controlled counterfactual simulations. Through 660
experiments on 15 latest commercial and open-source VLMs, we find that these
models exhibit striking limitations in basic world modeling abilities. For
instance, almost all models perform at near-random accuracy when distinguishing
motion trajectories. Additionally, they lack disentangled understanding --
e.g., some models tend to believe blue objects move faster than green ones.
More rich results and analyses reveal significant gaps between VLMs and
human-level world modeling.",http://arxiv.org/pdf/2506.21876v1,,False
