Title,Publication Date,Author(s),Abstract,Link,DOI,Relevant
Signed-Permutation Coordinate Transport for RMSNorm Transformers,30/06/2026,John Sweeney,"Modern LLM workflows move coordinate-indexed objects across checkpoints: steering vectors, sparse autoencoders, top-$k$ neuron sets, attribution lists, and merge alignments. This is only well posed after fixing the model's residual-stream gauge, which we show is architecture-dependent: LayerNorm residual charts have permutation gauge $S_d$ (up to a global sign flip), while RMSNorm charts with generic per-channel gain have signed-permutation gauge $B_d = S_d \ltimes \{\pm 1\}^d$. Permutation-only alignment is therefore symmetry-incomplete for RMSNorm models. We introduce sign-marginalized Hungarian matching and prove a sharp failure mode: with decorrelated coordinates, raw signed-correlation matching has a structural permutation-accuracy ceiling at the positive-sign fraction of the true gauge, which sign-marginalization removes. We then make coordinate-preserving transport, not function-level merging, the primary object: composing saved-checkpoint local $B_d$ gauges along same-base fine-tuning trajectories recovers 91.1% of cross-run coordinates at 1500 steps versus 60.3% for endpoint matching, and the gain is not explained by merely routing through the base. The recovered gauge transfers tools that permutation-only alignment breaks: TinyLlama SAE reconstruction has NMSE 0.004 under $B_d$ versus 1.08 under $S_d$; Qwen sentiment steering preserves 95.8% of its effect versus 17.2%; refusal steering reverses sign under $S_d$; coordinate-preserving merges behave the same way. The same covariance governs stateful training: signed transport of AdamW state preserves the resumed trajectory, while permutation-only state follows a different one from a functionally identical checkpoint. Finally, gauge-sweep audits show index-level interpretability claims are reproducible only relative to an explicit gauge.",https://arxiv.org/pdf/2606.31963v1,,False
Interface-Aware Neural Newton Preconditioning for Robust Cohesive Zone Model Simulations,30/06/2026,"Zhangyong Liang, Huanhuan Gao","Cohesive Zone Models (CZMs) are widely used to simulate interface fracture, delamination, adhesive failure, and fiber--matrix debonding in aerospace composite structures. In implicit quasi-static finite element analyses, cohesive softening may introduce negative interface tangents, solution jumps, and Newton-basin mismatch, so the previous converged state can become a poor initial guess for the next increment. This may lead to stagnation, wrong-branch convergence, or repeated step cuts. Existing remedies, including viscous regularization, path following, dynamic relaxation, and manual Newton--Raphson (NR) modification, either alter the effective response, increase cost, or rely on hand-crafted interface rules. This work proposes an Interface-Aware Neural Newton Preconditioner (IA-NNP) for difficult CZM increments. IA-NNP recasts manual NR modification as rule-based interface lifting and generalizes it into a learned, state-dependent interface correction. The method acts only on active interface variables and preserves the original traction--separation law, residual assembly, tangent evaluation, history update, and dissipation checks. Two realizations are developed: IA-NNP-Init for learned initial-guess lifting and IA-NNP-NL for iteration-level nonlinear right preconditioning. Interface graph features encode opening, traction, tangent, damage/history variables, mode mixity, residuals, and neighboring states. The correction is bounded, confidence-gated, and accepted only through the original CZM Newton solve. A root-equivalence property shows that IA-NNP changes the path to convergence but not the discrete CZM solution set. Tests on horizontal, circular, two-interface, and active-front benchmarks show improved difficult-increment convergence, better branch recovery, and fewer failures than standard NR and manual NR modification, while preserving the force--displacement response.",https://arxiv.org/pdf/2606.31921v1,,False
Accelerating Conformal Prediction via Approximate Leave-One-Out,30/06/2026,"Jiachen Cong, Jingbo Liu","While conformal prediction provides a general framework for uncertainty quantification in predictive inference, its application is often limited by computational cost. Recent methods, including Jackknife+ and Jackknife-minmax, achieve faster computation by trading a slight loss of efficiency relative to full conformal prediction, but still requires computing leave-one-out refits for all observations. In this paper, we further accelerate conformal prediction by incorporating approximate leave-one-out (ALO) estimators, and establish asymptotic coverage and efficiency. While our proof draws on methods developed for analyzing the consistency of ALO cross-validation risk estimators in high-dimensional statistics, it requires adaptations to handle conformal prediction, where leave-$i$-out residuals are needed for predictions at $x_{n+1}$ rather than just at the training covariate $x_i$. Simulation results validate our theoretical findings, showing that the ALO-based methods achieve coverage and efficiency comparable to the exact methods, while significantly reducing the runtime.",https://arxiv.org/pdf/2606.31915v1,,False
Sequential RC-TGAN: Generating Relational Time Series with Spectral Envelope Loss,30/06/2026,"Mohamed Gueye, Yazid Attabi, Manuel Morales, Maxime Dumas","The generation of synthetic relational databases often involves modeling complex temporal dynamics, such as transaction logs or event sequences. A significant challenge in this domain is the handling of categorical time series (e.g., status codes), where standard encoding methods like one-hot encoding fail to capture intrinsic frequency-domain features such as seasonality and cyclicity. In this paper, we introduce Sequential RC-TGAN (Seq. RC-TGAN), a temporal extension of the RC-TGAN framework, equipped with a novel integrated loss function based on the \textit{Spectral Envelope Theory}. This differentiable loss allows the generator to directly optimize the preservation of latent periodic structures via backpropagation. While spectral envelope theory is inherently designed for categorical sequences, we extend this frequency-domain regularization to continuous time series by employing a Variational Gaussian Mixture Model (VGM) discretization strategy. To establish a mathematically rigorous evaluation standard, we simulate categorical time series governed by a parameter $α$, with exactly known theoretical spectral envelopes. Integrating these dynamic sequences into the child tables of a relational database yields a robust ground-truth benchmark for evaluating the frequency-domain fidelity of our generative framework. Furthermore, we address the lack of robust evaluation standards for relational time series by proposing two new metrics: Spectral Density Divergence and Spectral Envelope Divergence. Experimental results on real-world datasets, as well as our simulated benchmarks, demonstrate that our end-to-end approach significantly outperforms state-of-the-art systems in reproducing cyclic patterns and long-term seasonality across both categorical and continuous features.",https://arxiv.org/pdf/2606.31904v1,,False
Bridging Local Observation and Global Simulation in Closed-Loop Traffic Modeling,30/06/2026,"Ziyan Wang, Tan Xiang, Peng Chen, Xintao Yan","A local-to-global context mismatch arises when autoregressive traffic simulators trained on ego-centric driving logs are deployed in globally observable closed-loop environments. In such logs, the ego vehicle has rich local observations, while surrounding agents are only partially observed due to perception limits and occlusions. As a result, simulators may learn incomplete context--action mappings that remain hidden in log-based training but emerge during closed-loop rollouts, leading to unrealistic behaviors such as abnormal stops, unsafe interactions, and rule violations. We propose CRAFT, a Contextual pReference Alignment Framework for Traffic Simulation, to mitigate this mismatch via self-supervised failure discovery and preference-guided test-time alignment. CRAFT treats the base simulator as a globally observable sandbox, generating diverse what-if rollouts from logged initial states to expose context-induced failures. These failures are grounded with human-aligned driving priors and converted into preference supervision for training a Contextual Preference Evaluator (CPE). At inference time, CPE acts as a plug-in alignment module that scores candidate actions under complete scene context and reweights autoregressive decoding toward globally coherent behaviors. CRAFT mitigates this local-to-global contextual bias, reducing collisions by 31.2\% and traffic violations by 33.2\% without retraining the base simulator.",https://arxiv.org/pdf/2606.31844v1,,False
An Agentic AI Framework to Accelerate Scientific Discovery in Plant Phenotyping,30/06/2026,"Renan Souza, Daniel Rosendo, Kelsey Carter, John Lagergren, Frédéric Suter, Shelaine L. Curd, Gerald A. Tuskan, Rafael Ferreira da Silva, David Weston","High-throughput plant phenotyping now generates image derived datasets far faster than scientists can analyze them. At Oak Ridge National Laboratory's Advanced Plant Phenotyping Laboratory (APPL), automated stations image hundreds of plants daily across multiple remote sensing modalities; yet, trait extraction and interpretation remain manual, expert-bound, and strictly post-hoc, making analysis, not acquisition, the binding constraint on discovery. We present an end-to-end agentic AI framework that turns the facility from a data factory into an interactive autonomous, discovery platform, where scientists partner with AI agents to accelerate time to insight. A conversational Co-Scientist Agent translates a scientist's natural-language question into a structured analysis plan, and a headless Compute Agent dispatches Vision Transformer segmentation and trait extraction on the Frontier exascale supercomputer. The two agents run in separate security and resource domains and communicate over a secure, token-authenticated streaming channel, a design that accounts for the federation, data-movement, and provenance realities cloud-native agentic frameworks ignore, ensuring end-to-end provenance is captured for every interaction. The framework turns a days- to weeks-long analysis process into an interactive loop where agents reason over results, recommend next analyses, and respond to follow-up questions in seconds.",https://arxiv.org/pdf/2606.31831v1,,False
Relational and Sequential Conformal Inference for Energy Time Series over Graphs via Foundation Models,30/06/2026,"Keivan Faghih Niresi, Alice Cicirello, Olga Fink","Accurate energy demand forecasting is essential for the reliable operation and planning of modern sustainable energy systems. Spatial-temporal graph neural networks (STGNNs) have recently achieved strong performance in point forecasting by jointly modeling temporal dynamics and relational dependencies across interconnected energy nodes. However, in real-world energy systems, accurate point forecasts alone are insufficient, as operators also require reliable uncertainty estimates to support risk-aware decision-making, grid stability, and operational planning under uncertainty. Conformal prediction provides a principled and model-agnostic framework for uncertainty quantification with statistical coverage guarantees, making it particularly attractive for safety-critical energy applications. However, existing conformal prediction approaches often fail to fully capture the complex spatial-temporal structure of energy systems. To address these limitations, we propose STOIC (Spatial-Temporal Graph Conformal Prediction with In-Context Learning), a novel framework that integrates graph-based forecasting with the zero-shot calibration capabilities of tabular foundation models. STOIC first generates point forecasts using an STGNN and subsequently reformulates spatial-temporal residuals into a tabular representation suitable for in-context learning. Leveraging a tabular foundation model, STOIC calibrates prediction intervals without task-specific retraining, effectively capturing both sequential and relational dependencies. We evaluate STOIC on five diverse benchmarks, including synthetic simulations as well as real-world electricity and district heating networks. Across all datasets, STOIC consistently outperforms existing conformal prediction baselines, delivering more reliable and robust uncertainty estimates for complex graph-structured energy time series.",https://arxiv.org/pdf/2606.31804v1,,False
RCT: A Robot-Collected Touch-Vision-Language Dataset for Tactile Generalization,30/06/2026,"Jingbo He, Michael Färber, Roberto Calandra","For robots manipulating open-world objects, tactile representations must generalize to unseen materials. We introduce RCT (Robotic Contact Tactile), a robot-collected touch-vision-language dataset with 29,279 tactile frames from full robot presses on 122 industrial reference materials in 7 categories, recorded with three DIGIT sensors at multiple contact positions. RCT preserves each press as a contact sequence, enabling held-out evaluation across materials, categories, sensors, contact positions, and contact sequences. Frames from one press are strongly correlated: frame-random splits can place near-duplicate observations of the same physical interaction in both training and test. With the encoder held fixed, removing contact-sequence overlap reduces tactile-to-text Recall@1 by 17.7 percentage points. When materials are additionally held out at training time, performance drops sharply, leaving held-out-material Recall@1 at 25.1 +/- 6.1% averaged over three held-out draws. The public TVL/HCT split shows the same structure: every test contact sequence appears in training, and raw-pixel nearest neighbors recover the correct sequence in 98.3% of cases. Uniformly sampling a press improves contrastive training, and RCT-trained embeddings improve category probes on unseen materials. RCT makes contact-sequence-aware, held-out-material evaluation reproducible and exposes novel-material generalization as a central challenge for robotic tactile perception. The RCT dataset is open-sourced at https://faerber-lab.github.io/RCT/",https://arxiv.org/pdf/2606.31694v1,,False
CLOUDADV: Decision-Aligned Instance Sizing with Zero-Shot Foundation Models under Drift,30/06/2026,"Jack Bell, Giacomo Carfi, Gerlando Gramaglia, Andrea Simioni, Daniele Fontani, Vincenzo Lomonaco","Cloud virtual machines are often overprovisioned, creating avoidable cost and operational inefficiency. We present CLOUDADV, an interactive engineer-facing advisory system for cloud instance sizing under workload drift. The system combines zero-shot time-series forecasting with bounded recommendation generation across day-, week-, and month-scale planning horizons. For each query, CLOUDADV constructs a structured decision context from historical utilization, forecast summaries, current VM metadata, candidate instance options, pricing, and explicit sizing heuristics. A higher-capacity LLM is used offline to generate reference recommendations, while a smaller production model is evaluated on the same prompts to assess deployment-time alignment under latency and cost constraints. Evaluation prioritizes downstream recommendation quality using simulated Azure cost savings and ex-post exceedance, with rolling-origin forecast accuracy reported as a secondary diagnostic against classical and supervised baselines. In a case study of seven production VMs, the reference recommendations reduce simulated monthly cost from about \$1,503 to \$708, yielding \$795/month in savings (52.9%) under conservative heuristic constraints, while the highest observed exceedance rate among downgraded cases is 1.5%. Although Chronos-2 does not minimize every forecasting metric, it often induces recommendation patterns similar to those of a supervised per-VM baseline. These results suggest that zero-shot foundation models can support decision-aligned provisioning in non-stationary cloud environments while reducing the operational burden of repeated per-tenant retraining, revalidation, and redeployment.",https://arxiv.org/pdf/2606.31470v1,,False
UniTac: A Unified Multimodal Model for Cross-Sensor Tactile Understanding and Generation,30/06/2026,"Jiahang Tu, Fengyu Yang, Chenyang Ma, Xihang Yu, Ziyao Zeng, Shaokai Wu, Hanbin Zhao, Zhi Tao, Chao Zhang, Hui Qian, Alex Wong","Unified multimodal models (UMMs) have shown great promise in integrating understanding and generation across diverse modalities. However, existing research rarely extends this paradigm to the tactile domain, where both object-level semantics and sensor-level configurations jointly determine the meaning of touch. To address this gap, we propose UniTac, the first UMM designed for tactile understanding and generation. UniTac models the tactile process as a transition from non-contact to contact, capturing the physical interaction between sensors and objects through a dual-level representation that encodes both sensor and object attributes. For tactile understanding, UniTac introduces two tasks, object property description and sensor identification, to enhance reasoning over physical and cross-sensor information. For tactile generation, we design a two-stage training paradigm consisting of reconstruction and alignment, together with a sensor-prior-based sampling strategy that simulates realistic tactile contact. Trained on large-scale multi-sensor datasets, UniTac achieves state-of-the-art performance in tactile understanding and generates realistic tactile signals across sensors.",https://arxiv.org/pdf/2606.31451v1,,False
Contextual Slate GLM Bandits with Limited Adaptivity,30/06/2026,"Tanmay Goyal, Sukruta Prakash Midigeshi, Gaurav Sinha","We investigate the contextual slate bandit problem with generalized linear rewards under limited adaptivity. At each round, the learner is presented with $N$ sets of items, where each item is represented by a $d$-dimensional feature vector. The learner then constructs a slate by selecting one item per set; the resulting slate yields a scalar reward sampled from a Generalized Linear Model (GLM). We propose algorithms under two limited-adaptivity settings: (a) Batched and (b) Rarely-Switching. For the batched setting, we introduce B-SlateGLinCB, which partitions the time horizon into $\mathcal{O}(\log\log T)$ batches such that each batch's policy relies only on data from previous batches. For the rarely-switching setting, we propose RS-SlateGLinCB, which adaptively performs only $\mathcal{O}(Nd\log T)$ parameter updates. Under a diversity assumption on the item sequences, we prove that B-SlateGLinCB and RS-SlateGLinCB achieve regret bounds of $\mathcal{O}(Nd^{3/2}\sqrt{T})$ and $\mathcal{O}(Nd\sqrt{T})$, respectively. Notably, both bounds are independent of the non-linearity parameter $κ$ that is typically found to scale the regret of GLM bandit algorithms. Our algorithms are computationally efficient, requiring only $\text{poly}(N)$ time per round despite $2^{Ω(N)}$ possible slates. Simulations show our algorithms outperform existing baselines with limited adaptivity and remain competitive with Slate-GLM-OFU, a fully adaptive state-of-the-art algorithm. Notably, a slightly modified B-SlateGLinCB empirically matches this baseline. Finally, we demonstrate strong performance in a practical in-context example selection task for language models.",https://arxiv.org/pdf/2606.31449v1,,False
DA-Studio: An Agentic System for End-to-End Data Analysis,30/06/2026,"Yizhe Liu, Shaolei Zhang, Ju Fan","Real-world data analysis is a multi-step process over heterogeneous inputs rather than merely producing a final answer. A practical system should autonomously organize multi-step workflows, execute generated code in a sandboxed and controllable environment, and remain inspectable through visible action traces and intermediate artifacts. Existing LLM-based analysis tools, however, often emphasize isolated subtasks, leaving limited support for complete execution-grounded workflows.
  We present DA-Studio (Data Analysis Studio), an interactive web-based demo system for end-to-end data analysis that is autonomous, sandboxed, and inspectable. DA-Studio integrates an action-structured analysis backend, a sandboxed execution workspace, and a browser interface for task setup, streamed action traces, artifact preview, code editing and rerunning, and report export. Through iterative action generation, code execution, and feedback incorporation, it incrementally constructs executable analysis steps from raw files and natural-language requests while exposing intermediate results and artifacts throughout the process.",https://arxiv.org/pdf/2606.31423v1,,False
Xiaomi-GUI-0 Technical Report,30/06/2026,"Wanxia Cao, Chengzhen Duan, Pei Fu, Pengzhi Gao, Niu Lian, Fazhan Liu, Hui Liu, Heng Qu, Qinzhuo Wu, Zhehao Yu, Tongbo Chen, Shiqi Cui, Anan Du, Shukai Jia, Yuanfa Li, Yike Liu, Wenchao Lu, Haoyuan Sun, Jiatong Sun, Cheng Tan, Yajie Wang, Changqiao Wu, Tao Xiong, Jiahui Yang, Yuxuan Yuan, Ruoceng Zhang, Shaojie Zhang, Jian Zhu, Jian Luan, Cong Zou","Graphical user interface (GUI) agents build on vision-language models to complete user tasks end-to-end in real applications through interface actions such as tapping, swiping, text entry, and navigation. However, existing GUI agents are trained and evaluated largely on offline trajectories, simulated environments, and standardized benchmarks. These differ substantially from real applications in interface layout, interaction logic, and abnormal-state distribution, and cannot faithfully characterize execution stability in real-world use, where account states, permission dialogs, payment authentication, and risk control continually reshape the state distribution and open a persistent gap between benchmark scores and real usability. To close this gap, we propose Xiaomi-GUI-0, a native multimodal GUI agent for real mobile environments, trained and evaluated within a real-device closed loop. At its core is a real-device-dominant hybrid infrastructure, where physical devices are the primary execution environment and sandboxes provide auxiliary support, so that data collection, training, rollout, and evaluation share an execution distribution close to real deployment. We construct multi-source training data spanning high-frequency head tasks, high-generalization data for long-tail intents, and capability-enhancement data for reflection and memory, and introduce an error-driven data flywheel that turns failure trajectories into corrected actions, reflective explanations, and recovery demonstrations. The model is trained through a progressive three-stage pipeline of supervised fine-tuning, step-level reinforcement learning, and agentic reinforcement learning. Evaluated on public benchmarks and our in-house RealMobile, Xiaomi-GUI-0 achieves 72.0% success on RealMobile and 78.9% on AndroidWorld, while substantially improving execution stability and abnormal-state recognition in real-world tasks.",https://arxiv.org/pdf/2606.31410v1,,False
3D HAMSTER: Bridging Planning and Control in Hierarchical Vision Language Action Models through 3D Trajectory Guidance,30/06/2026,"Dongyoon Hwang, Byungkun Lee, Dongjin Kim, Hyojin Jang, Hoiyeong Jin, Jueun Mun, Minho Park, Hojoon Lee, Hyunseung Kim, Jaegul Choo","Hierarchical Vision-Language-Action (VLA) models decouple high-level planning from low-level control to improve generalization in robot manipulation. Recent work in this paradigm uses 2D end-effector trajectories predicted by a Vision-Language Model (VLM) as explicit guidance for a downstream policy. However, state-of-the-art low-level policies operate in 3D metric space on point clouds, and feeding them 2D guidance that lacks depth forces each waypoint to be assigned the depth of whatever scene surface lies beneath it, producing geometrically distorted trajectories. We propose 3D HAMSTER, a hierarchical framework that closes this gap by having the planner directly output metrically reliable 3D trajectories. We augment a VLM with a dedicated depth encoder and a dense depth reconstruction objective to predict 3D waypoint sequences, which are directly integrated into a pointcloudbased low-level policy. Across 3D trajectory prediction, simulation, and real-world manipulation, 3D HAMSTER consistently outperforms proprietary VLMs and 2D-guided baselines, with the largest gains under appearance-altering shifts and unseen language, spatial, and visual conditions. The project page is available at https://davian-robotics.github.io/3D_HAMSTER/.",https://arxiv.org/pdf/2606.31329v1,,False
