Title,Publication Date,Author(s),Abstract,Link,DOI,Relevant
DSD: A Distributed Speculative Decoding Solution for Edge-Cloud Agile Large Model Serving,26/11/2025,"Fengze Yu, Leshu Li, Brad McDanel, Saiqian Zhang","Large language model (LLM) inference often suffers from high decoding latency and limited scalability across heterogeneous edge-cloud environments. Existing speculative decoding (SD) techniques accelerate token generation but remain confined to single-node execution. We propose DSD, a distributed speculative decoding framework that extends SD to multi-device deployments through coordinated draft-target execution. Given the lack of prior work on simulating this paradigm, we first introduce DSD-Sim, a discrete-event simulator that captures network, batching, and scheduling dynamics. Building on insights from DSD-Sim, we further design an Adaptive Window Control (AWC) policy that dynamically adjusts speculation window size to optimize throughput. Experiments across diverse workloads show that DSD achieves up to 1.1x speedup and 9.7% higher throughput over existing SD baselines, enabling agile and scalable LLM serving across edge and cloud.",https://arxiv.org/pdf/2511.21669v1,,False
Aligning LLMs Toward Multi-Turn Conversational Outcomes Using Iterative PPO,26/11/2025,"Daniel R. Jiang, Jalaj Bhandari, Yukai Yang, Rémi Munos, Tyler Lu","Optimizing large language models (LLMs) for multi-turn conversational outcomes remains a significant challenge, especially in goal-oriented settings like AI marketing or sales agents who facilitate transactions via messaging platforms. The difficulty stems from sparse, long-horizon rewards and the discrepancy between response-level planning and token-level generation. In this technical note, we propose a formal reduction of the multi-turn RL problem into a sequence of single-turn RLHF-style problems. This is achieved by setting a learned multi-turn Q-function as the reward model for the single-turn problem. We demonstrate and prove a key insight: solving this single-turn RL problem with standard token-level PPO is equivalent to a policy improvement step within the multi-turn problem. This insight naturally leads to Iterative PPO, a batch online policy iteration algorithm that alternates between fitting Q-functions from logged conversation trajectories and improving the policy. A major practical advantage is that Iterative PPO directly leverages stable, off-the-shelf single-turn RLHF tools, making it straightforward to implement. Our method occupies a middle ground between fully online and fully offline approaches, retaining the adaptability of online updates while gaining the stability benefits of offline training.",https://arxiv.org/pdf/2511.21638v1,,False
Visualizing LLM Latent Space Geometry Through Dimensionality Reduction,26/11/2025,"Alex Ning, Vainateya Rangaraju","Large language models (LLMs) achieve state-of-the-art results across many natural language tasks, but their internal mechanisms remain difficult to interpret. In this work, we extract, process, and visualize latent state geometries in Transformer-based language models through dimensionality reduction. We capture layerwise activations at multiple points within Transformer blocks and enable systematic analysis through Principal Component Analysis (PCA) and Uniform Manifold Approximation (UMAP). We demonstrate experiments on GPT-2 and LLaMa models, where we uncover interesting geometric patterns in latent space. Notably, we identify a clear separation between attention and MLP component outputs across intermediate layers, a pattern not documented in prior work to our knowledge. We also characterize the high norm of latent states at the initial sequence position and visualize the layerwise evolution of latent states. Additionally, we demonstrate the high-dimensional helical structure of GPT-2's positional embeddings, the sequence-wise geometric patterns in LLaMa, and experiment with repeating token sequences. We aim to support systematic analysis of Transformer internals with the goal of enabling further reproducible interpretability research. We make our code available at https://github.com/Vainateya/Feature_Geometry_Visualization.",https://arxiv.org/pdf/2511.21594v1,,False
Model-Based Policy Adaptation for Closed-Loop End-to-End Autonomous Driving,26/11/2025,"Haohong Lin, Yunzhi Zhang, Wenhao Ding, Jiajun Wu, Ding Zhao","End-to-end (E2E) autonomous driving models have demonstrated strong performance in open-loop evaluations but often suffer from cascading errors and poor generalization in closed-loop settings. To address this gap, we propose Model-based Policy Adaptation (MPA), a general framework that enhances the robustness and safety of pretrained E2E driving agents during deployment. MPA first generates diverse counterfactual trajectories using a geometry-consistent simulation engine, exposing the agent to scenarios beyond the original dataset. Based on this generated data, MPA trains a diffusion-based policy adapter to refine the base policy's predictions and a multi-step Q value model to evaluate long-term outcomes. At inference time, the adapter proposes multiple trajectory candidates, and the Q value model selects the one with the highest expected utility. Experiments on the nuScenes benchmark using a photorealistic closed-loop simulator demonstrate that MPA significantly improves performance across in-domain, out-of-domain, and safety-critical scenarios. We further investigate how the scale of counterfactual data and inference-time guidance strategies affect overall effectiveness.",https://arxiv.org/pdf/2511.21584v1,,False
Learning When to Stop: Adaptive Latent Reasoning via Reinforcement Learning,26/11/2025,"Alex Ning, Yen-Ling Kuo, Gabe Gomes","Latent reasoning represents a new development in Transformer language models that has shown potential in compressing reasoning lengths compared to chain-of-thought reasoning. By directly passing the information-rich previous final latent state into the next sequence, latent reasoning removes the restriction to human language tokens as the medium for reasoning. We develop adaptive-length latent reasoning models and introduce a post-SFT reinforcement-learning methodology to optimize latent reasoning length by minimizing reasoning length while maintaining accuracy. This, in turn, further reduces compute usage and raises the bar on the compressive capabilities of latent reasoning models. Experiments on the Llama 3.2 1B model and the GSM8K-Aug dataset show a $52\%$ drop in total reasoning length with no penalty to accuracy. In future work, we plan to extend to additional models and datasets, analyze relationships between training coefficients, experiment with architecture variations, and continue our knowledge distillation for latent reasoning SFT efforts. We make our code and pretrained weights available at https://github.com/apning/adaptive-latent-reasoning.",https://arxiv.org/pdf/2511.21581v1,,False
Multimodal Robust Prompt Distillation for 3D Point Cloud Models,26/11/2025,"Xiang Gu, Liming Lu, Xu Zheng, Anan Du, Yongbin Zhou, Shuchao Pang","Adversarial attacks pose a significant threat to learning-based 3D point cloud models, critically undermining their reliability in security-sensitive applications. Existing defense methods often suffer from (1) high computational overhead and (2) poor generalization ability across diverse attack types. To bridge these gaps, we propose a novel yet efficient teacher-student framework, namely Multimodal Robust Prompt Distillation (MRPD) for distilling robust 3D point cloud model. It learns lightweight prompts by aligning student point cloud model's features with robust embeddings from three distinct teachers: a vision model processing depth projections, a high-performance 3D model, and a text encoder. To ensure a reliable knowledge transfer, this distillation is guided by a confidence-gated mechanism which dynamically balances the contribution of all input modalities. Notably, since the distillation is all during the training stage, there is no additional computational cost at inference. Extensive experiments demonstrate that MRPD substantially outperforms state-of-the-art defense methods against a wide range of white-box and black-box attacks, while even achieving better performance on clean data. Our work presents a new, practical paradigm for building robust 3D vision systems by efficiently harnessing multimodal knowledge.",https://arxiv.org/pdf/2511.21574v1,,False
A decoupled alignment kernel for peptide membrane permeability predictions,26/11/2025,"Ali Amirahmadi, Gökçe Geylan, Leonardo De Maria, Farzaneh Etminani, Mattias Ohlsson, Alessandro Tibo","Cyclic peptides are promising modalities for targeting intracellular sites; however, cell-membrane permeability remains a key bottleneck, exacerbated by limited public data and the need for well-calibrated uncertainty. Instead of relying on data-eager complex deep learning architecture, we propose a monomer-aware decoupled global alignment kernel (MD-GAK), which couples chemically meaningful residue-residue similarity with sequence alignment while decoupling local matches from gap penalties. MD-GAK is a relatively simple kernel. To further demonstrate the robustness of our framework, we also introduce a variant, PMD-GAK, which incorporates a triangular positional prior. As we will show in the experimental section, PMD-GAK can offer additional advantages over MD-GAK, particularly in reducing calibration errors. Since our focus is on uncertainty estimation, we use Gaussian Processes as the predictive model, as both MD-GAK and PMD-GAK can be directly applied within this framework. We demonstrate the effectiveness of our methods through an extensive set of experiments, comparing our fully reproducible approach against state-of-the-art models, and show that it outperforms them across all metrics.",https://arxiv.org/pdf/2511.21566v1,,False
Machine Learning Approaches to Clinical Risk Prediction: Multi-Scale Temporal Alignment in Electronic Health Records,26/11/2025,"Wei-Chen Chang, Lu Dai, Ting Xu","This study proposes a risk prediction method based on a Multi-Scale Temporal Alignment Network (MSTAN) to address the challenges of temporal irregularity, sampling interval differences, and multi-scale dynamic dependencies in Electronic Health Records (EHR). The method focuses on temporal feature modeling by introducing a learnable temporal alignment mechanism and a multi-scale convolutional feature extraction structure to jointly model long-term trends and short-term fluctuations in EHR sequences. At the input level, the model maps multi-source clinical features into a unified high-dimensional semantic space and employs temporal embedding and alignment modules to dynamically weight irregularly sampled data, reducing the impact of temporal distribution differences on model performance. The multi-scale feature extraction module then captures key patterns across different temporal granularities through multi-layer convolution and hierarchical fusion, achieving a fine-grained representation of patient states. Finally, an attention-based aggregation mechanism integrates global temporal dependencies to generate individual-level risk representations for disease risk prediction and health status assessment. Experiments conducted on publicly available EHR datasets show that the proposed model outperforms mainstream baselines in accuracy, recall, precision, and F1-Score, demonstrating the effectiveness and robustness of multi-scale temporal alignment in complex medical time-series analysis. This study provides a new solution for intelligent representation of high-dimensional asynchronous medical sequences and offers important technical support for EHR-driven clinical risk prediction.",https://arxiv.org/pdf/2511.21561v1,,False
MMA: A Momentum Mamba Architecture for Human Activity Recognition with Inertial Sensors,26/11/2025,"Thai-Khanh Nguyen, Uyen Vo, Tan M. Nguyen, Thieu N. Vo, Trung-Hieu Le, Cuong Pham","Human activity recognition (HAR) from inertial sensors is essential for ubiquitous computing, mobile health, and ambient intelligence. Conventional deep models such as Convolutional Neural Networks (CNNs), Recurrent Neural Networks (RNNs), and transformers have advanced HAR but remain limited by vanishing or exloding gradients, high computational cost, and difficulty in capturing long-range dependencies. Structured state-space models (SSMs) like Mamba address these challenges with linear complexity and effective temporal modeling, yet they are restricted to first-order dynamics without stable longterm memory mechanisms. We introduce Momentum Mamba, a momentum-augmented SSM that incorporates second-order dynamics to improve stability of information flow across time steps, robustness, and long-sequence modeling. Two extensions further expand its capacity: Complex Momentum Mamba for frequency-selective memory scaling. Experiments on multiple HAR benchmarks demonstrate consistent gains over vanilla Mamba and Transformer baselines in accuracy, robustness, and convergence speed. With only moderate increases in training cost, momentum-augmented SSMs offer a favorable accuracy-efficiency balance, establishing them as a scalable paradigm for HAR and a promising principal framework for broader sequence modeling applications.",https://arxiv.org/pdf/2511.21550v1,,False
"Context-Specific Causal Graph Discovery with Unobserved Contexts: Non-Stationarity, Regimes and Spatio-Temporal Patterns",26/11/2025,"Martin Rabel, Jakob Runge","Real-world data, for example in climate applications, often consists of spatially gridded time series data or data with comparable structure. While the underlying system is often believed to behave similar at different points in space and time, those variations that do exist are twofold relevant: They often encode important information in and of themselves. And they may negatively affect the stability / convergence and reliability\Slash{}validity of results of algorithms assuming stationarity or space-translation invariance. We study the information encoded in changes of the causal graph, with stability in mind. An analysis of this general task identifies two core challenges. We develop guiding principles to overcome these challenges, and provide a framework realizing these principles by modifying constraint-based causal discovery approaches on the level of independence testing. This leads to an extremely modular, easily extensible and widely applicable framework. It can leverage existing constraint-based causal discovery methods (demonstrated on IID-algorithms PC, PC-stable, FCI and time series algorithms PCMCI, PCMCI+, LPCMCI) with little to no modification. The built-in modularity allows to systematically understand and improve upon an entire array of subproblems. By design, it can be extended by leveraging insights from change-point-detection, clustering, independence-testing and other well-studied related problems. The division into more accessible sub-problems also simplifies the understanding of fundamental limitations, hyperparameters controlling trade-offs and the statistical interpretation of results. An open-source implementation will be available soon.",https://arxiv.org/pdf/2511.21537v1,,False
Going with the Speed of Sound: Pushing Neural Surrogates into Highly-turbulent Transonic Regimes,26/11/2025,"Fabian Paischer, Leo Cotteleer, Yann Dreze, Richard Kurle, Dylan Rubini, Maurits Bleeker, Tobias Kronlachner, Johannes Brandstetter","The widespread use of neural surrogates in automotive aerodynamics, enabled by datasets such as DrivAerML and DrivAerNet++, has primarily focused on bluff-body flows with large wakes. Extending these methods to aerospace, particularly in the transonic regime, remains challenging due to the high level of non-linearity of compressible flows and 3D effects such as wingtip vortices. Existing aerospace datasets predominantly focus on 2D airfoils, neglecting these critical 3D phenomena. To address this gap, we present a new dataset of CFD simulations for 3D wings in the transonic regime. The dataset comprises volumetric and surface-level fields for around $30,000$ samples with unique geometry and inflow conditions. This allows computation of lift and drag coefficients, providing a foundation for data-driven aerodynamic optimization of the drag-lift Pareto front. We evaluate several state-of-the-art neural surrogates on our dataset, including Transolver and AB-UPT, focusing on their out-of-distribution (OOD) generalization over geometry and inflow variations. AB-UPT demonstrates strong performance for transonic flowfields and reproduces physically consistent drag-lift Pareto fronts even for unseen wing configurations. Our results demonstrate that AB-UPT can approximate drag-lift Pareto fronts for unseen geometries, highlighting its potential as an efficient and effective tool for rapid aerodynamic design exploration. To facilitate future research, we open-source our dataset at https://huggingface.co/datasets/EmmiAI/Emmi-Wing.",https://arxiv.org/pdf/2511.21474v1,,False
Ensemble Performance Through the Lens of Linear Independence of Classifier Votes in Data Streams,26/11/2025,"Enes Bektas, Fazli Can","Ensemble learning improves classification performance by combining multiple base classifiers. While increasing the number of classifiers generally enhances accuracy, excessively large ensembles can lead to computational inefficiency and diminishing returns. This paper investigates the relationship between ensemble size and performance through the lens of linear independence among classifier votes in data streams. We propose that ensembles composed of linearly independent classifiers maximize representational capacity, particularly under a geometric model. We then generalize the importance of linear independence to the weighted majority voting problem. By modeling the probability of achieving linear independence among classifier outputs, we derive a theoretical framework that explains the trade-off between ensemble size and accuracy. Our analysis leads to a theoretical estimate of the ensemble size required to achieve a user-specified probability of linear independence. We validate our theory through experiments on both real-world and synthetic datasets using two ensemble methods, OzaBagging and GOOWE. Our results confirm that this theoretical estimate effectively identifies the point of performance saturation for robust ensembles like OzaBagging. Conversely, for complex weighting schemes like GOOWE, our framework reveals that high theoretical diversity can trigger algorithmic instability. Our implementation is publicly available to support reproducibility and future research.",https://arxiv.org/pdf/2511.21465v1,,False
From Observation to Action: Latent Action-based Primitive Segmentation for VLA Pre-training in Industrial Settings,26/11/2025,"Jiajie Zhang, Sören Schwertfeger, Alexander Kleiner","We present a novel unsupervised framework to unlock vast unlabeled human demonstration data from continuous industrial video streams for Vision-Language-Action (VLA) model pre-training. Our method first trains a lightweight motion tokenizer to encode motion dynamics, then employs an unsupervised action segmenter leveraging a novel ""Latent Action Energy"" metric to discover and segment semantically coherent action primitives. The pipeline outputs both segmented video clips and their corresponding latent action sequences, providing structured data directly suitable for VLA pre-training. Evaluations on public benchmarks and a proprietary electric motor assembly dataset demonstrate effective segmentation of key tasks performed by humans at workstations. Further clustering and quantitative assessment via a Vision-Language Model confirm the semantic coherence of the discovered action primitives. To our knowledge, this is the first fully automated end-to-end system for extracting and organizing VLA pre-training data from unstructured industrial videos, offering a scalable solution for embodied AI integration in manufacturing.",https://arxiv.org/pdf/2511.21428v1,,False
Odin: Oriented Dual-module Integration for Text-rich Network Representation Learning,26/11/2025,"Kaifeng Hong, Yinglong Zhang, Xiaoying Hong, Xuewen Xia, Xing Xu","Text-attributed graphs require models to effectively combine strong textual understanding with structurally informed reasoning. Existing approaches either rely on GNNs--limited by over-smoothing and hop-dependent diffusion--or employ Transformers that overlook graph topology and treat nodes as isolated sequences. We propose Odin (Oriented Dual-module INtegration), a new architecture that injects graph structure into Transformers at selected depths through an oriented dual-module mechanism.Unlike message-passing GNNs, Odin does not rely on multi-hop diffusion; instead, multi-hop structures are integrated at specific Transformer layers, yielding low-, mid-, and high-level structural abstraction aligned with the model's semantic hierarchy. Because aggregation operates on the global [CLS] representation, Odin fundamentally avoids over-smoothing and decouples structural abstraction from neighborhood size or graph topology. We further establish that Odin's expressive power strictly contains that of both pure Transformers and GNNs.To make the design efficient in large-scale or low-resource settings, we introduce Light Odin, a lightweight variant that preserves the same layer-aligned structural abstraction for faster training and inference. Experiments on multiple text-rich graph benchmarks show that Odin achieves state-of-the-art accuracy, while Light Odin delivers competitive performance with significantly reduced computational cost. Together, Odin and Light Odin form a unified, hop-free framework for principled structure-text integration. The source code of this model has been released at https://github.com/hongkaifeng/Odin.",https://arxiv.org/pdf/2511.21416v1,,False
Subjective Depth and Timescale Transformers: Learning Where and When to Compute,26/11/2025,"Frederico Wieser, Martin Benfeghoul, Haitham Bou Ammar, Jun Wang, Zafeirios Fountas","The rigid, uniform allocation of computation in standard Transformer (TF) architectures can limit their efficiency and scalability, particularly for large-scale models and long sequences. Addressing this, we introduce Subjective Depth Transformers (SDT) and Subjective Timescale Transformers (STT), two distinct architectures that leverage Bayesian surprise signals to dynamically route computation, learning where and when to compute within decoder-only TFs. SDT augments a decoder-only stack with alternating Decision and Dynamic layers: a Decision layer computes a full block 'posterior' and a lightweight 'prior,' while a Dynamic layer employs fixed-capacity Top-K routing based on Bayesian surprise (Expected and Unexpected Change), maintaining a static compute graph. STT extends this conditional computation to the temporal domain: a transition network predicts residual updates, forming a temporal 'change hypothesis' that informs a router to dynamically execute or bypass TF blocks for each token, managing KV-cache contributions. Both architectures exhibit the predicted shift from novelty to prediction driven gating over training, suggesting alignment with surprise based principles. While operating at reduced capacity, they offer preliminary insights into the compute-accuracy trade-offs of conditional computation. The proposed architectures establish a flexible framework for efficiency, reducing self-attention computation by 75% and KV-cache requirements by 50% within each compute skipping layer, setting a pathway for more efficient models.",https://arxiv.org/pdf/2511.21408v1,,False
Phase-Aware Code-Aided EM Algorithm for Blind Channel Estimation in PSK-Modulated OFDM,26/11/2025,"Chin-Hung Chen, Ivana Nikoloska, Wim van Houtum, Yan Wu, Alex Alvarado","This paper presents a fully blind phase-aware expectation-maximization (EM) algorithm for OFDM systems with the phase-shift keying (PSK) modulation. We address the well-known local maximum problem of the EM algorithm for blind channel estimation. This is primarily caused by the unknown phase ambiguity in the channel estimates, which conventional blind EM estimators cannot resolve. To overcome this limitation, we propose to exploit the extrinsic information from the decoder as model evidence metrics. A finite set of candidate models is generated based on the inherent symmetries of PSK modulation, and the decoder selects the most likely candidate model. Simulation results demonstrate that, when combined with a simple convolutional code, the phase-aware EM algorithm reliably resolves phase ambiguity during the initialization stage and reduces the local convergence rate from 80% to nearly 0% in frequency-selective channels with a constant phase ambiguity. The algorithm is invoked only once after the EM initialization stage, resulting in negligible additional complexity during subsequent turbo iterations.",https://arxiv.org/pdf/2511.21340v1,,False
