Title,Publication Date,Author(s),Abstract,Link,DOI,Relevant
Simulation-based Inference via Langevin Dynamics with Score Matching,04/09/2025,"Haoyu Jiang, Yuexi Wang, Yun Yang","Simulation-based inference (SBI) enables Bayesian analysis when the
likelihood is intractable but model simulations are available. Recent advances
in statistics and machine learning, including Approximate Bayesian Computation
and deep generative models, have expanded the applicability of SBI, yet these
methods often face challenges in moderate to high-dimensional parameter spaces.
Motivated by the success of gradient-based Monte Carlo methods in Bayesian
sampling, we propose a novel SBI method that integrates score matching with
Langevin dynamics to explore complex posterior landscapes more efficiently in
such settings. Our approach introduces tailored score-matching procedures for
SBI, including a localization scheme that reduces simulation costs and an
architectural regularization that embeds the statistical structure of
log-likelihood scores to improve score-matching accuracy. We provide
theoretical analysis of the method and illustrate its practical benefits on
benchmark tasks and on more challenging problems in moderate to high
dimensions, where it performs favorably compared to existing approaches.",http://arxiv.org/pdf/2509.03853v1,,False
MillGNN: Learning Multi-Scale Lead-Lag Dependencies for Multi-Variate Time Series Forecasting,04/09/2025,"Binqing Wu, Zongjiang Shang, Jianlong Huang, Ling Chen","Multi-variate time series (MTS) forecasting is crucial for various
applications. Existing methods have shown promising results owing to their
strong ability to capture intra- and inter-variate dependencies. However, these
methods often overlook lead-lag dependencies at multiple grouping scales,
failing to capture hierarchical lead-lag effects in complex systems. To this
end, we propose MillGNN, a novel \underline{g}raph \underline{n}eural
\underline{n}etwork-based method that learns \underline{m}ult\underline{i}ple
grouping scale \underline{l}ead-\underline{l}ag dependencies for MTS
forecasting, which can comprehensively capture lead-lag effects considering
variate-wise and group-wise dynamics and decays. Specifically, MillGNN
introduces two key innovations: (1) a scale-specific lead-lag graph learning
module that integrates cross-correlation coefficients and dynamic decaying
features derived from real-time inputs and time lags to learn lead-lag
dependencies for each scale, which can model evolving lead-lag dependencies
with statistical interpretability and data-driven flexibility; (2) a
hierarchical lead-lag message passing module that passes lead-lag messages at
multiple grouping scales in a structured way to simultaneously propagate intra-
and inter-scale lead-lag effects, which can capture multi-scale lead-lag
effects with a balance of comprehensiveness and efficiency. Experimental
results on 11 datasets demonstrate the superiority of MillGNN for long-term and
short-term MTS forecasting, compared with 16 state-of-the-art methods.",http://arxiv.org/pdf/2509.03852v1,,False
"Hardware-Aware Data and Instruction Mapping for AI Tasks: Balancing Parallelism, I/O and Memory Tradeoffs",04/09/2025,"Md Rownak Hossain Chowdhury, Mostafizur Rahman","We introduce a mapping framework for deep learning inference that takes
advantage of predictable neural network behavior to plan both computation and
communication ahead of time. The framework generates a unified stream of
instructions and data, enabling the hardware to execute operations and route
information on its own, without frequent involvement from the host and with
minimal off-chip memory use. This naturally reduces reliance on I/O, off-chip
memory, and host control. By leveraging fine-grained message passing on a
programmable, message-based compute architecture, the framework keeps data
movement local and coordinates computation across the array using techniques
such as stationary-weight reuse, in-array multicasting, and staged reductions.
Applied to VGG-19, the framework sustains high utilization (88 to 92 percent),
with over 97 percent of messages generated internally and nearly 89 percent of
time consumed on-chip transfers. Computation throughput scales beyond 1 TFLOP/s
on larger arrays, while traffic reductions from reuse and local aggregation
reach up to 100 MB per layer. Overall, the results highlight the effectiveness
of streaming-based computation and show how our mapper enables this execution
style by tightly coordinating data and instruction flow across the hardware.",http://arxiv.org/pdf/2509.03846v1,,False
Vehicle-to-Infrastructure Collaborative Spatial Perception via Multimodal Large Language Models,04/09/2025,"Kimia Ehsani, Walid Saad","Accurate prediction of communication link quality metrics is essential for
vehicle-to-infrastructure (V2I) systems, enabling smooth handovers, efficient
beam management, and reliable low-latency communication. The increasing
availability of sensor data from modern vehicles motivates the use of
multimodal large language models (MLLMs) because of their adaptability across
tasks and reasoning capabilities. However, MLLMs inherently lack
three-dimensional spatial understanding. To overcome this limitation, a
lightweight, plug-and-play bird's-eye view (BEV) injection connector is
proposed. In this framework, a BEV of the environment is constructed by
collecting sensing data from neighboring vehicles. This BEV representation is
then fused with the ego vehicle's input to provide spatial context for the
large language model. To support realistic multimodal learning, a co-simulation
environment combining CARLA simulator and MATLAB-based ray tracing is developed
to generate RGB, LiDAR, GPS, and wireless signal data across varied scenarios.
Instructions and ground-truth responses are programmatically extracted from the
ray-tracing outputs. Extensive experiments are conducted across three V2I link
prediction tasks: line-of-sight (LoS) versus non-line-of-sight (NLoS)
classification, link availability, and blockage prediction. Simulation results
show that the proposed BEV injection framework consistently improved
performance across all tasks. The results indicate that, compared to an
ego-only baseline, the proposed approach improves the macro-average of the
accuracy metrics by up to 13.9%. The results also show that this performance
gain increases by up to 32.7% under challenging rainy and nighttime conditions,
confirming the robustness of the framework in adverse settings.",http://arxiv.org/pdf/2509.03837v1,,False
SAMVAD: A Multi-Agent System for Simulating Judicial Deliberation Dynamics in India,04/09/2025,"Prathamesh Devadiga, Omkaar Jayadev Shetty, Pooja Agarwal","Understanding the complexities of judicial deliberation is crucial for
assessing the efficacy and fairness of a justice system. However, empirical
studies of judicial panels are constrained by significant ethical and practical
barriers. This paper introduces SAMVAD, an innovative Multi-Agent System (MAS)
designed to simulate the deliberation process within the framework of the
Indian justice system.
  Our system comprises agents representing key judicial roles: a Judge, a
Prosecution Counsel, a Defense Counsel, and multiple Adjudicators (simulating a
judicial bench), all powered by large language models (LLMs). A primary
contribution of this work is the integration of Retrieval-Augmented Generation
(RAG), grounded in a domain-specific knowledge base of landmark Indian legal
documents, including the Indian Penal Code and the Constitution of India. This
RAG functionality enables the Judge and Counsel agents to generate legally
sound instructions and arguments, complete with source citations, thereby
enhancing both the fidelity and transparency of the simulation.
  The Adjudicator agents engage in iterative deliberation rounds, processing
case facts, legal instructions, and arguments to reach a consensus-based
verdict. We detail the system architecture, agent communication protocols, the
RAG pipeline, the simulation workflow, and a comprehensive evaluation plan
designed to assess performance, deliberation quality, and outcome consistency.
  This work provides a configurable and explainable MAS platform for exploring
legal reasoning and group decision-making dynamics in judicial simulations,
specifically tailored to the Indian legal context and augmented with verifiable
legal grounding via RAG.",http://arxiv.org/pdf/2509.03793v1,,False
