Title,Publication Date,Author(s),Abstract,Link,DOI,Relevant
Artificial Intelligence Reshapes Microwave Photonics,20/05/2026,"Peng Li, Xihua Zou, Jia Ye, Wei Pan, Lianshan Yan","As a rapidly emerging interdisciplinary field that intrinsically integrates microwave and photonics, microwave photonics (MWP) provides disruptive solutions to overcome the fundamental bandwidth of conventional electronic systems. By exploiting the inherently ultra-wide bandwidth and low-loss characteristics of photonic technologies, MWP enables the generation, transmission, processing, and detection of microwave, millimeter-wave, and terahertz signals. Representative breakthroughs include fully photonic microwave radar systems, photonic analog-to-digital converters with bandwidth up to 320 GHz, and photonic wireless communication systems achieving data rate as high as 616 Gbit/s. Meanwhile, the rapid growth of artificial intelligence (AI) is reshaping scientific research, engineering, and daily life in unprecedented ways, such as AI for science/engineering and AI co-scientist/assistant. Correspondingly, AI is profoundly reshaping MWP in all aspects, ranging from signal generation, transmission to signal processing and detection. AI has revolutionized the design, simulation, fabrication, testing, deployment, and maintenance of MWP systems, delivering autonomous operation and exceptional efficiency beyond traditional systems. Motivated by these developments, this Review Paper provides the first comprehensive overview of AI-enabled MWP, systematically summarizing the state-of-the-art advances and presenting insights for both the academic community and the broader public.",https://arxiv.org/pdf/2605.21224v1,10.1002/lpor.71267,False
SURGE: An Event-Centric Social Media Sentiment Time Series Benchmark with Interaction Structure,20/05/2026,"Chen Su, Pengsen Cheng, Yuanhe Tian, Yan Song","Public events on social media generate large volumes of discussion whose collective dynamics carry direct value for opinion forecasting and crisis response. Capturing how these dynamics evolve across an event's lifecycle requires organizing fragmented posts into event-level time series. Existing datasets cover only a small number of events within a single category, and typically discard the interaction structure between posts when constructing time series, which restricts both transfer across event types and controlled study of how interactions shape the resulting collective dynamics. We present SURGE, a multi-event social media benchmark that pairs event-level time series with aligned text and interaction structure linking posts within an event. SURGE is built through an automated pipeline that produces calendar-aligned time series at three temporal granularities, covering 67 events and more than 800K posts across five event categories. Each time bin is paired with flat and structured textual views derived from the same selected posts, enabling controlled evaluation of whether social interaction structure affects forecasting behavior. On top of SURGE we define benchmark protocols for numerical-only forecasting, text-augmented forecasting, high-interaction evaluation, and leave-one-category-out generalization. Experiments with representative time-series and multimodal forecasting models reveal three properties of the benchmark: a strong local-persistence regime in which naive baselines remain hard to beat under absolute error, limited transfer of existing text-augmented forecasters to event-driven social-media data, and increased difficulty on reply-dense periods that aggregate metrics tend to obscure. We further include a lightweight structure-aware probe as a reference implementation, illustrating how SURGE can support interaction-aware forecasting research.",https://arxiv.org/pdf/2605.21198v1,,False
Domain-Adaptable Reinforcement Learning for Code Generation with Dense Rewards,20/05/2026,"Erfan Aghadavoodi Jolfaei, Daniel Maninger, Abhinav Anand, Mert Tiftikci, Mira Mezini","Large language models show strong potential for automated code generation, but lack guarantees for correctness, quality, safety, and domain-specific constraints. For instance in robotics, where code generation is increasingly being used for planning and executing actions, awareness of the environment and physical constraints is critical. To facilitate the adaption of code-generating LLMs to diverse requirements, including domain-specific ones, we present a reinforcement learning framework that fine-tunes pre-trained LLMs using proximal policy optimization. Our customizable execution-aware reward formula captures and optimizes syntax, functional correctness, code style, security, and simulator executability. A token-level reward mapping mechanism enables effective credit assignment from execution outcomes to generated tokens. The framework is evaluated on general-purpose code generation (MBPP/MBPP+) and robotic program synthesis (RoboEval). The results show substantial improvements in functional correctness and simulator executability, including an absolute pass@1 increase of 19% on MBPP and a reduction in execution failures by 51% on RoboEval. These findings demonstrate that structured reinforcement learning can effectively align language models to correct program generation and domain-specific requirements.",https://arxiv.org/pdf/2605.21180v1,,False
ScenePilot: Controllable Boundary-Driven Critical Scenario Generation for Autonomous Driving,20/05/2026,"Qiyu Ruan, Yuxuan Wang, He Li, Zhenning Li, Cheng-zhong Xu","Safety-critical scenarios are central to evaluating autonomous driving systems, yet their rarity in naturalistic logs makes simulation-based stress testing indispensable. Most scenario generation methods treat surrounding agents as adversaries, but they either (i) induce failures without explicitly modeling vehicle-road physical limits, yielding visually extreme yet physically unsolvable crashes, or (ii) enforce physical feasibility or policy feasibility in isolation, which can over-focus on aggressive maneuvers or remain tied to a controller-dependent capability boundary. We propose ScenePilot, a feasibility-guided, boundary-driven framework that targets the boundary band: scenarios that are physically solvable in principle yet still cause the deployed autonomy stack to fail. We formulate generation as constrained multi-objective reinforcement learning, combining an RSS-derived physical-feasibility score $σ$ with an online-learned AV-risk predictor $Φ$, and introduce step-level feasibility-aware shielding to keep exploration near the feasibility boundary while avoiding infeasible artifacts. Experiments on SafeBench with multiple planners show that ScenePilot yields substantially higher collision rates (+6.2 percentage points) while preserving physical validity, and that adversarial fine-tuning on these boundary-band scenarios consistently reduces downstream crash rates. The code is available at https://github.com/QiyuRuan/ScenePilot.",https://arxiv.org/pdf/2605.21168v1,,False
SMoA: Spectrum Modulation Adapter for Parameter-Efficient Fine-Tuning,20/05/2026,"Yongkang Liu, Xing Li, Mengjie Zhao, Shanru Zhang, Zijing Wang, Qian Li, Shi Feng, Feiliang Ren, Daling Wang, Hinrich Schütze","As the number of model parameters increases, parameter-efficient fine-tuning (PEFT) has become the go-to choice for tailoring pre-trained large language models. Low-rank Adaptation (LoRA) uses a low-rank update method to simulate full parameter fine-tuning, which is widely used to reduce resource requirements. However, decreasing the rank encounters challenges with limited representational capacity. Theory suggests that LoRA fine-tuning with rank r converges toward the top r singular values of the pre-trained weight matrix. As the rank increases, more principal singular directions are preserved, which generally improves the model's performance. However, a larger rank also introduces more trainable parameters, leading to higher computational cost. To overcome this dilemma, we propose SMoA, a \textbf{S}pectrum \textbf{Mo}dulation \textbf{A}dapter that enlarges the accessible family of spectrum-aware updates under a smaller parameter budget. SMoA partitions the layer into multiple aligned spectral blocks and applies one in-block Hadamard-modulated low-rank branch to each diagonal block, yielding broader coverage of pretrained spectral directions. We provide theoretical analysis and empirical results on multiple tasks. In our experiments, SMoA improves average performance in the current lower-budget setting over LoRA and competitive LoRA-style baselines.",https://arxiv.org/pdf/2605.21147v1,,False
Efficient Learning of Deep State Space Models via Importance Smoothing,20/05/2026,"John-Joseph Brady, Nikolas Nusken, Yunpeng Li","Latent state space systems are ubiquitous in statistical modelling, arising naturally when a time series is observed through a noisy measurement function, however training deep state space models (DSSM) at scale remains difficult. Two largely distinct strategies and literatures have developed around the training of DSSMs. Firstly, auto-encoding DSSMs train generative DSSMs by optimising a variational lower bound. Secondly, DSSMs trained by back-propagating the outputs of a classical sequential Monte Carlo algorithm (SMC). Such approaches can train DSSMs for discriminative as well as generative tasks, however, due to the sequentiality of their forward pass, scale poorly on modern hardware. We propose a new training method \emph{parallel variational Monte Carlo} (PVMC) that bridges the gap between the paradigms, and can be used robustly to train DSSMs for both discriminative and generative tasks. Our method achieves state-of-the-art or better results on a set of baseline experiments and trains $10\times$ faster than the fastest competing SMC approach.",https://arxiv.org/pdf/2605.21108v1,,False
Towards Understanding Self-Pretraining for Sequence Classification,20/05/2026,"Omar Coser, Loredana Zollo, Paolo Soda, Antonio Orvieto","Amos et al. (2024) showed that the accuracy of Transformer models in sequence classification can be significantly improved by first pretraining with a masked token prediction objective without external data or augmentation, a procedure referred to as self-pretraining (SPT). While the primary objective of Amos et al. (2024) was to showcase that Transformers can achieve strong performance on the Long-Range Arena (LRA), their pipeline raises more fundamental questions: How does SPT drive optimization to better solutions? Why can standard supervised training fail in Transformers? To better understand this, we replicate and systematically ablate the findings of Amos et al. (2024). Our ablations suggest that a central bottleneck in the studied settings is not depth or generalization alone, but the ability of label supervision to learn useful query-key Attention patterns from random initialization. With a minimal setup, we identify learning proximity interactions - turning absolute positional encodings into proximity-biased Attention scores - as a key source of the improvements brought by SPT. Finally, in a simplified theoretical setup, we show that label supervision can be locally blind to certain Attention-score directions that are instead detectable through masked reconstruction.",https://arxiv.org/pdf/2605.21070v1,,False
Expectation Consistency Loss: Rethink Confidence Calibration under Covariate Shift,20/05/2026,"Jinzong Dong, Zhaohui Jiang, Bo Yang","Confidence calibration for classification models is vital in safety-critical decision-making scenarios and has received extensive attention. General confidence calibration methods assume training and test data are independent and identically distributed, limiting their effectiveness under covariate shifts. Previous calibration methods under covariate shift struggle with class-wise or canonical calibrations and often rely on unstable importance weighting when density ratios are large or unbounded. Given the above limitations, this paper rethinks confidence calibration under covariate shifts. First, we derive a necessary and sufficient condition for confidence calibration under covariate shifts, named Expectation consistency condition, which reveals covariate shifts do not necessarily lead to uncalibrated confidence and provides a weaker condition for confidence calibration than global covariate distribution alignment. Then, utilizing Expectation consistency condition, this paper proposes an unsupervised domain adaptation loss to calibrate confidence of the target domain, named Expectation consistency loss (ECL), which is compatible with canonical calibration, class-wise calibration, and top-label calibration. Third, we prove that computing ECL loss has the same sample complexity as Expected Calibration Error (ECE) and provide a theoretically grounded mini-batch trainable scheme for ECL loss. Finally, we validate the effectiveness of our method on both simulated and real-world covariate shift datasets.",https://arxiv.org/pdf/2605.21552v1,,False
DySink: Dynamic Frame Sinks for Autoregressive Long Video Generation,20/05/2026,"Bo Ye, Xinyu Cui, Jian Zhao, Tong Wei, Min-Ling Zhang","Autoregressive long video generation often adopts bounded-memory streaming for efficiency, typically combining local windows for short-term continuity with static early-frame sinks as long-range anchors. However, this fixed allocation keeps early frames cached even when the current visual state has substantially diverged from them, while discarding potentially more relevant intermediate history. As a result, the retained long-range context may become less adaptive and bias generation toward outdated cues; in severe cases, RoPE-induced phase re-alignment can homogenize inter-head attention and cause sink collapse, where content regresses toward sink frames. We propose DySink, a retrieval-based framework that maintains a compact memory bank and selects visually relevant historical frames as dynamic frame sinks. DySink couples adaptive retrieval with a sink anomaly gate, which detects excessive inter-head consensus over retrieved context and suppresses collapse-prone context. Experiments on minute-long videos show that DySink consistently improves dynamic degree over strong baselines while also achieving higher temporal quality. The code and model weights will be released at https://github.com/yebo0216best/DySink.",https://arxiv.org/pdf/2605.21028v1,,False
Concentration of General Stochastic Approximation Under Heavy-Tailed Markovian Noise,20/05/2026,"Shubhada Agrawal, Siva Theja Maguluri, Martin Zubeldia","We establish maximal concentration bounds for the iterates generated by stochastic approximation algorithms with general step sizes, where the noise has a finite-state Markovian component plus a Martingale-difference component. When the Martingale-difference noise is bounded, we show that the tail of the error can be sub-Gaussian, sub-Weibull, or something lighter than any Pareto but heavier than any Weibull, depending on the step size sequence and on whether the random operator is almost surely contractive, almost surely non-expansive, or expansive with positive probability. Our analysis relies on a novel Lyapunov function involving the moment-generating function of the solution to a Poisson equation, together with an auxiliary projected algorithm. We complement the upper bounds with worst-case examples showing that qualitatively sharper bounds are impossible. We further study the case of unbounded Martingale-difference noise when the average operator is contractive, and the step sizes are of order $1/k$. In this setting, we show that if the random operator is almost surely non-expansive, then the error tail is at most three times heavier than the noise tail, whereas if the random operator is expansive with positive probability, then the error may have substantially heavier tails. These results are obtained through a novel black-box truncation argument that reduces the unbounded-noise setting to the bounded-noise case.",https://arxiv.org/pdf/2605.20999v1,,False
Modeling Temporal scRNA-seq Data with Latent Gaussian Process and Optimal Transport,20/05/2026,"Mehmet Yigit Balik, Harri Lähdesmäki","Single-cell RNA sequencing provides insights into gene expression at single-cell resolution, yet inferring temporal processes from these static snapshot measurements remains a fundamental challenge. Current approaches utilizing neural differential equations and flows are sensitive to overfitting and lack careful considerations of biological variability. In this work, we propose a generative framework that models population trends using a latent heteroscedastic Gaussian process (GP) approximated by Hilbert space methods. To address the absence of genuine cell trajectories, we leverage an optimal transport (OT) objective that aligns generated and observed population distributions. Our method explicitly captures biological heterogeneity by incorporating cell-specific latent time and cell type conditioning to disentangle temporal asynchrony and trajectories to different cell types. We demonstrate state-of-the-art performance on complex interpolation and extrapolation benchmarks and introduce a novel gradient-based strategy for inferring perturbation trajectories.",https://arxiv.org/pdf/2605.20989v1,,False
Discovering Entity-Conditioned Lag Heterogeneity: A Lag-Gated Neural Audit Framework for Panel Time Series,20/05/2026,Andi Xu,"Country-level temporal panels are widely used in empirical analysis. Researchers often need to audit how different entities respond to historical signals over different time horizons. Current approaches typically do not provide directly auditable entity-specific lag summaries. We formulate entity-conditioned heterogeneous lag discovery as a temporal panel mining task and propose AC-GATE, an Adaptive-Conditioning Encoder with a Scale-Invariant Lag Gate. It instantiates conditional Moderated Distributed Lag by using observable entity-level proxies to condition lag-weight distributions over historical observations, thereby making effective lags structural outputs of the model rather than post-hoc explanations. The evaluation is based on a layered audit protocol that separates predictive calibration from lag discovery. A synthetic panel with known ground-truth lags is used for mechanism recovery testing, and two real-world country-level panels are used for external audit and stress testing. The results show that AC-GATE can recover heterogeneous lag structure in synthetic data, and generates non-degenerate, externally structured effective lags in real data.",https://arxiv.org/pdf/2605.21542v1,,False
PACD-Net: Pseudo-Augmented Contrastive Distillation for Glycemic Control Estimation from SMBG,20/05/2026,"Canyu Lei, David Repaske, Jianxin Xie","Effective diabetes management requires continuous monitoring of glycemic levels. Clinically, glycemic control is assessed using metrics such as Time in Range (TIR), Time Below Range (TBR), and Time Above Range (TAR), typically derived from continuous glucose monitoring (CGM). However, many patients rely on self-monitoring of blood glucose (SMBG) due to the high cost and limited accessibility of CGM. Unlike CGM, SMBG provides sparse and irregular measurements, making accurate estimation of these metrics challenging. Conventional supervised learning approaches struggle under such sparsity, leading to poor generalization and unstable performance. To address this, we propose PACD-Net, a self-supervised contrastive knowledge distillation framework for estimating glycemic control from SMBG. Pseudo-SMBG samples with richer temporal coverage are used as teacher signals to guide learning from sparse observations. In addition, multi-view contrastive learning enforces representation consistency across diverse sampling patterns. The model adopts a hybrid Swin Transformer-CNN backbone to capture temporal dependencies in sparse SMBG sequences. Experimental results demonstrate that PACD-Net consistently outperforms existing methods in estimating TAR, TIR, and TBR from real-world SMBG data, achieving improved accuracy as well as enhanced stability and generalization under extremely sparse observation settings. The proposed framework provides a practical tool for clinical SMBG interpretation and offers a generalizable approach for learning from sparse and irregularly sampled sensor data in broader applications.",https://arxiv.org/pdf/2605.20751v1,,False
Rethinking Cross-Layer Information Routing in Diffusion Transformers,20/05/2026,"Chao Xu, Maohua Li, Qirui Li, Yixuan Xu, Yanke Zhou, Yunhe Li, Cuifeng Shen, Hanlin Tang, Kan Liu, Tao Lan, Lin Qu, Shao-Qun Zhang","Diffusion Transformers (DiTs) have become a de facto backbone of modern visual generation, and nearly every major axis of their design -- tokenization, attention, conditioning, objectives, and latent autoencoders -- has been extensively revisited. The residual stream that governs how information accumulates across layers, however, has been directly inherited from the original Transformer. In this paper, we present a systematic empirical analysis of cross-layer information flow in DiTs, jointly along depth and denoising timestep, and identify three concrete symptoms of traditional residual addition, namely monotonic forward magnitude inflation, sharp backward gradient decay, and pronounced block-wise redundancy. Motivated by this diagnosis, we propose Diffusion-Adaptive Routing (\textsc{DAR}), a drop-in residual replacement that performs \emph{learnable, timestep-adaptive, and non-incremental} aggregation over the history of sublayer outputs. Moreover, the proposed \textsc{DAR} is compatible with many modern Transformer enhancement methods, such as REPA. On ImageNet $256\times256$, \textsc{DAR} improves SiT-XL/2 by $2.11$ FID ($7.56$ vs.\ $9.67$) and matches the baseline's converged quality with $8.75\times$ fewer training iterations. Stacked on top of REPA, it yields a $2\times$ training acceleration in the early stage, suggesting cross-layer information routing as an underexplored design axis in diffusion modeling, one that operates orthogonally to existing representation-alignment objectives. Beyond pretraining, \textsc{DAR} can also be applied during the fine-tuning stage of large-scale T2I models and preserves high-frequency details during Distribution Matching Distillation.",https://arxiv.org/pdf/2605.20708v1,,False
RoPeSLR: 3D RoPE-driven Sparse-LowRank Attention for Efficient Diffusion Transformers,20/05/2026,"Yuxi Liu, Zekun Zhang, Yixiang Cai, Renjia Deng, Yutong He, Kun Yuan","Diffusion Transformers (DiTs) have revolutionized high-fidelity video generation, yet their $\mathcal{O}(L^2)$ attention complexity poses a formidable bottleneck for long-sequence synthesis. While recent sparse-linear attention hybrids aim to mitigate this, their performance severely degrades at extreme sparsity due to the ""RoPE Dilemma"": standard linear attention fails to preserve the orthogonal relative-position structure of 3D Rotary Position Embeddings (RoPE), neutralizing vital distance awareness. To address this, we propose \textbf{RoPeSLR}, a 3D RoPE-guided Sparse-LowRank attention framework. We establish that under empirically validated assumptions, the DiT attention manifold admits a decoupling into a high-frequency semantic spike set (bounded by $\mathcal{O}(L^{3/2})$ sparsity) and an extreme low-rank ($\mathcal{O}(d_h \log L)$) background continuum. Guided by this structural prior, RoPeSLR eschews standard linear attention for a head-wise low-rank parameterization equipped with a learnable 3D Absolute Positional Embedding (PE) injection, seamlessly synthesizing long-range relative distance decay. By guaranteeing sub-quadratic sparsity and sub-linear rank growth, RoPeSLR is exceptionally suited for scaling to ultra-long video inference. Extensive evaluations validate this scalable superiority: at 90\% sparsity, RoPeSLR achieves up to $10\times$ fewer FLOPs on Wan2.1-1.3B and delivers a $2.26\times$ end-to-end inference speedup on the ultra-long 100K+ token sequences of HunyuanVideo-13B, all while maintaining near-lossless generation fidelity (less than 1.3\% average VBench degradation).",https://arxiv.org/pdf/2605.20659v1,,False
Jointly Learning Predicates and Actions Enables Zero-Shot Skill Composition,20/05/2026,"Benedict Quartey, Sebastian Castro, Eric Rosen, Wil Thomason, George Konidaris, Stefanie Tellex","Learning from Demonstration (LfD) enables robots to learn complex behaviors from expert examples, yet existing approaches often fail to generalize to new compositions of known skills without retraining. Modern generative policies model distributions over action trajectories alone, thus are unable to reason about the symbolic outcomes required for robust composition. We propose that skills should jointly model action trajectories and the symbolic outcomes they induce. To address this gap, we introduce Predicate Action Skills (PACTS), a class of closed-loop visuomotor policies that model skills as a joint generative process over action and predicate belief trajectories, producing coherent action-outcome rollouts within a single model. Jointly generating actions and predicates enables PACTS to learn internal representations that improve both action generation and predicate classification. Furthermore, we demonstrate zero-shot composition of learned skills via planning by leveraging online predicate predictions from PACTS as a symbolic interface for sequencing and monitoring execution. Project website: https://planpacts.github.io/",https://arxiv.org/pdf/2605.20648v1,,False
