Title,Publication Date,Author(s),Abstract,Link,DOI,Relevant
Designing Datacenter Power Delivery Hierarchies for the AI Era,15/05/2026,"Grant Wilkins, Fiodar Kazhamiaka, Alok Gautam Kumbhare, Chaojie Zhang, Ricardo Bianchini","Demand for AI accelerators is rapidly increasing rack power density, with projections approaching 1MW per deployment by 2027. This poses a major challenge for datacenter power delivery designers. As power densities increase, a datacenter designed for a different target density may strand power, i.e., may be unable to use all the power that its delivery hierarchy has provisioned. Designs must remain efficient over long datacenter lifetimes and multiple hardware generations. Power utilization is particularly important as grid power capacity is a scarce resource in the AI era.
  Designing an efficient power delivery hierarchy for the long run is difficult because rack placement feasibility, workload impact, and cost depend jointly on electrical topology, deployment granularity, placement policy, power oversubscription, and workload mix. Moreover, each of these factors evolve over time, have inter-dependencies across multiple resource dimensions, and generally do not lend themselves to closed-form analysis.
  To address this challenge, we develop a framework for evaluating datacenter power delivery designs using throughput, power, and cost metrics over realistic arrival, oversubscription, and decommissioning sequences. The framework combines projection models for GPU, compute, and storage deployments with operational factors grounded in production data from Microsoft Azure. Our results show that multi-resource stranding materially changes deployable capacity, effective capital expenditure, and delivered performance, and quantify how rising density from rack- and pod-scale AI systems shapes these outcomes. For AI datacenter design, the relevant planning objective is not installed megawatts, but deployable capacity over time.",https://arxiv.org/pdf/2605.16255v1,,False
FRESH: Information-Geometric Calibration of Patient-Level Models to Aggregate Evidence,15/05/2026,"Franklin Fuller, Daniele Bertolini, Samantha Liang, Jason Christopher, Aaron M. Smith","This note introduces FRESH (Fusion of Recent Evidence and Subject Histories), a method for incorporating population-level summary results -- published clinical trials, registry summaries,
  prior natural-history studies, and peer-reviewed indirect comparisons -- into predictive models trained on patient-level data. This method provides a principled means of combining both
  patient-level and aggregate-level data types into a unified data-efficient model for clinical decision making.
  FRESH assumes access to a generative model trained on patient-level data sources (e.g. clinical trial or real-world data). The method produces patient-level predictions from a re-calibrated
  model that matches a set of specified aggregate statistics for a target population. This can be understood as a patient-level recapitulation of the aggregate source -- with the key property
  that the recalibration is a minimal perturbation of the original joint distribution in a specific information-geometric sense. The resulting samples can be analyzed directly or combined into a
  post-training procedure to update the original generative model.
  This approach enables several applications where rigorously incorporating patient-level data with summary information is valuable, including (i) contextualizing single-arm trial results with
  respect to recent standard-of-care, (ii) clinical-trial simulations for design and probability-of-technical-success estimation, and (iii) comparative-effectiveness analyses of on-market
  therapies.",https://arxiv.org/pdf/2605.16246v1,,False
AI-Mediated Communication Can Steer Collective Opinion,15/05/2026,"Stratis Tsirtsis, Kai Rawal, Chris Russell, Brent Mittelstadt, Sandra Wachter","Generative artificial intelligence (AI) is increasingly integrated into the online platforms where humans exchange opinions; large language models (LLMs) now polish users' posts on LinkedIn and provide context for content shared on X. While prior work has shown that AI can express biased opinions and shape individuals' opinions during human-AI interactions, less attention has been paid to its influence on collective opinion formation when mediating human-to-human communication. We address this gap via a combination of empirical and theoretical analyses. We show empirically that LLMs from multiple popular families introduce directional biases when instructed to edit human-written texts on contested topics, for example, nudging texts in favor of gun control and against atheism. Building on this observation, we introduce a mathematical model of opinion dynamics in which an AI system sits between users on a social network, transforming the opinions they express and perceive. By analytically characterizing the equilibrium of this model and performing simulations on real social network data, we show that biases introduced by AI in human-to-human communication can be amplified through the network and shift collective opinion in their direction. In light of these findings, we investigate whether such biases are controllable by online platforms. We audit the ""Explain this post"" feature on X and find evidence of pro-life bias in Grok's outputs on abortion-related content, which we trace back to specific design choices. We conclude with a discussion of the broader implications of our findings in relation to ongoing legislative efforts in the European Union.",https://arxiv.org/pdf/2605.16245v1,,False
FORGE: Self-Evolving Agent Memory With No Weight Updates via Population Broadcast,15/05/2026,"Igor Bogdanov, Chung-Horng Lung, Thomas Kunz, Jie Gao, Adrian Taylor, Marzia Zaman","Can LLM agents improve decision-making through self-generated memory without gradient updates? We propose FORGE (Failure-Optimized Reflective Graduation and Evolution), a staged, population-based protocol that evolves prompt-injected natural-language memory for hierarchical ReAct agents. FORGE wraps a Reflexion-style inner loop, where a dedicated reflection agent (using the same underlying LLM, no distillation from a stronger model) converts failed trajectories into reusable knowledge artifacts: textual heuristics (Rules), few-shot demonstrations (Examples), or both (Mixed), with an outer loop that propagates the best-performing instance's memory to the population between stages and freezes converged instances via a graduation criterion. We evaluate on CybORG CAGE-2, a stochastic network-defense POMDP at a 30-step horizon against the B-line attacker, where all four tested LLM families (Gemini-2.5-Flash-Lite, Grok-4-Fast, Llama-4-Maverick, Qwen3-235B) exhibit strongly negative, heavy-tailed zero-shot rewards. Compared against both a zero-shot baseline and a Reflexion baseline (isolated single-stream learning), FORGE improves average evaluation return by 1.7-7.7$\times$ over zero-shot and by 29-72% over Reflexion in all 12 model-representation conditions, reducing major-failure rates (below $-100$) to as low as $\sim$1%. We find that (1) population broadcast is critical mechanism, with a no-graduation ablation confirming that broadcast carries the performance gains while graduation primarily saves compute; (2) Examples achieves the strongest returns for three of four models, Rules offers the best cost-reliability profile with $\sim$40% fewer tokens; and (3) weaker baseline models benefit disproportionately, suggesting FORGE may mitigate capability gaps rather than amplify strong models. All evidence is confined to CAGE-2 B-line; cross-family findings are directional evidence.",https://arxiv.org/pdf/2605.16233v1,10.1145/3786335.3813155,False
Learn Where Outcomes Diverge: Efficient VLA RL via Probabilistic Chunk Masking,15/05/2026,"Vaidehi Bagaria, Nikshep Grampurohit, Pulkit Verma","Reinforcement learning (RL) allows vision-language-action (VLA) policies to generalize beyond their training distribution by optimizing directly for task success, but post-training is computationally expensive. A natural response has been to speed rollout collection through faster simulators and world models. In GRPO-based VLA RL, we find that the dominant cost lies elsewhere: gradient computation accounts for approximately 78% of wall-clock time per step in our runs, while rollout collection accounts for only 21%. Gradient cost dominates because much of this computation is spent on phases that contribute little to learning. GRPO's learning signal is driven by advantage variance: only phases where successful and failed rollouts diverge produce learning signal. However, GRPO assigns the same advantage to every chunk in a rollout. As a result, actor-update compute is spent uniformly across the trajectory, including phases the policy already handles after pre-training and supervised fine-tuning. This paper presents Probabilistic Chunk Masking (PCM), a drop-in modification to GRPO that allocates gradient computation to a small, probabilistically selected subset of chunks per trajectory. PCM scores semantic phases using success-failure action variance, a rollout-derived proxy for per-phase gradient variance, and samples a fixed chunk budget with online-updated phase-level keep probabilities. We formalize per-phase gradient variance as the quantity determines where gradient computation is useful and show that success-failure action variance provides a measurable proxy for it. PCM requires no reward model or learned critic. On three LIBERO benchmarks, PCM matches the final success rate of standard GRPO while achieving 2.38 times wall-clock speedup, 4.8 times faster gradient updates, and 60% lower peak activation memory, while backpropagating through fewer than 20% of trajectory chunks.",https://arxiv.org/pdf/2605.16154v1,,False
Navigating Potholes with Geometry-Aware Sharpness Minimization,15/05/2026,"Simon Dufort-Labbé, Mehrab Hamidi, Razvan Pascanu, Ioannis Mitliagkas, Damien Scieur, Aristide Baratin","Sharpness-aware minimization (SAM) encourages flat minima by perturbing parameters along directions of high loss curvature, but treats all parameter directions uniformly, ignoring the underlying loss geometry. We introduce LLQR+SAM, which combines SAM with a learned preconditioner obtained from the recently proposed LLQR framework, a second-order method that recasts steepest descent as a layerwise linear-quadratic regulator problem. The preconditioner is updated sparsely and maintained as a slow exponential moving average, so it captures a smoothed, low-resolution picture of the loss landscape geometry. The SAM perturbation then operates on top of this learned geometry, probing curvature at a faster timescale. We show that this two-timescale structure is not merely a computational convenience: theoretically, the preconditioner amplifies the SAM escape signal in directions that are flat under the average geometry but locally sharp (potholes). Wide, flat basins, by contrast, remain stable. Empirically, LLQR+SAM gives consistent gains over both SAM and LLQR alone across standard vision and sequence modeling benchmarks, supporting the view that slow learned geometry and fast sharpness correction are genuinely complementary.",https://arxiv.org/pdf/2605.16134v1,,False
ShopGym: An Integrated Framework for Realistic Simulation and Scalable Benchmarking of E-Commerce Web Agents,15/05/2026,"Chinmay Savadikar, Mingyu Zhao, Yuanzheng Zhu, Han Li, Shuang Xie, Alberto Castelo, Tianfu Wu, Lingyun Wang","Developing and evaluating e-commerce web agents requires environments that preserve meaningful task structure while enabling controllable, reproducible, and scalable scientific comparison. Existing methodologies force a tradeoff: live storefronts provide realism but are non-stationary, difficult to inspect, and irreproducible, while hand-built sandbox benchmarks provide control but cover only a narrow range of layouts, catalogs, policies, and interaction patterns. We argue that the core bottleneck is methodological: the field lacks a scalable way to construct evaluation settings that are simultaneously realistic, diverse, controllable, inspectable, and reproducible. We introduce ShopGym, an integrated framework for realistic simulation and scalable benchmarking of e-commerce web agents. ShopGym is a framework for constructing e-commerce simulation environments and grounded benchmark tasks. Its simulation layer, ShopArena, converts live seed storefronts into self-contained sandbox shops through anonymized shop specifications and a staged, validated generation process. On top of these simulated storefronts, ShopGuru synthesizes benchmark tasks across seven skill categories, grounding each task in the shop's catalog, navigation structure, policies, and interaction affordances. Together, ShopArena and ShopGuru produce self-contained, resettable, inspectable, and stable evaluation artifacts that preserve structural properties and agent-evaluation signals relevant to shopping tasks. We validate the framework through graph-based structural analysis and agent-based behavioral evaluation with 224 generated tasks across six sandbox shops: three constructed with synthetic data and three with real data. Our results show that the synthetic shops preserve key structural properties of live storefronts, with agent performance on synthetic shops positively correlated with performance on live storefronts.",https://arxiv.org/pdf/2605.16116v1,,False
GeoGS-CE: Learning Delay--Beam Channel Priors with 3D Gaussians for High-Mobility Scenarios,15/05/2026,"Yumeng Zhang, Jiajia Guo, Chaozheng Wen, Chenghong Bian, Jun Zhang","Wideband channel estimation (CE) in high-mobility scenarios remains challenging because channel responses vary rapidly, while practical systems can allocate only sparse pilots to accommodate dense users. Fortunately, many high-mobility environments, such as high-speed railways, exhibit scheduled trajectories, predictable velocities, and a limited number of dominant propagation paths. These properties induce a delay--beam power spectrum that is more stable than the instantaneous complex channel frequency response (CFR), less sensitive to the random phase coherence, and rich in geometric information. To exploit such environmental properties, we propose GeoGS-CE, a two-stage channel estimation framework for sparse-pilot high-mobility scenarios. In the offline stage, GeoGS-CE jointly models: 1) a scene-level 3D Gaussian representation that captures the non-line-of-sight (NLoS) geometric scattering support, and 2) a leakage-aware differentiable wireless rendering process that maps the NLoS Gaussians, together with an explicit virtual line-of-sight (LoS) component, to the measured delay--beam power spectrum, while accounting for practical OFDM delay and array leakage effects. In the online stage, the delay--beam power spectrum is predicted for each user location and used as a strong covariance prior, enabling accurate full-band and full-array CFR reconstruction and tracking through a linear MMSE estimator. Simulations based on channels generated from a segment of the Guangshen high-speed railway show that the proposed geometric prior substantially improves CFR reconstruction over pilot-only and non-geometric baselines.",https://arxiv.org/pdf/2605.16094v1,,False
Ada-Diffuser: Latent-Aware Adaptive Diffusion for Decision-Making,15/05/2026,"Fan Feng, Selena Ge, Minghao Fu, Zijian Li, Yujia Zheng, Zeyu Tang, Yingyao Hu, Biwei Huang, Kun Zhang","Recent work has framed decision-making as a sequence modeling problem using generative models such as diffusion models. Although promising, these approaches often overlook latent factors that exhibit evolving dynamics, elements that are fundamental to environment transitions, reward structures, and high-level agent behavior. Explicitly modeling these hidden processes is essential for both precise dynamics modeling and effective decision-making. In this paper, we propose a unified framework that explicitly incorporates latent dynamic inference into generative decision-making from minimal yet sufficient observations. We theoretically show that under mild conditions, the latent process can be identified from small temporal blocks of observations. Building on this insight, we introduce Ada-Diffuser, a causal diffusion model that learns the temporal structure of observed interactions and the underlying latent dynamics simultaneously, and furthermore, leverages them for planning and control. With a modular design, Ada-Diffuser supports both planning and policy learning tasks, enabling adaptation to latent variations in dynamics, rewards, and latent actions. Experiments on simulated control and robotic benchmarks demonstrate its effectiveness in accurate latent inference and adaptive policy learning.",https://arxiv.org/pdf/2605.16054v1,,False
Learning Sim-Grounded Policies for Bimanual Rope Manipulation from Human Teleoperation Data,15/05/2026,"Gina Wigginghaus, Tim Missal, Berk Guler, Simon Manschitz, Jan Peters","Deformable Linear Objects (DLOs) such as ropes and cables are widely encountered in both household and industrial applications, yet remain challenging to manipulate due to their infinite-dimensional configuration space and frequent self-occlusion. Imitation learning from teleoperation offers a practical path to bimanual DLO manipulation, but its scalability is limited by human effort, making the choice of observation space critical for generalization from small datasets. In this study, we investigate whether the lack of generalization in egocentric visual policies for the knot-untangling task stems from the observation space itself, rather than from the policy architecture or data scale. We compare two Action Chunking with Transformers policies trained on the same bimanual teleoperation data: a vision-based policy conditioned on two egocentric RGB streams from wrist-mounted cameras, and a state-based policy conditioned on the DLO's 3D particle state, extracted from an initial observation via multi-view fusion and evolved in a particle-based eXtended Position-Based Dynamics simulation. Evaluated open-loop on an unseen rope configuration, the state-based policy outperforms its visual counterpart with a 30.8% reduction in L1 error when predicting the initial grasp-and-pull action, quantifying the observability gap between pixels and physics-consistent state, and pointing toward more data-efficient robot learning for the DLO manipulation task from limited human demonstrations.",https://arxiv.org/pdf/2605.16043v1,,False
Variational Autoregressive Networks with probability priors,15/05/2026,"Piotr Białas, Piotr Korcyl, Tomasz Stebel, Dawid Zapolski","Monte Carlo methods are essential across diverse scientific fields, yet their efficiency is frequently hampered by critical slowing down-a sharp increase in autocorrelation times near phase transitions. Although deep learning approaches, such as neural-network-based samplers, have been proposed to alleviate this issue, they face another serious problem: the difficulty of training the models. This difficulty partially stems from the overly general nature of original machine-learning architectures, which often ignore underlying physical symmetries and force networks to relearn them from scratch. In this paper, we demonstrate that incorporating physical priors into the model significantly enhances performance. Building upon existing strategies that integrate spin-spin interactions, we propose a framework that utilizes a prior probability distribution as a starting point for training. Our results for the Ising model, as well as for the Edwards-Anderson spin glass model, suggest that moving away from `blank slate' models in favor of physics-informed priors reduces the training burden and facilitates the simulation of larger system sizes in discrete spin models.",https://arxiv.org/pdf/2605.16020v1,,False
Adaptive Outer-Loop Control of Quadrotors via Reinforcement Learning,15/05/2026,"Vishnu Saj, Sushi Vemuri, Dileep Kalathil, Moble Benedict","Deep Reinforcement Learning (DRL) for quadrotor flight control typically relies on Domain Randomization (DR) for sim-to-real transfer, resulting in overly conservative policies that struggle with dynamic disturbances. To overcome this, we propose a novel adaptive control architecture that actively perceives and reacts to instantaneous perturbations. First, we train an optimal outer-loop policy, then replace its reliance on ground-truth disturbance data with a Residual Dynamics Predictor (RDP). The RDP estimates the external forces and moments acting on the aircraft in flight online using only the history of states and control actions. For seamless hardware transfer, we introduce a data-efficient linear calibration bridge and an online thrust correction mechanism that align the simulated latent space with reality using mere seconds of flight data. Real-world validations on a Crazyflie micro-quadrotor demonstrate that our adaptive controller significantly outperforms baselines, maintaining precise trajectory tracking under severe uncertainties including mass variations, asymmetric payloads, and dynamic slung loads",https://arxiv.org/pdf/2605.16015v1,,False
A Retrieval-Enhanced Transformer for Multi-Step Port-of-Call Sequence Prediction in Global Liner Shipping,15/05/2026,"Yanzhao Su, Fang He, Yineng Wang","Accurate multi-step port-of-call sequence prediction is vital for tactical resource orchestration and logistical efficiency. However, existing methods struggle with unreliable voyage schedules and the inability of AIS data to provide visibility beyond the immediate next port. To address this, this study proposes a Connectivity-Constrained and Retrieval-Enhanced (CCRE) deep learning framework. Inspired by Retrieval-Augmented Generation, CCRE introduces a retrieval-enhanced historical encoder that queries a global maritime database for contextually similar navigational precedents. Transforming these scenarios into candidate-level semantic representations compensates for data sparsity in long-tail routes and resolves routing ambiguities. Integrating this with a Transformer-based trajectory encoder, the architecture executes adaptive ""middle fusion"" via cross-attention. This dynamically shifts predictive reliance from real-time kinematics for short-term accuracy to historical context for long-term strategic stability. To ensure sequence-level coherence, forecasting is formulated as a joint sequence generation problem using an autoregressive Transformer decoder enriched with Scheduled Sampling and Gumbel-Softmax relaxation. This mitigates error accumulation, while topology masks strictly enforce maritime network reachability to eliminate operationally infeasible routes. Evaluated on a global dataset, CCRE achieves a 72.3% first-destination accuracy and a 61.4% average three-step accuracy, outperforming baselines like CatBoost and LSTM by average margins of 12.6% and 11.3%, respectively. Case studies further corroborate the model's scalability and ability to capture complex routing patterns across diverse international trade lanes.",https://arxiv.org/pdf/2605.15937v1,,False
Modeling Music as a Time-Frequency Image: A 2D Tokenizer for Music Generation,15/05/2026,"Yuqing Cheng, Xingyu Ma, Guochen Yu, Xiaotao Gu","Autoregressive music generation depends strongly on the audio tokenizer. Existing high-fidelity codecs often use residual multi-codebook quantization, which preserves reconstruction quality but complicates language modeling after sequence flattening, as the residual hierarchy imposes strong sequential dependencies and can amplify error accumulation. We propose BandTok, a generation-oriented 2D Mel-spectrogram tokenizer that represents each frame with Mel-frequency band tokens from a single shared codebook. This design yields a physically interpretable time-frequency token grid with a more independent token structure, making it better suited for autoregressive modeling. BandTok improves reconstruction with a multi-scale PatchGAN objective and EMA codebook updates. We further introduce an autoregressive language model with 2D Rotary Position Embedding (2D RoPE) to preserve temporal and frequency-band structure during generation. Experiments show that BandTok improves over residual-codebook tokenizers and achieves strong results in a data-limited setting. The source code and generation demos for this work are publicly available.",https://arxiv.org/pdf/2605.15831v1,,False
