Title,Publication Date,Author(s),Abstract,Link,DOI,Relevant
Modeling cognitive processes of natural reading with transformer-based Language Models,16/05/2025,"Bruno Bianchi, Fermín Travi, Juan E. Kamienkowski","Recent advances in Natural Language Processing (NLP) have led to the
development of highly sophisticated language models for text generation. In
parallel, neuroscience has increasingly employed these models to explore
cognitive processes involved in language comprehension. Previous research has
shown that models such as N-grams and LSTM networks can partially account for
predictability effects in explaining eye movement behaviors, specifically Gaze
Duration, during reading. In this study, we extend these findings by evaluating
transformer-based models (GPT2, LLaMA-7B, and LLaMA2-7B) to further investigate
this relationship. Our results indicate that these architectures outperform
earlier models in explaining the variance in Gaze Durations recorded from
Rioplantense Spanish readers. However, similar to previous studies, these
models still fail to account for the entirety of the variance captured by human
predictability. These findings suggest that, despite their advancements,
state-of-the-art language models continue to predict language in ways that
differ from human readers.",http://arxiv.org/pdf/2505.11485v1,,False
EdgeWisePersona: A Dataset for On-Device User Profiling from Natural Language Interactions,16/05/2025,"Patryk Bartkowiak, Michal Podstawski","This paper introduces a novel dataset and evaluation benchmark designed to
assess and improve small language models deployable on edge devices, with a
focus on user profiling from multi-session natural language interactions in
smart home environments. At the core of the dataset are structured user
profiles, each defined by a set of routines - context-triggered, repeatable
patterns of behavior that govern how users interact with their home systems.
Using these profiles as input, a large language model (LLM) generates
corresponding interaction sessions that simulate realistic, diverse, and
context-aware dialogues between users and their devices.
  The primary task supported by this dataset is profile reconstruction:
inferring user routines and preferences solely from interactions history. To
assess how well current models can perform this task under realistic
conditions, we benchmarked several state-of-the-art compact language models and
compared their performance against large foundation models. Our results show
that while small models demonstrate some capability in reconstructing profiles,
they still fall significantly short of large models in accurately capturing
user behavior. This performance gap poses a major challenge - particularly
because on-device processing offers critical advantages, such as preserving
user privacy, minimizing latency, and enabling personalized experiences without
reliance on the cloud. By providing a realistic, structured testbed for
developing and evaluating behavioral modeling under these constraints, our
dataset represents a key step toward enabling intelligent, privacy-respecting
AI systems that learn and adapt directly on user-owned devices.",http://arxiv.org/pdf/2505.11417v1,,False
Uncertainty quantification with approximate variational learning for wearable photoplethysmography prediction tasks,16/05/2025,"Ciaran Bench, Vivek Desai, Mohammad Moulaeifard, Nils Strodthoff, Philip Aston, Andrew Thompson","Photoplethysmography (PPG) signals encode information about relative changes
in blood volume that can be used to assess various aspects of cardiac health
non-invasively, e.g.\ to detect atrial fibrillation (AF) or predict blood
pressure (BP). Deep networks are well-equipped to handle the large quantities
of data acquired from wearable measurement devices. However, they lack
interpretability and are prone to overfitting, leaving considerable risk for
poor performance on unseen data and misdiagnosis. Here, we describe the use of
two scalable uncertainty quantification techniques: Monte Carlo Dropout and the
recently proposed Improved Variational Online Newton. These techniques are used
to assess the trustworthiness of models trained to perform AF classification
and BP regression from raw PPG time series. We find that the choice of
hyperparameters has a considerable effect on the predictive performance of the
models and on the quality and composition of predicted uncertainties. E.g. the
stochasticity of the model parameter sampling determines the proportion of the
total uncertainty that is aleatoric, and has varying effects on predictive
performance and calibration quality dependent on the chosen uncertainty
quantification technique and the chosen expression of uncertainty. We find
significant discrepancy in the quality of uncertainties over the predicted
classes, emphasising the need for a thorough evaluation protocol that assesses
local and adaptive calibration. This work suggests that the choice of
hyperparameters must be carefully tuned to balance predictive performance and
calibration quality, and that the optimal parameterisation may vary depending
on the chosen expression of uncertainty.",http://arxiv.org/pdf/2505.11412v1,,False
IISE PG&E Energy Analytics Challenge 2025: Hourly-Binned Regression Models Beat Transformers in Load Forecasting,16/05/2025,"Millend Roy, Vladimir Pyltsov, Yinbo Hu","Accurate electricity load forecasting is essential for grid stability,
resource optimization, and renewable energy integration. While
transformer-based deep learning models like TimeGPT have gained traction in
time-series forecasting, their effectiveness in long-term electricity load
prediction remains uncertain. This study evaluates forecasting models ranging
from classical regression techniques to advanced deep learning architectures
using data from the ESD 2025 competition. The dataset includes two years of
historical electricity load data, alongside temperature and global horizontal
irradiance (GHI) across five sites, with a one-day-ahead forecasting horizon.
Since actual test set load values remain undisclosed, leveraging predicted
values would accumulate errors, making this a long-term forecasting challenge.
We employ (i) Principal Component Analysis (PCA) for dimensionality reduction
and (ii) frame the task as a regression problem, using temperature and GHI as
covariates to predict load for each hour, (iii) ultimately stacking 24 models
to generate yearly forecasts.
  Our results reveal that deep learning models, including TimeGPT, fail to
consistently outperform simpler statistical and machine learning approaches due
to the limited availability of training data and exogenous variables. In
contrast, XGBoost, with minimal feature engineering, delivers the lowest error
rates across all test cases while maintaining computational efficiency. This
highlights the limitations of deep learning in long-term electricity
forecasting and reinforces the importance of model selection based on dataset
characteristics rather than complexity. Our study provides insights into
practical forecasting applications and contributes to the ongoing discussion on
the trade-offs between traditional and modern forecasting methods.",http://arxiv.org/pdf/2505.11390v1,,False
Anti-aliasing of neural distortion effects via model fine tuning,16/05/2025,"Alistair Carson, Alec Wright, Stefan Bilbao","Neural networks have become ubiquitous with guitar distortion effects
modelling in recent years. Despite their ability to yield perceptually
convincing models, they are susceptible to frequency aliasing when driven by
high frequency and high gain inputs. Nonlinear activation functions create both
the desired harmonic distortion and unwanted aliasing distortion as the
bandwidth of the signal is expanded beyond the Nyquist frequency. Here, we
present a method for reducing aliasing in neural models via a teacher-student
fine tuning approach, where the teacher is a pre-trained model with its weights
frozen, and the student is a copy of this with learnable parameters. The
student is fine-tuned against an aliasing-free dataset generated by passing
sinusoids through the original model and removing non-harmonic components from
the output spectra. Our results show that this method significantly suppresses
aliasing for both long-short-term-memory networks (LSTM) and temporal
convolutional networks (TCN). In the majority of our case studies, the
reduction in aliasing was greater than that achieved by two times oversampling.
One side-effect of the proposed method is that harmonic distortion components
are also affected. This adverse effect was found to be model-dependent, with
the LSTM models giving the best balance between anti-aliasing and preserving
the perceived similarity to an analog reference device.",http://arxiv.org/pdf/2505.11375v1,,False
Training NTK to Generalize with KARE,16/05/2025,"Johannes Schwab, Bryan Kelly, Semyon Malamud, Teng Andrea Xu","The performance of the data-dependent neural tangent kernel (NTK; Jacot et
al. (2018)) associated with a trained deep neural network (DNN) often matches
or exceeds that of the full network. This implies that DNN training via
gradient descent implicitly performs kernel learning by optimizing the NTK. In
this paper, we propose instead to optimize the NTK explicitly. Rather than
minimizing empirical risk, we train the NTK to minimize its generalization
error using the recently developed Kernel Alignment Risk Estimator (KARE; Jacot
et al. (2020)). Our simulations and real data experiments show that NTKs
trained with KARE consistently match or significantly outperform the original
DNN and the DNN- induced NTK (the after-kernel). These results suggest that
explicitly trained kernels can outperform traditional end-to-end DNN
optimization in certain settings, challenging the conventional dominance of
DNNs. We argue that explicit training of NTK is a form of over-parametrized
feature learning.",http://arxiv.org/pdf/2505.11347v1,,False
Temporally-Grounded Language Generation: A Benchmark for Real-Time Vision-Language Models,16/05/2025,"Keunwoo Peter Yu, Joyce Chai","Vision-language models (VLMs) have shown remarkable progress in offline tasks
such as image captioning and video question answering. However, real-time
interactive environments impose new demands on VLMs, requiring them to generate
utterances that are not only semantically accurate but also precisely timed. We
identify two core capabilities necessary for such settings --
$\textit{perceptual updating}$ and $\textit{contingency awareness}$ -- and
propose a new benchmark task, $\textbf{Temporally-Grounded Language Generation
(TGLG)}$, to evaluate them. TGLG requires models to generate utterances in
response to streaming video such that both content and timing align with
dynamic visual input. To support this benchmark, we curate evaluation datasets
from sports broadcasting and egocentric human interaction domains, and
introduce a new metric, $\textbf{TRACE}$, to evaluate TGLG by jointly measuring
semantic similarity and temporal alignment. Finally, we present
$\textbf{Vision-Language Model with Time-Synchronized Interleaving (VLM-TSI)}$,
a model that interleaves visual and linguistic tokens in a time-synchronized
manner, enabling real-time language generation without relying on turn-based
assumptions. Experimental results show that VLM-TSI significantly outperforms a
strong baseline, yet overall performance remains modest -- highlighting the
difficulty of TGLG and motivating further research in real-time VLMs. Code and
data available $\href{https://github.com/yukw777/tglg}{here}$.",http://arxiv.org/pdf/2505.11326v1,,False
Anomaly Detection for Non-stationary Time Series using Recurrent Wavelet Probabilistic Neural Network,16/05/2025,"Pu Yang, J. A. Barria","In this paper, an unsupervised Recurrent Wavelet Probabilistic Neural Network
(RWPNN) is proposed, which aims at detecting anomalies in non-stationary
environments by modelling the temporal features using a nonparametric density
estimation network. The novel framework consists of two components, a Stacked
Recurrent Encoder-Decoder (SREnc-Dec) module that captures temporal features in
a latent space, and a Multi-Receptive-field Wavelet Probabilistic Network
(MRWPN) that creates an ensemble probabilistic model to characterise the latent
space. This formulation extends the standard wavelet probabilistic networks to
wavelet deep probabilistic networks, which can handle higher data
dimensionality. The MRWPN module can adapt to different rates of data variation
in different datasets without imposing strong distribution assumptions,
resulting in a more robust and accurate detection for Time Series Anomaly
Detection (TSAD) tasks in the non-stationary environment. We carry out the
assessment on 45 real-world time series datasets from various domains, verify
the performance of RWPNN in TSAD tasks with several constraints, and show its
ability to provide early warnings for anomalous events.",http://arxiv.org/pdf/2505.11321v1,,False
Explaining Strategic Decisions in Multi-Agent Reinforcement Learning for Aerial Combat Tactics,16/05/2025,"Ardian Selmonaj, Alessandro Antonucci, Adrian Schneider, Michael Rüegsegger, Matthias Sommer","Artificial intelligence (AI) is reshaping strategic planning, with
Multi-Agent Reinforcement Learning (MARL) enabling coordination among
autonomous agents in complex scenarios. However, its practical deployment in
sensitive military contexts is constrained by the lack of explainability, which
is an essential factor for trust, safety, and alignment with human strategies.
This work reviews and assesses current advances in explainability methods for
MARL with a focus on simulated air combat scenarios. We proceed by adapting
various explainability techniques to different aerial combat scenarios to gain
explanatory insights about the model behavior. By linking AI-generated tactics
with human-understandable reasoning, we emphasize the need for transparency to
ensure reliable deployment and meaningful human-machine interaction. By
illuminating the crucial importance of explainability in advancing MARL for
operational defense, our work supports not only strategic planning but also the
training of military personnel with insightful and comprehensible analyses.",http://arxiv.org/pdf/2505.11311v1,,False
Rethinking Irregular Time Series Forecasting: A Simple yet Effective Baseline,16/05/2025,"Xvyuan Liu, Xiangfei Qiu, Xingjian Wu, Zhengyu Li, Chenjuan Guo, Jilin Hu, Bin Yang","The forecasting of irregular multivariate time series (IMTS) is crucial in
key areas such as healthcare, biomechanics, climate science, and astronomy.
However, achieving accurate and practical predictions is challenging due to two
main factors. First, the inherent irregularity and data missingness in
irregular time series make modeling difficult. Second, most existing methods
are typically complex and resource-intensive. In this study, we propose a
general framework called APN to address these challenges. Specifically, we
design a novel Time-Aware Patch Aggregation (TAPA) module that achieves
adaptive patching. By learning dynamically adjustable patch boundaries and a
time-aware weighted averaging strategy, TAPA transforms the original irregular
sequences into high-quality, regularized representations in a
channel-independent manner. Additionally, we use a simple query module to
effectively integrate historical information while maintaining the model's
efficiency. Finally, predictions are made by a shallow MLP. Experimental
results on multiple real-world datasets show that APN outperforms existing
state-of-the-art methods in both efficiency and accuracy.",http://arxiv.org/pdf/2505.11250v1,,False
A Set-Sequence Model for Time Series,16/05/2025,"Elliot L. Epstein, Apaar Sadhwani, Kay Giesecke","In many financial prediction problems, the behavior of individual units (such
as loans, bonds, or stocks) is influenced by observable unit-level factors and
macroeconomic variables, as well as by latent cross-sectional effects.
Traditional approaches attempt to capture these latent effects via handcrafted
summary features. We propose a Set-Sequence model that eliminates the need for
handcrafted features. The Set model first learns a shared cross-sectional
summary at each period. The Sequence model then ingests the summary-augmented
time series for each unit independently to predict its outcome. Both components
are learned jointly over arbitrary sets sampled during training. Our approach
harnesses the set nature of the cross-section and is computationally efficient,
generating set summaries in linear time relative to the number of units. It is
also flexible, allowing the use of existing sequence models and accommodating a
variable number of units at inference. Empirical evaluations demonstrate that
our Set-Sequence model significantly outperforms benchmarks on stock return
prediction and mortgage behavior tasks. Code will be released.",http://arxiv.org/pdf/2505.11243v1,,False
Massive-STEPS: Massive Semantic Trajectories for Understanding POI Check-ins -- Dataset and Benchmarks,16/05/2025,"Wilson Wongso, Hao Xue, Flora D. Salim","Understanding human mobility through Point-of-Interest (POI) recommendation
is increasingly important for applications such as urban planning, personalized
services, and generative agent simulation. However, progress in this field is
hindered by two key challenges: the over-reliance on older datasets from
2012-2013 and the lack of reproducible, city-level check-in datasets that
reflect diverse global regions. To address these gaps, we present Massive-STEPS
(Massive Semantic Trajectories for Understanding POI Check-ins), a large-scale,
publicly available benchmark dataset built upon the Semantic Trails dataset and
enriched with semantic POI metadata. Massive-STEPS spans 12 geographically and
culturally diverse cities and features more recent (2017-2018) and
longer-duration (24 months) check-in data than prior datasets. We benchmarked a
wide range of POI recommendation models on Massive-STEPS using both supervised
and zero-shot approaches, and evaluated their performance across multiple urban
contexts. By releasing Massive-STEPS, we aim to facilitate reproducible and
equitable research in human mobility and POI recommendation. The dataset and
benchmarking code are available at:
https://github.com/cruiseresearchgroup/Massive-STEPS",http://arxiv.org/pdf/2505.11239v1,,False
"Seeing Sound, Hearing Sight: Uncovering Modality Bias and Conflict of AI models in Sound Localization",16/05/2025,"Yanhao Jia, Ji Xie, S Jivaganesh, Hao Li, Xu Wu, Mengmi Zhang","Imagine hearing a dog bark and turning toward the sound only to see a parked
car, while the real, silent dog sits elsewhere. Such sensory conflicts test
perception, yet humans reliably resolve them by prioritizing sound over
misleading visuals. Despite advances in multimodal AI integrating vision and
audio, little is known about how these systems handle cross-modal conflicts or
whether they favor one modality. In this study, we systematically examine
modality bias and conflict resolution in AI sound localization. We assess
leading multimodal models and benchmark them against human performance in
psychophysics experiments across six audiovisual conditions, including
congruent, conflicting, and absent cues. Humans consistently outperform AI,
demonstrating superior resilience to conflicting or missing visuals by relying
on auditory information. In contrast, AI models often default to visual input,
degrading performance to near chance levels. To address this, we finetune a
state-of-the-art model using a stereo audio-image dataset generated via 3D
simulations. Even with limited training data, the refined model surpasses
existing benchmarks. Notably, it also mirrors human-like horizontal
localization bias favoring left-right precision-likely due to the stereo audio
structure reflecting human ear placement. These findings underscore how sensory
input quality and system architecture shape multimodal representation accuracy.",http://arxiv.org/pdf/2505.11217v1,,False
GLOVA: Global and Local Variation-Aware Analog Circuit Design with Risk-Sensitive Reinforcement Learning,16/05/2025,"Dongjun Kim, Junwoo Park, Chaehyeon Shin, Jaeheon Jung, Kyungho Shin, Seungheon Baek, Sanghyuk Heo, Woongrae Kim, Inchul Jeong, Joohwan Cho, Jongsun Park","Analog/mixed-signal circuit design encounters significant challenges due to
performance degradation from process, voltage, and temperature (PVT)
variations. To achieve commercial-grade reliability, iterative manual design
revisions and extensive statistical simulations are required. While several
studies have aimed to automate variation aware analog design to reduce
time-to-market, the substantial mismatches in real-world wafers have not been
thoroughly addressed. In this paper, we present GLOVA, an analog circuit sizing
framework that effectively manages the impact of diverse random mismatches to
improve robustness against PVT variations. In the proposed approach,
risk-sensitive reinforcement learning is leveraged to account for the
reliability bound affected by PVT variations, and ensemble-based critic is
introduced to achieve sample-efficient learning. For design verification, we
also propose $\mu$-$\sigma$ evaluation and simulation reordering method to
reduce simulation costs of identifying failed designs. GLOVA supports
verification through industrial-level PVT variation evaluation methods,
including corner simulation as well as global and local Monte Carlo (MC)
simulations. Compared to previous state-of-the-art variation-aware analog
sizing frameworks, GLOVA achieves up to 80.5$\times$ improvement in sample
efficiency and 76.0$\times$ reduction in time.",http://arxiv.org/pdf/2505.11208v1,,False
On Next-Token Prediction in LLMs: How End Goals Determine the Consistency of Decoding Algorithms,16/05/2025,"Jacob Trauger, Ambuj Tewari","Probabilistic next-token prediction trained using cross-entropy loss is the
basis of most large language models. Given a sequence of previous values,
next-token prediction assigns a probability to each possible next value in the
vocabulary. There are many ways to use next-token prediction to output token
sequences. This paper examines a few of these algorithms (greedy, lookahead,
random sampling, and temperature-scaled random sampling) and studies their
consistency with respect to various goals encoded as loss functions. Although
consistency of surrogate losses with respect to a target loss function is a
well researched topic, we are the first to study it in the context of LLMs (to
the best of our knowledge). We find that, so long as next-token prediction
converges to its true probability distribution, random sampling is consistent
with outputting sequences that mimic sampling from the true probability
distribution. For the other goals, such as minimizing the 0-1 loss on the
entire sequence, we show no polynomial-time algorithm is optimal for all
probability distributions and all decoding algorithms studied are only optimal
for a subset of probability distributions. When analyzing these results, we see
that there is a dichotomy created between the goals of information retrieval
and creative generation for the decoding algorithms. This shows that choosing
the correct decoding algorithm based on the desired goal is extremely important
and many of the ones used are lacking theoretical grounding in numerous
scenarios.",http://arxiv.org/pdf/2505.11183v1,,False
Attention on the Sphere,16/05/2025,"Boris Bonev, Max Rietmann, Andrea Paris, Alberto Carpentieri, Thorsten Kurth","We introduce a generalized attention mechanism for spherical domains,
enabling Transformer architectures to natively process data defined on the
two-dimensional sphere - a critical need in fields such as atmospheric physics,
cosmology, and robotics, where preserving spherical symmetries and topology is
essential for physical accuracy. By integrating numerical quadrature weights
into the attention mechanism, we obtain a geometrically faithful spherical
attention that is approximately rotationally equivariant, providing strong
inductive biases and leading to better performance than Cartesian approaches.
To further enhance both scalability and model performance, we propose
neighborhood attention on the sphere, which confines interactions to geodesic
neighborhoods. This approach reduces computational complexity and introduces
the additional inductive bias for locality, while retaining the symmetry
properties of our method. We provide optimized CUDA kernels and
memory-efficient implementations to ensure practical applicability. The method
is validated on three diverse tasks: simulating shallow water equations on the
rotating sphere, spherical image segmentation, and spherical depth estimation.
Across all tasks, our spherical Transformers consistently outperform their
planar counterparts, highlighting the advantage of geometric priors for
learning on spherical domains.",http://arxiv.org/pdf/2505.11157v1,,False
