Title,Publication Date,Author(s),Abstract,Link,DOI,Relevant
Learning Steerable Clarification Policies with Collaborative Self-play,03/12/2025,"Jonathan Berant, Maximillian Chen, Adam Fisch, Reza Aghajani, Fantine Huot, Mirella Lapata, Jacob Eisenstein","To handle underspecified or ambiguous queries, AI assistants need a policy for managing their uncertainty to determine (a) when to guess the user intent and answer directly, (b) when to enumerate and answer multiple possible intents, and (c) when to ask a clarifying question. However, such policies are contextually dependent on factors such as user preferences or modality. For example, enumerating multiple possible user intentions is cumbersome on small screens or in a voice setting. In this work, we propose to train steerable policies for managing this uncertainty using self-play. Given two agents, one simulating a user and the other an AI assistant, we generate conversations where the user issues a potentially ambiguous query, and the assistant needs to determine how to respond. Importantly, the model takes as input the numerical cost of each clarification question, and each generated word, and is asked to take the action that will maximize its final reward, which is the cost-penalized accuracy. We use Reinforced Self-Training (ReST) to train our model to achieve high reward and show this leads to a steerable policy that changes its behavior predictably conditioned on the provided costs, leading to higher reward and accuracy. Moreover, our procedure also generalizes to numerical cost values that were unobserved at training time.",https://arxiv.org/pdf/2512.04068v1,,False
On the Temporality for Sketch Representation Learning,03/12/2025,"Marcelo Isaias de Moraes Junior, Moacir Antonelli Ponti","Sketches are simple human hand-drawn abstractions of complex scenes and real-world objects. Although the field of sketch representation learning has advanced significantly, there is still a gap in understanding the true relevance of the temporal aspect to the quality of these representations. This work investigates whether it is indeed justifiable to treat sketches as sequences, as well as which internal orders play a more relevant role. The results indicate that, although the use of traditional positional encodings is valid for modeling sketches as sequences, absolute coordinates consistently outperform relative ones. Furthermore, non-autoregressive decoders outperform their autoregressive counterparts. Finally, the importance of temporality was shown to depend on both the order considered and the task evaluated.",https://arxiv.org/pdf/2512.04007v1,,False
DIQ-H: Evaluating Hallucination Persistence in VLMs Under Temporal Visual Degradation,03/12/2025,"Zexin Lin, Hawen Wan, Yebin Zhong, Xiaoqiang","Vision-Language Models (VLMs) deployed in safety-critical applications such as autonomous driving must handle continuous visual streams under imperfect conditions. However, existing benchmarks focus on static, high-quality images and ignore temporal degradation and error propagation, which are critical failure modes where transient visual corruption induces hallucinations that persist across subsequent frames. We introduce DIQ-H, the first benchmark for evaluating VLM robustness under dynamic visual degradation in temporal sequences. DIQ-H applies physics-based corruptions including motion blur, sensor noise, and compression artifacts, and measures hallucination persistence, error recovery, and temporal consistency through multi-turn question-answering tasks. To enable scalable annotation, we propose Uncertainty-Guided Iterative Refinement (UIR), which generates reliable pseudo-ground-truth using lightweight VLMs with uncertainty filtering, achieving a 15.3 percent accuracy improvement. Experiments on 16 state-of-the-art VLMs reveal substantial robustness gaps: even advanced models such as GPT-4o achieve only a 78.5 percent recovery rate, while open-source models struggle with temporal consistency at less than 60 percent. DIQ-H provides a comprehensive platform for evaluating VLM reliability in real-world deployments.",https://arxiv.org/pdf/2512.03992v1,,False
Autonomous Agents and Policy Compliance: A Framework for Reasoning About Penalties,03/12/2025,"Vineel Tummala, Daniela Inclezan","This paper presents a logic programming-based framework for policy-aware autonomous agents that can reason about potential penalties for non-compliance and act accordingly. While prior work has primarily focused on ensuring compliance, our approach considers scenarios where deviating from policies may be necessary to achieve high-stakes goals. Additionally, modeling non-compliant behavior can assist policymakers by simulating realistic human decision-making. Our framework extends Gelfond and Lobo's Authorization and Obligation Policy Language (AOPL) to incorporate penalties and integrates Answer Set Programming (ASP) for reasoning. Compared to previous approaches, our method ensures well-formed policies, accounts for policy priorities, and enhances explainability by explicitly identifying rule violations and their consequences. Building on the work of Harders and Inclezan, we introduce penalty-based reasoning to distinguish between non-compliant plans, prioritizing those with minimal repercussions. To support this, we develop an automated translation from the extended AOPL into ASP and refine ASP-based planning algorithms to account for incurred penalties. Experiments in two domains demonstrate that our framework generates higher-quality plans that avoid harmful actions while, in some cases, also improving computational efficiency. These findings underscore its potential for enhancing autonomous decision-making and informing policy refinement. Under consideration in Theory and Practice of Logic Programming (TPLP).",https://arxiv.org/pdf/2512.03931v1,,False
Hierarchical Vision Language Action Model Using Success and Failure Demonstrations,03/12/2025,"Jeongeun Park, Jihwan Yoon, Byungwoo Jeon, Juhan Park, Jinwoo Shin, Namhoon Cho, Kyungjae Lee, Sangdoo Yun, Sungjoon Choi","Prior Vision-Language-Action (VLA) models are typically trained on teleoperated successful demonstrations, while discarding numerous failed attempts that occur naturally during data collection. However, these failures encode where and how policies can be fragile, information that can be exploited to improve robustness. We address this problem by leveraging mixed-quality datasets to learn failure-aware reasoning at planning time. We introduce VINE, a hierarchical vision-language-action model that separates high-level reasoning (System 2) from low-level control (System 1) under a hierarchical reinforcement learning formalism, making failures usable as a structured learning signal rather than noisy supervision. System 2 performs feasibility-guided tree search over a 2D scene-graph abstraction: it proposes subgoal transitions, predicts success probabilities from both successes and failures, and prunes brittle branches before execution, effectively casting plan evaluation as feasibility scoring. The selected subgoal sequence is then passed to System 1, which executes low-level actions without modifying the agent's core skills. Trained entirely from offline teleoperation data, VINE integrates negative experience directly into the decision loop. Across challenging manipulation tasks, this approach consistently improves success rates and robustness, demonstrating that failure data is an essential resource for converting the broad competence of VLAs into robust execution.",https://arxiv.org/pdf/2512.03913v1,,False
"OmniDexVLG: Learning Dexterous Grasp Generation from Vision Language Model-Guided Grasp Semantics, Taxonomy and Functional Affordance",03/12/2025,"Lei Zhang, Diwen Zheng, Kaixin Bai, Zhenshan Bing, Zoltan-Csaba Marton, Zhaopeng Chen, Alois Christian Knoll, Jianwei Zhang","Dexterous grasp generation aims to produce grasp poses that align with task requirements and human interpretable grasp semantics. However, achieving semantically controllable dexterous grasp synthesis remains highly challenging due to the lack of unified modeling of multiple semantic dimensions, including grasp taxonomy, contact semantics, and functional affordance. To address these limitations, we present OmniDexVLG, a multimodal, semantics aware grasp generation framework capable of producing structurally diverse and semantically coherent dexterous grasps under joint language and visual guidance. Our approach begins with OmniDexDataGen, a semantic rich dexterous grasp dataset generation pipeline that integrates grasp taxonomy guided configuration sampling, functional affordance contact point sampling, taxonomy aware differential force closure grasp sampling, and physics based optimization and validation, enabling systematic coverage of diverse grasp types. We further introduce OmniDexReasoner, a multimodal grasp type semantic reasoning module that leverages multi agent collaboration, retrieval augmented generation, and chain of thought reasoning to infer grasp related semantics and generate high quality annotations that align language instructions with task specific grasp intent. Building upon these components, we develop a unified Vision Language Grasping generation model that explicitly incorporates grasp taxonomy, contact structure, and functional affordance semantics, enabling fine grained control over grasp synthesis from natural language instructions. Extensive experiments in simulation and real world object grasping and ablation studies demonstrate that our method substantially outperforms state of the art approaches in terms of grasp diversity, contact semantic diversity, functional affordance diversity, and semantic consistency.",https://arxiv.org/pdf/2512.03874v1,,False
EfficientECG: Cross-Attention with Feature Fusion for Efficient Electrocardiogram Classification,03/12/2025,"Hanhui Deng, Xinglin Li, Jie Luo, Zhanpeng Jin, Di Wu","Electrocardiogram is a useful diagnostic signal that can detect cardiac abnormalities by measuring the electrical activity generated by the heart. Due to its rapid, non-invasive, and richly informative characteristics, ECG has many emerging applications. In this paper, we study novel deep learning technologies to effectively manage and analyse ECG data, with the aim of building a diagnostic model, accurately and quickly, that can substantially reduce the burden on medical workers. Unlike the existing ECG models that exhibit a high misdiagnosis rate, our deep learning approaches can automatically extract the features of ECG data through end-to-end training. Specifically, we first devise EfficientECG, an accurate and lightweight classification model for ECG analysis based on the existing EfficientNet model, which can effectively handle high-frequency long-sequence ECG data with various leading types. On top of that, we next propose a cross-attention-based feature fusion model of EfficientECG for analysing multi-lead ECG data with multiple features (e.g., gender and age). Our evaluations on representative ECG datasets validate the superiority of our model against state-of-the-art works in terms of high precision, multi-feature fusion, and lightweights.",https://arxiv.org/pdf/2512.03804v1,,False
Adaptive Identification and Modeling of Clinical Pathways with Process Mining,03/12/2025,"Francesco Vitale, Nicola Mazzocca","Clinical pathways are specialized healthcare plans that model patient treatment procedures. They are developed to provide criteria-based progression and standardize patient treatment, thereby improving care, reducing resource use, and accelerating patient recovery. However, manual modeling of these pathways based on clinical guidelines and domain expertise is difficult and may not reflect the actual best practices for different variations or combinations of diseases. We propose a two-phase modeling method using process mining, which extends the knowledge base of clinical pathways by leveraging conformance checking diagnostics. In the first phase, historical data of a given disease is collected to capture treatment in the form of a process model. In the second phase, new data is compared against the reference model to verify conformance. Based on the conformance checking results, the knowledge base can be expanded with more specific models tailored to new variants or disease combinations. We demonstrate our approach using Synthea, a benchmark dataset simulating patient treatments for SARS-CoV-2 infections with varying COVID-19 complications. The results show that our method enables expanding the knowledge base of clinical pathways with sufficient precision, peaking to 95.62% AUC while maintaining an arc-degree simplicity of 67.11%.",https://arxiv.org/pdf/2512.03787v1,,False
Principled RL for Diffusion LLMs Emerges from a Sequence-Level Perspective,03/12/2025,"Jingyang Ou, Jiaqi Han, Minkai Xu, Shaoxuan Xu, Jianwen Xie, Stefano Ermon, Yi Wu, Chongxuan Li","Reinforcement Learning (RL) has proven highly effective for autoregressive language models, but adapting these methods to diffusion large language models (dLLMs) presents fundamental challenges. The core difficulty lies in likelihood approximation: while autoregressive models naturally provide token-level conditional probabilities essential for token-level RL objectives (e.g., GRPO), dLLMs generate sequences through iterative non-autoregressive denoising steps that lack this factorization. To address this fundamental mismatch, we propose ELBO-based Sequence-level Policy Optimization (ESPO), a principled RL framework that treats entire sequence generation as a single action and uses the ELBO as a tractable sequence-level likelihood proxy. Our method incorporates per-token normalization of importance ratios and robust KL-divergence estimation to ensure stable large-scale training. Extensive experiments on mathematical reasoning, coding, and planning tasks demonstrate that ESPO significantly outperforms token-level baselines, achieving dramatic improvements of 20-40 points on the Countdown task, while maintaining consistent gains on math and coding benchmarks. Our approach establishes sequence-level optimization as a principled and empirically effective paradigm for RL in dLLMs. Our code is available at https://github.com/ML-GSAI/ESPO.",https://arxiv.org/pdf/2512.03759v1,,False
Cross-embodied Co-design for Dexterous Hands,03/12/2025,"Kehlani Fay, Darin Anthony Djapri, Anya Zorin, James Clinton, Ali El Lahib, Hao Su, Michael T. Tolley, Sha Yi, Xiaolong Wang","Dexterous manipulation is limited by both control and design, without consensus as to what makes manipulators best for performing dexterous tasks. This raises a fundamental challenge: how should we design and control robot manipulators that are optimized for dexterity? We present a co-design framework that learns task-specific hand morphology and complementary dexterous control policies. The framework supports 1) an expansive morphology search space including joint, finger, and palm generation, 2) scalable evaluation across the wide design space via morphology-conditioned cross-embodied control, and 3) real-world fabrication with accessible components. We evaluate the approach across multiple dexterous tasks, including in-hand rotation with simulation and real deployment. Our framework enables an end-to-end pipeline that can design, train, fabricate, and deploy a new robotic hand in under 24 hours. The full framework will be open-sourced and available on our website.",https://arxiv.org/pdf/2512.03743v1,,False
Consistent Projection of Langevin Dynamics: Preserving Thermodynamics and Kinetics in Coarse-Grained Models,03/12/2025,"Vahid Nateghi, Lara Neureither, Selma Moqvist, Carsten Hartmann, Simon Olsson, Feliks Nüske","Coarse graining (CG) is an important task for efficient modeling and simulation of complex multi-scale systems, such as the conformational dynamics of biomolecules. This work presents a projection-based coarse-graining formalism for general underdamped Langevin dynamics. Following the Zwanzig projection approach, we derive a closed-form expression for the coarse grained dynamics. In addition, we show how the generator Extended Dynamic Mode Decomposition (gEDMD) method, which was developed in the context of Koopman operator methods, can be used to model the CG dynamics and evaluate its kinetic properties, such as transition timescales. Finally, we combine our approach with thermodynamic interpolation (TI), a generative approach to transform samples between thermodynamic conditions, to extend the scope of the approach across thermodynamic states without repeated numerical simulations. Using a two-dimensional model system, we demonstrate that the proposed method allows to accurately capture the thermodynamic and kinetic properties of the full-space model.",https://arxiv.org/pdf/2512.03706v1,,False
Quantum Topological Graph Neural Networks for Detecting Complex Fraud Patterns,03/12/2025,"Mohammad Doost, Mohammad Manthouri","We propose a novel QTGNN framework for detecting fraudulent transactions in large-scale financial networks. By integrating quantum embedding, variational graph convolutions, and topological data analysis, QTGNN captures complex transaction dynamics and structural anomalies indicative of fraud. The methodology includes quantum data embedding with entanglement enhancement, variational quantum graph convolutions with non-linear dynamics, extraction of higher-order topological invariants, hybrid quantum-classical anomaly learning with adaptive optimization, and interpretable decision-making via topological attribution. Rigorous convergence guarantees ensure stable training on noisy intermediate-scale quantum (NISQ) devices, while stability of topological signatures provides robust fraud detection. Optimized for NISQ hardware with circuit simplifications and graph sampling, the framework scales to large transaction networks. Simulations on financial datasets, such as PaySim and Elliptic, benchmark QTGNN against classical and quantum baselines, using metrics like ROC-AUC, precision, and false positive rate. An ablation study evaluates the contributions of quantum embeddings, topological features, non-linear channels, and hybrid learning. QTGNN offers a theoretically sound, interpretable, and practical solution for financial fraud detection, bridging quantum machine learning, graph theory, and topological analysis.",https://arxiv.org/pdf/2512.03696v1,,False
"When, How Long and How Much? Interpretable Neural Networks for Time Series Regression by Learning to Mask and Aggregate",03/12/2025,"Florent Forest, Amaury Wei, Olga Fink","Time series extrinsic regression (TSER) refers to the task of predicting a continuous target variable from an input time series. It appears in many domains, including healthcare, finance, environmental monitoring, and engineering. In these settings, accurate predictions and trustworthy reasoning are both essential. Although state-of-the-art TSER models achieve strong predictive performance, they typically operate as black boxes, making it difficult to understand which temporal patterns drive their decisions. Post-hoc interpretability techniques, such as feature attribution, aim to to explain how the model arrives at its predictions, but often produce coarse, noisy, or unstable explanations. Recently, inherently interpretable approaches based on concepts, additive decompositions, or symbolic regression, have emerged as promising alternatives. However, these approaches remain limited: they require explicit supervision on the concepts themselves, often cannot capture interactions between time-series features, lack expressiveness for complex temporal patterns, and struggle to scale to high-dimensional multivariate data.
  To address these limitations, we propose MAGNETS (Mask-and-AGgregate NEtwork for Time Series), an inherently interpretable neural architecture for TSER. MAGNETS learns a compact set of human-understandable concepts without requiring any annotations. Each concept corresponds to a learned, mask-based aggregation over selected input features, explicitly revealing both which features drive predictions and when they matter in the sequence. Predictions are formed as combinations of these learned concepts through a transparent, additive structure, enabling clear insight into the model's decision process.",https://arxiv.org/pdf/2512.03578v1,,False
Machine Learning to Predict Slot Usage in TSCH Wireless Sensor Networks,03/12/2025,"Stefano Scanzio, Gabriele Formis, Tullio Facchinetti, Gianluca Cena","Wireless sensor networks (WSNs) are employed across a wide range of industrial applications where ultra-low power consumption is a critical prerequisite. At the same time, these systems must maintain a certain level of determinism to ensure reliable and predictable operation. In this view, time slotted channel hopping (TSCH) is a communication technology that meets both conditions, making it an attractive option for its usage in industrial WSNs. This work proposes the use of machine learning to learn the traffic pattern generated in networks based on the TSCH protocol, in order to turn nodes into a deep sleep state when no transmission is planned and thus to improve the energy efficiency of the WSN. The ability of machine learning models to make good predictions at different network levels in a typical tree network topology was analyzed in depth, showing how their capabilities degrade while approaching the root of the tree. The application of these models on simulated data based on an accurate modeling of wireless sensor nodes indicates that the investigated algorithms can be suitably used to further and substantially reduce the power consumption of a TSCH network.",https://arxiv.org/pdf/2512.03570v1,10.1109/ETFA65518.2025.11205770,False
CookAnything: A Framework for Flexible and Consistent Multi-Step Recipe Image Generation,03/12/2025,"Ruoxuan Zhang, Bin Wen, Hongxia Xie, Yi Yao, Songhan Zuo, Jian-Yu Jiang-Lin, Hong-Han Shuai, Wen-Huang Cheng","Cooking is a sequential and visually grounded activity, where each step such as chopping, mixing, or frying carries both procedural logic and visual semantics. While recent diffusion models have shown strong capabilities in text-to-image generation, they struggle to handle structured multi-step scenarios like recipe illustration. Additionally, current recipe illustration methods are unable to adjust to the natural variability in recipe length, generating a fixed number of images regardless of the actual instructions structure. To address these limitations, we present CookAnything, a flexible and consistent diffusion-based framework that generates coherent, semantically distinct image sequences from textual cooking instructions of arbitrary length. The framework introduces three key components: (1) Step-wise Regional Control (SRC), which aligns textual steps with corresponding image regions within a single denoising process; (2) Flexible RoPE, a step-aware positional encoding mechanism that enhances both temporal coherence and spatial diversity; and (3) Cross-Step Consistency Control (CSCC), which maintains fine-grained ingredient consistency across steps. Experimental results on recipe illustration benchmarks show that CookAnything performs better than existing methods in training-based and training-free settings. The proposed framework supports scalable, high-quality visual synthesis of complex multi-step instructions and holds significant potential for broad applications in instructional media, and procedural content creation.",https://arxiv.org/pdf/2512.03540v1,10.1145/3746027.3755174,False
Adaptive sampling using variational autoencoder and reinforcement learning,03/12/2025,"Adil Rasheed, Mikael Aleksander Jansen Shahly, Muhammad Faisal Aftab","Compressed sensing enables sparse sampling but relies on generic bases and random measurements, limiting efficiency and reconstruction quality. Optimal sensor placement uses historcal data to design tailored sampling patterns, yet its fixed, linear bases cannot adapt to nonlinear or sample-specific variations. Generative model-based compressed sensing improves reconstruction using deep generative priors but still employs suboptimal random sampling. We propose an adaptive sparse sensing framework that couples a variational autoencoder prior with reinforcement learning to select measurements sequentially. Experiments show that this approach outperforms CS, OSP, and Generative model-based reconstruction from sparse measurements.",https://arxiv.org/pdf/2512.03525v1,,False
