Title,Publication Date,Author(s),Abstract,Link,DOI,Relevant
EasyV2V: A High-quality Instruction-based Video Editing Framework,18/12/2025,"Jinjie Mai, Chaoyang Wang, Guocheng Gordon Qian, Willi Menapace, Sergey Tulyakov, Bernard Ghanem, Peter Wonka, Ashkan Mirzaei","While image editing has advanced rapidly, video editing remains less explored, facing challenges in consistency, control, and generalization. We study the design space of data, architecture, and control, and introduce \emph{EasyV2V}, a simple and effective framework for instruction-based video editing. On the data side, we compose existing experts with fast inverses to build diverse video pairs, lift image edit pairs into videos via single-frame supervision and pseudo pairs with shared affine motion, mine dense-captioned clips for video pairs, and add transition supervision to teach how edits unfold. On the model side, we observe that pretrained text-to-video models possess editing capability, motivating a simplified design. Simple sequence concatenation for conditioning with light LoRA fine-tuning suffices to train a strong model. For control, we unify spatiotemporal control via a single mask mechanism and support optional reference images. Overall, EasyV2V works with flexible inputs, e.g., video+text, video+mask+text, video+mask+reference+text, and achieves state-of-the-art video editing results, surpassing concurrent and commercial systems. Project page: https://snap-research.github.io/easyv2v/",https://arxiv.org/pdf/2512.16920v1,,False
In-Context Algebra,18/12/2025,"Eric Todd, Jannik Brinkmann, Rohit Gandikota, David Bau","We investigate the mechanisms that arise when transformers are trained to solve arithmetic on sequences where tokens are variables whose meaning is determined only through their interactions. While prior work has found that transformers develop geometric embeddings that mirror algebraic structure, those previous findings emerge from settings where arithmetic-valued tokens have fixed meanings. We devise a new task in which the assignment of symbols to specific algebraic group elements varies from one sequence to another. Despite this challenging setup, transformers achieve near-perfect accuracy on the task and even generalize to unseen algebraic groups. We develop targeted data distributions to create causal tests of a set of hypothesized mechanisms, and we isolate three mechanisms models consistently learn: commutative copying where a dedicated head copies answers, identity element recognition that distinguishes identity-containing facts, and closure-based cancellation that tracks group membership to constrain valid answers. Complementary to the geometric representations found in fixed-symbol settings, our findings show that models develop symbolic reasoning mechanisms when trained to reason in-context with variables whose meanings are not fixed.",https://arxiv.org/pdf/2512.16902v1,,False
PolaRiS: Scalable Real-to-Sim Evaluations for Generalist Robot Policies,18/12/2025,"Arhan Jain, Mingtong Zhang, Kanav Arora, William Chen, Marcel Torne, Muhammad Zubair Irshad, Sergey Zakharov, Yue Wang, Sergey Levine, Chelsea Finn, Wei-Chiu Ma, Dhruv Shah, Abhishek Gupta, Karl Pertsch","A significant challenge for robot learning research is our ability to accurately measure and compare the performance of robot policies. Benchmarking in robotics is historically challenging due to the stochasticity, reproducibility, and time-consuming nature of real-world rollouts. This challenge is exacerbated for recent generalist policies, which has to be evaluated across a wide variety of scenes and tasks. Evaluation in simulation offers a scalable complement to real world evaluations, but the visual and physical domain gap between existing simulation benchmarks and the real world has made them an unreliable signal for policy improvement. Furthermore, building realistic and diverse simulated environments has traditionally required significant human effort and expertise. To bridge the gap, we introduce Policy Evaluation and Environment Reconstruction in Simulation (PolaRiS), a scalable real-to-sim framework for high-fidelity simulated robot evaluation. PolaRiS utilizes neural reconstruction methods to turn short video scans of real-world scenes into interactive simulation environments. Additionally, we develop a simple simulation data co-training recipe that bridges remaining real-to-sim gaps and enables zero-shot evaluation in unseen simulation environments. Through extensive paired evaluations between simulation and the real world, we demonstrate that PolaRiS evaluations provide a much stronger correlation to real world generalist policy performance than existing simulated benchmarks. Its simplicity also enables rapid creation of diverse simulated environments. As such, this work takes a step towards distributed and democratized evaluation for the next generation of robotic foundation models.",https://arxiv.org/pdf/2512.16881v1,,False
Semi-Supervised Online Learning on the Edge by Transforming Knowledge from Teacher Models,18/12/2025,Jiabin Xue,"Edge machine learning (Edge ML) enables training ML models using the vast data distributed across network edges. However, many existing approaches assume static models trained centrally and then deployed, making them ineffective against unseen data. To address this, Online Edge ML allows models to be trained directly on edge devices and updated continuously with new data. This paper explores a key challenge of Online Edge ML: ""How to determine labels for truly future, unseen data points"". We propose Knowledge Transformation (KT), a hybrid method combining Knowledge Distillation, Active Learning, and causal reasoning. In short, KT acts as the oracle in active learning by transforming knowledge from a teacher model to generate pseudo-labels for training a student model. To verify the validity of the method, we conducted simulation experiments with two setups: (1) using a less stable teacher model and (2) a relatively more stable teacher model. Results indicate that when a stable teacher model is given, the student model can eventually reach its expected maximum performance. KT is potentially beneficial for scenarios that meet the following circumstances: (1) when the teacher's task is generic, which means existing pre-trained models might be adequate for its task, so there will be no need to train the teacher model from scratch; and/or (2) when the label for the student's task is difficult or expensive to acquire.",https://arxiv.org/pdf/2512.16866v1,,False
LLMCache: Layer-Wise Caching Strategies for Accelerated Reuse in Transformer Inference,18/12/2025,Harsh Vardhan Bansal,"Transformer-based language models have achieved remarkable performance across a wide range of tasks, yet their high inference latency poses a significant challenge for real-timeand large-scale deployment. While existing caching mechanisms,such as token-level key-value caches, offer speedups in autore-gressive decoding, they are limited in scope and applicability. In this paper, we present LLMCache, a novel layer-wise caching framework that accelerates transformer inference by reusing intermediate activations based on semantic similarity of input sequences. Unlike prior work, LLMCache is model-agnostic,operates across both encoder and decoder architectures, and supports caching at arbitrary transformer layers. We introduce a lightweight fingerprinting mechanism for matching seman-tically similar inputs and propose adaptive eviction strategies to manage cache staleness. Experiments on BERT and GPT-2 across SQuAD, WikiText-103, and OpenBookQA show up to 3.1 X speedup in inference time with <0.5% accuracy degradation. Our results highlight LLMCache as a practical and general-purpose solution for optimizing transformer inference in real-world applications",https://arxiv.org/pdf/2512.16843v1,,False
Next-Generation License Plate Detection and Recognition System using YOLOv8,18/12/2025,"Arslan Amin, Rafia Mumtaz, Muhammad Jawad Bashir, Syed Mohammad Hassan Zaidi","In the evolving landscape of traffic management and vehicle surveillance, efficient license plate detection and recognition are indispensable. Historically, many methodologies have tackled this challenge, but consistent real-time accuracy, especially in diverse environments, remains elusive. This study examines the performance of YOLOv8 variants on License Plate Recognition (LPR) and Character Recognition tasks, crucial for advancing Intelligent Transportation Systems. Two distinct datasets were employed for training and evaluation, yielding notable findings. The YOLOv8 Nano variant demonstrated a precision of 0.964 and mAP50 of 0.918 on the LPR task, while the YOLOv8 Small variant exhibited a precision of 0.92 and mAP50 of 0.91 on the Character Recognition task. A custom method for character sequencing was introduced, effectively sequencing the detected characters based on their x-axis positions. An optimized pipeline, utilizing YOLOv8 Nano for LPR and YOLOv8 Small for Character Recognition, is proposed. This configuration not only maintains computational efficiency but also ensures high accuracy, establishing a robust foundation for future real-world deployments on edge devices within Intelligent Transportation Systems. This effort marks a significant stride towards the development of smarter and more efficient urban infrastructures.",https://arxiv.org/pdf/2512.16826v1,10.1109/HONET59747.2023.10374756,False
Coordinated Anti-Jamming Resilience in Swarm Networks via Multi-Agent Reinforcement Learning,18/12/2025,"Bahman Abolhassani, Tugba Erpek, Kemal Davaslioglu, Yalin E. Sagduyu, Sastry Kompella","Reactive jammers pose a severe security threat to robotic-swarm networks by selectively disrupting inter-agent communications and undermining formation integrity and mission success. Conventional countermeasures such as fixed power control or static channel hopping are largely ineffective against such adaptive adversaries. This paper presents a multi-agent reinforcement learning (MARL) framework based on the QMIX algorithm to improve the resilience of swarm communications under reactive jamming. We consider a network of multiple transmitter-receiver pairs sharing channels while a reactive jammer with Markovian threshold dynamics senses aggregate power and reacts accordingly. Each agent jointly selects transmit frequency (channel) and power, and QMIX learns a centralized but factorizable action-value function that enables coordinated yet decentralized execution. We benchmark QMIX against a genie-aided optimal policy in a no-channel-reuse setting, and against local Upper Confidence Bound (UCB) and a stateless reactive policy in a more general fading regime with channel reuse enabled. Simulation results show that QMIX rapidly converges to cooperative policies that nearly match the genie-aided bound, while achieving higher throughput and lower jamming incidence than the baselines, thereby demonstrating MARL's effectiveness for securing autonomous swarms in contested environments.",https://arxiv.org/pdf/2512.16813v1,,False
Few-Shot Specific Emitter Identification via Integrated Complex Variational Mode Decomposition and Spatial Attention Transfer,18/12/2025,"Chenyu Zhu, Zeyang Li, Ziyi Xie, Jie Zhang","Specific emitter identification (SEI) utilizes passive hardware characteristics to authenticate transmitters, providing a robust physical-layer security solution. However, most deep-learning-based methods rely on extensive data or require prior information, which poses challenges in real-world scenarios with limited labeled data. We propose an integrated complex variational mode decomposition algorithm that decomposes and reconstructs complex-valued signals to approximate the original transmitted signals, thereby enabling more accurate feature extraction. We further utilize a temporal convolutional network to effectively model the sequential signal characteristics, and introduce a spatial attention mechanism to adaptively weight informative signal segments, significantly enhancing identification performance. Additionally, the branch network allows leveraging pre-trained weights from other data while reducing the need for auxiliary datasets. Ablation experiments on the simulated data demonstrate the effectiveness of each component of the model. An accuracy comparison on a public dataset reveals that our method achieves 96% accuracy using only 10 symbols without requiring any prior knowledge.",https://arxiv.org/pdf/2512.16786v1,,False
KOSS: Kalman-Optimal Selective State Spaces for Long-Term Sequence Modeling,18/12/2025,"Lei Wang, Xin Tan, Mingwei Wang, Ying Zhang","Recent selective state space models (SSMs), such as Mamba and Mamba-2, have demonstrated strong performance in sequence modeling owing to input-dependent selection mechanisms. However, these mechanisms lack theoretical grounding and cannot support context-aware selection from latent state dynamics. To address these limitations, we propose KOSS, a Kalman-optimal Selective State Space model that formulates selection as latent state uncertainty minimization. Derived from estimation theory, KOSS adopts a continuous-time latent update driven by a Kalman gain that dynamically modulates information propagation based on content and context, enabling a closed-loop, context-aware selectivity mechanism. To ensure stable computation and near-linear scalability, KOSS employs global spectral differentiation for frequency-domain derivative estimation, along with a segment-wise scan for hardware-efficient processing. On a selective copying task with distractors, KOSS achieves over 79\% accuracy while baselines drop below 20\%, demonstrating robust context-aware selection. Furthermore, across nine long-term forecasting benchmarks, KOSS reduces MSE by 2.92--36.23\% and consistently outperforms state-of-the-art models in both accuracy and stability. To assess real-world applicability, a case study on secondary surveillance radar (SSR) tracking confirms KOSS's robustness under irregular intervals and noisy conditions and demonstrates its effectiveness in real-world applications. Finally, supplementary experiments verify Kalman gain convergence and the frequency response of spectral differentiation, providing theoretical support for the proposed closed-loop design.",https://arxiv.org/pdf/2512.16723v1,,False
How accurate are foundational machine learning interatomic potentials for heterogeneous catalysis?,18/12/2025,"Luuk H. E. Kempen, Raffaele Cheula, Mie Andersen","Foundational machine learning interatomic potentials (MLIPs) are being developed at a rapid pace, promising closer and closer approximation to ab initio accuracy. This unlocks the possibility to simulate much larger length and time scales. However, benchmarks for these MLIPs are usually limited to ordered, crystalline and bulk materials. Hence, reported performance does not necessarily accurately reflect MLIP performance in real applications such as heterogeneous catalysis. Here, we systematically analyze zero-shot performance of 80 different MLIPs, evaluating tasks typical for heterogeneous catalysis across a range of different data sets, including adsorption and reaction on surfaces of alloyed metals, oxides, and metal-oxide interfacial systems. We demonstrate that current-generation foundational MLIPs can already perform at high accuracy for applications such as predicting vacancy formation energies of perovskite oxides or zero-point energies of supported nanoclusters. However, limitations also exist. We find that many MLIPs catastrophically fail when applied to magnetic materials, and structure relaxation in the MLIP generally increases the energy prediction error compared to single-point evaluation of a previously optimized structure. Comparing low-cost task-specific models to foundational MLIPs, we highlight some core differences between these model approaches and show that -- if considering only accuracy -- these models can compete with the current generation of best-performing MLIPs. Furthermore, we show that no single MLIP universally performs best, requiring users to investigate MLIP suitability for their desired application.",https://arxiv.org/pdf/2512.16702v1,,False
Protecting Deep Neural Network Intellectual Property with Chaos-Based White-Box Watermarking,18/12/2025,"Sangeeth B, Serena Nicolazzo, Deepa K., Vinod P","The rapid proliferation of deep neural networks (DNNs) across several domains has led to increasing concerns regarding intellectual property (IP) protection and model misuse. Trained DNNs represent valuable assets, often developed through significant investments. However, the ease with which models can be copied, redistributed, or repurposed highlights the urgent need for effective mechanisms to assert and verify model ownership. In this work, we propose an efficient and resilient white-box watermarking framework that embeds ownership information into the internal parameters of a DNN using chaotic sequences. The watermark is generated using a logistic map, a well-known chaotic function, producing a sequence that is sensitive to its initialization parameters. This sequence is injected into the weights of a chosen intermediate layer without requiring structural modifications to the model or degradation in predictive performance. To validate ownership, we introduce a verification process based on a genetic algorithm that recovers the original chaotic parameters by optimizing the similarity between the extracted and regenerated sequences. The effectiveness of the proposed approach is demonstrated through extensive experiments on image classification tasks using MNIST and CIFAR-10 datasets. The results show that the embedded watermark remains detectable after fine-tuning, with negligible loss in model accuracy. In addition to numerical recovery of the watermark, we perform visual analyses using weight density plots and construct activation-based classifiers to distinguish between original, watermarked, and tampered models. Overall, the proposed method offers a flexible and scalable solution for embedding and verifying model ownership in white-box settings well-suited for real-world scenarios where IP protection is critical.",https://arxiv.org/pdf/2512.16658v1,,False
Riemannian Stochastic Interpolants for Amorphous Particle Systems,18/12/2025,"Louis Grenioux, Leonardo Galliano, Ludovic Berthier, Giulio Biroli, Marylou Gabrié","Modern generative models hold great promise for accelerating diverse tasks involving the simulation of physical systems, but they must be adapted to the specific constraints of each domain. Significant progress has been made for biomolecules and crystalline materials. Here, we address amorphous materials (glasses), which are disordered particle systems lacking atomic periodicity. Sampling equilibrium configurations of glass-forming materials is a notoriously slow and difficult task. This obstacle could be overcome by developing a generative framework capable of producing equilibrium configurations with well-defined likelihoods. In this work, we address this challenge by leveraging an equivariant Riemannian stochastic interpolation framework which combines Riemannian stochastic interpolant and equivariant flow matching. Our method rigorously incorporates periodic boundary conditions and the symmetries of multi-component particle systems, adapting an equivariant graph neural network to operate directly on the torus. Our numerical experiments on model amorphous systems demonstrate that enforcing geometric and symmetry constraints significantly improves generative performance.",https://arxiv.org/pdf/2512.16607v1,,False
Abacus: Self-Supervised Event Counting-Aligned Distributional Pretraining for Sequential User Modeling,18/12/2025,"Sullivan Castro, Artem Betlei, Thomas Di Martino, Nadir El Manouzi","Modeling user purchase behavior is a critical challenge in display advertising systems, necessary for real-time bidding. The difficulty arises from the sparsity of positive user events and the stochasticity of user actions, leading to severe class imbalance and irregular event timing. Predictive systems usually rely on hand-crafted ""counter"" features, overlooking the fine-grained temporal evolution of user intent. Meanwhile, current sequential models extract direct sequential signal, missing useful event-counting statistics. We enhance deep sequential models with self-supervised pretraining strategies for display advertising. Especially, we introduce Abacus, a novel approach of predicting the empirical frequency distribution of user events. We further propose a hybrid objective unifying Abacus with sequential learning objectives, combining stability of aggregated statistics with the sequence modeling sensitivity. Experiments on two real-world datasets show that Abacus pretraining outperforms existing methods accelerating downstream task convergence, while hybrid approach yields up to +6.1% AUC compared to the baselines.",https://arxiv.org/pdf/2512.16581v1,10.1145/3773966.3779391,False
Advantages and limitations in the use of transfer learning for individual treatment effects in causal machine learning,18/12/2025,"Seyda Betul Aydin, Holger Brandt","Generalizing causal knowledge across diverse environments is challenging, especially when estimates from large-scale datasets must be applied to smaller or systematically different contexts, where external validity is critical. Model-based estimators of individual treatment effects (ITE) from machine learning require large sample sizes, limiting their applicability in domains such as behavioral sciences with smaller datasets. We demonstrate how estimation of ITEs with Treatment Agnostic Representation Networks (TARNet; Shalit et al., 2017) can be improved by leveraging knowledge from source datasets and adapting it to new settings via transfer learning (TL-TARNet; Aloui et al., 2023). In simulations that vary source and sample sizes and consider both randomized and non-randomized intervention target settings, the transfer-learning extension TL-TARNet improves upon standard TARNet, reducing ITE error and attenuating bias when a large unbiased source is available and target samples are small. In an empirical application using the India Human Development Survey (IHDS-II), we estimate the effect of mothers' firewood collection time on children's weekly study time; transfer learning pulls the target mean ITEs toward the source ITE estimate, reducing bias in the estimates obtained without transfer. These results suggest that transfer learning for causal models can improve the estimation of ITE in small samples.",https://arxiv.org/pdf/2512.16489v1,,False
Quantifying and Bridging the Fidelity Gap: A Decisive-Feature Approach to Comparing Synthetic and Real Imagery,18/12/2025,"Danial Safaei, Siddartha Khastgir, Mohsen Alirezaei, Jeroen Ploeg, Son Tong, Xingyu Zhao","Virtual testing using synthetic data has become a cornerstone of autonomous vehicle (AV) safety assurance. Despite progress in improving visual realism through advanced simulators and generative AI, recent studies reveal that pixel-level fidelity alone does not ensure reliable transfer from simulation to the real world. What truly matters is whether the system-under-test (SUT) bases its decisions on the same causal evidence in both real and simulated environments - not just whether images ""look real"" to humans. This paper addresses the lack of such a behavior-grounded fidelity measure by introducing Decisive Feature Fidelity (DFF), a new SUT-specific metric that extends the existing fidelity spectrum to capture mechanism parity - the agreement in causal evidence underlying the SUT's decisions across domains. DFF leverages explainable-AI (XAI) methods to identify and compare the decisive features driving the SUT's outputs for matched real-synthetic pairs. We further propose practical estimators based on counterfactual explanations, along with a DFF-guided calibration scheme to enhance simulator fidelity. Experiments on 2126 matched KITTI-VirtualKITTI2 pairs demonstrate that DFF reveals discrepancies overlooked by conventional output-value fidelity. Furthermore, results show that DFF-guided calibration improves decisive-feature and input-level fidelity without sacrificing output value fidelity across diverse SUTs.",https://arxiv.org/pdf/2512.16468v1,,False
