Title,Publication Date,Author(s),Abstract,Link,DOI,Relevant
Multi-Fidelity Delayed Acceptance: hierarchical MCMC sampling for Bayesian inverse problems combining multiple solvers through deep neural networks,18/12/2025,"Filippo Zacchei, Paolo Conti, Attilio Alberto Frangi, Andrea Manzoni","Inverse uncertainty quantification (UQ) tasks such as parameter estimation are computationally demanding whenever dealing with physics-based models, and typically require repeated evaluations of complex numerical solvers. When partial differential equations are involved, full-order models such as those based on the Finite Element Method can make traditional sampling approaches like Markov Chain Monte Carlo (MCMC) computationally infeasible. Although data-driven surrogate models may help reduce evaluation costs, their utility is often limited by the expense of generating high-fidelity data. In contrast, low-fidelity data can be produced more efficiently, although relying on them alone may degrade the accuracy of the inverse UQ solution.
  To address these challenges, we propose a Multi-Fidelity Delayed Acceptance scheme for Bayesian inverse problems. Extending the Multi-Level Delayed Acceptance framework, the method introduces multi-fidelity neural networks that combine the predictions of solvers of varying fidelity, with high fidelity evaluations restricted to an offline training stage. During the online phase, likelihood evaluations are obtained by evaluating the coarse solvers and passing their outputs to the trained neural networks, thereby avoiding additional high-fidelity simulations.
  This construction allows heterogeneous coarse solvers to be incorporated consistently within the hierarchy, providing greater flexibility than standard Multi-Level Delayed Acceptance. The proposed approach improves the approximation accuracy of the low fidelity solvers, leading to longer sub-chain lengths, better mixing, and accelerated posterior inference. The effectiveness of the strategy is demonstrated on two benchmark inverse problems involving (i) steady isotropic groundwater flow, (ii) an unsteady reaction-diffusion system, for which substantial computational savings are obtained.",https://arxiv.org/pdf/2512.16430v1,,False
Code-in-the-Loop Forensics: Agentic Tool Use for Image Forgery Detection,18/12/2025,"Fanrui Zhang, Qiang Zhang, Sizhuo Zhou, Jianwen Sun, Chuanhao Li, Jiaxin Ai, Yukang Feng, Yujie Zhang, Wenjie Li, Zizhen Li, Yifan Chang, Jiawei Liu, Kaipeng Zhang","Existing image forgery detection (IFD) methods either exploit low-level, semantics-agnostic artifacts or rely on multimodal large language models (MLLMs) with high-level semantic knowledge. Although naturally complementary, these two information streams are highly heterogeneous in both paradigm and reasoning, making it difficult for existing methods to unify them or effectively model their cross-level interactions. To address this gap, we propose ForenAgent, a multi-round interactive IFD framework that enables MLLMs to autonomously generate, execute, and iteratively refine Python-based low-level tools around the detection objective, thereby achieving more flexible and interpretable forgery analysis. ForenAgent follows a two-stage training pipeline combining Cold Start and Reinforcement Fine-Tuning to enhance its tool interaction capability and reasoning adaptability progressively. Inspired by human reasoning, we design a dynamic reasoning loop comprising global perception, local focusing, iterative probing, and holistic adjudication, and instantiate it as both a data-sampling strategy and a task-aligned process reward. For systematic training and evaluation, we construct FABench, a heterogeneous, high-quality agent-forensics dataset comprising 100k images and approximately 200k agent-interaction question-answer pairs. Experiments show that ForenAgent exhibits emergent tool-use competence and reflective reasoning on challenging IFD tasks when assisted by low-level tools, charting a promising route toward general-purpose IFD. The code will be released after the review process is completed.",https://arxiv.org/pdf/2512.16300v1,,False
In-Context Probing for Membership Inference in Fine-Tuned Language Models,18/12/2025,"Zhexi Lu, Hongliang Chi, Nathalie Baracaldo, Swanand Ravindra Kadhe, Yuseok Jeon, Lei Yu","Membership inference attacks (MIAs) pose a critical privacy threat to fine-tuned large language models (LLMs), especially when models are adapted to domain-specific tasks using sensitive data. While prior black-box MIA techniques rely on confidence scores or token likelihoods, these signals are often entangled with a sample's intrinsic properties - such as content difficulty or rarity - leading to poor generalization and low signal-to-noise ratios. In this paper, we propose ICP-MIA, a novel MIA framework grounded in the theory of training dynamics, particularly the phenomenon of diminishing returns during optimization. We introduce the Optimization Gap as a fundamental signal of membership: at convergence, member samples exhibit minimal remaining loss-reduction potential, while non-members retain significant potential for further optimization. To estimate this gap in a black-box setting, we propose In-Context Probing (ICP), a training-free method that simulates fine-tuning-like behavior via strategically constructed input contexts. We propose two probing strategies: reference-data-based (using semantically similar public samples) and self-perturbation (via masking or generation). Experiments on three tasks and multiple LLMs show that ICP-MIA significantly outperforms prior black-box MIAs, particularly at low false positive rates. We further analyze how reference data alignment, model type, PEFT configurations, and training schedules affect attack effectiveness. Our findings establish ICP-MIA as a practical and theoretically grounded framework for auditing privacy risks in deployed LLMs.",https://arxiv.org/pdf/2512.16292v1,,False
Scaling Spatial Reasoning in MLLMs through Programmatic Data Synthesis,18/12/2025,"Zhi Helu, Huang Jingjing, Xu Wang, Xu Yangbin, Zhang Wanyue, Jiang Baoyang, Deng Shirui, Zhu Liang, Li Fangfang, Zhao Tiejun, Lin Yankai, Yao Yuan","Embodied intelligence, a grand challenge in artificial intelligence, is fundamentally constrained by the limited spatial understanding and reasoning capabilities of current models. Prevailing efforts to address this through enhancing Vision-Language Models (VLMs) are trapped in a dilemma: template-based datasets are scalable but structurally rigid, while manual annotation is linguistically diverse but unscalable and, critically, computationally imprecise. We introduce SPRITE, a novel framework that overcomes this dilemma by leveraging simulators and large models to programmatically synthesize scalable, diverse, and high-quality spatial reasoning data. The core innovation of SPRITE is to reframe ground-truth generation as a code-generation task. We utilize LLMs to compile complex spatial questions into executable programs, which are then verified against high-precision scene meta-information extracted from simulators. This ensures our ground truth is both computationally precise and verifiable, while the generative power of LLMs provides vast linguistic diversity. Leveraging this pipeline, we have curated a dataset encompassing 3 simulators, 11k+ scenes, and 300k+ image/video instruction-tuning pairs. We demonstrate that a VLM trained on our data achieves significant performance gains on multiple spatial benchmarks and outperforms other open-source datasets of equivalent size. Furthermore, a scalability analysis confirms our hypothesis that overcoming the low-diversity nature of traditional template methods is essential for building robust, generalizable spatial intelligence. We will make the SPRITE framework code and the full 300k+ dataset publicly available to facilitate future research in spatial intelligence.",https://arxiv.org/pdf/2512.16237v1,,False
The Evolution of Reranking Models in Information Retrieval: From Heuristic Methods to Large Language Models,18/12/2025,"Tejul Pandit, Sakshi Mahendru, Meet Raval, Dhvani Upadhyay","Reranking is a critical stage in contemporary information retrieval (IR) systems, improving the relevance of the user-presented final results by honing initial candidate sets. This paper is a thorough guide to examine the changing reranker landscape and offer a clear view of the advancements made in reranking methods. We present a comprehensive survey of reranking models employed in IR, particularly within modern Retrieval Augmented Generation (RAG) pipelines, where retrieved documents notably influence output quality.
  We embark on a chronological journey through the historical trajectory of reranking techniques, starting with foundational approaches, before exploring the wide range of sophisticated neural network architectures such as cross-encoders, sequence-generation models like T5, and Graph Neural Networks (GNNs) utilized for structural information. Recognizing the computational cost of advancing neural rerankers, we analyze techniques for enhancing efficiency, notably knowledge distillation for creating competitive, lighter alternatives. Furthermore, we map the emerging territory of integrating Large Language Models (LLMs) in reranking, examining novel prompting strategies and fine-tuning tactics. This survey seeks to elucidate the fundamental ideas, relative effectiveness, computational features, and real-world trade-offs of various reranking strategies. The survey provides a structured synthesis of the diverse reranking paradigms, highlighting their underlying principles and comparative strengths and weaknesses.",https://arxiv.org/pdf/2512.16236v1,,False
DAG Learning from Zero-Inflated Count Data Using Continuous Optimization,18/12/2025,"Noriaki Sato, Marco Scutari, Shuichi Kawano, Rui Yamaguchi, Seiya Imoto","We address network structure learning from zero-inflated count data by casting each node as a zero-inflated generalized linear model and optimizing a smooth, score-based objective under a directed acyclic graph constraint. Our Zero-Inflated Continuous Optimization (ZICO) approach uses node-wise likelihoods with canonical links and enforces acyclicity through a differentiable surrogate constraint combined with sparsity regularization. ZICO achieves superior performance with faster runtimes on simulated data. It also performs comparably to or better than common algorithms for reverse engineering gene regulatory networks. ZICO is fully vectorized and mini-batched, enabling learning on larger variable sets with practical runtimes in a wide range of domains.",https://arxiv.org/pdf/2512.16233v1,,False
Neural emulation of gravity-driven geohazard runout,18/12/2025,"Lorenzo Nava, Ye Chen, Maximillian Van Wyk de Vries","Predicting geohazard runout is critical for protecting lives, infrastructure and ecosystems. Rapid mass flows, including landslides and avalanches, cause several thousand deaths across a wide range of environments, often travelling many kilometres from their source. The wide range of source conditions and material properties governing these flows makes their runout difficult to anticipate, particularly for downstream communities that may be suddenly exposed to severe impacts. Accurately predicting runout at scale requires models that are both physically realistic and computationally efficient, yet existing approaches face a fundamental speed-realism trade-off. Here we train a machine learning model to predict geohazard runout across representative real world terrains. The model predicts both flow extent and deposit thickness with high accuracy and 100 to 10,000 times faster computation than numerical solvers. It is trained on over 100,000 numerical simulations across over 10,000 real world digital elevation model chips and reproduces key physical behaviours, including avulsion and deposition patterns, while generalizing across different flow types, sizes and landscapes. Our results demonstrate that neural emulation enables rapid, spatially resolved runout prediction across diverse real world terrains, opening new opportunities for disaster risk reduction and impact-based forecasting. These results highlight neural emulation as a promising pathway for extending physically realistic geohazard modelling to spatial and temporal scales relevant for large scale early warning systems.",https://arxiv.org/pdf/2512.16221v1,,False
