Title,Publication Date,Author(s),Abstract,Link,DOI,Relevant
On the Learning Curves of Revenue Maximization,29/04/2026,"Steve Hanneke, Alkis Kalavasis, Shay Moran, Grigoris Velegkas","Learning curves are a fundamental primitive in supervised learning, describing how an algorithm's performance improves with more data and providing a quantitative measure of its generalization ability. Formally, a learning curve plots the decay of an algorithm's error for a fixed underlying distribution as a function of the number of training samples. Prior work on revenue-maximizing learning algorithms, starting with the seminal work of Cole and Roughgarden [STOC, 2014], adopts a distribution-free perspective, which parallels the PAC learning framework in learning theory. This approach evaluates performance against the hardest possible sequence of valuation distributions, one for each sample size, effectively defining the upper envelope of learning curves over all possible distributions, thus leading to error bounds that do not capture the shape of the learning curves.
  In this work we initiate the study of learning curves for revenue maximization and provide a near-complete characterization of their rate of decay in the basic setting of a single item and a single buyer. In the absence of any restriction on the valuation distribution, we show that there exists a Bayes-consistent algorithm, meaning that its learning curve converges to zero for any arbitrary valuation distribution as the number of samples $n \to \infty$. However, this convergence must be arbitrarily slow, even if the optimal revenue is finite. In contrast, if the optimal revenue is achieved by a finite price, then the optimal rate of decay is roughly $1/\sqrt{n}$. Finally, for distributions supported on discrete sets of values, we show that learning curves decay almost exponentially fast, a rate unattainable under the PAC framework.",https://arxiv.org/pdf/2604.26922v1,,False
Language Diffusion Models are Associative Memories Capable of Retrieving Unseen Data,29/04/2026,"Bao Pham, Mohammed J. Zaki, Luca Ambrogioni, Dmitry Krotov, Matteo Negri","When do language diffusion models memorize their training data, and how to quantitatively assess their true generative regime? We address these questions by showing that Uniform-based Discrete Diffusion Models (UDDMs) fundamentally behave as Associative Memories (AMs) $\textit{with emergent creative capabilities}$. The core idea of an AM is to reliably recover stored data points as $\textit{memories}$ by establishing distinct basins of attraction around them. Historically, models like Hopfield networks use an explicit energy function to guarantee these stable attractors. We broaden this perspective by leveraging the observation that energy is not strictly necessary, as basins of attraction can also be formed via conditional likelihood maximization. By evaluating token recovery of $\textit{training}$ and $\textit{test}$ examples, we identify in UDDMs a sharp memorization-to-generalization transition governed by the size of the training dataset: as it increases, basins around training examples shrink and basins around unseen test examples expand, until both later converge to the same level. Crucially, we can detect this transition using only the conditional entropy of predicted token sequences: memorization is characterized by vanishing conditional entropy, while in the generalization regime the conditional entropy of most tokens remains finite. Thus, conditional entropy offers a practical probe for the memorization-to-generalization transition in deployed models.",https://arxiv.org/pdf/2604.26841v1,,False
Accelerating RL Post-Training Rollouts via System-Integrated Speculative Decoding,29/04/2026,"Hayate Iso, Tiyasa Mitra, Sudipta Mondal, Rasoul Shafipour, Venmugil Elango, Terry Kong, Yuki Huang, Seonjin Na, Izzy Putterman, Benjamin Chislett, Maor Ashkenazi, Joseph Guman, Gerald Shen, Tugrul Konuk, Ashwath Aithal, Ritika Borkar, Ran Zilberstein, Bita Rouhani","RL post-training of frontier language models is increasingly bottlenecked by autoregressive rollout generation, making rollout acceleration a central systems challenge. Many existing efficiency methods improve throughput by changing the rollout or optimization regime, for example, through off-policy execution, replay, or lower-precision generation. We study speculative decoding as a lossless acceleration primitive for RL rollouts that preserves the target model's output distribution. We implement speculative decoding in NeMo-RL with a vLLM backend, supporting both synchronous and asynchronous pipelines and enabling speculation during RL rollouts. This benefit is realizable across speculation mechanisms, such as pretrained MTP heads, small external draft models or even techniques such as Eagle3, which are traditionally applied after RL phase. This yields a deployment path for state-of-the-art speculative decoding inside RL training. In a reasoning post-training workload at 8B scale under synchronous RL, speculative decoding improves rollout throughput by 1.8x. Using a high-fidelity performance simulator, we project that combining speculative decoding with asynchronous RL yields up to 2.5x end-to-end training speedup at 235B scale.",https://arxiv.org/pdf/2604.26779v1,,False
Exploring the Potential of Probabilistic Transformer for Time Series Modeling: A Report on the ST-PT Framework,29/04/2026,"Zhangzhi Xiong, Haoyi Wu, You Wu, Shuqi Gu, Kan Ren, Kewei Tu","The Probabilistic Transformer (PT) establishes that the Transformer's self-attention plus its feed-forward block is mathematically equivalent to Mean-Field Variational Inference (MFVI) on a Conditional Random Field (CRF). Under this equivalence the Transformer ceases to be a black-box neural network and becomes a programmable factor graph: graph topology, factor potentials, and the message-passing schedule are all explicit and inspectable primitives that can be engineered. PT was originally developed for natural language and in this report we investigate its potential for time series. We first lift PT into the Spatial-Temporal Probabilistic Transformer (ST-PT) to repair PT's missing channel axis and weak per-step semantics, and adopt ST-PT as a shared cornerstone backbone. We then identify three distinct properties that PT/ST-PT offers as a factor-graph model and derive three Research Questions, one per property, that probe how each property can be exploited in time series: RQ1. The graph topology and potentials are direct programmable primitives. Can this be used to inject symbolic time-series priors into ST-PT through structural graph modifications, especially under data scarcity and noise? RQ2. The CRF's factor matrices are the operator's potentials. Can an external condition program these factor matrices on a per-sample basis, so that conditional generation becomes structural rather than feature-level modulation of a fixed one? RQ3. Each MFVI iteration is a Bayesian posterior update on the factor graph. Can this turn the latent transition of latent-space AutoRegressive (AR) forecasting from an opaque MLP into a principled posterior update, and can a CRF teacher distill its latents into the AR student to counter cumulative error? We give one empirical study per question. Together, these three studies position ST-PT as a programmable framework for time-series modeling.",https://arxiv.org/pdf/2604.26762v1,,False
Unified 4D World Action Modeling from Video Priors with Asynchronous Denoising,29/04/2026,"Jun Guo, Qiwei Li, Peiyan Li, Zilong Chen, Nan Sun, Yifei Su, Heyun Wang, Yuan Zhang, Xinghang Li, Huaping Liu","We propose X-WAM, a Unified 4D World Model that unifies real-time robotic action execution and high-fidelity 4D world synthesis (video + 3D reconstruction) in a single framework, addressing the critical limitations of prior unified world models (e.g., UWM) that only model 2D pixel-space and fail to balance action efficiency and world modeling quality. To leverage the strong visual priors of pretrained video diffusion models, X-WAM imagines the future world by predicting multi-view RGB-D videos, and obtains spatial information efficiently through a lightweight structural adaptation: replicating the final few blocks of the pretrained Diffusion Transformer into a dedicated depth prediction branch for the reconstruction of future spatial information. Moreover, we propose Asynchronous Noise Sampling (ANS) to jointly optimize generation quality and action decoding efficiency. ANS applies a specialized asynchronous denoising schedule during inference, which rapidly decodes actions with fewer steps to enable efficient real-time execution, while dedicating the full sequence of steps to generate high-fidelity video. Rather than entirely decoupling the timesteps during training, ANS samples from their joint distribution to align with the inference distribution. Pretrained on over 5,800 hours of robotic data, X-WAM achieves 79.2% and 90.7% average success rate on RoboCasa and RoboTwin 2.0 benchmarks, while producing high-fidelity 4D reconstruction and generation surpassing existing methods in both visual and geometric metrics.",https://arxiv.org/pdf/2604.26694v1,,False
SciHorizon-DataEVA: An Agentic System for AI-Readiness Evaluation of Heterogeneous Scientific Data,29/04/2026,"Dianyu Liu, Chuan Qin, Xi Chen, Xiaohan Li, Wenxi Xu, Yuyang Wang, Xin Chen, Yuanchun Zhou, Hengshu Zhu","AI-for-Science (AI4Science) is increasingly transforming scientific discovery by embedding machine learning models into prediction, simulation, and hypothesis generation workflows across domains. However, the effectiveness of these models is fundamentally constrained by the AI-readiness of scientific data, for which no scalable and systematic evaluation mechanism currently exists. In this work, we propose SciHorizon-DataEVA, a novel agentic system to scalable AI-readiness evaluation of heterogeneous scientific data. At the evaluation-criteria level, we introduce the Sci-TQA2 principles, which organize AI-readiness into four complementary dimensions: Governance Trustworthiness, Data Quality, AI Compatibility, and Scientific Adaptability. Each dimension is decomposed into measurable atomic elements that enable fine-grained and executable assessment. To operationalize these principles at scale, we develop Sci-TQA2-Eval, a hierarchical multi-agent evaluation approach orchestrated through a directed, cyclic workflow. Our Sci-TQA2-Eval dynamically constructs dataset-aware evaluation specifications by combining lightweight dataset profiling, applicability-aware metric activation, and knowledge-augmented planning grounded in domain constraints and dataset-paper signals. These specifications are executed through an adaptive, tool-centric evaluation mechanism with built-in verification and self-correction, enabling scalable and reliable assessment across heterogeneous scientific data. Extensive experiments on scientific datasets spanning multiple domains demonstrate the effectiveness and generality of SciHorizon-DataEVA for principled AI-readiness evaluation.",https://arxiv.org/pdf/2604.26645v1,,False
Preserving Disagreement: Architectural Heterogeneity and Coherence Validation in Multi-Agent Policy Simulation,29/04/2026,Ariel Sela,"Multi-agent deliberation systems using large language models (LLMs) are increasingly proposed for policy simulation, yet they suffer from artificial consensus: evaluator agents converge on the same option regardless of their assigned value perspectives. We present the AI Council, a three-phase deliberation framework, and conduct 120 deliberations across two policy scenarios to test two interventions. First, architectural heterogeneity (assigning a different 7-9B parameter model to each value perspective) significantly reduces first-choice concentration compared to a homogeneous baseline (child welfare: 70.9% to 46.1%, p < 0.001, r = 0.58; housing: 46.0% to 22.9%, p < 0.001, r = 0.50). This contrasts with accuracy-oriented multi-agent debate, where heterogeneity does not reduce convergence, suggesting model diversity operates differently when no objectively correct answer exists. Second, coherence validation (using a frontier model to assess whether each evaluator's reasoning is grounded in its assigned values) reveals a fidelity-diversity tradeoff: on a scenario with a dominant option, it further reduces concentration (46.1% to 40.8%, p = 0.004), but on a scenario with genuinely competitive options, it increases concentration (22.9% to 26.6%, p = 0.96) by amplifying high-coherence evaluators who cluster on one option. This tradeoff may be a general property of multi-agent systems employing quality weighting. We report negative results from three failed Delphi designs, demonstrate that 8B models exhibit binary rather than graded responses to counter-arguments, and propose the trustworthy tension rate as a diagnostic measure of small-model deliberation capabilities.",https://arxiv.org/pdf/2604.26561v1,,False
Deep-testing: the case of dependence detection,29/04/2026,"Gery Geenens, Pierre Lafaye de Micheaux, Ivan Muyun Zou","Deep learning methods have proved highly effective for classification and image recognition problems. In this paper, we ask whether this success can be transferred to hypothesis testing: if a neural network can distinguish, for example, an image of a handwritten digit from another, can it also distinguish an ""image of a sample"" (such as a scatter plot) generated under a given statistical model from one generated outside that model? Motivated by this idea, we propose a novel procedure called deep-testing, which approaches the classical inferential problem of hypothesis testing through deep learning. More specifically, the test statistic is a classification map learned by a deep neural network from simulated data satisfying the null and alternative hypotheses, leveraging its strong discriminating power to construct a highly powerful test. As a proof of concept, we apply deep-testing to the problem of independence testing, arguably one of the most important problems in statistics. In a large-scale simulation study, deep-testing achieves the highest overall power against nineteen competing methods across a broad range of complex dependence structures, confirming the viability of the proposed approach.",https://arxiv.org/pdf/2604.26558v1,,False
TLPO: Token-Level Policy Optimization for Mitigating Language Confusion in Large Language Models,29/04/2026,"Jinho Choo, JunSeung Lee, Jimyeong Kim, Yeeho Song, S. K. Hong, Yeong-Dae Kwon","Large language models (LLMs) demonstrate strong multilingual capabilities, yet often fail to consistently generate responses in the intended language, exhibiting a phenomenon known as language confusion. Prior mitigation approaches based on sequence-level fine-tuning, such as DPO, ORPO, and GRPO, operate at the level of entire responses and can lead to unintended degradation of general model capabilities, motivating the need for more fine-grained alternatives. To address this, we introduce Token-Level Policy Optimization (TLPO), a fine-tuning framework designed to mitigate language confusion through localized, token-level updates. TLPO identifies error-prone positions, explores alternative candidate tokens, and updates the policy using a tailored objective to suppress error-inducing outputs at a granular level. This selective intervention enables effective mitigation of language confusion without compromising the model's general abilities. Experiments on multiple multilingual LLMs across diverse languages demonstrate that TLPO significantly outperforms baselines in improving language consistency while preserving downstream task accuracy.",https://arxiv.org/pdf/2604.26553v1,,False
AGEL-Comp: A Neuro-Symbolic Framework for Compositional Generalization in Interactive Agents,29/04/2026,"Mahnoor Shahid, Hannes Rothe","Large Language Model (LLM)-based agents exhibit systemic failures in compositional generalization, limiting their robustness in interactive environments. This work introduces AGEL-Comp, a neuro-symbolic AI agent architecture designed to address this challenge by grounding actions of the agent. AGEL-Comp integrates three core innovations: (1) a dynamic Causal Program Graph (CPG) as a world model, representing procedural and causal knowledge as a directed hypergraph; (2) an Inductive Logic Programming (ILP) engine that synthesizes new Horn clauses from experiential feedback, grounding symbolic knowledge through interaction; and (3) a hybrid reasoning core where an LLM proposes a set of candidate sub-goals that are verified for logical consistency by a Neural Theorem Prover (NTP). Together, these components operationalize a deduction--abduction learning cycle: enabling the agent to deduce plans and abductively expand its symbolic world model, while a neural adaptation phase keeps its reasoning engine aligned with new knowledge. We propose an evaluation protocol within the \texttt{Retro Quest} simulation environment to probe for compositional generalization scenarios to evaluate our AGEL agent. Our findings clearly indicate the better performance of our AGEL model over pure LLM-based models. Our framework presents a principled path toward agents that build an explicit, interpretable, and compositionally structured understanding of their world.",https://arxiv.org/pdf/2604.26522v1,,False
Do Larger Models Really Win in Drug Discovery? A Benchmark Assessment of Model Scaling in AI-Driven Molecular Property and Activity Prediction,29/04/2026,Jinjiang Guo,"The rapid growth of molecular foundation models and general-purpose large language models has encouraged a scale-centric view of artificial intelligence in drug discovery, in which larger pretrained models are expected to supersede compact cheminformatics models and task-specific graph neural networks (GNNs). We test this assumption on 22 molecular property and activity endpoints, including public ADMET and Tox21 benchmarks and two internal anti-infective activity datasets. Across 167,056 held-out task--molecule evaluations under structure-similarity-separated five-fold cross-validation (37,756 ADMET, 77,946 Tox21, 49,266 anti-TB and 2,088 antimalaria), classical machine-learning (ML) models such as RF(ECFP4) and ExtraTrees(RDKit descriptors) win ten primary-metric tasks, GNNs such as GIN and Ligandformer win nine, and pretrained molecular sequence models such as MoLFormer and ChemBERTa2 win three. Rule-based SAR reasoning baselines, represented by GPT5.5-SAR and Opus4.7-SAR, do not win under the prespecified primary metrics, although train-fold-derived SAR knowledge provides measurable but uneven gains for SAR reasoning and interpretation. These results indicate that compact, specialized models remain highly effective for molecular property and activity prediction. The performance differences among classical ML, GNN and pretrained sequence models are often modest and endpoint-dependent, whereas larger or more general models do not provide a universal predictive advantage. Large models may still add value for zero-shot reasoning, SAR interpretation and hypothesis generation, but the results suggest that predictive performance depends on the alignment among molecular representation, inductive bias, data regime, endpoint biology and validation protocol.",https://arxiv.org/pdf/2604.26498v1,,False
Quantum Gatekeeper: Multi-Factor Context-Bound Image Steganography with VQC Based Key Derivation on Quantum Hardware,29/04/2026,"Sahil Tomar, Sandeep Kumar","This paper presents Quantum Gatekeeper, a context-bound image steganography framework where successful payload recovery depends on both cryptographic decryption and the reconstruction of a precise extraction path. The system integrates lossless least significant bit (LSB) embedding with a deterministic variational quantum circuit (VQC)-derived gate key, multi-factor contextual binding, and authenticated encryption. Payload extraction is contingent upon four requisite factors: a password, a shared secret, a user-supplied context string, and a reference image signature. Any deviation in these factors causes the system to read from an incorrect pixel sequence or fail authentication, resulting in silent rejection rather than partial disclosure. The proposed method derives a gatecontrolled extraction key from a seed-conditioned variational circuit, with parameters generated via cryptographic hash expansion and context-dependent image features. To ensure encode/decode consistency, the cryptographic key path is generated via exact statevector simulation; concurrently, IBM superconducting quantum hardware is utilized to evaluate the statistical behavior of the circuit family under physical noise. We introduce a dual-region image layout to resolve the nonce bootstrapping dependency, separating header recovery from payload recovery through independently derived keys. Experimental results confirm successful end-to-end message embedding and recovery on PNG images, demonstrating deterministic success under correct conditions and failure otherwise. The framework supports both text and image payloads; in the image-in-image configuration, a secret image is resized to a fixed resolution prior to embedding, enabling exact pixel-level recovery under correct contextual reconstruction.",https://arxiv.org/pdf/2604.26413v1,,False
Asymptotically Robust Learning-Augmented Algorithms for Preemptive FIFO Buffer Management,29/04/2026,"Wen-Han Hsieh, Ya-Chun Liang","We present a learning-augmented online algorithm for the preemptive FIFO buffer management problem, where packets arrive online to a finite-capacity buffer, must be transmitted in FIFO order, and the algorithm may preemptively discard buffered packets to accommodate future arrivals. Our algorithm simultaneously achieves 1-consistency, η-smoothness, and asymptotic \sqrt{3}-robustness, where ηdenotes the prediction error. Specifically, it attains an optimal competitive ratio of 1 under perfect predictions, degrades smoothly as the prediction error increases, and maintains an asymptotic competitive ratio of \sqrt{3} under arbitrarily inaccurate predictions, matching the best-known worst-case guarantee for the classical online problem, established by Englert and Westermann in 2009 [Algorithmica 53(4): 523-548].
  A key technical contribution of our work is the introduction of an \emph{output-based prediction error metric}. Because capacity constraints dictate that only a strictly bounded subset of arriving packets is ultimately transmitted, our metric assesses prediction quality over the resulting optimal schedules rather than the raw input sequences, avoiding artificial error penalties. To guarantee robustness, our algorithm dynamically monitors predictions and executes a \emph{buffer-clearing strategy} upon transitioning to a worst-case fallback mechanism. We prove that the competitive loss incurred by this clearing operation is bounded by an additive capacity constant that vanishes asymptotically. Finally, we show that our algorithm provides a generalized framework for learning-augmented buffer management: substituting the fallback module with any β-competitive online algorithm immediately yields asymptotic β-robustness.",https://arxiv.org/pdf/2604.26349v1,,False
AlphaJet: Automated Conceptual Aircraft Synthesis via Disentangled Generative Priors and Topology-Preserving Evolutionary Search,29/04/2026,Boris Kriuk,"Conceptual aircraft design is traditionally an expert-mediated iterative process in which a human designer proposes a configuration, runs low-order physics, inspects the result, and re-proposes. We present AlphaJet, an end-to-end automated synthesis pipeline that closes this loop. From a textual mission specification (mass, range, cruise speed, hard size envelope, engine count, areal density) AlphaJet evolves a feasible 3D aircraft in real time, scored by a transparent multi-disciplinary fitness function covering aerodynamics, structures, weights, stability, packaging, and geometric mount consistency. Three contributions distinguish our approach: (i) an Anatomically-Disentangled Variational Autoencoder (AD-VAE) whose first 25 latent dimensions are supervised to align with named anatomical parameters, providing an interpretable shape prior; (ii) a topology-elitist genetic algorithm that protects the best individual from each of five tail topologies and triggers stagnation restarts, preventing premature collapse to a single configuration; and (iii) mount-aware geometric scoring that computes signed penetration between engines and other structural parts, eliminating the redundant artifacts common in generative aircraft models. The full loop runs interactively on a CPU and streams every generation to a browser viewer, making it a practical real-world automation tool for early-phase design-space exploration.",https://arxiv.org/pdf/2604.26337v1,,False
