Title,Publication Date,Author(s),Abstract,Link,DOI,Relevant
Spontaneous symmetry breaking and Goldstone modes for deep information propagation,14/05/2026,"Nabil Iqbal, T. Anderson Keller, Yue Song, Takeru Miyato, Max Welling","In physical systems, whenever a continuous symmetry is spontaneously broken, the system possesses excitations called Goldstone modes, which allow coherent information propagation over long distances and times. In this work, we study deep neural networks whose internal layers are equivariant under a continuous symmetry and may therefore support analogous Goldstone-like degrees of freedom. We demonstrate, both analytically and empirically, that these degrees of freedom enable coherent signal propagation across depth and recurrent iterations, providing a mechanism for stable information flow without relying on architectural stabilizers such as residual connections or normalization. In feedforward networks, this results in improved trainability and representational diversity across layers. In recurrent settings, we demonstrate the same mechanism is valuable for long-term memory by propagating information over recurrent iterations, thereby improving performance of RNNs and GRUs on long-sequence modeling tasks.",https://arxiv.org/pdf/2605.14685v1,,False
Scalable Solution of the Stochastic Multi-path Traveling Salesman Problem via Neural Networks,14/05/2026,"Xiaochen Chou, Ludovica Di Marco, Enza Messina","The multi-path Traveling Salesman Problem with stochastic travel costs arises in hybrid vehicle routing applications designed for Smart City and City Logistics, where multiple paths exist between each pair of locations. Travel times along these paths are typically affected by real-time traffic conditions and therefore modeled as stochastic. The objective of the problem is to determine a Hamiltonian tour that minimizes the expected total travel cost under uncertainty. In this work, we adopt a two-stage stochastic programming formulation. In the first stage, a predefined route specifying the sequence of locations to be visited is determined, while taking into consideration a second-stage recourse problem that selects the optimal path from the feasible set of alternative paths for each pair of locations, once real-time traffic conditions are realized. To reduce the computational burden imposed by the large number of scenarios required to capture travel time uncertainty, the innovation of this work is the integration of neural network-based surrogate models to approximate the expected value of the second-stage recourse problem. Different architectures and training strategies for the neural networks are proposed and analyzed, with performance evaluated in terms of computation time, solution quality, and generalization capability. Preliminary findings demonstrate the enhanced scalability and practical applicability of the approach for complex vehicle routing problems under uncertainty.",https://arxiv.org/pdf/2605.14662v1,,False
Asymmetric Generative Recommendation via Multi-Expert Projection and Multi-Faceted Hierarchical Quantization,14/05/2026,"Bin Huang, Xin Wang, Junwei Pan, Yongqi Zhou, Yifeng Zhou, Zhixiang Feng, Shudong Huang, Haijie Gu, Wenwu Zhu","Generative Recommendation (GenRec) models reformulate recommendation as a sequence generation task, representing items as discrete Semantic IDs used symmetrically as both inputs and prediction targets. We identify a critical dual-stage information bottleneck in this design: (1) the Input Bottleneck, where lossy quantization degrades fine-grained semantics, while popularity bias skews the learned representations toward frequent items, and (2) the Output Bottleneck, where imprecise discrete targets limit supervision quality. To address these issues, we propose AsymRec, an asymmetric continuous-discrete framework that decouples input and output representations. Specifically, Multi-expert Semantic Projection (MSP) maps continuous embeddings into the Transformer's hidden space via expert-specialized projections, preserving semantic richness and improving generalization to infrequent items. Multi-faceted Hierarchical Quantization (MHQ) constructs high-capacity, structured discrete targets through multi-view and multi-level quantization with semantic regularization, preventing dimensional collapse while retaining fine-grained distinctions. Extensive experiments demonstrate that AsymRec consistently outperforms state-of-the-art generative recommenders by an average of 15.8 %. The code will be released.",https://arxiv.org/pdf/2605.14512v1,,False
What if Tomorrow is the World Cup Final? Counterfactual Time Series Forecasting with Textual Conditions,14/05/2026,"Shuqi Gu, Yongxiang Zhao, Baoyu Jing, Kan Ren","Time series forecasting has become increasingly critical in real-world scenarios, where future sequences are influenced not only by historical patterns but also by forthcoming events. In this context, forecasting must dynamically adapt to complex and stochastic future conditions, which introduces fundamental challenges in both forecasting and evaluation. Traditional methods typically rely on historical data or factual future conditions, while overlooking counterfactual scenarios. Furthermore, many existing approaches are restricted to simple structured conditions, limiting their ability to generalize to the real-world complexities. To address these gaps, we introduce the task of counterfactual time series forecasting with textual conditions, enabling more flexible and condition-aware forecasting. We propose a comprehensive evaluation framework that encompasses both factual and counterfactual settings, even in the absence of ground truth time series. Additionally, we present a novel text-attribution mechanism that distinguishes mutable from immutable factors, thereby improving forecast accuracy under sophisticated and stochastic textual conditions. The project page is at https://seqml.github.io/TADiff/",https://arxiv.org/pdf/2605.14422v1,,False
Coding Agent Is Good As World Simulator,14/05/2026,"Hongyu Wang, Jingquan Wang, Bocheng Zou, Radu Serban, Dan Negrut","World models have emerged as a powerful paradigm for building interactive simulation environments, with recent video-based approaches demonstrating impressive progress in generating visually plausible dynamics. However, because these models typically infer dynamics from video and represent them in latent states, they do not explicitly enforce physical constraints. As a result, the generated video rollouts are not physically plausible, exhibiting unstable contacts, distorted shapes, or inconsistent motion. In this paper, we present an agentic framework constructing physics-based world models through executable simulation code. The framework coordinates planning, code generation, visual review, and physics analysis agents. The planning agent converts the natural language prompt into a structured scene plan, the code agent implements it as executable simulation code, and the visual review agent provide visual feedback while the physics analysis agent checks physical consistency. The code is iteratively revised based on the feedback until the simulation matches the prompt reqirements and physical constraints. Experimental results show that our framework outperforms advanced video-based models in physical accuracy, instruction fidelity and visual quality, which could be applied to various scenarios including driving simulation and embodied robot tasks.",https://arxiv.org/pdf/2605.14398v1,,False
Nexus : An Agentic Framework for Time Series Forecasting,14/05/2026,"Sarkar Snigdha Sarathi Das, Palash Goyal, Mihir Parmar, Nanyun Peng, Vishy Tirumalashetty, Chun-Liang Li, Rui Zhang, Jinsung Yoon, Tomas Pfister","Time series forecasting is not just numerical extrapolation, but often requires reasoning with unstructured contextual data such as news or events. While specialized Time Series Foundation Models (TSFMs) excel at forecasting based on numerical patterns, they remain unaware to real-world textual signals. Conversely, while LLMs are emerging as zero-shot forecasters, their performance remains uneven across domains and contextual grounding. To bridge this gap, we introduce Nexus, a multi-agent forecasting framework that decomposes prediction into specialized stages: isolating macro-level and micro-level temporal fluctuations, and integrating contextual information when available before synthesizing a final forecast. This decomposition enables Nexus to adapt from seasonal signals to volatile, event-driven information without relying on external statistical anchors or monolithic prompting. We show that current-generation LLMs possess substantially stronger intrinsic forecasting ability than previously recognized, depending critically on how numerical and contextual reasoning are organized. Evaluated on data strictly succeeding LLM knowledge cutoffs spanning Zillow real estate metrics and volatile stock market equities, Nexus consistently matches or outperforms state-of-the-art TSFMs and strong LLM baselines. Beyond numerical accuracy, Nexus produces high-quality reasoning traces that explicitly show the fundamental drivers behind each forecast. Our results establish that real-world forecasting is an agentic reasoning problem extending well beyond only sequence modeling.",https://arxiv.org/pdf/2605.14389v1,,False
Analog RF Computing: A New Paradigm for Energy-Efficient Edge AI Over MU-MIMO Systems,14/05/2026,"Wentao Yu, Vincent W. S. Wong","Modern edge devices increasingly rely on neural networks for intelligent applications. However, conventional digital computing-based edge inference requires substantial memory and energy consumption. In analog radio frequency (RF) computing, a base station (BS) encodes the weights of the neural networks and broadcasts the RF waveforms to the clients. Each client reuses its passive mixer to multiply the received weight-encoded waveform with a locally generated input-encoded waveform. This enables wireless receivers to perform the matrix-vector multiplications (MVMs) that account for most of the computation burden in edge inference with ultra-low energy consumption. Unlike conventional downlink transmissions which are optimized for communications, analog RF computing requires a computing-centric physical layer that controls both the analog MVM accuracy and the energy consumption for inference. Motivated by this, in this paper, we propose a physical layer design framework for analog RF computing in MU-MIMO wireless systems. We derive tractable models for computing accuracy and energy consumption for inference, formulate a joint BS beamforming and client-side scaling problem subject to computing accuracy, transmit power, and hardware constraints, and develop a low-complexity algorithm to solve the non-convex problem. The proposed design provides client- and layer-specific accuracy control for both uniform- and mixed-precision inference. Simulations under 3GPP specifications show that analog RF computing can significantly reduce client-side energy consumption by nearly two orders of magnitude compared to digital computing, while mixed-precision inference requires even lower energy consumption than uniform-precision inference. Overall, these results establish analog RF computing over wireless networks as a promising paradigm for energy-efficient edge inference.",https://arxiv.org/pdf/2605.14331v1,,False
PhyMotion: Structured 3D Motion Reward for Physics-Grounded Human Video Generation,14/05/2026,"Yidong Huang, Zun Wang, Han Lin, Dong-Ki Kim, Shayegan Omidshafiei, Jaehong Yoon, Jaemin Cho, Yue Zhang, Mohit Bansal","Generating realistic human motion is a central yet unsolved challenge in video generation. While reinforcement learning (RL)-based post-training has driven recent gains in general video quality, extending it to human motion remains bottlenecked by a reward signal that cannot reliably score motion realism. Existing video rewards primarily rely on 2D perceptual signals, without explicitly modeling the 3D body state, contact, and dynamics underlying articulated human motion, and often assign high scores to videos with floating bodies or physically implausible movements. To address this, we propose PhyMotion, a structured, fine-grained motion reward that grounds recovered 3D human trajectories in a physics simulator and evaluates motion quality along multiple dimensions of physical feasibility. Concretely, we recover SMPL body meshes from generated videos, retarget them onto a humanoid in the MuJoCo physics simulator, and evaluate the resulting motion along three axes: kinematic plausibility, contact and balance consistency, and dynamic feasibility. Each component provides a continuous and interpretable signal tied to a specific aspect of motion quality, allowing the reward to capture which aspects of motion are physically correct or violated. Experiments show that PhyMotion achieves stronger correlation with human judgments than existing reward formulations. These gains carry over to RL-based post-training, where optimizing PhyMotion leads to larger and more consistent improvements than optimizing existing rewards, improving motion realism across both autoregressive and bidirectional video generators under both automatic metrics and blind human evaluation (+68 Elo gain). Ablations show that the three axes provide complementary supervision signals, while the reward preserves overall video generation quality with only modest training overhead.",https://arxiv.org/pdf/2605.14269v1,,False
A3D: Agentic AI flow for autonomous Accelerator Design,14/05/2026,"Abinand Nallathambi, Christopher Knight, Shantanu Ganguly, Wilfried Haensch, Anand Raghunathan","Accelerating applications through the design of hardware accelerators can significantly enhance system performance and energy efficiency. Despite advances, such as high-level synthesis (HLS), designing accelerators for complex applications still remains highly labor-intensive, demanding considerable expertise in understanding workloads to be accelerated, hardware design, micro-architecture, and EDA tool usage, posing challenges for application domain experts. Therefore, most accelerator solutions are limited to applications with a regular predictable dataflow. Advances in AI have enabled agents that perform autonomous planning, reasoning, execution and reflection, leading to unprecedented potential for automation through agentic AI. We present A3D, an Agentic AI flow for end-to-end Automation of hardware Accelerator Design. A3D automates workload analysis, performance bottleneck identification, code refactoring for HLS compatibility and micro-architecture generation. A3D also generates diverse accelerator designs by automatically exploring the speed-area tradeoff space. Recent efforts have explored the use of AI for specific tasks such as design space exploration in HLS, leaving several tasks to still be performed manually. A3D addresses the challenges in applying modern LLMs to accelerator design by judiciously partitioning tasks among specialist agents, orchestrating process loops with specialist and verifier agents, utilizing pre-existing and custom tools, and employing agentic RAG for codebase and proprietary EDA tool documentation exploration. Our implementation of A3D, using commercial components like Claude Sonnet 4.5 and the Catapult HLS tool, demonstrates its effectiveness by generating accelerator designs with no human intervention from complex scientific applications like LAMMPS (molecular dynamics simulation) and QMCPACK (quantum chemistry).",https://arxiv.org/pdf/2605.15237v1,,False
Diagnosing Training Inference Mismatch in LLM Reinforcement Learning,14/05/2026,"Tianle Zhong, Neiwen Ling, Yifan Pi, Zijun Wei, Tianshu Yu, Geoffrey Fox, Peng Wu, Xiao Yu","Modern LLM RL systems separate rollout generation from policy optimization. These two stages are expected to produce token probabilities that match exactly. However, implementation differences can make them assign different values to the same sequence under the same model weights, inducing Training-Inference Mismatch (TIM). TIM is difficult to inspect because it is entangled with off-policy drift and common stabilization mechanisms. In this work, we isolate TIM in a zero-mismatch diagnostic setting (VeXact), and show that small token-level numerical disagreements can independently cause training collapse. We further show that TIM changes the effective optimization problem, and identify a set of remedies that could mitigate TIM. Our results suggest that TIM is not benign numerical noise, but a systems-level perturbation that should be treated as a first-order factor in analyzing LLM RL stability.",https://arxiv.org/pdf/2605.14220v1,,False
SimPersona: Learning Discrete Buyer Personas from Raw Clickstreams for Grounded E-Commerce Agents,14/05/2026,"Zahra Zanjani Foumani, Alberto Castelo, Shuang Xie, Ted Chaiwachirasak, Han Li, Lingyun Wang","LLM-based web agents can navigate live storefronts, yet they often collapse to a single ""average buyer"" policy, failing to capture the heterogeneous and distributional nature of real buyer populations. Existing personalization methods rely on hand-crafted prompt-based personas that are brittle, difficult to scale, context-inefficient, and unable to faithfully represent population-level behavior. We introduce SimPersona, a novel framework that learns discrete buyer types from historical traffic and exposes them to LLM-based web agents as compact persona tokens. Given raw clickstreams, a behavior-aware VQ-VAE induces a discrete buyer-type space that captures the statistical structure of real buyer behavior and merchant-specific buyer population distributions. To provide behavior-specific guidance to LLM-based web agents, SimPersona maps each learned buyer type to a dedicated persona token in the LLM agent vocabulary and fine-tunes the agent with these tokens on real browsing traces. At inference, each synthetic buyer is assigned to a learned buyer type with a single encoder forward pass, requiring no retraining or store-specific prompt engineering. For population-level simulation, SimPersona samples buyer types from each merchant's empirical distribution over the learned VQ-VAE codebook and instantiates agents with the corresponding persona tokens, preserving merchant-specific buyer population distributions. Evaluated on $8.37$M buyers across $42$ held-out live storefronts, SimPersona achieves $78\%$ conversion-rate alignment with real buyers, exhibits interpretable behavioral variation across buyer types, and outperforms a baseline with $8\times$ more parameters on goal-oriented shopping tasks. We further release an open-source data pipeline that converts raw e-commerce event logs into buyer representations and agent-training traces.",https://arxiv.org/pdf/2605.14205v2,,False
Thinking Ahead: Prospection-Guided Retrieval of Memory with Language Models,13/05/2026,"Harshita Chopra, Krishna Kant Chintalapudi, Suman Nath, Ryen W. White, Chirag Shah","Long-horizon personalization requires dialogue assistants to retrieve user-specific facts from extended interaction histories. In practice, many relevant facts often have low semanticsimilarity to the query under dense retrieval. Standard Retrieval-Augmented Generation (RAG) and GraphRAG systems are still largely retrospective: they rely on embedding similarity to the query or on fixed graph traversals, so they often miss facts that matter for the user's needs but lie far from the query in embedding space. Inspired by prospection, the human ability to use imagined futures as cues for recall, we introduce Prospection-Guided Retrieval (PGR), which decouples retrieval from how memories are stored. Given a user query, PGR first expands the goal into a short Tree-of-Thought (ToT) or linear chain of plausible next steps, and uses these steps as retrieval probes rather than relying on the original query alone. The facts retrieved by these probes are then used to personalize the next round of prospection, enabling PGR to uncover additional memories that become relevant only after the simulation is grounded in the user's history. We also introduce MemoryQuest, a challenging multi-session benchmark in which each query is annotated with 3--5 dated reference facts subject to a low query-reference similarity constraint. Across 1,625 queries spanning 185 user profiles from 3 publicly available datasets, PGR-TOT substantially improves retrieval, including nearly 3x recall on MemoryQuest over the strongest baseline. In pairwise LLM-as-judge comparisons against baselines, PGR-generated responses are preferred on 89--98% of queries, with blinded human annotations on held-out subsets showing the same trend. Overall, the results demonstrate that explicit prospection yields large gains in long-horizon retrieval and response quality relative to similarity-only baselines.",https://arxiv.org/pdf/2605.14177v1,,False
Learning Selective Merge Policies for Deadline-Constrained Coded Caching via Deep Reinforcement Learning,13/05/2026,Amirhossein Yousefiramandi,"With the coded caching, the server can use the information the users have cached to serve multiple users at a time by sending a single coded multi-casting message, i.e., the merged message, thereby relieving the peak network loads. However, for the delay-sensitive applications of the users, like the video streaming services, it becomes essential to choose which messages to merge online, considering the strict deadlines for each request. The problem, however, is that while the merge is helpful for the formation of the current coded multi-casting message, it can be harmful for the subsequent ones. We proposed a DRL-based solution that formulates the deadline-constrained coded delivery as a masked discrete-action queue-state control problem, while we trained a graph-attention policy network via proximal policy optimization. The policy network reduces the broadcast-packet expiration ratio $ρ$ by $40.9%$ ($0.208$ vs. $0.352$) with respect to the best coded multi-casting baseline (SACM++) on the uniform-demand benchmark, while also attaining the best broadcast-efficiency score $σ$ across the Track A battery among the coded multi-casting methods. The interesting fact we observed is that for the applications of the users with tight deadlines, the method of selective merging is better than the method of aggressive merging, i.e., the policy network learns to merge at only $\approx 31.8%$ rate, even though the same observation holds across the variations within the same simulator family.",https://arxiv.org/pdf/2605.15236v1,,False
Uncovering Trajectory and Topological Signatures in Multimodal Pediatric Sleep Embeddings,13/05/2026,"Scott Ye, Harlin Lee","While generative models have shown promise in pediatric sleep analysis, the latent structure of their multimodal embeddings remains poorly understood. This work investigates session-wide diagnostic information contained in the sequences of 30-second pediatric PSG epochs embedded by a multimodal masked autoencoder. We test whether augmenting embeddings with PHATE-derived per-epoch coordinates and whole-night movement descriptors, persistent homology summaries of the embedding cloud, and EHR yields task-relevant signals. Simple linear and MLP models, chosen for interpretability rather than state-of-the-art performance, show that geometric, topological, and clinical features each provide complementary gains. For binary predictions, feature importance is task-dependent, and more expressive late-fusion models generally perform better, with AUPRC improving from 0.26 to 0.34 for desaturation, 0.31 to 0.48 for EEG arousal, 0.09 to 0.22 for hypopnea, and 0.05 to 0.14 for apnea. We also report Brier score and Expected Calibration Error, where the full fusion model yields the best calibration across all four binary tasks. Our study reveals that latent geometry/topology and EHR offer complementary, interpretable signals beyond embeddings, improving calibration and robustness under extreme imbalance.",https://arxiv.org/pdf/2605.14156v1,,False
