Title,Publication Date,Author(s),Abstract,Link,DOI,Relevant
TranSimHub:A Unified Air-Ground Simulation Platform for Multi-Modal Perception and Decision-Making,17/10/2025,"Maonan Wang, Yirong Chen, Yuxin Cai, Aoyu Pang, Yuejiao Xie, Zian Ma, Chengcheng Xu, Kemou Jiang, Ding Wang, Laurent Roullet, Chung Shue Chen, Zhiyong Cui, Yuheng Kan, Michael Lepech, Man-On Pun","Air-ground collaborative intelligence is becoming a key approach for
next-generation urban intelligent transportation management, where aerial and
ground systems work together on perception, communication, and decision-making.
However, the lack of a unified multi-modal simulation environment has limited
progress in studying cross-domain perception, coordination under communication
constraints, and joint decision optimization. To address this gap, we present
TranSimHub, a unified simulation platform for air-ground collaborative
intelligence. TranSimHub offers synchronized multi-view rendering across RGB,
depth, and semantic segmentation modalities, ensuring consistent perception
between aerial and ground viewpoints. It also supports information exchange
between the two domains and includes a causal scene editor that enables
controllable scenario creation and counterfactual analysis under diverse
conditions such as different weather, emergency events, and dynamic obstacles.
We release TranSimHub as an open-source platform that supports end-to-end
research on perception, fusion, and control across realistic air and ground
traffic scenes. Our code is available at
https://github.com/Traffic-Alpha/TranSimHub.",http://arxiv.org/pdf/2510.15365v1,,False
GaussGym: An open-source real-to-sim framework for learning locomotion from pixels,17/10/2025,"Alejandro Escontrela, Justin Kerr, Arthur Allshire, Jonas Frey, Rocky Duan, Carmelo Sferrazza, Pieter Abbeel","We present a novel approach for photorealistic robot simulation that
integrates 3D Gaussian Splatting as a drop-in renderer within vectorized
physics simulators such as IsaacGym. This enables unprecedented speed --
exceeding 100,000 steps per second on consumer GPUs -- while maintaining high
visual fidelity, which we showcase across diverse tasks. We additionally
demonstrate its applicability in a sim-to-real robotics setting. Beyond
depth-based sensing, our results highlight how rich visual semantics improve
navigation and decision-making, such as avoiding undesirable regions. We
further showcase the ease of incorporating thousands of environments from
iPhone scans, large-scale scene datasets (e.g., GrandTour, ARKit), and outputs
from generative video models like Veo, enabling rapid creation of realistic
training worlds. This work bridges high-throughput simulation and high-fidelity
perception, advancing scalable and generalizable robot learning. All code and
data will be open-sourced for the community to build upon. Videos, code, and
data available at https://escontrela.me/gauss_gym/.",http://arxiv.org/pdf/2510.15352v1,,False
Singularity-free dynamical invariants-based quantum control,17/10/2025,"Ritik Sareen, Akram Youssry, Alberto Peruzzo","State preparation is a cornerstone of quantum technologies, underpinning
applications in computation, communication, and sensing. Its importance becomes
even more pronounced in non-Markovian open quantum systems, where environmental
memory and model uncertainties pose significant challenges to achieving
high-fidelity control. Invariant-based inverse engineering provides a
principled framework for synthesizing analytic control fields, yet existing
parameterizations often lead to experimentally infeasible, singular pulses and
are limited to simplified noise models such as those of Lindblad form. Here, we
introduce a generalized invariant-based protocol for single-qubit state
preparation under arbitrary noise conditions. The control proceeds in
two-stages: first, we construct a family of bounded pulses that achieve perfect
state preparation in a closed system; second, we identify the optimal member of
this family that minimizes the effect of noise. The framework accommodates both
(i) characterized noise, enabling noise-aware control synthesis, and (ii)
uncharacterized noise, where a noise-agnostic variant preserves robustness
without requiring a master-equation description. Numerical simulations
demonstrate high-fidelity state preparation across diverse targets while
producing smooth, hardware-feasible control fields. This singularity-free
framework extends invariant-based control to realistic open-system regimes,
providing a versatile route toward robust quantum state engineering on NISQ
hardware and other platforms exhibiting non-Markovian dynamics.",http://arxiv.org/pdf/2510.15340v1,,False
Small Ensemble-based Data Assimilation: A Machine Learning-Enhanced Data Assimilation Method with Limited Ensemble Size,17/10/2025,"Zhilin Li, Yao Zhou, Xianglong Li, Zeng Liu, Zhaokuan Lu, Shanlin Xu, Seungnam Kim, Guangyao Wang","Ensemble-based data assimilation (DA) methods have become increasingly
popular due to their inherent ability to address nonlinear dynamic problems.
However, these methods often face a trade-off between analysis accuracy and
computational efficiency, as larger ensemble sizes required for higher accuracy
also lead to greater computational cost. In this study, we propose a novel
machine learning-based data assimilation approach that combines the traditional
ensemble Kalman filter (EnKF) with a fully connected neural network (FCNN).
Specifically, our method uses a relatively small ensemble size to generate
preliminary yet suboptimal analysis states via EnKF. A FCNN is then employed to
learn and predict correction terms for these states, thereby mitigating the
performance degradation induced by the limited ensemble size. We evaluate the
performance of our proposed EnKF-FCNN method through numerical experiments
involving Lorenz systems and nonlinear ocean wave field simulations. The
results consistently demonstrate that the new method achieves higher accuracy
than traditional EnKF with the same ensemble size, while incurring negligible
additional computational cost. Moreover, the EnKF-FCNN method is adaptable to
diverse applications through coupling with different models and the use of
alternative ensemble-based DA methods.",http://arxiv.org/pdf/2510.15284v1,,False
Causal Time Series Modeling of Supraglacial Lake Evolution in Greenland under Distribution Shift,17/10/2025,"Emam Hossain, Muhammad Hasan Ferdous, Devon Dunmire, Aneesh Subramanian, Md Osman Gani","Causal modeling offers a principled foundation for uncovering stable,
invariant relationships in time-series data, thereby improving robustness and
generalization under distribution shifts. Yet its potential is underutilized in
spatiotemporal Earth observation, where models often depend on purely
correlational features that fail to transfer across heterogeneous domains. We
propose RIC-TSC, a regionally-informed causal time-series classification
framework that embeds lag-aware causal discovery directly into sequence
modeling, enabling both predictive accuracy and scientific interpretability.
Using multi-modal satellite and reanalysis data-including Sentinel-1 microwave
backscatter, Sentinel-2 and Landsat-8 optical reflectance, and CARRA
meteorological variables-we leverage Joint PCMCI+ (J-PCMCI+) to identify
region-specific and invariant predictors of supraglacial lake evolution in
Greenland. Causal graphs are estimated globally and per basin, with validated
predictors and their time lags supplied to lightweight classifiers. On a
balanced benchmark of 1000 manually labeled lakes from two contrasting melt
seasons (2018-2019), causal models achieve up to 12.59% higher accuracy than
correlation-based baselines under out-of-distribution evaluation. These results
show that causal discovery is not only a means of feature selection but also a
pathway to generalizable and mechanistically grounded models of dynamic Earth
surface processes.",http://arxiv.org/pdf/2510.15265v1,,False
Planner and Executor: Collaboration between Discrete Diffusion And Autoregressive Models in Reasoning,17/10/2025,"Lina Berrayana, Ahmed Heakl, Muhammad Abdullah Sohail, Thomas Hofmann, Salman Khan, Wei Chen","Current autoregressive language models (ARMs) achieve high accuracy but
require long token sequences, making them costly. Discrete diffusion language
models (DDLMs) enable parallel and flexible generation within a fixed number of
steps and have recently emerged for their strong performance in complex
reasoning and long-term planning tasks. We present a study exploring hybrid
architectures that couple DDLMs with ARMs to assess whether their collaboration
can yield complementary benefits. We first examine collaboration in text space,
where one model plans the reasoning process and another executes the final
answer based on that plan. We then extend this setup to latent-space
communication, introducing a learned projector that maps DDLM latents into the
ARM's embedding space, potentially bypassing some of the text-generation
limitations of diffusion models. We find that shifting DDLM --> ARM
communication from text space to latent space yields significant accuracy
gains, for example increasing from 27.0% to 54.0% on DART-5 and from 0.0% to
14.0% on AIME24. We also find that combining a DDLM planner with an ARM
executor can provide substantial computational savings with little to no impact
on accuracy. For example, the latent-space pipeline, using 64 tokens for
planning and roughly 5 for execution, surpasses Qwen3.1-7B on DART-5 and AIME,
despite Qwen using 44 times more tokens. Overall, our study offers new insights
into reasoning with DDLMs and highlights their potential in hybrid
architectures.",http://arxiv.org/pdf/2510.15244v1,,False
Extending Audio Context for Long-Form Understanding in Large Audio-Language Models,17/10/2025,"Yuatyong Chaichana, Pittawat Taveekitworachai, Warit Sirichotedumrong, Potsawee Manakul, Kunat Pipatanakul","Large Audio-Language Models (LALMs) are often constrained by short audio
context windows, even when their text backbones support long contexts, limiting
long-form audio understanding. Prior work has introduced context-extension
methods (e.g. YaRN) on unimodal LLMs, yet their application to LALMs remains
unexplored. First, building on RoPE-based context extension, we introduce
Partial YaRN, a training-free, audio-only extension method that modifies only
audio token positions, leaving text positions intact to preserve the base LLM's
text capabilities. Second, we propose Virtual Longform Audio Training (VLAT), a
training strategy that extends Partial YaRN into a training-time positional
augmentation. VLAT simulates diverse audio lengths during training, enabling
generalization to inputs far longer than those seen in training and improving
robustness for long-context audio understanding. Our experiments on SALMONN and
Qwen2-Audio show that Partial YaRN outperforms the original models across wide
range of settings, and VLAT training strategy provides substantial improvement,
achieving strong performance on long audio of unseen lengths.",http://arxiv.org/pdf/2510.15231v1,,False
Machine Learning for Early Detection of Meningitis: Stacked Ensemble Learning with EHR data,17/10/2025,"Han Ouyang, Jesse Hamilton, Saeed Amal","We utilized a cohort of 214 meningitis patients and 46,303 non-meningitis
patients from the MIMIC-III database. After extensive data preprocessing, which
included ICD-based cohort selection, one-hot encoding of coding, and a
two-stage feature selection process (for both the training set and the testing
sets), clinically relevant features such as gender and high-risk ICD codes
(including subarachnoid hemorrhage, secondary malignant neoplasm of the brain,
and generalized epilepsy) are selected. Overall, these clinically reasonable
and temporally adherent features provided excellent modeling performance. Three
models (Random Forest, LightGBM, and Deep Neural Networks (DNN) are trained as
base models for Ensemble Learning. Base model outputs are aggregated and
stacked into a meta model (Logistic Regression) that uses the base model
outputs as input values in training. Ultimately, soldier outputs (AUC of
Testing Set 1: 0.9637, AUC of Testing Set 2: 0.9472) are obtained through
ensemble learning.
  We created a challenging condition for diagnosing meningitis, simulating a
real-world ER (Emergency Room) scenario to enhance clinical use in real-world
applications. While directly deploying a diagnostic tool that clinicians can
use is challenging, this paper paves the way for a potential future AI-driven
diagnostic approach for meningitis using Ensemble Learning.",http://arxiv.org/pdf/2510.15218v1,,False
