Title,Publication Date,Author(s),Abstract,Link,DOI,Relevant
Semantic Retrieval Augmented Contrastive Learning for Sequential Recommendation,06/03/2025,"Ziqiang Cui, Yunpeng Weng, Xing Tang, Xiaokun Zhang, Dugang Liu, Shiwei Li, Peiyang Liu, Bowei He, Weihong Luo, Xiuqiang He, Chen Ma","Sequential recommendation aims to model user preferences based on historical
behavior sequences, which is crucial for various online platforms. Data
sparsity remains a significant challenge in this area as most users have
limited interactions and many items receive little attention. To mitigate this
issue, contrastive learning has been widely adopted. By constructing positive
sample pairs from the data itself and maximizing their agreement in the
embedding space,it can leverage available data more effectively. Constructing
reasonable positive sample pairs is crucial for the success of contrastive
learning. However, current approaches struggle to generate reliable positive
pairs as they either rely on representations learned from inherently sparse
collaborative signals or use random perturbations which introduce significant
uncertainty. To address these limitations, we propose a novel approach named
Semantic Retrieval Augmented Contrastive Learning (SRA-CL), which leverages
semantic information to improve the reliability of contrastive samples. SRA-CL
comprises two main components: (1) Cross-Sequence Contrastive Learning via User
Semantic Retrieval, which utilizes large language models (LLMs) to understand
diverse user preferences and retrieve semantically similar users to form
reliable positive samples through a learnable sample synthesis method; and (2)
Intra-Sequence Contrastive Learning via Item Semantic Retrieval, which employs
LLMs to comprehend items and retrieve similar items to perform semantic-based
item substitution, thereby creating semantically consistent augmented views for
contrastive learning. SRA-CL is plug-and-play and can be integrated into
standard sequential recommendation models. Extensive experiments on four public
datasets demonstrate the effectiveness and generalizability of the proposed
approach.",http://arxiv.org/pdf/2503.04162v1,,False
Robust Multi-View Learning via Representation Fusion of Sample-Level Attention and Alignment of Simulated Perturbation,06/03/2025,"Jie Xu, Na Zhao, Gang Niu, Masashi Sugiyama, Xiaofeng Zhu","Recently, multi-view learning (MVL) has garnered significant attention due to
its ability to fuse discriminative information from multiple views. However,
real-world multi-view datasets are often heterogeneous and imperfect, which
usually makes MVL methods designed for specific combinations of views lack
application potential and limits their effectiveness. To address this issue, we
propose a novel robust MVL method (namely RML) with simultaneous representation
fusion and alignment. Specifically, we introduce a simple yet effective
multi-view transformer fusion network where we transform heterogeneous
multi-view data into homogeneous word embeddings, and then integrate multiple
views by the sample-level attention mechanism to obtain a fused representation.
Furthermore, we propose a simulated perturbation based multi-view contrastive
learning framework that dynamically generates the noise and unusable
perturbations for simulating imperfect data conditions. The simulated noisy and
unusable data obtain two distinct fused representations, and we utilize
contrastive learning to align them for learning discriminative and robust
representations. Our RML is self-supervised and can also be applied for
downstream tasks as a regularization. In experiments, we employ it in
unsupervised multi-view clustering, noise-label classification, and as a
plug-and-play module for cross-modal hashing retrieval. Extensive comparison
experiments and ablation studies validate the effectiveness of RML.",http://arxiv.org/pdf/2503.04151v1,,False
Robust Data Watermarking in Language Models by Injecting Fictitious Knowledge,06/03/2025,"Xinyue Cui, Johnny Tian-Zheng Wei, Swabha Swayamdipta, Robin Jia","Data watermarking in language models injects traceable signals, such as
specific token sequences or stylistic patterns, into copyrighted text, allowing
copyright holders to track and verify training data ownership. Previous data
watermarking techniques primarily focus on effective memorization after
pretraining, while overlooking challenges that arise in other stages of the LLM
pipeline, such as the risk of watermark filtering during data preprocessing, or
potential forgetting through post-training, or verification difficulties due to
API-only access. We propose a novel data watermarking approach that injects
coherent and plausible yet fictitious knowledge into training data using
generated passages describing a fictitious entity and its associated
attributes. Our watermarks are designed to be memorized by the LLM through
seamlessly integrating in its training data, making them harder to detect
lexically during preprocessing.We demonstrate that our watermarks can be
effectively memorized by LLMs, and that increasing our watermarks' density,
length, and diversity of attributes strengthens their memorization. We further
show that our watermarks remain robust throughout LLM development, maintaining
their effectiveness after continual pretraining and supervised finetuning.
Finally, we show that our data watermarks can be evaluated even under API-only
access via question answering.",http://arxiv.org/pdf/2503.04036v1,,False
Integrating Protein Dynamics into Structure-Based Drug Design via Full-Atom Stochastic Flows,06/03/2025,"Xiangxin Zhou, Yi Xiao, Haowei Lin, Xinheng He, Jiaqi Guan, Yang Wang, Qiang Liu, Feng Zhou, Liang Wang, Jianzhu Ma","The dynamic nature of proteins, influenced by ligand interactions, is
essential for comprehending protein function and progressing drug discovery.
Traditional structure-based drug design (SBDD) approaches typically target
binding sites with rigid structures, limiting their practical application in
drug development. While molecular dynamics simulation can theoretically capture
all the biologically relevant conformations, the transition rate is dictated by
the intrinsic energy barrier between them, making the sampling process
computationally expensive. To overcome the aforementioned challenges, we
propose to use generative modeling for SBDD considering conformational changes
of protein pockets. We curate a dataset of apo and multiple holo states of
protein-ligand complexes, simulated by molecular dynamics, and propose a
full-atom flow model (and a stochastic version), named DynamicFlow, that learns
to transform apo pockets and noisy ligands into holo pockets and corresponding
3D ligand molecules. Our method uncovers promising ligand molecules and
corresponding holo conformations of pockets. Additionally, the resultant
holo-like states provide superior inputs for traditional SBDD approaches,
playing a significant role in practical drug discovery.",http://arxiv.org/pdf/2503.03989v1,,False
Image Data Augmentation for the TAIGA-IACT Experiment with Conditional Generative Adversarial Networks,06/03/2025,"Yu. Yu. Dubenskaya, A. P. Kryukov, E. O. Gres, S. P. Polyakov, E. B. Postnikov, P. A. Volchugov, A. A. Vlaskina, D. P. Zhurov","Modern Imaging Atmospheric Cherenkov Telescopes (IACTs) generate a huge
amount of data that must be classified automatically, ideally in real time.
Currently, machine learning-based solutions are increasingly being used to
solve classification problems. However, these classifiers require proper
training data sets to work correctly. The problem with training neural networks
on real IACT data is that these data need to be pre-labeled, whereas such
labeling is difficult and its results are estimates. In addition, the
distribution of incoming events is highly imbalanced. Firstly, there is an
imbalance in the types of events, since the number of detected gamma quanta is
significantly less than the number of protons. Secondly, the energy
distribution of particles of the same type is also imbalanced, since
high-energy particles are extremely rare. This imbalance results in poorly
trained classifiers that, once trained, do not handle rare events correctly.
Using only conventional Monte Carlo event simulation methods to solve this
problem is possible, but extremely resource-intensive and time-consuming. To
address this issue, we propose to perform data augmentation with artificially
generated events of the desired type and energy using conditional generative
adversarial networks (cGANs), distinguishing classes by energy values. In the
paper, we describe a simple algorithm for generating balanced data sets using
cGANs. Thus, the proposed neural network model produces both imbalanced data
sets for physical analysis as well as balanced data sets suitable for training
other neural networks.",http://arxiv.org/pdf/2503.03982v1,,False
