Title,Publication Date,Author(s),Abstract,Link,DOI,Relevant
Toward Understanding Adversarial Distillation: Why Robust Teachers Fail,21/05/2026,"Hongsin Lee, Hye Won Chung","Adversarial Distillation aims to enhance student robustness by guiding the student with a robust teacher's soft labels within the min-max adversarial training framework, yet its success is notoriously inconsistent: a more robust teacher often fails to improve, or even harms, the student's robust generalization. In this paper, we identify a key mechanism of this teacher dependency: the misalignment between the teacher's supervisory confidence and the student's representational limitations on a consistent subset of training data -- the Robustly Unlearnable Set. We present a theoretical framework analyzing the feature learning dynamics of a two-layer neural network, demonstrating that this mismatch creates a dichotomy in distillation outcomes. We prove that when a teacher provides confident supervision on unlearnable samples, it compels the student to memorize spurious noise patterns that eventually overpower the learned robust signal, thereby driving robust overfitting. Conversely, a teacher that exhibits high uncertainty on these samples effectively suppresses noise memorization, allowing the student to rely solely on the learnable signal for robust generalization. We empirically validate our theory across both synthetic simulations and real-image classification datasets, confirming that robust overfitting is driven by the teacher's interaction with unlearnable samples. Finally, we demonstrate that a teacher's predictive entropy on unlearnable samples serves as a strong indicator of student robustness, validating our theoretical framework and offering a principled guideline for robust teacher selection.",https://arxiv.org/pdf/2605.21999v1,,False
Learning Spatiotemporal Sensitivity in Video LLMs via Counterfactual Reinforcement Learning,21/05/2026,"Dazhao Du, Jian Liu, Jialong Qin, Tao Han, Bohai Gu, Fangqi Zhu, Yujia Zhang, Eric Liu, Xi Chen, Song Guo","Video large language models (Video LLMs) achieve strong benchmark accuracy, yet often answer video questions through shortcuts such as single-frame cues and language priors rather than by tracking spatiotemporal dynamics. This issue is exacerbated in RL post-training, where correctness-only rewards can further reinforce shortcut policies that obtain high reward without tracking video dynamics. We address this by asking a controlled counterfactual question: if the visual world changed while the question remained fixed, should the answer change or stay the same? Based on this view, we propose \textbf{Counterfactual Relational Policy Optimization (CRPO)}, a dual-branch RL framework for improving \emph{spatiotemporal sensitivity}. CRPO constructs counterfactual videos through horizontal flips and temporal reversals, trains on both original and counterfactual branches, and introduces a \textbf{Counterfactual Relation Reward (CRR)} between their answers. CRR encourages answers to change for dynamic questions and remain unchanged for static questions. This cross-branch constraint makes it difficult for shortcut policies to be consistently rewarded across both branches. To evaluate this property, we introduce \textbf{DyBench}, a paired counterfactual video benchmark with 3,014 videos covering reversible dynamics, moving direction, and event sequence, together with a strict pair-accuracy metric that prevents fixed-answer shortcuts from inflating scores. Experiments show that CRPO outperforms prior RL methods on spatiotemporal-sensitive evaluations while maintaining competitive general video performance. On Qwen3-VL-8B, CRPO improves DyBench P-Acc by +7.7 and TimeBlind I-Acc by +8.2 over the base model, indicating improved spatiotemporal sensitivity rather than stronger reliance on static shortcuts. The project website can be found at https://ddz16.github.io/crpo.github.io/ .",https://arxiv.org/pdf/2605.21988v1,,False
Echo: Learning from Experience Data via User-Driven Refinement,21/05/2026,"Hande Dong, Xiaoyun Liang, Jiarui Yu, Jiayi Lin, Changqing Ai, Feng Liu, Wenjun Zhang, Rongbi Wei, Chaofan Zhu, Linjie Che, Feng Wu, Xin Shen, Dexu Kong, Xiaotian Wang, Qiuyuan Chen, Bingxu An, Yueting Lei, Qiang Lin","Static ""human data"" faces inherent limitations: it is expensive to scale and bounded by the knowledge of its creators. Continuous learning from ""experience data"" - interactions between agents and their environments - promises to transcend these barriers. Today, the widespread deployment of AI agents grants us low-cost access to massive streams of such real-world experience. However, raw interaction logs are inherently noisy, filled with trial-and-error and low information density, rendering them inefficient for direct model training.
  We introduce Echo, a generalized framework designed to operationalize the transition from raw experience to learnable knowledge, effectively ""echoing"" environmental feedback back into the training loop for model optimization. In today's agent ecosystem, user refinement serves as a primary source of such feedback: driven by responsibility for the outcome, users rigorously transform flawed agent proposals into verified solutions. These user-driven refinement sequences inherently distill agents' crude attempts into high-quality training signals. Echo systematically harvests these signals to continuously align the agent with real-world needs. Large-scale validation in a production code completion environment confirms that Echo effectively harnesses this pipeline, breaking the static performance ceiling by increasing the acceptance rate from 25.7% to 35.7%.",https://arxiv.org/pdf/2605.21984v1,,False
Reasoning through Verifiable Forecast Actions: Consistency-Grounded RL for Financial LLMs,21/05/2026,"Jialin Chen, Aosong Feng, Harshit Verma, Siyi Gu, Haiwen Wang, Ali Maatouk, Yixuan He, Yifeng Gao, Leandros Tassiulas, Rex Ying","Financial markets are characterized by extreme non-stationarity, low signal-to-noise ratios, and strong dependence on external information such as news, company fundamentals, and macroeconomic signals. Yet, existing approaches either abstract time-series into text or decouple forecasting from language-based reasoning, leading to a fundamental mismatch between qualitative reasoning and quantitative outcomes. To address this, we introduce StockR1, a time-series-enhanced LLM that unifies stock forecasting and financial reasoning through a verifiable forecast action. Based on a tool-call design, the model first emits a forecast action, which is a structured and interpretable representation of its qualitative market outlook. It then invokes a time-series decoder conditioned on this action to generate distributional future trajectories, leading to more informed question answering and financial reasoning. We optimize the full pipeline with reinforcement learning, where rewards jointly reflect answer validity, forecast accuracy, and consistency between generated actions and observed time-series dynamics. In addition, rewards are reweighted by a sample-level uncertainty scalar, encouraging the model to accommodate varying uncertainty in market dynamics. We evaluate StockR1 on financial question answering and stock forecasting over a large-scale 10-year benchmark. Our method consistently outperforms time-series baselines and general-purpose LLMs, improving reasoning accuracy by 17.7% (4B) and 25.9% (8B). These findings demonstrate that structuring the forecast actions establishes a powerful synergy between language reasoning and temporal prediction, enabling LLMs to reason through verifiable, interpretable, and numerically grounded decisions.",https://arxiv.org/pdf/2605.21975v1,,False
ChronoMedicalWorld: A Medical World Model for Learning Patient Trajectories from Longitudinal Care Data,21/05/2026,"Jiangyuan Wang, Xuyong Chen, Junwei He, Xu Xu, Shasha Xie, Fuman Han","Long-horizon clinical simulation -- predicting how a patient's physiology evolves over years under specified interventions -- is central to chronic-disease care, yet existing electronic health record (EHR) models are predominantly discriminative, and general-purpose large language models drift under repeated interventions. We propose the \textbf{ChronoMedicalWorld Model (CMWM)}, an action-conditioned latent world-model framework for learning patient trajectories from longitudinal care data. CMWM couples a joint-embedding state encoder with a wide action encoder that admits both structured intervention indicators and free-text communication embeddings, and trains a recurrent latent transition module under a six-term objective: next-observation supervision, next-latent prediction, SIGReg latent regularisation, and three physiology-aware shape priors (slope, continuity, large-jump penalty). A closed-loop rollout-prefix protocol matches training to deployment, so the model is optimised against the same multi-step error it exhibits at inference. As a concrete case study, we instantiate CMWM for annual estimated glomerular filtration rate (eGFR) trajectory forecasting in chronic kidney disease (CKD). On a 2{,}232-patient nephrology cohort, the CKD instantiation achieves a dynamic-50\% history rollout test mean absolute error (MAE) of 7.384 and root-mean-square error (RMSE) of 10.256, against 7.964 and 11.069 for a tuned GPT-5.5 structured-prompting baseline ($-7.28\%$ MAE, $-7.35\%$ RMSE), with the gain dominated by the dialogue portion of patient--health-coach communication. The framework is not CKD-specific: its architecture, loss design, and training protocol apply to any chronic condition that can be cast as periodic clinical state interleaved with structured and conversational interventions.",https://arxiv.org/pdf/2605.21963v1,,False
Dynamic Mixture of Latent Memories for Self-Evolving Agents,21/05/2026,"Dianzhi Yu, Vireo Zhang, Hongru Wang, Yanyu Chen, Minda Hu, Wanghan Xu, Siki Chen, Philip Torr, Zhenfei Yin, Irwin King","Achieving self-evolution in intelligent agents requires the continual accumulation of new knowledge across changing task sequences without forgetting previously acquired abilities. Existing approaches either internalize knowledge by updating model parameters, which induces catastrophic forgetting, or rely on external memory, which fails to genuinely enhance the model's intrinsic capabilities. We propose MoLEM, a generative mixture of latent memory framework based on a dynamic mixture-of-experts (MoE). We treat multiple experts as independent carriers to generate memory. A router selects and weights experts through key-query matching, and the aggregated latent memory is injected into the reasoning process. The base model for reasoning remains entirely frozen, with all experiential knowledge internalized into the additional modules, avoiding catastrophic forgetting. For continual learning, each training stage is paired with a lightweight autoencoder that selects the appropriate routing group at inference, and inputs that match no stage fall back to the pretrained model. Experiments train the framework on continual-learning sequences spanning math, science, and code domains. After training, we evaluate the framework on the corresponding test sets to measure task learning and competence preservation across continual adaptation stages. After the full continual-learning sequence, our method improves the average accuracy by 10.40% over the Vanilla pretrained baseline, while none of the competing methods consistently exceed this baseline across different training orders.",https://arxiv.org/pdf/2605.21951v1,,False
Engineering Hybrid Physics-Informed Neural Networks for Next-Generation Electricity Systems: A State-of-the-Art Review,21/05/2026,Joseph Nyangon,"The integration of machine learning with domain-specific physics is transforming the design, monitoring, and control of electricity systems, where data scarcity, limited interpretability, and the need to enforce physical laws constrain purely data-driven models. Physics-informed machine learning (PIML) addresses these limitations by embedding governing equations directly into the learning process, yielding accurate, efficient, and scalable solutions for Industry 4.0 applications. This article reviews hybrid PIML architectures for electricity systems, including physics-informed neural networks (PINNs), Deep Operator Networks (DeepONets), Fourier Neural Operators, Extreme Learning Machine-enhanced PINNs, graph-based PINNs (PIGNNs), and domain-decomposition PINNs. Each approach is examined through case studies spanning field analysis, fault detection, digital twins, surrogate modeling, and control optimization. The review shows that embedding Maxwell's equations and other first-principles constraints substantially improves predictive accuracy under sparse and noisy data, reduces simulation time by orders of magnitude relative to finite element methods, and enhances generalization across operating regimes. Hybrid frameworks consistently outperform purely data-driven baselines on parameter sensitivity, dynamic behavior, and robustness, while supporting real-time digital-twin calibration and uncertainty quantification. Persistent challenges include training instability for stiff multi-scale problems, computational cost of high-fidelity models, and the absence of standardized benchmarks. The findings demonstrate that PIML enables a paradigm shift from black-box data-driven methods to transparent, physics-informed strategies, positioning the field for sustained innovation in resilient and intelligent electricity systems.",https://arxiv.org/pdf/2605.21903v1,10.3389/frai.2026.1751785/,False
Causal Discovery in Structural VAR Models Under Equal Noise Variance,21/05/2026,"SeyedSina Seyedi HasanAbadi, Fahimeh Arab, Erfan Nozari, AmirEmad Ghassami","Causal discovery from multivariate time series is challenging when causal effects may occur both across time and within the same sampling interval. This issue is especially important in applications such as neuroscience, where the sampling rate may be coarse relative to the underlying dynamics and contemporaneous effects need not form an acyclic graph. We study causal discovery in linear Gaussian structural VAR models under an equal noise variance assumption, meaning that the structural noise terms have a common variance. Unlike the DAG-based cross-sectional equal noise variance setting, the time-series setting considered here does not generally yield point identification of a unique causal graph. Instead, multiple structural VAR parameterizations can induce the same stationary observed process law. We introduce a notion of observational equivalence tailored to this setting and show that the corresponding equivalence class is characterized by orthogonal transformations of the structural equations together with a global positive scale. This characterization leads to an equivalence-aware model discrepancy, the observational alignment discrepancy, which compares structural models modulo transformations that preserve the observed law. Building on this theory, we propose ENVAR, a sparsity-based procedure that searches over the induced observational equivalence class for a sparse normalized structural representative. We evaluate the proposed methodology on synthetic structural VAR data and on an fMRI dataset.",https://arxiv.org/pdf/2605.21846v1,,False
Truncated Neural Likelihood Estimation for Simulation-Based Inference in State-Space Models,20/05/2026,"Kostas Tsampourakis, Víctor Elvira","State-space models (SSMs) are powerful probabilistic tools for modeling time-varying systems with latent dynamics. Inference in SSMs involves the estimation of latent states and parameters. In this work, we focus on parameter inference, which for SSMs is in general a very challenging problem due to the intractability of the likelihood. Recently, neural estimation methods, such as sequential neural likelihood (SNL), have shown promising results in Bayesian inference problems. In this paper, we show that SNL, when applied to the SSM setting, suffers important limitations, such as requiring a large amount of simulated samples to achieve a moderate performance, scaling poorly with sequence length, while not being amortized. We then introduce a novel inference algorithm called truncated-SNL (T-SNL), which addresses the limitations of SNL. Our algorithm is more accurate, more stable and robust during training, more scalable to longer temporal sequences, and can be amortized when new observations become available. Our experiments show that T-SNL is sample-efficient, robust, and flexible algorithm which outperforms other approaches.",https://arxiv.org/pdf/2605.21805v1,,False
Probabilistic Attribution For Large Language Models,20/05/2026,"Shilpika Shilpika, Carlo Graziani, Bethany Lusch, Venkatram Vishwanath, Michael E. Papka","The generative nature of Large Language Models (LLMs) is reflected in the conditional probabilities they compute to sample each response token given the previous tokens. These probabilities encode the distributional structure that the model learns in training and exploits in inference. In this work, we use these probabilities to situate LLMs within the mathematical theory of stochastic processes. We use this framework to design a model-agnostic probabilistic token attribution measure, using Bayes rule to invert the next-token log-probabilities so as to capture the models internal representation of the distribution over token sequences. The representation is independent of the models computational structure. This representation yields the conditional probability of the response given the prompt, and of the response given the prompt with a token marginalized away. Our attribution score is the log of the ratio of these probabilities. We further compute the entropies of a single prompts token distributions, conditioned on the remaining context. The interplay between entropy and attribution score sheds light on LLM behavior. We evaluate 8 models across 7 prompts and investigate anomalies, token sensitivity, response stability, model stability, and training convergence, thereby improving interpretability and guiding users to focus on uncertain or unstable parts of the generation.",https://arxiv.org/pdf/2605.21726v1,,False
Representation Gap: Explaining the Unreasonable Effectiveness of Neural Networks from a Geometric Perspective,20/05/2026,"David Perera, Victor Moura, Lais Isabelle Alves dos Santos, Michel F. C. Haddad, Flavio Figueiredo","Characterizing precisely the asymptotic generalization error of neural networks using parameters that can be estimated efficiently is a crucial problem in machine learning, which relies heavily on heuristics and practitioners' intuition to make key design choices. In order to mitigate this issue, we introduce the Representation Gap, a metric closely related to the generalization error, but admitting better-behaved asymptotic dynamics. Focusing on equivariant diffusion models and leveraging results from optimal quantization and point-process theory, we derive a precise asymptotic equivalent of the Representation Gap and show that it is governed by a single parameter, the \textit{intrinsic dimension} of the task, which is easy to interpret, efficient to estimate, and can be linked to the equivariances of common neural network architectures. We show that this asymptotic dynamic also extends to a broader range of tasks and training algorithms. Finally, we demonstrate empirically that our asymptotic law and intrinsic dimension estimation are accurate on a wide range of synthetic datasets, where these quantities are known, as well as on more realistic datasets, where we obtain results consistent with the related literature.",https://arxiv.org/pdf/2605.21692v1,,False
MRecover: A Conditional Generative Model for Recovering Motion-Corrupted MR images Using AI Generated Contrast,20/05/2026,"Jinghang Li, Tales Santini, Courtney Clark, Bruno de Almeida, Cong Chu, Salem Alkhateeb, Andrea Sajewski, Jacob Berardinelli, Hecheng Jin, Tobias Campos, Jeremy J. Berardo, Joseph Mettenburg, Ariel Gildengers, Howard J. Aizenstein, Minjie Wu, Tamer S. Ibrahim","Hippocampal subfield segmentation requires high-resolution T2w turbo spin echo (TSE) MRI, yet this sequence is susceptible to motion artifacts, leading to substantial data loss. We developed a conditional generative model (MRecover) that synthesizes routinely acquired T1w images to create TSE images with autoregressive slice conditioning for volumetric consistency. Trained on 7T MRI data (n=577), the model achieved high in-domain fidelity (n=148, SSIM=0.84, FSIM=0.94) and generalized well to out-of-domain 3T data: subfield volumes from synthesized and the as-acquired images closely matched: (n=416, r=0.87-0.97) and yielded 31.8% more analyzable subjects in the motion-affected ADNI3 dataset after quality control (593 vs 450). The synthesized images also achieved larger effect sizes due to increasing the sample size for diagnostic group differences in hippocampal subfield atrophy (whole hippocampus $ε^2$= 0.121-0.100 vs. 0.086-0.062, left-right hemispheres). Project page: https://jinghangli98.github.io/MRecover/",https://arxiv.org/pdf/2605.21669v1,,False
EntmaxKV: Support-Aware Decoding for Entmax Attention,20/05/2026,"Gonçalo Duarte, Miguel Couceiro, Marcos V. Treviso","Long-context decoding is increasingly limited by KV-cache memory traffic since each generated token attends over a cache whose size grows linearly with context length. Existing sparse decoding methods reduce this cost by selecting subsets of tokens or pages, but are designed for softmax attention, whose dense tails make any truncation discard nonzero probability mass. In contrast, $α$-entmax produces exact zeros, turning sparse decoding from dense-tail approximation into support recovery: if the selected candidates contain the entmax support, sparse decoding remains exact. While recent entmax kernels enable efficient training, they do not address the autoregressive decoding bottleneck, where dense inference still streams the full KV cache before sparsity is known. In this work, we introduce EntmaxKV, an entmax-native sparse decoding framework that exploits sparsity before KV pages are loaded. EntmaxKV combines query-aware page scoring, support-aware candidate selection, and sparse entmax attention. We analyze truncation error through the dropped probability mass $δ$, showing that output error is controlled by $δ$ and vanishes when the entmax support is recovered. We further introduce a Gaussian-aware entmax selector that estimates the entmax threshold from lightweight page statistics, adapting the selected budget to the score distribution. Empirically, EntmaxKV drops less probability mass, retains more support tokens, and achieves lower output error than softmax-based sparse decoding at matched KV budgets. On long-context and language modeling benchmarks, it closely matches full-cache entmax while using a small fraction of the KV cache, achieving up to $3.36\times$ (softmax) and $5.43\times$ (entmax) speedup over full attention baselines at 1M context length. Code available at: https://github.com/deep-spin/entmaxkv.",https://arxiv.org/pdf/2605.21649v1,,False
$\textit{BlockFormer}$ : Transformer-based inference from interaction maps,20/05/2026,"Eloïse Touron, Pedro L. C. Rodrigues, Julyan Arbel, Nelle Varoquaux, Michael Arbel","Inference from interaction maps, such as centromere identification from genome-wide chromosome conformation capture techniques -- notably Hi-C -- can be formulated as a generic inverse problem: infer a set of parameters given a map summarizing pairwise interactions between entities through blocks of variable numbers and sizes. In this work, we introduce a data-driven approach that leverages shared structure between these maps, such as global alignment between localized patterns, while handling the variability in number and size of entities arising in real-world data. Our approach relies on a transformer architecture capable of handling such variability and a custom simulator to generate abundant, yet computationally cheap synthetic data for training. Applied to the problem of centromere localization, the method accurately recovers their genomic positions across a wide range of species of various genome sizes.",https://arxiv.org/pdf/2605.21617v1,,False
