Title,Publication Date,Author(s),Abstract,Link,DOI,Relevant
Motus: A Unified Latent Action World Model,15/12/2025,"Hongzhe Bi, Hengkai Tan, Shenghao Xie, Zeyuan Wang, Shuhe Huang, Haitian Liu, Ruowen Zhao, Yao Feng, Chendong Xiang, Yinze Rong, Hongyan Zhao, Hanyu Liu, Zhizhong Su, Lei Ma, Hang Su, Jun Zhu","While a general embodied agent must function as a unified system, current methods are built on isolated models for understanding, world modeling, and control. This fragmentation prevents unifying multimodal generative capabilities and hinders learning from large-scale, heterogeneous data. In this paper, we propose Motus, a unified latent action world model that leverages existing general pretrained models and rich, sharable motion information. Motus introduces a Mixture-of-Transformer (MoT) architecture to integrate three experts (i.e., understanding, video generation, and action) and adopts a UniDiffuser-style scheduler to enable flexible switching between different modeling modes (i.e., world models, vision-language-action models, inverse dynamics models, video generation models, and video-action joint prediction models). Motus further leverages the optical flow to learn latent actions and adopts a recipe with three-phase training pipeline and six-layer data pyramid, thereby extracting pixel-level ""delta action"" and enabling large-scale action pretraining. Experiments show that Motus achieves superior performance against state-of-the-art methods in both simulation (a +15% improvement over X-VLA and a +45% improvement over Pi0.5) and real-world scenarios(improved by +11~48%), demonstrating unified modeling of all functionalities and priors significantly benefits downstream robotic tasks.",https://arxiv.org/pdf/2512.13030v1,,False
Deep Learning-Driven Inversion Framework for Shear Modulus Estimation in Magnetic Resonance Elastography (DIME),15/12/2025,"Hassan Iftikhar, Rizwan Ahmad, Arunark Kolipaka","The Multimodal Direct Inversion (MMDI) algorithm is widely used in Magnetic Resonance Elastography (MRE) to estimate tissue shear stiffness. However, MMDI relies on the Helmholtz equation, which assumes wave propagation in a uniform, homogeneous, and infinite medium. Furthermore, the use of the Laplacian operator makes MMDI highly sensitive to noise, which compromises the accuracy and reliability of stiffness estimates. In this study, we propose the Deep-Learning driven Inversion Framework for Shear Modulus Estimation in MRE (DIME), aimed at enhancing the robustness of inversion. DIME is trained on the displacement fields-stiffness maps pair generated through Finite Element Modelling (FEM) simulations. To capture local wave behavior and improve robustness to global image variations, DIME is trained on small image patches. We first validated DIME using homogeneous and heterogeneous datasets simulated with FEM, where DIME produced stiffness maps with low inter-pixel variability, accurate boundary delineation, and higher correlation with ground truth (GT) compared to MMDI. Next, DIME was evaluated in a realistic anatomy-informed simulated liver dataset with known GT and compared directly to MMDI. DIME reproduced ground-truth stiffness patterns with high fidelity (r = 0.99, R^2 = 0.98), while MMDI showed greater underestimation. After validating DIME on synthetic data, we tested the model in in vivo liver MRE data from eight healthy and seven fibrotic subjects. DIME preserved physiologically consistent stiffness patterns and closely matched MMDI, which showed directional bias. Overall, DIME showed higher correlation with ground truth and visually similar stiffness patterns, whereas MMDI displayed a larger bias that can potentially be attributed to directional filtering. These preliminary results highlight the feasibility of DIME for clinical applications in MRE.",https://arxiv.org/pdf/2512.13010v1,,False
A Bayesian approach to learning mixtures of nonparametric components,15/12/2025,"Yilei Zhang, Yun Wei, Aritra Guha, XuanLong Nguyen","Mixture models are widely used in modeling heterogeneous data populations. A standard approach of mixture modeling is to assume that the mixture component takes a parametric kernel form, while the flexibility of the model can be obtained by using a large or possibly unbounded number of such parametric kernels. In many applications, making parametric assumptions on the latent subpopulation distributions may be unrealistic, which motivates the need for nonparametric modeling of the mixture components themselves. In this paper we study finite mixtures with nonparametric mixture components, using a Bayesian nonparametric modeling approach. In particular, it is assumed that the data population is generated according to a finite mixture of latent component distributions, where each component is endowed with a Bayesian nonparametric prior such as the Dirichlet process mixture. We present conditions under which the individual mixture component's distributions can be identified, and establish posterior contraction behavior for the data population's density, as well as densities of the latent mixture components. We develop an efficient MCMC algorithm for posterior inference and demonstrate via simulation studies and real-world data illustrations that it is possible to efficiently learn complex distributions for the latent subpopulations. In theory, the posterior contraction rate of the component densities is nearly polynomial, which is a significant improvement over the logarithm convergence rate of estimating mixing measures via deconvolution.",https://arxiv.org/pdf/2512.12988v1,,False
Next-generation reservoir computing validated by classification task,15/12/2025,Ken-ichi Kitayama,"An emerging computing paradigm, so-called next-generation reservoir computing (NG-RC) is investigated. True to its namesake, NG-RC requires no actual reservoirs for input data mixing but rather computing the polynomial terms directly from the time series inputs. However, benchmark tests so far reported have been one-sided, limited to prediction tasks of temporal waveforms such as Lorenz 63 attractor and Mackey-Glass chaotic signal. We will demonstrate for the first time that NG-RC can perform classification task as good as conventional RC. This validates the versatile computational capability of NG-RC in tasks of both prediction and classification.",https://arxiv.org/pdf/2512.12903v1,,False
Distillation of Discrete Diffusion by Exact Conditional Distribution Matching,15/12/2025,"Yansong Gao, Yu Sun","Discrete diffusion models (DDMs) are a powerful class of generative models for categorical data, but they typically require many function evaluations for a single sample, making inference expensive. Existing acceleration methods either rely on approximate simulators, such as $τ$-leaping, or on distillation schemes that train new student models and auxiliary networks with proxy objectives. We propose a simple and principled distillation alternative based on \emph{conditional distribution matching}. Our key observation is that the reverse conditional distribution of clean data given a noisy state, $p_{0\mid t}(x_0 \mid x_t)$, admits a Markov decomposition through intermediate times and can be recovered from marginal density ratios and the known forward CTMC kernel. We exploit this structure to define distillation objectives that directly match conditional distributions between a pre-trained teacher and a low-NFE student, both for one-step and few-step samplers.",https://arxiv.org/pdf/2512.12889v1,,False
Meta-GPT: Decoding the Metasurface Genome with Generative Artificial Intelligence,15/12/2025,"David Dang, Stuart Love, Meena Salib, Quynh Dang, Samuel Rothfarb, Mysk Alnatour, Andrew Salij, Hou-Tong Chen, Ho Wai, Lee, Wilton J. M. Kort-Kamp","Advancing artificial intelligence for physical sciences requires representations that are both interpretable and compatible with the underlying laws of nature. We introduce METASTRINGS, a symbolic language for photonics that expresses nanostructures as textual sequences encoding materials, geometries, and lattice configurations. Analogous to molecular textual representations in chemistry, METASTRINGS provides a framework connecting human interpretability with computational design by capturing the structural hierarchy of photonic metasurfaces. Building on this representation, we develop Meta-GPT, a foundation transformer model trained on METASTRINGS and finetuned with physics-informed supervised, reinforcement, and chain-of-thought learning. Across various design tasks, the model achieves <3% mean-squared spectral error and maintains >98% syntactic validity, generating diverse metasurface prototypes whose experimentally measured optical responses match their target spectra. These results demonstrate that Meta-GPT can learn the compositional rules of light-matter interactions through METASTRINGS, laying a rigorous foundation for AI-driven photonics and representing an important step toward a metasurface genome project.",https://arxiv.org/pdf/2512.12888v1,,False
