Title,Publication Date,Author(s),Abstract,Link,DOI,Relevant
Differentially Private Motif-Preserving Multi-modal Hashing,14/05/2026,"Zehua Cheng, Wei Dai, Jiahao Sun","Cross-modal hashing enables efficient retrieval by encoding images and text into compact binary codes. State-of-the-art methods rely on semantic similarity graphs derived from user interactions for supervision, yet these graphs encode sensitive behavioral patterns vulnerable to link reconstruction attacks. Existing privacy-preserving approaches fail on graph-structured data: Differentially Private SGD destroys relational motifs by treating samples independently, while graph synthesis methods suffer from unbounded local sensitivity in scale-free networks, hub nodes cause single-edge modifications to alter triangle counts by $\mathcal{O}(N)$, necessitating prohibitive noise injection. We term this phenomenon Hubness Explosion. We propose DMP-MH, a Sanitize-then-Distill framework that decouples privacy from representation learning. Our approach first bounds sensitivity by deterministically clipping node degrees, capping the $L_2$-sensitivity of triangle motifs independently of dataset size. A sanitized synthetic graph is then generated via Noisy Mirror Descent under $(ε,δ)$-Edge Differential Privacy. Finally, dual-stream hashing networks distill this topology using a holistic structural loss that enforces cross-modal alignment. Evaluated on MIRFlickr-25K and NUS-WIDE under a strict inductive protocol, DMP-MH outperforms private baselines by up to 11.4 mAP points while retaining up to 92.5% of non-private performance.",https://arxiv.org/pdf/2605.15460v1,,False
MR2-ByteTrack: CNN and Transformer-based Video Object Detection for AI-augmented Embedded Vision Sensor Nodes,14/05/2026,"Luca Bompani, Manuele Rusci, Luca Benini, Daniele Palossi, Francesco Conti","Modern smart vision sensors need on-device intelligence to process video streams, as cloud computing is often impractical due to bandwidth, latency, and privacy constraints. However, these sensory systems typically rely on ultra-low-power microcontrollers (MCUs) with limited memory and compute, making conventional video object detection methods, which require feature storage or multi-frame buffering, unfeasible. To address this challenge, we introduce Multi-Resolution Rescored ByteTrack (MR2-ByteTrack), a Video Object Detection (VOD) method tailored for MCU-based embedded vision nodes. MR2-ByteTrack reduces computational cost by alternating between full- and low-resolution inference, while linking detections across frames via ByteTrack and correcting misclassifications through the Rescore algorithm, which applies probability union rules to aggregate detection confidence scores across frames. We apply our approach to both a CNN-based detector and a Transformer-based model, demonstrating its generality across architectures with fundamentally different spatial processing. Experiments on ImageNetVID demonstrate that MR2-ByteTrack maintains accuracy, achieving mAP scores of up to 49.0 for the CNN-based models and 48.7 for the Transformer, while reducing multiply-accumulate operations by as much as 53\% for the CNNs and 32\% for the Transformer. When deployed on GAP9, an ultra-low-power RISC-V multicore MCU, our method yields up to 55\% energy savings compared to processing only full-resolution images, enabling the first real-time Transformer-based VOD on an MCU-class embedded vision node. Code available at https://github.com/Bomps4/Multi_Resolution_Rescored_ByteTrack/tree/IEEE_Access",https://arxiv.org/pdf/2605.15423v1,,False
Lagrangian Flow Matching: A Least-Action Framework for Principled Path Design,14/05/2026,"Shukai Du, Junzhe Zhang, Yiming Li","Flow matching trains a neural velocity field by regression against a target velocity associated with a prescribed probability path connecting a simple initial distribution to the data distribution. A central design choice is the path itself. Existing constructions, including rectified and optimal-transport-based paths, transport samples along straight lines between coupled endpoints and thus cover only a narrow class of dynamics. We observe that this corresponds to the simplest case of the least-action principle in classical mechanics, in which the kinetic Lagrangian yields free-particle straight-line trajectories. Building on this observation, we propose Lagrangian flow matching, a physics-based framework in which the probability path and velocity field are determined by minimizing the action of a general Lagrangian subject to the continuity equation and the prescribed endpoints. We show that this dynamic problem admits an equivalent static optimal transport (OT) formulation, yielding a family of simulation-free training objectives that recover OT-based flow matching as the kinetic special case and the trigonometric variance-preserving diffusion path as the harmonic-oscillator case. More general Lagrangians give rise to new probability paths and velocity fields, and numerical experiments show that they induce meaningful changes in the learned dynamics while remaining competitive with existing conditional flow matching models.",https://arxiv.org/pdf/2605.15419v1,,False
Margin-Adaptive Confidence Ranking for Reliable LLM Judgement,14/05/2026,"Gaojie Jin, Yong Tao, Lijia Yu, Tianjin Huang","Jung et al. (2025) introduce a hypothesis testing framework for guaranteeing agreement between large language models (LLMs) and human judgments, relying on the assumption that the model's estimated confidence is monotonic with respect to human-disagreement risk. In practice, however, this assumption may be violated, and the generalization behavior of the confidence estimator is not explicitly analyzed. We mitigate these issues by learning a dedicated confidence estimator instead of relying on heuristic confidence signals. Our approach leverages simulated annotator diversity and a margin-based ranking formulation to explicitly model how confidently an LLM distinguishes between human-agreement and human-disagreement cases. We further derive generalization guarantees for this estimator, revealing a margin-dependent trade-off that informs the design of an adaptive estimator training procedure. When integrated into fixed-sequence testing, the learned confidence estimator yields improved ranking accuracy and empirically strengthens the monotonic relationship between confidence and disagreement risk, leading to higher success rates in satisfying target agreement levels across multiple datasets and judge models.",https://arxiv.org/pdf/2605.15416v1,,False
Transformer Scalability Crisis: The First Comprehensive Empirical Analysis of Performance Walls in Modern Language Models,14/05/2026,"Mahdi Naser Moghadasi, Faezeh Ghaderi","Despite the remarkable success of transformer architectures in natural language processing, their scalability limitations remain poorly understood through systematic empirical analysis. This paper presents the first comprehensive large-scale evaluation of 118 transformer models across seven distinct architectural categories, revealing fundamental performance walls that manifest as hard deployment constraints. Our systematic benchmarking methodology uncovers a critical scalability crisis: while 88.1% of models successfully process sequences up to 512 tokens, this drops dramatically to 44.9% at 1024 tokens, with complete failure (0%) at 2048 tokens. Through rigorous analysis of loading times, memory consumption, and computational efficiency across sequence lengths from 128 to 2048 tokens, we demonstrate that compressed models achieve superior parameter efficiency (649.2 tokens/sec/M parameters) compared to large generative models (12.5 tokens/sec/M). Our findings challenge prevailing scaling assumptions and provide the first quantitative evidence that the theoretical O(n2) attention complexity translates into measurable performance walls. This work establishes new benchmarking methodologies for transformer evaluation and provides critical insights for practical deployment decisions in production environments.",https://arxiv.org/pdf/2605.15413v1,10.1109/BigData66926.2025.11401965,False
Beyond Partner Diversity: An Influence-Based Team Steering Framework for Zero-Shot Human-Machine Teaming,14/05/2026,"Wei Sheng, Rohan Paleja","While AI agents are rapidly advancing from isolated tools to interactive collaborators, data-driven human-machine teaming (HMT) methods remain costly in their reliance on human interaction data across domains, teammates, and team sizes. Zero-shot coordination (ZSC) addresses this bottleneck by simulating diverse partner populations to approximate how unseen partners might behave. However, partner coverage alone is insufficient as team settings scale and communication becomes degraded. To remedy this deficiency, we propose Influence-Based Team Steering (IBTS), a framework that uses influence shaping to incentivize agents to discover diverse, high-performing team interaction patterns and further steers ongoing trajectories toward stronger learned coordination modes. We assess IBTS on Overcooked-AI in both two-agent and three-agent settings, allowing us to test whether learned coordination structure transfers beyond dyadic interaction. Our evaluation includes simulated partners, synthetic partner-style variation, and, to our knowledge, the first 30-subject Overcooked-AI HMT study involving two real human teammates and one machine teammate. Across these evaluations, IBTS improves team performance against competing baselines, highlighting the need for scaled ZSC to combine sparse-reward coordination mechanisms with partner-variation coverage rather than relying on diversity alone.",https://arxiv.org/pdf/2605.15400v1,,False
Breakeven complexity: A new perspective on neural partial differential equation solvers,14/05/2026,"Yijing Zhang, Nicholas Roberts, Tanya Marwah, Mikhail Khodak","Neural surrogate solvers of partial differential equations (PDEs) promise dramatic speedups over numerical methods, especially in scenarios requiring many solves. However, current accuracy-based evaluations do not fully consider two central issues: (1) neural solvers incur substantial up-front costs for data generation, training, and tuning; and (2) classical solvers can also generate low-fidelity solutions at a sufficiently low simulation cost. To explicitly account for these realities and fully incorporate end-to-end costs, we propose an evaluation framework centered on breakeven complexity, a metric that counts the forward solves before a learned solver is cost-effective relative to an error-equivalent traditional solver. To evaluate this measure, we apply scaling laws to determine how much training budget to allocate to data generation and discuss how to achieve smooth error-matching in diverse settings. We evaluate the breakeven complexity of multiple neural PDE solvers on three PDEs on 2D periodic domains from APEBench and a novel benchmark of flows past multiple obstacles generated by the GPU-native PyFR code. Among other findings, our results suggest that neural PDE solvers become more effective as problems get harder in terms of cost, dimension, rollout, physics regime (e.g. higher Reynolds number), etc.",https://arxiv.org/pdf/2605.15399v1,,False
Belief Engine: Configurable and Inspectable Stance Dynamics in Multi-Agent LLM Deliberation,14/05/2026,"Joshua C. Yang, Maurice Flechtner, Damian Dailisan, Michiel A. Bakker","LLM-based agents are increasingly used to simulate deliberative interactions such as negotiation, conflict resolution, and multi-turn opinion exchange. Yet generated transcripts often do not reveal why an agent's stance changes: movement may reflect evidence uptake, anchoring, role drift, echoing, or changed prompt and retrieval context. We introduce the Belief Engine (BE), an auditable belief-update layer that treats ""belief"" as an evidential state over a proposition and exposes it as scalar stance. BE extracts arguments into structured memory and updates stance with a log-odds rule controlled by evidence uptake u and prior anchoring a. Across multiple base LLMs, parameter sweeps show that these controls reliably shape stance dynamics while preserving an evidence-level update trail. On DEBATE, a human deliberation dataset with pre/post opinions, BE best reconstructs participants whose final stance follows extracted evidence; stable and evidence-opposed cases instead point to anchoring or factors outside the extracted evidence stream. BE provides configurable infrastructure for studying evidence-grounded deliberation, where openness, commitment, convergence, and disagreement can be tied to explicit update assumptions rather than hidden prompt effects.",https://arxiv.org/pdf/2605.15343v1,,False
HoloMotion-1 Technical Report,14/05/2026,"Maiyue Chen, Kaihui Wang, Bo Zhang, Xihan Ma, Zhiyuan Yang, Yi Ren, Qijun Huang, Zihao Zhu, Yucheng Wang, Zhizhong Su","In this report, we present HoloMotion-1, a humanoid motion foundation model for zero-shot whole-body motion tracking. A key innovation of HoloMotion-1 is to scale control-policy training with a large-scale hybrid motion corpus, where video-reconstructed motions from in-the-wild videos provide the dominant source of motion diversity, while curated motion-capture and in-house motion data provide higher-fidelity supervision and deployment-oriented coverage. This data regime enables HoloMotion-1 to move beyond conventional MoCap-only training and exposes the policy to substantially broader behaviors, capture conditions, and motion styles.
  Learning from such heterogeneous data introduces new challenges, including reconstruction noise, source-domain mismatch, uneven motion quality, and the need for temporal modeling under large behavioral variation. To address these challenges, HoloMotion-1 integrates large-capacity temporal modeling, a sparsely activated Mixture-of-Experts Transformer with KV-cache inference for real-time control, and a sequence-level training strategy that improves learning efficiency on extended motion sequences. Extensive experiments on multiple unseen motion benchmarks show that HoloMotion-1 generalizes robustly across diverse motion types and capture conditions, significantly improves tracking accuracy over prior methods, and transfers directly to a real humanoid robot without task-specific fine-tuning.",https://arxiv.org/pdf/2605.15336v1,,False
Zero-Shot Goal Recognition with Large Language Models,14/05/2026,"Kin Max Piamolini Gusmão, Nathan Gavenski, Nir Oren, Felipe Meneguzzi","Large language models have recently reached near-parity with classical planners on well-known planning domains, yet this competence relies on world-knowledge exploitation rather than genuine symbolic reasoning. Goal recognition is a complementary abductive task structurally better suited to LLM strengths: it consists of evaluating consistency with world knowledge rather than generating novel action sequences. This paper provides the first systematic zero-shot evaluation of frontier LLMs as goal recognisers on key classical PDDL benchmarks. Our results show that LLM competence on goal recognition is uneven: some models scale with evidence and approach landmark-based accuracy at full observations, while others remain anchored to world-knowledge priors regardless of how much evidence accumulates. Qualitative analysis of model reasoning traces reveals that this divergence reflects a fundamental difference in evidence integration rather than domain familiarity. These findings position goal recognition as a principled benchmark for the foundational planning knowledge of LLMs.",https://arxiv.org/pdf/2605.15333v1,,False
Unified Simulation of Lagrangian Particle Dynamics via Transformer,14/05/2026,"Caoliwen Wang, Minghao Guo, Siyuan Chen, Heng Zhang, Mengdi Wang, Xingyu Ni, Hanson Sun, Kunyi Wang, Zherong Pan, Kui Wu, Lingjie Liu, Yin Yang, Chenfanfu Jiang, Taku Komura, Wojciech Matusik, Peter Yichen Chen","A unified simulator that can model diverse physical phenomena without solver-specific redesign is a long-standing goal across simulation science. We present a learning-based particle simulator built on a single transformer architecture to model cloth, elastic solds, Newtonian and non-Newtonian fluids, granular materials, and molecular dynamics. Our model follows a prediction-correction design on a shared Lagrangian particle representation. An explicit predictor first advances particles under the known external forces, producing an intermediate state that captures externally driven motion but not inter-particle interactions. A learned corrector then predicts the residual position and velocity updates through three stages: a particle tokenizer that encodes local particle-particle, particle-boundary, and topology-guided interactions; a super-token encoder that hierarchically merges particle tokens into a compact set of super tokens via alternating self-attention and token merging; and a super-token decoder that lifts these super tokens back to particle resolution through cross-attention to predict per-particle position and velocity corrections. Progressive token merging reduces the attention cost at successive encoder layers by halving the token count at each level, and the decoder communicates through the compact super-token set rather than full particle-to-particle attention. Across the six dynamics categories, the same architecture generalizes to unseen materials, boundary configurations, initial conditions, and external forces. We further demonstrate downstream interactive control, inverse design, and learning from real-world manipulation data, reducing the need for per-phenomenon solver engineering.",https://arxiv.org/pdf/2605.15305v1,,False
EntityBench: Towards Entity-Consistent Long-Range Multi-Shot Video Generation,14/05/2026,"Ruozhen He, Meng Wei, Ziyan Yang, Vicente Ordonez","Multi-shot video generation extends single-shot generation to coherent visual narratives, yet maintaining consistent characters, objects, and locations across shots remains a challenge over long sequences. Existing evaluations typically use independently generated prompt sets with limited entity coverage and simple consistency metrics, making standardized comparison difficult. We introduce EntityBench, a benchmark of 140 episodes (2,491 shots) derived from real narrative media, with explicit per-shot entity schedules tracking characters, objects, and locations simultaneously across easy / medium / hard tiers of up to 50 shots, 13 cross-shot characters, 8 cross-shot locations, 22 cross-shot objects, and recurrence gaps spanning up to 48 shots. It is paired with a three-pillar evaluation suite that disentangles intra-shot quality, prompt-following alignment, and cross-shot consistency, with a fidelity gate that admits only accurate entity appearances into cross-shot scoring. As a baseline, we propose EntityMem, a memory-augmented generation system that stores verified per-entity visual references in a persistent memory bank before generation begins. Experiments show that cross-shot entity consistency degrades sharply with recurrence distance in existing methods, and that explicit per-entity memory yields the highest character fidelity (Cohen's d = +2.33) and presence among methods evaluated. Code and data are available at https://github.com/Catherine-R-He/EntityBench/.",https://arxiv.org/pdf/2605.15199v1,,False
RoSHAP: A Distributional Framework and Robust Metric for Stable Feature Attribution,14/05/2026,"Lanxin Xiang, Liang Shi, Youhui Ye, Boyu Jiang, Dawei Zhou, Feng Guo","Feature attribution analysis is critical for interpreting machine learning models and supporting reliable data-driven decisions. However, feature attribution measures often exhibit stochastic variation: different train--test splits, random seeds, or model-fitting procedures can produce substantially different attribution values and feature rankings. This paper proposes a framework for incorporating stochastic nature of feature attribution and a robust attribution metric, RoSHAP, for stable feature ranking based on the SHAP metric. The proposed framework models the distribution of feature attribution scores and estimates it through bootstrap resampling and kernel density estimation. We show that, under mild regularity conditions, the aggregated feature attribution score is asymptotically Gaussian, which greatly reduces the computational cost of distribution estimation. The RoSHAP summarizes the distribution of SHAP into a robust feature-ranking criterion that simultaneously rewards features that are active, strong, and stable. Through simulations and real-data experiments, the proposed framework and RoSHAP outperform standard single-run attribution measures in identifying signal features. In addition, models built using RoSHAP-selected features achieve predictive performance comparable to full-feature models while using substantially fewer predictors. The proposed RoSHAP approach improves the stability and interpretability of machine learning models, enabling reliable and consistent insights for analysis.",https://arxiv.org/pdf/2605.15154v1,,False
Separating Intrinsic Ambiguity from Estimation Uncertainty in Deep Generative Models for Linear Inverse Problems,14/05/2026,"Yuxin Guo, Dongrui Deng, Pulkit Grover","Recently, deep generative models have been used for posterior inference in inverse problems, including high-stakes applications in medical imaging and scientific discovery, where the uncertainty of a prediction can matter as much as the prediction itself. However, posterior uncertainty is difficult to interpret because it can mix ambiguity inherent to the forward operator with uncertainty propagated through inference. We introduce a structural decomposition of posterior uncertainty that isolates intrinsic ambiguity. A cascade formulation makes this ambiguity accessible for calibration analysis, enabling qualitative diagnostics and simulation-based calibration tests that reveal failure modes that remain hidden when models are selected by reconstruction quality alone. We first validate the approach on a Gaussian example with analytical posterior structure, then illustrate the decomposition on accelerated magnetic resonance imaging (MRI), and finally apply the calibration diagnostics to electroencephalography (EEG) source imaging.",https://arxiv.org/pdf/2605.15050v1,,False
COTCAgent: Preventive Consultation via Probabilistic Chain-of-Thought Completion,14/05/2026,"Zihan Deng, Xiaozhen Zhong, Chuanzhi Xu","As large language models empower healthcare, intelligent clinical decision support has developed rapidly. Longitudinal electronic health records (EHR) provide essential temporal evidence for accurate clinical diagnosis and analysis. However, current large language models have critical flaws in longitudinal EHR reasoning. First, lacking fine-grained statistical reasoning, they often hallucinate clinical trends and metrics when quantitative evidence is textually implied, biasing diagnostic inference. Second, non-uniform time series and scarce labels in longitudinal EHR hinder models from capturing long-range temporal dependencies, limiting reliable clinical reasoning. To address the above limitations, this work presents the Probabilistic Chain-of-Thought Completion Agent (COTCAgent), a hierarchical reasoning framework for longitudinal electronic health records. It consists of three core modules. The Temporal-Statistics Adapter (TSA) converts analytical plans into executable code for standardized trend output. The Chain-of-Thought Completion (COTC) layer leverages a symptom-trend-disease knowledge base with weighted scoring to evaluate disease risk, while the bounded completion module acquires structured evidence through standardized inquiries and iterative scoring constraints to ensure rigorous reasoning. By decoupling statistical computation, feature matching, and language generation, the framework eliminates reliance on complex multi-modal inputs and enables efficient longitudinal record analysis with lower computational overhead. Experimental results show that COTCAgent powered by Baichuan-M2 achieves 90.47% Top-1 accuracy on the self-built dataset and 70.41% on HealthBench, outperforming existing medical agents and mainstream large language models. The code is available at https://github.com/FrankDengAI/COTCAgent/.",https://arxiv.org/pdf/2605.15016v1,,False
